number,title,author,createdAt,closedOrMergedAt,reviewsCount,hoursOpen
4550,reverseproxy: Avoid returning a `nil` error during GetClientCertificate,francislavoie,2022-01-27T08:35:21Z,2022-02-02T06:33:36+00:00,1,141.97
4551,reverseproxy: Make shallow-ish clone of the request,francislavoie,2022-01-27T09:39:17Z,2022-03-03T16:54:45+00:00,1,847.26
4564,templates: Elaborate on what's supported by the markdown function,francislavoie,2022-02-05T16:11:21Z,2022-02-07T05:14:42+00:00,1,37.06
4565,"cmd: Migrate to `spf13/cobra`, remove single-dash arg support",mohammed90,2022-02-06T14:28:57Z,2022-08-30T22:38:38+00:00,15,4928.16
4569,admin: Stop writing 500 status on invalid requests,mintbomb27,2022-02-11T05:23:13Z,2022-02-11T20:23:45+00:00,1,15.01
4571,caddyhttp: remote_ip matcher strip zone from end of IPv6,BitWuehler,2022-02-11T12:53:28Z,2022-02-23T14:57:36+00:00,2,290.07
4572,fastcgi: ensure `SERVER_PORT` is always set,ttys3,2022-02-12T11:37:10Z,2022-03-02T18:24:16+00:00,2,438.79
4579,admin: support ETags,jhwz,2022-02-16T23:51:38Z,2022-07-06T19:50:08+00:00,2,3355.97
4582,ci: update goreleaser,mohammed90,2022-02-19T00:15:47Z,2022-02-19T22:16:12+00:00,2,22.01
4583,logging: Add `roll_local_time` Caddyfile option,francislavoie,2022-02-19T00:52:23Z,2022-02-19T22:12:28+00:00,1,21.33
4584,caddyhttp: Always log handled errors at debug level,francislavoie,2022-02-19T05:36:02Z,2022-02-19T22:10:50+00:00,1,16.58
4585,caddyhttp: Move HTTP redirect listener to an optional module,francislavoie,2022-02-19T06:41:48Z,2022-02-19T22:36:37+00:00,3,15.91
4587,go.mod: Revert version bump of CEL,francislavoie,2022-02-19T17:06:47Z,2022-02-19T22:09:09+00:00,2,5.04
4589,httpcaddyfile: Disabling OCSP stapling for both managed and unmanaged,francislavoie,2022-02-19T19:25:25Z,2022-02-19T21:20:38+00:00,1,1.92
4592,httpcaddyfile: Support explicitly turning off `strict_sni_host`,francislavoie,2022-02-21T16:49:37Z,2022-03-02T01:02:39+00:00,1,200.22
4597,"caddyhttp: remote_ip matcher, handling of zone identifiers",BitWuehler,2022-02-23T14:56:14Z,2022-03-01T22:50:12+00:00,20,151.9
4603,Prevent unnecessary loading of config,YourTechBud,2022-02-26T14:44:33Z,2022-03-01T18:32:34+00:00,1,75.8
4606,caddyhttp: Honor wildcard hosts in log SkipHosts,mholt,2022-03-01T21:06:21Z,2022-03-04T20:45:00+00:00,1,71.64
4613,fileserver: Add `pass_thru` Caddyfile option,francislavoie,2022-03-05T00:52:20Z,2022-03-05T03:50:05+00:00,1,2.96
4614,fastcgi: Protect against requests with null bytes in the path,francislavoie,2022-03-05T02:27:35Z,2022-03-07T17:06:33+00:00,1,62.65
4615,caddyconfig: Support conditional requests in HTTP loader,RussellLuo,2022-03-05T07:43:10Z,2022-03-24T07:35:39+00:00,2,455.87
4616,"reverseproxy: Refactor dial address parsing, augment command parsing",francislavoie,2022-03-05T20:25:44Z,2022-03-05T23:34:19+00:00,1,3.14
4629,caddyhttp: retain all values of vars matcher when specified multiple times,mohammed90,2022-03-11T11:53:50Z,2022-03-11T15:55:37+00:00,1,4.03
4643,"caddyfile: Support for raw token values, improve `map`, `expression`",francislavoie,2022-03-18T02:38:32Z,2022-03-18T21:08:23+00:00,14,18.5
4649,Optimize PrepareRequest and req.Context lookups,renbou,2022-03-19T04:41:03Z,2022-09-13T20:13:26+00:00,7,4287.54
4654,Fix http3 servers dying after reload,renbou,2022-03-21T13:41:05Z,2022-03-22T23:47:57+00:00,12,34.11
4655,caddyfile: Prevent bad block opening tokens,francislavoie,2022-03-23T01:05:10Z,2022-03-23T18:34:13+00:00,6,17.48
4657,map: Prevent output destinations overlap with Caddyfile shorthands,francislavoie,2022-03-23T22:36:32Z,2022-05-06T16:25:32+00:00,1,1049.82
4658,core: Allow LoadConfig to return ErrConfigUnchanged,RussellLuo,2022-03-24T07:45:32Z,2022-04-11T18:03:10+00:00,2,442.29
4660,chore: Clean up adapt test line endings,francislavoie,2022-03-24T23:52:45Z,2022-03-25T04:48:45+00:00,1,4.93
4661,httpcaddyfile: Fix Auto-HTTPS edgecase,francislavoie,2022-03-25T00:54:32Z,2022-03-25T04:54:03+00:00,1,3.99
4664,reverseproxy: Sync up `handleUpgradeResponse` with stdlib,francislavoie,2022-03-26T02:22:27Z,2022-04-11T18:49:56+00:00,3,400.46
4665,chore: Fix for xcaddy builds,francislavoie,2022-03-27T07:02:49Z,2022-03-28T21:07:43+00:00,1,38.08
4666,reverseproxy: Add `_ms` placeholders for proxy durations,francislavoie,2022-03-29T05:52:22Z,2022-04-11T19:04:05+00:00,3,325.2
4669,caddypki: Load intermediate for signing on-the-fly,francislavoie,2022-03-29T21:35:08Z,2022-04-13T16:20:43+00:00,1,354.76
4674,"cmd: Fix defaulting admin address if empty in config, fixes `reload`",francislavoie,2022-04-02T18:21:51Z,2022-04-03T16:04:33+00:00,1,21.71
4679,Replace placeholder for file_server index,u5surf,2022-04-05T11:52:33Z,2022-04-07T21:01:09+00:00,1,57.14
4684,logging: Caddyfile support for `duration_format`,francislavoie,2022-04-07T08:28:16Z,2022-04-07T17:23:29+00:00,1,8.92
4687,fileserver: Implement `show` list,francislavoie,2022-04-08T08:40:10Z,2023-01-06T20:45:27+00:00,1,6564.09
4691,caddyhttp: Implement `skip_log` handler,francislavoie,2022-04-09T04:56:30Z,2022-09-15T16:05:36+00:00,8,3827.15
4693,reverseproxy: Support multiple 'to' upstreams in reverse-proxy cmd,parrotmac,2022-04-10T05:09:49Z,2022-09-15T18:35:38+00:00,1,3805.43
4695,cmd: Add `--diff` option for `caddy fmt`,francislavoie,2022-04-10T21:24:03Z,2022-04-12T18:49:19+00:00,1,45.42
4702,fix typo,cuishuang,2022-04-13T12:44:33Z,2022-04-13T16:13:28+00:00,1,3.48
4703,ci: Ensure we always check for latest version of Go,francislavoie,2022-04-13T18:18:32Z,2022-04-13T20:03:40+00:00,7,1.75
4707,caddyhttp: Enable HTTP/3 by default,mholt,2022-04-15T16:52:37Z,2022-08-15T18:01:58+00:00,8,2929.16
4715,Expose several Caddy HTTP Matchers to the CEL Matcher,TristonianJones,2022-04-19T02:48:17Z,2022-06-22T22:53:46+00:00,16,1556.09
4720,"caddyauth: Speed up basicauth provision, deprecate `scrypt`",francislavoie,2022-04-22T02:21:21Z,2022-09-05T19:32:58+00:00,3,3281.19
4724,reverseproxy: Improve hashing LB policies with HRW,mholt,2022-04-22T21:39:34Z,2022-04-27T16:39:23+00:00,4,115.0
4726,"httpcaddyfile: Add `{vars.*}` placeholder shortcut, reverse `vars` sort order",francislavoie,2022-04-24T06:22:05Z,2022-04-25T16:47:13+00:00,1,34.42
4728,httpcaddyfile: Deprecate paths in site addresses; use zap everywhere,francislavoie,2022-04-24T21:24:03Z,2022-04-25T16:12:11+00:00,1,18.8
4732,logging: Use `RedirectStdLog`,francislavoie,2022-04-27T02:48:41Z,2022-04-28T14:42:30+00:00,1,35.9
4739,reverseproxy: Support performing pre-check requests,francislavoie,2022-04-28T04:35:43Z,2022-05-06T14:50:27+00:00,6,202.25
4740,caddyhttp: Improve listen addr error message for IPv6,francislavoie,2022-04-28T06:03:27Z,2022-04-28T14:18:46+00:00,1,8.26
4741,core: Add optional unix socket file permissions,emilylange,2022-04-28T06:38:41Z,2023-06-23T20:49:41+00:00,4,10118.18
4742,cmd: Fix unix socket addresses for admin API requests,francislavoie,2022-04-28T07:58:08Z,2022-04-28T14:31:59+00:00,1,6.56
4748,Add protocol_min and protocol_max for reverseproxy transport http #4747,git001,2022-04-29T00:59:45Z,2022-04-29T03:52:45+00:00,1,2.88
4753,caddyfile: Shortcut for `remote_ip` for private IP ranges,francislavoie,2022-04-29T22:00:42Z,2022-05-04T18:42:37+00:00,1,116.7
4754,reverseproxy: Fix Caddyfile support for `replace_status`,francislavoie,2022-04-30T20:06:53Z,2022-05-02T17:44:29+00:00,1,45.63
4756,"reverseproxy: Implement retry count, alternative to try_duration",francislavoie,2022-05-01T20:56:48Z,2022-07-13T20:15:00+00:00,3,1751.3
4757,templates: Add custom template function registration,kroppt,2022-05-01T22:59:09Z,2022-05-02T20:55:35+00:00,1,21.94
4760,reverseproxy: Permit resolver addresses to not specify a port,francislavoie,2022-05-04T07:07:25Z,2022-05-04T18:40:39+00:00,1,11.55
4767,templates: Add `humanize` function,git001,2022-05-06T11:48:38Z,2022-05-24T23:47:08+00:00,9,443.98
4774,httpcaddyfile: Support multiple values for `default_bind`,francislavoie,2022-05-08T19:33:15Z,2022-05-09T01:32:10+00:00,1,5.98
4778,reverseproxy: Support http1.1>h2c,mholt,2022-05-09T18:16:12Z,2022-05-10T21:25:58+00:00,1,27.16
4782,chore: Bump quic-go to v0.27.0,nekohasekai,2022-05-12T03:39:27Z,2022-05-12T05:25:18+00:00,1,1.76
4783,"forwardauth: Support renaming copied headers, block support",francislavoie,2022-05-12T23:00:10Z,2022-06-16T20:28:11+00:00,1,837.47
4784,Add renegotiation option in reverseproxy tls client,yaslama,2022-05-13T04:51:09Z,2022-06-10T15:33:35+00:00,7,682.71
4790,core: Windows service integration,WingLim,2022-05-17T13:28:39Z,2022-07-29T20:06:55+00:00,2,1758.64
4796,templates: Documentation consistency,davidbgk,2022-05-17T19:14:44Z,2022-05-17T22:56:40+00:00,1,3.7
4798,httpcaddyfile: Add `{err.*}` placeholder shortcut,francislavoie,2022-05-18T04:59:31Z,2022-05-24T16:06:46+00:00,1,155.12
4808,Add SSL key logging.,Manouchehri,2022-05-23T16:10:19Z,2022-09-16T20:05:37+00:00,15,2787.92
4811,ci: Fix build caching on Windows,francislavoie,2022-05-24T23:50:27Z,2022-05-25T17:56:39+00:00,1,18.1
4817,reverseproxy: Add `--internal-certs` CLI flag,varianone,2022-05-28T09:23:21Z,2022-05-29T20:33:02+00:00,2,35.16
4827,reverseproxy: Correct the `tls_server_name` docs,francislavoie,2022-06-06T07:27:48Z,2022-06-06T18:37:09+00:00,2,11.16
4831,headers: Support wildcards for delete ops,mholt,2022-06-08T20:22:55Z,2022-06-15T15:57:44+00:00,1,163.58
4835,Make reverse proxy TLS server name replaceable for SNI upstreams.,kresike,2022-06-09T12:00:00Z,2022-06-09T15:10:41+00:00,1,3.18
4836,Another run at making reverse proxy TLS server name replaceable for SNI upstreams,kresike,2022-06-10T16:25:48Z,2022-06-15T03:53:05+00:00,11,107.45
4838,core: add type registry to facilitate validation of type adherence to namespace requirements,mohammed90,2022-06-12T19:42:00Z,2024-04-24T18:26:25+00:00,7,16366.74
4843,Add SkipTLSPorts to http transport,kresike,2022-06-15T08:47:14Z,2022-06-20T17:51:43+00:00,3,129.07
4846,admin: Implement /adapt endpoint (close #4465),mholt,2022-06-20T16:54:35Z,2022-06-29T04:43:57+00:00,2,203.82
4847,reverseproxy: Fix double headers in response handlers,francislavoie,2022-06-21T08:29:15Z,2022-06-22T19:10:14+00:00,2,34.68
4848,reverseproxy: Fix panic when TLS is not configured,francislavoie,2022-06-21T09:07:52Z,2022-06-22T19:01:57+00:00,1,33.9
4855,reverseproxy: PROXY protocol support for http transport,WeidiDeng,2022-06-28T03:53:34Z,2023-03-15T08:11:12+00:00,4,6244.29
4856,forwardauth: Fix case when `copy_headers` is omitted,francislavoie,2022-06-28T07:21:25Z,2022-06-29T01:23:30+00:00,1,18.03
4865,TCP Keepalive configuration,karmanyaahm,2022-07-03T14:37:37Z,2022-07-11T19:55:46+00:00,5,197.3
4867,"go.mod: Bump up quic-go to v0.28.0, fixes for BC breaks",francislavoie,2022-07-06T04:31:19Z,2022-07-06T18:14:32+00:00,1,13.72
4871,templates: Access to proxy response (closes #4420),mholt,2022-07-07T19:20:48Z,2024-09-26T19:01:21+00:00,1,19487.68
4872,reverseproxy: Adjust new TLS Caddyfile directive names,francislavoie,2022-07-08T08:15:53Z,2022-07-08T17:04:22+00:00,1,8.81
4879,admin api: expect quoted ETags,jhwz,2022-07-11T20:10:23Z,2022-07-12T18:23:55+00:00,1,22.23
4880,headers: Only replace known placeholders,francislavoie,2022-07-12T03:53:40Z,2022-07-12T18:16:03+00:00,1,14.37
4882,reverseproxy: Support 1xx status codes (HTTP early hints),dunglas,2022-07-12T19:45:47Z,2022-08-09T16:53:24+00:00,4,669.13
4895,reverseproxy: Close hijacked conns on reload/quit,mholt,2022-07-17T04:46:24Z,2022-09-02T23:01:56+00:00,2,1146.26
4900,cmd: Fix reload with stdin,francislavoie,2022-07-20T21:04:53Z,2022-07-21T00:14:34+00:00,1,3.16
4905,reverseproxy: Implement read & write timeouts for HTTP transport,mholt,2022-07-22T22:38:39Z,2022-07-24T04:38:42+00:00,9,30.0
4910,ci: generate SBOM and sign artifacts using cosign,mohammed90,2022-07-25T14:33:55Z,2022-09-03T00:37:10+00:00,1,946.05
4913,ci: Run golangci-lint on multiple os(#4875),u5surf,2022-07-26T10:51:17Z,2022-07-27T13:27:19+00:00,7,26.6
4916,caddyhttp: Clear out matcher error immediately after grabbing it,francislavoie,2022-07-27T19:47:22Z,2022-07-28T21:19:48+00:00,1,25.54
4919,chore: Add .gitattributes to force *.go to LF,francislavoie,2022-07-28T22:04:13Z,2022-07-29T12:46:46+00:00,1,14.71
4920,adding h2c graceful shutdown,WeidiDeng,2022-07-29T01:11:33Z,2024-09-26T19:04:18+00:00,1,18977.88
4925,"chore: Bump up to Go 1.19, minimum 1.18",francislavoie,2022-08-02T18:13:29Z,2022-08-02T20:39:09+00:00,3,2.43
4929,Serve http2 when listener wrapper doesn't return *tls.Conn,WeidiDeng,2022-08-03T14:17:19Z,2023-04-10T17:05:03+00:00,2,6002.8
4930,Replace strings.Index usages with strings.Cut,WilczynskiT,2022-08-04T00:21:37Z,2022-08-04T17:17:35+00:00,2,16.93
4932,optimization: Replaced strings.Index with strings.Cut,chir4gm,2022-08-04T09:31:58Z,2022-08-07T04:03:37+00:00,2,66.53
4933,caddyhttp: Support configuring Server from handler provisioning,WeidiDeng,2022-08-05T08:15:44Z,2022-09-16T20:48:55+00:00,4,1020.55
4935,reverseproxy: Add upstreams healthy metrics,david-szabo97,2022-08-07T12:07:42Z,2022-08-27T18:30:24+00:00,8,486.38
4937,go.mod: Upgrade OpenTelemetry dependencies,lewandowski-stripe,2022-08-08T17:25:34Z,2022-08-08T21:04:18+00:00,1,3.65
4943,logging: Fix `cookie` filter,francislavoie,2022-08-08T23:55:07Z,2022-08-09T01:11:02+00:00,1,1.27
4948,caddyhttp: Smarter path matching and rewriting,mholt,2022-08-10T05:56:54Z,2022-08-16T14:48:58+00:00,20,152.87
4950,httpcaddyfile: Fix bind when IPv6 is specified with network,stapelberg,2022-08-11T06:19:21Z,2022-09-15T14:03:24+00:00,5,847.73
4951,reverseproxy: Fix H2C dialer using new stdlib `DialTLSContext`,francislavoie,2022-08-12T17:17:33Z,2022-08-12T19:11:14+00:00,1,1.89
4953,reverseproxy: Add `unix+h2c` Caddyfile network shortcut,francislavoie,2022-08-12T19:21:23Z,2022-08-12T21:09:19+00:00,1,1.8
4963,fileserver: reset buffer before using it (#4962),abdusco,2022-08-16T00:50:18Z,2022-08-16T04:31:46+00:00,1,3.69
4964,admin: Don't stop old server if new one fails,WeidiDeng,2022-08-16T03:49:20Z,2022-08-26T04:17:52+00:00,1,240.48
4966,core: Change net.IP to netip.Addr; use netip.Prefix,WilczynskiT,2022-08-16T21:38:24Z,2022-08-17T22:10:58+00:00,18,24.54
4971,caddyhttp: Set `http.error.message` to the HandlerError message,francislavoie,2022-08-21T10:49:14Z,2022-08-23T05:31:07+00:00,1,42.7
4972,templates: Document `httpError` function,Malankar,2022-08-21T12:35:42Z,2022-09-02T04:07:53+00:00,1,279.54
4975,templates: cap of slice should not be smaller than length,jedy,2022-08-23T05:43:11Z,2022-08-23T14:26:02+00:00,1,8.71
4976,httpcaddyfile: Add shortcut for expression matchers,francislavoie,2022-08-23T06:23:40Z,2022-09-02T03:12:37+00:00,1,236.82
4977,caddyhttp: Fix for nil `handlerErr.Err`,francislavoie,2022-08-23T07:35:57Z,2022-08-23T14:17:46+00:00,1,6.7
4978,fastcgi: Optimize FastCGI transport,WeidiDeng,2022-08-23T08:29:01Z,2022-09-02T22:57:56+00:00,8,254.48
4980,httpcaddyfile: Add ocsp_interval global option,benburkert,2022-08-23T17:23:42Z,2022-08-24T17:22:56+00:00,1,23.99
4984,events: Begin implementing event system,mholt,2022-08-24T20:54:21Z,2022-08-25T22:37:31+00:00,5,25.72
4985,zstd: fix typo in comment,simon04,2022-08-25T07:02:36Z,2022-08-25T09:00:05+00:00,1,1.96
4986,Remove duplicate words in comments,Abirdcfly,2022-08-27T15:37:45Z,2022-08-27T20:39:27+00:00,1,5.03
4990,caddyhttp: Copy logger config to HTTP server during AutoHTTPS,francislavoie,2022-08-29T06:27:07Z,2022-09-02T03:31:54+00:00,1,93.08
4993,fileserver: Support glob expansion in file matcher,mholt,2022-08-30T19:16:22Z,2022-09-05T19:53:42+00:00,2,144.62
5004,fastcgi: allow users to log stderr output (#4967),flga,2022-09-01T16:05:09Z,2022-09-02T04:02:48+00:00,14,11.96
5006,caddyhttp: Support `respond` with HTTP 103 Early Hints,mholt,2022-09-01T19:18:45Z,2022-09-05T19:50:45+00:00,1,96.53
5007,dist: deb package manpages and bash completion scripts,mohammed90,2022-09-01T22:34:23Z,2022-09-02T03:39:18+00:00,4,5.08
5015,httpcaddyfile: Add a couple more placeholder shortcuts,francislavoie,2022-09-05T20:25:08Z,2022-09-06T03:41:49+00:00,1,7.28
5022,caddyhttp: Use sendfile(2) by implementing ReadFrom on wrappers,flga,2022-09-06T22:13:46Z,2022-09-07T20:13:35+00:00,1,22.0
5027,"supplychain: publish signing cert, sbom, and signatures of sbom",mohammed90,2022-09-08T21:02:34Z,2022-09-12T22:59:54+00:00,1,97.96
5030,caddyhttp: Explicitly disallow multiple regexp matchers,francislavoie,2022-09-09T00:48:42Z,2022-09-13T17:18:40+00:00,3,112.5
5039,fix encode handler header manipulation,WeidiDeng,2022-09-14T03:45:12Z,2022-09-15T22:05:08+00:00,5,42.33
5040,core: Wrap listeners with type that can pipe,mholt,2022-09-14T06:02:39Z,2024-09-26T19:12:44+00:00,1,17845.17
5042,caddyhttp: Make metrics opt-in,mholt,2022-09-16T17:21:10Z,2022-09-16T19:32:49+00:00,2,2.19
5046,ci: fix the name template of singing certificate and sboms,mohammed90,2022-09-17T09:08:22Z,2022-09-17T14:54:50+00:00,1,5.77
5049,response recorder save status code in all cases,WeidiDeng,2022-09-17T23:02:00Z,2022-09-18T00:47:53+00:00,4,1.76
5051,caddyhttp: Skip inserting HTTP->HTTPS redir if catch-all for both exist,francislavoie,2022-09-19T18:43:59Z,2022-09-20T04:11:20+00:00,1,9.46
5060,encode: don't WriteHeader unless called,WeidiDeng,2022-09-21T00:27:24Z,2022-09-21T14:30:43+00:00,2,14.06
5071,admin: use replacer on listen address,yroc92,2022-09-23T05:50:20Z,2022-09-29T17:24:53+00:00,2,155.58
5072,Allow version to be set manually,assistcontrol,2022-09-23T15:12:59Z,2022-10-05T16:59:57+00:00,1,289.78
5077,httploader: Implement retries,yroc92,2022-09-24T06:52:48Z,2022-10-06T04:34:50+00:00,6,285.7
5081,caddyhttp: replace placeholders in map defaults,willnorris,2022-09-25T05:19:23Z,2022-09-28T19:38:21+00:00,1,86.32
5088,reverseproxy: fix upstream scheme handling,lemmi,2022-09-27T17:21:10Z,2022-09-27T19:03:31+00:00,1,1.71
5091,reverseproxy: On 103 don't delete own headers,mholt,2022-09-28T20:40:35Z,2022-09-29T14:19:56+00:00,1,17.66
5097,forwardauth: Canonicalize header fields (fix #5038),mholt,2022-09-29T19:32:42Z,2022-10-05T05:37:01+00:00,3,130.07
5099,treat invalid file path as notFound,likev,2022-09-30T10:26:41Z,2022-10-05T03:32:41+00:00,1,113.1
5101,logging: Perform filtering on arrays of strings (where possible),francislavoie,2022-09-30T23:50:40Z,2022-10-05T05:21:23+00:00,1,101.51
5102,logging: Fix `skip_hosts` with wildcards,francislavoie,2022-10-01T01:14:40Z,2022-10-05T18:14:14+00:00,1,112.99
5103,caddyhttp: Add server-level `trusted_proxies` config,francislavoie,2022-10-01T03:29:20Z,2023-01-10T05:08:23+00:00,5,2425.65
5104,caddyhttp: Determine real client IP if trusted proxies configured,francislavoie,2022-10-01T05:22:17Z,2023-03-27T20:22:59+00:00,1,4263.01
5105,fileserver: better dark mode visited link contrast,iliana,2022-10-01T21:06:04Z,2022-10-02T00:14:27+00:00,1,3.14
5106,Fix inverted logic in Windows service detection,TobiX,2022-10-02T12:34:37Z,2022-10-02T20:56:55+00:00,1,8.37
5107,"caddyhttp: Implement named routes, `invoke` directive",francislavoie,2022-10-02T19:55:06Z,2023-05-16T15:27:52+00:00,7,5419.55
5108,logging: Add `time_local` option to use local time instead of UTC,francislavoie,2022-10-02T20:27:25Z,2022-10-05T04:23:14+00:00,1,55.93
5109,logging: Better `console` encoder defaults,francislavoie,2022-10-02T20:53:31Z,2022-10-05T03:18:48+00:00,1,54.42
5110,httpcaddyfile: Fix edgecase with `auto_https off` with provided certs,francislavoie,2022-10-03T03:57:37Z,2022-10-05T02:58:19+00:00,1,47.01
5114,addresses: Support Windows absolute paths for unix socket proxy upstreams,ueffel,2022-10-03T16:07:41Z,2023-02-08T17:05:10+00:00,10,3072.96
5115,Switch to program directory when running as Windows service,TobiX,2022-10-03T21:20:28Z,2022-10-04T17:04:02+00:00,1,19.73
5118,ci: enhance the CI/CD flow,mohammed90,2022-10-04T12:10:20Z,2022-10-04T14:03:10+00:00,1,1.88
5127,replacer: working directory global placeholder,dunglas,2022-10-07T08:23:57Z,2022-10-07T09:54:41+00:00,1,1.51
5131,fileserver: stop listing dir when request context is cancelled,abdusco,2022-10-08T05:04:46Z,2022-10-08T18:56:35+00:00,1,13.86
5140,log response size for websocket request,WeidiDeng,2022-10-13T07:08:55Z,2023-02-06T23:14:59+00:00,1,2800.1
5144,fileserver: fix breadcrumbs for directories with % percent sign in the name,abdusco,2022-10-13T20:30:12Z,2023-05-11T22:08:55+00:00,2,5041.65
5149,"docs: Fix templates documentation, stray newline breaks godoc",francislavoie,2022-10-16T12:23:41Z,2022-10-16T16:25:44+00:00,1,4.03
5151,cmd: Add missing `\n` to HelpTemplate,BakaFT,2022-10-17T06:06:58Z,2022-10-17T08:51:41+00:00,1,2.75
5154,fix: support known tls placeholders replacing even for non tls request,nikolaevn,2022-10-18T14:05:06Z,2024-09-26T19:22:40+00:00,4,17021.29
5159,caddyconfig: fix httploader leak from unused responses due to loop not breaking on success,ChrisLahaye,2022-10-20T11:43:05Z,2022-10-24T17:58:31+00:00,6,102.26
5160,caddytest: Increased sleep between retries to reduce flakey tests in CI,ben-bud,2022-10-20T14:43:52Z,2022-10-27T22:12:30+00:00,1,175.48
5161,caddyhttp: add placeholder {http.request.orig_uri.path.*},XYenon,2022-10-21T11:07:58Z,2022-10-24T17:57:50+00:00,1,78.83
5169,admin: fix certificate renewal,bit,2022-10-25T07:15:35Z,2022-11-23T18:48:38+00:00,1,707.55
5170,cmd: replace deprecated func use,mohammed90,2022-10-25T12:43:47Z,2022-10-25T14:56:38+00:00,1,2.21
5173,admin: set certmagic cache logger,bit,2022-10-27T07:36:14Z,2022-11-24T03:49:22+00:00,1,668.22
5176,caddyhttp: Canonicalize header field names,ghostwheel42,2022-10-27T16:27:12Z,2022-10-29T20:35:45+00:00,2,52.14
5179,ci: set least privilged token for github actions,ashishkurmi,2022-10-31T07:21:34Z,2022-11-06T09:01:36+00:00,2,145.67
5189,caddypki: use configured certificate instead of generating a new one,joga84,2022-11-08T09:35:01Z,2022-11-08T19:13:46+00:00,1,9.65
5192,caddyauth: improve handling of multiple providers,lukedirtwalker,2022-11-09T10:44:22Z,2023-02-07T12:24:24+00:00,5,2161.67
5199,reverseproxy: Mask the WS close message when we're the client,francislavoie,2022-11-11T05:44:10Z,2022-11-14T16:38:02+00:00,1,82.9
5210,version: don't panic if read build info doesn't work,lukedirtwalker,2022-11-18T12:30:27Z,2022-12-19T21:23:46+00:00,1,752.89
5217,Use go.step.sm/crypto to generate the PKI,maraino,2022-11-23T03:36:36Z,2022-11-24T03:47:42+00:00,1,24.18
5229,reverseproxy: Improve hostByHashing distribution,skeetmtp,2022-12-02T10:11:15Z,2022-12-05T18:28:13+00:00,2,80.28
5230,caddytest: internalize init config into '.go' file,mohammed90,2022-12-02T13:59:18Z,2022-12-05T18:49:42+00:00,2,76.84
5232,acme_server: Allow the lifetime for issued certificates to be configured,kylemcc,2022-12-05T21:12:42Z,2022-12-06T07:12:26+00:00,2,10.0
5248,readme: darker variants of logos in dark mode,emilylange,2022-12-12T02:35:50Z,2022-12-12T17:18:30+00:00,2,14.71
5249,caddyfile: Implement variadics for import args placeholders,WeidiDeng,2022-12-12T12:27:06Z,2023-02-17T00:08:36+00:00,7,1595.69
5257,encode: respect Cache-Control HTTP header no-transform,darkweak,2022-12-17T10:07:48Z,2022-12-20T20:26:53+00:00,1,82.32
5258,Check for github action updates monthly,jlosito,2022-12-17T17:00:49Z,2022-12-19T21:57:57+00:00,1,52.95
5259,readme: white ZeroSSL text color in dark mode,emilylange,2022-12-19T02:06:54Z,2022-12-19T20:01:31+00:00,2,17.91
5261,build(deps): bump peter-evans/repository-dispatch from 1 to 2,dependabot,2022-12-19T21:58:20Z,2022-12-19T23:44:55+00:00,1,1.78
5262,build(deps): bump actions/upload-artifact from 1 to 3,dependabot,2022-12-19T21:58:22Z,2022-12-20T00:14:43+00:00,2,2.27
5263,build(deps): bump actions/cache from 2 to 3,dependabot,2022-12-19T21:58:26Z,2022-12-19T23:56:53+00:00,2,1.97
5264,build(deps): bump goreleaser/goreleaser-action from 2 to 4,dependabot,2022-12-19T21:58:29Z,2022-12-20T00:47:34+00:00,2,2.82
5269,reverseproxy: Don't enable auto-https when `--from` flag is http,emilylange,2022-12-28T03:03:08Z,2023-01-06T20:42:07+00:00,1,233.65
5270,ci: Fix goreleaser deprecation,francislavoie,2022-12-28T03:22:20Z,2022-12-28T18:11:39+00:00,7,14.82
5271,ci: Update GitHub Actions to avoid `set-output` deprecation,shuuji3,2022-12-28T10:04:46Z,2022-12-28T17:05:43+00:00,2,7.02
5284,reverseproxy: Set origreq in active health check,mholt,2023-01-04T17:12:41Z,2023-01-06T20:06:38+00:00,2,50.9
5287,"caddytls: Add `dns_ttl` config, improve Caddyfile `tls` options",ihmels,2023-01-05T14:17:11Z,2023-01-06T19:44:00+00:00,5,29.45
5289,Fix hanging caused by Transfer-Encoding: chunked,u5surf,2023-01-07T01:13:13Z,2023-01-09T07:13:35+00:00,2,54.01
5293,caddytls: Add test cases for Caddyfile `tls` options,ihmels,2023-01-09T18:59:07Z,2023-01-09T20:18:13+00:00,1,1.32
5297,cmd: `caddy fmt` return code is 1 if not formatted,u5surf,2023-01-11T15:16:17Z,2023-01-22T04:28:37+00:00,2,253.21
5311,chore: Fix caddyfile.replaceEnvVars return,u5surf,2023-01-16T15:40:35Z,2023-01-17T11:57:42+00:00,1,20.29
5314,go.mod: Update golang.org/x/net to v0.5.0,alexandrevicenzi,2023-01-17T10:15:51Z,2023-01-17T12:07:08+00:00,1,1.85
5315,httpcaddyfile: Fix `handle` grouping inside `route`,WeidiDeng,2023-01-17T11:43:25Z,2023-01-18T21:04:41+00:00,2,33.35
5320,httpcaddyfile: Ignore the import empty dotfile.,u5surf,2023-01-19T15:12:13Z,2023-01-21T17:22:36+00:00,4,50.17
5323,caddyfile: Allow overriding server names,francislavoie,2023-01-20T07:24:58Z,2023-01-27T19:56:40+00:00,3,180.53
5328,caddyhttp: Pluggable trusted proxy IP range sources,francislavoie,2023-01-23T11:56:19Z,2023-02-06T19:44:11+00:00,5,343.8
5329,tracing: Support placeholders in span name,davidfrickert,2023-01-23T17:07:39Z,2023-01-25T07:26:45+00:00,4,38.32
5330,reverseproxy: Add flag to short command to disable redirects,u5surf,2023-01-24T00:30:53Z,2023-01-25T14:40:09+00:00,8,38.15
5331,go.mod: bump tscert package to fix Tailscale 1.34+ on Windows,bradfitz,2023-01-24T22:56:07Z,2023-01-25T01:01:54+00:00,1,2.1
5332,admin: Add `CADDY_ADMIN` env var to override the default,francislavoie,2023-01-25T07:42:40Z,2023-02-06T17:55:17+00:00,1,298.21
5339,httpcaddyfile: Add persist_config global option,u5surf,2023-01-28T02:26:36Z,2023-01-28T04:31:38+00:00,2,2.08
