number,title,author,createdAt,closedOrMergedAt,reviewsCount,hoursOpen
5344,caddyauth: Add singleflight for basic auth,u5surf,2023-01-30T15:19:45Z,2023-02-06T18:29:03+00:00,3,171.16
5348,"chore: Fix warning ""range variable captured by func literal""",francislavoie,2023-01-31T03:11:26Z,2023-01-31T08:07:57+00:00,1,4.94
5350,cmd: Add `--envfile` flag to `validate` command,amis-shokoohi,2023-01-31T11:13:21Z,2023-01-31T21:27:36+00:00,2,10.24
5351,cmd: `fmt` exit successfully after overwriting config file,amis-shokoohi,2023-01-31T11:19:28Z,2023-01-31T16:24:45+00:00,1,5.09
5353,"chore: Build with Go 1.20, keep minimum at 1.18 for now",francislavoie,2023-02-01T23:35:02Z,2023-02-06T16:29:21+00:00,2,112.91
5362,chore: Upgrade various dependencies,francislavoie,2023-02-08T06:31:14Z,2023-02-08T17:49:18+00:00,3,11.3
5367,reverseproxy: Don't buffer chunked requests (fix #5366),mholt,2023-02-10T19:04:39Z,2023-02-12T00:25:29+00:00,2,29.35
5369,reverseproxy: refactor HTTP transport layer,mohammed90,2023-02-12T20:31:08Z,2023-02-24T19:54:05+00:00,11,287.38
5377,cmd: Adjust documentation for commands,francislavoie,2023-02-16T11:22:19Z,2023-02-16T16:14:08+00:00,1,4.86
5379,"cmd: Expand cobra support, add short flags",francislavoie,2023-02-17T04:47:15Z,2023-02-24T23:09:13+00:00,11,186.37
5383,cmd: Fix validating JSON with unknown fields,francislavoie,2023-02-20T08:45:22Z,2023-02-22T18:39:41+00:00,2,57.91
5384,caddytls: Loosen the warning for on-demand,francislavoie,2023-02-20T11:32:43Z,2023-02-22T18:41:01+00:00,1,55.14
5385,caddyfile: Implement heredoc support,francislavoie,2023-02-20T16:50:07Z,2023-02-26T00:34:28+00:00,1,127.74
5396,reverseproxy: Remove deprecated `lookup_srv`,francislavoie,2023-02-26T01:57:27Z,2023-04-10T20:08:41+00:00,1,1050.19
5397,context: Rename func to `AppIfConfigured`,francislavoie,2023-02-26T04:07:20Z,2023-02-27T18:58:28+00:00,1,38.85
5401,reverseproxy: allow specifying ip version for dynamic `a` upstream,emilylange,2023-02-26T18:29:58Z,2023-02-27T17:23:10+00:00,5,22.89
5403,ci/cd: ship tarballs with vendored deps,mohammed90,2023-02-26T19:07:52Z,2023-02-26T22:06:16+00:00,1,2.97
5404,"caddyfile: Fix heredoc fuzz crasher, drop trailing newline",francislavoie,2023-02-26T20:33:33Z,2023-02-26T21:56:48+00:00,1,1.39
5405,caddyhttp: Fix shutdown delay on unix systems,francislavoie,2023-02-28T02:22:56Z,2023-03-03T03:41:53+00:00,3,73.32
5408,caddyhttp: Fix `vars_regexp` matcher with placeholders,francislavoie,2023-02-28T19:50:03Z,2023-03-02T16:01:55+00:00,1,44.2
5413,core: Eliminate unnecessary shutdown delay on Unix,mholt,2023-03-03T00:18:26Z,2023-03-03T04:00:18+00:00,1,3.7
5419,encode: flush status code when hijacked.,WeidiDeng,2023-03-06T03:39:13Z,2023-03-06T16:13:49+00:00,1,12.58
5424,"proxyprotocol: Add PROXY protocol support to `reverse_proxy`, add HTTP listener wrapper",gucki,2023-03-08T20:46:17Z,2023-03-31T21:44:54+00:00,16,552.98
5425,quic: enable 0-RTT,marten-seemann,2023-03-08T23:38:22Z,2023-03-09T15:58:32+00:00,1,16.34
5427,fileserver: New file browse template,mholt,2023-03-09T17:25:23Z,2023-03-10T18:19:31+00:00,9,24.9
5435,reverseproxy: Reset Content-Length to prevent fastcgi from hanging,trea,2023-03-15T18:41:32Z,2023-03-16T17:42:17+00:00,1,23.01
5439,H2 without tls conn,coolaj86,2023-03-17T08:08:02Z,2023-05-11T21:58:13+00:00,1,1333.84
5440,cicd: add `--yes` to cosign arguments,mohammed90,2023-03-17T13:26:47Z,2023-03-17T16:37:00+00:00,1,3.17
5441,log: make `sink` encodable,mohammed90,2023-03-17T14:13:51Z,2023-03-27T21:41:25+00:00,3,247.46
5443,caddytls: Zero out throttle window first,mholt,2023-03-17T20:24:19Z,2023-03-20T18:06:00+00:00,1,69.69
5446,"reverseproxy: Fix active health check header canonicalization, refactor",francislavoie,2023-03-19T19:39:40Z,2023-05-05T21:19:23+00:00,1,1129.66
5458,replacer: Add HTTP time format,francislavoie,2023-03-25T22:03:45Z,2023-03-27T20:51:13+00:00,1,46.79
5459,caddytls: Run the replacer on automation policy subjects,francislavoie,2023-03-25T23:59:34Z,2023-03-27T21:16:22+00:00,4,45.28
5460,reverseproxy: Header up/down support for CLI command,francislavoie,2023-03-26T06:11:26Z,2023-03-27T20:35:31+00:00,1,38.4
5461,caddyhttp: Log request body bytes read,francislavoie,2023-03-26T08:39:00Z,2023-03-27T22:40:16+00:00,6,38.02
5462,httpcaddyfile: Adjust path matcher sorting to solve for specificity,francislavoie,2023-03-27T04:58:02Z,2023-03-27T19:43:45+00:00,1,14.76
5463,replacer: Implement `file.*` global replacements,francislavoie,2023-03-27T09:30:18Z,2024-04-24T20:26:18+00:00,5,9466.93
5464,headers: Add support for deleting all headers as one operation,heimoshuiyu,2023-03-27T10:21:14Z,2023-03-27T21:05:18+00:00,1,10.73
5468,reverseproxy: Add `query` and `client_ip_hash` lb policies,francislavoie,2023-03-29T08:17:28Z,2023-04-04T03:31:47+00:00,1,139.24
5472,reverseproxy: Add mention of which half a copyBuffer err comes from,francislavoie,2023-03-31T06:17:59Z,2023-03-31T19:46:30+00:00,5,13.48
5474,build(deps): bump actions/setup-go from 3 to 4,dependabot,2023-04-02T00:00:35Z,2023-04-02T04:36:17+00:00,1,4.59
5475,fileserver: Add color-scheme meta tag,kidonng,2023-04-02T07:38:19Z,2023-04-03T02:44:21+00:00,1,19.1
5487,reverseproxy: Optimize the base case for `least_conn` policy,francislavoie,2023-04-12T12:02:03Z,2023-05-06T02:53:49+00:00,1,566.86
5488,"reverseproxy: Add `fallback` for some policies, instead of always random",francislavoie,2023-04-12T13:54:11Z,2023-05-05T21:08:10+00:00,1,559.23
5492,celmatcher: Implement `pkix.Name` conversion to string,francislavoie,2023-04-13T15:45:39Z,2023-04-19T15:55:23+00:00,1,144.16
5494,reverseproxy: Expand port ranges to multiple upstreams in CLI + Caddyfile,francislavoie,2023-04-14T23:34:44Z,2023-05-15T18:14:50+00:00,4,738.67
5497,templates: Add `fileStat` function,taophp,2023-04-17T09:27:32Z,2023-04-24T16:36:37+00:00,3,175.15
5498,reverseproxy: Fix reinitialize upstream healthy metrics,u5surf,2023-04-17T22:18:56Z,2023-04-25T15:59:27+00:00,2,185.68
5500,"acmeserver: Configurable `resolvers`, fix smallstep deprecations",francislavoie,2023-04-19T02:44:04Z,2023-05-03T17:07:22+00:00,15,350.39
5504,Rewrite: use escaped path,TP-O,2023-04-20T09:58:57Z,2023-05-16T15:16:07+00:00,1,629.29
5505,"caddyfile: Stricter parsing, error for brace on new line",francislavoie,2023-04-20T10:03:58Z,2023-04-20T18:43:52+00:00,1,8.66
5507,logging: Add traceID field to access logs when tracing is active,hairyhenderson,2023-04-23T16:38:30Z,2023-04-27T02:46:41+00:00,8,82.14
5508,fix some comments,cuishuang,2023-04-25T07:35:44Z,2023-04-25T15:54:42+00:00,1,8.32
5509,"caddyhttp: Impl `ResponseWriter.Unwrap()`, prep for Go 1.20's `ResponseController`",dunglas,2023-04-25T18:29:53Z,2023-04-26T23:44:01+00:00,2,29.24
5515,fastcgi: Fix `capture_stderr`,eanavitarte,2023-05-03T01:07:18Z,2023-05-04T00:40:49+00:00,2,23.56
5517,fix http3 outdated certificates after config reload,WeidiDeng,2023-05-04T07:28:24Z,2023-05-10T20:25:10+00:00,18,156.95
5521,feature: watch include directory,jonatan5524,2023-05-06T14:47:54Z,2023-05-08T22:49:17+00:00,6,56.02
5532,cmd: Implement storage import/export,Phrynobatrachus,2023-05-11T18:22:47Z,2023-06-02T19:04:31+00:00,25,528.7
5533,caddyhttp: Refactor cert Managers (fix #5415),mholt,2023-05-11T18:46:43Z,2023-05-15T16:47:30+00:00,5,94.01
5535,headers: Add `>` Caddyfile shortcut for enabling `defer`,francislavoie,2023-05-16T02:06:03Z,2023-05-16T05:18:13+00:00,1,3.2
5536,Fix file browser footer while in grid mode,unknown,2023-05-16T17:44:22Z,2023-05-19T15:51:22+00:00,2,70.12
5539,Do not replace import tokens if they are part of a snippet,WeidiDeng,2023-05-18T06:26:20Z,2023-05-22T21:36:56+00:00,3,111.18
5540,config: keep track of import instead of modifying file name,WeidiDeng,2023-05-19T06:18:21Z,2023-05-25T19:05:01+00:00,4,156.78
5541,Fix h3 shutdown,WeidiDeng,2023-05-19T10:21:27Z,2023-05-19T16:00:01+00:00,1,5.64
5545,Make grid entires take up full width on mobile view and fix breadcrumb colors in dark mode mobile view (fileserver),unknown,2023-05-19T22:02:15Z,2023-05-20T23:23:18+00:00,3,25.35
5547,fileserver: Allow Etag override,charles-dyfis-net,2023-05-20T00:27:15Z,2023-05-20T23:21:44+00:00,2,22.91
5553,"templates: Add `readFile` function, skips parsing contents as a template",asyncmeow,2023-05-22T22:26:41Z,2023-05-26T16:16:29+00:00,7,89.83
5554,listen_unix.go: Use consts to set SO_REUSEPORT_LB on FreeBSD,jpds,2023-05-23T13:43:25Z,2023-05-23T16:56:00+00:00,2,3.21
5556,fileserver: Define request vars for tracking content served,charles-dyfis-net,2023-05-23T22:07:00Z,2024-09-26T20:04:15+00:00,8,11805.95
5560,update quic-go to v0.35.0,marten-seemann,2023-05-30T08:20:48Z,2023-05-30T09:41:57+00:00,1,1.35
5564,feat: better implementation of grid layout,365cent,2023-06-04T22:00:35Z,2023-06-05T07:39:57+00:00,1,9.66
5567,reverseproxy: streaming timeouts,mmm444,2023-06-08T20:16:45Z,2023-06-19T21:54:43+00:00,8,265.63
5569,Fixes parsing of source IP in case it's an ipv6 address,gucki,2023-06-12T14:29:29Z,2023-06-12T15:35:22+00:00,1,1.1
5573,caddyhttp: support custom network for HTTP/3,oncilla,2023-06-13T17:11:31Z,2023-06-14T01:33:39+00:00,1,8.37
5574,headers: Allow `>` defer shortcut for replacements,francislavoie,2023-06-15T02:00:25Z,2023-06-15T23:18:55+00:00,1,21.31
5579,reverseproxy: Implement `weighted_round_robin` load balancing policy,sabify,2023-06-19T21:58:46Z,2023-06-20T17:42:59+00:00,5,19.74
5586,chore: upgrade otel,omerdemirok,2023-06-21T11:17:43Z,2023-06-21T17:46:43+00:00,1,6.48
5591,reverseproxy: Support `tls_except_ports` for active health checks,francislavoie,2023-06-22T17:43:41Z,2023-06-22T22:20:30+00:00,1,4.61
5596,core: Skip `chmod` for abstract unix sockets,emilylange,2023-06-24T15:54:10Z,2023-06-25T00:25:02+00:00,1,8.51
5606,listeners: embed `net.UDPConn` to allow automatic optimization by quic-go,WeidiDeng,2023-06-30T06:54:31Z,2023-06-30T22:31:26+00:00,1,15.62
5611,update quic-go to v0.36.1,marten-seemann,2023-07-01T18:29:06Z,2023-07-01T23:34:28+00:00,1,5.09
5614,cmd: Require config file exists for `caddy validate`,unknown,2023-07-02T20:25:27Z,2023-08-09T17:40:37+00:00,4,909.25
5623,caddytls: Reuse certificate cache through reloads,mholt,2023-07-08T16:31:05Z,2023-07-11T19:10:59+00:00,4,74.67
5624,cmd: Unwrap adapter modules to get underlying modules,WeidiDeng,2023-07-10T03:25:23Z,2024-09-26T20:11:27+00:00,1,10672.77
5626,caddyfile: Fix comparing if two tokens are on the same line,WeidiDeng,2023-07-12T03:02:29Z,2023-07-12T20:32:23+00:00,2,17.5
5630,fileserver: add `export-template` sub-command to `file-server`,mohammed90,2023-07-13T18:18:58Z,2023-07-13T21:54:48+00:00,1,3.6
5643,httpcaddyfile: Allow `hostnames` & logger name overrides for log directive,francislavoie,2023-07-21T01:38:53Z,2023-08-02T07:13:46+00:00,1,293.58
5644,"Update quic-go to v0.37.0, bump to Go 1.20 minimum",marten-seemann,2023-07-21T18:23:31Z,2023-07-22T04:00:48+00:00,1,9.62
5646,fileserver: add lazy image loading,ydylla,2023-07-22T14:41:38Z,2023-07-22T15:50:36+00:00,2,1.15
5648,export reverseproxy.ipVersions type,kkroo,2023-07-22T17:42:24Z,2023-07-25T18:50:21+00:00,2,73.13
5654,caddyhttp: Make use of `http.ResponseController`,francislavoie,2023-07-26T00:42:32Z,2023-08-02T20:03:26+00:00,5,187.35
5663,reverseproxy: Connection termination cleanup,mmm444,2023-07-31T16:50:21Z,2023-08-01T14:01:12+00:00,2,21.18
5672,encode: Fix infinite recursion,francislavoie,2023-08-02T22:41:02Z,2023-08-03T00:21:12+00:00,2,1.67
5685,import: check that matched key is not a substring of the replacement key,WeidiDeng,2023-08-04T08:27:41Z,2023-08-04T16:44:38+00:00,2,8.28
5695,reverseproxy: do not parse upstream address too early if it contains replaceble parts,mohammed90,2023-08-05T00:55:06Z,2023-08-05T21:30:03+00:00,4,20.58
5696,cmd: fix cli when admin endpoint uses new unix socket permission format,emilylange,2023-08-05T15:02:40Z,2023-08-06T00:09:16+00:00,4,9.11
5700,Significant variable naming changes and unit test code additions on the metric side,tae2089,2023-08-05T22:54:20Z,2024-04-11T22:45:57+00:00,1,5999.86
5705,fileserver: Don't repeat error for invalid method inside error context,francislavoie,2023-08-06T06:03:20Z,2023-08-09T17:12:10+00:00,1,83.15
5707,chore: use gofumpt,faddat,2023-08-06T06:24:10Z,2023-08-07T19:40:31+00:00,1,37.27
5708,chore: use gci linter,faddat,2023-08-06T06:26:18Z,2023-08-14T15:41:16+00:00,5,201.25
5709,chore: Lint tests,faddat,2023-08-06T06:30:43Z,2024-03-05T19:11:52+00:00,15,5100.69
5711,feat: use automaxprocs for better perf in containers,dunglas,2023-08-06T10:33:23Z,2023-12-18T22:50:26+00:00,1,3228.28
5712,chore: use revive linter,faddat,2023-08-06T12:55:53Z,2023-08-14T17:28:10+00:00,8,196.54
5718,go.mod: Upgrade golang.org/x/net to 0.14.0,shyim,2023-08-08T13:57:08Z,2023-08-08T17:23:27+00:00,1,3.44
5719,ci: Update to Go 1.21,mholt,2023-08-08T15:46:43Z,2023-08-09T16:34:28+00:00,1,24.8
5720,feat: Add 64-bit RISC-V to goreleaser config,AaronDewes,2023-08-08T16:26:59Z,2023-08-08T18:11:53+00:00,2,1.75
5725,core: Apply SO_REUSEPORT to UDP sockets,mholt,2023-08-09T15:17:44Z,2023-10-17T04:17:32+00:00,3,1645.0
5745,fileserver: Support `precompressed` files without base files,singhalkarun,2023-08-14T12:17:49Z,2024-04-18T15:12:26+00:00,5,5954.91
5749,core: quic listener will manage the underlying socket by itself.,WeidiDeng,2023-08-15T07:18:55Z,2023-10-16T15:28:16+00:00,7,1496.16
5751,fileserver: docs: clarify the ability to produce JSON array with `browse`,mohammed90,2023-08-15T14:27:02Z,2023-08-18T19:04:08+00:00,1,76.62
5752,reverseproxy: Always return new upstreams (fix #5736),mholt,2023-08-16T04:07:58Z,2023-08-17T17:33:41+00:00,3,37.43
5757,httpcaddyfile: Stricter errors for site and upstream address schemes,singhalkarun,2023-08-16T17:46:36Z,2023-08-19T11:28:26+00:00,4,65.7
5761,caddyfile: Loosen heredoc parsing,francislavoie,2023-08-18T01:25:41Z,2023-08-19T10:32:32+00:00,1,33.11
5765,caddyfile: Adjust error formatting,francislavoie,2023-08-19T11:35:39Z,2023-08-20T14:51:03+00:00,2,27.26
5769,caddyfile: Fix case where heredoc marker is empty after newline,francislavoie,2023-08-20T21:52:13Z,2023-08-24T03:27:57+00:00,1,77.6
5772,go.mod: Update quic-go to v0.38.0,WeidiDeng,2023-08-21T09:00:37Z,2023-08-24T02:55:28+00:00,1,65.91
5774,"replacer: change timezone to UTC for ""time.now.http"" placeholders",WeidiDeng,2023-08-22T02:22:48Z,2023-08-22T06:41:26+00:00,1,4.31
5779,logging: query filter for array of strings,pauljeannot,2023-08-24T17:16:00Z,2023-08-29T22:59:44+00:00,5,125.73
5780,reverseproxy: Allow fallthrough for response handlers without routes,pkoenig10,2023-08-25T06:04:16Z,2023-10-06T03:15:26+00:00,1,1005.19
5783,pki: generating CSR through API,mohammed90,2023-08-25T19:08:02Z,2024-09-26T20:16:48+00:00,1,9553.15
5784,tls: modularize trusted CA providers,mohammed90,2023-08-25T22:02:43Z,2024-01-25T08:44:41+00:00,7,3658.7
5786,"logging: Clone array on log filters, prevent side-effects",francislavoie,2023-08-27T02:46:08Z,2023-08-29T17:41:39+00:00,5,62.93
5790,chore: check vuln Go mods in CI,hainenber,2023-08-31T14:42:22Z,2023-09-05T15:31:26+00:00,3,120.82
5791,httpcaddyfile: fix placeholder shorthands in named routes,hainenber,2023-09-01T05:04:13Z,2023-09-08T18:38:45+00:00,2,181.58
5793,reverseproxy: Add more debug logs,mholt,2023-09-01T21:02:47Z,2023-10-11T19:36:20+00:00,8,958.56
5794,acmeserver: support specifying the allowed challenge types,mohammed90,2023-09-01T22:00:54Z,2024-02-08T08:42:03+00:00,10,3826.69
5795,requestbody: Add `replace` for optional body replacement,AdrienPensart,2023-09-02T23:13:35Z,2025-03-12T19:38:51+00:00,11,13364.42
5796,acmeserver: add policy field to define allow/deny rules,mohammed90,2023-09-03T08:14:09Z,2024-02-23T23:26:01+00:00,2,4167.2
5803,cmd: Prevent overwriting existing env vars with `--envfile`,evandam,2023-09-06T00:12:36Z,2023-09-07T02:19:24+00:00,2,26.11
5805,caddyhttp: Security enhancements for client IP parsing,nebez,2023-09-07T05:01:38Z,2024-01-13T20:46:38+00:00,6,3087.75
5808,httpcaddyfile: Enable TLS for catch-all site if `tls` directive is specified,hainenber,2023-09-09T08:19:48Z,2023-10-10T21:46:40+00:00,5,757.45
5811,reverseproxy: fix nil pointer dereference in AUpstreams.GetUpstreams,FossoresLP,2023-09-09T19:46:14Z,2023-09-10T23:08:02+00:00,2,27.36
5812,fileserver: browse template SVG icons and UI tweaks,glowinthedark,2023-09-10T12:50:48Z,2023-09-16T01:05:45+00:00,2,132.25
5828,reverseproxy: fix parsing Caddyfile fails for unlimited request/response buffers,mcfedr,2023-09-20T18:49:49Z,2023-10-11T08:42:40+00:00,1,493.88
5830,reverseproxy: only change the content-length header when the full request was buffered,mcfedr,2023-09-20T19:53:50Z,2024-01-09T19:59:31+00:00,1,2664.09
5832,reverseproxy: SRV dynamic upstream failover,mholt,2023-09-21T17:48:32Z,2024-03-05T19:08:31+00:00,3,3985.33
5833,"filesystem: Globally declared filesystems, `fs` directive",elee1766,2023-09-21T18:23:57Z,2024-01-13T20:12:43+00:00,8,2737.81
5841,"reverseproxy: Fix retries on ""upstreams unavailable"" error",francislavoie,2023-09-27T09:26:32Z,2023-10-10T22:07:20+00:00,1,324.68
5844,httpcaddyfile: Rewrite `root` and `rewrite` parsing to allow omitting matcher,francislavoie,2023-09-30T23:24:18Z,2024-01-15T16:57:08+00:00,1,2561.55
5845,"templates: Add dummy `RemoteAddr` to `httpInclude` request, proxy compatibility",ThanmayNath,2023-10-01T02:43:03Z,2023-10-07T20:47:34+00:00,5,162.08
5848,Use sync.Pool to reduce lengthReader allocations,perhapsmaple,2023-10-02T03:48:07Z,2023-10-16T20:42:02+00:00,3,352.9
5850,fileserver: Implement caddyfile.Unmarshaler interface,francislavoie,2023-10-02T11:06:34Z,2024-01-13T21:32:44+00:00,5,2482.44
5851,reverseproxy: Add `tls_curves` option to HTTP transport,bwesterb,2023-10-02T11:12:19Z,2024-01-13T20:56:23+00:00,4,2481.73
5852,"tls: Add support for X25519Kyber768Draft00 post-quantum ""curve"" when compiled with cfgo.",bwesterb,2023-10-02T12:30:47Z,2023-10-11T19:45:38+00:00,1,223.25
5853,fix: caddytest.AssertResponseCode error message,dunglas,2023-10-02T16:04:15Z,2023-10-02T20:55:10+00:00,1,4.85
5854,fileserver: Add command shortcuts `-l` and `-a`,dunglas,2023-10-04T12:29:48Z,2023-10-10T20:57:19+00:00,2,152.46
5855,fileserver: Enable compression for command by default,dunglas,2023-10-04T20:58:16Z,2023-12-14T03:44:22+00:00,5,1686.77
5857,reverseproxy: Add debug logging for dynamic A upstreams,francislavoie,2023-10-05T19:10:03Z,2023-10-11T15:50:45+00:00,1,140.68
5859,caddyhttp: Add `uuid` to access logs when used,francislavoie,2023-10-06T01:58:17Z,2023-12-13T22:40:15+00:00,1,1652.7
5860,"httpcaddyfile: Sort TLS SNI matcher, for deterministic adapt output",francislavoie,2023-10-06T02:59:06Z,2023-10-11T15:47:07+00:00,2,132.8
5861,reverseproxy: Replace health header placeholders,francislavoie,2023-10-06T03:48:21Z,2023-10-11T15:50:29+00:00,1,132.04
5862,reverseproxy: Fix `least_conn` policy regression,francislavoie,2023-10-06T04:14:19Z,2023-10-11T16:04:28+00:00,1,131.84
5865,httpcaddyfile: Add `RegisterDirectiveOrder` function for plugin authors,francislavoie,2023-10-07T04:46:08Z,2024-03-06T19:41:45+00:00,6,3638.93
5867,fileserver: Add canonical URL to browse template,Forza-tng,2023-10-07T11:50:32Z,2023-10-11T19:47:39+00:00,1,103.95
5869,encode: Add `application/wasm*` to the default content types,Christoph-D,2023-10-08T16:14:18Z,2023-10-10T21:18:37+00:00,1,53.07
5870,admin: respond with 4xx status code on non-existing config path,BattleRattle,2023-10-08T16:53:41Z,2023-10-11T20:24:30+00:00,1,75.51
5874,"cmd: Fix exiting with custom status code, add `caddy -v`",francislavoie,2023-10-10T07:50:31Z,2023-10-11T15:46:18+00:00,1,31.93
5880,fileserver: Add `precompressed` flag to command,ddemoss222,2023-10-11T21:46:39Z,2023-12-14T03:26:20+00:00,1,1517.66
5881,httpcaddyfile: Remove port from logger names,francislavoie,2023-10-12T05:24:47Z,2023-10-17T05:57:03+00:00,1,120.54
5883,caddyfile: Fix variadic placeholder false positive when token contains `:`,WeidiDeng,2023-10-12T06:29:16Z,2023-10-13T06:28:21+00:00,1,23.98
5891,cmd: upgrade: resolve symlink of the executable,mohammed90,2023-10-13T09:25:04Z,2023-10-13T21:19:23+00:00,2,11.91
5895,Add newline character to version string in CLI output,ThanmayNath,2023-10-14T12:33:14Z,2023-10-16T15:58:32+00:00,1,51.42
5896,httpcaddyfile: Fix TLS automation policy merging with get_certificate,francislavoie,2023-10-14T18:28:28Z,2023-10-14T20:23:50+00:00,1,1.92
5898,"templates: Clarify `include` args docs, add `.ClientIP`",francislavoie,2023-10-15T13:34:07Z,2023-10-16T00:58:46+00:00,3,11.41
5901,storage: Refactor with early return pattern in homeDir func,thor-son,2023-10-17T01:55:50Z,2023-10-17T05:20:20+00:00,1,3.41
5908,go.mod: CVE-2023-45142 Update opentelemetry,ddl-ebrown,2023-10-20T19:07:55Z,2023-10-20T21:15:49+00:00,1,2.13
5910,caddyhttp: Adjust `scheme` placeholder docs,francislavoie,2023-10-22T20:36:14Z,2023-10-22T21:47:16+00:00,3,1.18
5914,test: acmeserver: add smoke test for the ACME server directory,mohammed90,2023-10-24T07:52:07Z,2023-10-24T17:59:53+00:00,1,10.13
5915,proxyprotocol: use github.com/pires/go-proxyproto,mohammed90,2023-10-24T19:41:24Z,2023-12-13T16:07:43+00:00,24,1196.44
5916,chore: Fix usage pool comment,WeidiDeng,2023-10-26T01:04:54Z,2023-10-26T03:05:20+00:00,1,2.01
5917,httpredirectlistener: Only set read limit for when request is HTTP,WeidiDeng,2023-10-26T13:48:07Z,2023-11-20T12:31:36+00:00,11,598.72
5918,update quic-go to v0.39.3,marten-seemann,2023-10-27T10:00:29Z,2023-10-27T11:52:13+00:00,1,1.86
5919,"Added special case support for caddyfile suffix, case insensitive",omalk98,2023-10-27T21:13:12Z,2024-04-11T21:28:16+00:00,3,4008.25
5922,go.mod: update quic-go version to v0.40.0,WeidiDeng,2023-10-31T08:47:44Z,2023-10-31T18:05:34+00:00,2,9.3
5923,Align with the API changes in certmagic to pass the context into the decision func,ankon,2023-10-31T11:40:44Z,2023-12-07T17:40:14+00:00,1,893.99
5934,Avoid skipping a storage due to identical string representations,ankon,2023-11-09T19:15:03Z,2023-11-28T16:43:46+00:00,1,453.48
5944,logging: Add `zap.Option` support,francislavoie,2023-11-15T09:41:19Z,2023-12-18T20:48:35+00:00,3,803.12
5945,core: Add `ctx.Slogger()` which returns an `slog` logger,francislavoie,2023-11-17T03:48:44Z,2024-01-25T19:31:16+00:00,1,1671.71
5946,caddyhttp: http2 uses new round-robin scheduler,WeidiDeng,2023-11-17T07:36:47Z,2023-11-24T01:54:28+00:00,1,162.29
5948,caddyhttp: Register post-shutdown callbacks,mholt,2023-11-20T14:47:28Z,2024-02-15T04:21:24+00:00,1,2077.57
5949,chore: Bump otel to v1.21.0.,dlorenc,2023-11-22T02:36:12Z,2023-11-22T14:02:13+00:00,1,11.43
5952,reverseproxy: panic when reading from backend failed to propagate stream error,WeidiDeng,2023-11-23T02:18:59Z,2023-11-23T08:18:18+00:00,1,5.99
5960,Format markdown comments in modules.caddyhttp.App,sword-jin,2023-12-01T04:15:59Z,2023-12-18T20:21:35+00:00,1,424.09
5961,chore: enabling a few more linters,AnomalRoil,2023-12-02T13:02:02Z,2024-01-25T15:24:58+00:00,6,1298.38
5963,tls: accept placeholders in string values of certificate loaders,mohammed90,2023-12-04T14:33:14Z,2023-12-04T16:23:15+00:00,2,1.83
5965,httpcaddyfile: Add optional status code argument to `handle_errors` directive,armadi1809,2023-12-05T07:35:17Z,2024-01-16T06:24:17+00:00,4,1006.82
5968,cmd: Export the TLS storage last modified time as well.,jum,2023-12-07T16:23:32Z,2023-12-13T16:06:07+00:00,1,143.71
5973,fileserver: Browse symlink display shows the target,armadi1809,2023-12-12T00:23:51Z,2024-02-06T04:31:26+00:00,20,1348.13
5976,Ensure AppDataDir exists inside caddy.InstanceID(),armadi1809,2023-12-13T03:31:36Z,2023-12-13T14:39:11+00:00,1,11.13
5979,metrics: Record request metrics on HTTP errors,tgeoghegan,2023-12-13T16:35:14Z,2023-12-15T20:14:00+00:00,4,51.65
5980,logging: Automatic `wrap` default for `filter` encoder,francislavoie,2023-12-14T03:09:54Z,2024-01-25T04:00:22+00:00,2,1008.84
5983,Update quic-go to its latest version,armadi1809,2023-12-15T04:14:24Z,2023-12-15T05:42:01+00:00,1,1.46
5984,test: highlight a deadlock when reloading Caddy,dunglas,2023-12-15T10:40:15Z,2023-12-15T17:53:22+00:00,1,7.22
5990,httpcaddyfile: Sort skip_hosts for deterministic JSON,francislavoie,2023-12-16T16:34:50Z,2023-12-18T19:54:52+00:00,4,51.33
5995,replacer: Fix escaped closing braces,armadi1809,2023-12-19T06:17:46Z,2024-01-13T20:24:04+00:00,2,614.11
5997,httpcaddyfile: Fix cert file decoding to load multiple PEM in one file,francislavoie,2023-12-20T08:58:50Z,2023-12-20T15:37:21+00:00,1,6.64
6001,httpcaddyfile: Fix redir <to> html,subnut,2023-12-23T14:52:19Z,2024-01-10T12:24:48+00:00,3,429.54
6003,browse: Add total file size to directory listing,steffenbusch,2023-12-25T15:01:09Z,2023-12-30T18:47:13+00:00,1,123.77
6010,caddyhttp: support unix sockets in `caddy respond` command,networkException,2024-01-01T02:26:01Z,2024-01-01T03:34:00+00:00,1,1.13
6011,chore: check against errors of `io/fs` instead of `os`,mohammed90,2024-01-01T19:52:48Z,2024-01-02T05:48:56+00:00,1,9.94
6012,build(deps): bump actions/setup-go from 4 to 5,dependabot,2024-01-01T23:30:27Z,2024-01-02T07:13:31+00:00,1,7.72
6013,build(deps): bump actions/upload-artifact from 3 to 4,dependabot,2024-01-01T23:30:31Z,2024-01-02T08:23:26+00:00,1,8.88
6021,Switch Solaris-derivatives away from listen_unix,insom,2024-01-05T22:31:15Z,2024-01-06T10:09:21+00:00,1,11.63
6022,httpcaddyfile: Support client auth verifiers,zachgalvin,2024-01-06T00:21:21Z,2024-01-09T23:14:52+00:00,2,94.89
6025,tls: add reuse_private_keys,rithvikvibhu,2024-01-07T17:17:46Z,2024-01-09T23:00:31+00:00,9,53.71
6032,cmd: Adjust config load logs/errors,francislavoie,2024-01-10T19:57:49Z,2024-03-05T19:26:30+00:00,3,1319.48
6037,caddyfile: Normalize & flatten all unmarshalers,francislavoie,2024-01-12T10:31:01Z,2024-01-24T00:36:59+00:00,1,278.1
6040,caddyhttp: Fix panic when request missing ClientIPVarKey,francislavoie,2024-01-15T03:08:14Z,2024-01-24T00:45:51+00:00,1,213.63
6042,cmd: reverseproxy: log: use caddy logger,mohammed90,2024-01-15T22:00:57Z,2024-01-23T17:52:03+00:00,1,187.85
