number,title,author,createdAt,closedOrMergedAt,reviewsCount,hoursOpen,merged,additions,deletions,changedFiles,bodyLength,issueCommentsCount,reviewThreadsCount,interactionsCount,finalReviewState
134180,[Test] Use generic for GlobalCheckpoingSyncAction,ywangd,2025-09-04T23:44:37Z,2025-09-05T10:21:59+00:00,4,10.62,True,23,29,2,174,4,2,6,MERGED
134179,Migrate initial transport version for 9.0,jdconrad,2025-09-04T23:04:46Z,2025-09-05T14:52:27+00:00,1,15.79,True,4,4,5,92,2,0,2,MERGED
134178,[ML] Return 429 status when RequestExecutorService queue full,DonalEvans,2025-09-04T22:58:54Z,2025-09-08T16:02:14+00:00,2,89.06,True,82,59,8,382,4,2,6,MERGED
134175,Add infrastructure needed for resharding search filters,lkts,2025-09-04T22:15:21Z,2025-09-11T21:28:44+00:00,3,167.22,False,46,48,8,0,0,3,3,CLOSED
134174,Migrate initial transport versions for 8.19,jdconrad,2025-09-04T21:26:23Z,2025-09-04T22:54:21+00:00,1,1.47,True,2,2,3,93,2,0,2,MERGED
134172,Reserve square bracket syntax for ingest document flexible field access pattern,jbaiera,2025-09-04T20:29:06Z,2025-09-12T08:37:13+00:00,6,180.14,True,152,21,2,439,1,3,4,MERGED
134170,Block encode doc ids,benwtrent,2025-09-04T20:20:00Z,2025-09-05T11:55:38+00:00,2,15.59,True,67,42,3,518,1,0,1,MERGED
134169,[Gradle] Configure transitive dependencies via ComponentMetadataRules,breskeby,2025-09-04T20:14:36Z,2025-09-15T09:54:47+00:00,5,253.67,True,813,133,15,1794,5,5,10,MERGED
134165,ESQL: percentile agg accepting doubles but ignoring decimals,mouhc1ne,2025-09-04T19:23:01Z,2025-09-12T12:39:09+00:00,7,185.27,True,47,6,5,331,2,2,4,MERGED
134160,Balancer changes to use Decision#NOT_PREFERRED,DiannaHohensee,2025-09-04T18:19:31Z,2025-09-23T21:13:22+00:00,7,458.9,True,432,142,6,408,1,6,7,MERGED
134158,Migrate initial elasticsearch transport versions for 8.18,jdconrad,2025-09-04T15:56:38Z,2025-09-04T18:03:28+00:00,1,2.11,True,11,11,12,93,2,0,2,MERGED
134157,flushOnIdle use tryWithEngineOrNull,kingherc,2025-09-04T15:52:22Z,2025-09-15T14:39:42+00:00,6,262.79,True,103,24,2,241,3,2,5,MERGED
134156,ESQL: More docs for `DataType#UNDER_CONSTRUCTION`,nik9000,2025-09-04T15:48:28Z,2025-09-05T17:39:52+00:00,3,25.86,True,15,4,1,58,2,0,2,MERGED
134152,Correctly update SLM stats with master shutdown,samxbr,2025-09-04T15:29:41Z,2025-09-16T16:22:29+00:00,3,288.88,True,564,61,5,962,2,6,8,MERGED
134148,[8.19] Bootstrap initial versions to simplify transport version migration (#134084),jdconrad,2025-09-04T15:11:41Z,2025-09-04T16:24:39+00:00,1,1.22,True,11,17,14,118,1,0,1,MERGED
134145,Fix doc writers block writing logic for diskbbq,benwtrent,2025-09-04T14:57:48Z,2025-09-04T16:05:16+00:00,1,1.12,True,28,25,2,216,1,0,1,MERGED
134143,ES|QL: Enable CCS for FORK only in snapshot,ioanatia,2025-09-04T14:34:15Z,2025-09-04T15:47:40+00:00,2,1.22,True,12,1,3,168,1,0,1,MERGED
134140,ES|QL: Make TopN aggregator use heap sort internally.,przemekwitek,2025-09-04T14:16:09Z,2025-09-10T11:25:39+00:00,2,141.16,True,268,183,8,237,8,0,8,MERGED
134138,ESQL: Fix docs grammar,nik9000,2025-09-04T13:46:35Z,2025-09-08T19:06:26+00:00,1,101.33,True,5,5,5,43,4,0,4,MERGED
134137,Add signing configuration for cross cluster api keys,jfreden,2025-09-04T13:44:25Z,2025-09-16T06:12:24+00:00,14,280.47,True,1658,7,20,1025,3,13,16,MERGED
134134,Prevent field caps from failing due to can match failure,dimitris-athanasiou,2025-09-04T11:54:41Z,2025-09-10T18:00:30+00:00,7,150.1,True,116,83,8,643,8,7,15,MERGED
134132,Ensure enough nodes in `WriteLoadForecasterIT`,DaveCTurner,2025-09-04T11:52:45Z,2025-09-05T08:46:08+00:00,2,20.89,True,2,6,2,225,4,0,4,MERGED
134127,Add integration test for LOOKUP JOIN on remotes after STATS,luigidellaquila,2025-09-04T11:45:33Z,2025-09-04T14:12:59+00:00,2,2.46,True,14,0,1,95,1,1,2,MERGED
134122,[Renovate] Auto update common ci-agent-images,breskeby,2025-09-04T10:16:44Z,2025-09-04T18:56:39+00:00,2,8.67,True,19,1,1,173,3,1,4,MERGED
134119,[D0CS] Fix semantic_text example in mapping-reference/semantic-text.md,leemthompo,2025-09-04T10:01:16Z,2025-09-04T11:01:21+00:00,1,1.0,True,7,7,1,32,4,0,4,MERGED
134118,[Buildkite] Add daily pipeline to check for new jdk ea build,breskeby,2025-09-04T09:55:26Z,2025-09-05T21:06:21+00:00,13,35.18,True,141,1,3,54,1,6,7,MERGED
134117,Improve block loader for source only runtime fields of type long.,martijnvg,2025-09-04T09:42:35Z,2025-09-10T05:04:32+00:00,4,139.37,True,288,28,9,89,3,3,6,MERGED
134115,Resolve main indices before lookup,idegtiarenko,2025-09-04T08:46:07Z,2025-09-05T07:00:28+00:00,7,22.24,True,22,9,1,411,1,2,3,MERGED
134109,[DiskBBQ] Use a HNSW graph to compute neighbours,iverase,2025-09-04T08:07:01Z,2025-09-05T06:38:49+00:00,17,22.53,True,347,63,4,4990,5,6,11,MERGED
134107,Add a note about multi-valued doc values in the docs.,martijnvg,2025-09-04T07:28:26Z,2025-09-05T06:34:56+00:00,1,23.11,True,7,0,1,0,5,0,5,MERGED
134103,[Test] Fix SnapshotMetricsIT testByStateCounts_InitAndQueuedShards,ywangd,2025-09-04T05:25:46Z,2025-09-04T06:30:52+00:00,1,1.08,True,4,0,1,98,1,0,1,MERGED
134101,Test that `ClusterInfo` is refreshed when a new node is added,nicktindall,2025-09-04T01:41:25Z,2025-09-04T23:43:06+00:00,3,22.03,True,42,0,1,785,1,2,3,MERGED
134099,[Test] Fix WriteLoadForecasterIT testWriteLoadForecastIsOverriddenBySetting,ywangd,2025-09-04T00:43:27Z,2025-09-04T07:49:15+00:00,1,7.1,True,1,0,1,89,4,0,4,MERGED
134098,ESQL: LOOKUP JOIN with expressions,julian-elastic,2025-09-04T00:13:43Z,2025-09-17T17:54:37+00:00,85,329.68,True,4270,1734,59,917,9,71,80,MERGED
134095,Implementing irate function for timeseries,pabloem,2025-09-03T22:44:52Z,2025-09-09T22:54:53+00:00,16,144.17,True,3256,25,21,192,1,13,14,MERGED
134093,Add blockloader to patterned_text to support ESQL,parkertimmins,2025-09-03T22:29:47Z,2025-09-04T17:27:22+00:00,5,18.96,True,199,14,5,116,1,3,4,MERGED
134092,unmute test as it should be fixed,pabloem,2025-09-03T22:16:05Z,2025-09-04T21:39:05+00:00,1,23.38,True,11,11,3,14,2,0,2,MERGED
134091,Use latest setting value when initializing setting watch,rjernst,2025-09-03T22:00:06Z,2025-09-08T17:57:13+00:00,5,115.95,True,45,1,3,343,3,1,4,MERGED
134090,ESQL: Speed up MultiClusterSpecIT start up by 40% by parallelizing index creation,julian-elastic,2025-09-03T21:34:35Z,2025-09-05T00:23:57+00:00,8,26.82,True,43,12,2,221,1,3,4,MERGED
134086,ESQL: Small speed up in MultiClusterSpecIT,nik9000,2025-09-03T20:44:24Z,2025-09-09T21:14:55+00:00,2,144.51,True,42,4,1,308,1,0,1,MERGED
134084,Bootstrap initial versions to simplify transport version migration,jdconrad,2025-09-03T20:23:55Z,2025-09-03T23:56:17+00:00,4,3.54,True,21,17,14,224,2,3,5,MERGED
134082,Updating Docs For DiskBBQ Format,john-wagster,2025-09-03T19:53:15Z,2025-09-23T17:31:43+00:00,1,477.64,False,27,7,3,0,7,2,9,CLOSED
134081,Update the guide to add a new ESQL function,mouhc1ne,2025-09-03T19:06:28Z,2025-09-04T17:40:27+00:00,2,22.57,True,40,21,1,301,2,0,2,MERGED
134080,Add Google Model Garden's Anthropic support to Inference Plugin,Jan-Kazlouski-elastic,2025-09-03T18:28:58Z,2025-09-29T14:31:06+00:00,31,620.04,True,1934,118,30,32129,10,21,31,MERGED
134079,Avoid expensive status update in LuceneOperator,dnhatn,2025-09-03T18:18:10Z,2025-09-03T20:34:56+00:00,3,2.28,True,2,21,2,219,3,1,4,MERGED
134076,Updating docs for test classes,pabloem,2025-09-03T17:12:50Z,2025-09-03T21:48:12+00:00,3,4.59,True,9,6,1,0,1,2,3,MERGED
134074,Extend ReservedRoleNameChecker factory interface,slobodanadamovic,2025-09-03T16:59:12Z,2025-09-04T06:34:50+00:00,1,13.59,True,15,3,2,98,1,0,1,MERGED
134069,Fix failing thread pool test on low core count machines,mark-vieira,2025-09-03T16:24:21Z,2025-09-04T03:22:58+00:00,1,10.98,True,5,1,1,179,1,0,1,MERGED
134068,Removing test as coverage is achieved elsewhere,pabloem,2025-09-03T16:21:40Z,2025-09-05T05:42:37+00:00,2,37.35,True,0,479,2,70,2,0,2,MERGED
134067,update kibana_system to grant it access to .workflows-* system index,talboren,2025-09-03T15:53:40Z,2025-09-04T13:02:15+00:00,1,21.14,True,11,2,3,33,4,0,4,MERGED
134066,Unmute tests,joshua-adams-1,2025-09-03T14:36:27Z,2025-09-04T14:20:07+00:00,1,23.73,True,0,6,1,288,1,0,1,MERGED
134048,Avoid multiple in-memory copies of Vector Data,ldematte,2025-09-03T12:43:11Z,2025-09-30T13:09:58+00:00,1,648.45,False,201,75,4,1198,0,1,1,CLOSED
134038,ES|QL: Refactor FUSE planning,ioanatia,2025-09-03T11:40:11Z,2025-09-04T11:06:33+00:00,6,23.44,True,219,263,14,514,1,3,4,MERGED
134037,"ExponentialHistograms: refactor tests to use builder, add copy method",JonasKunz,2025-09-03T11:15:45Z,2025-09-04T10:10:06+00:00,9,22.91,True,173,192,11,267,1,5,6,MERGED
134033,Fix FORK with union-types,craigtaverner,2025-09-03T09:49:52Z,2025-09-05T16:05:39+00:00,4,54.26,True,64,9,6,781,4,2,6,MERGED
134029,ES|QL: Add grammar for SET instruction,luigidellaquila,2025-09-03T08:37:28Z,2025-09-09T08:08:40+00:00,17,143.52,True,3706,2834,21,156,6,14,20,MERGED
134028,Clean up CoordinatorTests,joshua-adams-1,2025-09-03T08:28:03Z,2025-09-04T10:15:50+00:00,2,25.8,True,17,19,2,106,1,0,1,MERGED
134018,Correctly record SLM state during master failover,samxbr,2025-09-02T21:00:35Z,2025-09-04T16:40:53+00:00,1,43.67,False,573,62,5,0,0,1,1,CLOSED
134016,Replace -1s with -1 in ML forecast tests,JeremyDahlgren,2025-09-02T20:39:07Z,2025-09-03T12:11:24+00:00,1,15.54,True,4,4,2,290,2,0,2,MERGED
134015,[8.19] Adding _meta.template_version to kibana reporting mappings (#133846),pmuellr,2025-09-02T20:14:05Z,2025-09-03T18:01:23+00:00,1,21.79,True,4,1,2,200,5,0,5,MERGED
134014,[9.1] Adding _meta.template_version to kibana reporting mappings (#133846),pmuellr,2025-09-02T20:12:17Z,2025-09-02T21:14:31+00:00,1,1.04,True,4,1,2,199,1,0,1,MERGED
134013,Refactor doc-id encoding for DiskBBQ to allow doc ids to be encoded in blocks,benwtrent,2025-09-02T19:18:56Z,2025-09-03T18:53:08+00:00,1,23.57,True,243,66,2,475,1,0,1,MERGED
134008,Fix PerFieldFormatSupplier mistake,martijnvg,2025-09-02T18:21:29Z,2025-09-03T20:13:27+00:00,4,25.87,True,55,14,3,216,2,2,4,MERGED
134007,[ML] Refactor inference API test threadpool creation,jonathan-buttner,2025-09-02T18:04:50Z,2025-09-03T18:56:13+00:00,2,24.86,True,147,148,69,359,1,1,2,MERGED
134006,Don't use tsdb codec for recovery_source fields,dnhatn,2025-09-02T17:15:32Z,2025-09-02T18:50:10+00:00,1,1.58,False,6,6,2,261,3,1,4,CLOSED
134005,Removing _doc from data stream effective mappings,masseyke,2025-09-02T16:58:01Z,2025-09-03T19:21:14+00:00,2,26.39,True,81,92,4,188,2,2,4,MERGED
134004,Update es-connectors-sharepoint.md,lhirlimann,2025-09-02T16:50:10Z,2025-09-04T08:30:27+00:00,5,39.67,True,1,0,1,154,6,2,8,MERGED
134003,ESQL - TO_DENSE_VECTOR function and additional casting,carlosdelest,2025-09-02T16:40:00Z,2025-09-10T11:51:33+00:00,4,187.19,True,1274,119,29,906,4,1,5,MERGED
133999,[DiskBBQ] small optimization on how we manage queues in hierarchical centroids,iverase,2025-09-02T15:49:36Z,2025-09-03T14:57:11+00:00,3,23.13,True,28,10,2,131,1,1,2,MERGED
133987,Add UPGRADE_TO_LUCENE_10_4_0 constant,romseygeek,2025-09-02T13:48:46Z,2025-09-02T15:33:24+00:00,1,1.74,True,1,0,1,0,2,0,2,MERGED
133986,ES|QL: Add PRESENT ES|QL function,leontyevdv,2025-09-02T13:47:26Z,2025-09-09T09:09:12+00:00,15,163.36,True,1273,6,25,170,4,12,16,MERGED
133985,Reshard add shard count,ankikuma,2025-09-02T13:46:49Z,2025-09-25T14:42:44+00:00,32,552.93,True,279,8,11,175,1,20,21,MERGED
133981,rest-api-spec: fix query_rules.test stability,pquentin,2025-09-02T13:29:20Z,2025-09-05T07:11:26+00:00,1,65.7,True,1,1,1,0,2,0,2,MERGED
133980,Upgrade elasticsearch to lucene 10.3.0,romseygeek,2025-09-02T13:23:43Z,2025-09-23T13:20:40+00:00,4,503.95,False,2123,1383,94,235,5,4,9,CLOSED
133977,[Buildkite] Use ubuntu2204 when testing openjdk17,breskeby,2025-09-02T13:00:13Z,2025-09-02T18:24:46+00:00,1,5.41,True,8,8,2,195,2,0,2,MERGED
133972,Add additional logging to make spotting stats issues easier,lukewhiting,2025-09-02T12:43:25Z,2025-09-17T11:17:40+00:00,11,358.57,True,61,19,5,163,1,5,6,MERGED
133970,Add annotations to PR benchmark pipeline,gbanasiak,2025-09-02T11:07:26Z,2025-09-03T07:23:42+00:00,1,20.27,True,39,9,1,76,8,0,8,MERGED
133969,Add toString implementation to exponential histograms,JonasKunz,2025-09-02T10:31:19Z,2025-09-02T12:51:51+00:00,6,2.34,True,103,0,2,362,1,2,3,MERGED
133968,Extend kibana-system permissions to manage security entities,kubasobon,2025-09-02T10:27:17Z,2025-09-16T15:50:05+00:00,3,341.38,True,22,3,5,668,11,0,11,MERGED
133967,Add builder for exponential histograms,JonasKunz,2025-09-02T10:23:28Z,2025-09-03T11:01:02+00:00,5,24.63,True,264,0,3,654,1,2,3,MERGED
133966,Catch up DLS with recent Lucene changes.,jpountz,2025-09-02T09:44:41Z,2025-09-24T17:46:23+00:00,3,536.03,True,233,175,8,544,7,1,8,MERGED
133962,Correct Typo In Latest Transport Version ID,lukewhiting,2025-09-02T08:04:15Z,2025-09-02T15:21:50+00:00,1,7.29,True,1,1,1,89,3,0,3,MERGED
133959,Add metrics max queue latency,nicktindall,2025-09-02T06:20:00Z,2025-09-04T23:35:48+00:00,5,65.26,True,156,63,10,600,2,4,6,MERGED
133958,Log allocation explain for unassigned in desiredBalance computaion,ywangd,2025-09-02T06:18:30Z,2025-09-04T00:54:52+00:00,6,42.61,True,266,22,9,298,3,3,6,MERGED
133957,Set storage engine as codeowner for the OTLP endpoint,felixbarny,2025-09-02T06:05:18Z,2025-09-02T07:10:25+00:00,1,1.09,True,6,1,2,84,1,0,1,MERGED
133956,[Test] Fix ClusterInfoServiceIT testMaxQueueLatenciesInClusterInfo,ywangd,2025-09-02T01:50:12Z,2025-09-02T05:10:56+00:00,2,3.35,True,33,12,2,127,3,1,4,MERGED
133955,Unmute SyntheticSourceRollingUpgradeIT,martijnvg,2025-09-01T20:09:27Z,2025-09-04T07:53:24+00:00,1,59.73,True,1,6,2,157,2,0,2,MERGED
133954,ILM: Force merge on zero-replica cloned index before snapshot,nielsbauman,2025-09-01T17:34:40Z,2025-09-05T14:13:40+00:00,27,92.65,True,641,132,18,1113,3,21,24,MERGED
133952,Fix warning when creating an OTel data stream,felixbarny,2025-09-01T15:39:49Z,2025-09-01T16:45:49+00:00,1,1.1,True,77,1,4,327,2,0,2,MERGED
133947,resolve remotes with field caps call,idegtiarenko,2025-09-01T14:44:35Z,2025-09-23T08:41:48+00:00,12,521.95,False,68,42,9,217,2,3,5,CLOSED
133945,[DiskBBQ] Make centroid oversampling depend on the visit ratio,iverase,2025-09-01T14:18:49Z,2025-09-02T15:05:09+00:00,9,24.77,True,14,9,2,430,1,3,4,MERGED
133941,OTLP: reuse hasher for creating _metric_names_hash,felixbarny,2025-09-01T14:05:30Z,2025-09-02T07:14:35+00:00,1,17.15,True,6,4,3,115,1,0,1,MERGED
133938,Bump asm to 9.8 for JDK 25 support in remaining places,mosche,2025-09-01T13:42:25Z,2025-09-01T14:54:51+00:00,1,1.21,True,5,5,3,103,2,0,2,MERGED
133937,Fix FwC test task registration,jozala,2025-09-01T13:30:26Z,2025-09-03T06:27:24+00:00,5,40.95,True,47,19,5,259,4,3,7,MERGED
133936,Fix single project GetClusterState API response for multiproject,alexey-ivanov-es,2025-09-01T13:13:39Z,2025-09-10T10:29:42+00:00,9,213.27,True,197,88,8,427,1,10,11,MERGED
133930,[ML] Improve memory estimation methods accuracy in TrainedModelAssignmentRebalancer and related classes,valeriy42,2025-09-01T12:13:50Z,2025-09-03T12:44:15+00:00,8,48.51,True,89,4,5,306,2,2,4,MERGED
133929,Fix release tests after merging geogrid types,craigtaverner,2025-09-01T11:31:02Z,2025-09-01T16:23:49+00:00,2,4.88,True,38,28,2,197,1,1,2,MERGED
133928,Refactor enrich policy resolution,idegtiarenko,2025-09-01T11:16:44Z,2025-09-01T14:27:35+00:00,3,3.18,True,32,25,4,104,1,2,3,MERGED
133927,Unmute spatial parsing tests where the failure appears non-reproducible,craigtaverner,2025-09-01T10:10:50Z,2025-09-02T09:30:12+00:00,1,23.32,True,0,9,1,397,1,0,1,MERGED
133919,[ML] Fix double-counting of inference memory in the assignment rebalancer,valeriy42,2025-09-01T09:17:27Z,2025-09-03T12:45:06+00:00,4,51.46,True,6,7,2,607,3,1,4,MERGED
133916,[ML] Fix model assignment error handling and assignment explanation generation,valeriy42,2025-09-01T08:15:49Z,2025-09-09T11:16:02+00:00,11,195.0,True,23,101,7,313,2,3,5,MERGED
133915,rest-api-spec: mark search_mvt as stable,pquentin,2025-09-01T07:46:51Z,2025-09-01T09:36:20+00:00,1,1.82,True,1,1,1,139,2,0,2,MERGED
133914,rest-api-spec: mark search application as beta,pquentin,2025-09-01T07:39:41Z,2025-09-02T12:58:28+00:00,1,29.31,True,5,5,5,180,2,0,2,MERGED
133913,Implement max for exponential histograms,JonasKunz,2025-09-01T07:35:29Z,2025-09-02T09:25:25+00:00,6,25.83,True,309,73,16,105,1,4,5,MERGED
133912,Mark migrate_reindex APIs as public and stable,pquentin,2025-09-01T07:31:25Z,2025-09-05T07:14:38+00:00,1,95.72,True,8,8,4,0,4,0,4,MERGED
133907,OTLP: rest and transport action,felixbarny,2025-09-01T07:20:21Z,2025-09-06T11:38:27+00:00,6,124.3,True,548,17,4,125,1,4,5,MERGED
133906,OTLP: add support for summaries,felixbarny,2025-09-01T07:18:24Z,2025-09-02T13:29:28+00:00,8,30.18,True,146,11,7,53,1,2,3,MERGED
133905,OTLP: add mapping hints,felixbarny,2025-09-01T07:14:35Z,2025-09-01T12:45:48+00:00,4,5.52,True,227,14,6,586,1,2,3,MERGED
133904,Fix MemorySegmentES92PanamaInt7VectorsScorer for small dimensions,iverase,2025-09-01T07:07:58Z,2025-09-01T08:28:23+00:00,1,1.34,True,1,4,2,236,1,0,1,MERGED
133903,OTLP: determine target data stream based on attributes and scope name,felixbarny,2025-09-01T07:04:47Z,2025-09-02T12:09:10+00:00,14,29.07,True,483,31,10,263,2,10,12,MERGED
133902,OTLP: add support for histograms,felixbarny,2025-09-01T06:58:48Z,2025-09-09T12:18:02+00:00,18,197.32,True,1226,36,17,72,1,7,8,MERGED
133901,Model movements to nodes with no existing node stats,nicktindall,2025-09-01T06:51:51Z,2025-09-09T02:10:07+00:00,5,187.3,False,111,11,2,403,2,5,7,CLOSED
133899,OTLP: ignore duplicate metric data points,felixbarny,2025-09-01T06:25:34Z,2025-09-02T10:37:40+00:00,5,28.2,True,75,30,3,117,1,2,3,MERGED
133898,OTLP: create metric documents,felixbarny,2025-09-01T06:13:46Z,2025-09-01T10:01:48+00:00,1,3.8,True,390,27,6,59,1,0,1,MERGED
133897,Runtime fields: pass down runtime field name as source filter when source mode is synthetic,martijnvg,2025-09-01T05:49:40Z,2025-09-04T06:12:42+00:00,5,72.38,True,373,22,27,139,3,3,6,MERGED
133896,Use the last good NodeUsageStatsForThreadPools when a node returns an error,nicktindall,2025-09-01T04:06:35Z,2025-09-10T23:09:44+00:00,26,235.05,True,210,9,4,485,5,13,18,MERGED
133895,Add support for Apache HTTP client 5 in X-Pack SSL,tvernum,2025-09-01T01:42:14Z,2025-09-08T04:47:37+00:00,2,171.09,True,1026,185,43,178,1,1,2,MERGED
133894,Account for simulated utilization threshold in WriteLoadConstraintDeciderIT,nicktindall,2025-09-01T00:25:37Z,2025-09-03T03:11:31+00:00,8,50.77,True,30,13,3,340,1,5,6,MERGED
133892,"Fix Typo ""using using"" in RLIKE/LIKE docs",nicpenning,2025-08-31T17:22:35Z,2025-09-08T18:09:39+00:00,1,192.78,True,1,1,1,19,10,0,10,MERGED
133866,"Random grouping, random agg test",pabloem,2025-08-30T00:04:59Z,2025-09-03T20:41:59+00:00,2,116.62,True,173,72,2,453,1,0,1,MERGED
133862,Update transport version docs,JVerwolf,2025-08-29T21:04:41Z,2025-09-11T20:57:42+00:00,24,311.88,True,109,99,1,141,7,19,26,MERGED
133861,[ML] Implementing latency improvements for EIS integration,jonathan-buttner,2025-08-29T21:03:33Z,2025-09-09T13:44:29+00:00,7,256.68,True,223,89,12,604,2,7,9,MERGED
133860,[ML] Cache Inference Endpoints,prwhelan,2025-08-29T20:50:30Z,2025-09-10T16:46:36+00:00,10,283.94,True,938,146,23,744,2,12,14,MERGED
133855,Test:nit incremental bulk missing content,mhl-b,2025-08-29T19:32:04Z,2025-09-04T20:33:19+00:00,2,145.02,True,18,14,1,101,3,0,3,MERGED
133853,Increment expected ESQL function count,jordan-powers,2025-08-29T18:53:15Z,2025-09-02T06:47:34+00:00,2,83.91,True,1,10,2,221,1,0,1,MERGED
133849,Refactor transport version constants into new file system,jdconrad,2025-08-29T18:15:33Z,2025-08-29T21:44:59+00:00,2,3.49,True,377,585,287,155,3,1,4,MERGED
133848,Delay S3 repo warning if default region absent,DaveCTurner,2025-08-29T17:42:18Z,2025-09-01T08:36:32+00:00,1,62.9,True,290,70,10,463,5,0,5,MERGED
133847,Add a new vectorize ES91OSQVectorsScorer in case there is no MMAP,iverase,2025-08-29T17:32:25Z,2025-09-02T15:00:02+00:00,2,93.46,True,630,42,5,3445,2,0,2,MERGED
133846,Adding `_meta.template_version` to kibana reporting mappings,pmuellr,2025-08-29T17:31:20Z,2025-09-02T18:02:16+00:00,1,96.52,True,4,1,2,1507,4,0,4,MERGED
133845,[ML] Disable EIS rate limiting within the inference API,jonathan-buttner,2025-08-29T17:29:14Z,2025-09-03T20:56:31+00:00,8,123.45,True,655,181,21,1346,1,6,7,MERGED
133844,Migrate transport versions for 9.2,jdconrad,2025-08-29T17:27:38Z,2025-08-29T22:48:46+00:00,1,5.35,True,19,13,7,50,1,0,1,MERGED
133839,Alternate approach to speed up ignored_source access,jordan-powers,2025-08-29T16:50:42Z,2025-09-05T18:53:03+00:00,1,170.04,True,575,482,18,1083,2,1,3,MERGED
133838,ESQL: Simply reenable a disabled test,bpintea,2025-08-29T16:42:26Z,2025-08-29T18:32:07+00:00,1,1.83,True,0,3,1,553,2,0,2,MERGED
133834,Add `LinkedProjectConfigService` with `ClusterSettings` implementation,JeremyDahlgren,2025-08-29T15:40:10Z,2025-09-09T18:34:57+00:00,11,266.91,True,594,229,36,703,1,12,13,MERGED
133833,Fix missing position offset in lossy sum of doubles,dnhatn,2025-08-29T15:38:07Z,2025-08-29T16:47:21+00:00,1,1.15,True,2,11,2,138,1,0,1,MERGED
133832,Index expression rewriter,piergm,2025-08-29T15:18:21Z,2025-09-15T14:57:46+00:00,12,407.66,False,515,1,6,749,1,18,19,CLOSED
133831,Reconciles the Roles page,yetanothertw,2025-08-29T15:06:51Z,2025-09-03T08:10:08+00:00,4,113.05,True,25,10,1,707,3,9,12,MERGED
133830,PoC: Pluggable node stats,szybia,2025-08-29T15:03:37Z,2025-09-17T09:52:06+00:00,9,450.81,False,311,11,23,2666,1,9,10,CLOSED
133821,Remove redundant switch on enum,not-napoleon,2025-08-29T13:52:01Z,2025-09-02T14:26:30+00:00,2,96.57,True,35,67,1,393,1,0,1,MERGED
133819,Mark user profile APIs as public,pquentin,2025-08-29T13:26:54Z,2025-09-05T07:15:56+00:00,2,161.82,True,7,7,7,260,3,0,3,MERGED
133814,rest-api-spec: update connector visibility/stability,pquentin,2025-08-29T13:08:50Z,2025-09-02T13:37:47+00:00,1,96.48,True,20,20,20,258,2,0,2,MERGED
133811,[Gradle] Fix test seed handling when running with cc,breskeby,2025-08-29T12:39:10Z,2025-09-04T14:14:41+00:00,11,145.59,True,141,39,11,214,4,8,12,MERGED
133810,Replaces links to the deduplicated/reconciled privileges page,yetanothertw,2025-08-29T12:25:01Z,2025-09-01T14:57:03+00:00,1,74.53,True,4,4,3,255,3,0,3,MERGED
133808,Add ES|QL SAMPLE to list the agg functions in docs,jan-elastic,2025-08-29T12:19:04Z,2025-08-29T13:51:36+00:00,1,1.54,True,4,0,2,0,3,0,3,MERGED
133807,Update ValuesSourceReaderOperatorTests for changes in Lucene,thecoop,2025-08-29T12:09:52Z,2025-09-01T09:13:44+00:00,1,69.06,True,1,7,2,53,1,0,1,MERGED
133806,ESQL - Add semantic_text support for knn function,carlosdelest,2025-08-29T11:40:50Z,2025-09-04T07:32:53+00:00,6,139.87,True,432,72,26,345,4,5,9,MERGED
133804,[ES|QL] Add a TS variation of GenerativeIT,limotova,2025-08-29T10:52:50Z,2025-09-18T19:16:17+00:00,21,488.39,True,398,10,7,271,5,9,14,MERGED
133793,[Sentinel One] - Fix Cannot execute ILM policy delete step,mohitjha-elastic,2025-08-29T09:00:54Z,2025-09-04T05:55:37+00:00,1,140.91,True,16,6,3,555,9,0,9,MERGED
133789,Allow private settings when system provided,felixbarny,2025-08-29T08:00:46Z,2025-09-11T13:56:17+00:00,13,317.93,True,253,36,8,796,4,11,15,MERGED
133788,Experiment with using tsdb doc values codec for _seq_no.,martijnvg,2025-08-29T07:58:03Z,2025-08-29T18:53:22+00:00,2,10.92,True,9,1,1,1475,5,0,5,MERGED
133785,ESQL: refine again the inlinestats unit test for release version,astefan,2025-08-29T07:09:36Z,2025-08-29T08:17:12+00:00,1,1.13,True,34,34,1,149,1,0,1,MERGED
133782,rest-api-spec: restore warning about internal use,pquentin,2025-08-29T06:55:11Z,2025-09-01T09:43:03+00:00,1,74.8,True,2,2,2,194,2,0,2,MERGED
133781,Fix testOptionalColumnAtATimeReaderWithSparseDocs,dnhatn,2025-08-29T06:41:29Z,2025-08-29T07:43:28+00:00,2,1.03,True,2,7,2,177,1,0,1,MERGED
133779,Speedup lossy sum with constant group,dnhatn,2025-08-29T03:46:09Z,2025-08-29T06:44:17+00:00,1,2.97,True,43,2,2,104,2,0,2,MERGED
133775,Remove Transfer-Encoding from HTTP request with no content,mhl-b,2025-08-29T00:03:36Z,2025-09-03T03:40:16+00:00,1,123.61,True,174,2,5,422,3,0,3,MERGED
133774,Fixed LogsIndexModeRollingUpgradeIT,Kubik42,2025-08-28T23:14:17Z,2025-08-29T20:36:24+00:00,4,21.37,True,236,238,5,5058,1,3,4,MERGED
133770,Increase local breaker reserve memory,dnhatn,2025-08-28T22:26:32Z,2025-08-29T05:46:32+00:00,1,7.33,True,2,2,1,869,2,0,2,MERGED
133769,Migrate the rest of the 9.2 transport versions to the new file system,jdconrad,2025-08-28T22:25:37Z,2025-08-29T17:30:59+00:00,2,19.09,False,173,116,58,90,1,1,2,CLOSED
133761,ESQL: Add url_decode function (#133494),mouhc1ne,2025-08-28T20:46:52Z,2025-09-02T13:08:26+00:00,4,112.36,True,634,75,19,96,3,6,9,MERGED
133760,ESQL: Add names to aggregator tests,nik9000,2025-08-28T20:22:41Z,2025-09-03T13:25:45+00:00,1,137.05,True,247,66,27,100,1,0,1,MERGED
133753,KNN Query visit_percentage,john-wagster,2025-08-28T19:26:37Z,2025-09-04T19:43:21+00:00,34,168.28,True,862,238,56,1006,9,28,37,MERGED
133752,Avoid stale enrich results after policy execution,joegallo,2025-08-28T18:40:03Z,2025-08-28T20:48:09+00:00,4,2.13,True,189,14,3,576,3,2,5,MERGED
133751,Run snyk check in periodic build for each development branch,breskeby,2025-08-28T17:42:46Z,2025-08-28T19:33:14+00:00,1,1.84,True,2,2,2,322,2,0,2,MERGED
133750,Forward port release notes for v8.18.6,elasticsearchmachine,2025-08-28T17:35:13Z,2025-08-29T07:40:01+00:00,1,14.08,True,53,0,2,80,2,0,2,MERGED
133749,[9.1] [DOCS] Fix indentation of dense vector lists (#133609),lcawl,2025-08-28T17:27:34Z,2025-08-29T15:07:48+00:00,1,21.67,True,3,14,1,185,2,0,2,MERGED
133748,Allow configure timeout in REST tests from sys props,dnhatn,2025-08-28T17:17:24Z,2025-09-09T02:17:52+00:00,1,273.01,True,3,0,1,481,1,0,1,MERGED
133745,Supporting more timestamp formats in `_text_structure/find_structure`,eyalkoren,2025-08-28T17:02:42Z,2025-09-02T13:09:15+00:00,3,116.11,True,414,7,10,154,3,2,5,MERGED
133744,Adds minor docs clarification,yetanothertw,2025-08-28T16:59:15Z,2025-08-29T08:42:44+00:00,3,15.72,True,3,2,1,85,2,2,4,MERGED
