number,title,author,createdAt,closedOrMergedAt,reviewsCount,hoursOpen,merged,additions,deletions,changedFiles,bodyLength,issueCommentsCount,reviewThreadsCount,interactionsCount,finalReviewState
135017,Update exception messages,joshua-adams-1,2025-09-18T15:59:43Z,2025-09-26T14:31:24+00:00,4,190.53,True,17,3,2,157,1,7,8,MERGED
135016,XContent parsing for DocStats and ShardFieldStats,kingherc,2025-09-18T15:52:17Z,2025-09-23T14:04:01+00:00,7,118.2,True,215,3,5,16,3,1,4,MERGED
135014,Use Explicit<> rather than Optional<> for Subobjects in ObjectMapper,romseygeek,2025-09-18T15:27:14Z,2025-09-19T08:33:40+00:00,1,17.11,True,119,117,13,175,2,0,2,MERGED
135013,Finalize release notes for v9.1.4 release,elasticsearchmachine,2025-09-18T15:15:09Z,2025-09-22T10:40:04+00:00,1,91.42,True,6,11,4,80,3,0,3,MERGED
135012,Bypass MMap arena grouping as this has caused issues with too many regions being mapped,benwtrent,2025-09-18T15:10:56Z,2025-09-19T22:51:49+00:00,1,31.68,True,43,5,4,678,9,0,9,MERGED
135011,ESQL: Handle right hand side of Inline Stats coming optimized with LocalRelation shortcut,astefan,2025-09-18T15:06:48Z,2025-09-26T06:36:28+00:00,4,183.49,True,123,19,8,1356,4,5,9,MERGED
135008,Change FailedToCommitClusterStateException to NotMasterException,joshua-adams-1,2025-09-18T14:39:44Z,2025-10-02T10:05:15+00:00,5,331.43,True,14,11,3,2532,2,3,5,MERGED
135000,Expand gpu support checks,ldematte,2025-09-18T13:28:35Z,2025-09-22T05:53:56+00:00,9,88.42,True,554,44,15,498,4,4,8,MERGED
134999,[ML] Fix YAML test to use correct query parameter type,pquentin,2025-09-18T12:30:10Z,2025-09-18T14:23:15+00:00,1,1.88,True,2,2,1,191,2,0,2,MERGED
134998,Cleanup esql session,idegtiarenko,2025-09-18T10:50:03Z,2025-09-19T07:13:18+00:00,9,20.39,True,108,92,6,110,1,6,7,MERGED
134992,Replace PatternTokenizer with a CharTokenizer,martijnvg,2025-09-18T09:15:38Z,2025-09-19T08:34:43+00:00,1,23.32,True,29,10,1,61,1,0,1,MERGED
134987,[8.19] Add missing common cat params (#134870),pquentin,2025-09-18T09:08:07Z,2025-09-19T10:13:54+00:00,1,25.1,True,323,0,18,171,0,0,0,MERGED
134986,[9.1] Add missing common cat params (#134870),pquentin,2025-09-18T09:06:30Z,2025-09-19T10:13:31+00:00,1,25.12,True,325,2,18,170,0,0,0,MERGED
134985,[Transform] Decrease loglevel (ERROR -> WARN) of 3 transform-related error messages,przemekwitek,2025-09-18T09:03:25Z,2025-09-18T12:00:59+00:00,5,2.96,True,3,3,2,294,1,1,2,MERGED
134982,OTLP: optimize _tsid creation,felixbarny,2025-09-18T08:53:38Z,2025-09-23T11:04:57+00:00,9,122.19,True,279,302,9,456,1,4,5,MERGED
134980,Document multi index query support for simplified retrievers,ioanatia,2025-09-18T08:19:34Z,2025-09-18T15:01:41+00:00,6,6.7,True,4,4,2,233,4,3,7,MERGED
134979,Fix bug in tsdb doc value codec,martijnvg,2025-09-18T07:57:04Z,2025-09-18T18:06:52+00:00,2,10.16,True,127,42,3,554,3,1,4,MERGED
134973,Add startsWith and regionMatches to SecureString,tvernum,2025-09-18T05:01:18Z,2025-09-19T04:28:30+00:00,2,23.45,True,170,2,2,340,1,1,2,MERGED
134971,Fix typo in feature flag,parkertimmins,2025-09-18T01:41:35Z,2025-09-18T06:32:21+00:00,1,4.85,True,1,3,2,14,6,0,6,MERGED
134966,Cutover to the new transport version system,rjernst,2025-09-17T23:06:28Z,2025-09-19T23:25:29+00:00,2,48.32,True,82,87,30,175,1,0,1,MERGED
134965,Delta and increase together ,pabloem,2025-09-17T22:15:08Z,2025-09-19T04:51:40+00:00,1,30.61,False,870,55,13,182,1,1,2,CLOSED
134964,[ES|QL] Use Double.BYTES instead of Long in double encoder,limotova,2025-09-17T22:11:25Z,2025-09-18T00:23:25+00:00,1,2.2,True,1,1,1,158,1,0,1,MERGED
134963,[Transform] Fix Missing Config Errors,prwhelan,2025-09-17T21:45:05Z,2025-09-24T19:47:58+00:00,3,166.05,True,334,73,14,520,3,3,6,MERGED
134960,[ML] Adding custom headers support openai text embeddings,jonathan-buttner,2025-09-17T20:54:09Z,2025-09-23T14:23:36+00:00,11,137.49,True,554,584,20,445,2,12,14,MERGED
134957,Bump FLEET_AGENTS_MAPPINGS_VERSION so the new mapping applies on upgrades,michel-laterman,2025-09-17T20:40:40Z,2025-09-23T14:47:54+00:00,1,138.12,True,1,1,1,181,2,0,2,MERGED
134956,Allow semantic queries to gather inference results on remote clusters,Mikep86,2025-09-17T20:30:49Z,2025-09-19T12:15:49+00:00,25,39.75,True,418,127,12,884,3,11,14,MERGED
134955,[Transform] Wait for PIT to close,prwhelan,2025-09-17T20:26:53Z,2025-09-18T14:07:28+00:00,1,17.68,True,63,21,5,119,3,0,3,MERGED
134954,Update api specs for search and async_search to match changes in #134240,quux00,2025-09-17T20:26:19Z,2025-09-18T04:17:50+00:00,1,7.86,True,8,0,2,0,1,0,1,MERGED
134953,Mark the create-index-from-source action as publicly available on Serverless,dakrone,2025-09-17T20:14:51Z,2025-09-18T15:19:20+00:00,1,19.07,True,3,0,1,244,1,0,1,MERGED
134952,ESQL: Enable Lookup Join on Expression Tech Preview,julian-elastic,2025-09-17T20:03:25Z,2025-09-23T13:56:10+00:00,9,137.88,True,34,17,5,146,5,4,9,MERGED
134951,ESQL: Replace function count tests,nik9000,2025-09-17T19:56:26Z,2025-09-21T21:58:53+00:00,4,98.04,True,18,6,2,462,1,1,2,MERGED
134945,[ML] Do not convert input Strings to ChunkInferenceInput unless necessary,DonalEvans,2025-09-17T19:20:00Z,2025-09-17T20:40:06+00:00,1,1.33,True,14,12,2,343,2,0,2,MERGED
134942,ESQL: Add telemetry support for Lookup Join On Expression,julian-elastic,2025-09-17T18:44:05Z,2025-09-19T12:38:40+00:00,2,41.91,True,259,169,5,208,2,0,2,MERGED
134941,DLM: Better `max_age` rollover for tiny retentions,szybia,2025-09-17T18:42:16Z,2025-09-18T18:07:59+00:00,4,23.43,True,119,4,5,49,3,1,4,MERGED
134936,Fixing conditional processor mutability bugs,masseyke,2025-09-17T18:32:10Z,2025-09-18T13:16:09+00:00,1,18.73,True,120,17,3,440,2,0,2,MERGED
134935,ESQL: More code gen standardization,nik9000,2025-09-17T18:27:37Z,2025-09-19T21:27:17+00:00,2,50.99,True,2090,1253,245,717,1,0,1,MERGED
134934,Increase timeseries function,pabloem,2025-09-17T18:27:24Z,2025-09-19T05:45:55+00:00,5,35.31,True,584,48,12,0,2,3,5,MERGED
134933,[ML] Add ContextualAI inference service,pedrocassalpacheco,2025-09-17T17:55:05Z,2025-09-26T10:49:15+00:00,8,208.9,True,1468,1,21,3047,7,6,13,MERGED
134932,Fix inline stats remote caps,dnhatn,2025-09-17T17:04:30Z,2025-09-17T21:35:47+00:00,2,4.52,True,1,1,1,75,1,0,1,MERGED
134926,Fixes testSnapshotShutdownProgressTracker,joshua-adams-1,2025-09-17T16:15:44Z,2025-09-25T08:32:10+00:00,3,184.27,True,17,19,2,1766,6,0,6,MERGED
134923,Add XPath to XmlUtils,joegallo,2025-09-17T15:42:13Z,2025-09-18T13:42:33+00:00,1,22.01,True,20,5,3,478,2,0,2,MERGED
134910,Update bundled JDK to 25,mosche,2025-09-17T14:45:47Z,2025-09-19T12:17:06+00:00,13,45.52,True,34,14,12,107,10,3,13,MERGED
134901,Add release notes for v8.19.4 release,elasticsearchmachine,2025-09-17T13:23:49Z,2025-09-22T11:03:52+00:00,1,117.67,True,3,0,1,80,2,0,2,MERGED
134900,Remove track_live_docs_in_memory_bytes feature flag,martijnvg,2025-09-17T13:03:44Z,2025-09-19T15:00:53+00:00,1,49.95,True,106,87,5,0,1,0,1,MERGED
134899,[ML] Filter out shutting down nodes from the zone mapper,davidkyle,2025-09-17T12:34:27Z,2025-09-22T13:34:45+00:00,5,121.0,True,37,67,7,1051,1,8,9,MERGED
134898,[DOCS] Marks the change point agg as GA,szabosteve,2025-09-17T12:30:24Z,2025-09-25T12:09:47+00:00,2,191.66,True,3,16,1,67,3,1,4,MERGED
134896,Remove implementation of set compatible versions task,rjernst,2025-09-17T12:21:19Z,2025-09-17T15:38:25+00:00,1,3.29,True,0,88,2,182,2,0,2,MERGED
134894,[Cyera] - Fix Cannot execute ILM policy delete step,muskan-agarwal26,2025-09-17T12:02:20Z,2025-09-26T05:52:47+00:00,2,209.84,True,16,4,3,509,16,0,16,MERGED
134893,Add trust configuration for cross cluster api keys,jfreden,2025-09-17T12:00:19Z,2025-09-26T08:33:51+00:00,5,212.56,True,1225,607,32,707,2,11,13,MERGED
134887,Avoid holding references to SearchExecutionContext in SourceConfirmedTextQuery,romseygeek,2025-09-17T11:01:26Z,2025-09-17T14:57:06+00:00,1,3.93,True,7,2,2,494,4,0,4,MERGED
134881,ES|QL: Make kibana docs for Query settings more consistent,luigidellaquila,2025-09-17T09:18:30Z,2025-09-17T10:19:07+00:00,1,1.01,True,2,2,2,87,2,0,2,MERGED
134880,Updates the Roles page title,yetanothertw,2025-09-17T09:17:38Z,2025-09-17T15:13:21+00:00,1,5.93,True,1,1,1,143,3,0,3,MERGED
134879,Throw 4xx instead of 5xx for ESQL malformed query params,pmpailis,2025-09-17T09:11:24Z,2025-09-23T11:02:53+00:00,1,145.86,True,38,0,3,175,3,0,3,MERGED
134877,[KQL] Refactored the field filter value grammar,afoucret,2025-09-17T08:45:13Z,2025-09-17T12:40:22+00:00,1,3.92,True,573,325,14,309,2,2,4,MERGED
134871,Remove `SizeValue`,DaveCTurner,2025-09-17T07:34:21Z,2025-09-17T09:53:54+00:00,3,2.33,True,15,307,10,317,1,3,4,MERGED
134870,Add missing common cat params,DaveCTurner,2025-09-17T07:12:20Z,2025-09-18T08:33:48+00:00,1,25.36,True,323,0,18,48,5,0,5,MERGED
134869,Add streams YAML tests to rest-resources-zip,pquentin,2025-09-17T06:59:57Z,2025-09-19T11:37:31+00:00,1,52.63,True,4,3,3,190,4,0,4,MERGED
134864,Unmute rate tests,dnhatn,2025-09-17T06:36:11Z,2025-09-17T08:35:15+00:00,1,1.98,True,0,15,1,74,1,0,1,MERGED
134862,[Test] Remove nonexistent balance settings in tests,ywangd,2025-09-17T06:29:02Z,2025-09-17T08:32:38+00:00,1,2.06,True,0,8,3,133,1,0,1,MERGED
134861,Fix and unmute testIndexSettingProviderPrivateSetting,felixbarny,2025-09-17T06:22:02Z,2025-09-18T08:57:25+00:00,1,26.59,True,2,5,2,2197,1,0,1,MERGED
134857,Fix rate tests,dnhatn,2025-09-17T05:12:29Z,2025-09-17T06:19:55+00:00,1,1.12,True,9,15,6,293,1,0,1,MERGED
134852,Fix mergeExecutorThreadCount in ThreadPoolMergeExecutorServiceDiskSpaceTests,lkts,2025-09-16T21:53:29Z,2025-09-17T16:56:04+00:00,1,19.04,True,1,1,1,124,2,0,2,MERGED
134851,Remove ingest conditionals _type deprecation warning,joegallo,2025-09-16T21:50:09Z,2025-09-17T15:50:25+00:00,7,18.0,True,6,67,3,1930,3,1,4,MERGED
134843,Fix cross cluster test to use system agnostic path,rjernst,2025-09-16T21:03:08Z,2025-09-16T23:17:51+00:00,1,2.25,True,4,3,1,126,1,0,1,MERGED
134842,Make resolve conflict in transport version its own task,rjernst,2025-09-16T20:47:53Z,2025-09-16T23:20:45+00:00,2,2.55,True,112,84,5,145,4,1,5,MERGED
134836,Fix release tests for chunk-rescorer tests behind feature flag,kderusso,2025-09-16T19:10:47Z,2025-09-16T20:37:18+00:00,1,1.44,True,1,1,1,64,1,0,1,MERGED
134835,Add new `/_security/stats` endpoint,szybia,2025-09-16T19:10:27Z,2025-09-22T18:54:12+00:00,4,143.73,True,356,3,17,1160,3,1,4,MERGED
134834,Rename patterned_text to pattern_text,parkertimmins,2025-09-16T18:45:19Z,2025-09-17T20:54:17+00:00,3,26.15,True,329,334,37,164,1,2,3,MERGED
134831,"Add tests where patterned_text is nested in object, nested, and passthrough objects",parkertimmins,2025-09-16T17:54:34Z,2025-09-16T19:00:07+00:00,2,1.09,True,263,0,1,184,1,0,1,MERGED
134827,ESQL: Rename command from INLINESTATS to INLINE STATS,bpintea,2025-09-16T17:28:03Z,2025-09-18T15:16:46+00:00,5,45.81,True,3531,3231,62,146,4,3,7,MERGED
134822,Support querying multiple indices with the simplified RRF retriever,ioanatia,2025-09-16T16:31:49Z,2025-09-18T08:02:13+00:00,5,39.51,True,412,44,5,426,2,2,4,MERGED
134820,[DOCS] [ESQL] Clean up ESQL enrich landing page,leemthompo,2025-09-16T15:57:26Z,2025-09-17T10:25:50+00:00,1,18.47,True,31,29,1,245,4,0,4,MERGED
134816,Adding a getUnmodifiableSourceAndMetadata() method to IngestDocument,masseyke,2025-09-16T14:44:05Z,2025-09-18T15:52:42+00:00,4,49.14,True,462,409,3,641,2,2,4,MERGED
134815,Finalize release notes for v9.0.7 release,elasticsearchmachine,2025-09-16T14:42:46Z,2025-09-17T13:28:33+00:00,1,22.76,True,2,11,4,80,3,0,3,MERGED
134812,Store the raw format name for DiskBBQ in field metadata,thecoop,2025-09-16T14:17:15Z,2025-09-20T14:33:48+00:00,5,96.28,True,77,15,5,168,7,2,9,MERGED
134802,docs: link Analyze API & Text analysis from match query page,Username46786,2025-09-16T12:31:30Z,2025-09-27T12:03:35+00:00,2,263.53,False,3,1,1,364,5,1,6,CLOSED
134801,[9.0] Reenable Index Compatibility BWC Tests,tlrx,2025-09-16T12:07:44Z,2025-09-16T15:26:21+00:00,1,3.31,True,1,3,1,206,1,0,1,MERGED
134800,[9.1] Reenable Index Compatibility BWC Tests,tlrx,2025-09-16T11:36:34Z,2025-09-16T15:25:51+00:00,1,3.82,True,1,0,1,157,1,0,1,MERGED
134799,Retrievers: Refactor retriever builder tests,ioanatia,2025-09-16T11:10:51Z,2025-09-16T15:20:55+00:00,12,4.17,True,282,305,3,447,1,6,7,MERGED
134798,Add relevant attributes to shard search latency APM metrics,javanna,2025-09-16T11:10:16Z,2025-09-23T09:20:43+00:00,4,166.17,True,285,93,5,1255,2,2,4,MERGED
134795,Expand Javadoc for `SnapshotsInProgress`,DaveCTurner,2025-09-16T10:05:36Z,2025-09-17T08:44:24+00:00,1,22.65,True,10,1,1,0,1,0,1,MERGED
134790,Bug fix: Facilitate second retrieval of the same value (#134770),gmarouli,2025-09-16T09:23:59Z,2025-09-17T14:36:01+00:00,5,29.2,True,103,15,5,399,3,4,7,MERGED
134788,Add BytesStreamOutputTests,joshua-adams-1,2025-09-16T09:18:47Z,2025-10-02T08:26:46+00:00,2,383.13,True,179,0,1,326,1,2,3,MERGED
134787,Remove use_lucene101 feature flag left over.,martijnvg,2025-09-16T09:15:14Z,2025-09-17T07:58:45+00:00,1,22.73,True,0,5,5,0,1,0,1,MERGED
134786,Add an option to return early from an allocate call,ywangd,2025-09-16T09:04:37Z,2025-09-19T02:13:07+00:00,15,65.14,True,256,18,5,291,4,11,15,MERGED
134785,Add remote cluster security SPI extension,slobodanadamovic,2025-09-16T08:21:38Z,2025-09-25T21:36:31+00:00,18,229.25,True,784,80,23,420,1,10,11,MERGED
134784,Reenable Index Compatibility BWC Tests,tlrx,2025-09-16T08:19:58Z,2025-09-16T15:24:57+00:00,4,7.08,True,22,0,3,112,3,1,4,MERGED
134783,Support recording index resolution results on `IndicesRequest`,n1v0lg,2025-09-16T08:02:20Z,2025-09-19T09:47:09+00:00,4,73.75,True,126,1,3,639,1,3,4,MERGED
134778,ES|QL: project_routing validation and Kibana docs,luigidellaquila,2025-09-16T07:55:46Z,2025-09-17T09:05:25+00:00,9,25.16,True,226,0,5,410,2,3,5,MERGED
134777,[ES|QL] Fix assertion error after inference resolution.,afoucret,2025-09-16T07:14:57Z,2025-09-17T15:28:35+00:00,4,32.23,True,40,29,2,169,3,1,4,MERGED
134776,Unify Authentication.newCloudAuthentication,tvernum,2025-09-16T06:55:57Z,2025-09-17T06:23:01+00:00,3,23.45,True,62,18,3,388,1,1,2,MERGED
134775,[DOCS]: Add connector release notes for 9.1.4,charlotte-hoblik,2025-09-16T06:49:11Z,2025-09-17T13:02:27+00:00,1,30.22,True,5,0,1,77,3,0,3,MERGED
134774,[DOCS]: Add connectors release notes for 9.0.7,charlotte-hoblik,2025-09-16T06:43:45Z,2025-09-16T08:01:05+00:00,1,1.29,True,5,0,1,77,1,0,1,MERGED
134773,[DOCS]: Add connectors release notes for 8.19.4,charlotte-hoblik,2025-09-16T06:35:59Z,2025-09-17T13:02:17+00:00,1,30.44,True,11,0,1,78,2,0,2,MERGED
134772,[DOCS]: Add connectors release notes for 8.18.7,charlotte-hoblik,2025-09-16T06:31:38Z,2025-09-16T08:45:35+00:00,1,2.23,True,11,0,1,78,2,0,2,MERGED
134768,Enable TS command in non-snapshot builds,dnhatn,2025-09-16T01:38:51Z,2025-09-18T03:59:30+00:00,9,50.34,True,2349,2681,55,282,5,5,10,MERGED
134767,Return slice and future timestamp in time-series source,dnhatn,2025-09-16T00:13:50Z,2025-09-16T06:17:53+00:00,2,6.07,True,385,81,19,665,3,1,4,MERGED
134766,Adding the shell of the SamplingService,masseyke,2025-09-15T22:49:51Z,2025-09-18T17:34:21+00:00,6,66.74,True,360,39,13,380,2,3,5,MERGED
134764,Unmute patterned_text integration tests,jordan-powers,2025-09-15T22:45:07Z,2025-09-16T16:04:00+00:00,1,17.31,True,0,12,1,187,1,0,1,MERGED
134754,Tighten asserts in FullClusterRestartSystemIndexCompatibilityIT and provide more context for failures,lkts,2025-09-15T20:39:42Z,2025-09-16T21:39:14+00:00,2,24.99,True,10,4,1,300,1,1,2,MERGED
134753,"Support bulk reading doc values for byte, short and integer field types.",martijnvg,2025-09-15T20:31:29Z,2025-09-17T13:33:07+00:00,8,41.03,True,521,41,14,122,1,6,7,MERGED
134747,Fix vector rehydration from _source during concurrent query phase,jimczi,2025-09-15T20:23:26Z,2025-09-16T16:05:09+00:00,4,19.7,True,28,16,4,372,2,1,3,MERGED
134745,Increment ESQL expected function count,jordan-powers,2025-09-15T19:36:22Z,2025-09-15T21:36:13+00:00,1,2.0,True,1,1,1,227,3,0,3,MERGED
134744,Patterned text conditionally disable templating,jordan-powers,2025-09-15T19:07:17Z,2025-09-17T14:27:33+00:00,3,43.34,True,121,25,5,175,1,1,2,MERGED
134743,[CI] Add missing support for skip-target-branches,brianseeders,2025-09-15T18:59:26Z,2025-09-15T21:25:40+00:00,1,2.44,True,87,0,5,125,3,0,3,MERGED
134742,ESQL: Log more on GenerativeIt failure,nik9000,2025-09-15T18:52:34Z,2025-09-16T13:05:59+00:00,1,18.22,True,4,0,2,169,1,0,1,MERGED
134741,Added no-op support for project_routing query param to REST endpoints that will support cross-project search,quux00,2025-09-15T18:38:14Z,2025-09-19T14:13:52+00:00,4,91.59,True,171,17,30,173,1,1,2,MERGED
134740,Unmute JULBridgeTests,jdconrad,2025-09-15T18:30:40Z,2025-09-22T20:08:39+00:00,1,169.63,False,0,3,1,82,1,0,1,CLOSED
134739,Fix transport version tests on windows,rjernst,2025-09-15T18:12:23Z,2025-09-17T18:39:34+00:00,1,48.45,True,8,3,2,501,2,0,2,MERGED
134737,Data Streams Stats action only on searchable nodes,kingherc,2025-09-15T16:54:21Z,2025-09-17T16:24:35+00:00,4,47.5,True,15,9,3,16,2,3,5,MERGED
134735,SearchService - don't log warnings when service is stopped or closed - additional comment,carlosdelest,2025-09-15T16:43:49Z,2025-09-16T07:33:26+00:00,1,14.83,True,3,1,1,73,2,0,2,MERGED
134734,Only run cleanup if patterned_text is enabled,parkertimmins,2025-09-15T16:42:24Z,2025-09-15T21:20:54+00:00,3,4.64,True,5,1,2,550,1,1,2,MERGED
134733,Make transport version comments parsable,jdconrad,2025-09-15T16:40:06Z,2025-09-16T19:36:18+00:00,4,26.94,True,22,2,2,116,2,1,3,MERGED
134731,Changes visibility of RemoteClusterAware.groupClusterIndices,piergm,2025-09-15T14:46:43Z,2025-09-16T15:38:45+00:00,1,24.87,False,6,1,2,0,2,1,3,CLOSED
134729,Fix release tests for chunk-rescorer tests behind feature flag,kderusso,2025-09-15T14:20:46Z,2025-09-16T16:40:14+00:00,1,26.32,True,2,1,1,82,2,0,2,MERGED
134727,ESQL: Drop old serialization,nik9000,2025-09-15T14:15:30Z,2025-09-17T18:29:26+00:00,3,52.23,True,229,773,67,169,1,3,4,MERGED
134725,[8.18] Propagates filter() to aggregation functions' surrogates (#134461),ncordon,2025-09-15T13:53:15Z,2025-09-18T07:53:02+00:00,1,66.0,True,219,11,11,198,0,0,0,MERGED
134724,[8.19] Propagates filter() to aggregation functions' surrogates (#134461),ncordon,2025-09-15T13:48:49Z,2025-09-18T07:53:54+00:00,1,66.08,True,243,12,11,198,0,0,0,MERGED
134722,[9.0] Propagates filter() to aggregation functions' surrogates (#134461),ncordon,2025-09-15T13:40:41Z,2025-09-18T07:54:31+00:00,1,66.23,True,224,12,11,197,0,0,0,MERGED
134721,[9.1] Propagates filter() to aggregation functions' surrogates (#134461),ncordon,2025-09-15T13:33:16Z,2025-09-18T07:55:17+00:00,1,66.37,True,244,12,11,197,0,0,0,MERGED
134719,Silence time zone ID deprecation warning for JDK 25 due to log4j2 bug.,mosche,2025-09-15T12:25:54Z,2025-09-18T16:04:06+00:00,3,75.64,True,9,4,1,361,3,1,4,MERGED
134717,Allow including semantic field embeddings in _source,jimczi,2025-09-15T11:13:35Z,2025-09-18T07:41:51+00:00,7,68.47,True,458,106,16,312,5,4,9,MERGED
134716,Fix `testFailIfAlreadyExists`,DaveCTurner,2025-09-15T10:27:46Z,2025-09-16T07:38:15+00:00,1,21.17,True,46,36,2,217,1,0,1,MERGED
134711,Add Reason field to elastic-agent upgrade details metadata,pchila,2025-09-15T10:02:29Z,2025-09-15T19:56:28+00:00,2,9.9,True,15,1,3,533,13,0,13,MERGED
134707,Improvements for inference ModelStatsTest,dimitris-athanasiou,2025-09-15T08:56:55Z,2025-09-15T15:40:45+00:00,1,6.73,True,27,4,1,102,1,0,1,MERGED
134705,ES|QL: Add example for decay,ioanatia,2025-09-15T07:32:12Z,2025-09-15T08:42:09+00:00,3,1.17,True,20,4,4,24,4,0,4,MERGED
134704,Expose ClusterInfoService via AllocationService,ywangd,2025-09-15T06:33:36Z,2025-09-16T08:11:48+00:00,2,25.64,True,4,0,1,17,1,0,1,MERGED
134701,ESQL: Always estimate size for types,nik9000,2025-09-14T15:43:07Z,2025-09-19T22:40:28+00:00,5,126.96,True,39,30,6,166,2,1,3,MERGED
134700,Simplify computation of resets in rate aggregation,dnhatn,2025-09-14T15:19:23Z,2025-09-15T17:01:09+00:00,5,25.7,True,312,428,4,81,2,2,4,MERGED
134696,ES|QL: refactor query generator and move it to testFixtures,luigidellaquila,2025-09-14T10:58:12Z,2025-09-19T09:29:22+00:00,1,118.52,True,424,273,29,160,4,1,5,MERGED
134693,Use doc_value based value fetcher for patterned_text,parkertimmins,2025-09-13T19:09:11Z,2025-09-17T22:06:08+00:00,6,98.95,True,131,23,3,385,1,5,6,MERGED
134689,Fixed a typo in the description for the combination type,ImadSaddik,2025-09-13T09:21:30Z,2025-09-15T08:51:55+00:00,1,47.51,True,1,1,1,201,4,0,4,MERGED
134686,Add release notes for v8.18.7 release,elasticsearchmachine,2025-09-13T00:17:26Z,2025-09-16T07:57:02+00:00,1,79.66,True,60,0,2,80,2,0,2,MERGED
134685,Add release notes for v8.19.4 release,elasticsearchmachine,2025-09-13T00:13:07Z,2025-09-17T13:03:34+00:00,1,108.84,True,79,0,2,80,2,0,2,MERGED
134684,Add release notes for v9.1.4 release,elasticsearchmachine,2025-09-13T00:08:51Z,2025-09-17T13:58:24+00:00,1,109.83,True,230,2,4,80,3,0,3,MERGED
134683,Add release notes for v9.0.7 release,elasticsearchmachine,2025-09-13T00:04:33Z,2025-09-16T07:55:33+00:00,1,79.85,True,247,76,4,80,3,0,3,MERGED
134682,Unmute testAckedIndexing to see if it still fails on main,bcully,2025-09-12T23:02:54Z,2025-09-18T16:35:02+00:00,1,137.54,True,0,3,1,155,3,0,3,MERGED
134673,[ML] Gracefully shutdown model deployment when node is removed from assignment routing,jonathan-buttner,2025-09-12T21:16:47Z,2025-09-25T13:32:47+00:00,4,304.27,True,74,16,3,1170,3,2,5,MERGED
134668,Move RCS settings-based test method to unit test,JeremyDahlgren,2025-09-12T19:33:16Z,2025-09-15T11:55:58+00:00,1,64.38,True,55,64,2,252,1,0,1,MERGED
134665,Fixed TextRollingUpgradeIT flaky runs,Kubik42,2025-09-12T18:54:06Z,2025-09-13T00:34:00+00:00,1,5.67,True,1,10,2,243,1,0,1,MERGED
134664,ESQL: Add example of regex REPLACE,nik9000,2025-09-12T18:42:15Z,2025-09-15T19:22:54+00:00,1,72.68,True,48,23,6,0,4,1,5,MERGED
134658,rest-api-spec: remove required: false for query parameters,pquentin,2025-09-12T17:11:12Z,2025-09-17T07:35:24+00:00,1,110.4,True,13,110,49,774,2,0,2,MERGED
134657,[DiskBBQ] modernize switch statements in DocIdsWriter,iverase,2025-09-12T17:00:15Z,2025-09-12T19:09:31+00:00,1,2.15,True,12,34,1,60,1,0,1,MERGED
134656,Fix deadlock in ThreadPoolMergeScheduler when a failing merge closes the IndexWriter,tlrx,2025-09-12T16:57:49Z,2025-09-22T07:31:33+00:00,26,230.56,True,679,36,7,973,7,16,23,MERGED
134649,Removing the logs stream feature flag,masseyke,2025-09-12T15:52:05Z,2025-09-12T18:52:37+00:00,1,3.01,True,24,134,10,275,1,0,1,MERGED
134648,Esql Fix bug with loading TS metadata,not-napoleon,2025-09-12T15:22:05Z,2025-09-16T11:50:52+00:00,9,92.48,True,196,13,9,314,3,7,10,MERGED
134645,Fix terms aggregation doc_count_error_upper_bound for already reduced results (batched query phase),benchaplin,2025-09-12T15:03:36Z,2025-09-30T16:59:01+00:00,5,433.92,True,22,21,4,1175,3,3,6,MERGED
134636,[Island Browser] - Fix Cannot execute ILM policy delete step,janvi-elastic,2025-09-12T14:04:51Z,2025-09-23T09:50:49+00:00,3,259.77,True,20,5,3,501,6,2,8,MERGED
134634,Extract inferece model stats into its own file,dimitris-athanasiou,2025-09-12T13:37:18Z,2025-09-13T13:50:48+00:00,2,24.23,True,159,102,6,282,3,3,6,MERGED
134630,[INFERENCE] Remove node pinning logic ,davidkyle,2025-09-12T12:12:09Z,2025-09-17T20:58:27+00:00,5,128.77,True,43,909,23,225,2,1,3,MERGED
134629,Improve block loader for source only runtime fields of type double.,martijnvg,2025-09-12T11:18:28Z,2025-09-12T16:16:38+00:00,4,4.97,True,172,28,6,110,3,2,5,MERGED
134628,Use modern Java pattern matching in QueryToFilterAdapter,romseygeek,2025-09-12T10:27:46Z,2025-09-12T16:13:52+00:00,1,5.77,True,16,16,1,0,2,0,2,MERGED
134625,Centralize telemetry listener wrapping in TransportSearchAction,javanna,2025-09-12T09:52:59Z,2025-09-15T13:12:36+00:00,14,75.33,True,150,112,3,883,2,9,11,MERGED
134621,ES|QL - Fix knn test,carlosdelest,2025-09-12T09:16:06Z,2025-09-12T11:57:53+00:00,1,2.7,True,8,8,1,168,1,0,1,MERGED
134617,Fix `HttpClientStatsTrackerTests#testToXContent`,DaveCTurner,2025-09-12T08:23:41Z,2025-09-12T13:26:54+00:00,1,5.05,True,29,11,2,213,2,0,2,MERGED
134609,Add 'SslProfileExtension' SPI interface,tvernum,2025-09-12T06:48:17Z,2025-09-23T01:46:03+00:00,6,258.96,True,415,53,17,409,2,5,7,MERGED
134607,Standardize Redact processor metadata field usage,jbaiera,2025-09-12T06:22:53Z,2025-09-12T19:34:57+00:00,3,13.2,True,115,30,4,416,1,1,2,MERGED
134606,If patterned_text length exceeds limit put in stored fields,parkertimmins,2025-09-12T03:25:02Z,2025-09-13T18:35:22+00:00,6,39.17,True,677,173,12,346,1,7,8,MERGED
134604,Adds certificate identity field to cross-cluster API keys,gmjehovich,2025-09-12T02:12:14Z,2025-10-03T08:49:45+00:00,18,510.63,True,1349,195,44,407,8,29,37,MERGED
134603,Merge old rate implementation to new implementation,dnhatn,2025-09-12T01:37:50Z,2025-09-12T04:49:46+00:00,1,3.2,True,2841,3779,14,340,2,0,2,MERGED
134597,Add more transport version validation cases,rjernst,2025-09-12T00:08:29Z,2025-09-17T19:23:56+00:00,5,139.26,True,136,85,8,204,2,2,4,MERGED
134591,[8.19] Fixed a bug where text fields in LogsDB indices did not use their keyword multi fields for block loading (#134253),Kubik42,2025-09-11T23:09:42Z,2025-09-12T17:49:45+00:00,1,18.67,True,907,140,20,246,0,0,0,MERGED
134590,Fill in missing transport version error message,rjernst,2025-09-11T22:44:26Z,2025-09-11T23:53:22+00:00,1,1.15,True,2,2,1,80,2,0,2,MERGED
134588,Document remote lookup join in 9.2,smalyshev,2025-09-11T22:28:04Z,2025-09-16T19:08:42+00:00,2,116.68,True,11,2,1,0,6,2,8,MERGED
134586,[ES|QL] Add rounding to stddev csv tests,limotova,2025-09-11T21:49:20Z,2025-09-15T19:44:52+00:00,2,93.93,True,49,35,4,195,4,1,5,MERGED
134585,Add classes to represent raw docs sampling configs,seanzatzdev,2025-09-11T21:48:57Z,2025-09-25T19:35:13+00:00,23,333.77,True,776,1,8,349,3,20,23,MERGED
134584,"[Test] Replace 0.0.0 version with ""detached"" property on ElasticsearchDistibution",jozala,2025-09-11T21:36:17Z,2025-10-03T11:13:46+00:00,20,517.62,True,256,105,38,1255,5,10,15,MERGED
