number,title,author,createdAt,closedOrMergedAt,reviewsCount,hoursOpen,merged,additions,deletions,changedFiles,bodyLength,issueCommentsCount,reviewThreadsCount,interactionsCount,finalReviewState
135459,Use supplier in `validateForReservedState`,nielsbauman,2025-09-25T17:06:24Z,2025-09-25T18:16:29+00:00,1,1.17,True,13,12,9,332,2,0,2,MERGED
135457,Skip data stream reference check in some cases,nielsbauman,2025-09-25T16:07:55Z,2025-10-01T15:21:43+00:00,8,143.23,True,45,9,1,1435,2,2,4,MERGED
135456,Fixing ReindexDatastreamIndexTransportActionIT.testTsdbStartEndSet to always provide index.routing_path,masseyke,2025-09-25T16:04:07Z,2025-09-25T17:45:04+00:00,1,1.68,True,1,7,2,195,1,0,1,MERGED
135448,ES|QL: Handle multi values in FUSE,ioanatia,2025-09-25T15:44:36Z,2025-09-26T08:45:46+00:00,3,17.02,True,386,130,15,635,1,2,3,MERGED
135447,[CI] Fix MergeWithFailureIT,tlrx,2025-09-25T15:08:18Z,2025-09-26T09:40:00+00:00,1,18.53,True,1,4,2,84,3,0,3,MERGED
135445,Remove obsolete --add-opens from JDK API extractor tool,mosche,2025-09-25T15:00:21Z,2025-09-26T09:41:46+00:00,1,18.69,True,0,22,1,152,1,0,1,MERGED
135444,Respect include/exclude patterns when applying `exclude_vectors`,jimczi,2025-09-25T14:47:59Z,2025-09-25T16:56:44+00:00,2,2.15,True,134,5,6,433,1,1,2,MERGED
135442,Renaming bulk vector scoring interfaces,benwtrent,2025-09-25T14:01:37Z,2025-09-25T18:14:45+00:00,3,4.22,True,10,10,4,106,1,1,2,MERGED
135435,[9.1] Fix DiscoveryDisruptionIT.testElectMasterWithLatestVersion (#135396),JeremyDahlgren,2025-09-25T13:12:10Z,2025-09-26T14:08:04+00:00,1,24.93,True,2,1,1,199,0,0,0,MERGED
135433,Properly guard assertion with feature flag,felixbarny,2025-09-25T11:49:21Z,2025-09-25T13:59:49+00:00,2,2.17,True,8,4,1,141,1,0,1,MERGED
135432,Avoid UOE when fetching the _inference metadata field,jimczi,2025-09-25T11:26:34Z,2025-09-25T13:28:13+00:00,1,2.03,True,45,5,2,152,1,0,1,MERGED
135431,[Downsampling++] Allow merging of passthrough mappers with object mappers under certain conditions.,gmarouli,2025-09-25T11:00:15Z,2025-09-30T07:56:26+00:00,2,116.94,True,219,14,7,695,5,1,6,MERGED
135426,[D0CS] Revise connector setup steps in documentation,leemthompo,2025-09-25T10:30:39Z,2025-09-25T12:32:18+00:00,1,2.03,True,3,1,1,159,3,0,3,MERGED
135424,Add Lucene99ScalarQuantizedVector classes removed in Lucene 10.4,thecoop,2025-09-25T10:00:34Z,2025-09-25T12:46:19+00:00,1,2.76,True,2073,5,6,0,1,1,2,MERGED
135419,ES|QL: do not use skip_unavailable in CPS,luigidellaquila,2025-09-25T09:42:19Z,2025-09-30T07:25:32+00:00,4,117.72,True,114,14,4,77,1,4,5,MERGED
135416,[9.1] Fixes testSnapshotShutdownProgressTracker (#134926),joshua-adams-1,2025-09-25T09:18:42Z,2025-09-25T15:19:22+00:00,1,6.01,True,17,19,2,1791,1,0,1,MERGED
135415,[9.0] Fixes testSnapshotShutdownProgressTracker (#134926),joshua-adams-1,2025-09-25T09:06:55Z,2025-09-25T15:19:11+00:00,1,6.2,True,17,16,1,1791,1,0,1,MERGED
135414,Change reindex to use ::es-redacted:: filtering,tvernum,2025-09-25T09:01:53Z,2025-09-26T02:35:47+00:00,2,17.57,True,267,47,5,438,4,1,5,MERGED
135403,ESQL: take INLINE STATS out of snapshot,astefan,2025-09-25T07:13:40Z,2025-09-26T05:39:50+00:00,1,22.44,True,2483,2494,22,0,3,1,4,MERGED
135402,Remove index.dimensions feature flag,felixbarny,2025-09-25T07:12:16Z,2025-09-29T15:38:16+00:00,1,104.43,True,19,50,6,76,5,0,5,MERGED
135401,OTLP: remove feature flag,felixbarny,2025-09-25T06:58:55Z,2025-09-25T08:15:37+00:00,1,1.28,True,7,20,3,106,2,0,2,MERGED
135396,Fix DiscoveryDisruptionIT.testElectMasterWithLatestVersion,JeremyDahlgren,2025-09-24T23:48:03Z,2025-09-25T12:28:30+00:00,1,12.67,True,2,4,2,344,4,0,4,MERGED
135395,Fixing docs and tests for timeseries no-longer-snapshot functions,pabloem,2025-09-24T22:13:32Z,2025-09-25T04:39:40+00:00,1,6.44,True,9,9,9,44,4,0,4,MERGED
135393,Improve block loader for source only runtime IP fields,Kubik42,2025-09-24T22:08:54Z,2025-09-26T17:55:52+00:00,2,43.78,True,219,40,5,18,3,1,4,MERGED
135392,Unmute ConcurrentSeqNoVersioningIT#testSeqNoCASLinearizability,lkts,2025-09-24T21:45:18Z,2025-09-26T15:39:43+00:00,2,41.91,True,0,3,1,103,2,0,2,MERGED
135391,Only validate upper bound of current branch on release branches,rjernst,2025-09-24T21:42:03Z,2025-09-25T18:01:41+00:00,1,20.33,True,30,5,2,306,2,0,2,MERGED
135386,Fixed a few typos in dense-vector.md,ImadSaddik,2025-09-24T20:42:16Z,2025-10-03T08:11:20+00:00,2,203.48,True,3,3,1,148,6,0,6,MERGED
135384,Fixing delta function,pabloem,2025-09-24T20:29:04Z,2025-09-25T04:39:21+00:00,1,8.17,True,20,30,5,41,1,0,1,MERGED
135382,[Build] update eclipse formatter used by spotless,breskeby,2025-09-24T20:21:54Z,2025-09-25T08:39:03+00:00,2,12.29,True,45,34,8,131,2,0,2,MERGED
135381,[Build] Update checkstyle from 10.3 to 11.0.1,breskeby,2025-09-24T19:50:53Z,2025-09-25T07:16:12+00:00,2,11.42,True,114,71,2,64,2,0,2,MERGED
135379,Avoid running resolve logic with no transport version name,rjernst,2025-09-24T18:41:52Z,2025-09-25T17:52:06+00:00,3,23.17,True,13,4,3,380,2,1,3,MERGED
135378,Validate Logstash pipeline ID when creating.,mashhurs,2025-09-24T17:56:17Z,2025-09-26T22:48:35+00:00,1,52.87,True,81,0,2,2442,2,0,2,MERGED
135375,ESQL: Fix flakiness in SessionUtilsTests,bpintea,2025-09-24T16:29:36Z,2025-09-26T08:33:09+00:00,2,40.06,True,35,36,2,73,2,1,3,MERGED
135374,Removed seqno_field_use_tsdb_doc_values_format feature flag,Kubik42,2025-09-24T16:27:44Z,2025-09-25T23:34:55+00:00,1,31.12,True,1,18,2,85,1,0,1,MERGED
135373,Improve block loader for source only runtime date fields,Kubik42,2025-09-24T15:49:47Z,2025-09-24T19:28:22+00:00,1,3.64,True,212,0,3,18,2,0,2,MERGED
135370,Remove pattern_text feature flag,jordan-powers,2025-09-24T15:24:41Z,2025-09-26T15:20:26+00:00,1,47.93,True,34,67,14,316,3,0,3,MERGED
135369,Revert #135052 #133630,pxsalehi,2025-09-24T15:23:48Z,2025-09-24T18:11:37+00:00,6,2.8,True,47,652,8,140,1,1,2,MERGED
135367,Refactor/disk bbq class movements,benwtrent,2025-09-24T14:56:12Z,2025-09-24T20:24:55+00:00,1,5.48,True,146,92,8,66,1,0,1,MERGED
135364,[ESQL] Add LLM usage warning for COMPLETION command,leemthompo,2025-09-24T14:20:51Z,2025-09-24T15:56:40+00:00,1,1.6,True,13,0,1,164,3,0,3,MERGED
135358,S2D1 - CPS Error handling,piergm,2025-09-24T13:36:41Z,2025-10-03T08:43:06+00:00,7,211.11,True,887,0,3,407,2,11,13,MERGED
135356,Add tests and docs for sum_over_time,kkrik-es,2025-09-24T13:25:54Z,2025-09-24T16:24:54+00:00,3,2.98,True,182,3,11,31,4,2,6,MERGED
135353,Simplify returnLocalAll handling in ES|QL,idegtiarenko,2025-09-24T13:14:46Z,2025-09-29T07:56:18+00:00,9,114.69,True,9,54,5,152,3,2,5,MERGED
135351,Set either index.dimensions or index.routing_path,felixbarny,2025-09-24T12:57:54Z,2025-09-24T13:59:04+00:00,1,1.02,True,89,40,5,142,1,0,1,MERGED
135350,[ML] Don't block thread while waiting for work to finish on graceful shutdown ,davidkyle,2025-09-24T12:57:31Z,2025-10-01T08:31:46+00:00,3,163.57,True,91,54,5,368,1,2,3,MERGED
135349,Add transport version docs clarification for serverless,rjernst,2025-09-24T12:56:25Z,2025-09-24T15:31:14+00:00,1,2.58,True,3,3,1,124,5,0,5,MERGED
135347,[Docs] Convert asciidoc lifecycle markers into Docs V3 syntax,florent-leborgne,2025-09-24T12:31:10Z,2025-09-25T08:02:48+00:00,1,19.53,True,59,54,14,292,3,0,3,MERGED
135346,Cross-project search index expression rewriting,n1v0lg,2025-09-24T12:25:06Z,2025-10-06T11:55:23+00:00,42,287.5,True,674,162,22,117,2,34,36,MERGED
135345,Remove Todo for exponential histogram merging optimization.,JonasKunz,2025-09-24T11:46:52Z,2025-09-29T14:39:57+00:00,1,122.88,True,10,5,1,18203,1,0,1,MERGED
135343,Add base classes for generic HNSW formats,thecoop,2025-09-24T11:05:00Z,2025-10-03T09:40:16+00:00,26,214.59,True,879,340,25,615,3,8,11,MERGED
135342,Add 'profile' support for knn query on HNSW with early termination,tteofili,2025-09-24T10:58:54Z,2025-09-25T13:29:15+00:00,3,26.51,True,250,93,10,310,3,2,5,MERGED
135341,Revert #135052 #133630,pxsalehi,2025-09-24T10:49:24Z,2025-09-24T16:25:47+00:00,1,5.61,True,47,652,8,140,1,0,1,MERGED
135339,ESQL: Make intermediate LocalRelation limit configurable,bpintea,2025-09-24T10:33:11Z,2025-09-26T15:07:06+00:00,3,52.57,True,106,129,24,178,2,2,4,MERGED
135337,Do not pass ProjectMetadata to lazy index permissions builder,jfreden,2025-09-24T09:26:29Z,2025-09-29T12:00:00+00:00,1,122.56,True,21,5,2,1648,2,0,2,MERGED
135334,ES|QL: add generator for SAMPLE command,luigidellaquila,2025-09-24T07:59:22Z,2025-09-24T09:31:41+00:00,4,1.54,True,49,0,2,60,1,1,2,MERGED
135332,Unmute logsdb tests.,martijnvg,2025-09-24T07:03:44Z,2025-09-24T11:46:04+00:00,1,4.71,True,0,36,1,317,2,0,2,MERGED
135328,Migrate transport versions 8841_052 through 8841_062,jdconrad,2025-09-23T23:03:34Z,2025-09-25T19:28:32+00:00,1,44.42,True,110,120,30,8,2,0,2,MERGED
135326,Add WriteLoadDecider canRemain logic,DiannaHohensee,2025-09-23T22:39:50Z,2025-10-01T19:00:07+00:00,4,188.34,True,553,185,3,15,1,10,11,MERGED
135322,Add back resetting transport upper bounds,rjernst,2025-09-23T22:22:16Z,2025-09-29T23:10:28+00:00,1,144.8,True,100,63,4,343,2,0,2,MERGED
135321,Move index sorting defaults to IndexSettingProviders,jordan-powers,2025-09-23T21:53:18Z,2025-10-03T16:19:18+00:00,3,234.43,False,1168,76,17,270,2,5,7,CLOSED
135318,Improve block loader for source only runtime boolean fields,Kubik42,2025-09-23T21:21:16Z,2025-09-24T21:07:23+00:00,2,23.77,True,185,0,2,18,3,2,5,MERGED
135317,document sandfly security connector,seanstory,2025-09-23T21:11:49Z,2025-09-24T16:34:07+00:00,2,19.37,True,316,0,2,69,5,1,6,MERGED
135309,Enable Semantic Search CCS When ccs_minimize_roundtrips=true,Mikep86,2025-09-23T20:48:15Z,2025-09-25T23:21:23+00:00,36,50.55,True,1716,198,24,719,2,19,21,MERGED
135308,[CI] UrlDecodeTests class failing,mouhc1ne,2025-09-23T19:23:57Z,2025-09-24T14:39:59+00:00,1,19.27,True,12,4,1,306,2,0,2,MERGED
135307,ES|QL: Add FUSE operator tests,ioanatia,2025-09-23T19:06:26Z,2025-09-25T12:37:25+00:00,4,41.52,True,447,69,17,903,1,2,3,MERGED
135306,Add support for extended search usage telemetry,kderusso,2025-09-23T18:58:24Z,2025-09-26T18:44:47+00:00,18,71.77,True,546,20,23,877,3,14,17,MERGED
135300,[Gradle/BWC] Patch bundled OpenJdk17 with Adoptium Jdk17 for older ES Distros,breskeby,2025-09-23T17:20:55Z,2025-09-24T14:13:13+00:00,5,20.87,True,224,22,7,231,2,4,6,MERGED
135299,Release DiskBBQ(`bbq_disk`) index type for dense_vector fields,benwtrent,2025-09-23T16:55:56Z,2025-09-24T12:02:03+00:00,5,19.1,True,457,1108,53,1074,4,2,6,MERGED
135298,Testing indices query cache memory stats,masseyke,2025-09-23T16:31:11Z,2025-09-26T20:17:03+00:00,3,75.76,True,197,12,2,301,5,1,6,MERGED
135292,New bulk scorer interface for vectors,benwtrent,2025-09-23T15:55:27Z,2025-09-24T15:40:34+00:00,2,23.75,True,236,106,6,209,1,1,2,MERGED
135290,ESQL: Add CSV Test for Lookup Join on Expression with Union Types,julian-elastic,2025-09-23T15:51:35Z,2025-09-24T17:13:49+00:00,1,25.37,True,23,0,1,59,1,0,1,MERGED
135279,[ML] Create endpoint cache feature,prwhelan,2025-09-23T13:55:34Z,2025-09-25T14:13:58+00:00,1,48.31,True,32,23,4,309,1,0,1,MERGED
135278,[DiskBBQ] Implement Bulk scoring when computing neighbours using a Hnsw graph,iverase,2025-09-23T13:54:39Z,2025-09-24T05:47:50+00:00,2,15.89,True,26,4,1,4368,1,0,1,MERGED
135272,ESQL: Un-snapshot all 3 URL scalar functions.,mouhc1ne,2025-09-23T13:04:41Z,2025-09-25T23:28:49+00:00,5,58.4,True,39,33,17,247,4,2,6,MERGED
135271,Add DLS stats to `_security/stats`,szybia,2025-09-23T12:48:33Z,2025-09-26T12:33:40+00:00,10,71.75,True,130,6,9,568,2,4,6,MERGED
135270,[ML] Add .reindexed-v7-ml-anomalies-* to anomaly results template index pattern,davidkyle,2025-09-23T12:33:59Z,2025-09-23T15:12:49+00:00,1,2.65,True,6,1,2,557,3,0,3,MERGED
135263,Optimize dotCount in expanding dot parser,ChrisHegarty,2025-09-23T11:01:07Z,2025-09-24T07:39:05+00:00,2,20.63,True,34,4,3,397,3,0,3,MERGED
135262,Add usage stats for semantic_text fields,dimitris-athanasiou,2025-09-23T10:40:26Z,2025-09-30T10:32:06+00:00,29,167.86,True,1099,66,11,917,8,23,31,MERGED
135261,Fix `SampleXXXAggregatorFunctionTests.testSimpleWithCranky` test,przemekwitek,2025-09-23T10:36:22Z,2025-09-23T11:47:12+00:00,1,1.18,True,4,17,2,395,1,0,1,MERGED
135257,Add a took time histogram for search triggered cache miss to blob cache metrics,andreidan,2025-09-23T09:00:38Z,2025-09-25T18:17:36+00:00,1,57.28,True,19,2,2,189,4,0,4,MERGED
135251,Cleanup of IndexSettingProvider,felixbarny,2025-09-23T06:52:25Z,2025-09-24T12:45:42+00:00,2,29.89,True,285,302,18,374,2,1,3,MERGED
135247,Fix alias id when drop all aggregates,dnhatn,2025-09-23T05:09:40Z,2025-09-24T01:10:26+00:00,1,20.01,True,26,1,5,583,4,0,4,MERGED
135246,Enable write load constraint decider by default,nicktindall,2025-09-23T04:45:28Z,2025-09-30T01:53:33+00:00,8,165.13,True,47,38,3,252,1,3,4,MERGED
135245,WriteLoadConstraintDecider: Always allow allocation of unassigned shards,nicktindall,2025-09-23T03:52:54Z,2025-10-01T03:41:14+00:00,4,191.81,True,62,16,2,16,1,2,3,MERGED
135244,Add reload listener to SslProfile,tvernum,2025-09-23T02:46:53Z,2025-09-25T03:28:37+00:00,1,48.7,True,79,12,9,304,2,0,2,MERGED
135242,[ML] Restore delayed string copying,DonalEvans,2025-09-23T00:14:29Z,2025-09-25T17:28:23+00:00,2,65.23,True,305,335,74,913,4,2,6,MERGED
135235,Fix systemd notify to use a shared arena,jdconrad,2025-09-22T21:35:07Z,2025-09-23T14:13:23+00:00,4,16.64,True,67,26,10,432,3,1,4,MERGED
135233,Rework ShardSearchContextId to explain use of searcher id better,cbuescher,2025-09-22T21:18:26Z,2025-09-25T11:48:41+00:00,1,62.5,True,22,17,5,600,2,1,3,MERGED
135226,Don't reset upper bounds,rjernst,2025-09-22T20:02:17Z,2025-09-23T18:06:54+00:00,1,22.08,True,12,3,2,293,2,0,2,MERGED
135225,ESQL: Expression based Lookup Join follow up and refactor,julian-elastic,2025-09-22T19:49:51Z,2025-10-02T12:44:11+00:00,2,232.91,True,32,139,6,222,4,1,5,MERGED
135223,Forbidding metrics used in aggregations for timeseries,pabloem,2025-09-22T19:31:34Z,2025-09-24T19:57:03+00:00,11,48.42,True,53,21,4,163,2,6,8,MERGED
135217,[ES|QL] Round stddev tests more aggressively,limotova,2025-09-22T18:39:23Z,2025-09-24T08:07:35+00:00,1,37.47,True,46,55,4,160,3,0,3,MERGED
135216,Add a hook to Engine to wrap the DirectoryReader provided to Searchers,bcully,2025-09-22T18:22:28Z,2025-10-02T19:33:00+00:00,5,241.18,True,7,1,1,76,4,1,5,MERGED
135215,ESQL: Opt in to support for new `aggregate_metric_double` and `dense_vector` using query constructs,nik9000,2025-09-22T18:20:49Z,2025-09-26T14:38:07+00:00,35,92.29,True,1259,171,26,1921,5,30,35,MERGED
135214,Reduce number of `ProjectMetadata`s built during template validation,nielsbauman,2025-09-22T17:27:21Z,2025-09-22T19:46:34+00:00,4,2.32,True,51,66,2,483,2,1,3,MERGED
135213,[ES|QL] Enable aggregate_metric_double outside of snapshots,limotova,2025-09-22T17:26:32Z,2025-09-30T23:10:13+00:00,10,197.73,True,815,185,100,237,3,5,8,MERGED
135212,Don't set index.dimensions if dimensions are added via dynamic templates,felixbarny,2025-09-22T17:25:14Z,2025-09-23T11:30:09+00:00,6,18.08,True,99,43,3,597,1,2,3,MERGED
135210,Use direct heap to GPU copy for raw vector data,ldematte,2025-09-22T16:49:17Z,2025-09-24T13:40:13+00:00,2,44.85,True,111,371,4,857,1,0,1,MERGED
135209,Fix expiration time in ES|QL async,dnhatn,2025-09-22T16:26:29Z,2025-09-22T22:49:13+00:00,2,6.38,True,76,71,5,225,5,1,6,MERGED
135208,ESQL: Fix multi cluster tests not working with @Repeat,ivancea,2025-09-22T16:19:13Z,2025-09-23T14:03:46+00:00,1,21.74,True,24,25,1,197,3,0,3,MERGED
135207,unmute #135194,richard-dennehy,2025-09-22T16:17:56Z,2025-09-23T11:49:44+00:00,1,19.53,True,0,3,1,34,1,0,1,MERGED
135206,Refactor IndexRouting.ExtractFromSource to be an abstract class,felixbarny,2025-09-22T16:10:25Z,2025-09-25T06:00:45+00:00,11,61.84,True,531,325,16,176,6,9,15,MERGED
135205,Remove references to transport version from index version docs,rjernst,2025-09-22T16:04:14Z,2025-09-22T19:12:06+00:00,1,3.13,True,7,7,1,160,5,0,5,MERGED
135204,ES|QL: Make _tsid available in metadata,leontyevdv,2025-09-22T15:17:37Z,2025-09-29T12:55:10+00:00,10,165.63,True,382,35,23,75,8,3,11,MERGED
135203,Use gradleProperty instead of findProperty,rjernst,2025-09-22T15:01:31Z,2025-09-23T13:19:28+00:00,1,22.3,True,6,8,1,93,2,0,2,MERGED
135198,Enable chunk_rescorer in text_similarity_reranker,kderusso,2025-09-22T14:50:34Z,2025-09-23T12:12:41+00:00,2,21.37,True,10,27,10,93,2,0,2,MERGED
135197,ESQL: Make the DocsMultiAggsMultiGroupings test deterministic,astefan,2025-09-22T14:09:48Z,2025-09-22T16:39:41+00:00,1,2.5,True,2,20,3,49,3,0,3,MERGED
135195,Provide more performant and reliable extraction of the executorName for EsThreads,mosche,2025-09-22T13:47:03Z,2025-09-24T11:11:44+00:00,7,45.41,True,173,125,27,384,1,3,4,MERGED
135191,[DOCS] Add applies_to tags to ESQL overview pages and functions,leemthompo,2025-09-22T12:30:55Z,2025-09-24T10:35:03+00:00,1,46.07,True,90,4,31,26,3,0,3,MERGED
135187,Avoid redundantly copying a map in `Settings` builder,nielsbauman,2025-09-22T11:59:59Z,2025-09-23T19:29:01+00:00,2,31.48,True,2,3,1,571,1,1,2,MERGED
135184,"Bug fix, last optimised value in `ESUTF8StreamJsonParser` kept old value.",gmarouli,2025-09-22T11:33:23Z,2025-09-29T12:46:33+00:00,6,169.22,True,156,15,6,760,6,7,13,MERGED
135183,Fixes DesiredBalanceComputerTests Failure,joshua-adams-1,2025-09-22T11:29:45Z,2025-09-23T09:28:12+00:00,2,21.97,True,1,4,2,550,1,0,1,MERGED
135176,CentroidCalculator does not return negative summation weights,iverase,2025-09-22T08:50:05Z,2025-09-22T12:20:16+00:00,1,3.5,True,45,1,3,299,3,0,3,MERGED
135172,Disable utf-8 parsing optimization,martijnvg,2025-09-22T08:11:04Z,2025-09-22T10:11:53+00:00,2,2.01,True,3,64,3,587,2,0,2,MERGED
135171,[ML] Add .ml-anomalies and .ml-annotations to the DotPrefixValidator exceptions,davidkyle,2025-09-22T08:09:28Z,2025-09-24T16:00:46+00:00,4,55.85,True,32,18,3,639,2,2,4,MERGED
135168,[8.18] Delete unsupported tests ,jfreden,2025-09-22T06:54:13Z,2025-09-22T08:02:20+00:00,1,1.14,True,0,20,1,619,0,0,0,MERGED
135167,rest-api-spec: fix master_timeout typo,pquentin,2025-09-22T06:40:02Z,2025-09-22T09:47:25+00:00,1,3.12,True,1,1,1,0,2,0,2,MERGED
135161,Use recycler bytestream output for translog writer,Tim-Brooks,2025-09-21T20:08:56Z,2025-09-25T03:47:37+00:00,4,79.64,True,15,7,2,184,1,1,2,MERGED
135160,ESQL: Standardize block args,nik9000,2025-09-21T18:11:34Z,2025-09-22T20:14:27+00:00,2,26.05,True,398,262,30,601,2,4,6,MERGED
135148,Force Merge in CachingEnableFilterQueryTests,john-wagster,2025-09-21T03:21:18Z,2025-09-22T20:21:21+00:00,1,41.0,True,2,6,2,29,1,0,1,MERGED
135138,Fixed a small typo in tokenizer-reference.md,ImadSaddik,2025-09-20T20:20:43Z,2025-09-22T11:19:16+00:00,1,38.98,True,1,1,1,165,5,0,5,MERGED
135136,Removing duplicate logger declaration,benwtrent,2025-09-20T14:02:58Z,2025-09-22T12:18:07+00:00,1,46.25,True,2,6,1,63,1,0,1,MERGED
135114,Add direct access to current recycler stream page,Tim-Brooks,2025-09-19T22:47:37Z,2025-09-24T18:33:12+00:00,10,115.76,True,753,49,4,482,3,9,12,MERGED
135113,Allow overriding upstream ref in transport version build logic,rjernst,2025-09-19T22:25:39Z,2025-09-22T14:54:40+00:00,3,64.48,True,15,0,3,337,3,1,4,MERGED
135110,Add serverless-specific index refresh info,shainaraskas,2025-09-19T19:46:00Z,2025-09-22T14:35:58+00:00,1,66.83,True,16,7,3,245,3,0,3,MERGED
135109,Better explain STATS on multivalued fields,nik9000,2025-09-19T19:44:27Z,2025-09-30T15:02:12+00:00,1,259.3,True,127,38,6,124,6,1,7,MERGED
135098,Manually roll over in `SearchableSnapshotActionIT`,nielsbauman,2025-09-19T15:46:38Z,2025-09-22T19:09:32+00:00,1,75.38,True,39,14,2,441,3,0,3,MERGED
135097,Fixes countDistinctWithConditions in csv-spec tests,ncordon,2025-09-19T15:40:03Z,2025-09-22T09:13:06+00:00,1,65.55,True,6,1,2,303,2,0,2,MERGED
135096,[ML] Tolerate mixed types in datafeed stats sort,davidkyle,2025-09-19T15:29:57Z,2025-09-24T15:30:33+00:00,2,120.01,True,6,0,2,246,3,0,3,MERGED
135094,ES|QL: Require all functions to provide examples,ioanatia,2025-09-19T15:07:22Z,2025-09-26T08:02:04+00:00,3,160.91,True,43,5,7,199,3,1,4,MERGED
135092,[8.19] Use consistent version of asm for painless and tools,mosche,2025-09-19T14:38:17Z,2025-09-22T13:13:10+00:00,1,70.58,True,11,11,3,55,0,0,0,MERGED
135090,[8.18] Use consistent version of asm for painless and tools,mosche,2025-09-19T14:24:25Z,2025-09-22T13:13:35+00:00,1,70.82,True,11,11,3,55,1,0,1,MERGED
135089,[9.1] Use consistent version of asm for painless and tools,mosche,2025-09-19T14:11:22Z,2025-09-22T13:13:58+00:00,1,71.04,True,13,13,4,55,1,0,1,MERGED
135087,"Optimize BytesArray::indexOf, which is used heavily in ndjson parsing",ChrisHegarty,2025-09-19T13:54:39Z,2025-09-20T10:38:56+00:00,15,20.74,True,374,84,10,1405,7,6,13,MERGED
135086,Update asm for painless,mosche,2025-09-19T13:46:07Z,2025-09-22T13:14:21+00:00,1,71.47,True,9,9,2,78,1,0,1,MERGED
135085,[8.18] Update bundled JDK to 25 (#134910),mosche,2025-09-19T12:42:46Z,2025-09-22T13:15:00+00:00,1,72.54,True,30,12,10,166,0,0,0,MERGED
135084,[8.19] Update bundled JDK to 25 (#134910),mosche,2025-09-19T12:40:38Z,2025-09-22T13:15:33+00:00,1,72.58,True,34,14,12,166,0,0,0,MERGED
135083,[9.0] Update bundled JDK to 25 (#134910),mosche,2025-09-19T12:36:43Z,2025-09-22T13:18:53+00:00,1,72.7,True,57,29,16,165,0,0,0,MERGED
135082,[9.1] Update bundled JDK to 25 (#134910),mosche,2025-09-19T12:32:10Z,2025-09-22T13:18:31+00:00,1,72.77,True,34,14,12,165,0,0,0,MERGED
135081,Local index resolution records resolved expressions,n1v0lg,2025-09-19T12:16:14Z,2025-09-24T11:55:03+00:00,10,119.65,True,375,68,9,1298,3,9,12,MERGED
135079,"ES|QL: Configurable score, key and group by columns for FUSE",ioanatia,2025-09-19T11:51:45Z,2025-09-22T15:35:19+00:00,8,75.73,True,3288,2576,24,495,3,5,8,MERGED
135078,ESQL: Fix async query inconsistent headers,ivancea,2025-09-19T11:42:09Z,2025-09-23T10:16:01+00:00,6,94.56,True,70,23,6,164,3,4,7,MERGED
135076,[ESQL] Edit versioning info for `absent` and `present` functions,kkrik-es,2025-09-19T11:36:17Z,2025-09-22T12:45:28+00:00,6,73.15,True,12,0,4,69,5,1,6,MERGED
135074,Fix BatchedQueryPhaseIT.testNumReducePhases,cbuescher,2025-09-19T11:02:35Z,2025-09-23T11:12:14+00:00,1,96.16,True,7,5,3,192,2,0,2,MERGED
135071,[ES|QL] Ensure Inference Service answer using only SEARCH and SEARCH_COORDINATION thread pools.,afoucret,2025-09-19T10:15:11Z,2025-09-24T07:37:52+00:00,3,117.38,True,69,92,5,592,1,1,2,MERGED
135069,Fix failing LuceneFilesExtensionsTests testIsLuceneExtension case,cbuescher,2025-09-19T09:29:08Z,2025-09-19T11:03:55+00:00,1,1.58,True,1,4,2,94,2,0,2,MERGED
135068,Turn NumericValues into functional interface,martijnvg,2025-09-19T09:26:15Z,2025-09-19T16:53:23+00:00,1,7.45,True,20,23,1,0,1,0,1,MERGED
135062,[ES|QL] Text embedding inference operator,afoucret,2025-09-19T08:59:02Z,2025-09-24T10:44:51+00:00,7,121.76,True,1160,64,12,121,1,8,9,MERGED
135059,[ES|QL] TEXT_EMBEDDING function definition,afoucret,2025-09-19T07:36:56Z,2025-09-24T13:15:37+00:00,16,125.64,True,571,28,19,448,3,14,17,MERGED
135057,Modifies H1 titles for better SEO,kosabogi,2025-09-19T07:06:40Z,2025-09-19T12:48:37+00:00,1,5.7,True,3,2,2,16,3,0,3,MERGED
135054,[ES|QL] Register AggregateMetricDoubleLiteral,limotova,2025-09-19T05:01:44Z,2025-09-26T23:49:36+00:00,2,186.8,True,88,6,8,218,2,0,2,MERGED
135053,Make SecureString comparisons constant time,tvernum,2025-09-19T04:31:47Z,2025-09-22T03:35:42+00:00,1,71.07,True,105,22,3,664,2,0,2,MERGED
135052,Move individual stats fields to AsyncRefresh,ywangd,2025-09-19T02:53:00Z,2025-09-19T03:56:42+00:00,1,1.06,True,33,46,1,184,1,0,1,MERGED
135051,Ban Limit + MvExpand before remote Enrich,smalyshev,2025-09-19T00:49:01Z,2025-09-22T19:29:30+00:00,7,90.67,True,51,0,3,1287,5,5,10,MERGED
135050,[DOCS] Remove node lifecycle and autoscaling APIs,lcawl,2025-09-19T00:10:07Z,2025-09-19T08:21:55+00:00,1,8.2,True,6,21,1,302,4,0,4,MERGED
135049,Rename index.mapping.patterned_text.disable_templating,Kubik42,2025-09-18T23:22:55Z,2025-09-23T19:59:52+00:00,1,116.62,True,12,12,4,22,1,0,1,MERGED
135048,[8.18] Cutover to the new transport version system,rjernst,2025-09-18T23:04:38Z,2025-09-19T23:28:26+00:00,1,24.4,True,26,49,6,195,0,0,0,MERGED
135047,[8.19] Cutover to the new transport version system,rjernst,2025-09-18T23:02:41Z,2025-09-19T23:28:11+00:00,1,24.43,True,29,52,9,195,0,0,0,MERGED
135046,[9.0] Cutover to the new transport version system,rjernst,2025-09-18T22:57:37Z,2025-09-19T23:27:56+00:00,1,24.51,True,32,52,13,195,0,0,0,MERGED
135045,[9.1] Cutover to the new transport version system,rjernst,2025-09-18T22:54:21Z,2025-09-19T23:28:42+00:00,1,24.57,True,34,60,15,195,0,0,0,MERGED
135044,Only validate primary ids on release branches,rjernst,2025-09-18T22:24:10Z,2025-09-19T14:20:05+00:00,1,15.93,True,45,5,4,666,2,1,3,MERGED
135043,Document Rest*Action and Transport*Action threading model ,zhubotang-wq,2025-09-18T22:11:59Z,2025-10-02T17:57:01+00:00,7,331.75,True,36,0,1,131,7,8,15,MERGED
135040,Weights in simplified RRF retriever cleanup,Mikep86,2025-09-18T21:55:01Z,2025-09-19T12:55:57+00:00,7,15.02,True,165,208,3,324,5,4,9,MERGED
135039,Remove feature flag for coalesced ignored source,jordan-powers,2025-09-18T21:51:21Z,2025-09-26T16:33:45+00:00,1,186.71,True,19,36,5,195,7,0,7,MERGED
135036,ESQL: Performance improvements for Lookup Join on Expression,julian-elastic,2025-09-18T20:47:11Z,2025-09-26T18:20:31+00:00,1,189.56,True,49,11,3,860,7,0,7,MERGED
135035,Implementation of Delta function for absolute change in gauges over time,pabloem,2025-09-18T20:29:49Z,2025-09-24T17:55:47+00:00,5,141.43,True,3416,6,20,22,3,7,10,MERGED
135034,Clarify what happens if max_open_jobs is set differently across nodes,ppf2,2025-09-18T20:18:50Z,2025-09-24T18:53:08+00:00,1,142.57,True,4,0,1,71,5,0,5,MERGED
135029,Fix testDateHistogramAggregation by limiting number docs to avoid OOM,parkertimmins,2025-09-18T17:36:51Z,2025-09-29T14:38:21+00:00,1,261.02,True,1,4,2,153,1,0,1,MERGED
135026,Improve block loader for source only runtime fields of type keyword,jordan-powers,2025-09-18T17:25:16Z,2025-09-19T16:18:54+00:00,1,22.89,True,187,31,9,234,2,0,2,MERGED
