number,title,author,createdAt,closedOrMergedAt,reviewsCount,hoursOpen,merged,additions,deletions,changedFiles,bodyLength,issueCommentsCount,reviewThreadsCount,interactionsCount,finalReviewState
110536,Saved Query: Add `onSelectQuery` to `QueryLibraryContext `,axelavargas,2025-09-03T15:42:03Z,2025-09-04T14:52:42+00:00,1,23.18,True,4,1,3,360,0,0,0,MERGED
110534,Plugins: Add ability to run backend plugins in containers,wbrowne,2025-09-03T15:09:00Z,2025-09-10T10:12:23+00:00,8,163.06,True,150,20,14,265,3,4,7,MERGED
110532,use standard sql in secure_value_lease_inactive.sql,PoorlyDefinedBehaviour,2025-09-03T14:47:11Z,2025-09-04T13:01:06+00:00,1,22.23,True,56,32,4,81,0,0,0,MERGED
110531,Chore: Fix some more a11y checks in stories,ashharrison90,2025-09-03T14:45:21Z,2025-09-04T08:57:02+00:00,1,18.19,True,142,102,7,1041,0,0,0,MERGED
110530,Alerting: Bump alerting package to include change to NewTLSClient,rwwiv,2025-09-03T14:33:06Z,2025-09-03T21:20:25+00:00,1,6.79,False,73,9,3,561,1,0,1,CLOSED
110527,search-after-write: Reuse index even if docs count doesn't match,pstibrany,2025-09-03T14:11:52Z,2025-09-03T15:35:46+00:00,2,1.4,True,21,15,2,187,0,1,1,MERGED
110525,Stop using DashboardModel for backend input to compare frontend and backend,ivanortegaalba,2025-09-03T14:02:45Z,2025-09-10T10:31:21+00:00,8,164.48,True,6185,2002,98,2527,0,9,9,MERGED
110524,TraceView: Add support for plugin components in trace view header,joey-grafana,2025-09-03T13:49:29Z,2025-09-04T08:58:21+00:00,2,19.15,True,46,21,4,241,0,0,0,MERGED
110523,[release-12.0.5] Fix: Prevent Rollup from treeshaking NPM packages,jackw,2025-09-03T13:45:20Z,2025-09-04T07:08:05+00:00,1,17.38,True,11,0,7,754,1,0,1,MERGED
110522,I18n: Prevent Intl.DateTimeFormat crash with invalid locales,akhilsingh-git,2025-09-03T13:44:16Z,2025-09-11T19:37:17+00:00,4,197.88,True,17,3,3,944,9,1,10,MERGED
110518,Graphite: Backend health-check,aangelisc,2025-09-03T12:42:40Z,2025-09-11T11:31:11+00:00,5,190.81,True,589,337,8,878,0,3,3,MERGED
110517,Migration v42: HideFrom tooltip consistency migration,dprokop,2025-09-03T12:36:21Z,2025-09-05T13:07:30+00:00,2,48.52,True,934,69,59,1046,0,0,0,MERGED
110516,datasources: querier: refactor: simplify,gabor,2025-09-03T12:05:42Z,2025-09-09T11:27:52+00:00,1,143.37,True,18,20,1,629,0,0,0,MERGED
110514,Adhoc filter: Test filter for value buttons integration,Develer,2025-09-03T11:29:52Z,2025-09-04T15:22:10+00:00,6,27.87,True,320,0,4,950,0,15,15,MERGED
110513,Restore dashboards: Clear cache when deleting or restoring dashboards,Clarity-89,2025-09-03T11:28:03Z,2025-09-05T10:03:13+00:00,5,46.59,True,16,1,1,617,6,2,8,MERGED
110511,Tempo: Migrates tags and tag values to datasource backend CallResource requests,adrapereira,2025-09-03T10:52:40Z,2025-09-09T16:31:32+00:00,5,149.65,True,268,311,12,1361,1,2,3,MERGED
110510,Frontend: Fix start scripts,jackw,2025-09-03T10:52:16Z,2025-09-18T12:07:33+00:00,4,361.25,True,3,2,2,653,0,0,0,MERGED
110508,FS: Add support for local dev configs,joshhunt,2025-09-03T10:10:44Z,2025-09-04T16:17:32+00:00,3,30.11,True,33,24,6,342,0,1,1,MERGED
110507,Bump @grafana/assistant package,ivanahuckova,2025-09-03T09:39:12Z,2025-09-03T13:30:03+00:00,7,3.85,True,52,90,10,550,0,3,3,MERGED
110501,EphemeralEnvs: Trigger workflow when PR is merged,macabu,2025-09-03T08:41:45Z,2025-09-03T14:50:29+00:00,2,6.15,True,1,1,1,463,0,0,0,MERGED
110500,Add extension point for overriding Observability home page,javiruiz01,2025-09-03T08:00:34Z,2025-09-10T13:43:36+00:00,14,173.72,True,79,19,7,1018,1,3,4,MERGED
110499,Stars: Remove deprecated internal ID apis,ryantxu,2025-09-03T07:41:36Z,2025-09-04T19:45:02+00:00,1,36.06,True,20,382,10,479,0,0,0,MERGED
110498,Alerting: Add extension point for rule view page enrichment section,laurenashleigh,2025-09-03T07:19:01Z,2025-09-09T10:33:12+00:00,1,147.24,True,145,9,7,80,0,0,0,MERGED
110497,TabItemEditor: Add tab title edit undo action,Sergej-Vlasov,2025-09-03T07:17:41Z,2025-09-04T06:58:52+00:00,1,23.69,True,20,2,2,111,0,0,0,MERGED
110493,Table: Update UX for uniform-reducer case in new footer and overflow,fastfrwrd,2025-09-03T04:14:16Z,2025-09-05T19:46:07+00:00,6,63.53,True,1917,229,12,1403,2,3,5,MERGED
110489,Stars: implement full CRUD operations via legacy service,ryantxu,2025-09-02T23:02:14Z,2025-09-04T19:49:49+00:00,5,44.79,True,541,47,9,203,2,3,5,MERGED
110488,Loki: resource frontend browser cache,gtk-grafana,2025-09-02T22:11:34Z,2025-09-26T12:18:21+00:00,3,566.11,True,7,0,1,1489,2,0,2,MERGED
110487,Provisioning Action Drawer: Organize action and cancel button order to match existing pattern,ywzheng1,2025-09-02T21:42:52Z,2025-09-03T05:50:52+00:00,1,8.13,True,21,21,7,607,0,0,0,MERGED
110486,FolderRepo: Prevent no basic role user getting infinite api calls on provisioning settings endpoint,ywzheng1,2025-09-02T21:35:41Z,2025-09-03T14:17:37+00:00,6,16.7,True,134,13,5,1115,0,3,3,MERGED
110485,Alerting: Comprehensive payload for Alertmanager convert API tests,yuri-tceretian,2025-09-02T21:22:56Z,2025-09-03T16:11:55+00:00,1,18.82,True,777,43,6,407,0,0,0,MERGED
110481,SQL Expressions: Add Exemplars to instrumentation,kylebrandt,2025-09-02T18:32:20Z,2025-09-03T17:25:45+00:00,1,22.89,True,50,3,2,755,0,1,1,MERGED
110479,SQL Expressions: Return error on malformed input,kylebrandt,2025-09-02T17:44:33Z,2025-09-02T18:49:04+00:00,1,1.08,True,12,0,2,685,0,0,0,MERGED
110477,Dashboards: Remove panel plugin provider from migrations,ryantxu,2025-09-02T17:19:40Z,2025-09-04T11:17:23+00:00,8,41.96,True,143,518,23,255,0,5,5,MERGED
110476,fix: Synchronously notify subscribers when writing Create events to CDK backend,filewalkwithme,2025-09-02T17:13:20Z,2025-09-03T14:49:04+00:00,7,21.6,True,10,12,1,1287,0,1,1,MERGED
110475,fix: add back missing edit button for panels for viewers-can-edit,eleijonmarck,2025-09-02T16:44:16Z,2025-09-03T16:02:17+00:00,2,23.3,True,2,8,2,412,0,0,0,MERGED
110473,SQL Expressions: Switch feature toggle to public preview,kylebrandt,2025-09-02T16:12:47Z,2025-09-03T15:11:00+00:00,2,22.97,True,9,5,4,611,4,0,4,MERGED
110472,Log line details: Update styles,matyax,2025-09-02T15:52:21Z,2025-09-03T15:44:29+00:00,5,23.87,True,59,43,4,192,1,1,2,MERGED
110470,Pyroscope: Fix incorrect rate calculation from flamegraph totals,marcsanmi,2025-09-02T15:00:54Z,2025-09-03T07:15:07+00:00,2,16.24,True,15,34,3,770,0,0,0,MERGED
110469,Chore: Remove betterer,tomratcliffe,2025-09-02T14:59:24Z,2025-09-04T17:17:54+00:00,2,50.31,True,13,604,14,184,0,0,0,MERGED
110468,Alerting: Fix insights panel for Grafana missed iterations,JacobsonMT,2025-09-02T14:58:02Z,2025-09-02T18:33:41+00:00,1,3.59,True,6,42,2,592,8,0,8,MERGED
110467,Provisioning: Hide badge if folder is managed by non-repo source,tomratcliffe,2025-09-02T14:54:57Z,2025-09-03T18:12:42+00:00,2,27.3,False,6,1,1,547,2,1,3,CLOSED
110466,Alerting: Bump alertenrichment API version to v1beta1,alexander-akhmetov,2025-09-02T14:51:19Z,2025-09-04T07:32:29+00:00,1,40.69,True,113,92,14,43,0,0,0,MERGED
110463,unistore: use scorch indexing instead of upside_down,chaudyg,2025-09-02T14:28:39Z,2025-09-03T09:06:08+00:00,6,18.62,True,14,2,1,942,0,1,1,MERGED
110460,Alerting: Minor papercut for data sources in the list view,gillesdemey,2025-09-02T14:02:32Z,2025-09-02T15:05:51+00:00,3,1.06,True,32,11,3,429,0,2,2,MERGED
110459,Remove unused `style` prop from FlameGraph,Johngeorgesample,2025-09-02T13:45:29Z,2025-09-26T08:23:50+00:00,1,570.64,True,0,2,1,488,1,0,1,MERGED
110456,ShortURL: Avoid teris-io/shortid,ryantxu,2025-09-02T13:16:31Z,2025-09-02T17:01:21+00:00,7,3.75,True,3,30,9,52,0,4,4,MERGED
110454,Plugins: Add metric for connection request unavailable errors,wbrowne,2025-09-02T12:43:28Z,2025-09-02T16:23:07+00:00,1,3.66,True,26,8,1,247,0,0,0,MERGED
110453,Chore: Remove betterer undocumented stories check,tomratcliffe,2025-09-02T12:42:28Z,2025-09-03T12:59:36+00:00,1,24.29,True,0,135,3,332,0,0,0,MERGED
110452,PostgreSQL: PGX fix multiple results handling,zoltanbedi,2025-09-02T12:41:32Z,2025-09-08T08:37:54+00:00,3,139.94,True,528,100,3,523,0,1,1,MERGED
110449,Folders: Update folder using app platform APIs ,tomratcliffe,2025-09-02T12:35:38Z,2025-09-03T10:29:27+00:00,9,21.9,True,232,169,16,311,1,8,9,MERGED
110448,fix(unified-strorage): optimize allocations,JohnnyQQQQ,2025-09-02T12:34:45Z,2025-09-02T13:43:48+00:00,6,1.15,True,5,11,1,96,0,1,1,MERGED
110447,feat: provides MT Dashboard service,konsalex,2025-09-02T12:07:12Z,2025-09-03T20:41:38+00:00,30,32.57,True,284,69,43,456,0,20,20,MERGED
110445,AdHoc Filter: Enable to GA,Develer,2025-09-02T11:15:48Z,2025-09-03T13:21:34+00:00,3,26.1,True,26,12,5,408,1,6,7,MERGED
110444,New Logs Panel: remove sibling visualization,matyax,2025-09-02T11:04:40Z,2025-09-04T09:27:50+00:00,1,46.39,True,6,656,15,222,4,0,4,MERGED
110443,DashboardProfiler: Add long frame detection with LoAF API integration,dprokop,2025-09-02T10:57:54Z,2025-09-15T11:40:46+00:00,2,312.71,True,98,2,2,1152,0,0,0,MERGED
110442,Azure: Show resource group in picker,aangelisc,2025-09-02T10:35:26Z,2025-09-02T14:57:30+00:00,1,4.37,True,94,4,4,563,0,0,0,MERGED
110439,Folders: Improve folder parent testing,ryantxu,2025-09-02T09:39:10Z,2025-09-04T10:50:32+00:00,11,49.19,True,884,357,9,228,0,8,8,MERGED
110438,Update scenes to v6.33.0,renovate,2025-09-02T09:30:56Z,2025-09-02T11:16:35+00:00,1,1.76,True,13,13,2,1031,0,0,0,MERGED
110437,Alerting: Enrichment per rule wip-2,soniaAguilarPeiron,2025-09-02T09:01:58Z,2025-09-10T11:52:10+00:00,11,194.84,True,87,37,7,776,0,5,5,MERGED
110435,Update audit-grafana.md,grafpat,2025-09-02T08:16:46Z,2025-09-05T00:52:08+00:00,1,64.59,False,1,2,1,902,6,1,7,CLOSED
110434,Plugin Extensions: refactors shared logic into validator function,hugohaggmark,2025-09-02T07:43:34Z,2025-09-08T04:22:28+00:00,10,140.65,True,784,137,8,951,9,5,14,MERGED
110433,Update @grafana/plugin-ui dependency to version ^0.10.10 across multiple packages,zoltanbedi,2025-09-02T07:35:58Z,2025-09-02T17:05:57+00:00,1,9.5,True,28,28,13,0,0,0,0,MERGED
110432,Secrets: Extract external facing decrypt types to apps,macabu,2025-09-02T07:29:18Z,2025-09-02T08:30:29+00:00,2,1.02,True,100,287,16,576,0,0,0,MERGED
110430,Add single version migrations support to DashboardMigrator,ivanortegaalba,2025-09-01T21:34:12Z,2025-09-03T13:00:37+00:00,2,39.44,True,6515,20110,93,1179,0,6,6,MERGED
110428,Metrics: Add http_response_size_bytes metric,joshhunt,2025-09-01T17:38:30Z,2025-09-03T13:47:38+00:00,5,44.15,True,44,17,3,305,0,2,2,MERGED
110425,Chore: Move a11y storybook check to eslint,tomratcliffe,2025-09-01T16:17:37Z,2025-09-03T12:31:10+00:00,1,44.23,True,58,84,3,184,0,0,0,MERGED
110424,Playwright: Changes needed for enterprise tests ,ashharrison90,2025-09-01T16:11:30Z,2025-09-03T14:45:55+00:00,4,46.57,True,15,6,5,678,0,2,2,MERGED
110417,Datasource view: Show a not-found message,andresmgot,2025-09-01T15:04:00Z,2025-09-02T12:37:51+00:00,1,21.56,True,58,18,8,530,0,1,1,MERGED
110414,Provisioning: Fix rule of hooks violations,Clarity-89,2025-09-01T14:54:37Z,2025-09-02T05:07:11+00:00,1,14.21,True,15,26,5,385,0,0,0,MERGED
110412,Log Details: Update links UI,matyax,2025-09-01T14:36:27Z,2025-09-02T15:06:57+00:00,1,24.51,True,181,21,5,338,2,0,2,MERGED
110411,IAM: Create Service Account API and legacy store impl,mgyongyosi,2025-09-01T14:27:08Z,2025-09-08T12:31:33+00:00,14,166.07,True,1994,231,46,775,0,8,8,MERGED
110410,unistore: add custom badger store for in-memory bleve backend,chaudyg,2025-09-01T13:43:20Z,2025-09-02T15:29:21+00:00,1,25.77,False,514,15,10,267,1,1,2,CLOSED
110407,DataSourceApi: More specific naming for getFiltersApplicability,mdvictor,2025-09-01T12:50:39Z,2025-09-02T08:32:24+00:00,2,19.7,True,21,18,4,703,1,0,1,MERGED
110405,Dashboard migration: Fix V16 migration to preserve panels when rows array is empty,dprokop,2025-09-01T11:41:30Z,2025-09-01T13:02:59+00:00,4,1.36,True,2198,1,4,1100,3,2,5,MERGED
110404,"Revert ""Dashboard: Add unit tests for keyboard shortcuts  (#107065)""",ashharrison90,2025-09-01T10:46:27Z,2025-09-01T11:52:46+00:00,1,1.11,True,9,251,2,699,0,0,0,MERGED
110399,Icon: Use non-block element for loader,Clarity-89,2025-09-01T09:58:00Z,2025-09-03T12:29:34+00:00,1,50.53,True,2,2,1,323,0,0,0,MERGED
110398,RowItemEditor: Add row title edit undo action,Sergej-Vlasov,2025-09-01T09:55:18Z,2025-09-02T07:09:16+00:00,1,21.23,True,19,1,2,206,0,0,0,MERGED
110397,DashboardGridItem: Trigger row repeat behaviour on panel edit complete,Sergej-Vlasov,2025-09-01T09:37:00Z,2025-09-02T14:10:11+00:00,1,28.55,True,12,0,2,320,0,0,0,MERGED
110396,Alerting: Add alertenrichment API types,alexander-akhmetov,2025-09-01T09:35:35Z,2025-09-02T11:33:55+00:00,1,25.97,True,1907,0,17,53,0,0,0,MERGED
110395,Dashoard-Scene: Remove unused(?) `console.log()` statement,leventebalogh,2025-09-01T09:22:16Z,2025-09-02T11:05:43+00:00,1,25.72,True,0,1,1,56,0,0,0,MERGED
110394,Alerting: register alert rule extension to irm,brojd,2025-09-01T09:18:09Z,2025-09-04T11:56:50+00:00,8,74.64,True,72,21,5,1358,5,4,9,MERGED
110393,Docs: Add feature toggle name to dashboard schema v2 docs,leventebalogh,2025-09-01T09:15:47Z,2025-09-02T14:17:26+00:00,1,29.03,False,1,1,1,322,4,1,5,CLOSED
110392,Don't use transaction in ListModifiedSince.,pstibrany,2025-09-01T08:38:53Z,2025-09-01T09:39:03+00:00,2,1.0,True,20,42,7,218,0,0,0,MERGED
110390,Dashboard: Only show Conditional Rendering on Custom Grid when FF is enabled,bfmatei,2025-09-01T08:19:56Z,2025-09-01T10:14:58+00:00,1,1.92,True,8,1,1,475,0,0,0,MERGED
110389,Provisioning: Update branch selection,Clarity-89,2025-09-01T06:08:11Z,2025-09-02T08:27:33+00:00,2,26.32,True,15,14,5,339,5,0,5,MERGED
110372,Chore(deps): Bump google-github-actions/setup-gcloud from 2.1.4 to 3.0.1,dependabot,2025-09-01T00:03:03Z,2025-09-02T09:34:55+00:00,1,33.53,True,2,2,2,4044,0,0,0,MERGED
110368,Histogram: Fix Tooltip placement issue,wassafshahzad,2025-08-31T13:01:57Z,2025-09-01T21:48:45+00:00,8,32.78,True,6,0,1,1109,3,1,4,MERGED
110367,fix(docs): Fix broken link in Entra ID SAML docs,volcanonoodle,2025-08-31T09:10:24Z,2025-09-01T09:29:01+00:00,1,24.31,True,1,1,1,578,1,0,1,MERGED
110357,Controllers: Make available as a target,stephaniehingtgen,2025-08-29T17:46:16Z,2025-08-30T10:27:51+00:00,3,16.69,True,327,301,10,799,0,5,5,MERGED
110356,Storage: Set default list limit to 500,toddtreece,2025-08-29T17:35:37Z,2025-09-01T09:09:41+00:00,2,63.57,True,1,1,1,744,0,0,0,MERGED
110353,LogLine: add min-height to fields wrapper,matyax,2025-08-29T16:36:44Z,2025-08-29T18:34:44+00:00,2,1.97,True,1,0,1,208,3,0,3,MERGED
110352,Authz: propagate folder changes to zanzana,forsethc,2025-08-29T16:06:38Z,2025-09-04T13:22:24+00:00,3,141.26,False,83,24,7,298,2,1,3,CLOSED
110347,Fix: Update return type for getActionsDefaultField to Field.,PrajwalAwate17,2025-08-29T14:39:18Z,2025-08-30T01:49:35+00:00,1,11.17,True,1,2,1,424,1,0,1,MERGED
110346,[release-12.0.5] Alerting: Fix copying of recording rule fields,moustafab,2025-08-29T14:23:19Z,2025-09-03T14:00:22+00:00,1,119.62,True,69,3,4,401,1,0,1,MERGED
110345,[release-11.6.6] Alerting: Fix copying of recording rule fields,moustafab,2025-08-29T14:21:10Z,2025-09-03T14:00:41+00:00,1,119.66,True,68,3,4,401,2,0,2,MERGED
110344,NewsPanel: Ensure unique HTML IDs for titles,joshhunt,2025-08-29T13:43:30Z,2025-08-29T15:34:16+00:00,2,1.85,True,2,1,1,126,0,0,0,MERGED
110341,Chore: Move `gf-form` betterer check to eslint instead,tomratcliffe,2025-08-29T11:39:05Z,2025-09-03T12:03:45+00:00,2,120.41,True,349,886,12,252,1,0,1,MERGED
110340,Advisor: Avoid write if checktype exists,andresmgot,2025-08-29T11:26:50Z,2025-09-03T07:54:50+00:00,2,116.47,True,232,123,2,1105,6,1,7,MERGED
110338,unified-storage: Skip query when ListModifiedSince cannot return anything.,pstibrany,2025-08-29T11:11:48Z,2025-08-29T12:49:20+00:00,4,1.63,True,44,10,3,183,0,1,1,MERGED
110337,Forbid more redirect patterns,volcanonoodle,2025-08-29T10:54:41Z,2025-09-02T14:12:40+00:00,1,99.3,True,23,9,4,36,1,0,1,MERGED
110336,Alerting: Allow filter by rule source in Filter V2,laurenashleigh,2025-08-29T10:45:09Z,2025-09-02T14:27:55+00:00,10,99.71,True,173,58,12,135,0,10,10,MERGED
110335,Log Line: Add custom highlight renderer,matyax,2025-08-29T10:12:33Z,2025-08-29T18:33:22+00:00,2,8.35,True,326,33,7,523,2,0,2,MERGED
110334,kvstore: merge the metadata store into the datastore,chaudyg,2025-08-29T09:58:19Z,2025-09-16T10:16:30+00:00,23,432.3,True,1939,2154,8,385,0,16,16,MERGED
110331,Update CONTRIBUTING.md  (Fa1thw patch 4),tonypowa,2025-08-29T08:39:52Z,2025-08-29T10:37:10+00:00,1,1.96,True,1,1,1,152,0,0,0,MERGED
110329,Explore: Remove Drilldowns banner,ifrost,2025-08-29T08:17:14Z,2025-08-29T10:53:07+00:00,1,2.6,True,0,54,3,112,0,0,0,MERGED
110328,Provisioning: Disable flaky tests,andresmgot,2025-08-29T08:09:24Z,2025-08-29T09:13:34+00:00,1,1.07,False,4,0,4,422,0,0,0,CLOSED
110327,Extensions: Declare tempo as being used by Enterprise,macabu,2025-08-29T07:59:51Z,2025-08-29T09:13:45+00:00,1,1.23,True,19,0,3,311,0,0,0,MERGED
110326,Alerting: Add Triage feature toggle,konrad147,2025-08-29T07:59:08Z,2025-09-01T09:33:33+00:00,5,73.57,True,108,16,13,1607,0,1,1,MERGED
110325,[WIP] TimeSeries: Use exported time shift function with option,drew08t,2025-08-29T07:28:22Z,2025-09-02T22:00:38+00:00,1,110.54,False,71,8,8,77,1,1,2,CLOSED
110322,Trend: Fix x-axis max affected by null-append to bar series,leeoniya,2025-08-29T04:04:12Z,2025-08-29T14:47:15+00:00,1,10.72,True,331,16,2,12809,0,0,0,MERGED
110319,FolderPicker: Allow customizing root item display,ywzheng1,2025-08-28T22:59:31Z,2025-08-29T14:43:48+00:00,1,15.74,True,106,28,6,925,0,0,0,MERGED
110318,Kubernetes Dashboards: Delete resourceVersion (on update and create) and name (on create),harisrozajac,2025-08-28T21:41:51Z,2025-08-29T02:52:14+00:00,1,5.17,True,6,2,1,488,0,0,0,MERGED
110316,FS: Canvas panel icons and background images are missing,jesdavpet,2025-08-28T20:02:09Z,2025-09-02T19:38:45+00:00,15,119.61,True,38,62,7,747,0,6,6,MERGED
110315,Remove SCIM banner,colin-stuart,2025-08-28T19:49:24Z,2025-09-02T16:07:06+00:00,1,116.3,True,1,20,2,211,0,0,0,MERGED
110314,Documentation: Fix inconsistency in Entra SAML docs,zackman0010,2025-08-28T19:37:39Z,2025-09-09T09:09:40+00:00,2,277.53,True,6,6,1,471,0,0,0,MERGED
110313,Text: Add Inter italic font variants to Grafana UI,kapowaz,2025-08-28T18:51:43Z,2025-09-03T14:04:14+00:00,2,139.21,True,18,0,3,1367,2,0,2,MERGED
110310,Inline log details: adjust height on resize,matyax,2025-08-28T16:50:30Z,2025-08-28T18:24:47+00:00,1,1.57,True,27,2,2,139,0,0,0,MERGED
110308,Tooltip Filter: Add test for Filter for value,Develer,2025-08-28T16:37:19Z,2025-08-29T09:56:23+00:00,1,17.32,True,58,1,1,584,1,0,1,MERGED
110305,Folders: Remove conditional hook calling in new folders hooks,tomratcliffe,2025-08-28T16:22:40Z,2025-08-29T15:17:34+00:00,2,22.91,True,28,32,3,341,0,0,0,MERGED
110302,Unistore: Only Shadow Search Traffic when running on modes > 0,filewalkwithme,2025-08-28T15:55:49Z,2025-09-01T19:14:54+00:00,1,99.32,True,129,8,2,809,4,1,5,MERGED
110299,Saved Queries: Fix Change DS during replace query did not update DataSourcePicker,axelavargas,2025-08-28T15:23:07Z,2025-09-01T12:53:07+00:00,2,93.5,True,194,8,3,786,0,1,1,MERGED
110298,FolderPicker: Add new prop allow customize root folder name,ywzheng1,2025-08-28T15:05:55Z,2025-08-28T20:49:08+00:00,3,5.72,False,84,18,7,663,0,1,1,CLOSED
110296,New Log Details: Fix multiple displayed links and correlactions,matyax,2025-08-28T14:52:42Z,2025-08-28T16:47:12+00:00,1,1.91,True,8,2,2,139,3,0,3,MERGED
110295,Provisioning: Fix patching released resources when Repository is deleted,ferruvich,2025-08-28T14:49:00Z,2025-09-02T19:13:43+00:00,11,124.41,True,122,6,2,1385,3,4,7,MERGED
110294,Graphite: Decouple from core Grafana,aangelisc,2025-08-28T14:33:00Z,2025-09-10T17:48:29+00:00,6,315.26,True,972,289,35,1294,0,4,4,MERGED
110293,AuthZ: Recover from an outdated cached folder tree,gamab,2025-08-28T14:26:15Z,2025-09-01T09:16:02+00:00,1,90.83,True,78,19,2,126,0,0,0,MERGED
110291,Update Storybook documentation for RadioButtonGroup and RadioButtonList with usage guidance,kapowaz,2025-08-28T13:52:02Z,2025-09-03T11:24:50+00:00,4,141.55,True,23,12,2,1336,2,2,4,MERGED
110290,Docs: Add a reference to Terraform SCIM resource,vtorosyan,2025-08-28T13:50:10Z,2025-08-28T16:33:14+00:00,3,2.72,True,105,49,3,600,1,0,1,MERGED
110289,fix: improve rest client on integration tests,mustafasencer,2025-08-28T13:48:40Z,2025-08-28T16:04:13+00:00,6,2.26,True,80,72,2,190,0,1,1,MERGED
110287,[release-12.1.2] Fix link to site which is no longer relevant,grafana-delivery-bot,2025-08-28T13:33:22Z,2025-08-29T07:57:23+00:00,1,18.4,True,1,1,1,139,2,0,2,MERGED
110286,[release-12.0.5] Fix link to site which is no longer relevant,grafana-delivery-bot,2025-08-28T13:33:08Z,2025-08-29T07:57:40+00:00,1,18.41,True,1,1,1,139,2,0,2,MERGED
110285,[release-11.6.6] Fix link to site which is no longer relevant,grafana-delivery-bot,2025-08-28T13:31:06Z,2025-08-29T07:57:57+00:00,1,18.45,True,1,1,1,139,2,0,2,MERGED
110284,Dashboards: Fix kiosk mode not persisting through refresh,oscarkilhed,2025-08-28T13:07:16Z,2025-08-29T06:41:34+00:00,1,17.57,True,2,2,2,201,0,0,0,MERGED
110281,[release-12.1.2] Plugin Configs: Fix Env types,grafana-delivery-bot,2025-08-28T12:55:14Z,2025-09-05T08:17:56+00:00,1,187.38,True,13,13,7,701,1,0,1,MERGED
110280,Alerting: Reduce failed network requests in Filter V2,laurenashleigh,2025-08-28T12:54:22Z,2025-09-02T14:12:21+00:00,3,121.3,True,157,171,4,137,0,4,4,MERGED
110279,Chore: Move `Deprecated layout components` rule from Betterer to ESlint,eledobleefe,2025-08-28T12:02:43Z,2025-08-29T10:33:14+00:00,2,22.51,True,23,52,11,554,0,0,0,MERGED
110277,Pyroscope: Add start and end date to profiletypes call,zoltanbedi,2025-08-28T11:51:28Z,2025-08-29T08:05:34+00:00,1,20.23,True,4,0,1,743,0,0,0,MERGED
110276,New Log Details: Inline improvements,matyax,2025-08-28T11:31:55Z,2025-09-03T16:53:38+00:00,4,149.36,True,17,8,5,146,10,1,11,MERGED
110274,TabsLayoutManager: Tab url sync rethink,Sergej-Vlasov,2025-08-28T10:40:39Z,2025-09-02T14:09:55+00:00,4,123.49,True,130,114,7,262,0,1,1,MERGED
110271,Chore: Publish frontend metrics from github actions,ashharrison90,2025-08-28T10:22:52Z,2025-08-29T08:24:23+00:00,3,22.03,True,119,20,4,864,0,2,2,MERGED
110270,Provisioning: Add branch dropdown to save drawer,Clarity-89,2025-08-28T10:12:10Z,2025-08-29T14:47:25+00:00,3,28.59,True,162,39,12,193,2,1,3,MERGED
110269,Alerting: disable error alerts in Filter V2,laurenashleigh,2025-08-28T10:04:25Z,2025-08-28T11:43:44+00:00,1,1.66,True,1,0,1,75,0,0,0,MERGED
110268,Fix dashboard migration discrepancies between backend and frontend implementations (use `toEqual`),ivanortegaalba,2025-08-28T09:59:06Z,2025-09-24T10:20:25+00:00,9,648.36,True,158178,25092,298,4678,3,10,13,MERGED
110263,`grafana-iam`: change `resourcepermission` to use a single verb,gamab,2025-08-28T08:23:57Z,2025-08-28T09:25:38+00:00,1,1.03,True,16,28,4,112,0,0,0,MERGED
110261,Extensions: Declare tempo as being used by Enterprise,macabu,2025-08-28T08:04:29Z,2025-08-28T09:17:06+00:00,2,1.21,True,19,0,3,275,0,0,0,MERGED
110258,Add url configuration to openfeature settings,undef1nd,2025-08-28T07:28:14Z,2025-08-28T13:28:03+00:00,5,6.0,True,1,0,1,153,0,1,1,MERGED
110257,Alerting: Move alerting file to an alerting folder,soniaAguilarPeiron,2025-08-28T06:55:56Z,2025-08-28T12:11:19+00:00,1,5.26,True,68,35,30,571,0,0,0,MERGED
110256,`grafana-iam`: Implement `resourcepermission` get,mohammad-hamid,2025-08-28T06:40:02Z,2025-09-04T15:14:16+00:00,16,176.57,True,1075,8,16,1818,0,16,16,MERGED
110250,unified-storage: add ListSinceModified to kv store,gassiss,2025-08-27T21:16:41Z,2025-09-04T16:26:40+00:00,23,187.17,True,566,31,4,39,0,11,11,MERGED
110248,DOCS:  SQL expressions updates for v12.2,lwandz13,2025-08-27T20:14:59Z,2025-09-10T19:00:33+00:00,17,334.76,True,81,12,1,976,1,7,8,MERGED
110247,Secrets: garbage collection,PoorlyDefinedBehaviour,2025-08-27T19:57:54Z,2025-09-02T14:11:02+00:00,6,138.22,True,1069,35,30,83,0,4,4,MERGED
110246,`grafana-iam`: Implement `resourcepermission` creation,gamab,2025-08-27T19:50:22Z,2025-09-05T12:22:25+00:00,12,208.53,True,1117,36,25,221,1,8,9,MERGED
110244,Save Queries: Remove entry points when user has Viewer role,juanicabanas,2025-08-27T19:18:15Z,2025-09-01T17:18:02+00:00,3,118.0,True,74,1,3,544,0,2,2,MERGED
110243,[release-12.1.2] BackendSrv: remove ampersand in validatePath,grafana-delivery-bot,2025-08-27T18:42:49Z,2025-08-27T20:42:42+00:00,1,2.0,True,1,1,1,83,2,0,2,MERGED
110242,unistore/apistore: improve package docs,filewalkwithme,2025-08-27T18:31:54Z,2025-08-27T22:00:05+00:00,1,3.47,True,26,1,1,553,0,0,0,MERGED
110241,Accessibility: Constrain popups to screen height,samsch,2025-08-27T18:26:02Z,2025-08-28T15:43:39+00:00,1,21.29,True,4,0,2,759,0,0,0,MERGED
110240,unified-storage: Bleve test cleanup,gassiss,2025-08-27T18:25:25Z,2025-08-29T15:35:31+00:00,14,45.17,True,140,458,2,21,0,7,7,MERGED
110232,Chore: Fix no-restricted-imports config not applying correctly,joshhunt,2025-08-27T16:14:36Z,2025-08-28T09:19:37+00:00,2,17.08,True,105,102,5,1834,0,0,0,MERGED
110228,Provisioning: Move repository package to provisioning app,MissingRoberto,2025-08-27T14:54:23Z,2025-09-02T07:45:45+00:00,1,136.86,True,223,136,140,616,0,0,0,MERGED
110226,"Provisioning: Move apifmt, loki and safepath to provisioning app",MissingRoberto,2025-08-27T14:04:04Z,2025-08-27T18:26:49+00:00,1,4.38,True,32,31,42,591,0,0,0,MERGED
110225,Background Services: Add wrapper to support startup order,toddtreece,2025-08-27T13:23:54Z,2025-09-10T08:06:26+00:00,17,330.71,True,790,36,17,1970,3,10,13,MERGED
110224,New Logs Panel: Extend line wrapping to control JSON formatting,matyax,2025-08-27T13:17:49Z,2025-08-27T17:34:14+00:00,4,4.27,True,180,51,12,304,2,1,3,MERGED
110223,Provisioning: processing of jobs in job controller,MissingRoberto,2025-08-27T13:11:41Z,2025-09-05T18:28:32+00:00,11,221.28,True,111,14,1,630,0,14,14,MERGED
110218,`grafana-iam`: Skeleton of the resource permission api backend,gamab,2025-08-27T11:47:08Z,2025-08-27T13:00:10+00:00,1,1.22,True,194,17,8,119,0,0,0,MERGED
