number,title,author,createdAt,closedOrMergedAt,reviewsCount,hoursOpen
5010,feat(components): Add Webhook Icon to Component Definition,Vigtu,2024-12-02T20:12:40Z,2024-12-06T19:38:24+00:00,1,95.43
5011,docs: add uv installation,mendonk,2024-12-02T20:17:36Z,2024-12-03T13:07:51+00:00,1,16.84
5012,feat(component): implement directory component enhancements,raphaelchristi,2024-12-02T21:05:38Z,2024-12-12T18:23:07+00:00,3,237.29
5015,fix: correct param for TableInput value,erichare,2024-12-02T22:45:58Z,2024-12-03T15:19:23+00:00,1,16.56
5016,"Track caller versions in Astra DB, fix dynamic inputs",erichare,2024-12-03T00:46:13Z,2024-12-03T14:16:10+00:00,1,13.5
5020,feat: Add support for loading flows and components from URLs,cbornet,2024-12-03T12:43:53Z,2025-01-08T15:41:37+00:00,6,866.96
5022,feature: Add message feedback and update frontend interface,anovazzi1,2024-12-03T13:41:51Z,2024-12-17T19:09:06+00:00,4,341.45
5024,refactor: migrate flow handling hooks and clean up component code,Cristhianzl,2024-12-03T14:58:03Z,2024-12-03T20:08:44+00:00,1,5.18
5027,refactor: Simplify ContentDisplay component,anovazzi1,2024-12-03T15:36:17Z,2024-12-03T23:22:00+00:00,1,7.76
5030,fix: handle incorrect token in AstraDB,erichare,2024-12-03T16:39:28Z,2024-12-03T17:40:25+00:00,1,1.02
5031,"fix: apply variables to fields automatically, remove password truncation from variable fields",lucaseduoli,2024-12-03T18:34:29Z,2024-12-05T20:46:49+00:00,1,50.21
5032,fix: use cn utility for className assignment,Cristhianzl,2024-12-03T18:50:40Z,2024-12-04T14:16:10+00:00,1,19.43
5034,fix: auto fill chat input on new sessions,lucaseduoli,2024-12-03T19:05:52Z,2024-12-03T21:33:19+00:00,4,2.46
5035,fix: uncentered tweaks tables text and removed notes from tweaks,lucaseduoli,2024-12-03T19:15:39Z,2024-12-03T20:56:19+00:00,1,1.68
5036,refactor: Remove footer from TableModal component,anovazzi1,2024-12-03T19:17:02Z,2024-12-05T16:26:06+00:00,1,45.15
5037,Refactor: update NodeDescription component to conditionally render character limit message,anovazzi1,2024-12-03T19:24:31Z,2024-12-09T15:44:32+00:00,1,140.33
5038,Refactor: update NoteNode inputClassName to remove unnecessary ring and focus styles,anovazzi1,2024-12-03T19:35:19Z,2024-12-05T01:04:28+00:00,1,29.49
5039,fix: add condition to not block component from building when input is filled by tool mode,lucaseduoli,2024-12-03T20:11:33Z,2024-12-05T13:57:06+00:00,2,41.76
5040,fix: adjust GitLoader to work in a hosted environment,italojohnny,2024-12-03T20:54:41Z,2024-12-04T14:58:31+00:00,1,18.06
5041,refactor: Remove unnecessary code for handling Enter,anovazzi1,2024-12-03T21:02:02Z,2024-12-09T15:34:41+00:00,1,138.54
5043,Refactor actionsMainPage-shard-0.spec.ts,anovazzi1,2024-12-03T22:16:07Z,2024-12-05T17:17:07+00:00,1,43.02
5044,refactor: Improve wait times and visibility checks in auto-save-off tests,anovazzi1,2024-12-03T22:36:07Z,2024-12-05T17:50:34+00:00,1,43.24
5045,Refactor: update autoLogin.spec.ts to use waitForSelector,anovazzi1,2024-12-03T22:40:46Z,2024-12-05T18:10:37+00:00,1,43.5
5046,Refactor: update curlApiGeneration test,anovazzi1,2024-12-03T22:43:00Z,2024-12-05T16:39:00+00:00,1,41.93
5048,fix: update drag and drop test,anovazzi1,2024-12-03T22:55:41Z,2024-12-04T20:33:22+00:00,1,21.63
5049,Refactor: refactor wait times and selectors in filterEdge-shard-1.spec.ts,anovazzi1,2024-12-03T23:01:57Z,2024-12-05T18:00:16+00:00,1,42.97
5051,docs: add docs to huggingface space restart script,Plasma-69,2024-12-04T08:18:11Z,2024-12-19T18:52:33+00:00,1,370.57
5054,fix: Fix test_get_and_cache_all_types_dict,cbornet,2024-12-04T13:08:50Z,2024-12-05T13:15:22+00:00,1,24.11
5057,ref: Make load_flow_from_json async,cbornet,2024-12-04T15:37:23Z,2024-12-11T17:53:33+00:00,6,170.27
5058,feat: Enhance Observability with ArizePhoenixTracer Integration,ialisaleh,2024-12-04T15:50:13Z,2024-12-05T16:09:03+00:00,14,24.31
5060,Fix: update broken test generalBugs-shard-12.spec,anovazzi1,2024-12-04T17:11:08Z,2024-12-04T18:37:19+00:00,1,1.44
5061,refactor: Adjust chat view layout for responsiveness,anovazzi1,2024-12-04T17:27:52Z,2024-12-05T17:33:08+00:00,1,24.09
5062,refactor: Add displayLoadingMessage flag to MessagesStoreType and adjust chat view layout,anovazzi1,2024-12-04T18:28:06Z,2024-12-11T14:04:56+00:00,3,163.61
5064,fix: Fix: improve error in InputFileComponent when displaying invalid file types,anovazzi1,2024-12-04T19:10:47Z,2024-12-05T17:42:37+00:00,1,22.53
5065,feat: enhance slider component with labels and improved input handling,Cristhianzl,2024-12-04T19:13:03Z,2024-12-06T13:03:00+00:00,3,41.83
5066,fix: re-activated playground page and made it full screen,lucaseduoli,2024-12-04T19:21:22Z,2024-12-05T20:10:16+00:00,1,24.82
5068,fix: update all naming to be plural sensitive,lucaseduoli,2024-12-04T19:33:31Z,2024-12-05T21:16:46+00:00,2,25.72
5069,fix: changed advanced settings to controls,lucaseduoli,2024-12-04T19:51:15Z,2024-12-05T21:24:39+00:00,1,25.56
5070,refactor: Improve reliability of flowPage.spec.ts test,anovazzi1,2024-12-04T19:54:03Z,2024-12-06T00:39:15+00:00,1,28.75
5071,fix: clear chat input when sending from play button,lucaseduoli,2024-12-04T19:56:31Z,2024-12-05T20:57:50+00:00,1,25.02
5072,refactor: Enhance flowSettings.spec.ts with improved element selectors and timeouts,anovazzi1,2024-12-04T19:57:51Z,2024-12-06T00:21:57+00:00,1,28.4
5073,Refactor: Remove unnecessary code and comments in integration-side-bar.spec.ts,anovazzi1,2024-12-04T20:50:54Z,2024-12-09T13:04:37+00:00,1,112.23
5074,Refactor: Improve performance on test,anovazzi1,2024-12-04T20:53:51Z,2024-12-06T01:05:46+00:00,1,28.2
5075,feat: add tool mode to AstraDB search input and enable AstraDB as a vector search Tool,edwinjosechittilappilly,2024-12-04T20:56:20Z,2024-12-09T23:26:14+00:00,1,122.5
5076,Refactor: Remove unnecessary wait timeouts in limit-file-size-upload test,anovazzi1,2024-12-04T21:08:09Z,2024-12-06T00:56:29+00:00,1,27.81
5077,Refactor: update wait timeouts in minimize.spec.ts,anovazzi1,2024-12-04T21:12:54Z,2024-12-06T00:47:33+00:00,1,27.58
5078,Refactor: Update wait selectors in outdated-actions.spec.ts,anovazzi1,2024-12-04T21:18:39Z,2024-12-06T01:14:08+00:00,1,27.92
5079,Refactor: update selectors in outdated message test,anovazzi1,2024-12-04T21:26:06Z,2025-01-07T16:52:37+00:00,1,811.44
5080,improve: improve pythonGenerationCodeAPI,anovazzi1,2024-12-04T21:31:23Z,2024-12-06T01:28:16+00:00,1,27.95
5084,refactor: simplify input_types in LCToolsAgentComponent  (remove BaseTool and StructuredTool),Cristhianzl,2024-12-05T12:22:12Z,2024-12-18T21:07:46+00:00,1,320.76
5087,ref: Bump ruff version to 0.8,cbornet,2024-12-05T14:47:27Z,2024-12-08T11:16:07+00:00,1,68.48
5088,ref: Apply ruff rule TC006,cbornet,2024-12-05T14:51:15Z,2024-12-08T11:35:01+00:00,1,68.73
5089,ref: Apply ruff rule RUF052,cbornet,2024-12-05T15:00:56Z,2024-12-08T11:51:03+00:00,1,68.84
5092,fix: allow passing curly braces in system instructions to the Agent component ,edwinjosechittilappilly,2024-12-05T15:43:29Z,2024-12-05T21:36:24+00:00,1,5.88
5093,ref: Apply ruff rules FURB110 and RUF046,cbornet,2024-12-05T16:08:00Z,2024-12-08T11:05:07+00:00,1,66.95
5094,chore: update import paths and button icon styles in table component,Cristhianzl,2024-12-05T17:05:26Z,2024-12-06T12:50:25+00:00,1,19.75
5095,feat(component): rename Parse Data to Data to Message for better clarity,raphaelchristi,2024-12-05T18:14:25Z,2025-01-05T20:37:15+00:00,3,746.38
5098,Refactor: improve starter project modal test,anovazzi1,2024-12-05T19:08:29Z,2024-12-07T02:47:30+00:00,1,31.65
5099,fix: have defaults for the table schema,erichare,2024-12-05T19:26:36Z,2024-12-12T18:33:15+00:00,1,167.11
5100,Refactor: Improve wait times and selectors in sticky-notes.spec.ts,anovazzi1,2024-12-05T19:36:04Z,2024-12-09T16:01:12+00:00,1,92.42
5102,fix: redirect to previous page after login,lucaseduoli,2024-12-05T20:38:57Z,2024-12-06T15:01:13+00:00,1,18.37
5103,fix: make sending a message not change the value of chatinput node,lucaseduoli,2024-12-05T20:46:56Z,2024-12-09T19:38:26+00:00,1,94.86
5104,Refactor: Improve wait times and visibility checks in stop-button-playground.spec.ts,anovazzi1,2024-12-05T20:51:49Z,2024-12-07T02:57:04+00:00,1,30.09
5105,Refactor: Remove unnecessary wait times in store-shard-0.spec.ts,anovazzi1,2024-12-05T20:53:29Z,2024-12-08T01:30:55+00:00,1,52.62
5106,fix: changed truncation style for big folder and flow names on header,lucaseduoli,2024-12-05T20:56:55Z,2024-12-10T16:23:43+00:00,1,115.45
5108,Refactor: Improve wait times and visibility checks in store-shard-3.spec.ts,anovazzi1,2024-12-05T21:21:10Z,2024-12-08T00:44:13+00:00,1,51.38
5109,Refactor: Improve wait times and visibility checks in twoEdges.spec.ts,anovazzi1,2024-12-05T21:27:59Z,2024-12-07T17:05:31+00:00,1,43.63
5110,feat: add tool mode to components that store and retrieve message history,rodrigosnader,2024-12-05T21:44:20Z,2024-12-06T18:16:04+00:00,1,20.53
5111,docs: composio component,mendonk,2024-12-05T22:36:03Z,2024-12-11T22:44:23+00:00,6,144.14
5113,feat: Add tool mode to the prompt component,rodrigosnader,2024-12-06T02:57:24Z,2024-12-06T18:03:49+00:00,1,15.11
5116,fix: Fix to_frontend_node modifying input components,cbornet,2024-12-06T12:26:37Z,2024-12-09T11:09:17+00:00,1,70.71
5117,fix: make chatinput text appear on playground only if no sessions are present,lucaseduoli,2024-12-06T14:16:58Z,2024-12-09T18:37:14+00:00,1,76.34
5118,feat: Restructure Youtube Transcripts component,viniciossilva3,2024-12-06T14:20:15Z,2024-12-11T20:27:19+00:00,2,126.12
5120,refactor: Improve wait times and visibility checks in userSettings.spec.ts,anovazzi1,2024-12-06T14:48:39Z,2024-12-09T16:40:22+00:00,1,73.86
5122,feature: Add interactive reader to dictAreaModal,anovazzi1,2024-12-06T16:39:38Z,2024-12-06T23:56:46+00:00,1,7.29
5124,Refactor: update selectItem component and remove unused imports,anovazzi1,2024-12-06T18:00:26Z,2024-12-17T02:12:04+00:00,1,248.19
5125,feat(component): enhance merge data with standard operations,raphaelchristi,2024-12-06T18:04:00Z,2024-12-20T12:27:52+00:00,3,330.4
5126,refactor: Remove unnecessary wait timeouts in chatInputOutputUser-shard-1.spec.ts,anovazzi1,2024-12-06T18:09:24Z,2024-12-06T23:21:04+00:00,1,5.19
5127,refactor: Remove unnecessary wait timeouts in chatInputOutputUser-shard-2.spec.ts,anovazzi1,2024-12-06T18:12:57Z,2024-12-07T15:30:48+00:00,1,21.3
5128,refactor: Improve page loading and element selection in DuckDuckGo integration test,anovazzi1,2024-12-06T18:15:31Z,2024-12-07T00:13:12+00:00,1,5.96
5129,Refactor: improve YouTube Transcripts integration tests,anovazzi1,2024-12-06T18:19:45Z,2024-12-07T03:43:24+00:00,1,9.39
5130,Refactor: remove unnecessary wait in component-as-tool-shortcut test,anovazzi1,2024-12-06T18:24:28Z,2024-12-06T23:47:00+00:00,1,5.38
5131,feat(component): enhance chat input component,raphaelchristi,2024-12-06T18:25:18Z,2025-01-09T16:50:56+00:00,10,814.43
5132,Refactor: update remove unnecessary wait timeouts in regression test,anovazzi1,2024-12-06T18:28:40Z,2024-12-07T02:36:50+00:00,1,8.14
5133,Refactor: remove unnecessary wait timeouts in regression test,anovazzi1,2024-12-06T18:34:30Z,2024-12-06T23:36:44+00:00,1,5.04
5134,refactor: Improve page loading and element visibility in regression tests,anovazzi1,2024-12-06T18:44:26Z,2024-12-09T16:10:18+00:00,1,69.43
5135,Refactor: Improve test stability and reliability,anovazzi1,2024-12-06T18:50:23Z,2024-12-07T03:19:18+00:00,1,8.48
5136,refactor: Improve page loading and element visibility in regression tests,anovazzi1,2024-12-06T19:14:45Z,2024-12-07T04:14:09+00:00,1,8.99
5137,Refactor: Improve wait times in regression test,anovazzi1,2024-12-06T19:20:30Z,2024-12-07T16:54:27+00:00,1,21.57
5138,Refactor: add data test id and improve wait times for element selectors in regression tests,anovazzi1,2024-12-06T19:35:44Z,2024-12-09T16:49:11+00:00,1,69.22
5139,refactor: Improve flow creation and search performance in test,anovazzi1,2024-12-06T19:39:28Z,2024-12-07T03:07:28+00:00,1,7.47
5140,Refactor: remove timeouts from generalbugs-shard10,anovazzi1,2024-12-06T19:48:08Z,2024-12-07T15:18:45+00:00,1,19.51
5141,refactor: Improve wait time for modals and elements in regression tests,anovazzi1,2024-12-06T20:00:51Z,2024-12-09T12:18:57+00:00,1,64.3
5142,fix: Improve  test and add improve timeouts,anovazzi1,2024-12-06T21:06:51Z,2024-12-07T02:25:40+00:00,1,5.31
5143,refactor: Remove unnecessary wait for timeout in Travel Planning Agent test,anovazzi1,2024-12-06T21:19:03Z,2024-12-07T14:54:28+00:00,1,17.59
5144,refactor Improve Vector Store test,anovazzi1,2024-12-06T21:34:06Z,2024-12-07T01:26:00+00:00,1,3.87
5146,ref: Remove sync get_session and DbSession,cbornet,2024-12-07T01:19:09Z,2024-12-08T10:27:19+00:00,1,33.14
5148,feat: add anthropic mcp endpoint,phact,2024-12-07T07:06:12Z,2025-01-03T04:56:31+00:00,20,645.84
5149,ref: Remove some useless asyncio.to_thread,cbornet,2024-12-07T13:22:45Z,2024-12-08T19:13:08+00:00,3,29.84
5150,fix: Execute event manager callbacks in asyncio thread,cbornet,2024-12-07T14:53:46Z,2024-12-09T16:23:03+00:00,1,49.49
5151,ref: Use AsyncSession in some tests,cbornet,2024-12-07T15:49:39Z,2024-12-08T01:09:44+00:00,1,9.33
5156,ref: Fix some ruff preview rules,cbornet,2024-12-08T18:49:07Z,2024-12-11T13:37:30+00:00,1,66.81
5157,feat: Activate blockbuster Lock.aquire detection,cbornet,2024-12-08T19:16:17Z,2024-12-09T12:59:50+00:00,1,17.73
5162,chore(ui): add text-foreground class to NodeStatus build element,Cristhianzl,2024-12-09T12:42:06Z,2024-12-09T20:13:28+00:00,1,7.52
5163,ref: Make initialize_database async,cbornet,2024-12-09T14:09:05Z,2024-12-10T06:44:35+00:00,1,16.59
5165,ref: Make create_or_update_starter_projects async,cbornet,2024-12-09T15:05:07Z,2024-12-10T07:51:35+00:00,1,16.77
5167,fix: Use anyio for file operations in a few places,cbornet,2024-12-09T15:44:57Z,2024-12-10T01:55:42+00:00,1,10.18
5168,test: Add utility functions to streamline test setup and improve maintainability,Cristhianzl,2024-12-09T17:26:27Z,2024-12-09T20:30:57+00:00,1,3.08
5170,fix: add load_from_db to all agents,anovazzi1,2024-12-09T20:24:50Z,2024-12-09T23:50:08+00:00,2,3.42
5171,refactor(openai): Remove deprecated parameters from OpenAI component,raphaelchristi,2024-12-09T21:59:53Z,2024-12-10T14:45:32+00:00,2,16.76
5172,refactor(Agent): remove unused parameters,raphaelchristi,2024-12-09T22:36:17Z,2025-01-20T16:11:54+00:00,1,1001.59
5173,chore(deps): bump nanoid in /src/frontend,dependabot,2024-12-09T23:47:42Z,2024-12-10T11:43:57+00:00,1,11.94
5174,feat: adding tool mode to LC model component,edwinjosechittilappilly,2024-12-10T01:24:14Z,2024-12-13T17:29:07+00:00,1,88.08
5176,feat: add README.FR.md for French speakers,AlexShadow3,2024-12-10T08:56:12Z,2024-12-12T15:14:43+00:00,4,54.31
5178,fix: validate and test database connection URLs,italojohnny,2024-12-10T09:42:17Z,2024-12-17T17:29:54+00:00,2,175.79
5180,ref: improving development environment and instructions,mieslep,2024-12-10T12:35:34Z,2024-12-12T12:01:05+00:00,6,47.43
5181,fix: Add async aupdate_build_config to CustomComponent,cbornet,2024-12-10T13:19:42Z,2024-12-11T16:25:15+00:00,2,27.09
5184,fix: adjust path to run only unit tests,italojohnny,2024-12-10T14:04:06Z,2025-01-08T13:50:57+00:00,3,695.78
5189,fix: Refactor JSON serialization in build_flow and log_vertex_build,anovazzi1,2024-12-10T19:19:07Z,2024-12-12T18:51:24+00:00,2,47.54
5190,feat!: rename the type BaseChatMessageHistory to Memory,italojohnny,2024-12-10T19:28:41Z,2024-12-18T22:20:38+00:00,1,194.87
5192,fix: Update Search API component to latest version from Travel Planning Agents template,Cristhianzl,2024-12-10T20:42:48Z,2024-12-11T18:08:19+00:00,1,21.43
5193,feat: add optional env var to skip starter project updates,jordanrfrazier,2024-12-10T20:47:55Z,2024-12-11T12:24:40+00:00,1,15.61
5195,ci: script and workflow to update starter projects,jordanrfrazier,2024-12-10T22:58:30Z,2024-12-12T02:48:55+00:00,3,27.84
5199,fix: make errors in build_flow function use the standardized ErrorMessage schema,ogabrielluiz,2024-12-11T13:29:14Z,2024-12-18T16:28:28+00:00,2,170.99
5200,fix: use SecretStr get_secret_value for LMStudio API key handling,Cristhianzl,2024-12-11T14:19:23Z,2024-12-12T12:08:04+00:00,3,21.81
5201,docs: Swap pip and uv installation instructions in README and install,mendonk,2024-12-11T14:52:27Z,2024-12-11T17:21:26+00:00,1,2.48
5202,docs: fix typos in documentation files,cypherpepe,2024-12-11T14:53:20Z,2024-12-11T17:30:08+00:00,1,2.61
5205,fix: Resolve DOM validation & React lifecycle warnings,Cristhianzl,2024-12-11T15:58:45Z,2024-12-11T17:48:12+00:00,1,1.82
5207,Docs: update quickstart,mendonk,2024-12-11T17:18:24Z,2024-12-11T21:33:03+00:00,1,4.24
5210,fix zep chat add support for cloud ,edwinjosechittilappilly,2024-12-11T18:08:07Z,2025-04-08T15:17:12+00:00,1,2829.15
5212,fix: validateDOMNesting error on nodeToolbarComponent,Cristhianzl,2024-12-11T19:31:51Z,2024-12-12T19:54:07+00:00,1,24.37
5213,feat: add gemini-2.0-flash-exp and gemini-exp-1206 models,raphaelchristi,2024-12-11T19:43:49Z,2024-12-12T21:21:46+00:00,1,25.63
5214,fix: update font size of prompt when validated,lucaseduoli,2024-12-11T20:03:12Z,2024-12-17T17:10:42+00:00,1,141.12
5216,feature: Improve Table customization to enhance ux on tool mode,anovazzi1,2024-12-11T21:17:22Z,2024-12-16T17:50:01+00:00,2,116.54
5217,feat: Enhance ConditionalRouterComponent with Regex Matching and UI Improvements,Vigtu,2024-12-11T21:47:33Z,2024-12-16T18:13:26+00:00,6,116.43
5218,feat: add vector retrieval and update policy/template,pedrocassalpacheco,2024-12-11T22:48:54Z,2024-12-18T16:01:51+00:00,4,161.22
5220,docs: fix typos Update integrations-assemblyai.md,mdqst,2024-12-12T08:12:48Z,2024-12-12T12:16:11+00:00,1,4.06
5222,ref: Make list_flows async,cbornet,2024-12-12T09:57:40Z,2024-12-12T16:02:44+00:00,5,6.08
5224,ref: Use async list_variables,cbornet,2024-12-12T10:30:15Z,2024-12-12T12:28:33+00:00,1,1.97
5225,docs: fix typo Update deployment-gcp.md,mdqst,2024-12-12T12:23:36Z,2024-12-18T18:29:21+00:00,2,150.1
5226,ref: Add and use update_component_build_config utility,cbornet,2024-12-12T12:48:53Z,2024-12-12T23:58:20+00:00,1,11.16
5227,fix: remove unused import and simplify key generation in SideBarFoldersButtonsComponent,Cristhianzl,2024-12-12T13:21:35Z,2024-12-12T15:42:10+00:00,1,2.34
5228,ref: Remove unused build_lc_memory,cbornet,2024-12-12T13:59:51Z,2024-12-16T15:34:48+00:00,1,97.58
5233,fix: Do a better job of mapping Langchain to LiteLLM,erichare,2024-12-12T16:17:32Z,2024-12-12T18:56:40+00:00,1,2.65
5235,refactor: reduce logging of SQLite pragmas and enhance model provider type safety,ogabrielluiz,2024-12-12T17:58:21Z,2024-12-13T14:20:55+00:00,2,20.38
5238,feat: add support for Python 3.13,ogabrielluiz,2024-12-12T19:11:09Z,2024-12-12T20:24:43+00:00,1,1.23
5240,ci: Update GitHub Actions workflow to include Python 3.13,ogabrielluiz,2024-12-12T20:42:29Z,2024-12-13T17:28:42+00:00,2,20.77
5242,fix: fixes agents issue by removing depreciated feature output parser from the LLM Model Components,edwinjosechittilappilly,2024-12-13T02:33:38Z,2024-12-16T16:04:24+00:00,3,85.51
5248,"fix: fixes tool metadata order and update issue, resolves agent tool metadata update failure",edwinjosechittilappilly,2024-12-13T16:17:48Z,2024-12-16T18:33:35+00:00,2,74.26
5249,Adding a complete component 'Place Call' to Olivya's Bundle Section,JamalBoustani,2024-12-13T16:24:52Z,2025-01-15T15:35:43+00:00,1,791.18
5251,feat: update react and react-dom versions to 18.3.1,Cristhianzl,2024-12-13T17:27:28Z,2024-12-13T18:55:16+00:00,1,1.46
5252,feat: turn most class variables into instance variables in the Component classes,ogabrielluiz,2024-12-13T18:00:23Z,2024-12-18T19:05:21+00:00,1,121.08
5253,perf: Optimize component rendering with memoization and useCallback hooks,Cristhianzl,2024-12-13T18:16:56Z,2024-12-13T22:24:45+00:00,1,4.13
5254,fix: support additional autodetect astradb params,erichare,2024-12-13T18:20:00Z,2024-12-13T19:23:43+00:00,1,1.06
5255,fix: simplify input field handling in InputListComponent,Cristhianzl,2024-12-13T19:02:23Z,2024-12-13T22:06:48+00:00,2,3.07
5257,chore: Fix audit vulnerabilities and update dependencies,ogabrielluiz,2024-12-13T19:10:38Z,2024-12-16T22:19:54+00:00,1,75.15
5259,ci: update docker image configuration for secure deployments,jordanrfrazier,2024-12-13T19:47:41Z,2024-12-13T22:38:55+00:00,2,2.85
5260,ci: Improve TypeScript test workflow logging,ogabrielluiz,2024-12-13T19:48:55Z,2024-12-16T21:20:51+00:00,2,73.53
5261,"refactor:  ⚡️ Speed up function `find_last_node` by 29,891%",misrasaurabh1,2024-12-13T22:16:17Z,2024-12-16T21:58:32+00:00,1,71.7
5262,refactor:  ⚡️ Speed up function `find_cycle_vertices` by 324%,misrasaurabh1,2024-12-13T22:18:30Z,2024-12-17T02:33:37+00:00,4,76.25
5263,refactor:  ⚡️ Speed up method `Graph.sort_chat_inputs_first` by 152%,misrasaurabh1,2024-12-13T22:23:58Z,2024-12-18T16:01:51+00:00,2,113.63
5267,feat: improve component configuration and input clarity,rodrigosnader,2024-12-14T06:09:02Z,2024-12-16T14:39:33+00:00,1,56.51
5269,fix: Put back some sync methods for backward compatibility.,cbornet,2024-12-14T12:17:53Z,2024-12-16T14:18:16+00:00,1,50.01
5271,feat: Add OpenRouter component for multi-provider model access,raphaelchristi,2024-12-14T21:22:57Z,2024-12-19T19:43:38+00:00,1,118.34
5272,fix: Properly handle invalid endpoint parameters in Baidu Qianfan component,niuguy,2024-12-14T23:57:19Z,2024-12-17T16:36:24+00:00,4,64.65
5281,feat: implement pagination for transaction log queries,dhlidongming,2024-12-16T12:47:16Z,2024-12-16T21:04:30+00:00,3,8.29
5288,ci: Add Python version input to setup-uv action and update workflow configuration,ogabrielluiz,2024-12-16T15:20:48Z,2024-12-17T01:48:50+00:00,1,10.47
5291,fix: move blocking io ops to async method on dbservice init,jordanrfrazier,2024-12-16T17:22:57Z,2024-12-17T13:21:34+00:00,3,19.98
5292,feat: Bump blockbuster version to 1.5.0,cbornet,2024-12-16T17:47:44Z,2024-12-17T22:26:19+00:00,1,28.64
5296,perf: Optimize component with memoization and selective store subscriptions,Cristhianzl,2024-12-16T20:36:31Z,2024-12-17T14:05:14+00:00,1,17.48
5297,feat: add pydantic-ai and update dependencies to support it,ogabrielluiz,2024-12-16T20:57:19Z,2024-12-17T13:41:06+00:00,1,16.73
5298,FIX: Clean up the advanced parameters in Astra DB Vector Store Component,erichare,2024-12-16T21:56:51Z,2024-12-17T02:33:07+00:00,3,4.6
5299,chore: remove console logs and unused imports,Cristhianzl,2024-12-16T22:14:03Z,2024-12-17T13:52:12+00:00,1,15.64
5301,perf: optimize vertex build query for recent records,dhlidongming,2024-12-17T05:24:36Z,2024-12-18T18:28:34+00:00,2,37.07
5304,ci: update changes filter to include lock files and base pyproject.toml,ogabrielluiz,2024-12-17T11:51:31Z,2024-12-17T13:23:55+00:00,1,1.54
5308,feat: improve chat scroll behavior during tab switches,Cristhianzl,2024-12-17T15:23:46Z,2024-12-17T21:20:39+00:00,1,5.95
5309,fix: make messages appear in the correct order again,ogabrielluiz,2024-12-17T16:45:29Z,2024-12-18T01:45:23+00:00,1,9.0
5310,"refactor: Enhance error handling, message editing and prompt display",Cristhianzl,2024-12-17T17:18:16Z,2024-12-19T20:02:15+00:00,5,50.73
5311,feat: add tool_mode parameter to MessageTextInput in ID Generator Component,Vigtu,2024-12-17T17:26:22Z,2024-12-18T22:06:49+00:00,1,28.67
5312,feat: introduce BundleItem component and memoize sidebar groups for performance,Cristhianzl,2024-12-17T17:43:53Z,2024-12-17T21:43:04+00:00,1,3.99
5315,Docs: components updates,mendonk,2024-12-17T18:30:52Z,2024-12-20T21:49:43+00:00,7,75.31
5316,fix: Fix tool mode switch state persistence in NodeToolbarComponent,Cristhianzl,2024-12-17T19:29:02Z,2024-12-17T22:00:37+00:00,1,2.53
5317,refactor: update ReactFlow to v12,lucaseduoli,2024-12-17T19:47:22Z,2024-12-18T19:52:23+00:00,2,24.08
5320,fix: Error handling in loading components/features in Agent Component,edwinjosechittilappilly,2024-12-17T21:31:51Z,2024-12-18T01:30:34+00:00,2,3.98
5322,"refactor:  (codeflash)⚡️ Speed up method `JSONCleaner._remove_control_characters` by 1,491%",misrasaurabh1,2024-12-17T23:42:46Z,2024-12-18T22:06:49+00:00,1,22.4
5323,refactor:  (codeflash) ⚡️ Speed up method `CalculatorToolComponent._eval_expr` by 103%,misrasaurabh1,2024-12-17T23:54:35Z,2024-12-18T22:03:56+00:00,3,22.16
5331,feat: Bump blockbuster version to 1.5.2,cbornet,2024-12-18T12:20:53Z,2024-12-18T14:43:32+00:00,1,2.38
5332,fix: make serialization errors in component update show up in the UI,ogabrielluiz,2024-12-18T12:57:14Z,2024-12-18T18:41:24+00:00,1,5.74
5333,"ref: Remove unused sync session_scope, with_session and engine",cbornet,2024-12-18T15:21:34Z,2024-12-18T21:02:50+00:00,1,5.69
5334,fix: Fix missing await in initialize_alembic_log_file,cbornet,2024-12-18T15:25:59Z,2024-12-18T17:18:38+00:00,1,1.88
5336,feat: ArizePhoenixTracer v2 - Enhanced Session Tracking and Flow Organization,ialisaleh,2024-12-18T15:40:55Z,2024-12-18T17:59:37+00:00,3,2.31
5339,feat: add ToolModeMixin to existting Input Types except SecretsInputs,edwinjosechittilappilly,2024-12-18T16:57:09Z,2024-12-18T20:41:27+00:00,2,3.74
5341,feat: add dataframe operations component,rodrigosnader,2024-12-18T17:58:04Z,2024-12-19T16:24:26+00:00,2,22.44
5343,feature: add command feature column to toolset table and other minor table improvements,anovazzi1,2024-12-18T18:16:21Z,2025-01-10T12:26:26+00:00,5,546.17
5344,refactor: Simplify agent input text content construction,anovazzi1,2024-12-18T19:11:44Z,2024-12-20T13:39:42+00:00,2,42.47
5345,fix: make search on sidebar shortcut not be triggered inside inputs,lucaseduoli,2024-12-18T20:22:26Z,2024-12-19T17:37:42+00:00,1,21.25
5346,fix:  improve UUID handling in flow helpers,edwinjosechittilappilly,2024-12-18T21:13:27Z,2024-12-19T01:25:29+00:00,1,4.2
5347,fix: remove redundant memoization from parameter render components to fix input cursor position,Cristhianzl,2024-12-18T21:50:46Z,2024-12-19T18:34:51+00:00,1,20.73
5348,feat: tool mode for all vector store components,erichare,2024-12-18T22:14:17Z,2024-12-19T17:01:59+00:00,1,18.8
