number,title,author,createdAt,closedOrMergedAt,reviewsCount,hoursOpen,merged,additions,deletions,changedFiles,bodyLength,issueCommentsCount,reviewThreadsCount,interactionsCount,finalReviewState
6151,Add a Mini-spec for `cursorTextColor`,zadjii-msft,2020-05-22T20:42:36Z,2021-01-21T13:17:39+00:00,2,5848.58,False,169,0,1,590,5,1,6,CLOSED
6146,"Fix #6079, allow pasting from Explorer's 'Copy Address'",aldahick,2020-05-22T17:20:27Z,2020-05-27T17:42:50+00:00,2,120.37,True,11,0,1,514,3,0,3,MERGED
6140,fix files without carriage return on the last line,flug,2020-05-22T15:15:14Z,2020-05-28T07:38:10+00:00,1,136.38,False,141,141,544,0,0,0,0,CLOSED
6139,"Add support for `--fullscreen`, `--maximized`",zadjii-msft,2020-05-22T14:59:45Z,2020-06-01T21:57:31+00:00,3,246.96,True,160,129,9,1021,4,2,6,MERGED
6110,Replace everything in `TerminalSettings` with `GETSET_PROPERTY`,zadjii-msft,2020-05-21T21:15:16Z,2020-05-27T21:46:40+00:00,5,144.52,True,69,514,3,252,1,1,2,MERGED
6100,"Add a context menu entry to ""Open Windows Terminal here""",zadjii-msft,2020-05-21T17:39:05Z,2020-05-28T15:42:14+00:00,23,166.05,True,580,11,22,1669,33,22,55,MERGED
6062,Implement preventing auto-scroll on new output,carlos-zamora,2020-05-21T00:21:49Z,2020-07-09T11:24:21+00:00,7,1187.04,True,10,2,1,1019,9,4,13,MERGED
6060,Add support for fullscreen `launchMode`,zadjii-msft,2020-05-20T19:58:53Z,2020-05-28T16:53:02+00:00,3,188.9,True,90,56,7,452,4,1,5,MERGED
6048,Add font weight options,miniksa,2020-05-20T18:01:04Z,2020-05-20T20:17:18+00:00,12,2.27,True,159,6,13,1130,19,8,27,MERGED
6011,Update to point to live docs,mattwojo,2020-05-19T23:40:06Z,2020-05-21T12:41:56+00:00,2,37.03,True,1,1,1,666,0,0,0,MERGED
6004,Add copyFormatting keybinding arg and array support,carlos-zamora,2020-05-19T19:56:09Z,2020-08-15T01:02:25+00:00,29,2093.1,True,174,33,14,1433,9,26,35,MERGED
5999,Correct the default 6x6x6 palette entries,j4james,2020-05-19T18:13:25Z,2020-05-19T20:02:39+00:00,2,1.82,True,134,134,1,714,6,0,6,MERGED
5996,Send the user-docs to a farm upstate,DHowett,2020-05-19T16:51:23Z,2020-06-02T22:00:13+00:00,1,341.15,False,0,1092,5,121,4,0,4,CLOSED
5988,Make sure to update the maximize button's visual state on launch,zadjii-msft,2020-05-19T14:38:38Z,2020-05-21T23:27:34+00:00,3,56.82,True,5,0,1,373,3,1,4,MERGED
5967,doc: correct Help Wanted link in CONTRIBUTING.md,shivam284,2020-05-18T14:27:26Z,2020-05-18T16:28:31+00:00,2,2.02,True,2,2,1,691,1,0,1,MERGED
5961,doc: fix a typo in user-docs/index.md,mengqi92,2020-05-18T07:32:11Z,2020-05-18T16:29:30+00:00,2,8.96,True,1,1,1,533,0,0,0,MERGED
5946,tools: add a powershell script to generate CPWD from the UCD,DHowett,2020-05-17T02:50:02Z,2020-06-03T07:16:15+00:00,7,412.44,True,280,1,3,2194,9,1,10,MERGED
5934,Partially regenerate codepoint widths from Emoji 13.0,DHowett-MSFT,2020-05-16T07:09:14Z,2020-05-17T20:32:44+00:00,1,37.39,True,111,144,2,869,3,0,3,MERGED
5931,Replace manual get/set code in GlobalAppSettings with GETSET_PROPERTY,DHowett-MSFT,2020-05-15T22:54:51Z,2020-06-03T22:51:47+00:00,5,455.95,True,121,305,7,449,2,2,4,MERGED
5928,Adds Alt+Click to auto split pane,carlos-zamora,2020-05-15T17:03:46Z,2020-06-01T20:26:22+00:00,2,411.38,True,23,1,1,489,3,0,3,MERGED
5927,Adding hint about full screen mode,mikewo,2020-05-15T15:13:28Z,2020-05-20T21:07:56+00:00,1,125.91,False,2,1,1,715,1,0,1,CLOSED
5922,ci: spelling: update to 0.0.16a; update advice,jsoref,2020-05-15T12:19:31Z,2020-05-28T13:01:53+00:00,8,312.71,True,40,79,11,1545,10,2,12,MERGED
5918,Remove the JSON reserializers (except for AKB),DHowett-MSFT,2020-05-15T00:26:11Z,2020-05-15T21:51:58+00:00,2,21.43,True,2,298,8,557,1,0,1,MERGED
5915,Add Mini-Spec for openSettings,carlos-zamora,2020-05-14T19:17:14Z,2020-06-11T17:12:09+00:00,5,669.92,True,135,0,1,372,8,5,13,MERGED
5914,"CodepointWidthDetector: reclassify U+25FB, U+25FC as Narrow",DHowett-MSFT,2020-05-14T17:57:27Z,2020-05-14T23:49:08+00:00,3,5.86,True,1,1,1,288,10,0,10,MERGED
5909,doc: add a tip about launching WT with a Win+Number shortcut,hmemcpy,2020-05-14T15:51:02Z,2020-05-14T23:48:04+00:00,2,7.95,True,2,1,1,212,2,0,2,MERGED
5888,Mini-spec for New Tab Menu Customization,zadjii-msft,2020-05-13T17:43:26Z,2020-08-12T13:40:39+00:00,19,2179.95,True,300,0,2,751,8,15,23,MERGED
5887,Spec for Improved keyboard handling in Conpty,zadjii-msft,2020-05-13T16:51:43Z,2020-06-04T12:42:34+00:00,29,523.85,True,574,0,4,790,12,25,37,MERGED
5883,Manually close tabs when they're closed while dragging them,zadjii-msft,2020-05-13T16:07:52Z,2020-05-14T01:47:33+00:00,2,9.66,True,14,1,1,792,4,0,4,MERGED
5882,Rename `propsheet/TerminalPage` to `propsheet/TerminalPropsheetPage`,zadjii-msft,2020-05-13T15:18:34Z,2020-05-14T01:49:20+00:00,2,10.51,True,23,23,5,353,1,0,1,MERGED
5881,Get rid of the padding above the tab row when maximized,zadjii-msft,2020-05-13T14:57:22Z,2020-05-21T22:26:37+00:00,5,199.49,True,57,5,2,1135,3,1,4,MERGED
5875,doc: Propose a JsonUtils replacement by writing documentation,DHowett-MSFT,2020-05-13T06:17:52Z,2020-06-04T05:54:55+00:00,10,527.62,True,257,0,1,270,13,5,18,MERGED
5874,closeTab warning (When more then one pane is open),Chips1234,2020-05-13T04:13:56Z,2020-07-25T18:52:53+00:00,22,1766.65,False,1110,1043,9,576,15,6,21,CLOSED
5870,Fix an accidental regression from #5771,zadjii-msft,2020-05-12T20:31:02Z,2020-05-12T22:02:16+00:00,2,1.52,True,121,0,2,2506,1,0,1,MERGED
5866,Revert some emoji back to narrow width,leonMSFT,2020-05-12T17:57:11Z,2020-05-12T19:38:11+00:00,2,1.68,True,7,7,2,734,3,0,3,MERGED
5865,Implement drag-drop paste for text,zadjii-msft,2020-05-12T17:31:35Z,2020-05-12T21:46:47+00:00,4,4.25,True,55,31,2,558,3,2,5,MERGED
5859,doc: fix broken link within documentation,Morgy93,2020-05-12T12:37:05Z,2020-05-12T18:27:37+00:00,3,5.84,True,1,1,1,539,0,0,0,MERGED
5856,Teach TerminalPage to handle exceptions that happen during paste,DHowett-MSFT,2020-05-12T01:40:42Z,2020-05-12T18:23:59+00:00,2,16.72,True,8,4,1,620,2,0,2,MERGED
5855,Stop trying to set selection endpoints when there's no selection,DHowett-MSFT,2020-05-12T01:13:14Z,2020-05-12T18:23:10+00:00,3,17.17,True,12,0,2,633,2,0,2,MERGED
5851,InteractivityWin32: Add a dependency on Dx,DHowett-MSFT,2020-05-11T20:59:33Z,2020-05-11T22:09:15+00:00,2,1.16,True,5,0,1,166,7,0,7,MERGED
5849,Dialogue to show all keyboard shortcuts,Chips1234,2020-05-11T19:13:12Z,2020-08-13T16:06:27+00:00,3,2252.89,False,113,0,4,575,20,1,21,CLOSED
5848,"dx: when filling an HWND target, use the actual background color",DHowett-MSFT,2020-05-11T19:08:56Z,2020-05-11T20:54:29+00:00,3,1.76,True,6,1,1,132,2,0,2,MERGED
5847,Switch the Cascadia projects to til::color where it's easily possible to do so,DHowett-MSFT,2020-05-11T18:23:38Z,2020-05-15T22:43:01+00:00,8,100.32,True,143,102,18,647,1,4,5,MERGED
5834,Fix SGR indexed colors to distinguish Indexed256 color (and more),j4james,2020-05-10T19:39:44Z,2020-05-27T22:34:46+00:00,17,410.92,True,328,376,36,5115,9,5,14,MERGED
5823,Add support for OSC 52 (copy-to-clipboard),uzxmx,2020-05-09T05:29:37Z,2020-06-30T01:55:41+00:00,28,1244.43,True,499,4,27,561,27,17,44,MERGED
5809,Manually select a new tab when we're in fullscreen mode,zadjii-msft,2020-05-08T13:59:00Z,2020-05-08T18:53:35+00:00,2,4.91,True,31,0,1,1131,2,0,2,MERGED
5804,Introduce Mark Mode spec (add-on),carlos-zamora,2020-05-08T06:06:56Z,2022-07-22T23:08:09+00:00,19,19337.02,True,282,171,8,494,35,17,52,MERGED
5798,Trigger scroll on scrolled selection,carlos-zamora,2020-05-07T21:00:45Z,2020-05-08T21:48:24+00:00,4,24.79,True,1,1,1,243,7,0,7,MERGED
5795,Make most emojis full-width,leonMSFT,2020-05-07T18:38:55Z,2020-05-08T22:31:10+00:00,5,27.87,True,130,145,3,1322,13,1,14,MERGED
5792,Initialize the text buffer with the default attributes on a resize,zadjii-msft,2020-05-07T16:59:17Z,2021-04-21T21:34:28+00:00,9,8380.59,True,169,3,3,969,4,2,6,MERGED
5789,Update the tab's close button color to match the tab text color,zadjii-msft,2020-05-07T14:07:54Z,2020-06-05T19:12:28+00:00,2,701.08,True,3,1,1,872,1,0,1,MERGED
5787,Add support for `compact` tab sizing,zadjii-msft,2020-05-07T13:52:03Z,2020-06-05T18:51:05+00:00,2,700.98,True,22,10,3,759,5,0,5,MERGED
5778,Move to Microsoft.UI.Xaml 2.4.0,DHowett-MSFT,2020-05-07T01:05:46Z,2020-06-05T17:07:03+00:00,4,712.02,True,18,18,11,203,28,0,28,MERGED
5775,Enable tab renaming at runtime from the UI,zadjii-msft,2020-05-06T21:37:55Z,2020-05-28T21:06:18+00:00,8,527.47,True,193,26,4,1493,9,4,13,MERGED
5774,Add a new appxmanifest for preview,carlos-zamora,2020-05-06T21:17:27Z,2020-05-07T16:00:56+00:00,5,18.72,True,180,17,7,432,2,6,8,MERGED
5772,Add a XAML Theming spec,zadjii-msft,2020-05-06T19:53:13Z,2021-07-07T13:30:59+00:00,8,10241.63,False,513,0,4,1326,12,8,20,CLOSED
5771,Fix wrapped lines in `less` in Git for Windows,zadjii-msft,2020-05-06T17:52:13Z,2020-05-08T21:22:10+00:00,3,51.5,True,421,13,5,1908,3,8,11,MERGED
5765,Update docs to mention commandline args,uSlackr,2020-05-06T13:22:26Z,2020-05-06T19:08:19+00:00,2,5.76,True,1,1,1,507,2,0,2,MERGED
5758,Refactor the SGR implementation in AdaptDispatch,j4james,2020-05-05T22:40:58Z,2020-05-08T23:04:17+00:00,15,72.39,True,519,1452,28,3678,24,10,34,MERGED
5752,Add File Explorer tip to User Docs,uSlackr,2020-05-05T14:26:18Z,2020-05-05T16:50:27+00:00,2,2.4,True,1,1,1,595,0,0,0,MERGED
5749,Don't set the new tab button colors for now,zadjii-msft,2020-05-05T13:25:48Z,2020-05-05T20:33:08+00:00,2,7.12,True,10,1,1,602,0,0,0,MERGED
5743,Scale box drawing glyphs to fit cells for visual bliss,miniksa,2020-05-04T22:45:24Z,2020-05-08T21:09:33+00:00,31,94.4,True,673,43,14,4692,11,22,33,MERGED
5742,Make sure we don't try to remove tabs when they don't exist,DHowett-MSFT,2020-05-04T22:28:59Z,2020-05-05T16:16:10+00:00,2,17.79,True,5,3,1,305,1,0,1,MERGED
5734,Fix RTL regression (fixes #4779),schorrm,2020-05-04T13:10:36Z,2020-05-04T16:14:45+00:00,4,3.07,True,10,4,1,1196,7,4,11,MERGED
5706,Allow the default profile to be specified by name,DHowett-MSFT,2020-05-02T20:26:53Z,2020-06-01T20:26:01+00:00,8,719.99,True,174,115,8,1415,2,8,10,MERGED
5690,"Make profile names, scheme names case-insensitive",zadjii-msft,2020-05-01T16:46:16Z,2020-07-13T14:51:26+00:00,6,1750.09,False,599,48,13,1389,1,3,4,CLOSED
5684,Add a note that the user needs to hide dynamic profiles,zadjii-msft,2020-05-01T13:28:26Z,2020-05-04T20:04:10+00:00,2,78.6,True,6,0,1,142,0,1,1,MERGED
5683,Make sure that EraseAll moves the Terminal viewport,zadjii-msft,2020-05-01T12:30:51Z,2020-05-05T01:36:31+00:00,4,85.09,True,139,7,5,1564,4,3,7,MERGED
5681,Update New Tab Button styling for consistency,carlos-zamora,2020-04-30T23:53:43Z,2020-06-04T19:00:00+00:00,1,835.1,False,1,1,1,431,6,0,6,CLOSED
5679,Remove the (Preview) tag from the primary App Name,DHowett-MSFT,2020-04-30T22:54:57Z,2020-05-01T16:30:17+00:00,2,17.59,True,1,1,1,30,2,0,2,MERGED
5674,Finalize Command Palette Spec,zadjii-msft,2020-04-30T20:25:36Z,2020-06-11T21:33:21+00:00,14,1009.13,True,788,430,3,772,9,10,19,MERGED
5673,"On second thought, embed the third-party notices in the package",DHowett-MSFT,2020-04-30T19:04:43Z,2020-04-30T22:06:14+00:00,10,3.03,True,42,34,10,391,0,4,4,MERGED
5671,Correct position on startup when window is out of screen,dynahcatq,2020-04-30T15:07:06Z,2021-09-28T01:01:05+00:00,1,12369.9,False,54,25,1,1387,7,1,8,CLOSED
5661,Bundle the entire CRT with our branded Release packages,DHowett-MSFT,2020-04-29T23:27:55Z,2020-04-30T07:08:44+00:00,3,7.68,True,69,1,5,582,4,3,7,MERGED
5656,"Remove ""Getting Started"" from the about dialog",DHowett-MSFT,2020-04-29T19:10:22Z,2020-04-29T23:37:01+00:00,2,4.44,True,0,3,1,225,1,0,1,MERGED
5654,Grab the write lock before updating the font,leonMSFT,2020-04-29T18:52:14Z,2020-04-30T00:05:30+00:00,4,5.22,True,19,13,2,632,10,1,11,MERGED
5652,Add explicit identifier to some constructors,unknown,2020-04-29T18:22:02Z,2020-04-29T23:50:47+00:00,2,5.48,True,12,11,11,706,2,0,2,MERGED
5645,Reserve textClusterColumns vector for performance,skyline75489,2020-04-29T12:11:39Z,2020-04-29T20:12:06+00:00,3,8.01,True,2,0,1,763,7,0,7,MERGED
5644,Added even more quick exit in InsertAttrRuns,skyline75489,2020-04-29T12:08:23Z,2020-04-29T20:08:38+00:00,3,8.0,True,44,2,2,841,8,0,8,MERGED
5630,Clamp the new rows scrolling value to a positive number,zadjii-msft,2020-04-28T21:58:23Z,2020-04-29T19:29:00+00:00,3,21.51,True,195,4,5,899,6,0,6,MERGED
5629,"Intentionally leak our Application, so that we DON'T crash on exit",zadjii-msft,2020-04-28T21:42:51Z,2020-04-30T19:36:02+00:00,4,45.89,True,18,0,1,1094,5,0,5,MERGED
5627,"Implement a pair of shims for `cls`, `Clear-Host` in conpty mode",zadjii-msft,2020-04-28T20:02:33Z,2020-04-30T21:53:32+00:00,6,49.85,True,475,72,24,1711,9,4,13,MERGED
5620,Hide the commandline on a resize to prevent a crash when snapping the window,zadjii-msft,2020-04-28T14:45:13Z,2020-04-29T23:47:57+00:00,6,33.05,True,96,28,3,1067,2,1,3,MERGED
5609,Adjust TSFInputControl alignment,leonMSFT,2020-04-28T06:27:44Z,2020-04-28T18:50:34+00:00,3,12.38,True,26,8,2,2008,2,0,2,MERGED
5599,Add and enforce minimum width,carlos-zamora,2020-04-27T18:50:33Z,2020-04-28T23:24:21+00:00,7,28.56,True,10,0,2,817,13,1,14,MERGED
5598,Improve default foregrounds for Tango schemes,rkitover,2020-04-27T18:02:56Z,2020-04-27T22:20:02+00:00,2,4.29,True,8,8,3,620,4,0,4,MERGED
5597,Add a warning about using the `globals` property,zadjii-msft,2020-04-27T17:50:21Z,2020-04-27T22:20:18+00:00,3,4.5,True,122,28,6,475,5,0,5,MERGED
5595,Remove the title tag from the generated HTML,zadjii-msft,2020-04-27T17:12:48Z,2020-04-29T23:41:57+00:00,5,54.49,True,12,9,5,597,4,1,5,MERGED
5593,"Add a ""My Settings Don't Work Anymore!"" issue template",zadjii-msft,2020-04-27T14:34:24Z,2020-04-28T20:35:48+00:00,1,30.02,False,23,0,1,171,3,3,6,CLOSED
5592,Prevent DXRenderer from using invalid properties,skyline75489,2020-04-27T12:36:22Z,2020-04-28T04:56:32+00:00,1,16.34,False,7,0,1,531,1,0,1,CLOSED
5584,Improve cluster construction performance,skyline75489,2020-04-27T00:02:36Z,2020-04-28T15:41:45+00:00,4,39.65,True,6,3,1,724,5,2,7,MERGED
5570,Add Anaconda PowerShell variant to third party tool profiles,letmaik,2020-04-25T21:32:56Z,2020-05-14T23:58:01+00:00,1,458.42,False,15,0,2,547,3,0,3,CLOSED
5556,Updating to change from requestedTheme to theme,mariusstrom,2020-04-25T02:50:43Z,2020-04-27T13:57:47+00:00,3,59.12,True,1,1,1,479,0,0,0,MERGED
5552,Fix Ctrl+Alt not being treated as a substitute for AltGr anymore,lhecker,2020-04-24T22:27:11Z,2020-04-28T22:27:44+00:00,7,96.01,True,12,12,2,631,5,3,8,MERGED
5550,Don't remove spaces when printing a new bottom line with a background color,zadjii-msft,2020-04-24T21:23:47Z,2020-04-30T15:01:04+00:00,3,137.62,True,195,1,6,591,4,0,4,MERGED
5549,doc: add `disabledProfileSources` to the schema,zadjii-msft,2020-04-24T20:36:14Z,2020-04-24T22:15:28+00:00,2,1.65,True,17,1,2,76,1,0,1,MERGED
5542,Actually check the elevation status when disabling tab rearrange,DHowett-MSFT,2020-04-24T17:38:51Z,2020-04-27T16:17:20+00:00,2,70.64,True,1,1,1,37,1,0,1,MERGED
5536,Lower case modifiers in doc,dotnetCarpenter,2020-04-24T14:36:57Z,2020-04-24T16:12:23+00:00,2,1.59,True,1,1,1,669,0,0,0,MERGED
5534,Remove last lingering references to profiles.json,zadjii-msft,2020-04-24T13:29:10Z,2020-04-24T21:29:34+00:00,4,8.01,True,14,13,6,279,1,1,2,MERGED
5533,"Add descriptions for `backgroundImageAlignment`, `backgroundImageOpacity`",zadjii-msft,2020-04-24T13:27:27Z,2020-04-24T17:15:36+00:00,2,3.8,True,2,1,1,165,1,0,1,MERGED
5509,Make sure background color is opaque when attrs are reversed,j4james,2020-04-23T20:22:53Z,2020-04-23T21:35:12+00:00,6,1.21,True,2,2,1,1550,0,1,1,MERGED
5508,Add a Third-Party notices link to the about dialog,leonMSFT,2020-04-23T20:16:40Z,2020-04-28T20:22:45+00:00,13,120.1,True,44,0,7,432,3,2,5,MERGED
5505,"Include Cascadia Mono in-package, switch to it by default",DHowett-MSFT,2020-04-23T19:22:29Z,2020-04-23T22:12:37+00:00,4,2.84,True,12,7,9,633,5,0,5,MERGED
5501,Add support for displaying the version with `wt --version`,zadjii-msft,2020-04-23T16:54:05Z,2020-05-04T20:56:16+00:00,8,268.04,True,109,37,10,172,3,3,6,MERGED
5485,Replace the HRGN-based titlebar cutout with an overlay window,DHowett-MSFT,2020-04-23T05:55:15Z,2020-04-24T22:22:40+00:00,12,40.46,True,198,79,6,1927,9,4,13,MERGED
5484,Add tooltip text to New Tab/Min/Max/Close,Chips1234,2020-04-23T04:11:37Z,2020-04-30T22:45:57+00:00,7,186.57,True,12,0,1,751,10,1,11,MERGED
5478,Notify UIA when Search finds something,carlos-zamora,2020-04-22T22:42:18Z,2020-04-29T17:36:46+00:00,2,162.91,True,7,5,1,454,2,0,2,MERGED
5472,Re-enable Ctrl-C if the application that spawned us disabled it,DHowett-MSFT,2020-04-22T18:57:12Z,2020-04-23T15:00:42+00:00,2,20.06,True,7,0,1,432,1,0,1,MERGED
5457,Use string_view where possible,rongjiecomputer,2020-04-22T04:55:51Z,2020-04-22T17:24:20+00:00,3,12.47,True,2,2,1,78,2,0,2,MERGED
5453,Enable Control Flow Guard in the common build props,DHowett-MSFT,2020-04-21T20:18:27Z,2020-04-22T18:30:14+00:00,2,22.2,True,1,0,1,48,7,0,7,MERGED
5451,build: move oss required to build conhost out of dep/,DHowett-MSFT,2020-04-21T18:48:39Z,2020-04-21T21:43:10+00:00,2,2.91,True,49,8,56,197,1,0,1,MERGED
5449,Add a test to cover #5428,zadjii-msft,2020-04-21T18:03:20Z,2020-04-22T11:16:18+00:00,2,17.22,True,137,0,1,208,1,0,1,MERGED
5448,doc: add a note about running `wt` in the current instance,zadjii-msft,2020-04-21T17:22:44Z,2020-04-21T20:45:19+00:00,2,3.38,True,7,2,1,207,0,0,0,MERGED
5432,Change Windows Powershell default scheme to Campbell,carlos-zamora,2020-04-20T22:48:44Z,2020-04-21T17:19:55+00:00,2,18.52,True,1,1,1,243,3,0,3,MERGED
5431,Send a Ctrl-C KeyUp event,leonMSFT,2020-04-20T22:41:10Z,2020-04-22T17:28:05+00:00,4,42.78,True,7,4,2,431,5,0,5,MERGED
5427,Various Differential Drawing fixes for #5345,zadjii-msft,2020-04-20T16:15:42Z,2020-04-20T22:01:26+00:00,9,5.76,True,250,105,9,1666,5,2,7,MERGED
5424,Add a git submodules sanity check step to the build,zadjii-msft,2020-04-20T12:19:23Z,2020-04-20T18:11:36+00:00,2,5.87,True,8,0,1,234,3,0,3,MERGED
5413,ci: spelling: update to 0.0.15a; update whitelist,jsoref,2020-04-19T05:23:55Z,2020-04-21T21:07:05+00:00,6,63.72,True,9,71,8,1191,1,1,2,MERGED
5407,Introduce UnicodeAttribute for better Unicode support,skyline75489,2020-04-18T09:38:19Z,2021-01-07T08:14:43+00:00,4,6334.61,False,331,23,16,1368,5,3,8,CLOSED
5405,Constrain a11y word nav to the virtual bottom,carlos-zamora,2020-04-18T00:10:02Z,2021-03-29T17:08:04+00:00,5,8296.97,False,5,2,1,955,16,3,19,CLOSED
5404,Add copyFormatting setting to all settings json files,carlos-zamora,2020-04-17T23:37:47Z,2020-04-20T23:49:13+00:00,3,72.19,True,6,1,4,117,10,0,10,MERGED
5399,UIA: Prevent crash from invalid UTR endpoint comparison,carlos-zamora,2020-04-17T21:58:55Z,2020-04-21T16:45:18+00:00,6,90.77,True,21,4,1,879,9,2,11,MERGED
5398,Don't duplicate spaces from potentially-wrapped EOL-deferred lines,DHowett-MSFT,2020-04-17T21:25:21Z,2020-04-20T21:45:44+00:00,13,72.34,True,58,1,2,467,3,3,6,MERGED
5388,"wpf: only dismiss selection for real chars, not modifiers",DHowett-MSFT,2020-04-17T07:20:31Z,2020-04-17T18:28:57+00:00,2,11.14,True,36,8,3,546,4,0,4,MERGED
5385,Fix a deadlock and a bounding rects issue in UIA,DHowett-MSFT,2020-04-17T00:42:51Z,2020-04-17T17:09:59+00:00,2,16.45,True,6,2,1,783,1,0,1,MERGED
5383,Add SS3 cursor key encoding to ConPty,carlos-zamora,2020-04-16T20:41:20Z,2020-04-17T16:14:39+00:00,4,19.56,True,74,49,4,411,2,0,2,MERGED
5381,"Spec for ""Independent Tab and Window Titles """,dgnuff,2020-04-16T20:01:42Z,2023-06-13T08:32:29+00:00,3,27660.51,False,84,0,2,686,8,1,9,CLOSED
5375,wpf: add support for VT mouse mode,DHowett-MSFT,2020-04-16T05:27:08Z,2020-04-17T02:05:47+00:00,4,20.64,True,75,0,4,723,4,1,5,MERGED
5374,"wpf: port selection changes from TermControl, add multi-click selection",DHowett-MSFT,2020-04-16T05:24:08Z,2020-04-17T01:10:30+00:00,6,19.77,True,83,18,3,537,5,3,8,MERGED
5373,wpf: fix two crashes and some fallout from the new key event handler,DHowett-MSFT,2020-04-16T05:21:50Z,2020-04-17T01:10:15+00:00,4,19.81,True,3,3,1,421,2,0,2,MERGED
5369,Tooltip Text,Chips1234,2020-04-15T23:34:40Z,2020-04-23T04:11:56+00:00,3,172.62,False,4,0,2,768,6,2,8,CLOSED
5368,Don't reflow a line as wrapped if it broke on the last cell,zadjii-msft,2020-04-15T21:41:19Z,2023-04-06T17:37:35+00:00,1,26059.94,False,2163,480927,38,1332,2,1,3,CLOSED
5365,Disable incremental rendering.,miniksa,2020-04-15T20:12:27Z,2020-04-21T17:21:25+00:00,3,141.15,False,20,15,1,719,5,0,5,CLOSED
5361,doc: Add note about using `;` as a separator in PowerShell,zadjii-msft,2020-04-15T17:13:13Z,2020-04-21T21:55:03+00:00,11,148.7,True,73,5,1,225,1,6,7,MERGED
5356,Rework error handling and state flow in the Azure connection,DHowett-MSFT,2020-04-14T22:16:01Z,2020-04-17T00:32:53+00:00,3,50.28,True,320,257,4,2767,5,1,6,MERGED
5350,specs: draft spec for adding profiles to the Windows jumplist,zadjii-msft,2020-04-14T16:52:24Z,2020-04-14T20:17:16+00:00,3,3.41,True,133,0,5,810,0,0,0,MERGED
5346,"Remove singleLine copy from Shift+Click, CopyOnSelect ",carlos-zamora,2020-04-13T23:08:47Z,2020-04-14T20:19:23+00:00,2,21.18,True,3,11,2,1023,2,0,2,MERGED
5345,Adjusts High DPI scaling to enable differential rendering,miniksa,2020-04-13T22:32:17Z,2020-04-22T21:59:52+00:00,9,215.46,True,356,166,17,2885,17,6,23,MERGED
5339,Fix localizability issues in Windows Terminal,DHowett-MSFT,2020-04-13T19:08:37Z,2020-04-14T20:48:46+00:00,2,25.67,True,54,46,6,268,2,0,2,MERGED
5336,"Import fmtlib/fmt@6.2.0, a C++20-style format library",DHowett,2020-04-13T05:22:59Z,2020-04-14T20:04:24+00:00,6,38.69,True,11495,4,24,1035,10,1,11,MERGED
5327,"fix scheme name resolution, and schema load on WSL",johnazariah,2020-04-12T03:50:34Z,2020-07-01T20:15:10+00:00,3,1936.41,True,487,492,6,835,4,0,4,MERGED
5319,Show a double width cursor for double width characters,leonMSFT,2020-04-10T21:41:34Z,2020-04-15T19:23:07+00:00,10,117.69,True,67,13,7,2331,11,4,15,MERGED
5317,Update the virtual bottom location if the cursor moves below it,j4james,2020-04-10T19:02:22Z,2020-04-14T20:20:30+00:00,4,97.3,True,55,0,2,1392,2,0,2,MERGED
5305,Add the Tango color schemes for Terminal and ColorTool,rkitover,2020-04-10T00:46:05Z,2020-04-14T17:47:02+00:00,3,113.02,True,499,1,4,615,9,0,9,MERGED
5304,doc: clean up the schema,carlos-zamora,2020-04-09T22:58:46Z,2020-04-28T19:14:31+00:00,22,452.26,True,39,116,1,932,2,15,17,MERGED
5303,Don't wait for a connection to finish when a control is closed,zadjii-msft,2020-04-09T19:45:42Z,2020-04-09T23:27:57+00:00,2,3.7,True,28,5,2,1468,4,0,4,MERGED
5300,Add support for the DSR-OS operating status report,j4james,2020-04-09T18:59:30Z,2020-04-09T20:11:37+00:00,2,1.2,True,48,5,8,1220,1,0,1,MERGED
5299,Add 'copyFormatting' global setting,carlos-zamora,2020-04-09T18:18:59Z,2020-04-09T23:32:39+00:00,3,5.23,True,32,10,5,903,5,0,5,MERGED
5294,Emit lines wrapped due to spaces at the end correctly,zadjii-msft,2020-04-09T14:58:00Z,2020-04-15T15:52:11+00:00,13,144.9,True,199,21,4,1883,16,3,19,MERGED
5292,Control: make sure we actually have a dispatcher in 100ms,DHowett-MSFT,2020-04-09T06:04:54Z,2020-04-09T19:08:07+00:00,2,13.05,True,2,1,1,192,1,0,1,MERGED
5289,Muffle updates to the cursor position to 1/~100ms,DHowett-MSFT,2020-04-08T23:03:01Z,2020-04-09T00:20:51+00:00,8,1.3,True,23,0,2,228,5,2,7,MERGED
5287,"Localize the profile name for cmd, change it to Command Prompt",DHowett-MSFT,2020-04-08T19:04:29Z,2020-04-08T20:41:59+00:00,3,1.62,True,9,2,4,865,0,0,0,MERGED
5286,Control: Start the connection outside of lock,DHowett-MSFT,2020-04-08T18:39:55Z,2020-04-08T20:55:21+00:00,2,2.26,True,6,2,1,534,1,0,1,MERGED
5285,tips and tricks added about random theme using Z-shell,krishnadevz,2020-04-08T17:08:59Z,2020-04-09T20:13:31+00:00,7,27.08,False,9,1,1,600,6,3,9,CLOSED
5280,Spec: Introduce a mini-specification for localized resource use from JSON,DHowett-MSFT,2020-04-08T00:29:15Z,2020-04-09T21:42:10+00:00,6,45.22,False,94,0,1,118,5,5,10,CLOSED
5277,Use grayscale AA always on non-opaque backgrounds,zadjii-msft,2020-04-07T21:51:51Z,2020-04-24T17:16:35+00:00,7,403.41,True,132,3,5,1763,6,2,8,MERGED
5274,Fall back to TerminalApp.dll's version when we're unpackaged,DHowett-MSFT,2020-04-07T20:41:18Z,2020-04-09T22:59:22+00:00,2,50.3,True,34,0,2,800,1,0,1,MERGED
5272,Fixed #5205: Ctrl+Alt+2 doesn't send ^[^@,lhecker,2020-04-07T20:15:56Z,2021-02-08T15:33:38+00:00,5,7363.3,True,22,12,2,1367,13,4,17,MERGED
5270,ci: spelling: update to 0.0.14a,jsoref,2020-04-07T15:44:40Z,2020-04-07T21:58:13+00:00,2,6.23,True,3,5,2,2450,3,0,3,MERGED
5265,Rename 'requestedTheme' to 'theme',carlos-zamora,2020-04-07T00:43:30Z,2020-04-07T19:14:07+00:00,5,18.51,True,21,23,7,325,3,0,3,MERGED
5263,Add 'copyFormatting' global setting,carlos-zamora,2020-04-06T23:34:26Z,2020-04-09T18:03:33+00:00,4,66.49,True,32,10,5,853,8,1,9,MERGED
5256,"Split rolling and PR builds. Drop ARM64, X86 from PR.",miniksa,2020-04-06T16:00:34Z,2020-04-06T22:11:04+00:00,2,6.17,True,39,17,1,762,11,0,11,MERGED
5251,Prevent the cursor type being reset when changing the visibility,j4james,2020-04-06T00:26:50Z,2020-04-06T23:00:41+00:00,3,22.56,True,9,1,1,1402,6,0,6,MERGED
5248,Make RIS switch back to the main buffer,j4james,2020-04-05T15:30:18Z,2020-04-06T23:44:56+00:00,4,32.24,True,37,2,2,1257,4,1,5,MERGED
5232,Patch the default profile and version into the settings template,DHowett-MSFT,2020-04-03T23:03:53Z,2020-04-07T18:35:06+00:00,10,91.52,True,143,35,15,846,2,6,8,MERGED
5231,Add default values to defaults.json,carlos-zamora,2020-04-03T21:51:13Z,2020-04-09T23:13:57+00:00,22,145.38,True,72,39,5,558,19,16,35,MERGED
5225,Relax locking around the swapchain,DHowett-MSFT,2020-04-03T00:22:26Z,2020-04-07T00:15:32+00:00,2,95.89,True,3,10,1,377,5,1,6,MERGED
5224,"Force all our dialogs into the application theme, forcibly",DHowett-MSFT,2020-04-02T23:39:05Z,2020-04-03T15:55:04+00:00,4,16.27,True,21,1,1,666,6,1,7,MERGED
5223,Change aka.ms links to fwlinks,cinnamon-msft,2020-04-02T18:29:04Z,2020-04-02T23:19:04+00:00,3,4.83,True,5,5,2,551,0,0,0,MERGED
