number,title,author,createdAt,closedOrMergedAt,reviewsCount,hoursOpen,merged,additions,deletions,changedFiles,bodyLength,issueCommentsCount,reviewThreadsCount,interactionsCount,finalReviewState
19406,Extra semicolon removed,Lochit-Vinay,2025-10-02T18:06:40Z,2025-10-02T19:08:23+00:00,1,1.03,False,1,1,1,1220,1,0,1,CLOSED
19403,Remove the leading fire from the taskbar progress handler,DHowett,2025-10-01T23:30:28Z,2025-10-02T16:24:31+00:00,1,16.9,True,0,1,1,730,0,0,0,MERGED
19401,Fix ghost characters with tmux over SSH (GH#18004),giuliohome,2025-10-01T00:58:09Z,2025-10-05T18:18:38+00:00,3,113.34,False,388,19,11,7,6,3,9,CLOSED
19395,"Avoid reentrancy issues when dropping AppHost, even harder",DHowett,2025-09-29T16:56:55Z,2025-09-30T21:05:58+00:00,2,28.15,True,3,3,1,922,0,0,0,MERGED
19387,Minor fixes to the settings schema,ralish,2025-09-27T12:12:44Z,2025-10-03T04:13:37+00:00,5,136.01,True,52,34,1,724,3,3,6,MERGED
19375, Fix broken MSDN link in gdi/state.cpp,AvishekDas5,2025-09-24T04:04:01Z,2025-09-25T19:17:09+00:00,1,39.22,True,1,1,1,524,4,0,4,MERGED
19372,Fix broken MSDN link in gdi/state.cpp,AvishekDas5,2025-09-23T14:16:22Z,2025-09-24T03:56:33+00:00,2,13.67,False,1,1,1,534,1,1,2,CLOSED
19365,Add GitHub Actions workflow for Windows Terminal build,AvishekDas5,2025-09-20T16:14:43Z,2025-09-21T03:23:02+00:00,2,11.14,False,155,0,6,331,3,2,5,CLOSED
19354,Avoid generating SSH profiles using stale memory,DHowett,2025-09-16T19:20:27Z,2025-09-16T20:23:58+00:00,1,1.06,True,6,15,2,127,1,0,1,MERGED
19353,Move newTabMenu creation to Settings Fixups,DHowett,2025-09-16T19:19:46Z,2025-09-16T21:08:45+00:00,4,1.82,True,12,11,1,903,2,1,3,MERGED
19352,VsDev: reject VS instances which do not actually contain devshell/devcmd,DHowett,2025-09-16T18:34:44Z,2025-09-16T20:24:10+00:00,1,1.82,True,5,3,2,13,1,0,1,MERGED
19351,Add tab color setting to settings UI,carlos-zamora,2025-09-15T21:51:06Z,2025-09-25T18:37:44+00:00,2,236.78,True,122,4,5,1244,1,2,3,MERGED
19347,Fix behavior of split-plane for existing windows,lhecker,2025-09-13T16:59:46Z,2025-09-16T18:09:56+00:00,1,73.17,True,5,4,2,77,0,0,0,MERGED
19344,Rewrite the MSAA/UIA integration into conhost,lhecker,2025-09-12T14:04:27Z,2025-09-22T22:53:52+00:00,14,248.82,True,923,1023,78,520,1,26,27,MERGED
19335,Apparently finish the SLNX migration,DHowett,2025-09-10T00:14:44Z,2025-09-10T01:39:40+00:00,1,1.42,True,76,76,1,82,0,0,0,MERGED
19332,Fix terminal profile schema to allow null in keybinding id,cavanaug,2025-09-08T23:11:16Z,2025-09-11T18:06:33+00:00,3,66.92,True,9,2,1,1180,2,0,2,MERGED
19329,Fix a crash in _makeCursorVisible,lhecker,2025-09-08T19:18:39Z,2025-09-10T19:21:46+00:00,7,48.05,True,33,10,2,132,1,3,4,MERGED
19328,Convert the solution file to the new SLNX format,DHowett,2025-09-08T18:04:42Z,2025-09-09T20:01:04+00:00,5,25.94,True,1096,2392,12,0,2,8,10,MERGED
19323,tests: add UIHelpers and ThemeHelpers to TestHostApp,DHowett,2025-09-05T21:28:40Z,2025-09-08T17:21:30+00:00,2,67.88,True,4,0,1,64,0,0,0,MERGED
19319,Localization Updates - main - 09/04/2025 03:03:15,consvc,2025-09-04T03:03:16Z,2025-09-05T22:13:47+00:00,1,43.18,True,2817,9,13,0,0,0,0,MERGED
19318,Fix conflicts from action args reflection PR,PankajBhojwani,2025-09-03T23:02:06Z,2025-09-04T01:04:29+00:00,1,2.04,True,1068,280,19,40,0,0,0,MERGED
19303,"Adjust ""Dimidium"" color scheme",dofuuz,2025-08-30T03:28:54Z,2025-09-03T16:04:28+00:00,1,108.59,True,2,2,1,475,4,0,4,MERGED
19298,Fix CoreWindow being destroyed after handoff,lhecker,2025-08-29T14:52:27Z,2025-09-01T13:32:58+00:00,1,70.68,True,23,18,1,195,0,0,0,MERGED
19297,Fix a race condition around Open/CloseClipboard,lhecker,2025-08-29T14:18:08Z,2025-08-29T18:20:54+00:00,1,4.05,True,41,2,1,180,0,0,0,MERGED
19296,Avoid reentrancy issues when dropping AppHost,lhecker,2025-08-28T22:01:35Z,2025-09-01T13:33:11+00:00,2,87.53,True,20,3,2,198,2,0,2,MERGED
19290,sb: add appId to the StoreBroker blobs (new AERO requirement),DHowett,2025-08-27T15:51:52Z,2025-08-27T17:22:28+00:00,1,1.51,True,2,0,2,77,0,0,0,MERGED
19289,Include Profile.BellSound as a media resource,DHowett,2025-08-27T15:26:47Z,2025-08-28T00:05:51+00:00,13,8.65,True,92,71,8,473,0,10,10,MERGED
19278,Localization Updates - main - 08/26/2025 03:03:22,consvc,2025-08-26T03:03:22Z,2025-08-28T22:32:22+00:00,2,67.48,True,76,106,20,0,0,0,0,MERGED
19274,docs: clarify color names and ECMA-48 mappingdocs: clarify color names and ECMA-48 mappingDocs/color names ecma48 explanation,DHANUSHRAJA22,2025-08-25T19:49:18Z,2025-08-26T21:31:16+00:00,3,25.7,False,1,0,1,2827,9,3,12,CLOSED
19273,Fix right click on tabs closing them,lhecker,2025-08-25T18:43:46Z,2025-09-08T23:16:20+00:00,5,340.54,True,59,79,3,182,1,2,3,MERGED
19271,build: remove the forced vpack submission; let us do it on our own time,DHowett,2025-08-25T15:47:52Z,2025-08-25T17:44:11+00:00,1,1.94,True,0,7,1,0,0,0,0,MERGED
19268,Move to CppWinRT 2.0.250303.1,DHowett,2025-08-24T17:25:49Z,2025-08-25T17:46:48+00:00,2,24.35,True,22,19,10,707,1,0,1,MERGED
19263,Fix unfocused appearance UI in settings,carlos-zamora,2025-08-22T00:09:31Z,2025-08-25T17:32:50+00:00,1,89.39,True,12,1,3,686,1,0,1,MERGED
19262,Remove TerminalSettings from the TerminalSettingsModel project,DHowett,2025-08-21T00:28:47Z,2025-09-03T19:01:37+00:00,17,330.55,True,894,1128,54,4563,2,14,16,MERGED
19261,Remove ProfileName from the surface of CoreSettings,DHowett,2025-08-20T18:04:04Z,2025-08-20T22:03:47+00:00,2,4.0,True,13,19,9,307,0,1,1,MERGED
19259,[Conhost] Fix off-by-1 error when copying and coloring selections,carlos-zamora,2025-08-19T23:56:12Z,2025-08-20T17:43:26+00:00,1,17.79,True,25,8,4,1168,0,0,0,MERGED
19258,Reflect inbox changes from RS,DHowett,2025-08-19T21:30:09Z,2025-08-25T19:14:25+00:00,5,141.74,True,25,8,9,346,6,8,14,MERGED
19254,Bust TerminalSettingsCache down to a plain old C++ class,DHowett,2025-08-16T22:28:31Z,2025-08-19T14:35:28+00:00,2,64.12,True,18,39,10,70,1,1,2,MERGED
19248,Add support for horizontal mouse wheel events,aymanbagabas,2025-08-15T20:34:17Z,2025-09-11T23:48:50+00:00,18,651.24,True,134,67,18,575,10,9,19,MERGED
19242,Fix a output marks performance regression,lhecker,2025-08-13T13:08:07Z,2025-08-13T16:10:19+00:00,1,3.04,True,10,5,2,57,1,0,1,MERGED
19239,Add SSH folder to NTM for dynamic profiles,carlos-zamora,2025-08-12T22:34:31Z,2025-08-13T22:43:27+00:00,7,24.15,True,37,3,4,1012,1,4,5,MERGED
19230,Localization Updates - main - 08/09/2025 03:04:06,consvc,2025-08-09T03:04:07Z,2025-08-12T15:39:45+00:00,2,84.59,True,234,26,13,0,0,0,0,MERGED
19229,Disable WIN32IM on shutdown,lhecker,2025-08-08T15:01:21Z,2025-08-08T17:48:53+00:00,2,2.79,True,29,13,4,216,0,1,1,MERGED
19225,"Clear Name, Source, and Commandline from Profiles.Defaults",carlos-zamora,2025-08-06T23:34:00Z,2025-08-22T00:05:27+00:00,4,360.52,True,98,29,4,275,2,2,4,MERGED
19223,Profiles Editor: make sure we notify the IconPath property,DHowett,2025-08-06T17:31:05Z,2025-08-06T23:09:48+00:00,2,5.65,True,2,1,2,121,0,0,0,MERGED
19221,"[f/llm] Tidy up ActiveControlInfo, fix for new IMediaResource Icon",DHowett,2025-08-06T13:34:07Z,2025-08-06T22:48:10+00:00,1,9.23,True,10,13,1,186,0,0,0,MERGED
19220,Throttle incoming handoffs so WinUI can layout them,lhecker,2025-08-06T11:05:21Z,2025-08-06T18:55:30+00:00,1,7.84,True,30,11,2,251,0,0,0,MERGED
19219,Localization Updates - main - 08/06/2025 03:04:16,consvc,2025-08-06T03:04:17Z,2025-08-07T12:30:29+00:00,2,33.44,True,52,0,13,0,0,0,0,MERGED
19214,editorconfig add,ReuelAlbert-Dev,2025-08-05T00:52:28Z,2025-08-05T01:59:24+00:00,2,1.12,False,140,0,2,331,1,5,6,CLOSED
19212,"Fix title being stuck after toggling ""showTerminalTitleInTitlebar""",DHowett,2025-08-04T21:05:41Z,2025-08-05T00:46:56+00:00,5,3.69,True,15,34,8,516,0,2,2,MERGED
19211,Fix WSL PATH corruption & potential use-after-free,lhecker,2025-08-04T15:02:38Z,2025-08-04T22:42:26+00:00,3,7.66,True,21,26,2,103,3,0,3,MERGED
19210,Extend lead/trail edge support for throttled_func,lhecker,2025-08-04T14:43:27Z,2025-08-04T18:25:37+00:00,8,3.7,True,323,285,19,300,0,4,4,MERGED
19199,Remove dependency on .NET 6 and Framework 4.8,lhecker,2025-08-01T13:14:19Z,2025-08-04T18:09:22+00:00,7,76.92,True,10,14,10,71,0,2,2,MERGED
19198,Create python-package-conda.yml,ReuelAlbert-Dev,2025-08-01T05:33:23Z,2025-08-01T09:59:04+00:00,5,4.43,False,163,0,3,331,4,8,12,CLOSED
19195,Fix minor grammar and wording issues in CONTRIBUTING.md and README.md,heenaf,2025-07-30T15:25:48Z,2025-09-16T19:48:42+00:00,3,1156.38,False,9,12,2,924,4,3,7,CLOSED
19192,Use a new API to propagate foreground state to child processes,DHowett,2025-07-30T00:40:18Z,2025-08-13T00:09:50+00:00,12,335.49,True,143,9,12,1079,0,8,8,MERGED
19189,[f/llm] Fix build break introduced by merging 65788d909,DHowett,2025-07-29T18:02:37Z,2025-07-29T20:08:29+00:00,2,2.1,True,1,1,1,0,0,1,1,MERGED
19187,Remove ColorHelper,lhecker,2025-07-29T15:06:03Z,2025-07-29T16:35:48+00:00,2,1.5,True,43,493,14,241,0,1,1,MERGED
19186,Fix use-after-free when disabling the ASB,lhecker,2025-07-29T13:29:00Z,2025-07-29T18:48:33+00:00,3,5.33,True,37,0,8,119,0,1,1,MERGED
19185,Fix/scrollbar marks shell integration,killerdevildog,2025-07-29T01:03:03Z,2025-07-29T17:20:48+00:00,2,16.3,True,25,0,7,1075,3,1,4,MERGED
19182,fix(ControlCore): prevent cursor repositioning during mouse selection,MengAiDev,2025-07-28T07:35:01Z,2025-08-04T21:09:09+00:00,4,181.57,True,1,1,1,277,3,1,4,MERGED
19173,Resolved Grapheme Clusters Error,FireFistisDead,2025-07-25T14:18:39Z,2025-07-25T16:08:21+00:00,1,1.83,False,6,3,1,870,0,0,0,CLOSED
19167,Fix WSLENV environment variable duplication in ConptyConnection,Weichenleeeee123,2025-07-24T05:36:05Z,2025-07-29T01:47:07+00:00,2,116.18,True,64,10,2,968,11,0,11,MERGED
19166,Filter the Command Palette in English in addition to locale,DHowett,2025-07-23T22:25:10Z,2025-07-28T19:08:49+00:00,7,116.73,True,497,303,18,204,5,3,8,MERGED
19165,"Command: realize resource-key names when they are requested, not at load",DHowett,2025-07-23T22:08:46Z,2025-07-24T17:53:10+00:00,1,19.74,True,83,55,2,318,0,0,0,MERGED
19164,Update key chord styling in actions page,carlos-zamora,2025-07-23T18:24:31Z,2025-07-23T23:21:24+00:00,1,4.95,True,7,9,1,509,3,0,3,MERGED
19156,Add telemetry for settings UI traffic,carlos-zamora,2025-07-21T17:28:22Z,2025-08-22T00:06:20+00:00,12,750.63,True,279,8,22,3151,3,15,18,MERGED
19151,feat: add option to adjust opacity with Ctrl+Shift+scroll,paulinek13,2025-07-19T19:49:29Z,2025-07-21T22:24:46+00:00,2,50.59,True,25,2,12,681,1,0,1,MERGED
19149,Remove IconElement caching from PaletteItem,DHowett,2025-07-19T00:12:41Z,2025-07-21T22:11:27+00:00,1,69.98,True,3,7,1,336,2,0,2,MERGED
19148,Undo the damage done to FilteredCommand in #17330,DHowett,2025-07-18T20:11:40Z,2025-07-19T00:09:12+00:00,2,3.96,True,4,21,2,216,0,0,0,MERGED
19143,"Rewrite media resource handling (relative path icons, web URLs)",DHowett,2025-07-17T22:37:29Z,2025-08-05T20:47:51+00:00,34,454.17,True,2169,601,84,5630,27,43,70,MERGED
19142,Add telemetry for new tab menu traffic,carlos-zamora,2025-07-17T20:38:41Z,2025-07-21T22:33:53+00:00,7,97.92,True,117,5,1,1194,0,5,5,MERGED
19139,"Fix Application Title Being Stuck After Swapping ""showTerminalTitleInTitlebar"" From False to True",Techypanda,2025-07-17T04:37:16Z,2025-08-05T00:46:57+00:00,3,452.16,False,26,1,3,902,3,1,4,CLOSED
19137,Re-enable web-source icons in Stable and Preview builds,DHowett,2025-07-16T23:19:13Z,2025-07-17T02:13:13+00:00,1,2.9,True,19,3,2,52,16,0,16,MERGED
19136,Merge TabBase+TerminalTab into just Tab,DHowett,2025-07-16T21:45:38Z,2025-07-22T15:04:19+00:00,5,137.31,True,1034,1197,22,114,0,10,10,MERGED
19135,ci: turn on SARIF reporting unconditionally for check-spelling,DHowett,2025-07-16T20:44:24Z,2025-07-16T22:10:07+00:00,1,1.43,True,1,1,1,80,0,0,0,MERGED
19132,Remove WinRT composition (inheritance) from PaletteItem,DHowett,2025-07-15T22:54:50Z,2025-07-16T20:09:17+00:00,2,21.24,True,322,367,25,731,3,3,6,MERGED
19131,"Expose a library's Resource Loader, allow a user to ""subset"" it",DHowett,2025-07-14T20:46:10Z,2025-07-14T22:43:48+00:00,3,1.96,True,21,6,4,460,1,1,2,MERGED
19130,Rewrite HighlightedTextControl and remove HighlightedText,DHowett,2025-07-14T16:43:25Z,2025-07-14T20:40:21+00:00,14,3.95,True,297,267,21,1799,2,12,14,MERGED
19127,feat: add option to enable zoom with `ctrl + scroll`,paulinek13,2025-07-14T08:35:25Z,2025-07-17T22:09:53+00:00,8,85.57,True,24,1,12,1617,15,8,23,MERGED
19117,Improve TSF color filtering logic (re: QQPinyin),lhecker,2025-07-10T14:31:58Z,2025-07-14T22:19:10+00:00,2,103.79,True,5,10,1,275,0,0,0,MERGED
19114,"version: fix the LCID in our VERSIONINFO, add descriptions to each file",DHowett,2025-07-09T20:15:24Z,2025-07-09T21:36:13+00:00,5,1.35,True,18,0,16,13,0,1,1,MERGED
19109,Include the hash of the SID in the Window Class and Mutant,DHowett,2025-07-08T17:47:30Z,2025-07-08T22:27:21+00:00,1,4.66,True,14,1,1,940,1,0,1,MERGED
19094,build: enable the compliance theatre build options,DHowett,2025-07-02T23:47:05Z,2025-07-03T17:16:04+00:00,2,17.48,True,11,0,2,79,0,0,0,MERGED
19089,ConPTY: Emit DSR CPR on resize,lhecker,2025-07-01T16:20:37Z,2025-08-06T11:06:45+00:00,7,858.77,True,93,68,8,367,1,2,3,MERGED
19088,Move ConPTY handoff logic into WindowEmperor,lhecker,2025-07-01T13:50:02Z,2025-07-01T19:00:00+00:00,8,5.17,True,164,291,16,802,4,3,7,MERGED
19083,Fix another VT input double-encoding issue,lhecker,2025-06-30T15:22:05Z,2025-07-02T23:49:33+00:00,1,56.46,True,29,6,1,99,5,0,5,MERGED
19073,OutputDebugString Added,vivekcpu,2025-06-26T15:34:01Z,2025-06-30T12:24:34+00:00,1,92.84,False,19,2,1,1260,3,0,3,CLOSED
19072,Center text of default launch terminal,HO-COOH,2025-06-26T14:46:35Z,2025-07-21T22:35:09+00:00,3,607.81,True,1,0,1,72,1,0,1,MERGED
19067,Don't trim bracketed pastes,lhecker,2025-06-24T14:39:45Z,2025-08-08T20:53:43+00:00,8,1086.23,True,305,206,28,588,8,2,10,MERGED
19055,feat: add MicaAlt support for settings background (#17650),farheen-shaikh530,2025-06-19T21:51:10Z,2025-07-29T03:34:21+00:00,1,941.72,False,23,1,4,1655,1,1,2,CLOSED
19048,Update dependencies,zwJimRaynor,2025-06-17T12:00:49Z,2025-07-29T19:12:14+00:00,2,1015.19,True,6,6,1,404,3,0,3,MERGED
19047,Add Microsoft.WSL profile source to schema,chawyehsu,2025-06-17T06:08:20Z,2025-06-23T23:55:46+00:00,4,161.79,True,15,7,1,175,6,0,6,MERGED
19046,Fix support for the Tencent QQPinyin IME,lhecker,2025-06-16T22:44:31Z,2025-06-16T23:52:27+00:00,3,1.13,True,25,13,2,0,1,1,2,MERGED
19044,Gently rework icon and background image validation,DHowett,2025-06-16T20:39:00Z,2025-06-16T23:01:36+00:00,3,2.38,True,70,31,1,993,0,1,1,MERGED
19035,Localization Updates - main - 06/14/2025 03:04:55,consvc,2025-06-14T03:04:56Z,2025-06-17T03:42:04+00:00,1,72.62,True,52,0,13,0,0,0,0,MERGED
19034,Indicate support for OSC 52 in the DA1 report,j4james,2025-06-14T00:43:10Z,2025-06-19T01:13:00+00:00,3,120.5,True,42,19,7,1070,3,0,3,MERGED
19028,Fix mutable default argument in `vttests/common.py::sgr_n`,mohiuddin-khan-shiam,2025-06-13T02:06:54Z,2025-06-24T19:19:23+00:00,2,281.21,True,12,1,1,914,0,0,0,MERGED
19027,Display a warning if SUI is unable to write to settings file,carlos-zamora,2025-06-13T00:25:05Z,2025-06-24T20:06:03+00:00,5,283.68,True,46,25,15,1295,1,2,3,MERGED
19026,Ensure items is not null before checking its size so we dont crash,jamespack,2025-06-12T23:24:49Z,2025-06-13T00:34:52+00:00,2,1.17,True,1,1,1,363,3,0,3,MERGED
19025,Small enhancements for VS profile generation,reynoldskr,2025-06-12T21:36:52Z,2025-06-13T22:41:10+00:00,6,25.07,True,40,6,2,466,11,3,14,MERGED
19024,Manually focus panes after swapping them,carlos-zamora,2025-06-12T17:45:05Z,2025-06-13T22:43:13+00:00,1,28.97,True,14,2,1,686,0,0,0,MERGED
19023,Fix crash when closing multiple panes simultaneously,carlos-zamora,2025-06-12T17:19:22Z,2025-06-24T21:58:33+00:00,5,292.65,True,7,0,1,900,0,1,1,MERGED
19020,build: adjust for changes in the Az.Accounts module,DHowett,2025-06-11T20:45:18Z,2025-06-18T23:04:45+00:00,1,170.32,True,1,1,1,134,0,0,0,MERGED
19014,Try to get the client name during DefTerm handoff,DHowett,2025-06-06T23:11:29Z,2025-06-24T21:33:27+00:00,5,430.37,True,7,0,1,0,2,1,3,MERGED
19001,[UX] Settings UI refinements,niels9001,2025-06-04T09:05:08Z,2025-07-23T17:07:11+00:00,10,1184.03,True,160,155,15,914,4,10,14,MERGED
18996,build: try even harder to find a working VC tools version,DHowett,2025-06-02T17:16:27Z,2025-06-02T18:27:22+00:00,4,1.18,True,21,1,1,117,0,1,1,MERGED
18993,Tweak spacing on about dialog,niels9001,2025-06-02T13:20:51Z,2025-06-03T15:38:16+00:00,3,26.29,True,17,14,1,613,8,0,8,MERGED
18987,Create devcontainer.json,Ybk1600,2025-05-30T16:54:13Z,2025-05-31T18:48:19+00:00,1,25.9,False,5,0,2,334,2,0,2,CLOSED
18986,Back Button in Settings,Techypanda,2025-05-30T13:39:34Z,2025-06-04T06:43:01+00:00,2,113.06,False,60,19,3,827,5,1,6,CLOSED
18980,Localization Updates - main - 05/29/2025 03:05:25,consvc,2025-05-29T03:05:25Z,2025-05-31T03:39:32+00:00,1,48.57,True,1225,354,26,0,3,0,3,MERGED
18976,Preserve the cursor row during Clear Buffer,lhecker,2025-05-28T14:03:57Z,2025-06-25T16:31:28+00:00,15,674.46,True,69,37,10,410,12,4,16,MERGED
18970,fuzzing: make fuzzing work with vcpkg and the new library layout,DHowett,2025-05-27T21:55:15Z,2025-05-27T22:56:11+00:00,1,1.02,True,21,1,4,81,0,0,0,MERGED
18949,Add support for OSC 52 clipboard copy in conhost,j4james,2025-05-26T09:01:16Z,2025-06-10T20:09:51+00:00,10,371.14,True,60,2,7,718,2,4,6,MERGED
18946,Add arm64 build support using the build script,jamespack,2025-05-25T03:40:44Z,2025-06-24T20:56:49+00:00,2,737.27,True,1,0,1,655,1,0,1,MERGED
18942,"fix: don't print bidi isolates LRI, RLI, FSI, PDI",adalinesimonian,2025-05-23T01:15:09Z,2025-05-30T17:06:40+00:00,10,183.86,True,6,1,1,658,14,3,17,MERGED
18940,Upgrade to check-spelling v0.0.25,jsoref,2025-05-22T15:04:42Z,2025-06-24T20:54:05+00:00,27,797.82,True,701,743,107,1126,9,21,30,MERGED
18927,Fix build errors from updated VS build agents,carlos-zamora,2025-05-19T21:28:59Z,2025-05-22T23:57:04+00:00,3,74.47,True,6,6,4,112,3,0,3,MERGED
18926,Add branding and unpackaged metadata to a few telemetry events,carlos-zamora,2025-05-19T18:46:57Z,2025-05-22T23:56:01+00:00,12,77.15,True,46,151,5,391,0,5,5,MERGED
18915,Add reflection to the ActionArgs in the settings model,PankajBhojwani,2025-05-14T23:12:45Z,2025-09-03T20:36:10+00:00,55,2685.39,True,1065,277,19,1143,1,48,49,MERGED
18912,Eagerly persist on WM_ENDSESSION,lhecker,2025-05-14T17:23:53Z,2025-05-22T23:02:59+00:00,3,197.65,True,11,3,2,268,0,1,1,MERGED
18908,Localization Updates - main - 05/14/2025 03:05:55,consvc,2025-05-14T03:05:56Z,2025-05-22T23:52:41+00:00,2,212.78,True,3048,58,52,0,0,0,0,MERGED
18907,Add reset cache and settings buttons to SUI,carlos-zamora,2025-05-13T23:39:25Z,2025-05-14T17:34:41+00:00,2,17.92,True,134,15,9,463,2,1,3,MERGED
18906,wpf: force builtin glyphs,DHowett,2025-05-13T21:57:33Z,2025-05-13T23:18:16+00:00,2,1.35,True,1,0,1,60,0,0,0,MERGED
18905,wpf: allow OSC 52 to write the clipboard,DHowett,2025-05-13T21:56:43Z,2025-05-13T23:18:06+00:00,3,1.36,True,10,4,3,103,0,5,5,MERGED
18904,Load .wt.json snippets from parent directories,carlos-zamora,2025-05-13T21:03:52Z,2025-05-14T17:34:13+00:00,3,20.51,True,76,22,2,651,0,6,6,MERGED
18900,"Bind ""Clear buffer"" action to Ctrl+Shift+K",carlos-zamora,2025-05-12T23:45:12Z,2025-05-13T17:46:17+00:00,1,18.02,True,1,0,1,61,0,0,0,MERGED
18899,Speculative: remove overeager line wrapping in AdaptDispatch,DHowett,2025-05-12T23:40:42Z,2025-05-14T00:14:46+00:00,1,24.57,True,0,7,1,76,1,0,1,MERGED
18898,Persist window layout every few minutes,carlos-zamora,2025-05-12T23:10:42Z,2025-05-14T18:08:07+00:00,2,42.96,True,39,13,9,610,1,0,1,MERGED
18896,Update to TouchdownBuildTask v5,DHowett,2025-05-12T18:56:34Z,2025-05-12T21:06:22+00:00,1,2.16,True,1,1,1,18,0,0,0,MERGED
18888,Fix remaining settings container previews in SUI,carlos-zamora,2025-05-09T22:42:29Z,2025-05-13T20:39:22+00:00,3,93.95,True,116,26,11,530,0,4,4,MERGED
18886,Use Microsoft.Windows.Settings module for enabling developer mode,mdanish-kh,2025-05-09T21:22:35Z,2025-05-09T23:13:19+00:00,2,1.85,True,6,6,3,542,3,0,3,MERGED
18885,FIX#18877 Triple-click to select logical line,albus-droid,2025-05-08T22:42:47Z,2025-05-09T23:00:47+00:00,2,24.3,True,27,0,2,1060,10,0,10,MERGED
18869,[1.22] Fix teardown when 'allowHeadless' is enabled,carlos-zamora,2025-05-03T00:26:13Z,2025-05-08T18:20:19+00:00,2,137.9,True,1,1,1,2870,1,0,1,MERGED
18864,Fix SGR mouse movement reports,j4james,2025-05-02T00:04:15Z,2025-05-02T22:36:45+00:00,2,22.54,True,22,32,3,877,4,0,4,MERGED
18862,Account for custom cell sizes in launch size calculation,j4james,2025-05-01T15:10:37Z,2025-05-01T18:28:44+00:00,1,3.3,True,3,0,1,395,3,0,3,MERGED
18861,wpf: use the new TSF implementation,DHowett,2025-05-01T03:42:20Z,2025-05-02T23:30:52+00:00,4,43.81,True,106,0,2,336,0,4,4,MERGED
18856,Bring back changes required to build conhost-1.24 in Windows,DHowett,2025-04-29T22:54:35Z,2025-05-02T19:27:28+00:00,2,68.55,True,39,19,13,0,1,2,3,MERGED
18855,Fix two image erasure bugs,j4james,2025-04-29T20:39:59Z,2025-04-29T23:15:39+00:00,2,2.59,True,22,11,2,850,3,0,3,MERGED
18854,Implement custom text context menus to fix crashes,lhecker,2025-04-29T16:37:25Z,2025-05-14T19:47:24+00:00,7,363.17,True,521,36,28,594,1,6,7,MERGED
18853,Port OSS consumption changes from OS PR !12826284,DHowett,2025-04-28T21:46:02Z,2025-04-29T20:23:24+00:00,3,22.62,True,38,36,35,35,0,1,1,MERGED
18841,release-engineering: package (during build) and upload GPO templates,DHowett,2025-04-25T17:49:18Z,2025-04-25T23:00:49+00:00,1,5.19,True,20,5,2,71,0,0,0,MERGED
18840,Remove virtual functions in BaseWindow with CRTP,HO-COOH,2025-04-25T17:33:30Z,2025-04-25T22:55:24+00:00,2,5.37,True,14,24,3,113,2,0,2,MERGED
18836,wpf: strong-name sign Microsoft.Terminal.Wpf,DHowett,2025-04-24T23:31:35Z,2025-04-29T20:37:57+00:00,3,117.11,True,21,0,4,322,1,1,2,MERGED
18833,Use RenderSettings for DECSET 2026 - Synchronized Output,lhecker,2025-04-24T12:49:32Z,2025-04-24T17:22:30+00:00,3,4.55,True,45,41,6,160,2,0,2,MERGED
18830,ServicingPipeline: make a bunch of quality of life improvements,DHowett,2025-04-23T23:09:49Z,2025-04-24T18:25:22+00:00,2,19.26,True,142,15,1,437,2,0,2,MERGED
18826,Implement DECSET 2026 - Synchronized Output,lhecker,2025-04-23T00:30:35Z,2025-04-23T17:15:51+00:00,2,16.75,True,91,3,5,447,8,0,8,MERGED
18816,Fix a major stdin wakeup race condition,lhecker,2025-04-19T00:41:04Z,2025-04-23T20:27:22+00:00,7,115.77,True,172,325,16,1829,1,3,4,MERGED
18814,Enable SSH Generator Feature Flag and polish UI,carlos-zamora,2025-04-18T00:16:32Z,2025-05-31T19:50:19+00:00,5,1051.56,True,70,2,8,908,6,1,7,MERGED
18813,Add Badge to highlight new Extensions Page,carlos-zamora,2025-04-17T23:37:56Z,2025-04-24T22:26:03+00:00,6,166.8,False,82,2,11,1300,2,3,5,CLOSED
18807,Localization Updates - main - 04/16/2025 21:02:38,consvc,2025-04-16T21:02:38Z,2025-04-18T20:13:59+00:00,1,47.19,True,101,19,17,0,1,0,1,MERGED
18798,Fix color selection off-by-one error and dangling Y-beam,carlos-zamora,2025-04-14T22:14:40Z,2025-04-15T04:17:58+00:00,2,6.05,True,4,13,4,1131,0,0,0,MERGED
18797,Backup and restore attributes during cooked reads,lhecker,2025-04-14T20:05:48Z,2025-04-14T23:59:47+00:00,6,3.9,True,30,9,1,330,2,2,4,MERGED
18796,Fix wide char support for WriteConsoleOutputAttribute,lhecker,2025-04-14T18:24:12Z,2025-04-14T21:12:01+00:00,1,2.8,True,52,13,2,158,0,0,0,MERGED
18781,Fix CRLF translation when DISABLE_NEWLINE_AUTO_RETURN is reset,lhecker,2025-04-10T21:48:28Z,2025-04-15T00:57:30+00:00,1,99.15,True,13,4,1,196,0,0,0,MERGED
18780,Added right margin to description textblock of action suggestion,vamsiikrishnaak,2025-04-10T17:03:00Z,2025-04-14T19:08:15+00:00,2,98.09,True,1,0,1,268,2,0,2,MERGED
18775,Display local time instead of UTC while restoring previous session,vamsiikrishnaak,2025-04-08T16:53:41Z,2025-04-10T00:33:40+00:00,2,31.67,True,16,2,1,548,2,0,2,MERGED
18767,"Add support for OSC 104, 110, 111, 112 and 117 (resets)",DHowett,2025-04-07T22:29:33Z,2025-04-10T00:11:47+00:00,12,49.7,True,216,8,9,1209,2,7,9,MERGED
18759,TerminalControl: Support MinGW path translation style (C:\ -> C:/),abutcher-gh,2025-04-03T22:15:12Z,2025-04-14T21:11:52+00:00,2,262.94,True,65,4,17,975,7,1,8,MERGED
18729,vcpkg: add an overlay port for fmt 11.1.4; enable /W3,DHowett,2025-03-26T19:32:07Z,2025-03-26T22:37:21+00:00,1,3.09,True,81,2,5,228,0,0,0,MERGED
18707,Delay-load icu so that we don't fail to start up on Windows <1903,DHowett,2025-03-20T22:58:02Z,2025-03-21T00:57:07+00:00,1,1.98,True,2,1,2,605,1,0,1,MERGED
18700,"Update command palette search to prioritize ""longest substring"" match.",e82eric,2025-03-18T02:21:24Z,2025-06-03T00:22:25+00:00,28,1846.02,True,1232,266,20,1800,41,14,55,MERGED
18684,Add support for language override to unpackaged/portable builds,DHowett,2025-03-12T21:06:30Z,2025-03-14T22:03:26+00:00,1,48.95,True,21,28,6,344,2,0,2,MERGED
18683,Remove unused package for missing licensing,aphistra,2025-03-12T20:59:19Z,2025-03-13T21:46:17+00:00,1,24.78,True,0,1,1,237,1,0,1,MERGED
18681,Fix a ConPTY startup hang with 0-param DA1 responses,lhecker,2025-03-12T17:18:45Z,2025-03-12T23:29:37+00:00,2,6.18,True,17,6,2,286,0,0,0,MERGED
18678,Remove unused package for missing licensing,aphistra,2025-03-11T20:49:03Z,2025-03-12T20:56:43+00:00,2,24.13,False,0,1,1,204,0,0,0,CLOSED
18676,Fix a handoff deadlock if layout completes synchronously,lhecker,2025-03-11T14:49:51Z,2025-03-12T23:27:13+00:00,4,32.62,True,20,36,5,415,0,1,1,MERGED
18671,Updated README with minor improvements,Madhumgithub,2025-03-10T14:28:25Z,2025-03-10T16:29:07+00:00,1,2.01,False,11,0,1,331,0,0,0,CLOSED
18657,fix(json): remove trailing commas in XamlStyler.json and consolegit2gitgilters.json,unknown,2025-03-06T05:53:38Z,2025-03-10T23:19:57+00:00,1,113.44,False,2,2,2,576,4,0,4,CLOSED
18654,Replace New Tab Menu Match Profiles functionality with regex support,carlos-zamora,2025-03-05T21:42:02Z,2025-05-14T17:30:06+00:00,7,1675.8,True,161,47,14,489,2,9,11,MERGED
18645,Add WinGet configuration file for building terminal,mdanish-kh,2025-03-01T14:46:30Z,2025-03-21T16:57:05+00:00,11,482.18,True,143,0,5,863,3,3,6,MERGED
18636,Fix dialogs not working across multiple windows,lhecker,2025-02-27T15:03:42Z,2025-02-28T23:14:16+00:00,3,32.18,True,42,17,2,912,0,1,1,MERGED
18635,Fix bugs introduced in #18623,lhecker,2025-02-27T14:56:52Z,2025-02-28T22:19:35+00:00,4,31.38,True,24,26,2,295,0,1,1,MERGED
18633,Add display name and icon to SUI extensions page,carlos-zamora,2025-02-27T01:00:09Z,2025-04-24T22:24:18+00:00,4,1365.4,True,663,309,31,1298,4,10,14,MERGED
18632,Fix a shutdown race condition in ControlCore,lhecker,2025-02-26T15:32:38Z,2025-03-14T22:06:02+00:00,13,390.56,True,253,485,15,683,2,10,12,MERGED
18629,Reduce log spam on conhost exit,lhecker,2025-02-25T16:00:19Z,2025-02-25T19:50:07+00:00,4,3.83,True,19,20,5,203,0,1,1,MERGED
18628,Fix two sources of runtime exceptions,lhecker,2025-02-25T15:56:39Z,2025-02-25T19:50:26+00:00,2,3.9,True,17,11,3,669,0,0,0,MERGED
18627,Fix panes being dropped when tearing off tabs,lhecker,2025-02-25T15:41:33Z,2025-02-26T18:58:34+00:00,7,27.28,True,53,88,5,299,0,7,7,MERGED
18623,Fix persistence of the last closed window,lhecker,2025-02-24T16:22:20Z,2025-02-26T19:05:59+00:00,7,50.73,True,39,11,2,124,2,1,3,MERGED
18622,Fix persistence of empty windows,lhecker,2025-02-24T16:20:15Z,2025-02-24T18:27:45+00:00,2,2.12,True,6,0,1,211,2,0,2,MERGED
18621,Fix leaking the contents of the first tab in the first window,lhecker,2025-02-24T15:50:35Z,2025-02-24T18:27:36+00:00,4,2.62,True,6,0,1,175,0,1,1,MERGED
18620,Fix a crash when closing tabs,lhecker,2025-02-24T15:12:35Z,2025-02-24T18:31:33+00:00,4,3.32,True,31,4,4,278,1,2,3,MERGED
18613,Fixed broken link in README,Abdikhafar-hub,2025-02-22T12:09:02Z,2025-02-24T17:20:07+00:00,1,53.18,False,1,1,1,331,0,0,0,CLOSED
18609,Localization Updates - main - 02/21/2025 03:05:09,consvc,2025-02-21T03:05:09Z,2025-02-21T22:58:50+00:00,1,19.89,True,104,0,13,0,0,0,0,MERGED
18606,Update GitHub Copilot description to include GitHub Copilot Free,PankajBhojwani,2025-02-20T21:21:45Z,2025-02-21T22:37:57+00:00,2,25.27,True,2,2,1,131,0,0,0,MERGED
18602,Bugfix: don't round to nearest cell for mouse movements and VT mouse mode,carlos-zamora,2025-02-20T01:53:15Z,2025-02-26T18:51:10+00:00,3,160.97,True,2,2,1,719,0,1,1,MERGED
18588,ConPTY: Fix shutdown if killed during startup,lhecker,2025-02-18T18:43:03Z,2025-02-21T22:57:38+00:00,2,76.24,True,105,126,3,813,0,1,1,MERGED
18586,Remove outdated arg comment for `_ClosePseudoConsoleMembers`,Maddimax,2025-02-18T07:49:04Z,2025-02-20T20:20:57+00:00,3,60.53,True,0,1,1,129,2,0,2,MERGED
18569,Localization Updates - main - 02/13/2025 03:05:04,consvc,2025-02-13T03:05:05Z,2025-02-19T00:07:25+00:00,2,141.04,True,3,3,2,0,0,0,0,MERGED
18563,"Add CAM16 based color scheme ""Dimidium""",dofuuz,2025-02-12T07:19:06Z,2025-02-20T21:16:40+00:00,3,205.96,True,24,0,2,503,6,0,6,MERGED
18559,Add Extensions page to Settings UI,carlos-zamora,2025-02-11T00:50:05Z,2025-05-28T19:03:03+00:00,28,2562.22,True,2123,115,42,4134,9,41,50,MERGED
18551,Fix an issue with Windows Terminal ,electric-otter,2025-02-10T14:44:32Z,2025-02-20T20:39:38+00:00,1,245.92,False,26,18,1,331,0,0,0,CLOSED
18530,Remove `startOnUserLogin` from the settings; use OS APIs only,DHowett,2025-02-07T16:27:04Z,2025-02-20T22:53:33+00:00,5,318.44,True,170,95,16,1691,6,3,9,MERGED
18527,Remove duplicate entries from defaults.json,joca-bt,2025-02-07T11:07:03Z,2025-02-12T18:06:43+00:00,2,126.99,True,2,5,1,42,3,0,3,MERGED
18518,Feat preview color scheme on mouse hover,eleadufresne,2025-02-06T03:06:38Z,2025-03-15T00:00:10+00:00,9,884.89,True,86,0,2,1836,16,4,20,MERGED
18507,Localization Updates - main - 02/05/2025 03:04:41,consvc,2025-02-05T03:04:42Z,2025-02-08T00:42:11+00:00,2,69.62,True,52,52,13,0,0,0,0,MERGED
18502,"Add Oklab based color scheme ""Ottosson""",lhecker,2025-02-03T21:58:48Z,2025-02-03T23:11:28+00:00,2,1.21,True,23,0,1,377,2,0,2,MERGED
18495,Improve quality of GDI image scaling,j4james,2025-02-01T23:36:16Z,2025-02-03T22:46:26+00:00,2,47.17,True,4,0,2,938,6,0,6,MERGED
18484,Localization Updates - main - 01/31/2025 03:04:35,consvc,2025-01-31T03:04:35Z,2025-02-03T19:42:24+00:00,1,88.63,True,104,0,13,0,0,0,0,MERGED
18483,Fix Ctrl+Insert does not copy the selected text from Command Palette,eleadufresne,2025-01-31T02:58:02Z,2025-02-03T20:22:04+00:00,2,89.4,True,1,1,1,905,2,0,2,MERGED
18476,Fix missing icon and truncated text on NullableColorPicker,carlos-zamora,2025-01-30T01:24:35Z,2025-02-04T19:07:59+00:00,7,137.72,True,59,38,3,425,0,2,2,MERGED
18468,build: change how we find  the latest VC tools version,DHowett,2025-01-28T19:36:52Z,2025-01-28T21:33:50+00:00,2,1.95,True,1,1,1,263,0,0,0,MERGED
18462,Add 2 additional error messages,halldk,2025-01-26T06:32:10Z,2025-04-14T23:15:12+00:00,11,1888.72,True,23,2,3,385,8,3,11,MERGED
18456,OSC 52 Localization Updates - main - 01/24/2025 03:05:35,consvc,2025-01-24T03:05:36Z,2025-01-30T22:13:28+00:00,3,163.13,True,52,0,13,0,0,0,0,MERGED
18452,Localization Updates - main - 01/22/2025 22:29:06,consvc,2025-01-22T22:29:07Z,2025-01-24T00:39:43+00:00,2,26.18,True,55,3,13,0,0,0,0,MERGED
18451,Multiple fixes to address CodeQL requirements,javierdlg,2025-01-22T17:34:22Z,2025-03-18T18:26:31+00:00,9,1320.87,True,5,4,4,1299,0,3,3,MERGED
18449,Let folks disable OSC 52,DHowett,2025-01-21T22:53:01Z,2025-01-24T00:28:02+00:00,7,49.58,True,38,7,14,222,4,2,6,MERGED
18445,Fix cursor hiding on input,lhecker,2025-01-21T13:02:50Z,2025-01-21T19:56:50+00:00,8,6.9,True,65,63,5,899,0,4,4,MERGED
18444,Fix dispatching of system keys,lhecker,2025-01-21T12:52:11Z,2025-01-21T20:48:51+00:00,3,7.94,True,11,9,2,224,0,1,1,MERGED
18434,Fix 'closeWindow' ignoring confirmation,carlos-zamora,2025-01-16T01:39:19Z,2025-01-23T23:24:50+00:00,2,189.76,True,1,9,7,459,0,0,0,MERGED
18431,Added CodeQL supression comment,javierdlg,2025-01-15T17:21:38Z,2025-01-15T20:57:54+00:00,5,3.6,True,1,1,1,807,0,1,1,MERGED
18424,[Windows 10] Fix layout in New Tab Menu page,carlos-zamora,2025-01-14T19:35:52Z,2025-01-22T02:22:20+00:00,2,174.77,True,20,0,1,502,1,0,1,MERGED
18418,Make SUI previews readable by screen readers,carlos-zamora,2025-01-09T18:56:31Z,2025-01-22T02:21:31+00:00,5,295.42,True,156,11,17,2394,0,3,3,MERGED
18411,build: add a couple more signing variables to ESRP,DHowett,2025-01-08T20:14:15Z,2025-01-08T21:23:36+00:00,2,1.16,True,6,0,3,60,1,0,1,MERGED
18388,Fix schema description,Tarang74,2025-01-03T14:52:55Z,2025-01-28T23:43:33+00:00,2,608.84,True,1,1,1,191,2,0,2,MERGED
18387,Fix Microsoft.Windows.Console.ConPTY package runtime identifiers,mitchcapper,2025-01-03T09:16:13Z,2025-01-06T21:39:58+00:00,3,84.4,True,8,8,2,505,2,0,2,MERGED
18386,No longer clear the input box when Terminal chat is dismissed,PankajBhojwani,2025-01-02T23:15:49Z,2025-01-06T22:40:52+00:00,3,95.42,True,0,3,1,480,0,0,0,MERGED
18376,Fix Empty WordDelimiters Handling in IsWordDelim and DelimiterClass,ys250228,2024-12-29T08:40:09Z,2025-01-06T21:57:17+00:00,1,205.29,False,9,3,1,1323,1,0,1,CLOSED
18363,"[Enterprise, GPO] Add ""Default Terminal app"" policy to definition template",htcfreek,2024-12-25T18:22:08Z,2025-04-18T23:01:12+00:00,4,2740.65,True,69,0,2,1324,17,0,17,MERGED
18347,Add support for tabbing to embedded hyperlinks,carlos-zamora,2024-12-21T00:19:09Z,2025-02-24T23:55:45+00:00,9,1583.61,True,82,17,1,1078,0,7,7,MERGED
18345,Fix multiple regressions since #18215,lhecker,2024-12-20T18:47:56Z,2025-01-06T21:41:20+00:00,4,410.89,True,49,29,4,600,0,2,2,MERGED
18342,Add descriptions and new labels to the bot rules,carlos-zamora,2024-12-19T23:58:41Z,2025-04-23T20:31:23+00:00,4,2996.55,True,220,145,1,270,4,2,6,MERGED
18334,"Remove dependencies on unstable MSVC/STL extensions,",YexuanXiao,2024-12-17T04:15:17Z,2025-01-06T22:15:41+00:00,20,498.01,True,16,10,9,173,0,12,12,MERGED
18328,Teach ServicingPipeline to paginate project board items,DHowett,2024-12-13T20:31:30Z,2025-01-08T21:35:40+00:00,1,625.07,True,42,31,1,44,1,0,1,MERGED
18326,Reduce likelihood of races between stdout and cooked stdin reads,lhecker,2024-12-13T17:01:55Z,2025-01-27T22:37:04+00:00,2,1085.59,True,42,18,3,672,1,0,1,MERGED
18323,Localization Updates - main - 01/06/2025 17:49:30,consvc,2024-12-13T03:05:55Z,2025-01-06T18:23:16+00:00,4,591.29,True,1963,0,13,0,0,0,0,MERGED
18322,"Add ""Windows.Terminal.VisualStudio"" to schema",carlos-zamora,2024-12-13T00:11:31Z,2024-12-13T20:40:25+00:00,3,20.48,True,2,1,1,13,1,0,1,MERGED
18315,Added CodeQL supression comment,javierdlg,2024-12-12T16:49:48Z,2024-12-12T23:38:21+00:00,2,6.81,True,1,1,1,814,0,0,0,MERGED
18306,Fix colored tab losing color when unselected,carlos-zamora,2024-12-11T00:55:05Z,2024-12-11T18:23:24+00:00,3,17.47,True,3,1,1,364,2,0,2,MERGED
18300,"Unify padding parsers, make SUI operate on struct `Thickness`",DHowett,2024-12-10T18:55:11Z,2025-01-24T23:17:42+00:00,11,1084.38,True,110,219,8,1098,3,5,8,MERGED
18292,Localization Updates - main - 12/07/2024 03:05:36,consvc,2024-12-07T03:05:36Z,2024-12-11T21:21:15+00:00,2,114.26,True,60,0,10,0,0,0,0,MERGED
18291,Replace MarkKind::None with MarkKind::Output,lhecker,2024-12-06T21:45:48Z,2024-12-11T20:26:48+00:00,4,118.68,False,9,13,3,397,2,2,4,CLOSED
18287,Reduce malloc churn for console calls <=128KiB,lhecker,2024-12-04T23:55:35Z,2024-12-05T17:34:00+00:00,2,17.64,True,2,2,1,281,0,0,0,MERGED
18285,"Fix clustering of gc=Cf, GCB=CN codepoints",lhecker,2024-12-04T20:21:47Z,2024-12-05T21:38:41+00:00,3,25.28,True,822,867,3,602,0,1,1,MERGED
18282,Localization Updates - main - 12/04/2024 03:06:12,consvc,2024-12-04T03:06:13Z,2024-12-06T18:32:57+00:00,2,63.45,True,2280,26,16,0,0,0,0,MERGED
18277,Update settings schema for compatibility.textMeasurement,lhecker,2024-12-02T21:46:26Z,2024-12-05T00:03:42+00:00,2,50.29,True,9,0,1,40,0,0,0,MERGED
18276,Fix til string to integer routines,lhecker,2024-12-02T21:45:38Z,2024-12-05T00:41:15+00:00,3,50.93,True,108,44,2,216,0,0,0,MERGED
18268,"[conhost] Fix WM_GETDPISCALEDSIZE handler, use provided size instead of current window size",ekoschik,2024-12-02T00:19:20Z,2025-01-10T22:43:04+00:00,11,958.4,True,90,40,4,3625,2,6,8,MERGED
18261,Upgrade to check-spelling v0.0.24,jsoref,2024-11-28T22:48:04Z,2024-12-04T18:06:31+00:00,18,139.31,True,695,368,61,1391,3,18,21,MERGED
18260,Improve correctness of Sixel background fill,j4james,2024-11-28T16:27:15Z,2025-06-11T00:04:56+00:00,4,4663.63,True,71,13,2,1753,19,0,19,MERGED
18258,Remove references to fabricbot,jsoref,2024-11-28T04:42:47Z,2024-12-02T18:23:52+00:00,2,109.68,True,1,10,1,470,1,0,1,MERGED
18252,Add 10.0.26100.0 to MaxVersionTested,lhecker,2024-11-27T00:12:39Z,2024-12-03T20:37:34+00:00,2,164.42,True,8,7,7,495,3,0,3,MERGED
18248,Fix infinite recursion in TSF,lhecker,2024-11-25T22:42:31Z,2024-11-26T18:39:04+00:00,4,19.94,True,15,3,2,219,1,1,2,MERGED
18243,doc: Fix typo in CONTRIBUTING.md,AsciiWolf,2024-11-24T16:10:24Z,2024-11-25T22:35:29+00:00,2,30.42,True,1,1,1,108,1,0,1,MERGED
18240,Simplify nested condition and make progress > 0 condition explicit,karurung,2024-11-23T22:36:01Z,2024-11-26T19:57:44+00:00,1,69.36,False,2,5,1,141,4,0,4,CLOSED
18239,build: fix arm64 vcpkg triplet selection error,DHowett,2024-11-22T19:39:56Z,2024-11-22T21:52:48+00:00,2,2.21,True,3,0,1,374,0,0,0,MERGED
18235,Defuse throttled_func when it's accidentally engaged,lhecker,2024-11-22T00:52:42Z,2024-11-25T23:31:38+00:00,6,94.65,True,26,21,2,248,3,2,5,MERGED
18233,Fix order and robustness of CTRL_*_EVENTs,lhecker,2024-11-21T16:44:49Z,2024-11-25T23:05:31+00:00,4,102.34,True,35,22,2,570,1,1,2,MERGED
18229,"Revert ""Dedup command history by default (#17852)""",lhecker,2024-11-21T02:22:29Z,2024-11-25T23:03:37+00:00,2,116.69,True,3,3,2,183,3,0,3,MERGED
18228,Properly implement WaitForData for ReadConsoleInput,lhecker,2024-11-21T00:42:24Z,2024-12-03T21:12:47+00:00,6,308.51,True,51,150,8,989,0,7,7,MERGED
18221,Fix UIMarkdown with AuditMode,PankajBhojwani,2024-11-20T00:31:29Z,2024-11-25T22:39:39+00:00,9,142.14,True,23,19,6,40,0,4,4,MERGED
18220,Improve parsing of responses from the AI,PankajBhojwani,2024-11-19T23:26:01Z,2024-11-25T21:02:10+00:00,8,141.6,True,92,153,9,404,1,6,7,MERGED
18215,Remove Monarch/Peasant & Make UI single-threaded,lhecker,2024-11-19T00:15:21Z,2024-12-12T21:21:24+00:00,37,573.1,True,1769,12249,164,1342,6,43,49,MERGED
18208,Localization Updates - main - Orphaned and Path Translation,consvc,2024-11-16T03:06:18Z,2024-11-19T19:38:45+00:00,2,88.54,True,523,3,13,0,0,0,0,MERGED
18207,Don't allow orphaned profiles to show up in the Default Profiles,DHowett,2024-11-16T00:28:10Z,2024-11-19T22:52:36+00:00,3,94.41,True,2,2,2,0,4,1,5,MERGED
18206,[<= 1.22] Retain (BUT DON'T INDICATE) orphaned dynamic profiles,DHowett,2024-11-16T00:27:04Z,2024-11-18T21:52:44+00:00,2,69.43,True,9,5,7,714,1,1,2,MERGED
18205,[<= 1.22] Do path translation for multiple types of WSL,DHowett,2024-11-16T00:00:56Z,2024-11-18T16:36:46+00:00,1,64.6,True,2,1,1,99,1,0,1,MERGED
18201,Improve parsing of responses from the AI,PankajBhojwani,2024-11-15T00:12:48Z,2024-11-19T23:26:25+00:00,1,119.23,False,46,36,2,368,6,1,7,CLOSED
18195,"Add a new (advanced) profile setting, pathTranslationStyle",DHowett,2024-11-14T03:29:47Z,2024-11-15T23:55:35+00:00,6,44.43,True,150,68,22,695,8,6,14,MERGED
18188,Retain (and indicate) orphaned dynamic profiles,DHowett,2024-11-13T18:55:33Z,2024-11-15T17:02:31+00:00,8,46.12,True,228,4,15,781,2,3,5,MERGED
18183,"wsl: skip distributions that indicate they are ""Modern""",DHowett,2024-11-12T17:49:14Z,2024-11-13T22:12:47+00:00,5,28.39,True,8,0,2,0,0,1,1,MERGED
18181,Set the error status correctly for Github Copilot responses,PankajBhojwani,2024-11-12T01:19:39Z,2024-11-12T17:37:39+00:00,3,16.3,True,1,1,1,77,0,0,0,MERGED
18179,AtlasEngine: Better builtin glyphs,lhecker,2024-11-11T23:15:45Z,2024-11-15T13:37:28+00:00,2,86.36,True,9,3,2,204,7,0,7,MERGED
18171,Add the ability to show the tab bar in fullscreen,GeekJosh,2024-11-09T15:31:40Z,2025-01-30T21:53:44+00:00,7,1974.37,True,133,13,21,1274,13,3,16,MERGED
18135,Localization Updates - main - 11/01/2024 03:05:38 - Move Tab,consvc,2024-11-01T03:05:39Z,2024-11-05T23:25:22+00:00,4,116.33,True,120,3,13,0,0,0,0,MERGED
18133,copilot: ensure that we wait for auth to complete before retrying,DHowett,2024-10-31T18:54:02Z,2024-10-31T20:55:00+00:00,2,2.02,True,2,2,1,51,0,0,0,MERGED
18130,Fix High Contrast mode in Settings UI,carlos-zamora,2024-10-31T00:14:30Z,2024-10-31T19:08:42+00:00,3,18.9,True,9,3,3,243,1,0,1,MERGED
18126,Updated pane context menu,dm17ryk,2024-10-30T12:20:45Z,2025-05-15T22:56:58+00:00,13,4738.6,True,197,23,6,450,24,10,34,MERGED
18121,Lead the user to the AI settings when no provider is set up,PankajBhojwani,2024-10-28T23:55:49Z,2024-10-29T16:20:26+00:00,4,16.41,True,92,10,11,134,2,4,6,MERGED
18116,Add icon override setting for newTabMenu entries,GeekJosh,2024-10-27T11:52:46Z,2024-10-29T18:45:19+00:00,4,54.88,True,32,13,8,1684,2,2,4,MERGED
18114,Update ORGANIZATION.md,Haaziq386,2024-10-27T06:02:58Z,2024-10-28T20:51:21+00:00,1,38.81,False,3,0,1,459,2,0,2,CLOSED
18113,Fix spelling checker to recognize 'winston',akaday,2024-10-26T17:04:38Z,2024-10-28T16:41:32+00:00,1,47.62,False,114,81,2,874,6,0,6,CLOSED
18109,Fix tab contrast colors when in high contrast,carlos-zamora,2024-10-25T22:46:54Z,2024-11-04T22:51:20+00:00,3,240.07,True,86,45,1,653,3,1,4,MERGED
18107,Add 'Move Tab' submenu to tab context menu,carlos-zamora,2024-10-24T20:32:07Z,2024-10-31T20:15:11+00:00,4,167.72,True,101,54,5,269,1,1,2,MERGED
18106,Make selection an exclusive range,carlos-zamora,2024-10-23T20:19:57Z,2025-01-28T22:54:49+00:00,35,2330.58,True,738,278,30,3194,13,26,39,MERGED
18095,Allow enterprises to disable Terminal Chat or only enable select LMs,PankajBhojwani,2024-10-22T02:14:30Z,2024-10-29T01:41:11+00:00,13,167.44,True,341,106,14,985,10,9,19,MERGED
18066,Translations,Dev-Chris15,2024-10-16T14:15:45Z,2024-11-04T14:08:03+00:00,1,455.87,False,220,0,2,58,3,0,3,CLOSED
18062,A better and user friendly read me!,Iweisc,2024-10-16T07:04:07Z,2024-11-12T16:43:37+00:00,2,657.66,False,53,367,1,644,1,0,1,CLOSED
18056,Closes #18055 - Updated README with Table Of Contents,raghav2005,2024-10-15T09:44:23Z,2024-12-05T16:21:39+00:00,2,1230.62,True,36,0,1,333,3,0,3,MERGED
18052,Update actions/add-to-project 1.0.1 -> 1.0.2,Jvr2022,2024-10-15T08:10:15Z,2024-11-04T23:17:37+00:00,2,495.12,True,1,1,1,464,0,0,0,MERGED
18051,[Terminal Chat] Fix getting the wrong executable when the commandline contains a space,PankajBhojwani,2024-10-14T22:11:08Z,2024-10-16T18:40:15+00:00,5,44.49,True,27,11,1,555,0,1,1,MERGED
18031,Localization Updates - 10/22/2024 03:06:53,consvc,2024-10-11T03:05:48Z,2024-10-22T21:33:06+00:00,3,282.45,True,1250,2,15,13,0,0,0,MERGED
18030,"Fix hiding the icon when it's set to ""none""",carlos-zamora,2024-10-10T22:18:57Z,2024-10-11T00:11:51+00:00,3,1.88,True,3,1,1,597,0,1,1,MERGED
18027,Use floating DIPs throughout the stack,lhecker,2024-10-10T14:29:02Z,2024-11-15T12:26:10+00:00,8,861.95,True,176,253,22,462,1,7,8,MERGED
18022,Changed new tab index on tab close to next tab,michaeljsXu,2024-10-10T03:47:45Z,2024-10-11T00:08:04+00:00,3,20.34,True,4,4,1,409,1,0,1,MERGED
18021,OpenConsole.psm1 PSVersion check,michaeljsXu,2024-10-10T02:49:24Z,2024-10-11T02:27:34+00:00,5,23.64,True,1,0,1,521,2,1,3,MERGED
18018,"Update the bug templates to include type, convert Feature to yaml",DHowett,2024-10-09T17:03:29Z,2024-10-21T14:40:52+00:00,2,285.62,True,26,50,4,0,0,1,1,MERGED
18015,Add New Tab Menu Customization to Settings UI,carlos-zamora,2024-10-08T22:46:47Z,2024-12-03T23:07:14+00:00,10,1344.34,True,2545,249,37,2329,8,27,35,MERGED
18014,Allow Github Copilot to be used with Terminal Chat,PankajBhojwani,2024-10-08T18:50:38Z,2024-10-28T23:18:34+00:00,39,484.47,True,1315,156,50,796,12,63,75,MERGED
18013,Open current working directory action.,michaeljsXu,2024-10-08T17:46:22Z,2024-12-05T12:18:45+00:00,3,1386.54,True,36,1,12,612,2,0,2,MERGED
18010,Stop updating AutoSuggestBox on selection redux,lhecker,2024-10-08T15:34:22Z,2024-10-23T22:20:30+00:00,2,366.77,True,47,16,4,632,2,1,3,MERGED
18009,Add a policy for profile sources,lhecker,2024-10-08T10:36:21Z,2024-10-15T21:48:09+00:00,35,179.2,True,108,11,7,329,11,12,23,MERGED
18007,Escape single quotes while translating dropped Win32 paths,a4lg,2024-10-08T06:40:50Z,2024-11-23T18:34:22+00:00,5,1115.89,True,12,0,1,1463,12,1,13,MERGED
18005,Prepend path to nuget in repo,Jewelry-x,2024-10-07T22:31:56Z,2024-11-14T20:56:41+00:00,2,910.41,True,1,1,1,653,0,0,0,MERGED
18001,Optimize til::rle to do replacing a little faster,flyingcat,2024-10-06T12:22:55Z,2024-10-17T17:54:36+00:00,1,269.53,False,148,32,2,966,4,3,7,CLOSED
17994,Don't send newlines to the shell from Terminal Chat,PankajBhojwani,2024-10-03T21:18:48Z,2024-10-23T22:26:27+00:00,8,481.13,True,9,4,1,539,5,4,9,MERGED
17993,Allow shift+enter in Terminal Chat's text box,PankajBhojwani,2024-10-03T21:08:14Z,2024-10-04T22:32:23+00:00,1,25.4,True,3,1,2,92,0,0,0,MERGED
17989,"Revert ""Stop updating AutoSuggestBox on selection""",DHowett,2024-10-02T17:20:48Z,2024-10-03T15:24:38+00:00,2,22.06,True,5,6,3,43,1,0,1,MERGED
17983,Add Profile.BellSound to Settings UI,carlos-zamora,2024-10-01T21:01:18Z,2024-12-12T22:44:32+00:00,18,1729.72,True,471,11,12,695,9,20,29,MERGED
17966,Localization Updates - main - 09/27/2024 03:04:44,consvc,2024-09-27T03:04:45Z,2024-10-01T21:48:54+00:00,1,114.74,True,26,0,2,0,2,0,2,MERGED
17965,Improve Profile.Icon UI in settings,carlos-zamora,2024-09-26T22:25:26Z,2024-10-22T21:32:13+00:00,9,623.11,True,1760,40,12,615,6,4,10,MERGED
17962,New tokenization & integer parsing helpers,lhecker,2024-09-25T18:21:11Z,2024-10-29T18:55:21+00:00,6,816.57,True,302,248,9,635,3,2,5,MERGED
17961,Stop updating AutoSuggestBox on selection,lhecker,2024-09-25T18:08:13Z,2024-09-26T15:06:02+00:00,2,20.96,True,6,5,3,686,1,0,1,MERGED
17960,Fix an exception on startup,lhecker,2024-09-25T12:07:57Z,2024-09-25T17:49:40+00:00,3,5.7,True,14,10,1,135,1,1,2,MERGED
17958,Localization Updates - main - 09/26/2024 19:14:21,consvc,2024-09-24T21:20:24Z,2024-09-26T19:22:05+00:00,2,46.03,True,334,22,16,41,0,0,0,MERGED
17954,Check EnableHexNumpad before enabling it,lhecker,2024-09-23T18:57:35Z,2024-09-24T18:56:30+00:00,4,23.98,True,23,6,1,251,0,1,1,MERGED
17953,Add input scope startup setting,lhecker,2024-09-23T15:05:41Z,2024-09-24T21:14:31+00:00,5,30.15,True,399,255,28,480,0,2,2,MERGED
17951,Fix a sixel crash when the buffer is reflowed,j4james,2024-09-22T17:21:40Z,2024-09-24T19:04:28+00:00,2,49.71,True,10,2,1,1001,0,0,0,MERGED
17945,Add support for the S8C1T/S7C1T escape sequences,j4james,2024-09-21T14:25:46Z,2024-10-07T13:11:39+00:00,10,382.76,True,304,136,21,1327,0,4,4,MERGED
17933,Add Warnings to Settings UI,carlos-zamora,2024-09-18T19:03:50Z,2024-09-25T17:10:24+00:00,4,166.11,True,142,82,9,334,1,2,3,MERGED
17929,build: fix the TSA configuration,DHowett,2024-09-16T22:01:43Z,2024-09-17T15:30:59+00:00,1,17.49,True,1,1,1,48,0,0,0,MERGED
17923,Add miscellaneous simple settings to the settings UI,carlos-zamora,2024-09-12T21:35:56Z,2024-10-10T23:14:55+00:00,19,673.65,True,175,24,16,390,2,17,19,MERGED
17912,Improve color contrast of reset button in SUI,carlos-zamora,2024-09-11T23:12:16Z,2024-09-25T17:07:25+00:00,4,329.92,True,10,1,1,89,1,1,2,MERGED
17910,Fix text scaling issues in settings UI,carlos-zamora,2024-09-11T18:41:02Z,2024-09-17T17:46:00+00:00,4,143.08,True,26,5,4,1097,1,1,2,MERGED
17909,"Add separate padding settings for left, top, right and bottom",nukoseer,2024-09-11T18:28:35Z,2024-12-06T18:34:52+00:00,13,2064.1,True,247,19,4,205,16,8,24,MERGED
17905,Fix a cooked read deadlock,lhecker,2024-09-11T13:16:39Z,2024-09-24T19:06:01+00:00,3,317.82,True,30,13,2,394,0,1,1,MERGED
17895,Add a Compatibility and Terminal page to the Settings UI,carlos-zamora,2024-09-10T23:19:19Z,2024-10-10T23:54:31+00:00,21,720.59,True,572,86,43,900,15,25,40,MERGED
17888,Add `Feature_QuickFix` to preview builds,carlos-zamora,2024-09-09T21:17:47Z,2024-09-11T15:34:11+00:00,2,42.27,True,1,0,1,9,0,0,0,MERGED
17886,Fix a crash on pane close,lhecker,2024-09-09T17:04:28Z,2024-09-12T15:03:39+00:00,2,69.99,True,2,2,1,460,0,0,0,MERGED
17885,Stop scrolling on output when search is open,lhecker,2024-09-09T17:00:06Z,2024-09-24T19:06:36+00:00,2,362.11,True,32,48,9,662,1,0,1,MERGED
17884,Fix clear buffer command,lhecker,2024-09-09T16:54:05Z,2024-09-24T19:11:27+00:00,3,362.29,True,24,49,7,499,1,0,1,MERGED
17881,Add `Feature_SaveSnippet` to preview builds,zadjii-msft,2024-09-09T11:45:35Z,2024-09-09T23:37:12+00:00,2,11.86,True,1,0,1,111,0,0,0,MERGED
17879,Add support for resetting the color scheme with RIS,j4james,2024-09-08T23:27:48Z,2024-09-16T18:59:12+00:00,6,187.52,True,67,2,9,1260,0,1,1,MERGED
17872,Remove PackageES in favor of our own versioning package,DHowett,2024-09-07T04:10:56Z,2024-09-09T23:37:25+00:00,2,67.44,True,18,40,9,309,0,0,0,MERGED
17870,Add nullable colors and improve Profile.Icon in settings UI,carlos-zamora,2024-09-06T19:33:21Z,2024-12-12T20:30:54+00:00,21,2328.96,True,3064,211,34,2790,5,18,23,MERGED
17853,Restore contents when a screen info is closed,lhecker,2024-09-03T16:31:47Z,2024-09-06T15:18:51+00:00,3,70.78,True,63,43,4,287,0,1,1,MERGED
17852,Dedup command history by default,lhecker,2024-09-03T15:33:21Z,2024-09-04T19:57:23+00:00,2,28.4,True,3,3,2,707,1,0,1,MERGED
17849,Fix ScrollRect to DECCRA translation,lhecker,2024-09-03T13:38:31Z,2024-09-04T23:06:36+00:00,2,33.47,True,21,19,1,259,0,0,0,MERGED
17848,Fix crash in AppHost::_QuitRequested,lhecker,2024-09-03T11:18:34Z,2024-09-06T15:19:03+00:00,2,76.01,True,13,1,1,58,0,0,0,MERGED
17845,Pass through DCS responses when VT input mode is disabled,j4james,2024-09-01T10:41:41Z,2024-09-04T13:36:32+00:00,3,74.91,True,15,1,2,1434,4,0,4,MERGED
17833,Avoid dropping Esc characters from VT responses,lhecker,2024-08-30T16:02:45Z,2024-09-04T13:47:01+00:00,8,117.74,True,29,24,6,710,4,1,5,MERGED
17829,Avoid focus loops in ConPTY,lhecker,2024-08-29T23:16:03Z,2024-10-08T16:37:33+00:00,8,953.36,True,147,130,21,1308,2,10,12,MERGED
17828,Fix two ConPTY HWND focus issues,zadjii-msft,2024-08-29T18:31:32Z,2024-08-29T21:19:16+00:00,4,2.8,True,19,0,2,2312,1,2,3,MERGED
17826,Give spacing marks space,lhecker,2024-08-29T16:56:59Z,2024-08-29T20:27:25+00:00,2,3.51,True,463,390,2,211,0,0,0,MERGED
17821,Add action IDs to the color selection commands,PankajBhojwani,2024-08-28T22:49:53Z,2024-08-29T20:08:28+00:00,6,21.31,True,80,40,1,358,1,1,2,MERGED
17820,Add tab color indicator for tab switch menu (CTRL+Tab),nukoseer,2024-08-28T21:09:33Z,2024-09-06T15:21:40+00:00,7,210.2,True,13,0,5,369,2,2,4,MERGED
17802,Make sure a blank title string resets the title,j4james,2024-08-26T10:19:58Z,2024-08-26T12:02:39+00:00,3,1.71,True,1,1,1,696,0,0,0,MERGED
17795,Remove unnecessary FMT,carlos-zamora,2024-08-23T20:25:12Z,2024-08-26T21:38:12+00:00,2,73.22,True,1,1,1,107,0,0,0,MERGED
17790,Don't emit raw escape sequences in the test log output,zadjii-msft,2024-08-23T16:21:12Z,2024-08-23T17:48:38+00:00,3,1.46,True,4,4,1,220,0,0,0,MERGED
17788,Prevent a crash when holding enter when creating a tab,zadjii-msft,2024-08-23T15:23:22Z,2024-08-23T17:49:12+00:00,2,2.43,True,3,3,1,231,0,0,0,MERGED
17786,Improve reliability of VT responses,lhecker,2024-08-23T14:14:56Z,2024-08-23T17:54:28+00:00,5,3.66,True,26,22,3,1006,0,2,2,MERGED
17783,Make fire_and_forget exception safe,lhecker,2024-08-23T01:59:10Z,2024-08-23T19:19:42+00:00,4,17.34,True,219,171,41,354,0,1,1,MERGED
17781,"Clip the ""current commandline"" at the cursor position",zadjii-msft,2024-08-22T21:41:43Z,2024-08-23T19:24:35+00:00,4,21.71,True,87,6,6,417,2,1,3,MERGED
17779,Restore off-the-top behavior for VT mouse mode,DHowett,2024-08-22T21:21:08Z,2024-08-23T16:43:40+00:00,5,19.38,True,25,25,5,1296,3,1,4,MERGED
17777,Dismiss the snippet preview when there is no suggestions,zadjii-msft,2024-08-22T20:52:13Z,2024-08-23T17:12:00+00:00,4,20.33,True,38,4,1,562,1,2,3,MERGED
17774,"During Alt+Numpad composition, stash keys in case we bail out",DHowett,2024-08-22T19:36:49Z,2024-08-23T15:13:50+00:00,6,19.62,True,59,33,2,520,0,4,4,MERGED
17768,ConPTY: Raise the MAX_PATH limit,lhecker,2024-08-22T13:50:24Z,2024-08-22T16:32:11+00:00,3,2.7,True,38,44,1,177,0,1,1,MERGED
17767,Localization Updates - main - 08/22/2024 03:06:16,consvc,2024-08-22T03:06:16Z,2024-08-23T19:30:13+00:00,1,40.4,True,100,139,13,0,0,0,0,MERGED
17763,Fix overwrite key binding warning in the SUI,PankajBhojwani,2024-08-21T20:32:15Z,2024-08-21T22:43:21+00:00,2,2.19,True,13,6,1,484,2,0,2,MERGED
17761,Set the default for `autoMarkPrompts` to `true`,zadjii-msft,2024-08-21T16:40:22Z,2024-08-21T22:07:06+00:00,2,5.45,True,2,2,2,520,0,0,0,MERGED
17758,`x-save` the commandline in the current window,zadjii-msft,2024-08-21T15:17:18Z,2024-08-21T21:53:39+00:00,2,6.61,True,17,2,2,520,0,1,1,MERGED
17757,ConPTY: Inject W32IM sequences,lhecker,2024-08-21T14:33:44Z,2024-08-21T16:31:32+00:00,2,1.96,True,14,5,3,188,0,0,0,MERGED
17756,Port ServicingPipeline.ps1 to ProjectsV2,DHowett,2024-08-21T02:16:52Z,2024-08-21T12:49:36+00:00,3,10.55,True,139,29,1,602,0,2,2,MERGED
17753,Force selection FG to black or white depending on BG luminance,DHowett,2024-08-20T21:03:13Z,2024-08-21T12:50:04+00:00,4,15.78,True,9,6,4,77,0,1,1,MERGED
17751,Fix a crash during settings update,lhecker,2024-08-20T16:59:25Z,2024-08-20T18:21:21+00:00,2,1.37,True,11,2,1,234,0,0,0,MERGED
17750,Fix pane event handlers being unbound,lhecker,2024-08-20T16:27:02Z,2024-08-21T12:44:42+00:00,3,20.29,True,3,5,1,1008,0,0,0,MERGED
17749,Disable PGO for nightly builds,DHowett,2024-08-20T16:22:37Z,2024-08-20T19:15:28+00:00,2,2.88,True,1,1,1,11,2,0,2,MERGED
17748,Fix a crash when disabling the ASB,lhecker,2024-08-20T14:20:16Z,2024-08-20T19:58:54+00:00,3,5.64,True,4,1,1,200,0,1,1,MERGED
17747,Use DECCRA/DECFRA for ScrollConsoleScreenBuffer,lhecker,2024-08-20T14:10:48Z,2024-08-23T20:02:01+00:00,17,77.85,True,505,182,14,584,0,9,9,MERGED
17745,Log when `WindowsTerminal.exe` starts,zadjii-msft,2024-08-19T21:13:52Z,2024-08-20T15:18:42+00:00,2,18.08,True,7,0,1,25,0,0,0,MERGED
17742,Allow OSC 17 to set the selection background color,DHowett,2024-08-19T17:44:08Z,2024-08-22T17:58:12+00:00,20,72.23,True,31,27,16,354,0,5,5,MERGED
17741,ConPTY: Flush unhandled sequences to the buffer,lhecker,2024-08-19T17:30:19Z,2024-08-22T22:52:09+00:00,16,77.36,True,1201,1767,25,709,5,25,30,MERGED
17738,Fix input sequences split across the buffer boundary,j4james,2024-08-18T21:52:55Z,2024-08-20T00:22:56+00:00,2,26.5,True,13,5,1,833,1,0,1,MERGED
17732,Localization Updates - main - 08/16/2024 23:36:05,consvc,2024-08-16T23:36:05Z,2024-08-19T18:52:54+00:00,2,67.28,True,209,26,26,0,0,0,0,MERGED
17731,Restore the ability to disable checking for URLs,DHowett,2024-08-16T22:55:27Z,2024-08-19T15:44:26+00:00,3,64.82,True,12,0,2,12,3,0,3,MERGED
17729,Add support for querying Xterm dynamic colors and palette,DHowett,2024-08-16T20:54:03Z,2024-08-21T22:45:14+00:00,11,121.85,True,562,172,10,1633,32,17,49,MERGED
17725,atlas: draw selection colors as background/foreground instead of alpha overlay,DHowett,2024-08-15T19:25:59Z,2024-08-19T14:54:18+00:00,9,91.47,True,39,106,12,1449,4,3,7,MERGED
17723,Fix a misdiagnosis in MSVC 17.11,lhecker,2024-08-15T14:21:32Z,2024-08-15T16:33:43+00:00,2,2.2,True,16,0,4,6,0,1,1,MERGED
17721,"Handle window resize event (CSI t, resize)",nukoseer,2024-08-15T07:38:55Z,2024-08-29T18:43:50+00:00,8,347.08,True,248,4,24,244,13,9,22,MERGED
17718,Log action dispatch occurrence,carlos-zamora,2024-08-15T01:02:03Z,2024-08-21T23:29:32+00:00,8,166.46,True,14,1,1,328,2,3,5,MERGED
17715,Add elipses back in to some command names,carlos-zamora,2024-08-14T21:02:18Z,2024-08-21T18:13:39+00:00,16,165.19,True,8,11,1,681,0,8,8,MERGED
17714,Fix session persistence when the session ends,lhecker,2024-08-14T20:26:38Z,2024-08-20T11:24:51+00:00,3,134.97,True,68,51,12,926,0,0,0,MERGED
17710,Use a plain char array to pass connection input,lhecker,2024-08-13T17:08:35Z,2024-08-14T02:35:47+00:00,4,9.45,True,123,101,17,608,0,0,0,MERGED
17708,Add support for querying the DECCTR color table report,j4james,2024-08-13T12:25:44Z,2024-08-13T23:53:26+00:00,7,11.46,True,290,0,9,1139,1,2,3,MERGED
17706,Switch to the new and beautiful VS Dev Shell icons,DHowett,2024-08-12T23:49:12Z,2024-08-13T23:21:09+00:00,2,23.53,True,38,22,15,728,3,0,3,MERGED
17705,Fix PowerShell profile warnings during WT build (oops),DHowett,2024-08-12T22:22:49Z,2024-08-13T16:12:30+00:00,2,17.83,True,1,1,1,0,0,0,0,MERGED
17704,Align the OSS ConPTY API with Windows 11 24H2,lhecker,2024-08-12T15:21:46Z,2024-08-14T20:15:50+00:00,3,52.9,True,17,42,6,177,1,0,1,MERGED
17696,schema: add reloadEnvironmentVariables to newTerminalArgs,carlos-zamora,2024-08-09T20:43:56Z,2024-08-14T20:16:04+00:00,5,119.54,True,5,0,1,412,0,3,3,MERGED
17695,Fix UIA RangeFromPoint API,carlos-zamora,2024-08-09T18:39:40Z,2024-08-20T22:58:05+00:00,6,268.31,True,35,43,6,1082,0,2,2,MERGED
17690,Add action for opening settings directory in file explorer,e82eric,2024-08-09T06:18:50Z,2024-12-05T12:20:13+00:00,5,2838.02,True,21,2,6,132,7,6,13,MERGED
17685,Remove SetTextAttributes from the ITerminalApi interface,j4james,2024-08-08T16:48:27Z,2024-08-08T23:45:17+00:00,2,6.95,True,72,54,10,708,0,0,0,MERGED
17682,Log number of interactive sessions,carlos-zamora,2024-08-07T18:40:51Z,2024-08-08T13:52:07+00:00,7,19.19,True,13,0,2,211,1,3,4,MERGED
17681,Remove CHAR_INFO munging for raster fonts,lhecker,2024-08-07T15:35:20Z,2024-08-13T23:18:16+00:00,2,151.72,True,30,659,9,1531,1,1,2,MERGED
17680,Remove IsGlyphFullWidth from InputBuffer,lhecker,2024-08-07T14:49:40Z,2024-08-07T20:19:11+00:00,3,5.49,True,11,19,2,1019,1,1,2,MERGED
17679,AtlasEngine: Fix curly line rendering on rows with line renditions,lhecker,2024-08-07T14:42:13Z,2024-08-07T20:19:01+00:00,2,5.61,True,4,3,1,110,1,0,1,MERGED
17678,Track and log changes to settings,carlos-zamora,2024-08-07T00:23:29Z,2024-08-23T19:28:19+00:00,28,403.08,True,531,10,22,2649,5,28,33,MERGED
17676,Port selection in conhost and Terminal to use til::generational,DHowett,2024-08-06T19:16:47Z,2024-08-09T18:11:28+00:00,7,70.91,True,369,264,8,1099,1,6,7,MERGED
17675,til: add til::point_span_subspan_within_rect,DHowett,2024-08-06T19:11:43Z,2024-08-06T21:53:39+00:00,5,2.7,True,12,5,2,88,0,1,1,MERGED
17674,"atlas,d2d: overdraw the background bitmap by one cell on all sides",DHowett,2024-08-06T18:05:21Z,2024-08-06T21:50:48+00:00,13,3.76,True,38,7,2,275,2,2,4,MERGED
17668,Fix cooked read reflow under ConPTY,lhecker,2024-08-05T22:22:28Z,2024-08-07T17:58:10+00:00,2,43.59,True,20,4,2,348,0,0,0,MERGED
17667,Return strings directly from read_file_as_utf8_string_if_exists,lhecker,2024-08-05T20:58:39Z,2024-08-06T21:53:47+00:00,2,24.92,True,29,36,5,538,1,0,1,MERGED
17666,Remove VT color quirk for PowerShell,lhecker,2024-08-05T20:42:26Z,2024-08-06T12:23:04+00:00,2,15.68,True,23,275,17,823,0,0,0,MERGED
17660,Add support for the VT answerback capability,j4james,2024-08-03T16:44:44Z,2024-08-07T22:46:02+00:00,5,102.02,True,62,3,24,629,0,1,1,MERGED
17659,Add support for querying the DECSCUSR setting,j4james,2024-08-03T13:29:45Z,2024-08-05T21:54:56+00:00,2,56.42,True,105,56,3,1090,0,0,0,MERGED
17655,"Hygiene: get rid of all instances of hstring ctor'd with L""""",DHowett,2024-08-02T21:01:30Z,2024-08-06T21:41:21+00:00,3,96.66,True,25,25,9,67,0,0,0,MERGED
17654,Fix session restoration of full buffers,lhecker,2024-08-02T20:35:21Z,2024-08-13T23:17:18+00:00,5,266.7,True,15,27,2,395,2,1,3,MERGED
17648,Update scratch project dependencies,lhecker,2024-08-02T02:02:27Z,2024-08-06T21:53:24+00:00,2,115.85,True,10,46,6,44,0,0,0,MERGED
17647,Modernize VtPipeTerm,lhecker,2024-08-02T00:18:12Z,2024-08-26T19:06:44+00:00,7,594.81,True,207,1200,10,607,1,5,6,MERGED
17646,Be less strict about trivialities,lhecker,2024-08-02T00:13:56Z,2024-08-07T06:23:06+00:00,2,126.15,True,4,3,1,126,0,0,0,MERGED
17645,Address feedback from #17510,lhecker,2024-08-01T21:10:11Z,2024-08-07T06:23:17+00:00,6,129.22,True,96,67,10,597,2,2,4,MERGED
17638,"Introduce the concept of ""selection spans"" instead of ""rects""",DHowett,2024-07-31T22:11:49Z,2024-08-15T19:00:40+00:00,8,356.81,True,297,554,29,1965,16,11,27,MERGED
17637,Implement Alt-Numpad handling,lhecker,2024-07-31T17:14:38Z,2024-08-07T07:32:31+00:00,7,158.3,True,172,80,2,507,3,3,6,MERGED
17636,Fix sixels in BackendD2D,lhecker,2024-07-31T00:25:50Z,2024-07-31T16:05:46+00:00,3,15.67,True,1,1,1,7,0,1,1,MERGED
17635,Fix alt-numpad events,lhecker,2024-07-30T23:14:03Z,2024-07-31T16:05:35+00:00,2,16.86,True,6,6,1,266,0,0,0,MERGED
17630,"build: switch back to the ""latest"" OneBranch build image",DHowett,2024-07-30T17:35:54Z,2024-07-30T23:26:28+00:00,2,5.84,True,0,5,1,514,1,0,1,MERGED
17617,"Fix cursor invalidation, again",lhecker,2024-07-25T23:07:53Z,2024-07-26T18:09:25+00:00,2,19.03,True,3,2,1,276,0,0,0,MERGED
17614,Use WinGet API to improve Quick Fix results,carlos-zamora,2024-07-25T16:36:40Z,2024-08-23T17:20:29+00:00,19,696.73,True,216,20,19,1691,6,27,33,MERGED
17604,Update MSBuildCache to 0.1.283-preview,dfederm,2024-07-23T23:50:14Z,2024-07-26T16:24:45+00:00,2,64.58,True,3,3,1,192,3,0,3,MERGED
17603,Update .vsconfig to include vcpkg and some newer tools,DHowett,2024-07-23T19:37:12Z,2024-07-23T22:28:04+00:00,3,2.85,True,39,22,2,0,2,2,4,MERGED
17592,build: bootstrap vcpkg before nuget restore,DHowett,2024-07-20T17:19:55Z,2024-07-22T17:23:34+00:00,2,48.06,True,2,2,1,717,0,0,0,MERGED
17589,"README: move build badges to shine-oss, remove colortool, move to top",DHowett,2024-07-19T16:06:14Z,2024-07-22T17:30:38+00:00,2,73.41,True,2,9,1,0,25,0,25,MERGED
17586,Use a PasswordBox instead of a TextBox for the AzureOpenAI key,PankajBhojwani,2024-07-18T19:04:45Z,2024-07-19T22:54:20+00:00,3,27.83,True,9,7,3,106,1,0,1,MERGED
17585,Add support for markdown -> XAML parsing,zadjii-msft,2024-07-18T11:17:46Z,2024-11-12T18:18:11+00:00,20,2815.01,True,1775,2,33,1829,6,55,61,MERGED
17584,Localization Updates - main - 07/18/2024 03:07:26,consvc,2024-07-18T03:07:26Z,2024-07-22T15:54:07+00:00,2,108.78,True,39,0,13,0,2,0,2,MERGED
17583,AtlasEngine: Fix dirty rects during scrolling,lhecker,2024-07-18T02:05:56Z,2024-07-22T12:48:52+00:00,2,106.72,True,19,21,4,415,6,1,7,MERGED
17582,AtlasEngine: Generate shader PDBs in Release builds,lhecker,2024-07-18T02:03:47Z,2024-07-18T21:09:27+00:00,2,19.09,True,10,32,1,137,0,0,0,MERGED
17581,AtlasEngine: Implement sixels,lhecker,2024-07-18T02:02:25Z,2024-07-23T19:39:13+00:00,5,137.61,True,327,68,14,702,5,1,6,MERGED
17577,Make WindowsTerminal F5-runnable,DHowett,2024-07-17T21:57:11Z,2024-07-23T22:28:57+00:00,3,144.53,True,35,0,1,25,2,1,3,MERGED
17576,Fix cursor inheritance,lhecker,2024-07-17T12:12:46Z,2024-07-17T15:37:27+00:00,2,3.41,True,20,11,3,419,0,0,0,MERGED
17575,Add ITerminalHandoff3 in preparation for overlapped pipes,lhecker,2024-07-16T16:00:03Z,2024-07-17T01:03:11+00:00,7,9.05,True,116,121,13,387,0,6,6,MERGED
17574,Implement a timeout for PSEUDOCONSOLE_INHERIT_CURSOR,lhecker,2024-07-16T15:34:02Z,2024-07-17T01:02:59+00:00,5,9.48,True,87,109,5,263,0,2,2,MERGED
17573,Abstract Write/FillOutput APIs with FillConsoleImpl,lhecker,2024-07-16T15:31:29Z,2024-07-17T01:01:29+00:00,2,9.5,True,137,125,6,264,0,0,0,MERGED
17572,Remove the --vtmode flag,lhecker,2024-07-16T15:27:28Z,2024-07-17T01:02:50+00:00,2,9.59,True,16,259,7,248,0,0,0,MERGED
17571,Make til/rand noexcept-correct,lhecker,2024-07-16T15:07:56Z,2024-07-17T00:59:32+00:00,3,9.86,True,7,4,3,100,0,0,0,MERGED
17570,Move FindActionableControlCharacter to Types,lhecker,2024-07-16T15:05:52Z,2024-07-17T01:02:39+00:00,2,9.95,True,117,115,3,125,0,0,0,MERGED
17569,Remove CleanupGlobalFont from tests,lhecker,2024-07-16T14:24:13Z,2024-07-17T01:02:28+00:00,2,10.64,True,4,37,13,138,0,0,0,MERGED
17568,Fix colors getting lost on reflow,lhecker,2024-07-15T23:41:46Z,2024-07-30T16:32:16+00:00,5,352.84,True,11,2,2,395,3,1,4,MERGED
17567,Fix various Read/WriteConsoleOutput bugs,lhecker,2024-07-15T15:04:59Z,2024-07-18T00:26:16+00:00,6,57.35,True,89,177,6,1014,0,3,3,MERGED
17566,Add helper functions for pipes,lhecker,2024-07-15T14:29:59Z,2024-07-17T01:02:07+00:00,7,34.54,True,215,4,3,649,0,3,3,MERGED
17556,Fix various cooked read issues,lhecker,2024-07-12T16:07:17Z,2024-07-15T12:01:57+00:00,4,67.91,True,65,21,3,454,0,5,5,MERGED
17553,"Add an ""export chat history"" button to Terminal Chat",PankajBhojwani,2024-07-12T00:13:34Z,2024-07-23T21:13:50+00:00,28,285.0,True,161,70,9,499,12,12,24,MERGED
17552,Revert lazy loading Quick Fix UI,carlos-zamora,2024-07-11T22:21:36Z,2024-07-12T00:29:20+00:00,2,2.13,True,9,7,2,575,1,0,1,MERGED
17550,15x faster reflow in debug builds,lhecker,2024-07-11T19:27:05Z,2024-07-12T03:05:44+00:00,2,7.64,True,5,5,2,309,0,0,0,MERGED
17544,Fix cursor invalidation with horizontal scrolling,lhecker,2024-07-10T22:40:09Z,2024-07-11T11:51:49+00:00,2,13.19,True,2,1,1,207,0,0,0,MERGED
17543,Fix double paste when CF_UNICODETEXT & CF_HDROP are present,lhecker,2024-07-10T22:17:53Z,2024-07-12T04:02:25+00:00,2,29.74,True,1,0,1,119,0,0,0,MERGED
17540,Allow OpenAI to be used with Terminal Chat,PankajBhojwani,2024-07-09T22:04:12Z,2024-10-28T19:34:02+00:00,27,2661.5,True,877,177,35,716,7,36,43,MERGED
17537,Create a base class for all pane content events,zadjii-msft,2024-07-09T14:27:02Z,2024-07-15T12:16:25+00:00,4,141.82,True,34,38,5,196,0,0,0,MERGED
17536,AtlasEngine: Fix a buffer overrun,lhecker,2024-07-09T13:51:26Z,2024-07-09T22:42:18+00:00,2,8.85,True,2,1,1,405,2,0,2,MERGED
17535,Stop parsing `saveSnippets` actions in json,zadjii-msft,2024-07-09T13:39:37Z,2024-07-10T15:44:41+00:00,3,26.08,True,21,4,10,294,2,0,2,MERGED
17533,Dismiss a action preview when the next action isn't previewable,zadjii-msft,2024-07-09T10:51:51Z,2024-07-09T21:47:56+00:00,2,10.93,True,3,0,1,153,0,0,0,MERGED
17531,Localization Updates - 07/11/2024,consvc,2024-07-09T03:05:53Z,2024-07-11T20:02:21+00:00,2,64.94,True,240,0,21,0,0,0,0,MERGED
17528,Add a close button to the Snippets pane,zadjii-msft,2024-07-08T21:41:45Z,2024-07-09T17:08:18+00:00,6,19.44,True,49,17,5,222,0,1,1,MERGED
17526,Fix qps-ploc generation for store translations,lhecker,2024-07-08T14:44:40Z,2024-07-08T22:26:16+00:00,8,7.69,True,70,32,2,390,0,3,3,MERGED
17524,Update .md files,skanda890,2024-07-08T13:52:28Z,2024-07-08T17:23:52+00:00,1,3.52,False,5,5,3,347,1,0,1,CLOSED
17516,Avoid covering current search highlight with search box,e82eric,2024-07-04T07:15:39Z,2024-08-07T06:32:16+00:00,14,815.28,True,52,19,7,335,3,5,8,MERGED
17514,onebranch: allow publish/package to run in :latest container,DHowett,2024-07-03T21:10:41Z,2024-07-08T20:37:50+00:00,2,119.45,True,11,1,2,209,0,0,0,MERGED
17511,Localization Updates - main - 07/08/2024 20:47:05,consvc,2024-07-03T18:35:02Z,2024-07-08T23:45:05+00:00,5,125.17,True,1082,672,156,0,0,1,1,MERGED
17510,A minor ConPTY refactoring: Goodbye VtEngine Edition,lhecker,2024-07-03T01:37:19Z,2024-08-01T20:38:11+00:00,110,715.01,True,1974,17468,125,4336,33,93,126,MERGED
17509,Fix schema and user defaults from Action ID change,PankajBhojwani,2024-07-02T22:46:33Z,2024-07-03T14:32:10+00:00,2,15.76,True,1,2,2,146,2,0,2,MERGED
17508,AtlasEngine: Curly line redux,lhecker,2024-07-02T17:20:18Z,2024-07-02T18:52:32+00:00,3,1.54,True,5,15,1,11,3,0,3,MERGED
17507,build: update the loc pipeline with the final locations of the PDPs,DHowett,2024-07-02T17:13:21Z,2024-07-02T21:42:29+00:00,2,4.49,True,44,49,1,149,0,0,0,MERGED
17504,Add support for querying the character cell size,j4james,2024-07-02T14:19:52Z,2024-07-02T18:19:41+00:00,2,4.0,True,43,8,6,1140,0,0,0,MERGED
17502,Add action for Quick Fix and key binding for Suggestions,carlos-zamora,2024-07-02T00:31:08Z,2024-07-17T22:28:30+00:00,13,381.96,True,74,21,9,1305,3,8,11,MERGED
17501,AtlasEngine: Improve appearance of curly underlines,lhecker,2024-07-01T23:31:15Z,2024-07-02T16:29:20+00:00,3,16.97,True,47,20,2,446,1,1,2,MERGED
17500,Check in all localized PDPs,consvc,2024-07-01T17:30:42Z,2024-07-02T17:18:35+00:00,1,23.8,True,4602,0,26,0,0,0,0,MERGED
17497,Initialize all SixelParser members,lhecker,2024-07-01T12:09:07Z,2024-07-01T17:04:12+00:00,2,4.92,True,17,17,1,312,0,0,0,MERGED
17496,Update the version of nuget in CI,zadjii-msft,2024-07-01T11:09:15Z,2024-07-01T20:21:57+00:00,2,9.21,False,2,2,1,148,1,0,1,CLOSED
17485,Localization Updates - main - 06/29/2024 03:05:30,consvc,2024-06-29T03:05:30Z,2024-07-01T13:09:32+00:00,2,58.07,True,57,0,4,0,0,0,0,MERGED
17476,Check the PDPs and StoreBroker configs into the repo,DHowett,2024-06-27T19:50:07Z,2024-07-01T17:23:05+00:00,2,93.55,True,502,2,8,534,4,0,4,MERGED
17474,Localization Updates for #16916 (Grapheme Clusters),consvc,2024-06-27T03:04:48Z,2024-06-28T20:19:58+00:00,2,41.25,True,216,0,12,0,0,1,1,MERGED
17464,Fix builtin glyph corruption in the D2D renderer,lhecker,2024-06-21T20:41:20Z,2024-06-23T10:44:54+00:00,3,38.06,True,7,1,1,92,0,0,0,MERGED
17462,New sample for MiniTerm,lixinyang123,2024-06-21T15:02:39Z,2024-07-01T21:59:27+00:00,1,246.95,False,261,1,7,143,4,4,8,CLOSED
17458,Localization Updates - builtin glyphs/shader compilation,consvc,2024-06-21T03:05:47Z,2024-06-24T20:03:25+00:00,1,88.96,True,52,39,26,0,0,0,0,MERGED
17454,Remove the D2D warning from the Builtin Glyphs setting,DHowett,2024-06-20T19:09:17Z,2024-06-20T21:03:27+00:00,2,1.9,True,1,1,1,0,0,0,0,MERGED
17453,Implement snap-on-input/output for conhost,lhecker,2024-06-20T16:20:47Z,2025-08-12T19:22:34+00:00,8,10035.03,True,71,38,5,204,20,0,20,MERGED
17451,nuget: move to shine-oss tenant rather than ms tenant,DHowett,2024-06-19T20:00:12Z,2024-07-01T12:06:51+00:00,2,280.11,True,1,1,1,0,0,0,0,MERGED
17450,Fix crash when closing panes very quickly,PankajBhojwani,2024-06-19T18:33:57Z,2024-06-20T16:51:31+00:00,3,22.29,True,7,6,1,529,2,1,3,MERGED
17445,Use VT for COOKED_READ_DATA,lhecker,2024-06-19T00:59:03Z,2024-07-11T20:47:31+00:00,32,547.81,True,839,731,15,4524,9,22,31,MERGED
17444,Move colorbrewer into its own proper header,lhecker,2024-06-19T00:30:08Z,2024-06-20T17:45:00+00:00,3,41.25,True,47,71,8,293,3,1,4,MERGED
17443,Remove some unused TextBuffer methods,lhecker,2024-06-19T00:23:36Z,2024-06-20T17:49:43+00:00,3,41.44,True,0,396,3,91,0,1,1,MERGED
17442,Make the renderer optional,lhecker,2024-06-19T00:18:03Z,2024-06-20T19:03:31+00:00,4,42.76,True,111,89,16,185,0,0,0,MERGED
17441,Add more ConsoleBench tests,lhecker,2024-06-18T23:31:28Z,2024-06-22T12:07:01+00:00,2,84.59,True,588,152,9,105,1,0,1,MERGED
17440,build: make the agent pool selection more robust,DHowett,2024-06-18T17:50:00Z,2024-06-19T15:13:52+00:00,1,21.4,True,30,30,6,286,0,0,0,MERGED
17436,Display useful pixel shader compilation errors,blitzRahul,2024-06-15T05:35:40Z,2024-06-21T22:00:40+00:00,12,160.42,True,26,11,3,641,2,3,5,MERGED
17423,Localization Updates - main - 06/12/2024 03:05:48,consvc,2024-06-12T03:05:49Z,2024-06-13T20:36:59+00:00,2,41.52,True,52,0,13,0,0,0,0,MERGED
17422,Upgrade to rapidhash,Nicoshev,2024-06-11T23:29:40Z,2024-11-14T20:48:19+00:00,6,3741.31,False,448,105,12,519,8,5,13,CLOSED
17421,Add support for Sixel images in conhost,j4james,2024-06-11T20:20:00Z,2024-07-01T11:36:02+00:00,26,471.27,True,1590,251,36,1604,31,17,48,MERGED
17417,Mark the AdaptDispatch ctor as noexcept,zadjii-msft,2024-06-10T18:23:05Z,2024-06-10T21:50:53+00:00,3,3.46,True,2,2,2,151,0,0,0,MERGED
17416,Add an experimental setting for making suggestions RGB,zadjii-msft,2024-06-10T11:48:55Z,2024-06-25T22:44:57+00:00,10,370.93,True,67,27,13,104,2,5,7,MERGED
17394,Create an ILMProvider interface and have our current implementation use it,PankajBhojwani,2024-06-07T18:43:00Z,2024-09-06T03:01:21+00:00,41,2168.31,True,448,182,15,602,9,43,52,MERGED
17393,Add Microsoft.MSBuildCache,dfederm,2024-06-07T18:12:34Z,2024-06-20T21:02:26+00:00,5,314.83,True,139,20,7,407,9,1,10,MERGED
17388,Add support for local snippets in the CWD,zadjii-msft,2024-06-07T12:05:32Z,2024-07-26T01:39:26+00:00,18,1165.57,True,253,80,16,686,2,22,24,MERGED
17387,Add a spec for an In-process ConPTY,lhecker,2024-06-07T01:53:03Z,2024-07-30T16:35:42+00:00,5,1286.71,True,843,0,2,213,1,2,3,MERGED
17386,"Re-implement previewing, with the new TSF",zadjii-msft,2024-06-06T17:29:13Z,2024-06-11T23:51:18+00:00,14,126.37,True,127,11,13,475,3,9,12,MERGED
17380,Localization Updates for #17369,consvc,2024-06-06T03:05:18Z,2024-06-10T19:49:09+00:00,2,112.73,True,52,0,13,0,0,0,0,MERGED
17376,"Add descriptions to commands (namely, snippets)",zadjii-msft,2024-06-05T21:06:13Z,2024-06-12T20:37:09+00:00,12,167.52,True,202,49,6,419,1,15,16,MERGED
17374,Fix spurious clear-to-end sequence in buffer dumps,lhecker,2024-06-05T18:27:06Z,2024-06-05T19:54:08+00:00,2,1.45,True,1,1,1,374,0,0,0,MERGED
17369,Warn when using old MacType versions,lhecker,2024-06-05T11:58:53Z,2024-06-05T20:12:14+00:00,5,8.22,True,80,2,5,555,3,2,5,MERGED
17368,Make subsequent windows open in the foreground,flyingcat,2024-06-05T11:41:37Z,2024-06-10T22:05:34+00:00,5,130.4,True,2,0,1,701,6,3,9,MERGED
17361,Support valid out-of-bounds access in utextAccess,lhecker,2024-06-04T14:59:23Z,2024-06-05T17:48:06+00:00,4,26.81,True,43,34,2,725,0,1,1,MERGED
17358,Fix two panes being closed when just one is,lhecker,2024-06-04T00:05:27Z,2024-06-04T19:42:45+00:00,3,19.62,True,61,66,8,1708,0,2,2,MERGED
17353,Account for viewport movement when wrapping over multiple rows,j4james,2024-06-01T18:24:45Z,2024-06-03T23:51:30+00:00,2,53.45,True,57,6,5,866,3,0,3,MERGED
17352,Fix some search highlights scenarios,tusharsnx,2024-06-01T15:15:07Z,2024-06-13T19:07:50+00:00,9,291.88,True,50,9,3,376,0,2,2,MERGED
17349,Localization Updates - main - regex search,consvc,2024-06-01T03:05:08Z,2024-06-05T17:57:55+00:00,4,110.88,True,156,0,13,0,1,0,1,MERGED
17346,Automatically enable AdjustIndistinguishableColors if High Contrast mode enabled,carlos-zamora,2024-05-31T23:37:37Z,2025-06-13T22:38:40+00:00,14,9071.02,True,50,8,12,827,8,11,19,MERGED
17335,Remove the animations from the command palette too,zadjii-msft,2024-05-29T18:43:19Z,2024-05-30T00:07:50+00:00,2,5.41,True,21,19,3,99,0,0,0,MERGED
17334,Show parts of the scrollback on restore,lhecker,2024-05-29T15:45:21Z,2024-05-30T15:01:13+00:00,2,23.26,True,25,16,2,525,2,0,2,MERGED
17333,Fix a crash when closing panes,lhecker,2024-05-29T13:39:14Z,2024-05-30T15:38:53+00:00,4,25.99,True,37,32,5,367,1,1,2,MERGED
17332,Cursor coordinates are viewport-relative,lhecker,2024-05-29T12:59:30Z,2024-05-29T18:09:56+00:00,3,5.17,True,5,1,1,322,0,0,0,MERGED
17331,Replace `tab.ActivePaneChanged` handler with a method,zadjii-msft,2024-05-28T19:55:30Z,2024-05-31T19:36:49+00:00,2,71.69,True,28,22,5,247,3,0,3,MERGED
17330,Add a snippets pane,zadjii-msft,2024-05-28T15:07:36Z,2024-07-08T19:02:19+00:00,18,987.91,True,756,18,15,1816,7,27,34,MERGED
17329,"Add a spec for ""Snippets""",zadjii-msft,2024-05-28T11:57:07Z,2024-06-22T11:38:53+00:00,31,599.7,True,695,0,24,285,8,34,42,MERGED
17326,Fix hyperlinks using an extra character at the end,tusharsnx,2024-05-28T06:50:05Z,2024-05-28T17:38:03+00:00,2,10.8,True,37,0,2,288,0,1,1,MERGED
17318,Raise the dupe bot's threshold to .8,zadjii-msft,2024-05-24T16:15:39Z,2024-05-24T18:28:28+00:00,1,2.21,True,1,1,1,245,0,0,0,MERGED
17316,Add support for regex search to conhost and Terminal,DHowett,2024-05-23T22:17:56Z,2024-05-31T11:54:57+00:00,9,181.62,True,203,63,24,102,5,10,15,MERGED
17304,"Localization Updates - fix issues in Korean, Italian, Spanish",consvc,2024-05-22T17:23:25Z,2024-05-28T18:04:56+00:00,3,144.69,True,22,22,5,41,3,0,3,MERGED
17290,Position the conpty cursor correctly when wrappedRow is set,j4james,2024-05-18T23:37:01Z,2024-05-30T14:56:03+00:00,2,279.32,True,58,1,3,1418,2,0,2,MERGED
17287,Remove some unused/obsolete XtermEngine code,j4james,2024-05-18T13:47:08Z,2024-05-20T18:27:38+00:00,2,52.67,True,0,16,1,590,0,0,0,MERGED
17284,Revert Canary to supporting 10.0.19041 (Windows 10 Vb+),DHowett,2024-05-17T18:34:59Z,2024-05-17T20:46:52+00:00,1,2.2,True,1,3,1,75,1,0,1,MERGED
17281,Allow actions in the new tab dropdown,PankajBhojwani,2024-05-16T23:57:11Z,2024-06-06T22:57:22+00:00,9,503.0,True,178,4,13,126,11,6,17,MERGED
17278,AtlasEngine: Implement remaining underlines and builtin glyphs for D2D,lhecker,2024-05-16T13:53:33Z,2024-05-17T00:11:55+00:00,12,10.31,True,422,160,9,1115,0,4,4,MERGED
17272,Localization Updates - main - 05/15/2024 03:05:01,consvc,2024-05-15T03:05:02Z,2024-05-17T17:42:09+00:00,5,62.62,True,52,13,13,0,0,0,0,MERGED
17269,Backport session persistence fixes in #17211 and #17268,lhecker,2024-05-14T20:25:09Z,2024-05-16T00:10:53+00:00,5,27.76,True,16,10,7,248,0,1,1,MERGED
17268,Fix persistence of handoff'd tabs,lhecker,2024-05-14T20:18:09Z,2024-05-15T22:34:46+00:00,4,26.28,True,9,4,3,644,0,1,1,MERGED
17266,Fix lock warning during ReturnResponse,lhecker,2024-05-14T15:56:54Z,2024-05-15T22:34:46+00:00,2,30.63,True,2,1,1,147,1,0,1,MERGED
17261,Remove spaces from snippets in the SXNUI,zadjii-msft,2024-05-13T18:43:16Z,2024-05-14T19:55:54+00:00,6,25.21,True,36,2,2,442,1,2,3,MERGED
17260,ServicingPipeline: Warn when local release-XX branch is not uptodate,DHowett,2024-05-13T16:27:53Z,2024-05-14T19:19:01+00:00,4,26.85,True,14,0,1,51,0,2,2,MERGED
17259,Improve font related help text,lhecker,2024-05-13T15:37:52Z,2024-05-14T15:58:25+00:00,4,24.34,True,4,1,1,209,0,2,2,MERGED
17258,AtlasEngine: Improve robustness against weird font sizes,lhecker,2024-05-13T15:32:57Z,2024-05-14T20:00:09+00:00,4,28.45,True,34,11,5,768,2,1,3,MERGED
17257,Fix race conditions in UiaTextRangeBase,lhecker,2024-05-13T15:24:20Z,2024-05-13T17:29:31+00:00,2,2.09,True,21,10,1,248,1,1,2,MERGED
17251,Fix single-tab window tear-off crash,tusharsnx,2024-05-12T14:20:21Z,2024-05-13T17:14:17+00:00,5,26.9,True,4,1,1,219,1,1,2,MERGED
17247,Remove the animations from the suggestions UI,zadjii-msft,2024-05-10T21:57:01Z,2024-05-13T17:17:01+00:00,4,67.33,True,21,1,1,64,1,4,5,MERGED
17245,Clean up command history context passed to suggestions UI,zadjii-msft,2024-05-10T21:16:01Z,2024-05-13T18:09:55+00:00,5,68.9,True,77,7,2,456,2,2,4,MERGED
17234,Fix cursor invalidation when line renditions are used,j4james,2024-05-10T00:43:16Z,2024-05-10T01:50:53+00:00,2,1.13,True,2,2,1,722,1,0,1,MERGED
17233,Fix conpty cursor movement detection on double-width lines,j4james,2024-05-09T23:56:44Z,2024-05-10T01:15:11+00:00,2,1.31,True,3,1,2,881,1,0,1,MERGED
17221,PowerShell menu completion parser thread-safety fix,krzysdz,2024-05-08T23:06:17Z,2024-05-09T19:30:15+00:00,4,20.4,True,1,1,1,542,0,2,2,MERGED
17216,build: move ESRP to a parameterized subtask which takes signingId,DHowett,2024-05-08T20:50:56Z,2024-05-10T20:54:56+00:00,1,48.07,True,117,111,5,152,1,0,1,MERGED
17215,Remove command's knowledge of its keys,PankajBhojwani,2024-05-08T17:04:44Z,2024-06-06T21:25:44+00:00,17,700.35,True,123,260,20,256,10,20,30,MERGED
17213,Fix typing multiple emojis on Windows 10,lhecker,2024-05-08T15:13:52Z,2024-05-08T21:35:09+00:00,7,6.35,True,5,3,1,498,0,1,1,MERGED
17212,Fix !_noFlushOnEnd not flushing,lhecker,2024-05-08T14:02:39Z,2024-05-08T21:01:58+00:00,6,6.99,True,4,0,1,136,2,1,3,MERGED
17211,Fix session being persisted even when disabled,lhecker,2024-05-08T13:48:09Z,2024-05-08T21:31:21+00:00,2,7.72,True,19,7,6,517,6,0,6,MERGED
17199,Add nullptr checks to shared_ptr conversions,lhecker,2024-05-07T17:55:13Z,2024-05-07T19:14:55+00:00,2,1.33,True,7,7,2,582,0,0,0,MERGED
17195,Make sure DCS strings are flushed to conpty without delay,j4james,2024-05-05T14:40:30Z,2024-05-06T20:54:08+00:00,3,30.23,True,19,13,10,679,1,0,1,MERGED
17194,Prevent the VT engine painting unnecessarily,j4james,2024-05-05T00:47:12Z,2024-05-06T19:18:24+00:00,5,42.52,True,19,58,6,1416,0,1,1,MERGED
17193,AtlasEngine: Fix several error handling bugs,lhecker,2024-05-04T14:24:48Z,2024-05-06T18:51:25+00:00,2,52.44,True,11,8,4,598,0,0,0,MERGED
17189,"build: switch to TouchdownBuildTask v3, which supports a new type of auth",DHowett,2024-05-03T19:11:52Z,2024-05-03T21:08:32+00:00,2,1.94,True,3,3,1,0,1,0,1,MERGED
17188,Localization Updates - 05/06/2024 19:34:03,consvc,2024-05-03T19:01:37Z,2024-05-06T19:35:11+00:00,2,72.56,True,30,0,5,0,0,0,0,MERGED
17183,Some schema updates for 1.21,zadjii-msft,2024-05-02T16:23:51Z,2024-05-02T19:15:25+00:00,3,2.86,True,43,3,1,429,0,1,1,MERGED
17182,Fix remaining buffer serialization bugs,lhecker,2024-05-02T14:18:14Z,2024-05-02T23:26:03+00:00,2,9.13,True,42,8,1,592,1,0,1,MERGED
17181,Fix multiple cursor invalidation issues,lhecker,2024-05-02T13:14:51Z,2024-05-02T23:33:26+00:00,3,10.31,True,170,138,3,1495,0,1,1,MERGED
17180,Move the AttachConsole in the feature tests in the retry loop,zadjii-msft,2024-05-02T12:01:22Z,2024-05-02T16:12:06+00:00,2,4.18,True,12,1,1,233,0,0,0,MERGED
17175,Localization Updates - main - 05/02/2024 03:05:18,consvc,2024-05-02T03:05:18Z,2024-05-02T16:13:51+00:00,2,13.14,True,18,0,3,0,0,0,0,MERGED
17174,"Don't always focus pane content on Tapped, if the pane is already focused",zadjii-msft,2024-05-01T21:38:11Z,2024-05-02T16:12:19+00:00,10,18.57,True,23,18,4,373,0,7,7,MERGED
17173,Fix font axis/feature SUI issues,lhecker,2024-05-01T21:18:47Z,2024-05-02T16:12:34+00:00,3,18.9,True,142,78,6,495,0,2,2,MERGED
17170,Take wrapping into account when expanding wordwise selections,DHowett,2024-05-01T16:23:22Z,2024-05-02T16:14:20+00:00,9,23.85,True,87,36,3,13,1,5,6,MERGED
17169,Prevent multiple settings tabs from being persisted,zadjii-msft,2024-05-01T15:06:42Z,2024-05-02T04:45:12+00:00,3,13.64,True,16,2,1,571,1,0,1,MERGED
17164,Fix font axes/features settings UI,lhecker,2024-04-30T22:38:50Z,2024-05-01T17:41:06+00:00,8,19.04,True,798,956,22,711,0,8,8,MERGED
17162,Refactor ActionMap and Command to use ActionIDs,PankajBhojwani,2024-04-30T17:46:44Z,2024-06-04T01:01:28+00:00,38,823.25,True,1090,727,17,517,3,72,75,MERGED
17156,build: force the latest VCToolsVersion; see DD-1541167 for more,DHowett,2024-04-29T16:37:52Z,2024-04-29T18:32:19+00:00,3,1.91,True,13,0,3,28,1,0,1,MERGED
17154,Update so that cursor size/type/isblinkingallowed get restored when switching back to main buffer from alt buffer,e82eric,2024-04-29T03:47:30Z,2024-04-30T11:46:41+00:00,7,31.99,False,11,0,2,2686,6,1,7,CLOSED
17148,Fix the DECTCEM reset position in the conpty stream,j4james,2024-04-27T21:15:04Z,2024-04-29T12:52:24+00:00,3,39.62,True,4,1,3,751,0,0,0,MERGED
17145,No longer serialize generated IDs,PankajBhojwani,2024-04-26T23:13:27Z,2024-04-29T15:29:40+00:00,3,64.27,True,19,33,4,275,0,1,1,MERGED
17144,Fix clearing marks,zadjii-msft,2024-04-26T21:59:19Z,2024-05-02T23:27:12+00:00,22,145.46,True,136,31,3,58,8,6,14,MERGED
17143,Improve Viewport and Viewport::WalkInBounds,lhecker,2024-04-26T21:25:00Z,2024-07-02T16:24:01+00:00,4,1602.98,True,65,601,19,396,6,2,8,MERGED
17141,"Fix repositioning with the cursor, again",zadjii-msft,2024-04-26T16:46:32Z,2024-04-26T21:54:17+00:00,4,5.13,True,81,75,2,204,2,1,3,MERGED
17138,Fix the location that selecting a mark uses,zadjii-msft,2024-04-26T11:22:25Z,2024-05-01T15:51:06+00:00,10,124.48,True,154,3,3,616,0,2,2,MERGED
17137,Update Cascadia Code to 2404.23,DHowett,2024-04-26T01:02:52Z,2024-04-26T15:08:38+00:00,2,14.1,True,2,2,5,706,3,0,3,MERGED
17136,AtlasEngine: Improve debuggability,lhecker,2024-04-26T00:25:59Z,2024-04-26T11:54:52+00:00,4,11.48,True,43,14,2,97,0,1,1,MERGED
17134,"build: switch to ESRP v5, which supports managed identities",DHowett,2024-04-25T22:25:44Z,2024-05-01T20:50:40+00:00,6,142.42,True,65,9,9,166,4,12,16,MERGED
17132,Fix search constantly triggering a scroll,lhecker,2024-04-25T16:43:03Z,2024-04-30T21:18:44+00:00,9,124.59,True,86,96,9,865,3,3,6,MERGED
17129,Fix doskey macros for inputs with >1 consecutive whitespace,lhecker,2024-04-25T15:22:28Z,2024-05-02T20:23:44+00:00,6,173.02,True,118,613,5,502,2,9,11,MERGED
17125,Localization Updates - main - 04/25/2024 03:04:34,consvc,2024-04-25T03:04:35Z,2024-04-26T03:16:02+00:00,3,24.19,True,52,0,13,0,0,0,0,MERGED
17120,Make UTextFromTextBuffer newline aware,lhecker,2024-04-24T14:46:13Z,2024-04-29T17:22:12+00:00,6,122.6,True,131,39,5,609,1,6,7,MERGED
17116,"build: disable CheckCFlags for now, as it is blowing up the build",DHowett,2024-04-23T23:31:57Z,2024-04-24T18:00:57+00:00,3,18.48,True,15,0,2,48,2,5,7,MERGED
17115,Update Azure Cloud Shell API to the newer version,PankajBhojwani,2024-04-23T22:31:37Z,2024-04-24T00:17:08+00:00,3,1.76,True,2,2,1,179,1,0,1,MERGED
17113,Add a system message to session restore,lhecker,2024-04-23T19:34:53Z,2024-04-24T21:23:50+00:00,11,25.82,True,92,7,5,491,0,6,6,MERGED
17110,Don't explode when duplicating a pane,zadjii-msft,2024-04-23T16:32:08Z,2024-04-23T20:28:29+00:00,2,3.94,True,2,1,1,121,0,0,0,MERGED
17107,Fix TerminalPage not being released on window close,lhecker,2024-04-23T13:28:08Z,2024-04-23T16:50:31+00:00,2,3.37,True,0,3,2,272,0,0,0,MERGED
17104,AtlasEngine: Fix custom shader time imprecision,lhecker,2024-04-22T23:42:08Z,2024-04-23T17:05:23+00:00,2,17.39,True,31,3,3,401,0,0,0,MERGED
17103,[1.20] Revert search result highlighting from stable,DHowett,2024-04-22T21:26:08Z,2024-04-23T19:00:23+00:00,2,21.57,True,3,251,28,134,1,0,1,MERGED
17100,Use float instead of double by default,lhecker,2024-04-22T15:10:31Z,2024-04-23T00:45:25+00:00,3,9.58,True,180,178,45,737,0,1,1,MERGED
17098,Update libpopcnt to v2.6,Jvr2022,2024-04-22T08:41:01Z,2024-04-30T11:18:53+00:00,3,194.63,False,7,7,2,0,4,2,6,CLOSED
17097,Update actions/add-to-project to 1.0.1,Jvr2022,2024-04-22T07:51:54Z,2024-04-23T16:16:47+00:00,2,32.41,True,1,1,1,0,3,0,3,MERGED
17092,Fix search highlights during reflow,lhecker,2024-04-20T14:46:15Z,2024-04-23T22:59:30+00:00,12,80.22,True,200,273,27,1826,5,11,16,MERGED
17085,Add more TraceLogging to ApiDispatchers,lhecker,2024-04-18T16:23:39Z,2024-04-22T21:23:38+00:00,7,101.0,True,375,58,5,301,0,3,3,MERGED
17069,Fix wrong CommandPallete access,tusharsnx,2024-04-16T16:34:38Z,2024-04-16T19:44:36+00:00,2,3.17,True,4,1,1,339,2,0,2,MERGED
17068,Fix persisting the size of a focus mode window,zadjii-msft,2024-04-16T15:12:15Z,2024-04-25T12:54:47+00:00,2,213.71,True,14,2,1,199,2,0,2,MERGED
17067,A minor TSF refactoring,lhecker,2024-04-16T14:21:27Z,2024-04-18T18:18:46+00:00,13,51.96,True,1408,5494,83,3339,2,9,11,MERGED
17066,Also remember to persist window positions,zadjii-msft,2024-04-16T12:00:01Z,2024-04-17T18:33:07+00:00,3,30.55,True,40,0,7,156,2,1,3,MERGED
17059,Allow copying with ANSI escape code control sequences,FuegoFro,2024-04-13T21:44:18Z,2024-11-20T16:03:05+00:00,15,5298.31,True,348,243,21,1242,9,8,17,MERGED
17058,Fix window style under minimized state,tusharsnx,2024-04-13T15:51:20Z,2024-04-16T16:15:47+00:00,2,72.41,True,3,2,1,442,2,0,2,MERGED
17049,[1.20] Backport session persistence improvements,lhecker,2024-04-11T22:59:37Z,2024-04-23T21:47:14+00:00,2,286.79,True,207,665,43,467,4,0,4,MERGED
17045,Upgrade version of Selenium,skanda890,2024-04-11T09:41:21Z,2024-06-20T20:57:17+00:00,2,1691.27,False,2,2,1,382,8,0,8,CLOSED
17037,Add files via upload,Ismith507,2024-04-10T18:46:42Z,2024-04-30T11:21:59+00:00,1,472.59,False,12,12,1,525,3,4,7,CLOSED
17035,Localization Updates - main - associated with #16886,consvc,2024-04-10T03:04:12Z,2024-04-16T15:36:14+00:00,4,156.53,True,341,341,26,0,0,1,1,MERGED
17030,Add more profile GUID tests,marcelwgn,2024-04-08T19:10:21Z,2024-04-09T20:14:17+00:00,4,25.07,True,43,21,1,574,2,1,3,MERGED
17025,Localization Updates - main - 04/06/2024 03:04:16,consvc,2024-04-06T03:04:16Z,2024-04-08T17:25:58+00:00,2,62.36,True,1,1,1,0,0,0,0,MERGED
17022,Buffer Restore: Fix serializing >32KiB,lhecker,2024-04-05T15:37:47Z,2024-04-05T19:35:17+00:00,3,3.96,True,4,7,1,181,1,1,2,MERGED
17012,Increase usage of fmt and FMT_COMPILE,lhecker,2024-04-03T21:10:39Z,2024-04-05T19:39:02+00:00,7,46.47,True,30,75,9,255,0,3,3,MERGED
17009,Get rid of UpdateTerminalSettings,zadjii-msft,2024-04-03T16:05:59Z,2024-04-05T15:16:56+00:00,4,47.18,True,49,55,11,180,0,1,1,MERGED
17006,Replace WinRT clipboard API with Win32 for copying,lhecker,2024-04-03T01:54:27Z,2024-04-10T20:06:59+00:00,6,186.21,True,113,135,23,699,0,2,2,MERGED
17005,Add Spec for Quick Fix,carlos-zamora,2024-04-02T22:57:12Z,2024-06-11T18:37:09+00:00,20,1675.67,True,74,0,6,234,2,18,20,MERGED
17002,build: try out the MSBuild static graph,DHowett,2024-04-02T18:25:58Z,2024-04-05T00:15:27+00:00,3,53.82,False,1,0,1,79,0,1,1,CLOSED
16998,Don't explode on session restore,zadjii-msft,2024-04-02T14:54:52Z,2024-04-02T17:39:41+00:00,2,2.75,True,12,1,1,446,0,0,0,MERGED
16997,Add some docs on how to resolve `DEP0700` errors in VS,zadjii-msft,2024-04-02T14:43:13Z,2024-04-02T17:07:34+00:00,3,2.41,True,44,0,1,57,1,2,3,MERGED
16993,Fix bugs introduced in #16821 (custom font fallback),lhecker,2024-04-01T21:37:46Z,2024-04-01T23:32:32+00:00,8,1.91,True,56,29,4,642,2,6,8,MERGED
16992,BODGE: send ESC at the start of the PGO test to unblock it tonight,zadjii-msft,2024-04-01T21:02:37Z,2024-04-02T14:24:27+00:00,1,17.36,False,5,0,1,159,1,0,1,CLOSED
16991,ci/rel: publish symbols using the internal symbol request API instead,DHowett,2024-04-01T19:13:51Z,2024-04-02T23:35:51+00:00,3,28.37,True,130,2,5,155,1,3,4,MERGED
16990,Query SGR 4:X support from Terminal before consuming it in the adapter,tusharsnx,2024-04-01T18:52:55Z,2024-04-16T09:00:14+00:00,1,350.12,False,209,4,20,1311,4,0,4,CLOSED
16989,Add clamping of initial rows and columns settings,marcelwgn,2024-04-01T15:09:57Z,2024-04-02T18:54:38+00:00,4,27.74,True,30,0,3,315,3,2,5,MERGED
16987,Don't right-click paste on a click that also activates the window,zadjii-msft,2024-04-01T14:40:51Z,2024-04-02T19:19:49+00:00,4,28.65,False,25,2,5,280,3,1,4,CLOSED
16973,Localization Updates - main - 03/30/2024 03:04:37,consvc,2024-03-30T03:04:37Z,2024-04-02T17:06:28+00:00,4,86.03,True,79,39,23,0,1,1,2,MERGED
16970,Buffer Restore: Fix turning off intense/faint,lhecker,2024-03-29T13:59:13Z,2024-03-29T15:18:31+00:00,2,1.32,True,26,2,1,560,0,0,0,MERGED
16967,Localization Updates - main - 03/29/2024 03:04:36,consvc,2024-03-29T03:04:37Z,2024-03-29T15:19:51+00:00,2,12.25,True,134,95,18,0,0,0,0,MERGED
16966,A shortcut to select file/files in the explorer. And copy that path to the terminal.,Raukie,2024-03-28T20:36:52Z,2024-11-05T03:07:52+00:00,1,5310.52,False,118,1,7,2339,9,0,9,CLOSED
16962,Scratch tool: generate a fragment extension with every color scheme,zadjii-msft,2024-03-28T11:35:50Z,2024-04-02T21:14:41+00:00,3,129.65,True,147,0,1,451,0,1,1,MERGED
16959,Localization Updates - main - 03/28/2024 03:03:16,consvc,2024-03-28T03:03:16Z,2024-03-28T12:56:27+00:00,2,9.89,True,389,0,26,0,0,0,0,MERGED
16955,Replace 'it'll' with 'it will' to adhere to Microsoft Style Guidelines,hellocharli,2024-03-27T22:26:46Z,2024-03-28T12:49:31+00:00,3,14.38,True,1,1,1,571,1,0,1,MERGED
16954,Remove VtApiRoutines,lhecker,2024-03-27T17:16:04Z,2024-03-28T18:53:02+00:00,7,25.62,True,78,1464,34,333,0,2,2,MERGED
16953,"Add Dark+, CGA and IBM color schemes",zadjii-msft,2024-03-27T15:51:24Z,2024-03-28T13:04:37+00:00,2,21.22,True,69,0,1,144,5,0,5,MERGED
16952,Replace til::some with til::small_vector,lhecker,2024-03-27T15:41:57Z,2024-03-29T23:58:05+00:00,8,56.27,True,77,707,21,846,2,7,9,MERGED
16951,"Change default pane keybindings to duplicate, rather than use default profile",zadjii-msft,2024-03-27T15:05:45Z,2024-04-05T19:56:42+00:00,3,220.85,True,4,2,1,172,0,0,0,MERGED
16950,Fix `repositionCursorWithMouse` after the viewport starts scrolling,zadjii-msft,2024-03-27T14:58:26Z,2024-03-28T18:49:31+00:00,4,27.85,True,18,7,1,133,1,2,3,MERGED
16949,Add a WT_SETTINGS_DIR env variable that portable profiles can use,zadjii-msft,2024-03-27T14:23:42Z,2024-03-28T20:44:20+00:00,5,30.34,True,17,0,2,290,3,1,4,MERGED
16948,Replace til::bit_cast with std::bit_cast,lhecker,2024-03-27T13:46:31Z,2024-03-28T19:16:44+00:00,2,29.5,True,9,17,6,107,0,0,0,MERGED
16945,Localization Updates - main - 03/27/2024 02:34:17,consvc,2024-03-27T02:34:18Z,2024-03-27T11:28:26+00:00,2,8.9,True,138,320,19,0,0,0,0,MERGED
16944,Enable the check for the jailbreak filter,PankajBhojwani,2024-03-27T00:11:57Z,2024-03-27T01:19:33+00:00,2,1.13,True,3,0,1,176,0,1,1,MERGED
16941,ci: trigger builds for gh-readonly-queue/* merge queue branches,DHowett,2024-03-26T16:46:09Z,2024-03-26T17:55:14+00:00,1,1.15,True,1,0,1,19,0,0,0,MERGED
16939,AtlasEngine: Make Direct2D/3D and Present1 configurable,lhecker,2024-03-26T15:18:08Z,2024-03-26T22:00:00+00:00,19,6.7,True,351,314,49,534,2,15,17,MERGED
16938,Make marks a stable feature,zadjii-msft,2024-03-26T14:31:59Z,2024-04-05T21:13:44+00:00,5,246.7,True,14,9,3,187,0,0,0,MERGED
16937,Rewrite how marks are stored & add reflow,zadjii-msft,2024-03-26T13:42:46Z,2024-04-05T20:45:23+00:00,30,247.04,True,1628,496,28,1835,5,41,46,MERGED
16924,Make ploc translations predictable,lhecker,2024-03-23T11:03:40Z,2024-03-25T18:42:22+00:00,3,55.65,True,2974,2742,27,476,0,1,1,MERGED
16920,Add VSCode configs for better out-of-box LSP support,tusharsnx,2024-03-22T09:45:37Z,2024-03-25T12:40:04+00:00,2,74.91,True,25,6,1,149,0,0,0,MERGED
16918,Fixed UI capitalization and style errors.,Ismith507,2024-03-21T21:17:25Z,2024-04-10T18:41:51+00:00,1,477.41,False,0,0,0,527,4,6,10,CLOSED
16916,Implement grapheme clusters,lhecker,2024-03-21T16:44:33Z,2024-06-26T19:15:39+00:00,27,2330.52,True,3794,727,54,1415,23,23,46,MERGED
16914,"Add support for restoring non-terminal panes, and opening them with `splitPane`, `newTab`",zadjii-msft,2024-03-21T14:45:52Z,2024-04-05T20:00:11+00:00,14,365.24,True,1182,868,25,1646,0,12,12,MERGED
16910,Localization Updates - main - 03/21/2024 03:04:53,consvc,2024-03-21T03:04:53Z,2024-03-21T14:27:26+00:00,2,11.38,True,717,808,13,0,0,0,0,MERGED
16907,build: roll back to a build container with the 14.38 compiler,DHowett,2024-03-20T19:41:22Z,2024-03-20T20:52:53+00:00,2,1.19,True,1,1,1,51,3,0,3,MERGED
16904,Add IDs to Commands,PankajBhojwani,2024-03-19T20:44:47Z,2024-04-18T01:03:43+00:00,14,700.32,True,352,127,10,470,5,14,19,MERGED
16903,Remove dependency on IsGlyphFullWidth for IRM/DECSWL,lhecker,2024-03-19T16:15:00Z,2024-04-10T15:43:12+00:00,18,527.47,True,142,59,11,413,3,7,10,MERGED
16898,Fix a ReadConsoleOutputCharacter regression,lhecker,2024-03-19T00:02:09Z,2024-03-20T19:37:04+00:00,6,43.58,True,26,40,3,752,3,2,5,MERGED
16894,AtlasEngine: Fix a OOB read when rendering PUA chars,lhecker,2024-03-18T21:13:59Z,2024-03-21T20:38:53+00:00,4,71.42,True,83,64,10,673,3,0,3,MERGED
16886,Fix: UI style errors: Menu items capitalization and  (ellipses) mark misuse,HarshNarayanJha,2024-03-17T06:29:31Z,2024-04-10T00:47:23+00:00,6,570.3,True,49,49,3,349,5,1,6,MERGED
16885,Add generic documentation for TerminalInput::_initKeyboardMap() function of t,raphaelgpalma,2024-03-16T23:21:20Z,2024-03-18T18:22:53+00:00,1,43.03,False,11,0,1,465,1,0,1,CLOSED
16877,Localization Updates - main - 03/15/2024 03:03:49,consvc,2024-03-15T03:03:50Z,2024-03-19T15:38:18+00:00,2,108.57,True,1333,1229,13,0,2,0,2,MERGED
16876,Add SettingContainer Warning/Error styles to replace InfoBar,DHowett,2024-03-14T19:49:03Z,2024-03-18T14:22:52+00:00,2,90.56,True,182,0,1,363,3,0,3,MERGED
16873,"Remove the ""set default terminal"" banner",DHowett,2024-03-14T16:51:40Z,2024-03-20T21:23:12+00:00,2,148.53,True,8,97,6,325,2,0,2,MERGED
16871,Add support for turning off full-color Emoji,DHowett,2024-03-13T23:52:55Z,2024-03-15T00:05:12+00:00,3,24.2,True,56,2,18,280,1,1,2,MERGED
16870,[clang-tidy] Remove in-product uses of std::bind,DHowett,2024-03-13T20:58:38Z,2024-04-29T18:34:57+00:00,4,1125.61,True,12,18,4,145,0,1,1,MERGED
16865,Localization Updates - main - 03/12/2024 03:03:57,consvc,2024-03-12T03:03:57Z,2024-03-12T14:29:00+00:00,1,11.42,True,312,0,3,0,0,0,0,MERGED
16863,Fix a number of minor issues that Clang flagged (again! again!),DHowett,2024-03-11T20:35:07Z,2024-03-18T14:15:36+00:00,2,161.67,True,34,28,11,547,0,0,0,MERGED
16858,Update CommandPalette.cpp to ignore _filterTextChanged on TabSwitchMode,AlejandroBlanco2001,2024-03-10T22:15:41Z,2024-03-14T19:58:05+00:00,2,93.71,True,10,0,1,1422,2,0,2,MERGED
16850,Localization Updates - main - 03/09/2024 03:03:55,consvc,2024-03-09T03:03:56Z,2024-03-09T17:43:36+00:00,1,14.66,True,208,0,2,0,0,0,0,MERGED
16848,Add Quick Fix UI and support for custom CommandNotFound OSC,carlos-zamora,2024-03-08T21:14:14Z,2024-06-29T00:02:26+00:00,23,2690.8,True,516,42,34,1195,13,38,51,MERGED
16844,Use `.rc` files in TSM instead of string literals,PankajBhojwani,2024-03-08T02:03:00Z,2024-03-14T20:50:07+00:00,14,162.79,True,117,67,15,287,7,11,18,MERGED
16837,Replace usages of `TYPED_EVENT` with `til::event`,zadjii-msft,2024-03-07T12:32:38Z,2024-03-20T16:02:26+00:00,7,315.5,True,633,583,107,4808,2,2,4,MERGED
16835,Check the localizations into the project nightly,DHowett,2024-03-06T22:12:15Z,2024-03-08T20:22:11+00:00,8,46.17,True,102,62,9,2410,6,5,11,MERGED
16825,Fix conpty rendering of control characters in the buffer,j4james,2024-03-05T22:47:49Z,2024-03-06T19:16:03+00:00,3,20.47,True,18,0,1,1109,1,0,1,MERGED
16824,Make ColorFromXOrgAppColorName both smaller and more correct,DHowett,2024-03-05T20:35:29Z,2024-03-08T20:14:41+00:00,4,71.65,True,6,7,1,271,0,1,1,MERGED
16823,Add OriginTag to Command,PankajBhojwani,2024-03-05T19:35:59Z,2024-03-19T22:01:00+00:00,5,338.42,True,84,77,10,407,1,2,3,MERGED
16821,Add support for customizing font fallback,lhecker,2024-03-05T17:49:53Z,2024-03-26T23:38:54+00:00,19,509.82,True,727,312,28,551,4,23,27,MERGED
16820,Clean up the Converters implementation,lhecker,2024-03-05T17:44:33Z,2024-03-18T14:26:18+00:00,7,308.7,True,64,68,7,324,0,1,1,MERGED
16816,Update the spec for Action IDs,PankajBhojwani,2024-03-05T00:38:51Z,2024-03-09T19:11:50+00:00,3,114.55,True,44,25,2,413,1,0,1,MERGED
16815,Fix Scratch.sln,carlos-zamora,2024-03-05T00:20:14Z,2024-03-07T22:55:50+00:00,2,70.59,True,3,0,1,209,1,0,1,MERGED
16812,Fix selection expansion for Double-Width and Double-Height rows,tusharsnx,2024-03-04T15:46:09Z,2024-04-02T21:10:11+00:00,3,701.4,True,2,1,1,308,1,0,1,MERGED
16811,Fix feature/llm for the new Microsoft.Terminal.UI library,DHowett,2024-03-04T15:28:32Z,2024-03-04T17:13:46+00:00,1,1.75,True,7,2,4,0,0,0,0,MERGED
16810,Fix the velocity script to actually support canary,zadjii-msft,2024-03-04T12:40:17Z,2024-03-04T20:03:27+00:00,2,7.39,True,1,0,1,282,0,0,0,MERGED
16809,Add a pile of 'experimental' settings to the profile SUI,zadjii-msft,2024-03-04T12:35:52Z,2024-03-21T17:07:57+00:00,12,412.53,True,100,1,6,181,1,3,4,MERGED
16808,Add SearchBox entry/exit animations,tusharsnx,2024-03-04T07:34:08Z,2024-03-18T18:45:59+00:00,14,347.2,True,244,7,7,291,5,3,8,MERGED
16804,Add support for the DECSWT (Set Window Title) escape sequence,j4james,2024-03-03T00:36:33Z,2024-03-04T20:03:14+00:00,5,43.44,True,100,71,15,1159,0,3,3,MERGED
16793,Properly fix ConPTY buffer corking,lhecker,2024-03-01T15:59:57Z,2024-03-28T20:45:20+00:00,2,652.76,True,36,3,4,744,0,0,0,MERGED
16790,Fix being unable to delete a changed Font Axis or Font Feature,PankajBhojwani,2024-02-29T23:39:39Z,2024-03-01T11:43:58+00:00,3,12.07,True,2,2,1,291,0,0,0,MERGED
16789,Fix the bad default light theme selection background color,uoRetr0,2024-02-29T22:36:08Z,2024-04-29T19:30:26+00:00,2,1436.9,True,3,3,1,534,2,0,2,MERGED
16788,A minor cleanup of ProfileViewModel,lhecker,2024-02-29T17:35:51Z,2024-02-29T20:25:29+00:00,3,2.83,True,38,54,2,398,0,0,0,MERGED
16787,Fix bugs in CharToColumnMapper,lhecker,2024-02-29T17:21:00Z,2024-02-29T21:59:15+00:00,5,4.64,True,101,36,6,556,0,1,1,MERGED
16775,Fix the hyperlink detection when there are leading wide glyph in the row,comzyh,2024-02-27T18:21:20Z,2024-02-28T16:34:41+00:00,2,22.22,True,1,1,1,1984,5,0,5,MERGED
16773,Make the Settings Model tests into proper CI tests,DHowett,2024-02-27T17:14:53Z,2024-02-29T17:00:05+00:00,7,47.75,True,142,178,31,512,5,1,6,MERGED
16772,Add new and extend existing til::string helpers,lhecker,2024-02-27T15:57:36Z,2024-02-28T16:57:22+00:00,4,25.0,True,141,58,9,898,0,2,2,MERGED
16767,"DO NOT MERGE, DO REVIEW - migrate openconsole/inbox to main through release-1.19",DHowett,2024-02-26T17:26:37Z,2024-02-26T20:33:48+00:00,1,3.12,False,267,1,4,127,1,0,1,CLOSED
16760,Make shaded block glyphs look even betterer,lhecker,2024-02-24T17:49:34Z,2024-02-28T17:25:58+00:00,8,95.61,True,270,187,11,774,14,4,18,MERGED
16752,build: switch to NuGetAuthenticate@1,DHowett,2024-02-22T23:20:46Z,2024-02-23T11:34:02+00:00,2,12.22,True,2,2,2,48,0,0,0,MERGED
16751,[llm branch] hygiene: remove derelict ARM configurations,DHowett,2024-02-22T21:47:25Z,2024-02-23T11:34:37+00:00,2,13.79,True,0,4,1,50,0,0,0,MERGED
