number,title,author,createdAt,closedOrMergedAt,reviewsCount,hoursOpen,merged,additions,deletions,changedFiles,bodyLength,issueCommentsCount,reviewThreadsCount,interactionsCount,finalReviewState
15278,AtlasEngine: Add support for locl variants,lhecker,2023-05-03T13:48:16Z,2023-05-04T19:08:09+00:00,4,29.33,True,15,2,2,372,0,1,1,MERGED
15273,Don't auto-dismiss the warning dialog on launch,zadjii-msft,2023-05-01T15:39:04Z,2023-05-02T18:22:12+00:00,4,26.72,True,25,2,2,137,2,1,3,MERGED
15269,Preserve active attributes during VT resize operations,j4james,2023-04-30T02:31:32Z,2023-05-02T13:04:02+00:00,3,58.54,True,55,0,2,1173,0,0,0,MERGED
15267,Allow ROW::CopyRangeFrom to be vectorized,lhecker,2023-04-29T15:15:53Z,2023-06-22T22:17:47+00:00,3,1303.03,True,26,14,3,746,1,0,1,MERGED
15263,Move session restore into a helper in AppHost,zadjii-msft,2023-04-28T22:29:15Z,2023-05-02T17:35:43+00:00,3,91.11,True,61,52,2,78,0,1,1,MERGED
15262,Fix Present1 params when scrolling the entire viewport,lhecker,2023-04-28T21:55:37Z,2023-05-08T19:02:02+00:00,8,237.11,True,131,115,4,742,1,9,10,MERGED
15261,Add support for LNM (Line Feed/New Line Mode),j4james,2023-04-28T21:07:29Z,2023-05-12T23:16:49+00:00,2,338.16,True,168,125,12,1664,1,0,1,MERGED
15259,Don't explode when we tear out the last tab of the window,zadjii-msft,2023-04-28T15:21:34Z,2023-04-28T23:10:19+00:00,4,7.81,True,4,3,1,351,0,1,1,MERGED
15258,"Add default bindings for ""move tab/pane to a new window""",zadjii-msft,2023-04-28T14:35:12Z,2023-05-01T15:20:24+00:00,2,72.75,True,19,0,3,118,0,0,0,MERGED
15257,Make reset button accessible,BenConstable9,2023-04-28T11:40:29Z,2023-05-02T17:33:51+00:00,4,101.89,True,5,2,2,78,3,1,4,MERGED
15254,Add an action for manually invoking the control context menu,zadjii-msft,2023-04-27T19:20:31Z,2023-05-11T03:32:27+00:00,6,320.2,True,72,6,8,208,0,4,4,MERGED
15253,Fix an infinite loop when pressing `alt`,zadjii-msft,2023-04-27T19:17:31Z,2023-05-11T03:20:25+00:00,9,320.05,True,11,2,1,52,6,2,8,MERGED
15252,"Make the rclick menu pre-populate ""Find"" with the selected text",zadjii-msft,2023-04-27T19:16:09Z,2023-04-28T19:25:04+00:00,2,24.15,True,4,1,1,21,0,0,0,MERGED
15251,Another theoretical fix for another race condition,zadjii-msft,2023-04-27T15:44:21Z,2023-05-01T14:43:38+00:00,2,94.99,True,2,1,2,160,0,1,1,MERGED
15250,Move the Close... actions to a nested menu on the tab,zadjii-msft,2023-04-27T15:27:31Z,2023-04-28T23:05:29+00:00,2,31.63,True,17,13,3,267,0,1,1,MERGED
15249,Don't just die if the user doesn't have the dx debugging tools,zadjii-msft,2023-04-27T14:43:49Z,2023-04-27T17:08:32+00:00,2,2.41,True,40,4,1,409,1,3,4,MERGED
15241,Add an action for immediately restarting a connection,zadjii-msft,2023-04-26T19:17:27Z,2023-04-28T22:50:12+00:00,3,51.55,True,32,9,7,310,0,0,0,MERGED
15240,(A better) Refactoring of how connection restarting is handled,zadjii-msft,2023-04-26T19:16:54Z,2023-04-28T20:01:13+00:00,18,48.74,True,160,31,13,435,0,10,10,MERGED
15239,Avoid loading nearby fonts unless necessary,lhecker,2023-04-26T17:39:35Z,2023-05-03T11:30:55+00:00,3,161.86,True,109,91,9,504,0,0,0,MERGED
15237,Add support to show close button for active tab only.,kovdu,2023-04-25T21:39:04Z,2023-05-03T11:21:47+00:00,2,181.71,True,48,69,6,580,3,2,5,MERGED
15235,Prevent crash when VTParameters::subspan is out of range,j4james,2023-04-25T19:16:51Z,2023-04-25T21:52:34+00:00,2,2.6,True,38,1,2,938,3,0,3,MERGED
15233,Switch to function pointers,zadjii-msft,2023-04-25T15:13:35Z,2023-04-25T20:25:30+00:00,3,5.2,True,6,6,2,167,0,2,2,MERGED
15232,A very sensible Pane refactoring,zadjii-msft,2023-04-25T15:09:58Z,2023-04-25T20:58:14+00:00,5,5.8,True,26,24,2,360,0,1,1,MERGED
15231,Remove the window thread from the list of threads before nulling the AppHost,zadjii-msft,2023-04-24T18:49:17Z,2023-04-25T14:43:51+00:00,2,19.91,True,16,3,3,312,4,1,5,MERGED
15222,"Remove IsUwp, RunAsUwp, defaults-universal and all fallout",DHowett,2023-04-21T22:34:14Z,2023-04-25T16:28:55+00:00,3,89.91,True,36,375,13,153,0,0,0,MERGED
15221,Add jump list support for indirect icon references,jamespack,2023-04-21T21:40:04Z,2023-04-26T22:34:15+00:00,21,120.9,True,51,9,3,552,6,4,10,MERGED
15220,Make sure the command palette isn't null,zadjii-msft,2023-04-21T15:45:29Z,2023-04-21T21:36:19+00:00,3,5.85,True,1,1,1,97,0,0,0,MERGED
15217,Also do the VisualState dance on the tab item,zadjii-msft,2023-04-20T18:43:18Z,2023-04-24T21:41:11+00:00,2,98.96,True,22,4,1,275,0,0,0,MERGED
15215,Enable WINRT_LEAN_AND_MEAN,DHowett,2023-04-20T18:09:51Z,2023-04-24T22:14:17+00:00,5,100.07,True,13,1,2,497,5,2,7,MERGED
15213,A hypothetical fix for hidden windows,zadjii-msft,2023-04-20T15:47:03Z,2023-04-25T21:42:09+00:00,8,125.92,True,1,1,1,372,2,1,3,MERGED
15206,Fix AppInitialized latency metric,lhecker,2023-04-19T12:13:19Z,2023-04-25T22:28:07+00:00,5,154.25,True,51,67,3,463,1,1,2,MERGED
15204,Avoid animations during startup,lhecker,2023-04-18T17:23:56Z,2023-04-20T12:31:45+00:00,3,43.13,True,235,169,9,1128,1,2,3,MERGED
15203,Lazy load CommandPalette and AboutDialog,lhecker,2023-04-18T16:42:04Z,2023-04-19T19:18:37+00:00,4,26.61,True,76,67,9,318,1,1,2,MERGED
15200,Add automation heading level 1 to fix about dialog,BenConstable9,2023-04-18T10:14:39Z,2023-04-20T13:18:13+00:00,2,51.06,True,2,1,1,176,1,0,1,MERGED
15198,Added Close Pane to Context Menu,joadoumie,2023-04-18T01:51:59Z,2023-04-26T17:37:09+00:00,13,207.75,True,37,4,3,814,8,6,14,MERGED
15196,Lazy load CommandPalette and AboutDialog,lhecker,2023-04-17T20:04:21Z,2023-04-18T16:23:13+00:00,1,20.31,True,78,62,7,304,1,0,1,MERGED
15195,Add a warning when a proportional font is selected,jamespack,2023-04-17T19:45:46Z,2023-04-20T12:42:14+00:00,7,64.94,True,32,2,5,807,6,6,12,MERGED
15189,Default to XamlRoot when unable to find focused object,jamespack,2023-04-15T23:40:41Z,2023-04-20T19:00:37+00:00,3,115.33,True,7,0,1,787,0,0,0,MERGED
15187,Fix Peasant::ActivateWindow being called with an all 0 GUID,lhecker,2023-04-15T21:29:01Z,2023-04-19T17:42:24+00:00,3,92.22,True,34,63,2,876,0,1,1,MERGED
15183,Update to MUX 2.8.3,zadjii-msft,2023-04-14T17:47:33Z,2023-04-17T13:28:29+00:00,2,67.68,True,4,4,3,200,1,0,1,MERGED
15179,Actually use the persisted position with `centerOnLaunch:true`,zadjii-msft,2023-04-13T20:53:11Z,2023-04-14T17:13:07+00:00,2,20.33,True,11,1,1,339,1,0,1,MERGED
15178,Fix reordering tabs mysteriously shuffling the actual backing tabs,zadjii-msft,2023-04-13T20:47:54Z,2023-04-17T13:27:52+00:00,3,88.67,True,29,36,3,523,1,1,2,MERGED
15175,Fix missing call to UpdateViewport::UpdateViewport during tearout,lhecker,2023-04-13T14:25:24Z,2023-04-25T21:32:45+00:00,9,295.12,True,4,3,3,660,2,4,6,MERGED
15171,Fix a hang when writing wide glyphs into a 1 column terminal,lhecker,2023-04-12T11:44:09Z,2023-04-14T21:15:09+00:00,12,57.52,True,16,12,2,638,2,2,4,MERGED
15169,A more efficient copy assignment operator for Pane.LayoutSizeNode,jamespack,2023-04-12T01:51:59Z,2023-04-14T18:52:40+00:00,6,65.01,True,4,34,2,1018,0,1,1,MERGED
15166,Skip generating a profile for rancher-desktop,jamespack,2023-04-11T20:17:31Z,2023-04-12T16:56:56+00:00,2,20.66,True,3,2,1,328,2,0,2,MERGED
15165,Manually hide our DesktopWindowXamlSource,zadjii-msft,2023-04-11T19:54:30Z,2023-04-14T18:07:05+00:00,5,70.21,True,29,2,3,1209,5,0,5,MERGED
15164,Remove a 1px gap under the tabs only visible at >150%,zadjii-msft,2023-04-11T19:50:22Z,2023-04-20T17:13:40+00:00,2,213.39,True,15,3,3,319,5,0,5,MERGED
15162,fix not updating the nav view when add/removing profiles,zadjii-msft,2023-04-11T16:44:48Z,2023-04-17T14:53:59+00:00,13,142.15,True,50,74,2,572,3,5,8,MERGED
15161,Register the GetWindowLayoutRequested handler only when ready,zadjii-msft,2023-04-11T14:50:18Z,2023-04-12T16:57:25+00:00,2,26.12,True,17,7,1,792,2,0,2,MERGED
15160,Fix re-persisting the new legacy themes,zadjii-msft,2023-04-11T13:58:24Z,2023-04-11T22:10:12+00:00,6,8.2,True,13,2,1,97,0,1,1,MERGED
15155,Add support for bracketed paste mode in ConHost,j4james,2023-04-10T21:01:29Z,2023-04-26T16:37:22+00:00,7,379.6,True,66,63,10,1184,0,3,3,MERGED
15154,Add subtext to why Always show tabs is not toggleable in SUI.,jamespack,2023-04-10T19:43:48Z,2023-04-18T16:23:18+00:00,5,188.66,True,2,2,1,707,0,2,2,MERGED
15141,Helix: Decode HTML entities in the test comment field (#15141,DHowett,2023-04-07T19:24:03Z,2023-04-10T20:17:30+00:00,1,72.89,True,1,1,1,188,0,0,0,MERGED
15137,Enable ctrl+shift to run terminal elevated from context menu,jamespack,2023-04-07T13:05:22Z,2023-04-17T14:12:45+00:00,10,241.12,True,10,10,2,640,11,2,13,MERGED
15133,unpackaged: allow building an unpackaged distribution from layout,DHowett,2023-04-07T00:01:26Z,2023-04-20T12:47:06+00:00,2,324.76,True,42,19,1,443,0,0,0,MERGED
15130,Send a KeyUp sequence only once a key has been released,j4james,2023-04-06T20:03:51Z,2023-04-11T22:59:25+00:00,2,122.93,True,5,12,1,1830,6,0,6,MERGED
15129,wpf: Bump the history length to 9001 instead of 1000,DHowett,2023-04-06T17:02:09Z,2023-04-06T20:03:13+00:00,2,3.02,True,1,1,1,52,0,0,0,MERGED
15123,PGO: Update the Helix payload to rely on the unpackaged distribution,DHowett,2023-04-06T00:02:19Z,2023-04-06T20:01:00+00:00,3,19.98,True,6,13,2,72,2,1,3,MERGED
15120,Stop the beef when you hover off a hyperlink,DHowett,2023-04-05T20:52:59Z,2023-04-05T23:10:54+00:00,2,2.3,True,10,8,1,73,0,0,0,MERGED
15118,"When unpackaged, isolate the monarch by the install path",DHowett,2023-04-05T19:01:15Z,2023-04-05T22:04:59+00:00,2,3.06,True,33,2,1,299,0,0,0,MERGED
15111,Respect the codepage stored in .LNK files in conhost,michalnpl,2023-04-04T21:02:20Z,2023-04-06T15:51:57+00:00,2,42.83,True,1,1,1,1030,1,0,1,MERGED
15110,Upgrade clang-format to 15.0.7,lhecker,2023-04-04T20:45:39Z,2023-04-05T15:03:21+00:00,3,18.3,True,188,138,13,224,3,1,4,MERGED
15108,"Add ""legacy"" themes",zadjii-msft,2023-04-04T18:47:08Z,2023-04-06T16:50:31+00:00,5,46.06,True,75,8,4,431,1,2,3,MERGED
15107,Introduce Microsoft.Terminal.UI and consolidate UI helpers,DHowett,2023-04-04T17:05:38Z,2024-03-01T17:56:50+00:00,6,7968.85,True,524,388,72,542,17,7,24,MERGED
15106,Back off between attempts to start the tests,zadjii-msft,2023-04-04T16:17:42Z,2023-04-13T18:38:39+00:00,5,218.35,True,10,6,1,464,7,3,10,MERGED
15105,Use new row primitives for ResizeTraditional,lhecker,2023-04-04T16:11:13Z,2023-04-05T14:59:21+00:00,3,22.8,True,73,188,4,606,0,1,1,MERGED
15100,Replace statics in headers with inline constants,lhecker,2023-04-04T11:53:22Z,2023-04-04T15:19:20+00:00,2,3.43,True,32,32,11,411,0,0,0,MERGED
15098,Fix accuracy bugs around float/double/int conversions,lhecker,2023-04-03T23:38:47Z,2023-04-04T16:33:18+00:00,3,16.91,True,55,59,7,682,2,1,3,MERGED
15097,Remove our dependency on any CRT--AppX or forwarders,DHowett,2023-04-03T23:00:13Z,2023-04-04T21:11:13+00:00,2,22.18,True,17,23,7,128,3,0,3,MERGED
15095,Format URLs for display when we show the tooltip,DHowett,2023-04-03T20:05:13Z,2023-04-03T21:22:25+00:00,3,1.29,True,14,1,2,107,1,0,1,MERGED
15094,Use DIPs for the window bounds when tearing out,zadjii-msft,2023-04-03T19:35:51Z,2023-04-04T14:21:44+00:00,6,18.76,True,14,14,4,112,0,2,2,MERGED
15091,Add a simple tool to test rendering functionality,lhecker,2023-04-03T14:47:22Z,2023-04-03T18:21:22+00:00,3,3.57,True,319,0,5,270,0,1,1,MERGED
15090,Expose hyperlink attributes in PaintBufferGridLines,lhecker,2023-04-03T14:29:21Z,2023-04-03T18:39:37+00:00,2,4.17,True,56,47,6,625,0,0,0,MERGED
15089,Introduce til::linear_flat_set,lhecker,2023-04-03T14:19:11Z,2023-04-04T17:50:10+00:00,3,27.52,True,222,0,6,408,10,1,11,MERGED
15088,Introduce til::generational - a struct comparison helper,lhecker,2023-04-03T13:58:27Z,2023-04-04T13:47:37+00:00,10,23.82,True,135,3,6,1249,5,5,10,MERGED
15087, Fix warnings in til for an upcoming version of MSVC,lhecker,2023-04-03T13:45:30Z,2023-04-03T18:14:01+00:00,2,4.48,True,4,1,2,20,1,1,2,MERGED
15084,Add support for horizontal margin sequences,j4james,2023-04-03T01:08:49Z,2023-05-15T22:32:30+00:00,18,1029.39,True,1025,351,13,2582,8,8,16,MERGED
15082,Support environment variables in the settings,ianjoneill,2023-04-01T18:43:00Z,2023-04-11T23:01:11+00:00,12,244.3,True,322,262,25,255,12,12,24,MERGED
15079,Fix a crash in the rclick context menu,zadjii-msft,2023-03-31T19:47:18Z,2023-03-31T20:49:12+00:00,2,1.03,True,2,2,2,105,0,0,0,MERGED
15078,Upgrade to MUX 2.8,zadjii-msft,2023-03-31T19:43:23Z,2023-04-03T22:40:46+00:00,8,74.96,True,68,38,5,986,3,5,8,MERGED
15077,Fix focus issue when profile selected from nested menu entry,kkostrzewa,2023-03-31T10:26:20Z,2023-04-25T20:24:06+00:00,6,609.96,True,4,0,1,234,6,1,7,MERGED
15075,Filter out control characters that don't do anything,j4james,2023-03-30T21:57:58Z,2023-04-05T14:58:53+00:00,4,137.02,True,44,19,3,1029,1,1,2,MERGED
15062,fix: WpfTerminalControl allow Connection set to null,mitchcapper,2023-03-29T05:25:24Z,2023-04-14T20:25:07+00:00,4,399.0,True,16,3,1,1198,8,1,9,MERGED
15054,Update DECSC/DECRC to match the newer DEC terminals,j4james,2023-03-28T00:41:05Z,2023-03-28T19:03:41+00:00,2,18.38,True,14,22,2,1253,0,0,0,MERGED
15051,"Add ""portable mode"", where settings load from the install path",DHowett,2023-03-27T16:33:11Z,2023-03-31T22:12:00+00:00,8,101.65,True,72,10,10,542,6,4,10,MERGED
15050,Add flexible virtualization rules for HKCU\Console\Startup,DHowett,2023-03-27T16:29:46Z,2023-03-28T15:23:58+00:00,6,22.9,True,33,3,3,341,2,2,4,MERGED
15046,Fix font size of HTML clipboard contents,lhecker,2023-03-26T11:55:02Z,2023-03-27T16:44:54+00:00,2,28.83,True,1,1,1,164,0,0,0,MERGED
15040,Add a second way of detecting whether DefTerm is available,DHowett,2023-03-23T22:11:59Z,2023-03-24T22:21:50+00:00,2,24.16,True,15,1,1,2,2,1,3,MERGED
15039,Clean up more warnings,zadjii-msft,2023-03-23T21:57:41Z,2023-03-24T13:30:59+00:00,2,15.55,True,27,28,3,161,0,0,0,MERGED
15035,VsDevCmdGenerator: respect the user's startingDirectory,DHowett,2023-03-23T00:44:18Z,2023-03-23T23:14:49+00:00,2,22.51,True,4,0,2,85,1,0,1,MERGED
15034,Add support for an unpackaged distribution of Terminal,DHowett,2023-03-22T23:39:54Z,2023-03-30T21:38:11+00:00,2,189.97,True,269,10,7,1903,5,0,5,MERGED
15032,[SPEC] Add a lightweight spec for Portable Mode,DHowett,2023-03-22T19:37:39Z,2023-03-31T20:46:00+00:00,12,217.14,True,90,0,1,0,1,5,6,MERGED
15031,Consolidate our MSIX distribution back down to one package,DHowett,2023-03-22T19:26:20Z,2023-03-24T13:31:17+00:00,3,42.08,True,31,150,19,678,1,1,2,MERGED
15030,Fix `wt -w _quake` by not throwing when setting the window name,zadjii-msft,2023-03-22T18:15:11Z,2023-03-24T13:30:38+00:00,4,43.26,True,13,2,1,197,0,1,1,MERGED
15029,Add `til::property` and other winrt helpers,zadjii-msft,2023-03-21T20:34:39Z,2023-05-03T17:41:37+00:00,8,1029.12,True,372,9,9,679,3,19,22,MERGED
15028,Remove useRegExe and add rescap:unvirtualizedResources,DHowett,2023-03-21T18:20:25Z,2023-03-21T20:18:22+00:00,2,1.97,True,26,64,6,251,4,0,4,MERGED
15027,Add a `useCommandline` property to the suggestions action,zadjii-msft,2023-03-21T16:05:19Z,2023-08-15T15:39:37+00:00,7,3527.57,True,101,41,16,438,1,4,5,MERGED
15026,Fix DECCRA when copying from a double-width line,j4james,2023-03-21T10:57:30Z,2023-03-22T17:37:09+00:00,3,30.66,True,54,1,2,709,0,0,0,MERGED
15020,"Add buttons for selecting commands, output to context menu",zadjii-msft,2023-03-20T15:09:39Z,2023-04-25T14:43:49+00:00,10,863.57,True,249,19,12,379,8,10,18,MERGED
15011,Fix some simple C# linter warnings,zadjii-msft,2023-03-17T17:31:09Z,2023-03-17T18:52:24+00:00,2,1.35,True,18,17,1,265,0,0,0,MERGED
15010,Enable the Hybrid CRT for all C++ projects,DHowett,2023-03-17T17:29:48Z,2023-03-17T22:12:32+00:00,2,4.71,True,15,1,2,659,1,0,1,MERGED
15008,Properly configure the project dependencies for TerminalAzBridge,zadjii-msft,2023-03-17T14:01:39Z,2023-03-17T18:59:36+00:00,3,4.97,True,4,1,2,68,2,1,3,MERGED
15002,Fix audit failures in TerminalCore,j4james,2023-03-16T11:11:28Z,2023-03-16T16:51:54+00:00,2,5.67,True,5,5,3,496,0,0,0,MERGED
14999,Reload environment variables by default; add setting to disable,ianjoneill,2023-03-16T08:55:04Z,2023-03-17T18:50:19+00:00,6,33.92,True,161,132,8,518,14,4,18,MERGED
14998,Add support for the Presentation State reports,j4james,2023-03-16T01:02:36Z,2023-03-23T22:46:18+00:00,14,189.73,True,661,24,13,1007,1,8,9,MERGED
14995,Add options to enable and disable read only mode,Swinkid,2023-03-14T23:40:56Z,2023-03-22T17:32:57+00:00,6,185.87,True,89,2,13,891,8,4,12,MERGED
14993,Allow wsl$ in file URIs; generally allow all URI schemes,zadjii-msft,2023-03-14T19:55:52Z,2023-03-17T18:29:43+00:00,2,70.56,True,14,1,1,754,3,0,3,MERGED
14991,Fix console aliases not working,lhecker,2023-03-14T16:26:43Z,2023-03-17T20:43:44+00:00,7,76.28,True,47,40,4,596,2,5,7,MERGED
14990,Add support for querying the DECAC settings,j4james,2023-03-14T15:36:10Z,2023-03-17T19:16:47+00:00,2,75.68,True,85,6,3,1324,2,0,2,MERGED
14989,Add support for the DECRQCRA checksum report,j4james,2023-03-14T02:33:56Z,2023-03-14T16:45:46+00:00,2,14.2,True,208,0,11,1940,2,0,2,MERGED
14971,Fix offset calculation in the outlines shader,lhecker,2023-03-08T23:44:34Z,2023-03-16T20:21:33+00:00,2,188.62,True,16,35,1,464,0,0,0,MERGED
14965,Add a Winget Releaser workflow,sitiom,2023-03-08T05:56:14Z,2023-03-17T22:57:43+00:00,2,233.02,True,27,0,1,266,10,0,10,MERGED
14959,Rewrite AtlasEngine to allow arbitrary overhangs,lhecker,2023-03-06T16:37:27Z,2023-04-26T12:02:51+00:00,21,1219.42,True,6162,3605,34,3178,34,28,62,MERGED
14947,Add pre-build PowerShell version check,Smeyer025,2023-03-03T18:36:15Z,2023-03-31T23:02:29+00:00,2,676.44,True,14,0,3,1745,2,0,2,MERGED
14946,Clearly differentiate running elevated vs. drag/drop breaking,zadjii-msft,2023-03-03T15:16:44Z,2023-03-17T22:01:37+00:00,6,342.75,True,84,72,11,657,3,6,9,MERGED
14944,Add support for running the Terminal without _any_ windows,zadjii-msft,2023-03-02T22:29:37Z,2023-04-06T17:39:40+00:00,3,835.17,True,25,1,7,670,2,0,2,MERGED
14943,Add support for opening the Suggestions UI with recent commands,zadjii-msft,2023-03-02T21:06:09Z,2023-08-15T13:48:09+00:00,14,3976.7,True,212,16,18,564,2,15,17,MERGED
14939,Add tooltips to the Suggestions Control,zadjii-msft,2023-03-01T19:32:53Z,2023-08-10T16:22:48+00:00,1,3884.83,False,123,7,6,352,7,1,8,CLOSED
14938,Add Suggestions UI & experimental shell completions support,zadjii-msft,2023-03-01T18:58:30Z,2023-08-14T10:46:42+00:00,47,3975.8,True,2003,3,40,4180,5,47,52,MERGED
14936,Ensure that delayed EOL wrap is reset when necessary,j4james,2023-02-28T23:29:26Z,2023-03-04T00:57:51+00:00,9,73.47,True,172,13,6,2561,0,4,4,MERGED
14935,Enable tearing out tabs to create new windows,zadjii-msft,2023-02-28T20:55:32Z,2023-03-31T19:37:18+00:00,9,742.7,True,380,111,19,1089,9,27,36,MERGED
14933,Switch to the new Helix queues,DHowett,2023-02-28T19:28:06Z,2023-03-03T21:26:39+00:00,2,73.98,True,2,2,1,36,1,0,1,MERGED
14931,Address remaining review feedback for #14255,lhecker,2023-02-28T12:16:03Z,2023-02-28T18:50:14+00:00,2,6.57,True,1,13,4,153,0,0,0,MERGED
14914,Prefer member function find over std::find,AZero13,2023-02-27T04:24:20Z,2023-02-27T15:42:09+00:00,3,11.3,False,1,3,1,49,1,2,3,CLOSED
14906,Provide a more detailed Device Attributes report,j4james,2023-02-25T02:07:47Z,2023-04-26T16:56:22+00:00,2,1454.81,True,25,5,2,1190,2,0,2,MERGED
14901,Enable dragging tabs between windows,zadjii-msft,2023-02-23T16:39:49Z,2023-03-30T15:20:24+00:00,17,838.68,True,364,14,21,2954,7,21,28,MERGED
14883,AtlasEngine: Fix calculation of advanceScale,lhecker,2023-02-20T13:10:03Z,2023-02-21T21:23:39+00:00,2,32.23,True,1,1,1,218,0,0,0,MERGED
14874,Merge the LineFeed functionality into AdaptDispatch,j4james,2023-02-18T14:53:57Z,2023-03-30T18:32:55+00:00,4,963.65,True,330,638,15,2582,1,1,2,MERGED
14873,Enable holding ctrl to open the Terminal elevated from File Explorer,jamespack,2023-02-18T01:14:34Z,2023-04-04T16:24:34+00:00,2,1095.17,True,26,2,3,480,14,0,14,MERGED
14870,Correctness: Remove JsonUtils and IconConverter's 2-phase lookup bugs,DHowett,2023-02-17T23:22:59Z,2023-02-18T00:26:31+00:00,2,1.06,True,83,87,6,280,3,0,3,MERGED
14866,Add support for moving panes and tabs between windows,zadjii-msft,2023-02-17T17:18:53Z,2023-03-30T14:37:54+00:00,31,981.32,True,944,169,52,1818,5,45,50,MERGED
14864,Spec for the Suggestions UI,zadjii-msft,2023-02-17T12:54:17Z,2023-10-05T14:27:31+00:00,22,5521.55,True,745,0,7,845,4,40,44,MERGED
14851,Introduce a ContentManager helper,zadjii-msft,2023-02-14T15:42:41Z,2023-03-22T17:11:44+00:00,17,865.48,True,297,46,21,2157,2,23,25,MERGED
14846,Update ControlsV2 scrollbar template,lhecker,2023-02-13T22:00:18Z,2023-02-15T23:36:40+00:00,3,49.61,True,31,28,2,124,3,1,4,MERGED
14843,One process to rule them all,zadjii-msft,2023-02-13T16:48:47Z,2023-03-17T22:59:35+00:00,79,774.18,True,1916,1741,48,9012,5,92,97,MERGED
14840,Ignore CHAR_INFO trailers during WriteConsoleOutput,lhecker,2023-02-13T13:54:56Z,2023-02-15T23:40:25+00:00,2,57.76,True,73,17,4,410,0,0,0,MERGED
14839,Create til::env to help with refreshing environment variables,ianjoneill,2023-02-13T13:26:50Z,2023-03-13T23:10:39+00:00,12,681.73,True,689,2,6,193,7,16,23,MERGED
14825,"Split `AppLogic` into ""App logic"" and ""Window logic""",zadjii-msft,2023-02-10T22:58:14Z,2023-03-17T14:17:12+00:00,37,831.32,True,2050,1650,21,3203,5,51,56,MERGED
14822,Consolidate NTSTATUS and remove INLINE_NSTATUS_FROM_WIN32,DHowett,2023-02-10T20:03:58Z,2023-02-14T21:48:25+00:00,3,97.74,True,361,545,60,758,4,3,7,MERGED
14821,Add an efficient text stream write function,lhecker,2023-02-10T16:43:30Z,2023-03-24T22:20:53+00:00,26,1013.62,True,566,217,18,1502,15,19,34,MERGED
14816,"Pass the window root to the profile page views, instead of the view model",PankajBhojwani,2023-02-09T18:31:42Z,2023-02-10T23:39:08+00:00,6,29.12,True,53,24,13,276,0,2,2,MERGED
14807,Add the ability to select a whole command (or its output),zadjii-msft,2023-02-07T14:20:30Z,2023-04-20T12:34:58+00:00,7,1726.24,True,398,20,16,1017,0,15,15,MERGED
14792,Spec for shell integration marks,zadjii-msft,2023-02-05T21:59:37Z,2023-07-20T22:24:42+00:00,25,3960.42,True,499,0,3,1242,6,47,53,MERGED
14787,Update tab drop behavior to select dropped tab,marcelwgn,2023-02-04T22:02:25Z,2023-02-07T23:45:35+00:00,4,73.72,True,7,0,1,57,1,0,1,MERGED
14776,AzureConnection: remove our dependency on cpprestsdk,DHowett,2023-02-03T00:25:29Z,2023-02-07T21:13:11+00:00,22,116.8,True,292,347,16,1237,5,14,19,MERGED
14775,Add support for a right-click context menu,zadjii-msft,2023-02-02T23:42:45Z,2023-03-17T18:54:11+00:00,17,1027.19,True,322,21,26,780,4,24,28,MERGED
14763,Replace gsl::byte/span with std,lhecker,2023-01-30T15:20:48Z,2023-02-02T21:24:14+00:00,4,78.06,True,359,383,97,223,1,3,4,MERGED
14748,Minor cleanups after #14745,lhecker,2023-01-27T17:02:12Z,2023-03-30T15:27:05+00:00,2,1486.41,True,4,25,2,57,0,0,0,MERGED
14747,Make KeyEvent char data a little less confusing,lhecker,2023-01-27T17:00:25Z,2023-02-02T21:12:38+00:00,3,148.2,True,12,3,4,188,0,0,0,MERGED
14746,Minor improvements for SplitToOem,lhecker,2023-01-27T16:59:23Z,2023-02-02T21:14:52+00:00,4,148.26,True,13,16,1,514,1,1,2,MERGED
14745,Remove TranslateUnicodeToOem and all related code,lhecker,2023-01-27T16:51:26Z,2023-02-28T20:55:18+00:00,23,772.06,True,603,1224,23,2263,10,22,32,MERGED
14735,Make all console output modes more strictly buffer state,j4james,2023-01-26T01:31:40Z,2023-01-27T20:38:38+00:00,4,43.12,True,77,69,11,1778,6,1,7,MERGED
14733,Generalize OpenConsoleProxy's HybridCRT logic,DHowett,2023-01-25T22:01:14Z,2023-01-27T19:17:31+00:00,3,45.27,True,46,38,5,137,1,1,2,MERGED
14728,"When generating a stacked changelog, note which branch/es contain a commit",DHowett,2023-01-24T22:23:12Z,2023-01-25T18:52:12+00:00,3,20.48,True,18,9,1,922,0,1,1,MERGED
14722,Resize our ContentDialog's when the window resizes,zadjii-msft,2023-01-23T15:22:43Z,2023-01-23T18:42:27+00:00,3,3.33,True,19,0,1,509,2,1,3,MERGED
14714,Ensure TermControl is not closing when firing UIA events,carlos-zamora,2023-01-20T19:01:16Z,2023-01-21T15:48:34+00:00,13,20.79,True,13,0,3,517,4,4,8,MERGED
14710,Code sign the contents of the Terminal package,DHowett,2023-01-20T00:08:09Z,2023-01-20T17:47:19+00:00,2,17.65,True,140,0,2,642,3,1,4,MERGED
14708,Update the titlebar visibility when we gain/lose focus too,zadjii-msft,2023-01-19T23:06:56Z,2023-01-20T01:38:35+00:00,2,2.53,True,19,2,1,584,4,1,5,MERGED
14706,Fix the selected color scheme list item container background being blue in Windows 10,PankajBhojwani,2023-01-19T19:24:53Z,2023-01-19T22:04:29+00:00,4,2.66,True,5,0,1,209,5,1,6,MERGED
14704,Manually set the automation name of the default color scheme for screen reader,PankajBhojwani,2023-01-19T01:43:44Z,2023-01-19T19:39:09+00:00,3,17.92,True,19,0,2,859,7,0,7,MERGED
14701,"Add TerminalStress, Mike Treit's application for breaking WT",DHowett,2023-01-18T23:53:58Z,2023-01-19T19:20:44+00:00,4,19.45,True,123,0,4,89,5,1,6,MERGED
14700,Add support for IRM (Insert Replace Mode),j4james,2023-01-18T23:28:37Z,2023-01-19T19:59:05+00:00,5,20.51,True,128,11,10,930,6,3,9,MERGED
14697,Make the PR template less unfriendly,DHowett,2023-01-18T21:57:28Z,2023-01-19T11:39:05+00:00,3,13.69,True,8,14,1,98,1,1,2,MERGED
14694,Add mutex to keyEvents in TermControlAutomationPeer,carlos-zamora,2023-01-17T23:26:45Z,2023-01-18T07:28:06+00:00,7,8.02,True,24,20,3,446,3,2,5,MERGED
14678,[WPF] Add TermCore null checks to HwndTerminal,carlos-zamora,2023-01-13T19:09:12Z,2023-01-13T23:03:15+00:00,2,3.9,True,68,10,1,306,4,0,4,MERGED
14677,Prevent flickering in nushell due to FTCS marks,zadjii-msft,2023-01-13T16:35:59Z,2023-05-11T21:11:30+00:00,9,2836.59,True,33,12,5,696,5,6,11,MERGED
14675,Only use Mica in the SUI if Mica is available,zadjii-msft,2023-01-13T11:36:53Z,2023-01-19T21:06:49+00:00,7,153.5,True,27,1,1,247,3,2,5,MERGED
14673,Ensure export and find tab context menu items work for unfocused tabs,ianjoneill,2023-01-13T07:06:05Z,2023-01-16T18:18:06+00:00,2,83.2,True,15,11,4,614,2,0,2,MERGED
14671,Fix some additional typos,musvaage,2023-01-12T15:03:55Z,2023-01-16T16:17:55+00:00,3,97.23,True,9,9,8,63,3,0,3,MERGED
