number,title,author,createdAt,closedOrMergedAt,reviewsCount,hoursOpen,merged,additions,deletions,changedFiles,bodyLength,issueCommentsCount,reviewThreadsCount,interactionsCount,finalReviewState
10971,Ensure automation peer is created regardless of terminal initialization,carlos-zamora,2021-08-17T23:18:26Z,2021-08-18T21:26:44+00:00,8,22.14,True,57,40,4,1045,3,3,6,MERGED
10969,Reword bold enum options,PankajBhojwani,2021-08-17T22:55:43Z,2021-08-20T22:34:34+00:00,8,71.65,True,4,4,1,97,1,1,2,MERGED
10967,Lookup WSL distros in the registry,zadjii-msft,2021-08-17T18:14:45Z,2021-08-24T13:10:37+00:00,18,162.93,True,189,1,2,933,14,18,32,MERGED
10966,Refactor `u8u16` and `u16u8` conversion functions,german-one,2021-08-17T17:45:53Z,2021-08-23T23:48:14+00:00,36,150.04,True,174,303,2,1118,8,20,28,MERGED
10958,"Render ""intense"" text as bright by default",PankajBhojwani,2021-08-16T17:32:00Z,2021-08-16T19:59:37+00:00,3,2.46,True,2,2,2,126,6,0,6,MERGED
10947,Fix focus-tab --previous/next to ignore tab switcher order,Don-Vito,2021-08-15T06:31:07Z,2021-08-19T17:18:14+00:00,3,106.79,True,15,0,3,151,5,1,6,MERGED
10945,Make ActionMap compatible with ScanCode-only KeyChords,lhecker,2021-08-13T16:19:07Z,2021-08-20T00:21:33+00:00,9,152.04,True,117,103,7,428,2,4,6,MERGED
10941,Initial try for connection restart,skyline75489,2021-08-13T03:01:09Z,2021-08-18T03:55:17+00:00,2,120.9,False,98,6,18,603,3,1,4,CLOSED
10938,Tray Icon PR followup,leonMSFT,2021-08-12T22:49:03Z,2021-08-19T17:38:18+00:00,13,162.82,True,20,18,4,257,4,3,7,MERGED
10937,Prevent deadlock in UIA Move API,carlos-zamora,2021-08-12T22:12:39Z,2021-08-13T17:56:34+00:00,2,19.73,True,75,63,2,483,11,0,11,MERGED
10934,Change settings content frame transition to drill in,Don-Vito,2021-08-12T19:37:32Z,2021-08-12T22:36:10+00:00,3,2.98,True,11,1,1,155,12,0,12,MERGED
10927,GH10909 in order movement,Rosefield,2021-08-12T02:22:33Z,2021-08-16T22:33:23+00:00,6,116.18,True,310,156,15,571,11,3,14,MERGED
10923,Remove std::deque from Renderer,lhecker,2021-08-11T21:24:42Z,2021-08-24T15:28:00+00:00,31,306.06,True,161,251,10,307,5,17,22,MERGED
10922,"Manually dismiss popups when the window moves, or the SUI scrolls",zadjii-msft,2021-08-11T17:55:41Z,2021-08-16T13:41:17+00:00,6,115.76,True,231,155,24,1649,7,5,12,MERGED
10921,Improve WriteCharsLegacy performance by increasing local buffer size,lhecker,2021-08-11T17:09:19Z,2021-08-12T17:54:59+00:00,5,24.76,True,3,3,1,306,3,1,4,MERGED
10917,Fix layering of sc() keybindings with vk() ones,lhecker,2021-08-11T00:13:10Z,2021-08-11T23:09:25+00:00,2,22.94,True,99,74,8,460,6,0,6,MERGED
10916,Use STL for ActionMap members,lhecker,2021-08-10T22:37:24Z,2021-08-11T15:18:56+00:00,11,16.69,True,26,29,3,241,1,4,5,MERGED
10910,Hide profiles by default if they aren't new,lhecker,2021-08-09T21:41:40Z,2021-08-16T13:32:05+00:00,3,159.84,True,48,8,2,870,15,1,16,MERGED
10908,Fix WriteUTF8FileAtomic to preserve symlinks,Don-Vito,2021-08-09T19:19:02Z,2021-08-12T16:47:16+00:00,36,69.47,True,23,2,2,738,14,5,19,MERGED
10907,"Add logging, test for #10875",zadjii-msft,2021-08-09T15:02:15Z,2021-08-11T15:20:16+00:00,4,48.3,True,106,17,5,670,2,2,4,MERGED
10906,Implement and action for manually clearing the Terminal (and conpty) buffer,zadjii-msft,2021-08-09T14:50:25Z,2021-09-02T14:59:43+00:00,6,576.15,True,536,1,35,1176,4,4,8,MERGED
10902,Account for the window frame when calculating initial position,zadjii-msft,2021-08-09T09:51:53Z,2021-08-09T18:27:20+00:00,2,8.59,True,58,13,5,463,3,0,3,MERGED
10901,Make the TerminalApi exception handler less garrulous,zadjii-msft,2021-08-09T09:46:42Z,2021-08-09T18:28:07+00:00,2,8.69,True,27,18,2,549,3,0,3,MERGED
10895,Prevent redraw upon resize if new size is equal to old,Don-Vito,2021-08-08T09:08:46Z,2021-08-09T18:22:08+00:00,2,33.22,True,12,5,1,464,3,0,3,MERGED
10886,Improve UIA movement testing methodology,carlos-zamora,2021-08-06T00:21:28Z,2021-08-19T20:47:08+00:00,3,332.43,True,4038,56,6,855,5,1,6,MERGED
10885,Update SUI tooltips from 'checked' to 'enabled',carlos-zamora,2021-08-05T20:55:09Z,2021-08-09T17:29:04+00:00,3,92.57,True,13,13,1,129,3,1,4,MERGED
10878,Fix a use-after-free crash when returning from the alt buffer,j4james,2021-08-05T02:45:39Z,2021-08-05T13:08:51+00:00,2,10.39,True,3,2,1,1003,3,0,3,MERGED
10876,Reload settings when the input method changes,lhecker,2021-08-05T00:25:16Z,2021-08-05T21:33:45+00:00,3,21.14,True,93,28,7,607,3,1,4,MERGED
10874,Initialize the padding for the Control UIA provider,zadjii-msft,2021-08-04T18:47:41Z,2021-08-11T15:13:39+00:00,2,164.43,True,10,2,3,692,2,1,3,MERGED
10867,Fix SSE2 variant of TextColor::GetColor,lhecker,2021-08-04T00:59:06Z,2021-08-04T15:57:20+00:00,3,14.97,True,6,3,1,263,3,0,3,MERGED
10865,Add selection marker overlays for keyboard selection,carlos-zamora,2021-08-03T22:50:51Z,2022-06-20T22:47:53+00:00,18,7703.95,True,285,31,12,1498,25,18,43,MERGED
10864,Add titlebar acrylic,matthew4850,2021-08-03T22:47:42Z,2021-08-23T16:40:26+00:00,5,473.88,True,1292,1218,9,463,12,3,15,MERGED
10863,Fix setting `wght` axis font bugs,PankajBhojwani,2021-08-03T18:33:57Z,2021-08-25T01:19:41+00:00,14,510.76,True,96,11,3,314,12,9,21,MERGED
10856,Fix font changes not resizing _invalidMap,lhecker,2021-08-02T18:40:22Z,2021-08-02T20:54:47+00:00,3,2.24,True,6,5,1,252,2,1,3,MERGED
10854,Move to 1ES engineering pools,miniksa,2021-08-02T17:53:11Z,2021-08-04T17:00:41+00:00,3,47.12,True,25,21,4,301,5,0,5,MERGED
10847,Sanitize C1 control chars in SetConsoleTitle API,j4james,2021-08-01T22:52:18Z,2021-08-02T21:04:17+00:00,6,22.2,True,40,9,2,1005,4,1,5,MERGED
10846,[settings-editor] Switch to function bindings instead of Converter objects,marcelwgn,2021-08-01T22:20:18Z,2021-08-03T22:25:24+00:00,7,48.09,True,233,727,37,174,4,13,17,MERGED
10843,Make the alt buffer inherit cursor state from the main buffer,j4james,2021-08-01T19:59:27Z,2021-08-02T19:56:12+00:00,4,23.95,True,86,2,2,1204,8,1,9,MERGED
10842,Fix drag and drop on '+' button for drive letters,ianjoneill,2021-08-01T18:22:36Z,2021-08-03T18:16:07+00:00,10,47.89,True,25,11,3,272,2,1,3,MERGED
10841,Set drag and drop on '+' tooltip text based on keyboard modifiers,ianjoneill,2021-08-01T17:46:39Z,2021-08-02T18:44:39+00:00,3,24.97,True,20,3,2,344,2,0,2,MERGED
10832,Add Split Tab option to tab context menu,cinnamon-msft,2021-07-30T17:45:55Z,2021-08-05T13:46:24+00:00,9,140.01,True,88,7,6,1059,2,8,10,MERGED
10824,Implement Keyboard Selection,carlos-zamora,2021-07-29T23:46:39Z,2021-09-23T19:24:32+00:00,17,1339.63,True,306,51,12,1086,12,13,25,MERGED
10823,[DefApp] Move from Monarch multi instance servers to Peasant single instance servers,leonMSFT,2021-07-29T20:30:22Z,2021-08-05T17:05:22+00:00,9,164.58,True,74,50,8,505,6,5,11,MERGED
10811,Optimize hot path in OutputCellIterator,skyline75489,2021-07-28T01:49:25Z,2021-07-30T02:25:00+00:00,2,48.59,False,37,2,2,556,6,3,9,CLOSED
10806,Passing through moveFocus keys when moving to another pane failed,FWest98,2021-07-27T15:10:26Z,2021-07-28T22:05:33+00:00,2,30.92,True,18,12,5,1183,5,1,6,MERGED
10801,Fix: Multimedia Key Hotkey Support,FWest98,2021-07-27T00:19:37Z,2021-07-27T17:11:52+00:00,2,16.87,True,9,2,2,679,3,0,3,MERGED
10799,Adding/fixing Alt+Space handling,FWest98,2021-07-26T22:20:42Z,2021-08-10T19:53:07+00:00,3,357.54,True,100,38,11,3256,4,1,5,MERGED
10780,Move Pane to Tab (GH7075),Rosefield,2021-07-24T05:25:41Z,2021-08-12T16:41:18+00:00,13,467.26,True,805,218,22,2577,14,9,23,MERGED
10779,Vectorize TextColor::GetColor,lhecker,2021-07-24T00:09:58Z,2021-08-02T19:03:00+00:00,6,234.88,True,154,129,13,347,5,1,6,MERGED
10778,Replace the placeholder release build with our real one,DHowett,2021-07-23T23:00:24Z,2021-07-27T01:14:59+00:00,6,74.24,True,482,143,3,677,2,4,6,MERGED
10777,[DRAFT] Use Font Set filtering/matching to better resolve complex name specifications,miniksa,2021-07-23T21:56:27Z,2022-01-14T16:43:12+00:00,10,4194.78,False,79,8,2,354,4,3,7,CLOSED
10774,Remove some unnecessary font features from our default feature list,PankajBhojwani,2021-07-23T21:33:42Z,2021-07-26T16:27:07+00:00,3,66.89,True,1,8,1,194,1,1,2,MERGED
10772,[DefApp] Teach connection and tab to negotiate initial size,miniksa,2021-07-23T20:37:36Z,2021-07-26T19:31:48+00:00,3,70.9,True,22,2,2,914,3,1,4,MERGED
10770,Fix conhost UseDx mode,lhecker,2021-07-23T15:49:34Z,2021-07-23T18:19:07+00:00,11,2.49,True,12,18,3,467,2,4,6,MERGED
10759,"Add an ENUM setting for disabling rendering ""intense"" text as bold",zadjii-msft,2021-07-22T17:26:08Z,2021-08-16T13:45:57+00:00,15,596.33,True,208,8,29,1425,12,7,19,MERGED
10756,Update NavigateFocus function to use new visual-based navigation,Rosefield,2021-07-22T14:35:12Z,2021-07-23T00:09:48+00:00,2,9.58,True,15,60,2,806,2,0,2,MERGED
10755,"Combine progress states in the tab, taskbar",zadjii-msft,2021-07-22T14:14:38Z,2021-08-10T11:16:18+00:00,5,453.03,True,217,76,16,1571,3,5,8,MERGED
10751,Pass inbound handoff message via heap so it cannot race out of scope by the time it reaches the ConsoleIoThread,miniksa,2021-07-21T20:59:11Z,2021-07-22T12:51:31+00:00,5,15.87,True,24,1,1,1867,3,1,4,MERGED
10749,Fix text selection while new lines are being printed when history buffer is full,PankajBhojwani,2021-07-21T18:57:28Z,2021-08-20T22:36:26+00:00,11,723.65,True,107,0,3,377,6,4,10,MERGED
10746,Shift the island up by 1px when maximized,zadjii-msft,2021-07-21T14:32:45Z,2021-07-28T22:15:22+00:00,3,175.71,True,16,1,2,882,4,1,5,MERGED
10744,Recalculate quake window size when snapping across monitors,zadjii-msft,2021-07-21T13:04:42Z,2021-08-02T19:42:57+00:00,7,294.64,True,91,9,2,918,3,5,8,MERGED
10738,Release unneeded memory more eagerly from conhost,lhecker,2021-07-20T21:59:17Z,2021-07-21T05:59:58+00:00,4,8.01,True,24,2,2,797,6,1,7,MERGED
10737,Account for the window borders when restoring from fullscreen,zadjii-msft,2021-07-20T20:24:10Z,2021-07-28T22:18:58+00:00,9,193.91,True,24,8,1,802,4,3,7,MERGED
10727,Fix building with v143 toolchain,lhecker,2021-07-20T15:37:52Z,2021-07-20T17:00:50+00:00,4,1.38,True,8,50,12,257,0,2,2,MERGED
10726,Add tracelogging for drag&drop on the new tab button,zadjii-msft,2021-07-20T14:45:28Z,2021-07-20T16:19:48+00:00,2,1.57,True,7,0,1,166,4,0,4,MERGED
10716,Add background color to grid to prevent animation overflow,mimvdb,2021-07-19T23:23:57Z,2021-07-20T19:04:19+00:00,6,19.67,True,4,3,1,911,4,1,5,MERGED
10715,Add `experimental.input.forceVT` to JSON schema,cinnamon-msft,2021-07-19T22:30:40Z,2021-07-20T14:16:40+00:00,2,15.77,True,4,0,1,134,1,0,1,MERGED
10714,Don't auto-generate the hidden field when creating profile stubs,PankajBhojwani,2021-07-19T22:13:59Z,2021-07-21T22:41:12+00:00,3,48.45,True,0,2,1,656,1,0,1,MERGED
10713,Add the ability to toggle a pane's split direction,Rosefield,2021-07-19T22:06:27Z,2021-08-02T21:04:57+00:00,4,334.98,True,159,59,12,880,13,1,14,MERGED
10711,Make sure we terminate the expected title string,DHowett,2021-07-19T19:38:00Z,2021-07-20T14:04:54+00:00,3,18.45,True,5,1,2,308,3,1,4,MERGED
10685,Defer cursor winrt event triggering,skyline75489,2021-07-16T10:06:47Z,2021-07-20T14:05:46+00:00,2,99.98,True,12,1,3,556,9,0,9,MERGED
10676,Prevent the quake window's borders from hanging onto adjacent monitors,zadjii-msft,2021-07-15T21:18:33Z,2021-07-20T21:04:42+00:00,4,119.77,True,5,2,1,369,3,1,4,MERGED
10675,Fix unfocused appearance editor not appearing/disappearing correctly,PankajBhojwani,2021-07-15T20:28:07Z,2021-07-16T17:18:40+00:00,4,20.84,True,2,2,1,413,1,1,2,MERGED
10674,Re-evaluate the size of the quake window when it's summoned to a monitor,zadjii-msft,2021-07-15T20:26:53Z,2021-07-20T16:26:36+00:00,2,116.0,True,7,0,1,609,4,0,4,MERGED
10666,Introduce vk() and sc() key chord specifiers,lhecker,2021-07-15T01:14:59Z,2021-07-20T22:34:52+00:00,13,141.33,True,541,332,26,740,11,19,30,MERGED
10663,Fix color picker minimum width,unknown,2021-07-14T17:42:48Z,2021-07-15T14:39:26+00:00,4,20.94,True,0,8,1,136,3,0,3,MERGED
10654,Clean up KeyChordSerialization,lhecker,2021-07-14T01:41:11Z,2021-07-14T21:22:24+00:00,6,19.69,True,326,205,6,610,2,5,7,MERGED
10653,Fix output stuttering using a ticket lock,lhecker,2021-07-14T00:58:56Z,2021-07-14T23:41:22+00:00,12,22.71,True,111,22,7,653,9,5,14,MERGED
10652,Add a KeyChordListener to the Settings UI,carlos-zamora,2021-07-13T23:31:43Z,2021-07-16T22:11:55+00:00,13,70.67,True,259,86,12,1751,3,10,13,MERGED
10651,Clamp the `focusTab` action to the number of available tabs,zadjii-msft,2021-07-13T20:38:22Z,2021-07-22T13:48:37+00:00,7,209.17,True,80,18,6,439,6,3,9,MERGED
10650,Fix a pair of TermControl dragging bugs,zadjii-msft,2021-07-13T17:36:34Z,2021-07-28T22:27:09+00:00,4,364.84,True,116,15,6,1017,5,1,6,MERGED
10648,"Add a setting for disabling rendering ""intense"" text as bold",zadjii-msft,2021-07-13T15:29:52Z,2021-07-19T21:24:16+00:00,3,149.91,False,57,2,15,524,2,2,4,CLOSED
10646,Upgrade check-spelling to v0.0.19,jsoref,2021-07-13T07:18:24Z,2021-07-13T16:21:44+00:00,4,9.06,True,24,18,6,1315,0,1,1,MERGED
10642,Fix mouse coordinates when viewport is scrolled,PankajBhojwani,2021-07-12T23:28:19Z,2021-07-20T21:39:55+00:00,13,190.19,True,96,1,2,218,6,5,11,MERGED
10640,Update Xaml Toolkit App Host to 6.1.3,DHowett,2021-07-12T21:46:01Z,2021-07-12T22:58:02+00:00,2,1.2,True,30,30,13,79,4,0,4,MERGED
10638,"Preliminary work to add Swap Panes functionality (GH Issues 1000, 4922)",Rosefield,2021-07-12T16:14:39Z,2021-07-22T12:53:03+00:00,17,236.64,True,1037,2,20,2054,9,13,22,MERGED
10621,Optimize hot path in textBufferCellIterator,skyline75489,2021-07-12T03:16:28Z,2021-07-27T15:09:57+00:00,11,371.89,True,114,10,3,660,10,3,13,MERGED
10620,Don't call flush when circling is triggered in VtRenderer,skyline75489,2021-07-12T02:32:47Z,2021-08-05T09:21:37+00:00,1,582.81,False,6,2,1,1121,5,0,5,CLOSED
10619,Encapsulate settings main frame to prevent overflow,mimvdb,2021-07-11T20:38:30Z,2021-07-12T21:50:11+00:00,2,25.19,True,3,2,1,460,6,0,6,MERGED
10618,Include profile nav menu items to consider for retaining position,mimvdb,2021-07-11T20:25:26Z,2021-07-12T18:44:40+00:00,3,22.32,True,6,8,1,905,10,0,10,MERGED
10615,Initial refactor of IRenderEngine interface,skyline75489,2021-07-11T10:00:50Z,2021-08-13T05:27:26+00:00,23,787.44,False,1241,1330,25,1684,4,11,15,CLOSED
10606,Specify sln file to use for razzle nuget restore,mimvdb,2021-07-10T10:14:17Z,2021-07-12T20:50:15+00:00,2,58.6,True,1,1,1,692,4,0,4,MERGED
10603,Use WinRT VirtualKeyModifiers instead of a custom enum,mimvdb,2021-07-09T23:02:16Z,2021-07-12T21:24:27+00:00,4,70.37,True,62,97,11,510,9,1,10,MERGED
10602,Update RIS to reset mouse mode and encoding,PankajBhojwani,2021-07-09T22:59:02Z,2021-07-12T18:50:05+00:00,10,67.85,True,8,0,2,322,3,2,5,MERGED
10601,Fix all fragments not loading when one is badly formed,PankajBhojwani,2021-07-09T17:24:28Z,2021-07-09T20:43:35+00:00,5,3.32,True,27,15,1,396,5,1,6,MERGED
10593,Enable /Zc:preprocessor,lhecker,2021-07-09T00:19:55Z,2021-07-13T23:00:11+00:00,8,118.67,True,337,628,28,321,4,14,18,MERGED
10591,#10497: Do not force the font on output codepage change,alabuzhev,2021-07-08T19:18:06Z,2021-07-08T21:10:35+00:00,3,1.87,True,0,21,1,835,5,0,5,MERGED
10589,Fix the cursor blink VT sequence being ignored,PankajBhojwani,2021-07-08T17:56:51Z,2021-07-09T18:45:16+00:00,8,24.81,True,10,1,1,113,4,1,5,MERGED
10588,Reintroduce the Defaults page and the Reset buttons,DHowett,2021-07-08T17:23:31Z,2021-07-09T22:03:42+00:00,16,28.67,True,116,46,15,2253,3,10,13,MERGED
10582,Delay load call SetThreadDescription to restore WPF renderer on Win7,miniksa,2021-07-07T23:58:21Z,2021-07-08T07:58:53+00:00,2,8.01,True,8,1,1,1163,3,0,3,MERGED
10581,Introduce feature flag for editable actions page,carlos-zamora,2021-07-07T22:49:56Z,2021-07-08T20:55:31+00:00,4,22.09,True,406,2,7,390,8,3,11,MERGED
10580,#10477: Handle things above U+FFFF in GDI renderer,alabuzhev,2021-07-07T21:08:00Z,2021-07-08T15:35:11+00:00,2,18.45,True,10,8,1,1583,2,0,2,MERGED
10569,Skip accessibility notifier and all event calculations when we're in PTY mode,miniksa,2021-07-06T22:31:13Z,2021-07-09T18:45:45+00:00,15,68.24,True,111,45,12,592,7,8,15,MERGED
10566,Use memcmp for TextAttribute & TextColor comparison,skyline75489,2021-07-06T10:32:19Z,2022-05-05T17:37:41+00:00,11,7279.09,True,29,37,5,876,41,5,46,MERGED
10559,Introduce a api-ms-win-core-synch-l1-2-0 shim for Windows 7,lhecker,2021-07-05T01:55:27Z,2021-07-07T16:48:29+00:00,15,62.88,True,320,12,6,434,5,7,12,MERGED
10550,Add the 'Add new' button to the Actions page,carlos-zamora,2021-07-02T21:47:39Z,2021-07-07T23:43:41+00:00,13,121.93,True,122,21,5,1554,3,6,9,MERGED
10549,Fix racy access to _tsfTryRedrawCanvas in TermControl,lhecker,2021-07-02T16:26:45Z,2021-07-06T21:59:44+00:00,4,101.55,True,65,75,2,990,5,1,6,MERGED
10546,Set working directory when invoked from shell extension,ianjoneill,2021-07-02T07:36:09Z,2021-07-09T18:53:52+00:00,5,179.3,True,4,3,1,501,10,1,11,MERGED
10544,[A11y] Initialize and copy _blockRange in UIA Clone,carlos-zamora,2021-07-01T23:59:11Z,2021-07-06T20:54:52+00:00,9,116.93,True,25,1,3,603,5,3,8,MERGED
10537,Don't notify a11y event when in ConPTY mode,skyline75489,2021-06-30T04:19:44Z,2021-07-06T21:15:07+00:00,4,160.92,True,6,0,1,64,11,0,11,MERGED
10535,Advice users to relaunch after changing the language,lhecker,2021-06-30T00:19:59Z,2021-06-30T22:31:57+00:00,2,22.2,True,1,1,1,140,1,0,1,MERGED
10533,Improve parser performance by reducing tracing overhead,lhecker,2021-06-29T22:22:36Z,2021-06-30T00:28:40+00:00,3,2.1,True,25,20,2,527,7,0,7,MERGED
10525,Allow users to set font features and font axes,PankajBhojwani,2021-06-28T21:47:06Z,2021-07-22T23:15:45+00:00,118,577.48,True,531,60,17,772,19,74,93,MERGED
10521,Add fast lookup path for DxFontInfo,skyline75489,2021-06-27T04:00:38Z,2021-07-09T20:19:21+00:00,22,304.31,True,30,53,3,85,9,10,19,MERGED
10518,doc/roadmap: add 1.9 Preview Release Blogpost Link,onerandomusername,2021-06-26T16:35:43Z,2021-06-28T15:36:15+00:00,2,47.01,True,1,1,1,581,0,0,0,MERGED
10516,[A11y] Treat last character as 'end of buffer',carlos-zamora,2021-06-25T23:38:47Z,2021-07-09T23:21:42+00:00,1,335.72,False,1290,153,19,809,5,1,6,CLOSED
10513,Introduce a basic ApplicationState class,lhecker,2021-06-25T15:43:06Z,2021-06-30T00:25:45+00:00,21,104.71,True,485,237,12,571,4,23,27,MERGED
10499,Update WindowExe.manifest,asklar,2021-06-23T07:16:55Z,2021-06-23T17:59:07+00:00,2,10.7,True,1,1,1,13,2,0,2,MERGED
10498,"Render SGR 1 (""intensity"") as bold in the DX engine",skyline75489,2021-06-23T00:52:44Z,2021-07-07T21:07:52+00:00,23,356.25,True,10,1,3,322,9,5,14,MERGED
10494,Replicate winrt::make<> changes in ScratchIslandApp SampleAppLib,BreeceW,2021-06-22T19:20:16Z,2021-06-23T03:21:07+00:00,2,8.01,True,4,12,1,112,3,0,3,MERGED
10492,Add an enum-compatible bitset class.,j4james,2021-06-22T19:04:19Z,2021-09-27T13:27:29+00:00,3,2322.39,True,305,0,6,909,10,0,10,MERGED
10489,Add Settings UI enum to json schema,WSLUser,2021-06-22T16:59:15Z,2021-06-22T22:05:00+00:00,4,5.1,True,5,3,1,309,0,1,1,MERGED
10478,Replace PolyTextOutW with ExtTextOutW,alabuzhev,2021-06-21T23:55:42Z,2021-06-22T18:41:18+00:00,2,18.76,True,7,2,1,741,14,0,14,MERGED
10471,Defer _run substr operation in StateMachine::ProcessString,skyline75489,2021-06-21T09:01:08Z,2021-06-29T22:47:27+00:00,24,205.77,True,47,15,2,145,17,9,26,MERGED
10465,Fix code-format and test invocation through PowerShell,ianjoneill,2021-06-20T07:36:23Z,2021-06-21T14:53:00+00:00,2,31.28,True,11,9,2,1031,2,0,2,MERGED
10457,Spec for font features and axes of variation,PankajBhojwani,2021-06-18T20:57:03Z,2021-07-09T21:01:04+00:00,15,504.07,True,107,0,2,103,6,7,13,MERGED
10455,Update Cascadia Code to 2106.17,DHowett,2021-06-18T18:40:21Z,2021-06-18T20:47:19+00:00,2,2.12,True,21,21,12,412,4,0,4,MERGED
10449,Fix startup race of resizing ConPTY,miniksa,2021-06-17T23:23:50Z,2021-06-22T19:23:16+00:00,2,115.99,True,42,65,4,940,1,0,1,MERGED
10447,Allow closing tabs by index,ianjoneill,2021-06-17T19:38:13Z,2021-06-25T19:22:52+00:00,6,191.74,True,162,43,10,872,12,5,17,MERGED
10446,Localize the shell extension's menu item,DHowett,2021-06-17T18:27:52Z,2021-06-17T21:49:56+00:00,3,3.37,True,30,6,3,590,4,1,5,MERGED
10434,Fix crash when unpackaged due to PrimaryLanguageOverride,lhecker,2021-06-15T22:19:27Z,2021-06-16T21:08:15+00:00,18,22.81,True,126,164,14,555,1,8,9,MERGED
10433,Group font options in the json into a single object,PankajBhojwani,2021-06-15T21:07:03Z,2021-07-01T17:08:46+00:00,19,380.03,True,319,39,13,778,6,13,19,MERGED
10431,Setup OneFuzz for CI,carlos-zamora,2021-06-15T18:29:30Z,2022-01-21T18:24:07+00:00,27,5279.91,True,293,10,14,552,10,29,39,MERGED
10426,Prefer FMT_COMPILE for string formatting in VtRenderer,skyline75489,2021-06-15T03:48:58Z,2021-06-22T15:39:16+00:00,29,179.84,True,35,112,5,226,23,8,31,MERGED
10424,doc: fix typo in TAEF.md,eltociear,2021-06-14T10:51:09Z,2021-06-14T17:06:01+00:00,2,6.25,True,1,1,1,90,1,0,1,MERGED
10423,Don't dispatch the Toggle Command Palette action to keep the just closed Command Palette closed.,kovdu,2021-06-14T07:28:59Z,2021-06-14T23:32:32+00:00,2,16.06,True,7,1,1,570,3,0,3,MERGED
10415,Persist inbox conhost; delegate control activities to it via a pipe,miniksa,2021-06-11T22:43:16Z,2021-06-16T19:23:38+00:00,27,116.67,True,561,39,24,4599,8,34,42,MERGED
10412,Fix edit button color in light theme,carlos-zamora,2021-06-11T20:38:06Z,2021-06-14T16:51:15+00:00,2,68.22,True,0,4,1,257,3,0,3,MERGED
10411,Force the execution policy on the til::feature powershell script,DHowett,2021-06-11T18:53:03Z,2021-06-11T20:14:18+00:00,2,1.35,True,1,1,1,124,2,0,2,MERGED
10403,"Introduce til/latch.h, til/mutex.h and til/throttled_func.h",lhecker,2021-06-10T21:35:17Z,2021-06-22T20:16:32+00:00,27,286.69,True,742,229,20,668,6,14,20,MERGED
10401,"Make sure caption controls ""dim out"" when window loses NC focus",AnuthaDev,2021-06-10T21:00:20Z,2021-07-21T19:00:57+00:00,2,982.01,False,81,1,8,880,5,1,6,CLOSED
10394,Throttle cursor redrawing in outputStream.cpp,skyline75489,2021-06-10T12:10:30Z,2021-06-28T21:08:22+00:00,7,440.96,True,10,2,1,237,4,3,7,MERGED
10392,Cancel the preview of nested commands when moving back on the stack.,kovdu,2021-06-10T07:51:57Z,2021-06-14T17:20:30+00:00,2,105.48,True,9,0,1,1616,8,0,8,MERGED
10390,Fix SUI race conditions when reloading settings,lhecker,2021-06-10T00:43:53Z,2021-06-11T00:38:10+00:00,5,23.9,True,93,125,6,499,4,4,8,MERGED
10389,Activate window only (no toggle) when inbound connection arrives,miniksa,2021-06-09T22:41:49Z,2021-06-10T06:42:11+00:00,2,8.01,True,1,0,1,542,4,0,4,MERGED
10384,profile.schema: add missing actions and commands keys,LuanVSO,2021-06-09T19:21:24Z,2021-06-10T18:10:49+00:00,13,22.82,True,96,5,1,610,1,14,15,MERGED
10383,Spec for font configuration objects,PankajBhojwani,2021-06-09T18:41:32Z,2021-06-11T15:46:04+00:00,17,45.08,False,102,0,1,368,3,7,10,CLOSED
10373,Bugfix: serialize iterable commands,carlos-zamora,2021-06-09T00:26:41Z,2021-06-10T18:25:28+00:00,4,41.98,True,77,26,5,546,5,1,6,MERGED
10370,Restore embedded manifests to say 18362,miniksa,2021-06-08T23:00:45Z,2021-06-09T16:23:27+00:00,2,17.38,True,13,4,3,876,5,0,5,MERGED
10369,Add percentage sign to opacity slider values,marcelwgn,2021-06-08T22:34:16Z,2021-06-09T22:45:06+00:00,7,24.18,True,60,4,6,219,4,3,7,MERGED
10368,Add Minimize to Tray and Tray Icon,leonMSFT,2021-06-08T19:22:39Z,2021-08-12T19:54:39+00:00,47,1560.53,True,773,85,34,1036,20,58,78,MERGED
10367,Restore helix runs by passing parameters,miniksa,2021-06-08T17:04:23Z,2021-06-08T18:57:30+00:00,2,1.89,True,2,0,1,449,2,0,2,MERGED
10361,Add support for branch- and branding-based feature flagging,DHowett,2021-06-08T03:53:01Z,2021-06-10T23:09:52+00:00,10,67.28,True,484,0,8,2667,5,5,10,MERGED
10357,Lock for writing in `ControlCore::SetBackgroundOpacity`,miniksa,2021-06-07T22:14:58Z,2021-06-09T16:55:42+00:00,2,42.68,True,1,0,1,606,6,0,6,MERGED
10341,Ensure equality when hashing default args and no args in actions,carlos-zamora,2021-06-04T22:57:28Z,2021-06-16T22:43:29+00:00,11,287.77,True,39,2,3,994,6,5,11,MERGED
10336,Expose Text Attributes to UI Automation,carlos-zamora,2021-06-04T18:48:54Z,2021-07-09T23:21:35+00:00,44,844.54,True,866,46,17,3035,12,50,62,MERGED
10335,Fix some places where we weren't using winrt::make,marcelwgn,2021-06-04T18:44:48Z,2021-06-04T22:22:07+00:00,20,3.62,True,7,15,3,100,3,7,10,MERGED
10326,Remove CONSOLE_API_MSG::UpdateUserBufferPointers hack,lhecker,2021-06-04T00:02:02Z,2021-06-14T19:52:40+00:00,8,259.84,True,80,84,4,605,6,3,9,MERGED
10318,DOC: Fix camelCase (or capitalization),ayushman17,2021-06-03T17:43:15Z,2021-06-04T23:06:10+00:00,4,29.38,True,5,5,2,252,3,1,4,MERGED
10317,Allow creating and editing unfocused appearances in the SUI,PankajBhojwani,2021-06-03T17:33:28Z,2021-07-13T23:33:23+00:00,16,966.0,True,258,4,13,642,5,12,17,MERGED
10309,Add a language switcher using PrimaryLanguageOverride,lhecker,2021-06-02T00:52:26Z,2021-06-10T23:24:22+00:00,20,214.53,True,278,62,20,1057,11,21,32,MERGED
10307,Cleanup from bell flash PR,PankajBhojwani,2021-06-01T18:34:24Z,2021-06-02T18:49:33+00:00,4,24.25,True,26,17,2,227,1,1,2,MERGED
10297,Replace feedback button with command palette button in dropdown,KnapSac,2021-05-31T12:38:27Z,2021-06-10T18:08:48+00:00,9,245.51,True,25,19,3,100,4,4,8,MERGED
10280,Update profiles schema to draft 2020-12,ealap,2021-05-30T03:01:10Z,2021-06-04T23:41:44+00:00,2,140.68,True,1,1,1,453,4,0,4,MERGED
10268,Make the xaml formatting script work outside the root directory,j4james,2021-05-29T00:51:14Z,2021-06-02T18:29:47+00:00,5,113.64,True,4,4,1,1219,1,0,1,MERGED
10264,Enable winrt::make<> detection,DHowett,2021-05-28T19:58:33Z,2021-06-01T22:33:53+00:00,6,98.59,True,2,9,3,305,1,1,2,MERGED
10263,Ignore closeOnExit when a conn. moves from Connecting to Failed,DHowett,2021-05-28T18:10:49Z,2021-05-28T19:22:43+00:00,3,1.2,True,14,0,3,890,2,1,3,MERGED
10261,Switch FAIL_FAST to LOG for starting inbound connection server on monarch startup,miniksa,2021-05-28T17:14:05Z,2021-05-28T20:57:48+00:00,2,3.73,True,28,6,3,745,5,0,5,MERGED
