number,title,author,createdAt,closedOrMergedAt,reviewsCount,hoursOpen
8,add windows compatibility,Atrox,2019-01-16T12:59:46Z,2019-01-16T17:53:50+00:00,1,4.9
15,Go 1.11.4+ and Docker 18.09 pre-reqs,SvenDowideit,2019-01-21T08:35:52Z,2019-01-22T15:33:55+00:00,5,30.97
30,--watch,jnewland,2019-02-10T02:40:38Z,2019-02-13T04:30:03+00:00,1,73.82
34,Regex tweaks,sosedoff,2019-02-14T20:50:27Z,2019-02-15T00:47:00+00:00,1,3.94
35,Detect workflow event type,sosedoff,2019-02-15T16:38:07Z,2019-02-17T01:01:37+00:00,1,32.39
38,Add flag to skip pulling images already present,marccampbell,2019-02-18T05:44:27Z,2019-02-19T14:29:27+00:00,1,32.75
46,Handle docker image build failures,sosedoff,2019-03-02T03:45:57Z,2019-03-02T15:53:25+00:00,1,12.12
48,"Ignore error, vet failure",marccampbell,2019-03-10T02:41:21Z,2019-03-10T15:13:15+00:00,1,12.53
55,s/pull-request/pull_request,curiouslychase,2019-04-02T18:12:26Z,2019-04-02T21:26:26+00:00,1,3.23
56,Render correct graph for non-default events,aidansteele,2019-04-08T11:03:53Z,2019-04-08T15:16:04+00:00,1,4.2
57,Use docker’s stdcopy to ensure we don’t emit garbage bytes to stdout,aidansteele,2019-04-09T11:03:32Z,2019-05-23T06:10:06+00:00,1,1051.11
65,"explain how to ""skip"" some actions using filter",maxheld83,2019-05-20T17:49:24Z,2019-05-23T06:11:25+00:00,1,60.37
68,feat: support branches as GITHUB_REF,caarlos0,2019-05-23T03:06:43Z,2019-05-23T06:15:58+00:00,1,3.15
77,add arch linux installation instructions,mainrs,2019-09-04T12:46:59Z,2019-09-05T01:51:31+00:00,1,13.08
78,doc: remove unnecessary brew command,qoomon,2019-09-09T15:06:01Z,2019-09-16T21:35:52+00:00,1,174.5
118,fix #117 - handle whitespace in actrc secrets,Steffen911,2020-03-02T11:54:06Z,2020-03-02T16:11:47+00:00,1,4.29
147,docs(README): add --env-file flag,davidlj95,2020-03-12T13:58:17Z,2020-03-12T16:54:05+00:00,1,2.93
152,Include install instructions for nix,ysndr,2020-03-13T11:53:36Z,2020-03-13T14:55:21+00:00,1,3.03
154,Add support for step.working-directory (closes #149),aidansteele,2020-03-13T23:36:53Z,2020-03-14T07:00:37+00:00,1,7.4
155,Add support for runs-on array form (closes #146),aidansteele,2020-03-14T07:45:58Z,2020-03-16T21:58:11+00:00,1,62.2
157,Use “push” event workflow(s) if defined (closes #156),aidansteele,2020-03-15T23:30:13Z,2020-03-16T05:29:13+00:00,1,5.98
163,Improved gitignore handling,aidansteele,2020-03-18T05:36:06Z,2020-03-18T13:55:40+00:00,1,8.33
164,Use go-git for looking up repository details,rsotnychenko,2020-03-18T11:25:18Z,2020-07-24T00:17:31+00:00,2,3060.87
180,"Windows+Docker path reference fixes, mostly around the not relying on filepath.Separator",syntaqx,2020-04-01T09:02:53Z,2020-06-29T22:50:00+00:00,2,2149.79
183,Add install instructions from Scoop,Tadaboody,2020-04-02T07:06:15Z,2020-04-16T23:22:48+00:00,1,352.28
184,feat: load every environment from --env-file to workflow,jonyhy96,2020-04-03T11:37:23Z,2020-04-17T17:04:40+00:00,1,341.45
190,Remove length constraint for container names,albertofem,2020-04-13T17:52:28Z,2020-04-16T23:05:01+00:00,1,77.21
194,Replaces the deprecated go-git import path with the new one.,mcuadros,2020-04-16T09:59:12Z,2020-04-16T23:24:31+00:00,1,13.42
198,disable gitignore for actions,alanb-sony,2020-04-17T07:21:41Z,2021-01-15T00:58:31+00:00,2,6545.61
201,Use env variables in Action.Runs.Env,whoan,2020-04-19T04:09:03Z,2020-04-19T18:29:35+00:00,1,14.34
207,add support for ssh:// remote DOCKER_HOST,SvenDowideit,2020-04-24T07:31:21Z,2020-05-04T04:15:43+00:00,1,236.74
221,Add default error case for Runs.Using,mheap,2020-05-03T20:35:12Z,2020-05-04T03:55:21+00:00,1,7.34
222,Normalise Runs.Using to lowercase,mheap,2020-05-03T20:38:22Z,2020-05-04T03:59:14+00:00,1,7.35
223,Implement UnmarshalYAML for ActionRunsUsing,mheap,2020-05-04T09:36:23Z,2020-05-04T12:40:12+00:00,1,3.06
225,Make envs available in if conditionals,torbjornvatn,2020-05-04T13:15:08Z,2020-05-04T19:18:14+00:00,1,6.05
229,Add support for changing the GITHUB_ACTOR,mheap,2020-05-09T12:15:58Z,2020-05-12T07:14:57+00:00,1,66.98
231,Mask secrets in job output,mheap,2020-05-11T12:33:01Z,2020-05-13T22:22:32+00:00,1,57.83
238,Grammar,jsoref,2020-05-15T13:52:22Z,2020-05-15T19:30:50+00:00,1,5.64
240,Spelling,jsoref,2020-05-17T10:25:52Z,2020-05-18T16:53:43+00:00,1,30.46
241,Markup for runners,jsoref,2020-05-17T11:40:16Z,2020-05-18T16:55:00+00:00,1,29.25
243,Fix using: node12 handling,jsoref,2020-05-17T12:45:57Z,2020-05-18T21:31:10+00:00,2,32.75
252,Update brand name for macOS,jsoref,2020-05-20T14:27:39Z,2020-05-20T15:37:30+00:00,1,1.16
256,Added documentation for module not found issue.,gjvpaet,2020-05-25T04:20:00Z,2020-05-26T16:12:18+00:00,3,35.87
259,Change -W command to accept a single file,arbourd,2020-05-27T03:37:02Z,2020-05-27T14:36:00+00:00,1,10.98
267,Pull latest changes from ref using cached repo,mheap,2020-06-06T17:07:10Z,2020-06-09T14:43:27+00:00,1,69.6
274,Update unit test command to `make test`,rajington,2020-06-12T10:13:59Z,2020-06-12T22:31:38+00:00,1,12.29
283,Container volumes sometimes reused even if configured not to,N2D4,2020-06-18T13:50:54Z,2020-06-18T15:21:56+00:00,1,1.52
287,Rewrite contexts before evaluating them,badouralix,2020-06-21T18:52:49Z,2020-06-24T14:08:45+00:00,1,67.27
288,remove .gitignore before docker cp,o0Ignition0o,2020-06-21T19:38:44Z,2020-06-23T18:57:25+00:00,1,47.31
290,Properly pass format argument to avoid MISSING,jsoref,2020-06-24T07:51:05Z,2020-06-24T14:05:06+00:00,1,6.23
293,Support running commands in repositories without action.yaml,jsoref,2020-06-25T03:22:36Z,2021-03-30T19:26:25+00:00,12,6688.06
304,Fixes comments on StepType enum consts,amitmahbubani,2020-07-09T23:02:51Z,2020-07-13T16:39:23+00:00,1,89.61
308,Support `PREFIX` environment variable,vladimyr,2020-07-18T19:12:07Z,2020-07-20T14:33:30+00:00,1,43.36
309,use t.Cleanup and prefer assert.NoError over .Nil,trashhalo,2020-07-18T19:50:03Z,2020-07-20T14:35:44+00:00,1,42.76
313,fix: add default values in vmInput,denysvitali,2020-07-20T19:20:19Z,2020-07-21T13:50:15+00:00,1,18.5
314,Document `secret-file` in README and add example,Strajk,2020-07-21T08:11:31Z,2020-07-21T13:51:34+00:00,1,5.67
318,Added PHONY targets to Makefile,engnadeau,2020-07-26T13:05:46Z,2020-07-26T23:36:42+00:00,1,10.52
320,Added docker pull instructions for building from source,engnadeau,2020-07-26T15:25:45Z,2020-07-26T23:35:44+00:00,1,8.17
326,Fix to fail GitHub Actions test,whywaita,2020-08-01T20:32:10Z,2020-08-02T02:05:25+00:00,1,5.55
327,add privileged mode,whywaita,2020-08-01T20:48:21Z,2020-08-03T04:53:59+00:00,1,32.09
334,fix file permission for non root user docker image,watiko,2020-08-08T13:52:08Z,2020-08-08T20:31:27+00:00,1,6.66
343,Support setting shell via defaults.run,tokenrove,2020-08-21T20:49:31Z,2020-08-28T18:52:26+00:00,1,166.05
347,feat: docker 19.03.12,greut,2020-08-26T10:25:19Z,2020-08-28T18:45:04+00:00,1,56.33
348,chore: upgrade docker v19.03.12,greut,2020-08-29T09:28:07Z,2020-08-30T05:55:23+00:00,1,20.45
349,Special case handling of empty workflow files for user experience,cdb,2020-08-31T20:34:32Z,2020-08-31T21:50:02+00:00,1,1.26
352,feat: add fromJSON support,theowenyoung,2020-09-01T17:13:06Z,2020-09-01T20:55:30+00:00,1,3.71
354,Set the default branch inside the event data,tomlazar,2020-09-01T21:21:48Z,2020-09-02T14:56:45+00:00,1,17.58
360,Fix copyDir to normalize file paths in tar archive,barweiss,2020-09-07T12:59:40Z,2020-09-15T14:00:15+00:00,1,193.01
367,Add macOS install instructions,yallen011,2020-09-15T22:45:30Z,2021-01-31T00:30:40+00:00,1,3289.75
369,"feat: support custom GITHUB_RUN_ID, GITHUB_RUN_NUMBER",theowenyoung,2020-09-19T12:58:26Z,2020-09-22T21:13:30+00:00,1,80.25
371,Fix path for local node12 actions,jromero,2020-09-25T17:05:20Z,2020-09-29T20:39:45+00:00,1,99.57
372,Add CI=true environment variable,leonardodino,2020-09-27T01:05:37Z,2020-09-28T15:22:42+00:00,1,38.28
381,Remove confusing message about symlinks,lyleunderwood,2020-10-03T00:07:53Z,2020-10-06T17:02:38+00:00,1,88.91
382,Simpler list view,lshamis,2020-10-06T00:02:32Z,2020-10-12T17:26:23+00:00,1,161.4
383,[Add] More logging for default push action,TechIsCool,2020-10-07T01:19:24Z,2020-10-09T05:28:02+00:00,1,52.14
386,When running on Windows the correct path separator must be used,taliesins,2020-10-08T09:23:56Z,2020-10-09T05:30:50+00:00,1,20.11
395,Docs: Add --secret-file info in Secrets section,jmmendivil,2020-10-17T02:41:32Z,2020-10-17T14:38:54+00:00,1,11.96
399,Update README.md,raethlein,2020-10-21T11:41:29Z,2020-10-21T15:09:40+00:00,1,3.47
404,fix: outputs espace,theowenyoung,2020-10-30T23:09:47Z,2020-11-02T13:40:47+00:00,2,62.52
406,Change handling of ExtraPath,winksaville,2020-11-02T19:38:01Z,2020-11-02T21:56:20+00:00,1,2.31
411,Add variadic version of hashFiles,Bigpet,2020-11-09T16:00:39Z,2020-11-09T17:08:57+00:00,1,1.14
412,envs in if: - take 2,torbjornvatn,2020-11-09T20:29:54Z,2020-11-12T16:15:10+00:00,2,67.75
413,Adds ability to use container images from matrices.,SteffenSeckler,2020-11-10T17:01:11Z,2020-11-10T22:55:29+00:00,1,5.91
415,Fixes include when using matrix and strategy build.,SteffenSeckler,2020-11-11T12:04:03Z,2020-12-08T18:13:08+00:00,3,654.15
417,Act env,torbjornvatn,2020-11-12T09:16:28Z,2020-11-18T15:14:35+00:00,1,149.97
423,Change setupEnv to return an ExpressionEvaluator,winksaville,2020-11-16T21:43:55Z,2021-01-13T00:02:54+00:00,3,1370.32
424,EvalBool and Interpolation fixes,torbjornvatn,2020-11-16T22:46:26Z,2020-11-17T17:31:06+00:00,1,18.74
426,GitHub env file support,torbjornvatn,2020-11-20T00:43:36Z,2021-01-12T06:39:44+00:00,1,1277.94
429,Extract runTestJobFile from TestRunEvent,winksaville,2020-11-22T20:15:48Z,2020-11-30T05:45:12+00:00,1,177.49
434,Fix tests if there are hooks generated by templates,lufia,2020-11-30T08:01:37Z,2021-01-12T06:35:58+00:00,1,1030.57
459,Warns that not Apple Silicon compatible.,bencooper222,2021-01-03T02:51:08Z,2021-01-08T08:26:21+00:00,1,125.59
460,Add option to disable hiding of secrets,catthehacker,2021-01-08T01:32:45Z,2021-01-12T06:28:46+00:00,1,100.93
461,Fix slashes when running on Windows,catthehacker,2021-01-08T01:37:36Z,2021-01-12T06:41:36+00:00,1,101.07
462,Use static initial PATH,catthehacker,2021-01-08T01:43:55Z,2021-01-12T06:27:17+00:00,1,100.72
463,Add Ubuntu 20.04 to supported platforms,catthehacker,2021-01-08T01:51:04Z,2021-01-12T06:22:54+00:00,1,100.53
470,Make all secrets case insensitive by formatting them to uppercase,catthehacker,2021-01-12T15:00:03Z,2021-01-12T17:54:53+00:00,1,2.91
471,"Fix ""Unable to checkout"" error",lufia,2021-01-14T08:00:14Z,2021-01-15T05:24:18+00:00,1,21.4
472,Format sources with gofmt,lufia,2021-01-14T08:04:39Z,2021-01-15T05:37:39+00:00,1,21.55
474,Add `--env` flag to pass environment vars without file,catthehacker,2021-01-14T16:56:44Z,2021-01-15T05:26:02+00:00,1,12.49
476,Update parts of repo,catthehacker,2021-01-14T21:44:50Z,2021-01-15T05:21:45+00:00,1,7.62
477,Fix/a small confusion in readme,ibraheeamm,2021-01-14T22:58:50Z,2021-01-15T05:20:17+00:00,1,6.36
478,Make stale bot action less aggressive,catthehacker,2021-01-15T04:07:31Z,2021-01-15T05:19:25+00:00,1,1.2
483,Add survey during first run for a default image,catthehacker,2021-01-17T19:00:29Z,2021-01-19T14:30:18+00:00,1,43.5
485,Report error when `if` expression is invalid,edtan,2021-01-18T00:11:05Z,2021-01-18T19:44:28+00:00,1,19.56
486,Add autodetect event flag,catthehacker,2021-01-18T00:29:09Z,2021-01-18T19:42:56+00:00,1,19.23
488,Load .secrets file as default,catthehacker,2021-01-19T05:20:34Z,2021-01-19T14:31:47+00:00,1,9.19
494,Print error when runs-on key is not defined,catthehacker,2021-01-20T22:35:59Z,2021-01-21T14:02:49+00:00,1,15.45
495,Stop current execution if there is the invalid syntax in the workflow,lufia,2021-01-21T12:22:47Z,2021-01-21T14:00:34+00:00,1,1.63
500,Throw an error if the steps has a invalid uses directive,lufia,2021-01-22T08:54:34Z,2021-01-23T16:07:29+00:00,2,31.22
502,Shouldn't rewrite dot in a string to index syntax,lufia,2021-01-23T18:15:23Z,2021-02-08T17:14:13+00:00,1,382.98
503,Fix Cartesian product to return empty set if empty set is given,edtan,2021-01-23T19:09:26Z,2021-01-23T22:55:55+00:00,1,3.77
508,"fix: --version, --help do not need check platform config",theowenyoung,2021-01-29T08:28:37Z,2021-01-29T14:40:14+00:00,1,6.19
512,Add GitHub issue templates,catthehacker,2021-01-31T02:46:27Z,2021-02-08T17:15:52+00:00,1,206.49
514,Add support for composite actions,mdelillo,2021-02-02T22:17:41Z,2021-04-02T20:40:45+00:00,3,1414.38
515,Fix choco Dockerfile,catthehacker,2021-02-03T09:44:59Z,2021-02-03T19:12:15+00:00,1,9.45
523,Update `README.md`/`cmd/root.go` with additional information,catthehacker,2021-02-08T14:21:50Z,2021-02-08T17:12:58+00:00,1,2.85
524,Update Docker images,catthehacker,2021-02-08T18:58:27Z,2021-02-23T17:49:25+00:00,1,358.85
525,Add option to run custom architecture (container platform),catthehacker,2021-02-08T21:12:10Z,2021-03-29T04:08:41+00:00,3,1158.94
529,Removed pipefail from bash shell execution to match GitHub Actions,andrewgee,2021-02-12T14:50:02Z,2021-02-12T16:28:27+00:00,1,1.64
530,Fixed `reference not found` error when using commit hash.,sinozu,2021-02-16T13:46:59Z,2021-02-23T17:50:28+00:00,2,172.06
531,Fix indent with gofmt,sinozu,2021-02-16T13:53:19Z,2021-02-17T19:48:00+00:00,1,29.91
533,Add --userns flag to support Docker daemon that enables user namespace,hibariya,2021-02-16T21:12:04Z,2021-02-27T16:31:25+00:00,1,259.32
537,Add option to allow files/directories in `.gitignore` to be copied to container,catthehacker,2021-02-19T14:40:58Z,2021-05-03T14:37:21+00:00,5,1751.94
539,properly parse arguments to Docker container steps,kdomanski,2021-02-21T13:23:20Z,2021-02-23T17:47:07+00:00,1,52.4
541,Fix link to issue #97 in README.md,jonico,2021-02-22T15:45:29Z,2021-02-23T17:45:28+00:00,1,26.0
544,#534 feat: step continues when continue-on-error is ture,horitaku1124,2021-02-24T00:48:55Z,2021-02-25T16:55:07+00:00,4,40.1
552,Add more context to MODULE_NOT_FOUND errors and how to fix it,alfredodeza,2021-03-05T16:56:23Z,2021-03-13T00:15:27+00:00,1,175.32
557,Set step results to map more closely to reality,pezholio,2021-03-08T17:08:40Z,2021-05-19T00:05:43+00:00,1,1710.95
560,Update test workflows and improve `expression_test.go`/`run_context_test.go`,catthehacker,2021-03-11T17:36:05Z,2021-03-13T00:25:11+00:00,1,30.82
562,Fix tests on Windows,catthehacker,2021-03-12T08:28:34Z,2021-03-13T00:23:03+00:00,1,15.91
563,Add code testing on MacOS,catthehacker,2021-03-12T08:36:18Z,2021-03-29T14:55:52+00:00,2,414.33
566,$GITHUB_PATH support,torbjornvatn,2021-03-15T20:13:32Z,2021-05-06T13:30:12+00:00,20,1241.28
567,Use project dir instead of /github/workspace,rockandska,2021-03-15T21:37:56Z,2021-03-29T04:32:46+00:00,1,318.91
570,Invoke login shells to source `/etc/environment`,catthehacker,2021-03-17T15:48:50Z,2021-03-29T04:35:02+00:00,1,276.77
571,Add `ImageOS` env var based on running platform,catthehacker,2021-03-17T17:11:23Z,2021-03-18T00:14:08+00:00,1,7.05
574,CI: Add snapshot artifacts to PR builds,JustinGrote,2021-03-23T17:07:39Z,2021-03-29T04:38:28+00:00,1,131.51
575,Update Shell Tasks to match ScriptHandlerHelpers,JustinGrote,2021-03-23T23:33:46Z,2021-03-29T17:06:51+00:00,2,137.55
577,Fix platforms during initial setup,catthehacker,2021-03-24T16:58:52Z,2021-03-29T14:58:01+00:00,1,117.99
578,fix: pass `sc.Env` through `common.Logger` to hide secrets,catthehacker,2021-03-24T19:16:21Z,2021-03-29T04:45:07+00:00,1,105.48
579,fix: hardcode `ubuntu-latest` for `ImageOS` envvar,catthehacker,2021-03-24T19:27:48Z,2021-03-29T04:46:09+00:00,1,105.31
580,fix: update `ubuntu-latest` to point to `ubuntu-20.04`,catthehacker,2021-03-24T19:41:53Z,2021-03-29T04:47:07+00:00,1,105.09
591,use container image platform only on docker 1.41+,jaypipes,2021-03-30T12:49:54Z,2021-03-30T17:10:42+00:00,2,4.35
595,Clean the repository cache if it is in incomplete state,lufia,2021-04-02T04:33:57Z,2021-04-06T13:43:02+00:00,2,105.15
596,Fail workflow if the job name is invalid,catthehacker,2021-04-02T10:30:20Z,2021-04-02T14:01:46+00:00,1,3.52
600,Refactor `.actrc` locations and default image survey,catthehacker,2021-04-03T16:03:51Z,2021-04-05T15:51:14+00:00,1,47.79
604,Add various GitHub environment variables,jsoref,2021-04-04T05:39:56Z,2021-05-06T20:02:30+00:00,20,782.38
605,GitHub Event Path #542,jsoref,2021-04-04T08:57:53Z,2021-05-03T15:02:27+00:00,1,702.08
606,Handle tagless versions,jsoref,2021-04-04T15:30:27Z,2021-04-05T15:53:06+00:00,1,24.38
608,Composite action,jsoref,2021-04-04T17:16:49Z,2021-05-03T21:57:46+00:00,1,700.68
616,Update README.md: Updated note about Apple Silicon,Freyja-Folkvangr,2021-04-13T00:22:39Z,2021-04-22T18:22:28+00:00,1,234.0
619,fix: rework container architecture flag,catthehacker,2021-04-15T13:16:00Z,2021-05-02T15:15:13+00:00,1,409.99
620,feat: Don't push `pkg/runner/act/` where actions cache is stored,catthehacker,2021-04-15T13:17:06Z,2021-05-03T14:54:51+00:00,1,433.63
624,Add nektos/act to awesome-runner list,jonico,2021-04-18T00:44:36Z,2021-04-18T16:53:54+00:00,2,16.16
628,Fixes #598,Renstrom,2021-04-22T21:54:00Z,2021-05-05T20:04:03+00:00,7,310.17
629,Add `needs` job output,mtps,2021-04-23T00:11:28Z,2021-07-01T15:20:21+00:00,6,1671.15
630,fix: update readme with more relevant/updated information,catthehacker,2021-04-23T00:13:57Z,2021-05-03T14:41:31+00:00,1,254.46
633,Prefer go-git to find the reference name,snazy,2021-04-23T19:42:19Z,2021-05-03T14:32:01+00:00,2,234.83
635,Separate Container Workdir from host Workdir,JustinGrote,2021-04-24T23:35:13Z,2021-05-04T21:50:35+00:00,19,238.26
637,Fixes Issue #597,Renstrom,2021-04-25T14:35:14Z,2021-05-03T16:51:49+00:00,3,194.28
638,Draft: Adds services capabilities,Markcial,2021-04-26T10:05:30Z,2021-06-20T00:05:10+00:00,7,1309.99
643,feat: Speeding up workflows,catthehacker,2021-04-28T16:18:48Z,2021-05-02T15:13:31+00:00,1,94.91
648,Recursively scan for workflows,catthehacker,2021-05-01T18:50:39Z,2021-05-03T14:57:25+00:00,1,44.11
658,GitHub Enterprise support,ZauberNerd,2021-05-04T17:11:45Z,2021-05-05T16:42:34+00:00,2,23.51
660,Remove pwsh -login and add Pwsh test,JustinGrote,2021-05-04T23:00:09Z,2021-05-05T05:57:33+00:00,7,6.96
665,Add custom docker registry authentication,KnisterPeter,2021-05-05T14:41:52Z,2021-05-05T16:37:18+00:00,6,1.92
668,fix: hide masked value,KnisterPeter,2021-05-06T11:01:44Z,2021-05-15T21:11:16+00:00,2,226.16
670,Write git clone progress only if terminal is a TTY,KnisterPeter,2021-05-06T11:21:46Z,2021-05-06T13:55:23+00:00,2,2.56
672,Add install instructions for `go`,catthehacker,2021-05-06T12:37:23Z,2021-05-06T13:43:50+00:00,1,1.11
674,Replace `gopass` lib with `golang.org/x/term`,catthehacker,2021-05-06T17:08:23Z,2021-05-06T20:13:15+00:00,1,3.08
675,fix: remove Windows issue from `README.md`,catthehacker,2021-05-06T17:12:22Z,2021-05-06T20:16:24+00:00,1,3.07
677,Asset server implementation,KnisterPeter,2021-05-07T14:47:05Z,2021-11-10T17:57:23+00:00,6,4491.17
679,"Refactor `git` to add more errors, tests and specific GitHub Actions error",catthehacker,2021-05-08T01:25:09Z,2021-05-08T03:29:03+00:00,1,2.06
680,Hotfix: Skip Checkout Regression,JustinGrote,2021-05-08T16:05:28Z,2021-05-10T15:12:57+00:00,4,47.12
681,Test fixups for Windows/Forks,JustinGrote,2021-05-10T23:21:51Z,2021-06-10T18:27:35+00:00,2,739.1
685,Fix typo,koppor,2021-05-16T21:06:54Z,2021-05-17T01:09:11+00:00,2,4.04
686,Add hint on ${{ github.token }},koppor,2021-05-16T21:13:53Z,2021-05-17T01:02:40+00:00,2,3.81
687,fix: use auth when fetching (same as with cloning),KnisterPeter,2021-05-17T10:10:00Z,2021-05-18T06:25:08+00:00,1,20.25
688,refactor: remove `gotest.tools`,catthehacker,2021-05-17T22:48:44Z,2021-05-18T06:14:50+00:00,1,7.43
690,Fix: GITHUB_PATH should prepend,jsoref,2021-05-18T07:07:26Z,2021-05-18T13:22:40+00:00,2,6.25
691,Have List suggest -W for duplicate jobs,jsoref,2021-05-18T07:52:37Z,2021-05-20T14:12:11+00:00,2,54.33
698,feat: add option for custom socket path,catthehacker,2021-05-22T18:47:41Z,2021-05-23T14:43:10+00:00,3,19.92
699,Add `arm64`/`arm` and capture all snapshots,catthehacker,2021-05-22T19:40:17Z,2021-05-23T15:32:56+00:00,1,19.88
700,Switch to `interface{}` instead of `map[string]...`,catthehacker,2021-05-23T00:27:34Z,2021-06-06T14:53:19+00:00,1,350.43
701,Move actions path outside of workdir,catthehacker,2021-05-23T04:02:52Z,2021-05-24T17:09:04+00:00,1,37.1
702,fix: avoid race condition by not running exec/start twice,ZauberNerd,2021-05-23T15:43:25Z,2021-05-25T12:35:53+00:00,4,44.87
712,"Refactor local, composite actions and run steps",ChristopherHX,2021-05-29T19:44:01Z,2021-06-10T15:28:23+00:00,2,283.74
714,Support container removal at exit. Fixes #694,jbenden,2021-06-01T16:50:35Z,2021-06-10T15:09:05+00:00,2,214.31
716,Add support for container kernel capabilities,jbenden,2021-06-01T22:12:06Z,2021-06-04T16:07:00+00:00,2,65.92
719,Read local actions from docker container,ChristopherHX,2021-06-03T14:10:46Z,2021-08-03T17:39:56+00:00,2,1467.49
722,fix: update issue template,catthehacker,2021-06-04T06:13:43Z,2021-06-04T20:16:02+00:00,1,14.04
723,"Update images, fix extrapath",catthehacker,2021-06-05T16:00:05Z,2021-06-10T23:12:06+00:00,1,127.2
725,fix: don't replace empty secrets,catthehacker,2021-06-07T09:25:42Z,2021-06-07T13:54:12+00:00,2,4.47
726,fix: wrong perms,catthehacker,2021-06-07T15:48:41Z,2021-06-09T23:08:40+00:00,1,55.33
743,fix: warn Apple M1 (arm64) users,catthehacker,2021-06-23T15:29:12Z,2021-06-23T18:09:28+00:00,2,2.67
745,Improve typography,mingww64,2021-06-26T12:28:02Z,2021-07-28T07:03:18+00:00,1,762.59
746,Fix url typo in README.md,djbender,2021-07-01T16:07:32Z,2021-07-14T14:40:10+00:00,2,310.54
749,Add docker context workaround to readme,davetapley,2021-07-07T05:21:24Z,2021-07-07T18:41:23+00:00,4,13.33
752,"Fix format function {{, }} are escapes",ChristopherHX,2021-07-16T18:22:54Z,2021-08-09T15:19:10+00:00,2,572.94
753,Fix defaults (composite),ChristopherHX,2021-07-16T18:26:40Z,2021-07-21T13:50:44+00:00,2,115.4
761,Fix `ImageOS` format,bryannaegele,2021-07-25T23:12:37Z,2021-08-01T15:39:39+00:00,2,160.45
762,README: add MacPorts info,herbygillot,2021-07-26T02:17:00Z,2021-08-01T15:29:13+00:00,3,157.2
763,"Simplify Matrix decode, add defaults for fail-fast and max-parallel, add test",catthehacker,2021-07-26T21:35:39Z,2021-08-09T15:35:05+00:00,2,329.99
766,"Update docs, file formatting and docker images",catthehacker,2021-08-08T02:36:44Z,2021-08-09T16:07:26+00:00,1,37.51
767,Fix docker: invalid reference format,ChristopherHX,2021-08-08T10:18:42Z,2021-08-09T18:16:31+00:00,3,31.96
768,Cache dockerhub images from linux for macOS,ChristopherHX,2021-08-08T10:52:04Z,2021-08-31T00:01:30+00:00,3,541.16
771,Add reading environment from Docker image,catthehacker,2021-08-09T18:16:15Z,2021-09-26T16:37:53+00:00,1,1150.36
772,Add proper support for working-directory & fix command builder,catthehacker,2021-08-09T19:16:21Z,2021-08-10T19:40:21+00:00,1,24.4
773,fix: log in to dockerhub to avoid rate limits,catthehacker,2021-08-09T23:55:20Z,2021-08-10T02:38:02+00:00,1,2.71
774,fix: copy whole action dir to container,catthehacker,2021-08-11T01:24:47Z,2021-08-11T05:21:52+00:00,1,3.95
775,Add support for GHA services,catthehacker,2021-08-11T02:50:12Z,2022-08-27T23:55:05+00:00,4,9165.08
776,fix: mount volume for workflow info,catthehacker,2021-08-11T09:15:56Z,2021-09-24T13:32:22+00:00,1,1060.27
781,CI: Add CodeQL analysis for discovering code vulnerabilities,HarshCasper,2021-08-20T16:42:59Z,2021-10-08T00:05:27+00:00,1,1159.37
786,Improve `--list`,catthehacker,2021-08-28T18:32:37Z,2021-08-30T15:38:04+00:00,1,45.09
787,Update Go to 1.17,catthehacker,2021-08-28T21:41:40Z,2021-08-30T18:06:20+00:00,1,44.41
789,Close docker client,ChristopherHX,2021-08-30T10:50:30Z,2021-10-24T16:50:44+00:00,3,1326.0
791,Refresh hash after pull for branch refs,ChristopherHX,2021-08-30T11:08:09Z,2021-09-08T16:47:12+00:00,2,221.65
793,Feature: uses in composite,ChristopherHX,2021-08-30T11:18:32Z,2021-12-22T19:19:51+00:00,9,2744.02
797,feat: add Dependabot config,catthehacker,2021-09-08T05:22:15Z,2021-09-08T13:46:46+00:00,1,8.41
798,build(deps): bump actions/stale from 3 to 4,dependabot,2021-09-08T13:47:06Z,2021-09-25T19:13:23+00:00,2,413.44
799,build(deps): bump actions/setup-go from 1 to 2.1.4,dependabot,2021-09-08T13:47:10Z,2021-09-25T19:13:22+00:00,2,413.44
801,build(deps): bump codecov/codecov-action from 1.5.2 to 2.0.3,dependabot,2021-09-08T13:47:16Z,2021-09-20T02:09:18+00:00,2,276.37
802,build(deps): bump github.com/go-git/go-billy/v5 from 5.0.0 to 5.3.1,dependabot,2021-09-08T14:00:42Z,2021-09-10T15:34:10+00:00,2,49.56
804,build(deps): bump github.com/mattn/go-isatty from 0.0.12 to 0.0.14,dependabot,2021-09-08T14:01:17Z,2021-09-25T19:13:24+00:00,2,413.2
805,build(deps): bump github.com/go-git/go-git/v5 from 5.2.0 to 5.4.2,dependabot,2021-09-08T14:01:54Z,2021-09-25T19:13:23+00:00,2,413.19
806,build(deps): bump github.com/docker/cli from 20.10.3+incompatible to 20.10.8+incompatible,dependabot,2021-09-08T14:02:14Z,2021-09-25T19:13:22+00:00,1,413.19
809,support for container option: --hostname,MarcinFalkowski,2021-09-09T19:36:02Z,2021-09-10T05:03:41+00:00,2,9.46
810,fix(mergify): needs-work label handling,sileht,2021-09-10T07:44:06Z,2021-09-26T16:08:52+00:00,2,392.41
815,Provide hint for -P,jsoref,2021-09-13T20:29:11Z,2021-09-13T23:14:41+00:00,2,2.76
819,build(deps): bump codecov/codecov-action from 1.5.2 to 2.1.0,dependabot,2021-09-20T02:09:14Z,2021-09-23T07:12:30+00:00,1,77.05
821,Remove ubuntu-16.04 and add missing links for nix/go,catthehacker,2021-09-21T11:48:38Z,2021-09-22T19:43:58+00:00,1,31.92
822,Bump all dependencies (and fix dependabot mess),catthehacker,2021-09-23T07:28:55Z,2021-09-25T19:13:22+00:00,1,59.74
823,fix: add simple concurrency limit,catthehacker,2021-09-24T21:58:25Z,2021-09-26T16:21:13+00:00,1,42.38
824,build(deps): bump github.com/joho/godotenv from 1.3.0 to 1.4.0,dependabot,2021-09-25T19:30:06Z,2021-09-26T16:47:33+00:00,2,21.29
828,fix: rewrite how image env is merged,catthehacker,2021-09-27T09:19:27Z,2021-09-27T19:01:15+00:00,1,9.7
