number,title,author,createdAt,closedOrMergedAt,reviewsCount,hoursOpen
2767,feat: add models permission level for AI inference responses,pelikhan,2025-05-20T13:10:20Z,2025-05-22T21:57:52+00:00,2,56.79
2777,feat: Default to host architecture for containers and enhance ARM CI,alvidofaisal,2025-05-21T19:27:38Z,2025-05-23T05:38:11+00:00,1,34.18
2924,ci: make codecov informational only,panekj,2025-05-23T01:45:23Z,2025-05-23T08:26:29+00:00,1,6.68
3225,added info log when container image platform mismatched,rmfleet,2025-05-24T02:15:35Z,2025-06-19T21:37:15+00:00,6,643.36
5026,fix: valueMasker concurrent map write,ChristopherHX,2025-06-02T15:00:22Z,2025-06-11T18:06:26+00:00,2,219.1
5028,fix: GITHUB_ENV and GITHUB_OUTPUT allow larger lines,ChristopherHX,2025-06-03T20:57:50Z,2025-06-11T17:36:11+00:00,2,188.64
5276,ci: fix goreleaser config,panekj,2025-06-11T17:57:47Z,2025-06-11T21:43:53+00:00,1,3.77
5294,fix: matrix expansion logic,ChristopherHX,2025-06-12T21:06:23Z,2025-08-21T23:39:01+00:00,2,1682.54
5295,fix: step container workdir and mounts,ChristopherHX,2025-06-12T21:09:44Z,2025-08-21T23:29:43+00:00,1,1682.33
5296,fix: file name,ChristopherHX,2025-06-12T21:18:37Z,2025-08-21T23:18:42+00:00,1,1682.0
5297,fix: post step failure is job failure,ChristopherHX,2025-06-12T23:11:28Z,2025-06-13T16:53:18+00:00,1,17.7
5326,feat: allow workflow description,ChristopherHX,2025-06-13T13:05:08Z,2025-06-13T16:33:10+00:00,1,3.47
5330,Really really dont depend on docker,wall-rl,2025-06-13T17:15:33Z,2025-06-26T19:14:49+00:00,1,313.99
5884,fix: use ubuntu-latest bookworm instead of buster for tests,ChristopherHX,2025-07-25T10:49:46Z,2025-07-25T20:33:59+00:00,1,9.74
5891,chore: mergify does no longer support queue_conditions != merge_condi…,ChristopherHX,2025-08-01T15:15:59Z,2025-08-08T16:38:36+00:00,1,169.38
5893,fix: allow yaml anchors,ChristopherHX,2025-08-04T15:04:56Z,2025-09-19T17:34:52+00:00,4,1106.5
5899,refactor: simplify adding new node versions add node 24,ChristopherHX,2025-08-12T19:13:40Z,2025-08-21T23:07:47+00:00,2,219.9
5914,build(deps): bump the dependencies group across 1 directory with 8 updates,dependabot,2025-08-23T13:58:17Z,2025-09-01T03:59:04+00:00,3,206.01
