number,title,author,createdAt,closedOrMergedAt,reviewsCount,hoursOpen
8082,Docs: Add /api/version endpoint to API documentation,anxkhn,2024-12-13T06:44:22Z,2024-12-29T19:33:44+00:00,4,396.82
8084,ollama webui for  local docker deployment,oslook,2024-12-13T08:22:30Z,2025-02-06T23:41:02+00:00,1,1335.31
8091,runner: switch logging back to stderr,dhiltgen,2024-12-13T21:26:12Z,2024-12-13T22:36:51+00:00,1,1.18
8092,llama: Ensure KV cache is fully defragmented.,jessegross,2024-12-14T00:35:22Z,2024-12-17T22:01:19+00:00,3,93.43
8101,llama: vendor commit ba1cb19c,jmorganca,2024-12-14T20:40:05Z,2024-12-14T22:55:51+00:00,2,2.26
8102,ci: be more aggressive on parallelism in build,dhiltgen,2024-12-14T21:55:42Z,2024-12-14T22:56:05+00:00,1,1.01
8113,llama: add qwen2vl support,jmorganca,2024-12-16T07:59:10Z,2025-05-11T03:57:07+00:00,1,3499.97
8119,docs: change getting started guide link for pgai,Askir,2024-12-16T15:12:29Z,2024-12-17T06:13:23+00:00,1,15.02
8125,darwin: restore multiple runners for x86,dhiltgen,2024-12-17T00:30:34Z,2024-12-17T02:45:02+00:00,3,2.24
8130,"llm: do not silently fail for supplied, but invalid formats",bmizerany,2024-12-17T04:55:01Z,2024-12-17T05:57:49+00:00,3,1.05
8131,scripts: sign renamed macOS binary,jmorganca,2024-12-17T07:41:17Z,2024-12-18T02:03:49+00:00,1,18.38
8134,feat: Introduce speculative decoding,bfroemel,2024-12-17T09:49:16Z,2025-01-09T17:43:29+00:00,15,559.9
8142,llama: update vendored code to 081b29bd,jmorganca,2024-12-17T19:22:48Z,2025-01-05T06:53:36+00:00,1,443.51
8163,"Reuse type InvalidModelNameErrMsg, unify the const parameters.",zhanluxianshen,2024-12-18T21:52:07Z,2024-12-23T15:38:34+00:00,1,113.77
8172,Updated the version of golang/crypto package to handle CVE-2024-45337,Squishedmac,2024-12-19T10:56:32Z,2024-12-20T17:29:30+00:00,1,30.55
8193,Updated installer script for smaller wizard size.,YonTracks,2024-12-21T00:27:56Z,2025-03-19T13:55:29+00:00,5,2125.46
8196,chore: upgrade to gods v2,mxyng,2024-12-21T08:06:14Z,2025-01-10T21:50:11+00:00,1,493.73
8198,feat(readme): add Perplexica,ItzCrazyKns,2024-12-21T13:53:26Z,2024-12-23T01:04:02+00:00,1,35.18
8208,fix crash bug with /save when quotes are used,pdevine,2024-12-22T03:35:17Z,2024-12-22T06:31:37+00:00,3,2.94
8211,docker: upgrade rocm to 6.3.3,Pekkari,2024-12-22T10:55:40Z,2025-02-25T21:38:08+00:00,7,1570.71
8215,added source.go for syntax highlighting on code blocks,belfie13,2024-12-23T04:54:20Z,2024-12-27T18:17:49+00:00,5,109.39
8227,README.md inclusion of a project alpaca,olumolu,2024-12-24T07:32:36Z,2024-12-25T04:05:36+00:00,1,20.55
8232, Remove redundant image_url format check in fromChatRequest,muzzlol,2024-12-24T15:22:37Z,2025-01-13T19:32:37+00:00,1,484.17
8236,Update README.md,adarshM84,2024-12-25T08:05:46Z,2024-12-27T18:16:06+00:00,2,58.17
8242,README: add neollama to terminal section of communiy integrations,paradoxical-dev,2024-12-25T20:47:22Z,2024-12-25T22:16:12+00:00,1,1.48
8267,examples: remove codified examples,ParthSareen,2024-12-29T22:10:00Z,2025-01-13T19:26:22+00:00,7,357.27
8284,Add CUSTOM_CPU_FLAGS to Dockerfile.,rick-github,2025-01-02T07:08:32Z,2025-01-06T17:17:19+00:00,2,106.15
8301,Runner for OIlama engine,jessegross,2025-01-04T04:18:22Z,2025-02-14T01:09:26+00:00,18,980.85
8307,fix: correct endpoint URL to avoid 404 error,ubaldus,2025-01-04T21:14:22Z,2025-01-04T23:45:16+00:00,1,2.52
8343,OpenAI: accept additional headers to fix CORS error #8342,isamu,2025-01-08T00:40:36Z,2025-01-08T19:28:11+00:00,1,18.79
8351,better client error for /api/create,pdevine,2025-01-08T21:28:44Z,2025-01-09T18:12:30+00:00,1,20.73
8352,Add LangChain for .NET to libraries list,steveberdy,2025-01-08T22:28:42Z,2025-01-14T17:37:35+00:00,1,139.15
8380,make the modelfile path relative for `ollama create`,pdevine,2025-01-10T23:11:50Z,2025-01-11T00:14:08+00:00,2,1.04
8388,add new create api doc,pdevine,2025-01-12T00:45:51Z,2025-01-14T01:30:24+00:00,1,48.74
8408,convert: qwen2 from safetensors,BruceMacD,2025-01-14T01:01:38Z,2025-01-14T18:34:37+00:00,1,17.55
8410,sample: add sampling package for new engine,ParthSareen,2025-01-14T02:04:26Z,2025-02-25T01:19:01+00:00,75,1007.24
8411,llama: move grammar tests to llama_test.go,jmorganca,2025-01-14T02:49:33Z,2025-01-14T20:55:46+00:00,1,18.1
8428,Fix absolute path names + gguf detection,pdevine,2025-01-14T22:05:17Z,2025-01-15T03:01:24+00:00,8,4.94
8438,docs: fixed path to examples,Gloryjaw,2025-01-15T08:25:19Z,2025-01-15T19:49:12+00:00,1,11.4
8449,parser: fix parsing Modelfiles with multiple FROM commands,jmorganca,2025-01-16T06:24:20Z,2025-01-16T08:14:06+00:00,1,1.83
8455,docs: add link to Langfuse integration example,jannikmaierhoefer,2025-01-16T10:17:48Z,2025-01-17T06:41:12+00:00,1,20.39
8480,check bounds for blob parts,bbSnavy,2025-01-18T08:26:59Z,2025-02-05T02:54:12+00:00,3,426.45
8487,Update gpu.md,EndoTheDev,2025-01-19T16:33:00Z,2025-01-20T02:45:35+00:00,1,10.21
8490,Draft MLX go backend for new engine,dhiltgen,2025-01-19T19:08:38Z,2025-02-14T01:09:28+00:00,1,606.01
8515,Remove tfs_z from documentation.,rick-github,2025-01-21T10:21:42Z,2025-01-21T17:29:00+00:00,1,7.12
8521,Blackwell codegen Support,johnnynunez,2025-01-21T21:38:54Z,2025-02-02T23:24:35+00:00,1,289.76
8524,Remove reference to the deleted examples folder,danielpunkass,2025-01-22T00:10:46Z,2025-01-23T06:52:16+00:00,1,30.69
8539,next build,mxyng,2025-01-22T19:05:54Z,2025-01-29T23:03:38+00:00,7,171.96
8540,Update README.md added deepseek-r1,olumolu,2025-01-22T19:45:52Z,2025-02-07T19:31:16+00:00,2,383.76
8551,Readme - add LlmTornado to libraries,lofcz,2025-01-23T16:53:23Z,2025-01-25T09:04:07+00:00,1,40.18
8567,"build: support Compute Capability 5.0, 5.2 and 5.3 for CUDA 12.x",prusnak,2025-01-24T16:50:29Z,2025-02-25T17:54:19+00:00,3,769.06
8587,llm: update library lookup logic now that there is one runner,jmorganca,2025-01-26T02:49:27Z,2025-01-29T05:07:49+00:00,4,74.31
8603,Update the Documentation.,kontactguddu,2025-01-27T07:40:57Z,2025-02-07T19:28:28+00:00,7,275.79
8612,Teach ollama to be patient,MayorUshanka,2025-01-27T18:30:23Z,2025-02-06T02:36:51+00:00,1,224.11
8643,benchmark: performance of running ollama server,BruceMacD,2025-01-28T23:57:54Z,2025-03-21T20:08:20+00:00,26,1244.17
8656,Add DeepSeek R1 in README,zakk616,2025-01-29T12:38:21Z,2025-02-07T19:33:06+00:00,1,222.91
8659,Add simple-discord-ai to README.md,zyphixor,2025-01-29T13:27:41Z,2025-02-06T02:35:04+00:00,1,181.12
8663,Update README.md Adding DeepSeek to the table of models,teymuur,2025-01-29T14:34:27Z,2025-01-30T15:15:16+00:00,1,24.68
8668,Hide empty terminal window,ashokgelal,2025-01-29T16:31:07Z,2025-05-05T16:06:46+00:00,1,2303.59
8672,openai: set `context_length` size ,ParthSareen,2025-01-29T21:14:09Z,2025-02-08T02:42:13+00:00,24,221.47
8688,Add library in Zig.,dravenk,2025-01-30T08:05:43Z,2025-02-08T19:10:47+00:00,1,227.08
8691,Fix install_cuda_driver_yum() for dnf5,FreeCap23,2025-01-30T13:15:48Z,2025-05-04T07:32:53+00:00,2,2250.28
8692,Refactor Byte Formatting Logic and Add Its Tests,fyvri,2025-01-30T13:55:54Z,2025-02-05T20:23:08+00:00,1,150.45
8702,discover: fix default LibOllamaPath value,jmorganca,2025-01-30T17:53:46Z,2025-01-30T20:21:38+00:00,1,2.46
8714,Avoid sharing a buffer when multiple inputs are sent to generate embeddings via api/embed.,dpereira,2025-01-30T22:32:03Z,2025-02-06T00:53:33+00:00,1,146.36
8715,build: set CFLAGS for cpu,mxyng,2025-01-30T22:38:17Z,2025-01-31T18:25:40+00:00,3,19.79
8733,Add support for rootless local installation (--user flag),rfievet,2025-01-31T20:14:50Z,2025-02-02T21:05:43+00:00,1,48.85
8744,fix release workflow,mxyng,2025-02-01T02:00:23Z,2025-02-03T21:19:57+00:00,1,67.33
8746,Ollama getting index oob exception,fallenreaper,2025-02-01T02:48:23Z,2025-02-05T02:52:47+00:00,2,96.07
8766,Docs: Added syntax highlighting in certain `json` and `shell` codeblocks in api.md,Bert0ns,2025-02-01T23:43:26Z,2025-02-02T21:12:55+00:00,1,21.49
8767,readme: add MinimalNextOllamaChat to community-integrations,anilkay,2025-02-01T23:46:13Z,2025-02-02T20:56:10+00:00,1,21.17
8774,Update download.go,yashwanth2706,2025-02-02T16:26:42Z,2025-02-06T00:35:43+00:00,5,80.15
8780,Update README.md: DeepSeek R1,raphael-64,2025-02-02T23:51:38Z,2025-02-03T18:16:41+00:00,1,18.42
8785,"Fix ollama (Jetson, Blackwell, AMD)",johnnynunez,2025-02-03T07:51:45Z,2025-02-04T00:50:27+00:00,5,16.98
8810,ci: fix extra quote,mxyng,2025-02-04T02:20:21Z,2025-02-04T16:35:30+00:00,1,14.25
8811,Add MLflow Tracing as an observability integration in README,daniellok-db,2025-02-04T04:38:43Z,2025-02-06T00:04:24+00:00,1,43.43
8827,ml/backend/ggml: fix library loading on macOS amd64,jmorganca,2025-02-04T19:49:43Z,2025-02-04T23:05:39+00:00,2,3.27
8829,ci: split docker build by platform,mxyng,2025-02-04T22:27:13Z,2025-02-05T01:04:27+00:00,5,2.62
8831,format download.go file and clean whitespace,yashwanth2706,2025-02-05T01:49:27Z,2025-02-05T18:00:26+00:00,2,16.18
8835,llama: use dynamic backend loading for mllama and clip,jmorganca,2025-02-05T07:07:53Z,2025-02-05T17:46:56+00:00,3,10.65
8854,docs: add syntax highlighting in code blocks,fyvri,2025-02-05T18:39:41Z,2025-02-07T17:55:07+00:00,11,47.26
8862,ci: fix linux archive,mxyng,2025-02-06T02:00:23Z,2025-02-06T03:45:58+00:00,1,1.76
8864,Update README.md,jiaojinqian,2025-02-06T03:30:37Z,2025-02-06T21:04:31+00:00,1,17.57
8865,chore(format): rename test file from byte_test.go to bytes_test.go,fyvri,2025-02-06T03:48:39Z,2025-02-06T21:06:15+00:00,1,17.29
8867,bytes.go with unified byte format conversion constants,hurricane1988,2025-02-06T05:56:03Z,2025-02-06T21:13:39+00:00,1,15.29
8877,add React Native client Integrations,annilq,2025-02-06T09:01:02Z,2025-02-07T01:15:49+00:00,1,16.25
8883,readme: add ChibiChat to community integrations,CosmicEventHorizon,2025-02-06T11:11:28Z,2025-02-07T00:08:46+00:00,1,12.96
8890,Improve Download Stall Handling with Adaptive Retry Mechanism,yashwanth2706,2025-02-06T16:03:59Z,2025-02-07T01:12:24+00:00,1,9.14
8897,doc Update:  Linux uninstall,abhitrueprogrammer,2025-02-06T21:11:43Z,2025-02-06T22:54:58+00:00,2,1.72
8915,chore: git ignore vendor directory,chengjoey,2025-02-07T06:23:25Z,2025-02-08T04:09:11+00:00,5,21.76
8938,config: allow setting context length through env var,ParthSareen,2025-02-08T02:40:01Z,2025-02-24T21:26:35+00:00,12,402.78
8940,refactor: using slices.Contains to simplify the code,zoupingshi,2025-02-08T03:59:13Z,2025-08-22T08:37:19+00:00,2,4684.64
8941,ci: use windows-2022 to sign and bundle,mxyng,2025-02-08T04:36:54Z,2025-02-08T21:07:01+00:00,1,16.5
8951,improve timeout handling for blobDownload,thorseraq,2025-02-08T15:24:09Z,2025-02-23T16:40:15+00:00,1,361.27
8953,"Add ""LocalLLM"" Repo link",qusaismael,2025-02-08T17:58:27Z,2025-02-08T20:28:01+00:00,1,2.49
8973,doc: add Abso SDK to the list of community integrations,hughcrt,2025-02-09T18:00:13Z,2025-02-11T08:14:45+00:00,4,38.24
8975,doc: add link to Lunary integration to the Observability section,hughcrt,2025-02-09T19:05:44Z,2025-02-10T06:08:47+00:00,1,11.05
8976,ml/backend/ggml: fix crash on dlopen on machines without AVX,jmorganca,2025-02-10T01:26:33Z,2025-02-10T17:52:12+00:00,1,16.43
8996,api: document client stream behavior with a test,BruceMacD,2025-02-10T21:47:00Z,2025-02-20T21:19:58+00:00,13,239.55
9022,api: add optional hints to errors for troubleshooting,BruceMacD,2025-02-11T21:54:57Z,2025-03-13T23:28:53+00:00,14,721.57
9043,doc: fix link for Abso,hughcrt,2025-02-12T12:42:54Z,2025-02-12T17:15:08+00:00,1,4.54
9045,readme: fix nix package link,bloominstrong,2025-02-12T13:17:09Z,2025-02-12T17:16:27+00:00,1,3.99
9052,docs(readme): Reference Ollama Homebrew in README,pygeek,2025-02-12T18:13:23Z,2025-02-12T19:17:40+00:00,1,1.07
9053,Wire up new tokenizers for new engine,dhiltgen,2025-02-12T18:25:37Z,2025-02-14T01:09:30+00:00,5,30.73
9060,build: add `-DGGML_CUDA_NO_PEER_COPY=ON` for ROCm ggml builds on windows,jmorganca,2025-02-13T02:32:13Z,2025-02-13T08:23:17+00:00,1,5.85
9066,docs: group additional ROCm docs for building on Windows,jmorganca,2025-02-13T08:27:39Z,2025-02-22T19:22:59+00:00,1,226.92
9072,Move cgroup fix out of AMD section.,rick-github,2025-02-13T15:58:57Z,2025-02-25T16:52:50+00:00,1,288.9
9075,Add Ollamazing to Community Integrations,buiducnhat,2025-02-13T16:38:58Z,2025-02-13T18:47:09+00:00,1,2.14
9076,Add H200 as supported device.,rick-github,2025-02-13T16:46:33Z,2025-02-13T18:44:23+00:00,1,1.96
9077,Document the no-Modelfile function of `ollama create`,rick-github,2025-02-13T21:10:27Z,2025-07-17T05:16:10+00:00,3,3680.1
9079,cmd: fix flickering in progress bar,jeremyschlatter,2025-02-14T00:26:47Z,2025-02-18T22:59:29+00:00,2,118.55
9080,model: implement bert in ollama engine,mxyng,2025-02-14T00:28:23Z,2025-09-15T22:36:00+00:00,5,5134.13
9081,ml/backend/ggml: stable sort devices by score,jmorganca,2025-02-14T01:29:19Z,2025-02-14T02:42:36+00:00,2,1.22
9098,Update windows.md,James-William-Kincaid-III,2025-02-14T10:12:25Z,2025-02-15T20:38:24+00:00,1,34.43
9108,test: add test cases for HumanNumber(),ismdeep,2025-02-14T14:04:31Z,2025-02-18T19:35:26+00:00,1,101.52
9113,New engine: vision models and auto-fallback,dhiltgen,2025-02-14T17:07:42Z,2025-03-04T17:03:46+00:00,14,431.93
9120,Windows ARM build,dhiltgen,2025-02-14T20:53:33Z,2025-02-27T17:02:25+00:00,10,308.15
9121,ml: let model specify rope configuration,BruceMacD,2025-02-14T22:15:03Z,2025-03-13T23:29:10+00:00,2,649.24
9122,model: document high-level model interface,BruceMacD,2025-02-14T22:59:15Z,2025-02-15T00:01:00+00:00,1,1.03
9128,ci: set owner/group in tarball,mxyng,2025-02-15T07:14:50Z,2025-02-18T20:11:09+00:00,1,84.94
9136,cli: adding support ctrl-n/p like general cli,Shane-XB-Qian,2025-02-15T14:35:11Z,2025-03-12T15:51:56+00:00,1,601.28
9138,docs: Add OpenDeepResearcher-via-searxng to Community Integrations,benhaotang,2025-02-15T15:27:03Z,2025-02-18T19:39:11+00:00,1,76.2
9146,test: add test cases for ListHandler defined in cmd/cmd.go,yuiseki,2025-02-16T05:27:08Z,2025-02-19T21:24:27+00:00,1,87.96
9150,llm_telegram_bot added to README.md,innightwolfsleep,2025-02-16T13:21:10Z,2025-02-18T15:04:31+00:00,1,49.72
9159,llama: add patch to fix ggml backend reg errors,jmorganca,2025-02-17T00:04:57Z,2025-02-19T03:46:18+00:00,1,51.69
9162,Update ggml-backend.cpp,hackhy,2025-02-17T03:25:16Z,2025-02-18T19:38:10+00:00,1,40.22
9195,cmake: avoid building intel backends on linux,mxyng,2025-02-18T17:55:25Z,2025-02-18T22:17:00+00:00,1,4.36
9198,gemma2 implementation for the new engine,pdevine,2025-02-18T20:51:25Z,2025-03-12T06:44:50+00:00,2,513.89
9200,model: add new engine support for qwen2 family,BruceMacD,2025-02-18T22:37:45Z,2025-03-13T23:29:25+00:00,1,552.86
9203,build: remove backend build for sapphirerapids,mxyng,2025-02-18T22:59:11Z,2025-02-19T21:42:00+00:00,1,22.71
9204,ml: Abstract attention out of model definitions,jessegross,2025-02-18T23:21:18Z,2025-02-21T21:16:21+00:00,11,69.92
9212,docs: Add MaxKB to Community Integrations,maninhill,2025-02-19T06:36:43Z,2025-02-19T21:20:09+00:00,1,14.72
9214,docs: Add AntSK to Community Integrations,xuzeyu91,2025-02-19T07:35:14Z,2025-02-19T21:22:49+00:00,2,13.79
9231,chore: reorder patches 0018,mxyng,2025-02-19T23:06:09Z,2025-02-20T03:49:24+00:00,1,4.72
9235,New engine performance improvements,jessegross,2025-02-19T23:44:14Z,2025-02-20T22:49:48+00:00,9,23.09
9237,OpenAI: accept x-stainless-timeout header to fix CORS error,lucasthahn,2025-02-20T00:54:54Z,2025-02-20T05:56:19+00:00,1,5.02
9242,go.mod: bump to go1.24,bmizerany,2025-02-20T05:22:39Z,2025-02-24T21:11:46+00:00,1,111.82
9243,fix: the problem of loading models with large difference in initial and final layer sizes,itej89,2025-02-20T05:27:59Z,2025-05-13T23:42:39+00:00,12,1986.24
9251,docs: Add yla to Community Integrations,danielekp,2025-02-20T14:36:30Z,2025-02-20T19:34:24+00:00,1,4.96
9255,Add missing function parens.,rick-github,2025-02-20T16:58:04Z,2025-02-20T20:10:15+00:00,1,3.2
9256,ollamarunner: Pass runner performance parameters to backends,jessegross,2025-02-20T19:28:48Z,2025-02-20T21:27:57+00:00,8,1.99
9259,ml/backend/ggml: fix rms norm,mxyng,2025-02-21T00:45:31Z,2025-02-21T18:34:19+00:00,1,17.81
9270,server: group routes by category and purpose,bmizerany,2025-02-21T07:25:48Z,2025-02-22T05:02:26+00:00,7,21.61
9272,doc(README): add `RockChinQ/LangBot` to integrations list,RockChinQ,2025-02-21T10:10:36Z,2025-02-21T17:36:56+00:00,1,7.44
9294,server/internal: copy bmizerany/ollama-go to internal package,bmizerany,2025-02-23T00:37:58Z,2025-02-25T06:39:44+00:00,12,54.03
9304,"Update ROCm (6.3 linux, 6.2 windows) and CUDA v12.8",dhiltgen,2025-02-23T20:43:38Z,2025-02-25T21:47:36+00:00,11,49.07
9312,docs: Add 1Panel to Community Integrations,wanghe-fit2cloud,2025-02-24T09:39:55Z,2025-02-28T17:53:03+00:00,2,104.22
9313,server: allow vscode-file origins,eriestrisnadi,2025-02-24T10:27:37Z,2025-02-27T18:39:43+00:00,1,80.2
9324,llm: remove internal subprocess req and resp types,BruceMacD,2025-02-24T23:04:53Z,2025-03-14T22:21:53+00:00,15,431.28
9336,[doc update] Update broken URLs,ChuanhuiLiu,2025-02-25T10:35:20Z,2025-02-25T21:15:59+00:00,2,10.68
9344,fix: add back bf16 support,mxyng,2025-02-25T17:19:39Z,2025-02-25T19:26:15+00:00,2,2.11
9346,Updating the link suggested by PR review,ChuanhuiLiu,2025-02-25T18:39:27Z,2025-02-25T21:15:48+00:00,1,2.61
9347,server/internal: replace model delete API with new registry handler,bmizerany,2025-02-25T18:53:46Z,2025-02-27T20:04:53+00:00,6,49.19
9348,".github: always run tests, and other helpful fixes",bmizerany,2025-02-25T19:07:04Z,2025-02-25T22:28:07+00:00,1,3.35
9350,Add cuda Blackwell architecture for v12,dhiltgen,2025-02-25T21:52:12Z,2025-02-26T17:20:53+00:00,5,19.48
9356,llama: update llama.cpp and ggml vendor code to commit d7cfe1ff,jmorganca,2025-02-26T05:23:26Z,2025-02-27T04:34:44+00:00,4,23.19
9360,docs: fix api examples link,stevenh,2025-02-26T11:08:20Z,2025-02-27T18:51:12+00:00,1,31.71
9367,Win: doc new rocm zip file,dhiltgen,2025-02-26T17:27:39Z,2025-03-05T22:11:21+00:00,1,172.73
9373,model: add bos token if configured,mxyng,2025-02-26T19:23:42Z,2025-02-27T21:04:59+00:00,4,25.69
9374,sample: improve ollama engine sampler performance,ParthSareen,2025-02-26T19:31:24Z,2025-03-07T20:37:48+00:00,22,217.11
9377,sample: remove transforms from greedy sampling,ParthSareen,2025-02-26T21:11:18Z,2025-02-27T23:44:53+00:00,3,26.56
9378,ml: split model across backends,mxyng,2025-02-26T21:45:30Z,2025-03-07T22:08:21+00:00,21,216.38
9379,server: validate local path on safetensor create,BruceMacD,2025-02-26T22:53:27Z,2025-03-01T00:10:43+00:00,19,49.29
9380,runner: simplify tensor split parsing,mxyng,2025-02-26T23:59:50Z,2025-02-27T18:36:46+00:00,1,18.62
9381,ml: update Context.Forward interface,mxyng,2025-02-27T00:00:50Z,2025-02-27T22:27:16+00:00,2,22.44
9383,attention: Remove unnecessary contiguous operations & Flash attention,jessegross,2025-02-27T01:05:17Z,2025-03-02T04:53:23+00:00,11,75.8
9384,ml/backend/ggml: fix debug logging,mxyng,2025-02-27T01:05:34Z,2025-02-27T18:30:57+00:00,2,17.42
9399,go.mod: Use full version for go 1.24.0,jessegross,2025-02-27T19:37:36Z,2025-02-27T21:01:32+00:00,2,1.4
9400,server/internal/internal/names: validate names,bmizerany,2025-02-27T21:28:49Z,2025-03-01T21:15:14+00:00,3,47.77
9405,CONTRIBUTING: clarify commit message guidelines and add examples,bmizerany,2025-02-27T23:44:40Z,2025-02-28T03:22:26+00:00,2,3.63
9411,docs: add Reins to community integrations,ibrahimcetin,2025-02-28T07:02:58Z,2025-03-03T19:06:30+00:00,1,84.06
9424,Update README.md,olumolu,2025-02-28T19:12:31Z,2025-03-03T19:09:21+00:00,2,71.95
9426,cmake: build compute capability 12.0,jmorganca,2025-02-28T19:37:24Z,2025-02-28T21:12:31+00:00,1,1.59
9427,server/.../safetensors: fix offsets and include all model parts,bmizerany,2025-02-28T19:42:45Z,2025-02-28T21:08:10+00:00,4,1.42
9428,fix: replace deprecated functions,mxyng,2025-02-28T19:50:41Z,2025-02-28T21:29:35+00:00,1,1.65
9433,runner: clear cache when shift is not possible,BruceMacD,2025-03-01T00:27:31Z,2025-03-31T19:54:45+00:00,15,739.45
9434,types: allow tool function parameters with either a single type or an array of types,rozgo,2025-03-01T03:14:12Z,2025-04-07T21:27:01+00:00,1,906.21
9435,ml/backend/ggml: consolidate system info logging,mxyng,2025-03-01T03:24:42Z,2025-03-04T23:14:31+00:00,7,91.83
9442,Add AstrBot to Community Integrations,Soulter,2025-03-01T14:36:26Z,2025-03-02T05:58:35+00:00,1,15.37
9454,server/internal/client/ollama: handle extended names in client/ollama,bmizerany,2025-03-02T05:23:45Z,2025-03-02T21:30:41+00:00,2,16.12
9456,docs: don't use self-closing tag for anchor element,remarkablemark,2025-03-02T08:27:53Z,2025-03-03T19:56:34+00:00,1,35.48
9458,chore(cmd): add miss err return for stop cmd,googs1025,2025-03-02T10:59:12Z,2025-03-03T20:13:41+00:00,1,33.24
9463,server/internal/client/ollama: hold DiskCache on Registry,bmizerany,2025-03-02T23:48:52Z,2025-03-03T04:55:44+00:00,1,5.11
9465,chore(server): refactor the error variable in server part,googs1025,2025-03-03T02:06:39Z,2025-03-28T18:50:22+00:00,2,616.73
9468,Update README.md - Add OllamaServer,sunshine0523,2025-03-03T05:26:12Z,2025-03-04T00:38:33+00:00,3,19.21
9479,docker: use go version from go.mod,mxyng,2025-03-03T18:01:35Z,2025-03-03T21:02:02+00:00,1,3.01
9481,fix(install.sh): update lib/ollama directory permissions,mxyng,2025-03-03T19:26:47Z,2025-03-03T21:01:19+00:00,1,1.58
9483,Update README.md,olumolu,2025-03-03T20:08:19Z,2025-03-04T19:10:56+00:00,2,23.04
9484,"server/.../backoff,syncs: conditionally skip synctest tests",bmizerany,2025-03-03T21:28:35Z,2025-03-04T00:45:40+00:00,1,3.28
9485,server/internal/registry: take over pulls from server package,bmizerany,2025-03-04T00:45:24Z,2025-03-05T22:48:18+00:00,5,46.05
9487,dependabot,unknown,2025-03-04T01:43:59Z,2025-03-05T17:54:12+00:00,1,40.17
9537,docs(tool): add mcp-llm,sammcj,2025-03-06T07:04:56Z,2025-03-10T16:52:03+00:00,1,105.79
9540,docs: Add SwiftChat to Community Integrations,zhu-xiaowei,2025-03-06T07:52:50Z,2025-03-10T18:01:09+00:00,1,106.14
9545,documentation: Add OLLAMA_CONTEXT_LENGTH to FAQ.,rick-github,2025-03-06T10:55:33Z,2025-03-10T18:02:54+00:00,2,103.12
9557,ollamarunner: Improve multimodal input handling,jessegross,2025-03-06T21:56:01Z,2025-03-07T00:54:16+00:00,2,2.97
9565,add QwQ model to supported list,iBreaker,2025-03-07T05:36:59Z,2025-03-07T17:30:07+00:00,1,11.89
9569,Better WantedBy declaration,dwt,2025-03-07T09:26:39Z,2025-03-10T21:09:38+00:00,1,83.72
9576,cli: don't exit for invalid model during /load.,rick-github,2025-03-07T12:48:43Z,2025-03-12T06:42:53+00:00,1,113.9
9586,sample: temporarily use grammars for constrained generation in new engine,jmorganca,2025-03-07T21:50:20Z,2025-03-10T15:17:39+00:00,30,65.46
9587,kvcache: Support non-causal attention,jessegross,2025-03-07T23:10:32Z,2025-03-08T02:39:27+00:00,1,3.48
9589,ollamarunner: Quiet debug logging and panic on unimplemented features,jessegross,2025-03-07T23:40:26Z,2025-03-08T02:38:02+00:00,1,2.96
9590,fix: pad tensor item if ge zero,mxyng,2025-03-08T02:05:43Z,2025-03-10T23:34:56+00:00,4,69.49
9604,model: Update encoder cache to use multimodal input processing handler,jessegross,2025-03-09T01:52:26Z,2025-03-10T00:05:26+00:00,4,22.22
9626,chore: added opik to observability integrations for ollama,vincentkoc,2025-03-10T16:28:52Z,2025-03-10T23:15:10+00:00,1,6.77
9631,sample: add numerical stability to softmax transform,ParthSareen,2025-03-10T19:51:09Z,2025-03-10T21:43:53+00:00,9,1.88
9634,server: allow running embed models in parallel,BruceMacD,2025-03-10T20:37:44Z,2025-03-10T22:54:55+00:00,1,2.29
9635,Align versions for local builds,dhiltgen,2025-03-10T21:42:24Z,2025-03-14T22:44:09+00:00,3,97.03
9636,Build release for windows with local script,dhiltgen,2025-03-10T21:49:03Z,2025-03-11T15:34:20+00:00,1,17.75
9640,add verbose mode to the show command,pdevine,2025-03-11T05:37:42Z,2025-03-13T21:24:27+00:00,7,63.78
9643,docs: Add OLLAMA_ORIGINS for browser extension support,13rac1,2025-03-11T07:22:00Z,2025-03-13T23:35:20+00:00,5,64.22
9654,Integration test improvements,dhiltgen,2025-03-11T16:56:39Z,2025-04-16T21:25:55+00:00,8,868.49
9669,sample: fix sorting order and top_k,ParthSareen,2025-03-12T04:47:10Z,2025-03-12T18:59:17+00:00,17,14.2
9681,Update base image from Ubuntu 20.24 to 24.04 LTS,vrampal,2025-03-12T09:11:54Z,2025-07-05T23:02:33+00:00,1,2773.84
9688,ollama-debug.c: correct mistype,Shane-XB-Qian,2025-03-12T14:35:51Z,2025-03-13T17:12:44+00:00,2,26.61
9692,models/gemma3: remove final logit softcap,BruceMacD,2025-03-12T15:44:00Z,2025-03-12T17:17:57+00:00,1,1.57
9703,count gemma3 vision tensors,mxyng,2025-03-12T21:37:39Z,2025-03-13T23:56:34+00:00,4,26.32
9719,Update README.md,Aharon-Bensadoun,2025-03-13T08:39:19Z,2025-05-06T21:47:36+00:00,1,1309.14
9732,sample: separate softmax and temperature transforms,ParthSareen,2025-03-13T14:57:38Z,2025-03-13T16:53:27+00:00,18,1.93
9740,sample: add error handling for empty logits,ParthSareen,2025-03-13T17:55:30Z,2025-03-20T18:11:18+00:00,7,168.26
9741,fix: error if image requested without vision model,mxyng,2025-03-13T18:00:02Z,2025-03-13T22:03:25+00:00,4,4.06
9742,fix: error on embeddings; not currently implemented,mxyng,2025-03-13T18:24:32Z,2025-03-13T20:12:33+00:00,3,1.8
9743,sample: make mutations in transforms explicit,ParthSareen,2025-03-13T19:33:23Z,2025-03-17T18:24:18+00:00,12,94.85
9746,server/internal/client: use chunksums for concurrent blob verification,bmizerany,2025-03-13T23:19:30Z,2025-03-14T05:18:29+00:00,7,5.98
9747,Support multiple images in Gemma3 ,jessegross,2025-03-13T23:45:08Z,2025-03-14T22:38:54+00:00,1,22.9
9755,server/internal/chunks: remove chunks package,bmizerany,2025-03-14T06:14:02Z,2025-03-14T15:57:59+00:00,1,9.73
9773,Add support for ROCm gfx1151,dhiltgen,2025-03-14T21:55:19Z,2025-03-17T16:33:57+00:00,1,66.64
9775,server/internal/client/ollama: set User-Agent for registry client,bmizerany,2025-03-14T23:01:53Z,2025-03-15T01:33:07+00:00,1,2.52
9777,model: support for mistral-small in the ollama runner,BruceMacD,2025-03-14T23:59:04Z,2025-04-05T22:06:15+00:00,1,526.12
