number,title,author,createdAt,closedOrMergedAt,reviewsCount,hoursOpen,merged,additions,deletions,changedFiles,bodyLength,issueCommentsCount,reviewThreadsCount,interactionsCount,finalReviewState
12323,More generalized error msg for sintercard and zintercard for limit option,hwware,2023-06-15T20:42:09Z,2023-06-20T17:58:27+00:00,2,117.27,False,2,2,2,1199,5,0,5,CLOSED
12322,Sanitizer reported memory leak for '--invalid' option or port number is missed cases to redis-server.,hwware,2023-06-15T18:15:06Z,2023-06-20T07:07:29+00:00,8,108.87,True,12,3,2,5105,3,2,5,MERGED
12321,Align RM_ReplyWithErrorFormat with RM_ReplyWithError,guybe7,2023-06-15T13:47:02Z,2023-06-20T17:44:43+00:00,7,123.96,True,22,10,2,486,1,4,5,MERGED
12320,Fix SPOP/RESTORE propagation when doing lazy free,enjoy-binbin,2023-06-15T12:48:03Z,2023-06-16T15:14:11+00:00,3,26.44,True,57,3,4,610,0,1,1,MERGED
12318,Removing duplicated tests,YaacovHazan,2023-06-15T07:18:51Z,2023-06-16T12:55:25+00:00,2,29.61,True,0,21,1,208,0,0,0,MERGED
12316,Optimize SET PXAT to reduce calls of rewriteClientCommandVector,enjoy-binbin,2023-06-14T14:06:37Z,2023-06-15T07:07:48+00:00,5,17.02,True,8,6,2,122,1,2,3,MERGED
12315,Set Jemalloc --disable-cache-oblivious to reduce memory overhead,oranagra,2023-06-14T09:38:52Z,2023-06-18T07:30:23+00:00,1,93.86,True,1,1,1,1779,3,0,3,MERGED
12313,Only check if we need to resize if we actually appended,unknown,2023-06-14T01:15:40Z,2023-06-19T00:28:44+00:00,3,119.22,False,6,5,1,193,2,1,3,CLOSED
12310,Correcting the Copied test case without changing command.,hwware,2023-06-13T15:08:27Z,2023-06-14T07:03:34+00:00,2,15.92,True,1,1,1,588,0,0,0,MERGED
12304,Prevent PEJ on loading and on readonly replica.,MeirShpilraien,2023-06-12T10:28:11Z,2023-06-15T07:10:23+00:00,10,68.7,True,7,1,1,686,2,1,3,MERGED
12301,Fix XREADGROUP BLOCK stuck in endless loop,enjoy-binbin,2023-06-12T00:57:10Z,2023-06-13T10:27:05+00:00,21,33.5,True,28,2,2,641,5,5,10,MERGED
12299,Implement `CLIENT KILL MAXAGE <maxage>`,slavak,2023-06-11T10:23:34Z,2024-01-30T18:24:37+00:00,10,5600.02,True,61,3,4,254,4,5,9,MERGED
12298,Optimize PSUBSCRIBE and PUNSUBSCRIBE from O(N*M) to O(N),enjoy-binbin,2023-06-11T09:43:20Z,2023-06-19T13:31:18+00:00,5,195.8,True,35,38,9,1194,2,4,6,MERGED
12296,Fix ACLAppendUserForLoading memory leak when merge error,enjoy-binbin,2023-06-10T06:38:29Z,2023-06-11T01:11:17+00:00,1,18.55,True,4,4,1,260,1,0,1,MERGED
12288,Adding missing test cases for Addslot Command,hwware,2023-06-08T19:51:17Z,2023-06-11T05:36:27+00:00,1,57.75,True,11,0,1,51,0,0,0,MERGED
12279,redis-cli --stat take dbnum value from CONFIG GET to output total keys,enjoy-binbin,2023-06-07T14:30:54Z,2023-08-16T07:54:37+00:00,13,1673.4,True,24,1,1,83,0,3,3,MERGED
12277,Add missing return on -UNKILLABLE sent by master case,enjoy-binbin,2023-06-07T10:59:51Z,2023-06-08T12:13:54+00:00,2,25.23,True,1,0,1,138,8,0,8,MERGED
12276,"Use Reservoir Sampling for random sampling of dict, and fix hang during fork",sundb,2023-06-07T06:04:40Z,2023-06-16T16:13:08+00:00,7,226.14,True,147,8,2,1400,8,6,14,MERGED
12274,Adding geo command's missing test cases,hwware,2023-06-06T21:13:35Z,2023-06-20T09:50:04+00:00,1,324.61,True,13,0,1,648,4,0,4,MERGED
12273,redis-cli: use previous hostip when not provided by redis cluster server,MakDon,2023-06-06T16:10:38Z,2023-07-20T22:31:07+00:00,6,1062.34,True,23,2,2,1191,10,5,15,MERGED
12272,Improve GETRANGE command behavior,linzihao1999,2023-06-06T15:13:41Z,2024-08-20T04:34:43+00:00,1,10573.35,True,17,14,2,1461,15,0,15,MERGED
12269,Allow cluster slots/shards api to respond during loading,hpatro,2023-06-05T21:32:11Z,2023-06-13T15:16:32+00:00,3,185.74,True,8,2,4,115,1,0,1,MERGED
12257,Rewrite huge printf calls to smaller ones for readability,zuiderkwast,2023-06-02T16:01:21Z,2023-09-28T06:21:23+00:00,11,2822.33,True,476,492,5,415,24,5,29,MERGED
12254,Refresh deps/hiredis to latest (unreleased) version.,yossigo,2023-06-01T10:57:05Z,2023-06-06T03:40:44+00:00,2,112.73,True,2561,308,42,103,2,0,2,MERGED
12253,Use std=gnu11 instead of std=c11.,yossigo,2023-06-01T08:52:00Z,2023-06-05T09:11:31+00:00,1,96.33,True,2,2,1,187,3,0,3,MERGED
12250,use embedded string object and more efficient ll2string for long long value convert to string,judeng,2023-05-31T09:56:16Z,2023-06-20T12:14:45+00:00,22,482.31,True,41,113,6,597,9,7,16,MERGED
12249,Document aof-disable-auto-gc in redis.conf,sonicloong,2023-05-31T04:59:32Z,2023-06-27T03:59:11+00:00,2,646.99,False,4,0,1,174,9,0,9,CLOSED
12247,Reset command duration for rejected command.,YaacovHazan,2023-05-30T08:29:44Z,2023-06-11T20:12:05+00:00,1,299.71,True,20,0,2,388,1,0,1,MERGED
12244,Fix outdated LFU comments to eliminate confusion,enjoy-binbin,2023-05-29T15:28:27Z,2023-12-06T18:46:57+00:00,11,4587.31,True,13,15,1,233,0,5,5,MERGED
12243,Fix GETEX db delete call to emit DB_FLAG_KEY_EXPIRED on expiration,enjoy-binbin,2023-05-29T11:21:52Z,2023-05-29T12:39:32+00:00,1,1.29,True,1,2,1,96,3,0,3,MERGED
12242,flushSlavesOutputBuffers should not write to replicas scheduled to drop,oranagra,2023-05-29T11:00:45Z,2023-06-12T11:05:35+00:00,3,336.08,True,25,11,4,289,1,0,1,MERGED
12241,Avoid trying to trim string loaded from RDB file.,oranagra,2023-05-29T09:17:15Z,2023-05-30T07:43:26+00:00,1,22.44,True,9,3,3,75,1,0,1,MERGED
12238,[BUG] Incorrect error msg for XREAD command,hwware,2023-05-26T20:03:59Z,2023-05-28T05:37:32+00:00,2,33.56,True,11,2,2,539,0,1,1,MERGED
12237,enable malloc_usable_size on haiku and dragonflybsd.,devnexen,2023-05-26T15:55:05Z,2023-05-28T05:44:28+00:00,1,37.82,True,5,1,2,0,0,0,0,MERGED
12235,Add new loglevel nothing to sentinel-config.json,enjoy-binbin,2023-05-26T02:30:55Z,2023-05-26T06:12:23+00:00,1,3.69,True,3,0,1,449,1,0,1,MERGED
12234,Support maxiov per connection type,pizhenwei,2023-05-25T08:58:32Z,2023-05-28T05:35:27+00:00,5,68.62,True,9,4,5,166,0,1,1,MERGED
12233,"Support TLS service when ""tls-cluster"" is not enabled and persist both plain and TLS port in nodes.conf",CharlesChen888,2023-05-25T07:06:56Z,2023-06-26T14:43:38+00:00,36,775.61,True,334,96,9,2041,11,24,35,MERGED
12231,hiding the password when use the '-a',polaris-alioth,2023-05-25T01:07:28Z,2024-03-06T11:09:13+00:00,1,6874.03,False,4,0,2,95,7,0,7,CLOSED
12229,Try lazyfree temp zset in ZUNION / ZINTER / ZDIFF and optimize ZINTERCARD to avoid create temp zset,enjoy-binbin,2023-05-24T15:29:50Z,2023-05-29T06:55:17+00:00,9,111.42,True,15,7,2,355,0,1,1,MERGED
12227,CI to validate commands.def is up to date,oranagra,2023-05-24T10:34:13Z,2023-05-24T13:21:19+00:00,1,2.79,True,12,4,2,42,0,0,0,MERGED
12224,Add dummy CLUSTER SLAVES call tests to fix reply ci,enjoy-binbin,2023-05-24T04:05:42Z,2023-05-24T06:28:39+00:00,1,2.38,True,14,0,2,346,0,0,0,MERGED
12223,Sync the new loglevel nothing to sentinel,enjoy-binbin,2023-05-24T02:59:51Z,2023-05-24T06:32:39+00:00,1,3.55,True,12,4,3,257,0,0,0,MERGED
12220,Fix WAIT for clients being blocked in a module command,oranagra,2023-05-23T13:26:01Z,2023-05-28T07:10:52+00:00,7,113.75,True,86,0,4,564,2,1,3,MERGED
12219,Add ability for modules to know which client is being cmd filtered,sjpotter,2023-05-23T13:07:55Z,2023-06-20T06:03:53+00:00,6,664.93,True,63,1,4,178,16,2,18,MERGED
12218,fix typo in db.c comment,mojh7,2023-05-23T10:15:19Z,2023-05-24T22:03:17+00:00,1,35.8,True,1,1,1,32,0,0,0,MERGED
12212,Make a light weight version (default) of DEBUG HTSTATS,oranagra,2023-05-22T13:31:36Z,2023-05-24T13:27:44+00:00,5,47.94,True,39,17,3,336,3,1,4,MERGED
12209,improve performance for scan command when matching pattern or data type,judeng,2023-05-22T09:37:14Z,2023-06-27T13:43:46+00:00,69,868.11,True,352,118,5,2155,28,37,65,MERGED
12205,Optimize HRANDFIELD and ZRANDMEMBER case 3 when listpack encoded,enjoy-binbin,2023-05-19T16:47:18Z,2023-05-22T12:48:33+00:00,6,68.02,True,48,32,4,6589,13,3,16,MERGED
12198,"Adding test case for hvals, hkeys, hexists against wrong type",hwware,2023-05-18T19:52:11Z,2023-05-24T06:34:13+00:00,2,130.7,True,4,1,1,97,1,1,2,MERGED
12197,Correct get_proc_stat_ll comment,junezqj,2023-05-18T14:25:59Z,2024-03-06T11:05:19+00:00,1,7028.66,False,1,1,1,16,1,0,1,CLOSED
12194,Try to fix SENTINEL SIMULATE-FAILURE test by re-source init-tests before each test,enjoy-binbin,2023-05-18T03:47:41Z,2023-05-29T10:43:27+00:00,1,270.93,True,7,1,1,910,16,0,16,MERGED
12192,replica redirect read&write to master in standalone mode,soloestoy,2023-05-17T12:03:32Z,2024-11-20T05:46:44+00:00,25,13265.72,False,57,8,7,614,52,4,56,CLOSED
12187,Add BITFIELD_RO basic tests for non-repl use cases,fadidahanna,2023-05-16T14:45:16Z,2023-05-18T09:16:46+00:00,1,42.52,True,12,2,1,182,0,0,0,MERGED
12185,"Performance improvement to ZADD and ZRANGESTORE, convert to skiplist and expand dict in advance",enjoy-binbin,2023-05-16T11:47:01Z,2023-05-18T12:24:47+00:00,13,48.63,True,82,12,2,1770,5,4,9,MERGED
12183,Fix for set max entries edge case in setTypeCreate / setTypeMaybeConvert,enjoy-binbin,2023-05-16T08:32:43Z,2023-05-16T18:32:21+00:00,5,9.99,True,57,10,3,944,0,2,2,MERGED
12179,Allow bigger tolerance in eventloop duration test.,CharlesChen888,2023-05-15T14:57:20Z,2023-06-11T06:02:41+00:00,1,639.09,True,2,2,1,238,0,0,0,MERGED
12178,Manage number of new connections per cycle,AshMosh,2023-05-15T13:56:10Z,2024-01-02T23:15:03+00:00,22,5577.31,True,30,4,7,777,32,8,40,MERGED
12177,improve performance for keys with expiration time,judeng,2023-05-15T12:22:56Z,2023-06-14T08:17:39+00:00,2,715.91,True,0,6,1,496,4,0,4,MERGED
12174,Improve moduleBlockClient timeout overflow handling,guybe7,2023-05-15T08:48:23Z,2023-06-21T09:48:14+00:00,1,889.0,True,13,5,1,89,0,0,0,MERGED
12173,Release Redis 7.2 RC2,oranagra,2023-05-15T06:55:03Z,2023-05-15T10:08:15+00:00,2,3.22,True,67005,31527,907,1747,0,0,0,MERGED
12171,Don't disconnect all clients in ACL LOAD,slavak,2023-05-14T12:20:07Z,2023-12-24T09:56:44+00:00,12,5373.61,True,185,72,4,315,2,12,14,MERGED
12169,"increase tolerance of new event loop test, fails on freebsd CI",oranagra,2023-05-14T06:08:56Z,2023-05-14T14:40:29+00:00,1,8.53,True,1,1,1,60,0,0,0,MERGED
12167,Fix bug: LPOS RANK LONG_ MIN causes overflow,ncghost1,2023-05-13T10:31:40Z,2023-05-14T06:04:33+00:00,2,19.55,True,2,1,2,179,0,0,0,MERGED
12166,"Exclude aux fields from ""cluster nodes"" and ""cluster replicas"" output",PingXie,2023-05-12T19:04:09Z,2023-05-23T15:32:38+00:00,6,260.47,True,17,36,6,258,8,2,10,MERGED
12158,Fix memory leak when RM_Call's RUN_AS_USER fails,sjpotter,2023-05-11T09:58:37Z,2023-05-23T11:29:28+00:00,8,289.51,True,20,21,1,383,0,1,1,MERGED
12156,fix moduleNotifyKeyUnlink to open the key with READ rather than WRITE,oranagra,2023-05-11T08:40:58Z,2023-05-11T15:16:08+00:00,1,6.59,True,1,1,1,30,0,0,0,MERGED
12155,Prevent repetitive backlog trimming,BCathcart,2023-05-10T21:27:07Z,2023-05-18T06:25:56+00:00,6,176.98,True,6,6,1,1240,2,2,4,MERGED
12152,"Correct COMMAND DOCS summary, like COMMAND INFO",enjoy-binbin,2023-05-09T14:49:26Z,2023-05-10T05:26:46+00:00,1,14.62,True,20,10,3,160,1,0,1,MERGED
12151,fix `GEORADIUS[BYMEMBER]` `STORE` & `STOREDIST` args spec,leibale,2023-05-09T06:34:39Z,2023-05-09T11:24:37+00:00,7,4.83,True,48,38,5,92,7,4,11,MERGED
12150,EXPIRE precision test more attempts and more tolerant,enjoy-binbin,2023-05-09T04:05:44Z,2023-05-09T11:14:23+00:00,1,7.14,True,8,6,1,498,0,0,0,MERGED
12148,Adding missing test case for smembers scard commands,hwware,2023-05-08T15:09:57Z,2023-05-16T16:26:49+00:00,1,193.28,True,6,2,1,105,0,0,0,MERGED
12144,Remove repetitive the,cuishuang,2023-05-08T09:03:21Z,2023-05-08T23:12:45+00:00,1,14.16,True,3,3,3,56,0,0,0,MERGED
12141,Fix defrag CI for 32bit after merge of jemalloc 5.3,oranagra,2023-05-08T05:33:52Z,2023-05-08T06:44:20+00:00,2,1.17,True,2,1,1,129,0,0,0,MERGED
12136,Correct zrangeGenericCommand comment,tisonkun,2023-05-06T16:20:38Z,2023-05-08T23:13:32+00:00,2,54.88,True,1,1,1,13,0,0,0,MERGED
12133,add a new loglevel 'nothing' to disable logging,soloestoy,2023-05-06T03:48:25Z,2023-05-23T15:30:44+00:00,3,419.71,True,3,0,3,463,6,1,7,MERGED
12129,Delete empty key if fails after moduleCreateEmptyKey() in module,sundb,2023-05-05T03:38:30Z,2023-05-07T07:13:19+00:00,2,51.58,True,107,6,4,299,0,1,1,MERGED
12126,Pause cron to prevent premature shrinking in querybuf test,enjoy-binbin,2023-05-04T06:44:39Z,2023-05-04T10:02:08+00:00,2,3.29,True,8,2,1,532,6,0,6,MERGED
12125,adding missing test cases GET and GETEX,hwware,2023-05-03T17:40:13Z,2023-05-07T08:46:11+00:00,2,87.1,True,8,0,1,63,0,0,0,MERGED
12123,multi.tcl: reset readraw at the end of the test,guybe7,2023-05-03T14:06:21Z,2023-05-04T08:58:31+00:00,5,18.87,True,3,3,1,246,0,2,2,MERGED
12119,Fix name of module API in documentation,madolson,2023-05-03T01:29:00Z,2023-05-03T17:35:28+00:00,2,16.11,True,1,1,1,109,0,0,0,MERGED
12117,[MINOR] Change the local buffer size values with macros to better readability.,hwware,2023-05-01T21:16:17Z,2023-05-08T14:39:26+00:00,5,161.39,False,2,2,1,141,0,2,2,CLOSED
12116,Updating missing test cases for Hash commands,hwware,2023-05-01T14:48:01Z,2023-05-01T18:00:08+00:00,1,3.2,True,9,2,1,106,0,0,0,MERGED
12115,Update jemalloc 5.3.0,oranagra,2023-05-01T14:36:20Z,2023-05-07T14:41:18+00:00,1,144.08,True,52038,20516,382,280,3,0,3,MERGED
12109,Rdb channel for full sync,naglera,2023-04-27T11:38:57Z,2024-09-05T09:56:28+00:00,120,11926.29,False,1781,89,15,470,8,111,119,CLOSED
12104,Update old Debian CI.,yossigo,2023-04-25T07:35:02Z,2023-04-25T11:09:38+00:00,2,3.58,True,1,1,1,271,2,0,2,MERGED
12088,Free backlog only if rsi is invalid when master reboot,soloestoy,2023-04-21T07:15:52Z,2023-05-06T03:53:28+00:00,3,356.63,True,40,5,2,750,1,0,1,MERGED
12083,"Minor change around the req-res validator, skip sentinel commands",guybe7,2023-04-20T14:37:14Z,2023-04-20T20:28:45+00:00,1,5.86,True,32,20,2,338,1,0,1,MERGED
12082,optimize spopwithcount propagation,ztxiuyuan,2023-04-20T12:08:50Z,2023-05-22T07:27:14+00:00,7,763.31,True,66,21,2,344,1,10,11,MERGED
12079,Add missing reply schema and coverage tests,enjoy-binbin,2023-04-20T07:01:27Z,2023-04-27T06:32:14+00:00,46,167.51,True,197,17,9,535,8,15,23,MERGED
12076,Fix typos,AussieSeaweed,2023-04-19T20:32:38Z,2023-04-20T08:50:29+00:00,2,12.3,True,4,4,3,0,0,0,0,MERGED
12070,adding missing test cases for decr decrby commands,hwware,2023-04-18T20:52:33Z,2023-04-19T06:55:56+00:00,1,10.06,True,11,0,1,245,0,0,0,MERGED
12068,"after calling aeSetDontWait from beforesleep, aeProcessEvent may be still wait once",CFlyGoo,2023-04-18T14:18:33Z,2023-04-23T14:02:09+00:00,12,119.73,True,22,27,1,258,6,5,11,MERGED
12067,Move startup system check to before daeomniztion and modules init,oranagra,2023-04-18T13:18:51Z,2023-04-19T06:23:47+00:00,1,17.08,True,28,24,1,248,0,0,0,MERGED
12065,Report AOF failure status to systemd in shutdown,enjoy-binbin,2023-04-18T10:35:07Z,2023-04-24T05:20:01+00:00,1,138.75,True,2,0,1,286,2,0,2,MERGED
12064,Tests: Do not save an RDB by default and add a SIGTERM default AOFRW test,enjoy-binbin,2023-04-18T09:53:53Z,2023-04-18T13:14:27+00:00,6,3.34,True,52,19,10,409,3,2,5,MERGED
12061,Adding missing test cases for getrange command,hwware,2023-04-17T16:38:44Z,2023-04-18T05:32:10+00:00,1,12.89,True,5,0,1,216,0,0,0,MERGED
12059,Update dict.c dict_can_resize comment,CFlyGoo,2023-04-17T12:07:36Z,2023-04-18T14:17:22+00:00,2,26.16,True,3,3,1,145,0,0,0,MERGED
12058,6.0.19,oranagra,2023-04-17T07:26:40Z,2023-04-17T12:54:33+00:00,1,5.46,True,302,23,13,293,0,0,0,MERGED
12057,6.2.12,oranagra,2023-04-17T07:25:12Z,2023-04-17T12:54:27+00:00,1,5.49,True,271,15,16,460,0,0,0,MERGED
12056,Redis 7.0.11,oranagra,2023-04-17T07:22:12Z,2023-04-17T12:54:04+00:00,1,5.53,True,209,47,16,499,0,0,0,MERGED
12051,Fix RDB check regression caused by PR 12022,joehu21,2023-04-16T16:15:31Z,2023-04-17T18:05:36+00:00,6,25.83,True,14,13,5,631,15,5,20,MERGED
12049,Tests: Do not save an RDB by default,guybe7,2023-04-16T09:08:03Z,2023-04-18T10:32:20+00:00,1,49.4,False,20,13,6,289,5,1,6,CLOSED
12045,Calc total allocations when using freeReplicationBacklogRefMemAsync,enjoy-binbin,2023-04-14T07:10:37Z,2023-04-16T12:58:54+00:00,2,53.8,False,1,3,1,316,0,1,1,CLOSED
12042,redis-cli - add option --count for scan,kell0gg,2023-04-14T05:04:02Z,2023-05-11T05:15:00+00:00,8,648.18,True,8,2,1,180,4,1,5,MERGED
12041,[BUG]  COMMAND GETKEYS and COMMAND GETKEYSANDFLAG returns error for CLUSTER subcommand KEYSLOT,hwware,2023-04-13T19:52:21Z,2023-04-17T10:16:30+00:00,5,86.4,False,28,6,3,881,1,4,5,CLOSED
12039,Added missing test cases for substring,hwware,2023-04-13T14:19:45Z,2023-04-13T18:48:26+00:00,2,4.48,True,3,0,1,160,2,0,2,MERGED
12036,improve performance of keys command by using static objects,judeng,2023-04-13T10:04:53Z,2023-04-16T10:02:47+00:00,1,71.97,True,4,5,1,61,1,0,1,MERGED
12035,Fix some compile warnings and errors when building with gcc-12 or clang,sundb,2023-04-13T08:59:41Z,2023-04-18T06:53:51+00:00,13,117.9,True,128,66,11,6166,8,12,20,MERGED
12029,Background Job Manager (BJM) - replacement for BIO,JimB123,2023-04-12T17:33:39Z,2024-04-23T15:30:28+00:00,11,9045.95,False,1154,571,24,2026,20,26,46,CLOSED
12025,iterate clients fairly in clientsCron(),soloestoy,2023-04-12T05:54:56Z,2023-04-24T06:01:40+00:00,1,288.11,True,3,4,1,672,6,0,6,MERGED
12024,Print IP and port on Possible SECURITY ATTACK detected,enjoy-binbin,2023-04-12T04:38:13Z,2023-04-13T01:23:00+00:00,1,20.75,True,7,1,1,151,1,0,1,MERGED
12023,Don't pass --fail-commands-not-all-hit to validator if we don't run the full testsuite,enjoy-binbin,2023-04-12T03:29:24Z,2023-04-12T09:23:51+00:00,3,5.91,True,105,3,1,309,1,1,2,MERGED
12022,Fix redis_check_rdb() hang when rdb is FIFO,joehu21,2023-04-11T18:24:47Z,2023-04-14T23:14:27+00:00,5,76.83,True,11,0,1,265,9,3,12,MERGED
12021,Add ZREMRANGEBYLEX basics tests to fix reply-schemas daily,enjoy-binbin,2023-04-11T04:48:58Z,2023-04-11T08:14:17+00:00,3,3.42,True,40,0,1,342,1,1,2,MERGED
12020,Remove prototypes with empty declarations,madolson,2023-04-11T01:58:31Z,2023-05-03T00:31:32+00:00,5,526.55,True,210,211,43,582,5,1,6,MERGED
12019,Minor performance improvement to SADD and HSET,madolson,2023-04-11T01:55:56Z,2023-05-08T23:11:20+00:00,24,669.26,True,39,7,3,2210,4,4,8,MERGED
12018,Updating reply_schema for sentinal commands,hwware,2023-04-10T20:39:23Z,2023-04-19T06:08:11+00:00,1,201.48,True,37,5,5,488,13,0,13,MERGED
12017,Update reply_schema details for info and hset commands json files accordingly. ,hwware,2023-04-10T19:31:49Z,2023-04-13T09:17:28+00:00,4,61.76,True,2,0,2,232,1,2,3,MERGED
12013,Attempt to solve MacOS CI issues in GH Actions,oranagra,2023-04-10T08:16:07Z,2023-04-12T06:19:21+00:00,6,46.05,True,143,109,22,1001,3,3,6,MERGED
12008,[New command] CLUSTER KEYSHARD key,hwware,2023-04-06T15:00:51Z,2023-11-20T21:09:36+00:00,5,5478.15,False,275,0,3,737,5,3,8,CLOSED
12004,Increase threshold for flaky cache reclaim test,oranagra,2023-04-04T12:54:09Z,2023-04-05T11:45:42+00:00,2,22.86,True,7,7,1,558,0,0,0,MERGED
12000,avoid incorrect shrinking of querybuf when client is reading a big argv,judeng,2023-04-03T11:13:29Z,2023-04-16T12:49:26+00:00,3,313.6,True,32,3,3,658,6,1,7,MERGED
11997,Changed activeExpireCycle server.masterhost check to iAmMaster in beforeSleep,enjoy-binbin,2023-04-03T09:08:03Z,2023-04-04T06:05:53+00:00,1,20.96,True,1,1,1,505,3,0,3,MERGED
11995,Add help message for client setinfo,yangbodong22011,2023-04-03T07:16:53Z,2023-04-04T12:56:34+00:00,2,29.66,True,4,0,1,400,2,1,3,MERGED
11992,Disconnect pub-sub subscribers when revoking `allchannels` permission,slavak,2023-04-02T09:38:46Z,2023-04-02T13:18:29+00:00,1,3.66,True,21,0,2,559,0,0,0,MERGED
11988,"CRC64 can be faster, if we want",josiahcarlson,2023-03-31T21:16:50Z,2024-03-27T17:35:08+00:00,15,8684.31,False,563,50,6,901,16,24,40,CLOSED
11987,Add 'count' option to the 'RANDOMKEY' command,hwware,2023-03-31T14:53:30Z,2024-03-23T22:32:33+00:00,3,8599.65,False,195,12,3,568,4,1,5,CLOSED
11982,Use dummy allocator to make accesses defined as per standard,sundb,2023-03-30T07:51:22Z,2023-04-10T17:38:41+00:00,30,273.79,True,118,37,6,4111,29,14,43,MERGED
11980,Fixtcl,Mixficsol,2023-03-30T00:53:52Z,2023-03-30T03:05:59+00:00,1,2.2,False,8,3,2,69,2,0,2,CLOSED
11975,redis-cli - handle sensitive command redaction for variadic CONFIG SET,hwware,2023-03-27T20:05:55Z,2023-04-02T16:19:45+00:00,6,140.23,True,9,6,1,417,1,1,2,MERGED
11974,"Fix parseScanCursorOrReply to reject empty strings instead of treating them the same as ""0""",Mixficsol,2023-03-26T17:59:35Z,2023-04-12T09:10:14+00:00,7,399.18,False,14,7,3,248,10,3,13,CLOSED
11973,Fix fork done handler wrongly update fsync metrics and enhance AOF_FSYNC_ALWAYS,enjoy-binbin,2023-03-26T14:06:50Z,2023-03-29T12:17:06+00:00,42,70.17,True,64,13,4,1559,6,13,19,MERGED
11971,Add COMMAND COUNT test to cover reply-schemas-validator test,enjoy-binbin,2023-03-25T02:56:56Z,2023-03-26T05:39:05+00:00,1,26.7,True,9,6,2,342,0,0,0,MERGED
11970,Fixed tracking of command duration for multi/eval/module/wait,madolson,2023-03-25T00:51:57Z,2023-03-30T02:58:52+00:00,16,122.12,True,14,1,5,1742,7,5,12,MERGED
11963,Add basic eventloop latency measurement.,CharlesChen888,2023-03-24T03:59:50Z,2023-05-12T17:13:16+00:00,80,1189.22,True,215,34,5,1155,24,52,76,MERGED
11962,Fix warning: a function declaration without a prototype,Rtoax,2023-03-24T02:45:21Z,2023-03-24T05:38:31+00:00,1,2.89,False,205,205,41,545,1,0,1,CLOSED
11961,Clang: fix for -flto argument,rafie,2023-03-23T15:00:27Z,2023-03-27T09:55:18+00:00,9,90.91,True,7,2,1,208,4,1,5,MERGED
11958,ignore latency errors in the schema validation CI,oranagra,2023-03-23T06:14:00Z,2023-03-23T08:49:09+00:00,2,2.59,True,2,2,1,145,0,0,0,MERGED
11945,[redis-benchmark] Adding --seed option to seed the RNG,hqkhan,2023-03-20T17:31:01Z,2023-05-02T13:20:38+00:00,9,1027.83,True,7,1,1,630,0,3,3,MERGED
11944,Optimize MSETNX to avoid double lookup,oranagra,2023-03-20T17:15:33Z,2023-05-28T07:58:30+00:00,7,1646.72,True,36,10,4,119,4,2,6,MERGED
11942,Overhauls command summaries and man pages.,itamarhaber,2023-03-20T16:24:03Z,2023-03-29T17:48:59+00:00,3,217.42,True,783,784,390,657,5,6,11,MERGED
11941,Release 7.0.10,oranagra,2023-03-20T13:20:29Z,2023-03-20T17:16:50+00:00,1,3.94,True,441,97,19,538,0,0,0,MERGED
11940,Avoid assertion when MSETNX is used with the same key twice (CVE-2023-28425),oranagra,2023-03-20T12:47:57Z,2023-03-20T16:50:45+00:00,2,4.05,True,10,3,2,118,0,0,0,MERGED
11939,Fix new subscribe mode test in reply-schemas-validator,enjoy-binbin,2023-03-20T08:46:58Z,2023-03-20T09:58:20+00:00,4,1.19,True,7,0,2,534,1,1,2,MERGED
11936,"update summary of lpop, lpushx, rpop, rpushx commands in json file",hwware,2023-03-17T20:11:28Z,2023-03-24T13:40:24+00:00,2,161.48,False,4,4,4,1005,4,1,5,CLOSED
11934,"Minor fix to print, set to str",enjoy-binbin,2023-03-17T10:20:04Z,2023-03-17T12:20:55+00:00,1,2.01,True,3,3,1,263,2,0,2,MERGED
11933,Fix cluster client connection lost,chenshi5012,2023-03-17T09:09:33Z,2023-04-10T01:22:51+00:00,1,568.22,False,7,1,1,84,1,0,1,CLOSED
11930,passwords printed in the crash log,polaris-alioth,2023-03-17T07:07:23Z,2023-03-20T06:18:39+00:00,2,71.19,True,6,0,1,912,1,0,1,MERGED
11926,Fix compile lto-wrapper warning for aarch64,Rtoax,2023-03-16T11:17:08Z,2023-03-17T16:23:07+00:00,1,29.1,True,1,1,1,597,4,0,4,MERGED
11923,Add RM_ReplyWithErrorFormat that can support format,enjoy-binbin,2023-03-15T16:13:57Z,2023-04-12T07:11:30+00:00,5,662.96,True,53,2,6,456,4,1,5,MERGED
11922,Fix WAITAOF mix-use last_offset and last_numreplicas,enjoy-binbin,2023-03-15T12:54:13Z,2023-03-15T16:16:16+00:00,3,3.37,True,86,5,3,530,0,2,2,MERGED
11917,Fix WAITAOF reply when using last_offset and last_numreplicas,enjoy-binbin,2023-03-15T05:14:08Z,2023-03-15T09:07:04+00:00,6,3.88,True,98,33,3,330,1,4,5,MERGED
11913,CLI hints based on command arg JSON,zuiderkwast,2023-03-14T14:27:50Z,2023-03-30T16:05:34+00:00,11,385.63,False,12015,9888,15,270,8,2,10,CLOSED
11911,"Bump codespell to 2.2.4, fix typos and outupdated comments",enjoy-binbin,2023-03-14T11:52:04Z,2023-03-16T06:50:32+00:00,1,42.97,True,23,24,12,39,1,0,1,MERGED
11910,Remove unnecessary `fsync` when sentinel flushs config file,ShooterIT,2023-03-14T03:22:44Z,2023-03-19T10:51:35+00:00,2,127.48,True,7,15,1,120,0,0,0,MERGED
11908,Bump codespell from 2.2.2 to 2.2.4 in /.codespell,dependabot,2023-03-13T15:59:06Z,2023-03-14T11:52:41+00:00,1,19.89,False,1,1,1,5728,2,0,2,CLOSED
11907,Add support for pubsub channel subscribers information,hpatro,2023-03-13T10:12:03Z,2023-07-11T17:06:23+00:00,26,2886.91,False,358,2,4,1575,20,33,53,CLOSED
11905,Fix tail->repl_offset update in feedReplicationBuffer,enjoy-binbin,2023-03-13T09:24:08Z,2023-03-13T14:12:29+00:00,1,4.81,True,19,6,3,1608,1,0,1,MERGED
11900,Fix race in sentinel manual failover test,enjoy-binbin,2023-03-10T06:48:46Z,2023-03-12T11:25:10+00:00,2,52.61,True,14,1,1,1466,0,0,0,MERGED
11895,Don't run command filter on blocked command reprocessing,sjpotter,2023-03-09T12:57:22Z,2023-03-20T06:04:14+00:00,10,257.11,True,59,4,3,351,11,5,16,MERGED
11892,Fix Uninitialised value error in createSparklineSequence (LATENCY GRAPH),enjoy-binbin,2023-03-09T08:39:48Z,2023-03-09T10:05:50+00:00,2,1.43,True,22,1,2,125,2,1,3,MERGED
11889,Document syslog directives in sentinel.conf.,fengtan,2023-03-08T15:28:07Z,2023-04-04T12:25:53+00:00,3,644.96,True,10,0,1,373,3,0,3,MERGED
11888,Add missing master_reboot flag in sentinel instance info,enjoy-binbin,2023-03-08T05:26:39Z,2023-03-21T15:13:31+00:00,2,321.78,True,2,0,1,41,6,0,6,MERGED
11887,Fix redis-cli cluster test timing issue,enjoy-binbin,2023-03-08T03:48:15Z,2023-03-26T05:46:59+00:00,4,433.98,True,1,1,1,341,1,1,2,MERGED
11885,Always compact nodes in stream listpacks,madolson,2023-03-07T03:06:59Z,2023-03-07T23:06:53+00:00,2,20.0,True,15,10,2,2318,1,0,1,MERGED
11884,Using fast_float library for faster parsing of 64 decimal strings.,filipecosta90,2023-03-06T23:44:23Z,2024-09-15T13:37:30+00:00,5,13405.89,True,3979,30,15,947,14,2,16,MERGED
11883,Solve race in CLIENT NO-TOUCH lru test,enjoy-binbin,2023-03-06T05:06:42Z,2023-03-07T13:27:09+00:00,1,32.34,True,1,1,1,523,3,0,3,MERGED
