number,title,author,createdAt,closedOrMergedAt,reviewsCount,hoursOpen,merged,additions,deletions,changedFiles,bodyLength,issueCommentsCount,reviewThreadsCount,interactionsCount,finalReviewState
8724,XAUTOCLAIM: JUSTID should prevent incrementing delivery_count,guybe7,2021-03-30T11:32:31Z,2021-03-30T20:48:02+00:00,1,9.26,True,3,1,1,44,0,0,0,MERGED
8723,"Fix ""default"" and overwritten / reset users will not have pubsub channels permissions by default.",huangzhw,2021-03-30T10:49:05Z,2021-04-05T20:13:20+00:00,9,153.4,True,50,7,5,1369,3,1,4,MERGED
8722,re-fix config rewrite for empty save directive,JunhuaY,2021-03-29T20:50:26Z,2021-03-30T19:49:06+00:00,1,22.98,True,9,1,2,394,11,0,11,MERGED
8720,solve race conditions in psync2-pingoff test,oranagra,2021-03-29T15:08:34Z,2021-03-30T08:41:06+00:00,1,17.54,True,15,3,1,572,0,0,0,MERGED
8717,zsetAdd: Fix wrong reply in case of INCR and GT/LT,guybe7,2021-03-29T14:17:37Z,2021-04-01T06:33:54+00:00,6,64.27,True,92,55,2,565,5,3,8,MERGED
8715,Restore old client 'processCommandAndResetClient' to fix false dead client indicator,MeirShpilraien,2021-03-29T08:05:24Z,2021-03-29T10:34:16+00:00,2,2.48,True,46,1,2,399,1,0,1,MERGED
8714,reuse existing range comparators in zslDeleteRangeByScore,wuYin,2021-03-29T04:52:21Z,2021-04-01T05:50:23+00:00,2,72.97,True,3,6,1,184,0,0,0,MERGED
8710,Sentinel: release the previous connection with the instance when setting password,yz1509,2021-03-27T12:56:39Z,2022-03-13T08:46:24+00:00,7,8419.83,False,182,0,2,725,9,3,12,CLOSED
8709,Use chi-square for random distributivity verification in test,sundb,2021-03-27T10:14:56Z,2021-04-01T05:20:15+00:00,6,115.09,True,33,13,4,436,10,4,14,MERGED
8707,Update redis conf,jlisam,2021-03-26T21:11:39Z,2021-04-21T10:51:53+00:00,1,613.67,True,12,12,1,94,0,0,0,MERGED
8705,fix redis-cli.c handling of rediss:// tlsscheme,stevelipinski,2021-03-26T17:59:56Z,2021-03-28T21:25:30+00:00,1,51.43,True,4,2,1,11,1,0,1,MERGED
8703,[Sentinel] sentinelFlushConfig avoid close to overwrite original errno,hwware,2021-03-26T15:40:21Z,2021-04-15T18:11:41+00:00,1,482.52,True,1,1,1,128,3,0,3,MERGED
8700,Replace dict's hash table with HAMT,zuiderkwast,2021-03-25T16:52:09Z,2024-08-27T06:49:43+00:00,14,30013.96,False,828,1100,14,4607,13,11,24,CLOSED
8699,Minor client output buffer optimizations,yoav-steinberg,2021-03-25T16:43:22Z,2021-03-30T20:06:29+00:00,2,123.39,True,18,8,1,115,1,1,2,MERGED
8692,Remove deprecated comments for saving expire time,ShooterIT,2021-03-25T07:24:54Z,2021-03-25T13:09:12+00:00,1,5.74,True,1,2,1,67,0,0,0,MERGED
8690,Fix misleading comment,hzzb,2021-03-24T17:23:02Z,2021-03-25T02:39:31+00:00,1,9.27,True,1,1,1,52,0,0,0,MERGED
8689,Introduce fast path to bypass expensive serveClientsBlockedOnKeyByModule call,igorwwwwwwwwwwwwwwwwwwww,2021-03-24T13:56:41Z,2021-03-25T14:16:03+00:00,6,24.32,True,4,0,1,720,10,1,11,MERGED
8688,Remove cron saving during BGSAVE test.,yoav-steinberg,2021-03-23T15:18:09Z,2021-03-24T13:14:47+00:00,1,21.94,True,1,1,1,197,4,0,4,MERGED
8687,Client eviction,yoav-steinberg,2021-03-23T14:51:16Z,2021-09-23T11:02:16+00:00,87,4412.18,True,1168,131,18,8429,9,48,57,MERGED
8685,Avoid evaluating log arguments when log filtered by level.,yoav-steinberg,2021-03-23T10:21:57Z,2021-03-24T06:22:12+00:00,1,20.0,True,10,5,2,0,3,0,3,MERGED
8683,Fix crash report killed by message,oranagra,2021-03-22T20:38:22Z,2021-03-24T06:33:24+00:00,5,33.92,True,1,1,1,437,0,2,2,MERGED
8682,[Sentinel] add missing flags in sentinel instance state representation ,hwware,2021-03-22T15:15:08Z,2021-03-22T18:13:31+00:00,1,2.97,True,2,0,1,231,0,0,0,MERGED
8681,Corrupt stream key access to uninitialized memory,oranagra,2021-03-22T12:57:48Z,2021-03-24T09:33:50+00:00,2,44.6,True,13,1,2,400,0,0,0,MERGED
8680,Cleanup: sentinelGetInstanceTypeString is unused.,huangzhw,2021-03-22T11:46:45Z,2021-03-22T14:13:25+00:00,1,2.44,True,0,7,1,111,0,0,0,MERGED
8679,Fix race in replication test,oranagra,2021-03-22T07:06:01Z,2021-03-22T08:50:39+00:00,1,1.74,True,4,2,1,203,1,0,1,MERGED
8678,improve error handing in anetFDToString to avoid returning successfully with garbage.,georgeanderson,2021-03-21T16:26:00Z,2021-05-11T11:27:09+00:00,4,1219.02,True,12,4,1,493,5,2,7,MERGED
8676,startLoading and stopLoading should be called in pairs.,huangzhw,2021-03-21T12:24:40Z,2021-03-22T07:18:56+00:00,1,18.9,True,1,1,1,447,4,0,4,MERGED
8674,fix race in diskless load cluster tests,oranagra,2021-03-21T06:35:45Z,2021-03-22T08:51:13+00:00,2,26.26,True,8,1,1,415,0,0,0,MERGED
8670,Fix: server will crash if rdbload or rdbsave method is not provided in module,OhBonsai,2021-03-19T04:19:40Z,2021-04-06T09:09:37+00:00,7,436.83,True,44,7,4,542,20,6,26,MERGED
8667,Fix the display of make install,yancz2000,2021-03-18T12:19:27Z,2021-04-10T18:25:53+00:00,2,558.11,True,14,3,1,304,3,0,3,MERGED
8666,Remove obsolete wait3() / wait4() and fix a valgrind warning in checkChildrenDone(),QuChen88,2021-03-17T21:29:00Z,2021-03-24T15:41:05+00:00,11,162.2,True,11,12,6,268,4,2,6,MERGED
8664,Add missed param LADDR ip:port in CLIENT KILL help.h,huangzhw,2021-03-17T11:29:18Z,2021-03-17T13:39:52+00:00,1,2.18,False,1,1,1,79,3,0,3,CLOSED
8662,Fixes for systems with 64-bit time,botovq,2021-03-17T06:24:31Z,2021-03-17T13:45:38+00:00,1,7.35,True,2,2,2,266,1,0,1,MERGED
8661,Fix script kill to work also on scripts that use pcall,MeirShpilraien,2021-03-16T19:46:08Z,2021-03-17T16:52:12+00:00,3,21.1,True,36,0,2,690,0,4,4,MERGED
8660,Cleanup: remove dead code from anet.,yossigo,2021-03-16T15:11:48Z,2021-03-17T10:52:24+00:00,1,19.68,True,0,80,2,192,4,0,4,MERGED
8659,Fix issue where error replies are not counted on stats,MeirShpilraien,2021-03-16T10:53:34Z,2021-03-16T12:49:59+00:00,1,1.94,True,11,3,1,357,3,0,3,MERGED
8658,Fix crash when hz config out of range,sundb,2021-03-16T05:35:38Z,2021-03-26T01:59:53+00:00,6,236.4,True,4,0,1,338,4,1,5,MERGED
8657,syncWithMaster: slaveTryPartialResynchronization split to send and receive,huangzhw,2021-03-16T01:29:15Z,2021-04-21T08:43:23+00:00,1,871.24,False,78,71,1,345,1,0,1,CLOSED
8655,Fix server won't start on alpine/libmusl without IPv6.,yossigo,2021-03-15T19:57:45Z,2021-03-16T09:20:03+00:00,2,13.37,True,5,4,1,326,2,0,2,MERGED
8654,Missing EXEC on modules propagation after failed EVAL execution,guybe7,2021-03-15T17:48:29Z,2021-03-15T19:19:57+00:00,2,1.52,True,62,4,4,719,0,1,1,MERGED
8653,Add replica-announced config option,fatpat,2021-03-15T15:53:30Z,2021-03-30T20:40:23+00:00,12,364.78,True,107,3,6,1194,5,7,12,MERGED
8651,resolve cluster failover timeout when master repl_offset is 0,linyi-xq,2021-03-15T11:40:03Z,2021-03-23T03:00:33+00:00,2,183.34,True,4,4,2,265,2,0,2,MERGED
8649,Tests for fixing cluster,funny-falcon,2021-03-15T08:05:59Z,2021-03-29T10:52:03+00:00,2,338.77,True,189,7,5,253,9,3,12,MERGED
8647,"When tests exit normally, some processes may still be alive",huangzhw,2021-03-15T04:27:23Z,2021-03-16T15:25:31+00:00,1,34.97,True,8,4,2,901,15,0,15,MERGED
8645,Fix slowdown due to child reporting CoW.,yossigo,2021-03-14T14:41:49Z,2021-03-22T11:25:58+00:00,9,188.74,True,53,12,4,400,1,3,4,MERGED
8644,Add support for reading encrypted keyfiles.,yossigo,2021-03-14T14:41:18Z,2021-03-22T11:27:46+00:00,4,188.77,True,53,4,5,11,1,1,2,MERGED
8640,Fix typo and outdated comments.,huangzhw,2021-03-13T06:46:14Z,2021-03-14T07:41:43+00:00,1,24.92,True,34,17,6,0,0,0,0,MERGED
8638,Fixes a typo in DEBUG HELP,itamarhaber,2021-03-12T14:38:11Z,2021-03-24T09:11:38+00:00,2,282.56,True,1,1,1,0,0,0,0,MERGED
8633,Process hello command even if the default user has no permissions.,hpatro,2021-03-09T23:32:29Z,2021-03-11T05:19:36+00:00,4,29.79,True,11,3,2,238,2,1,3,MERGED
8632,Fix SLOWLOG for blocked commands,oranagra,2021-03-09T22:52:12Z,2021-03-25T08:20:28+00:00,5,369.47,True,72,49,6,1433,1,1,2,MERGED
8631,set module eviction context flag only in masters,oranagra,2021-03-09T21:16:48Z,2021-03-16T10:17:15+00:00,2,157.01,True,1,1,1,477,5,0,5,MERGED
8630,key miss stat increment was misplaced,oranagra,2021-03-09T21:08:48Z,2021-03-10T11:20:07+00:00,1,14.19,True,1,1,1,82,0,0,0,MERGED
8629,allow RESET during busy scripts,oranagra,2021-03-09T21:02:58Z,2021-03-11T05:52:28+00:00,1,32.83,True,1,0,1,79,1,0,1,MERGED
8628,strip % sign from current_fork_perc info field,oranagra,2021-03-09T20:55:57Z,2021-03-10T13:25:17+00:00,4,16.49,True,1,1,1,487,2,0,2,MERGED
8627,[Sentinel] fix potential NULL ptr issue for sentinel instance connection,hwware,2021-03-09T16:06:23Z,2021-03-16T10:23:19+00:00,1,162.28,True,8,4,1,241,2,0,2,MERGED
8626,Adds `LEN` to `STRALGO`'s comment,itamarhaber,2021-03-09T14:51:27Z,2021-03-10T14:19:48+00:00,2,23.47,True,1,1,1,25,0,0,0,MERGED
8625,Run daily workflows only on redis/redis repo.,hpatro,2021-03-09T09:03:08Z,2021-03-09T10:35:42+00:00,1,1.54,True,2,0,1,148,1,0,1,MERGED
8621,Sharded pubsub implementation,hpatro,2021-03-08T23:18:11Z,2022-01-03T00:54:47+00:00,73,7201.61,True,1343,106,28,2562,23,70,93,MERGED
8620,Fix memory info on FreeBSD.,yossigo,2021-03-08T18:53:32Z,2021-03-09T09:33:32+00:00,3,14.67,True,3,3,1,125,0,1,1,MERGED
8617,Fix some issues with modules and MULTI/EXEC ,guybe7,2021-03-08T13:33:19Z,2021-03-10T16:02:17+00:00,7,50.48,True,170,19,6,1687,1,4,5,MERGED
8616,Fix test false positive due to a race condition.,yossigo,2021-03-08T11:35:01Z,2021-03-08T19:22:08+00:00,2,7.79,True,6,0,1,0,0,0,0,MERGED
8615,Fix for benchmark output cannot ensure clean line,chimney-lee,2021-03-08T10:29:08Z,2021-03-09T12:50:04+00:00,1,26.35,True,4,1,1,1168,1,0,1,MERGED
8605,Remove some dead code,huangzhw,2021-03-05T00:58:37Z,2021-03-05T17:54:34+00:00,3,16.93,True,0,5,2,71,0,3,3,MERGED
8604,Wrong usage sdscatprintf in redis-cli.,yatsukhnenko,2021-03-04T20:20:15Z,2021-03-08T10:57:28+00:00,1,86.62,True,6,2,1,64,3,0,3,MERGED
8603,Fix FreeBSD <12.x builds.,yossigo,2021-03-04T19:31:54Z,2021-03-07T12:14:23+00:00,2,64.71,True,9,0,1,0,0,0,0,MERGED
8600,Fix typo in sentinel.c,yancz2000,2021-03-04T11:50:04Z,2021-03-05T17:32:11+00:00,1,29.7,True,1,1,1,0,0,0,0,MERGED
8597,remove unused latency variable,uriyage,2021-03-03T19:18:39Z,2021-03-05T17:29:52+00:00,2,46.19,True,0,1,1,33,0,0,0,MERGED
8596,Fix RedisModule_IsAOFClient Redis Module API,YaacovHazan,2021-03-03T19:04:05Z,2021-03-04T11:02:24+00:00,1,15.97,True,1,1,1,396,3,0,3,MERGED
8595,Update the location information in some URLs,yancz2000,2021-03-03T11:27:43Z,2021-04-06T09:29:02+00:00,1,814.02,True,3,3,3,27,1,0,1,MERGED
8592,Fix typo in t_stream.c,eltociear,2021-03-03T00:53:29Z,2021-03-16T14:41:45+00:00,2,325.8,True,1,1,1,23,0,0,0,MERGED
8590,[Sentinel] generalize error check for SENTINEL MONITOR rumtime config,hwware,2021-03-02T21:26:37Z,2021-03-03T06:36:08+00:00,1,9.16,True,1,11,1,165,0,0,0,MERGED
8589,Improve SSL cleanup handling.,yossigo,2021-03-02T16:15:32Z,2021-03-03T08:08:06+00:00,1,15.88,True,21,1,3,126,1,0,1,MERGED
8588,Fix client_recent_max_input/output_buffer in 'INFO CLIENTS' when all clients drop.,yoav-steinberg,2021-03-02T16:07:45Z,2021-03-03T07:36:28+00:00,1,15.48,True,24,22,1,397,1,0,1,MERGED
8587,Add support for plaintext clients in TLS cluster,zuiderkwast,2021-03-02T14:14:51Z,2021-03-30T20:11:32+00:00,19,677.94,True,143,44,10,759,18,5,23,MERGED
8585,Skip unnecessary check for pong received,madolson,2021-03-01T23:12:16Z,2021-03-25T02:37:38+00:00,2,555.42,True,0,1,1,327,5,0,5,MERGED
8584,Redact slowlog entries for config with sensitive data.,madolson,2021-03-01T22:23:51Z,2021-03-16T05:00:30+00:00,20,342.61,True,93,43,7,436,7,6,13,MERGED
8583,Fix potential replication-4 test race condition.,yossigo,2021-03-01T21:00:37Z,2021-03-02T16:12:11+00:00,2,19.19,True,10,6,1,159,2,0,2,MERGED
8580,Redis 6.2.1,oranagra,2021-03-01T17:19:12Z,2021-03-02T06:14:39+00:00,4,12.92,True,589,193,36,886,2,0,2,MERGED
8579,Fix errors when loading RDB with missing modules.,yossigo,2021-03-01T16:59:51Z,2021-03-02T07:39:37+00:00,1,14.66,True,15,5,3,11,0,0,0,MERGED
8578,Redis 6.0.12,oranagra,2021-03-01T16:14:06Z,2021-03-02T06:13:08+00:00,4,13.98,True,82,25,9,135,0,0,0,MERGED
8577,Redis 5.0.12,oranagra,2021-03-01T16:12:56Z,2021-03-02T06:11:52+00:00,3,13.98,True,12,6,3,135,0,0,0,MERGED
8570,Add run all test support with define REDIS_TEST,sundb,2021-03-01T05:45:47Z,2021-03-10T07:13:11+00:00,23,217.46,True,276,229,25,527,20,13,33,MERGED
8569,Remove unused parameter container in quicklist,sundb,2021-03-01T03:17:24Z,2021-03-01T10:39:32+00:00,1,7.37,False,9,16,2,276,1,0,1,CLOSED
8568,fix stream deep sanitization with deleted records,oranagra,2021-02-28T16:22:58Z,2021-03-01T15:23:29+00:00,1,23.01,True,4,1,3,188,0,0,0,MERGED
8567,Sentinel: fix info_refresh time before sentinel get first response,hwware,2021-02-26T16:01:56Z,2021-03-11T20:28:21+00:00,1,316.44,True,6,3,1,468,0,0,0,MERGED
8566,Improve redis-cli non-binary safe string handling.,yossigo,2021-02-26T13:25:55Z,2021-03-04T13:03:49+00:00,8,143.63,True,113,44,2,607,6,12,18,MERGED
8565,remove redundant check for evalCommand,uriyage,2021-02-26T12:35:08Z,2021-03-09T19:57:14+00:00,4,271.37,True,4,8,1,122,0,1,1,MERGED
8564,Add GetAbsExpire/SetAbsExpire for module,chenyang8094,2021-02-26T03:36:32Z,2021-03-24T09:10:15+00:00,17,629.56,True,35,1,2,672,1,3,4,MERGED
8562,Avoid hello command to be persisted in cli history file.,hpatro,2021-02-25T20:25:58Z,2021-05-18T07:27:10+00:00,1,1955.02,False,13,3,1,135,9,0,9,CLOSED
8560,fix: call CLIENT INFO from redis module will crash the server,OhBonsai,2021-02-25T15:03:26Z,2021-03-01T06:18:14+00:00,2,87.25,True,5,1,2,493,2,0,2,MERGED
8559,Cleanup ZADD_* flags,guybe7,2021-02-25T14:13:31Z,2021-03-10T14:09:43+00:00,5,311.94,True,67,78,3,294,0,1,1,MERGED
8557,Moved requipreass and querybuf length to generic configs,madolson,2021-02-25T03:39:20Z,2021-02-26T05:00:27+00:00,5,25.35,True,31,80,4,502,1,3,4,MERGED
8555,"Make dbid check for SWAPDB command consistent with SELECT, MOVE, and COPY",QuChen88,2021-02-25T01:46:35Z,2021-03-01T05:54:52+00:00,3,100.14,True,4,4,1,180,0,0,0,MERGED
8554,Cleanup usage of malloc_usable_size.,yossigo,2021-02-24T20:40:58Z,2021-02-25T07:24:41+00:00,9,10.73,True,53,5,3,327,2,3,5,MERGED
8553,Fix div by 0 in redis-cli cluster creation,yatsukhnenko,2021-02-24T19:50:06Z,2021-02-28T13:28:09+00:00,14,89.63,True,1,1,1,319,0,2,2,MERGED
8552,Allow stopped redis processes to be killed,madolson,2021-02-24T18:13:12Z,2021-02-24T22:26:16+00:00,1,4.22,True,4,0,2,228,3,0,3,MERGED
8551,redis-cli prompt: fix db number and transaction state inconsistencies after reconnect,hwware,2021-02-24T16:23:07Z,2021-02-25T18:08:24+00:00,3,25.75,True,3,0,1,434,0,1,1,MERGED
8550,XTRIM: Parse args before lookupKey,guybe7,2021-02-24T12:46:28Z,2021-02-24T14:41:50+00:00,1,1.92,True,5,5,1,57,0,0,0,MERGED
8549,XTRIM should take at least 4 args,guybe7,2021-02-24T12:41:27Z,2021-02-24T14:41:00+00:00,1,1.99,True,1,1,1,0,0,0,0,MERGED
8544,Use addReplyErrorObject with shared.noscripterr,sundb,2021-02-24T05:43:10Z,2021-02-24T16:45:13+00:00,1,11.03,True,15,2,2,93,0,0,0,MERGED
8541,Optimize CLUSTER SLOTS reply by reducing unneeded loops,KinWaiYuen,2021-02-24T02:14:31Z,2021-03-12T06:40:35+00:00,13,388.43,True,51,58,2,44,7,13,20,MERGED
8536,Fix race in CONFIG REWRITE sanity,guybe7,2021-02-23T12:32:07Z,2021-02-23T18:28:03+00:00,1,5.93,True,1,1,1,59,0,0,0,MERGED
8535,In luaRedisGenericCommand check channel return is ACL_DENIED_CHANNEL,huangzhw,2021-02-23T12:16:41Z,2021-02-24T00:55:10+00:00,1,12.64,True,1,1,1,89,0,0,0,MERGED
8534,make processCommand check publish channel permissions.,huangzhw,2021-02-23T12:07:51Z,2021-03-26T11:10:02+00:00,11,743.04,True,55,33,7,481,17,4,21,MERGED
8533,Fix compile errors with no HAVE_MALLOC_SIZE.,yossigo,2021-02-23T11:28:02Z,2021-02-23T15:08:49+00:00,2,3.68,True,23,6,2,11,2,0,2,MERGED
8532,Fix failed tests on Linux Alpine and add a CI job.,yossigo,2021-02-23T09:49:19Z,2021-02-23T10:57:46+00:00,2,1.14,True,36,18,5,11,0,1,1,MERGED
8528,Release 5.0.11,oranagra,2021-02-22T15:21:04Z,2021-02-22T21:22:53+00:00,5,6.03,True,396,46,17,1188,0,1,1,MERGED
8527,Release 6.0.11,oranagra,2021-02-22T14:36:31Z,2021-02-22T23:35:37+00:00,3,8.98,True,507,64,24,1219,0,0,0,MERGED
8525,Redis 6.2.0 GA,oranagra,2021-02-22T13:57:55Z,2021-02-22T21:23:58+00:00,3,7.43,True,1853,653,89,2549,0,0,0,MERGED
8522,Fix integer overflow. (CVE-2021-21309),yossigo,2021-02-22T10:06:41Z,2021-02-22T13:41:32+00:00,3,3.58,True,14,1,3,352,0,1,1,MERGED
8521,Module api support for RESP3,ashtul,2021-02-22T09:14:01Z,2021-08-03T08:37:19+00:00,40,3887.39,True,486,39,6,303,4,21,25,MERGED
8520,Remove race condition and consistency issues with client pause threaded IO,madolson,2021-02-22T04:32:25Z,2021-02-22T21:05:00+00:00,7,16.54,True,37,10,3,485,1,4,5,MERGED
8519,Fix overflow check of expire time,sundb,2021-02-22T02:17:49Z,2021-02-22T06:45:26+00:00,1,4.46,True,2,2,1,84,2,0,2,MERGED
8517,Fix allowed length for REPLCONF ip-address.,yossigo,2021-02-20T20:46:17Z,2021-02-21T09:22:36+00:00,1,12.61,True,27,25,4,240,0,0,0,MERGED
8516,Shared reusable client for RM_Call(),zuiderkwast,2021-02-19T20:31:32Z,2021-02-28T12:11:18+00:00,1,207.66,True,43,11,4,295,4,0,4,MERGED
8515,"dict: pause rehash, minor readability refactor",JimB123,2021-02-19T18:08:26Z,2021-02-20T10:56:31+00:00,1,16.8,True,14,14,2,619,0,0,0,MERGED
8513,Fix timing error oom-score-adj test,sundb,2021-02-19T03:11:01Z,2021-02-19T11:01:25+00:00,2,7.84,True,6,1,1,293,2,1,3,MERGED
8510,"Make port, tls-port and bind configurations modifiable",YaacovHazan,2021-02-18T20:24:09Z,2021-03-01T14:04:44+00:00,13,257.68,True,282,56,8,278,1,9,10,MERGED
8508,Module API for getting user name of a client,OhBonsai,2021-02-18T09:12:00Z,2021-02-28T12:36:37+00:00,21,243.41,True,25,0,2,389,8,5,13,MERGED
8505,solve valgrind warning in child_info,oranagra,2021-02-17T08:22:08Z,2021-02-17T10:30:29+00:00,1,2.14,True,5,4,1,88,0,0,0,MERGED
8504,"SRANDMEMBER RESP3 return should be Array, not Set",hwware,2021-02-16T20:00:40Z,2021-02-22T13:00:59+00:00,3,137.01,True,23,5,3,521,17,1,18,MERGED
8497,"minor test suite cleanup, revive old test",oranagra,2021-02-15T14:07:39Z,2021-02-15T15:20:03+00:00,1,1.21,True,2,3,2,484,0,0,0,MERGED
8495,http -> https,cheese1,2021-02-15T13:51:22Z,2021-03-10T17:11:16+00:00,6,555.33,True,14,14,6,0,1,1,2,MERGED
8493,3 optimizations: ziplist in-place replace and some trivial ones,zuiderkwast,2021-02-15T10:46:38Z,2021-02-16T11:01:14+00:00,7,24.24,True,84,16,5,313,0,2,2,MERGED
8492,Escape unsafe field name characters in INFO.,yossigo,2021-02-15T09:49:26Z,2021-02-15T15:08:53+00:00,5,5.32,True,79,5,9,11,1,2,3,MERGED
8491,solve race in replication-2 test - again,oranagra,2021-02-15T07:04:57Z,2021-02-15T10:50:23+00:00,1,3.76,True,7,3,1,201,0,0,0,MERGED
8488,Cleanup: dictEncObjHash remove redundant conditional statement,huangzhw,2021-02-13T09:37:23Z,2021-03-07T16:09:12+00:00,2,534.53,True,7,14,1,76,6,0,6,MERGED
8486,redis-benchmark: Fix broken protocol when used with -a or --dbnum,filipecosta90,2021-02-12T15:09:39Z,2021-02-14T12:42:42+00:00,1,45.55,True,3,0,1,316,0,0,0,MERGED
8483,Remove acl subcommand validation if fully added command exists.,hpatro,2021-02-11T19:53:43Z,2021-02-22T13:22:25+00:00,7,257.48,True,22,19,2,1123,1,4,5,MERGED
8482,Fix errors with sentinel leaked fds test.,yossigo,2021-02-11T11:27:58Z,2021-02-11T13:25:02+00:00,2,1.95,True,18,9,2,196,1,1,2,MERGED
8481,Fix duplicate replicas issue.,yossigo,2021-02-11T08:30:50Z,2021-02-11T09:50:48+00:00,2,1.33,True,18,11,1,187,0,1,1,MERGED
8480,Fix Sentinel configuration rewrite.,yossigo,2021-02-10T14:47:58Z,2021-02-10T16:38:11+00:00,1,1.84,True,2,2,1,139,5,0,5,MERGED
8479,Removed time sensitive checks from block on background tests during leak checks,filipecosta90,2021-02-09T22:53:14Z,2021-02-10T06:59:07+00:00,1,8.1,True,40,19,4,250,0,0,0,MERGED
8475,"Cleanup in redis-cli and tests: release memory on exit, change dup test name",trevor211,2021-02-09T05:50:04Z,2021-02-09T10:36:10+00:00,7,4.77,True,17,6,2,137,0,2,2,MERGED
8474,Always replicate TTLs as absolute timestamps in milliseconds,ny0312,2021-02-08T23:37:08Z,2021-05-30T06:20:32+00:00,60,2646.72,True,390,214,10,2796,14,27,41,MERGED
8472,Remove redundant pubsub list to store the patterns.,hpatro,2021-02-08T18:22:47Z,2021-02-17T22:13:50+00:00,1,219.85,True,11,46,5,244,1,0,1,MERGED
8471,Adds code of conduct,itamarhaber,2021-02-08T14:12:13Z,2021-02-09T12:38:09+00:00,3,22.43,True,96,0,1,14,4,0,4,MERGED
8470,Increasing block on background timeout time to avoid nightly test failure,filipecosta90,2021-02-08T12:47:02Z,2021-02-08T14:24:01+00:00,1,1.62,True,3,3,1,328,1,0,1,MERGED
8469,Fix and cleanup Sentinel leaked fds test.,yossigo,2021-02-08T11:45:46Z,2021-02-08T15:02:47+00:00,9,3.28,True,91,36,5,285,3,4,7,MERGED
8464,Remove redundant pubsub list to store the patterns.,hpatro,2021-02-08T00:57:38Z,2021-02-08T18:06:56+00:00,1,17.16,False,122,104,21,244,0,1,1,CLOSED
8460,Update CI on Ubuntu to tcl8.6 (since 20.04 is now used),oranagra,2021-02-07T12:37:51Z,2021-02-07T13:41:50+00:00,1,1.07,True,7,7,2,139,0,0,0,MERGED
8458,Fix compliation on arm64 Mac with jemalloc,dgilman,2021-02-07T08:25:10Z,2021-03-01T06:15:26+00:00,5,525.84,True,4,0,1,240,0,1,1,MERGED
8456,Client tracking tracking-redir-broken push len is 2 not 3,huangzhw,2021-02-07T01:31:31Z,2021-02-21T07:34:47+00:00,10,342.05,True,87,39,3,800,1,7,8,MERGED
8454,Fixes compiler warning on implicit declaration of function nanosleep,filipecosta90,2021-02-05T16:42:21Z,2021-02-05T17:51:32+00:00,1,1.15,True,3,3,1,466,0,0,0,MERGED
8453,RM_ZsetRem: Delete key if empty,zuiderkwast,2021-02-05T13:06:27Z,2021-02-05T17:54:02+00:00,1,4.79,True,50,0,5,101,1,0,1,MERGED
8449,Fix typo and some comments,huangzhw,2021-02-04T10:42:45Z,2021-02-08T17:29:33+00:00,4,102.78,True,13,15,9,27,1,1,2,MERGED
8446,"Modules: In RM_HashSet, add COUNT_ALL flag and set errno",zuiderkwast,2021-02-04T08:50:14Z,2021-02-15T09:40:05+00:00,19,264.83,True,155,11,6,220,9,6,15,MERGED
8445,GEOSEARCH bybox bug fixes and new fuzzy tester,yangbodong22011,2021-02-04T07:27:34Z,2021-02-04T16:08:36+00:00,11,8.68,True,225,60,4,477,2,5,7,MERGED
8444,Optimize HRANDFIELD and ZRANDMEMBER case 4 when ziplist encoded,oranagra,2021-02-03T20:02:22Z,2021-02-07T14:55:11+00:00,5,90.88,True,129,44,4,575,2,1,3,MERGED
8442,Modules API docs: Sections and links,zuiderkwast,2021-02-03T09:07:45Z,2021-04-13T21:58:05+00:00,10,1668.84,True,259,67,2,395,11,9,20,MERGED
8439,Modules: Add remaining list API functions,zuiderkwast,2021-02-02T12:07:46Z,2021-09-14T14:48:06+00:00,30,5378.67,True,635,22,10,1020,19,17,36,MERGED
8438,Fix FreeBSD Daily issues.,yossigo,2021-02-02T11:15:07Z,2021-02-03T15:35:29+00:00,4,28.34,True,16,19,4,441,2,4,6,MERGED
8436,XINFO should use lookupKeyReadOrReply,soloestoy,2021-02-02T03:03:58Z,2021-02-02T08:51:20+00:00,1,5.79,True,1,1,1,154,2,0,2,MERGED
8435,cluster failover will timeout if master repl_offset is 0,linyi-xq,2021-02-02T02:43:28Z,2021-03-23T02:57:00+00:00,2,1176.23,False,4,4,2,162,9,0,9,CLOSED
8431,Cleanup: addReplyAggregateLen and addReplyBulkLen remove redundant check,huangzhw,2021-02-01T10:58:49Z,2021-02-02T08:54:20+00:00,1,21.93,True,2,8,1,173,1,0,1,MERGED
8429,"RAND* commands: fix risk of OOM panic in hash and zset, use fair random in hash, and add tests for even distribution to all",sundb,2021-02-01T03:07:59Z,2021-02-05T13:56:20+00:00,10,106.81,True,141,36,7,336,23,7,30,MERGED
8427,6.2 RC3,oranagra,2021-01-31T15:54:35Z,2021-02-01T18:11:42+00:00,9,26.29,True,6051,921,91,2103,0,2,2,MERGED
8425,temporarily disable sentinel test FD leak print,oranagra,2021-01-31T07:44:45Z,2021-01-31T10:14:37+00:00,1,2.5,True,2,2,1,142,0,0,0,MERGED
8424,Fix test issues from introduction of HRANDFIELD,oranagra,2021-01-30T18:30:57Z,2021-01-31T10:13:45+00:00,1,15.71,True,22,1,3,422,1,0,1,MERGED
8422,fix sentinel  announces hostnames test error,hwware,2021-01-29T21:36:39Z,2021-01-30T09:18:59+00:00,1,11.71,True,8,3,1,628,4,0,4,MERGED
8419,Handle remaining fsync errors,ShooterIT,2021-01-29T03:32:11Z,2021-04-01T09:45:15+00:00,12,1494.22,True,53,16,7,739,2,4,6,MERGED
8417,Update CLIENT HELP regarding KILL options.,yossigo,2021-01-28T16:35:57Z,2021-01-28T18:49:47+00:00,2,2.23,True,4,2,1,88,1,0,1,MERGED
8416,Add --insecure option to command line tools.,yossigo,2021-01-28T13:02:27Z,2021-02-07T10:36:57+00:00,2,237.57,True,11,1,4,223,0,0,0,MERGED
8414,Add child current processed keys to persistence info,uriyage,2021-01-28T10:17:50Z,2021-02-16T14:06:52+00:00,27,459.82,True,134,80,8,190,19,19,38,MERGED
8411,Moved most static strings into the shared structure,madolson,2021-01-28T06:52:43Z,2021-02-09T19:52:28+00:00,2,301.0,True,61,80,11,655,0,0,0,MERGED
8409,Send the readiness notification when we are ready to accept connections,guillemj,2021-01-27T22:49:57Z,2021-03-14T06:46:26+00:00,2,1087.94,True,4,6,2,835,2,0,2,MERGED
8405,Avoid assertions when testing arm64 cow bug.,yossigo,2021-01-27T12:59:32Z,2021-01-28T08:33:46+00:00,3,19.57,True,68,33,1,321,0,1,1,MERGED
8403,Fix in activeDefragSdsListAndDict update de->v.val not ln->value,huangzhw,2021-01-27T11:42:36Z,2021-01-27T16:56:43+00:00,1,5.24,True,1,1,1,198,1,0,1,MERGED
8398,Remove check leading to duplicate branches,vmaksimovski,2021-01-26T03:36:43Z,2021-01-26T04:58:04+00:00,3,1.36,True,5,6,1,350,0,1,1,MERGED
8397,Add proc-title-template option.,yossigo,2021-01-25T22:32:32Z,2021-01-28T16:17:40+00:00,14,65.75,True,244,12,7,352,11,6,17,MERGED
8394,latency: add expire-del event,soloestoy,2021-01-25T11:33:42Z,2021-01-26T01:45:54+00:00,1,14.2,True,4,0,1,0,3,0,3,MERGED
8391,Add tests for RESP3 responce of ZINTER and ZRANGE,oranagra,2021-01-24T14:28:24Z,2021-01-26T15:55:33+00:00,1,49.45,True,19,0,3,215,3,0,3,MERGED
8390,In XADD take deleted items into consideration when switch to new node,huangzhw,2021-01-24T12:38:00Z,2021-02-22T13:08:16+00:00,2,696.5,True,3,1,1,129,3,1,4,MERGED
8389,Update inline help in redis-cli,valentinogeron,2021-01-24T12:00:06Z,2021-01-26T17:34:57+00:00,1,53.58,False,115,25,1,0,2,0,2,CLOSED
8386,Fix recent test failures,oranagra,2021-01-23T16:47:11Z,2021-01-23T19:53:59+00:00,1,3.11,True,5,4,2,155,1,0,1,MERGED
8381,In dbOverwrite moduleNotifyKeyUnlink should use old val,huangzhw,2021-01-22T06:19:57Z,2021-01-22T07:37:25+00:00,1,1.29,True,1,1,1,121,0,0,0,MERGED
