number,title,author,createdAt,closedOrMergedAt,reviewsCount,hoursOpen,merged,additions,deletions,changedFiles,bodyLength,issueCommentsCount,reviewThreadsCount,interactionsCount,finalReviewState
10249,Add check min-slave-* feature when evaluating Lua scripts for 6.2,noradomi,2022-02-07T10:30:30Z,2022-04-11T09:59:28+00:00,1,1511.48,True,29,9,2,230,17,0,17,MERGED
10248,Remove assert and refuse delete expired on ro replicas,zuiderkwast,2022-02-07T08:10:38Z,2022-02-08T11:19:27+00:00,3,27.15,True,10,10,1,480,0,1,1,MERGED
10247,add test suite infra to test RESP3 attributes,oranagra,2022-02-06T19:58:32Z,2022-02-06T22:10:05+00:00,1,2.19,True,17,6,2,145,0,0,0,MERGED
10246,Supplement define guards to prevent multiple inclusion,liwg06,2022-02-06T14:58:55Z,2022-02-07T04:13:34+00:00,1,13.24,True,5,0,1,42,0,0,0,MERGED
10243,Fix PSYNC crash with wrong offset,enjoy-binbin,2022-02-06T08:48:41Z,2022-02-06T11:13:56+00:00,1,2.42,True,10,9,1,693,2,0,2,MERGED
10241,fix file permissions for scripts in utils folder,oranagra,2022-02-05T15:03:17Z,2022-02-05T16:40:09+00:00,1,1.61,True,2,0,2,36,0,0,0,MERGED
10240,Update FCALL/FCALL_RO summary and complexity,enjoy-binbin,2022-02-05T04:38:05Z,2022-02-05T08:35:08+00:00,1,3.95,True,8,8,4,66,0,0,0,MERGED
10237,Handle key-spec flags with modules,oranagra,2022-02-04T19:45:32Z,2022-02-08T08:01:35+00:00,17,84.27,True,319,80,12,369,6,14,20,MERGED
10236,Fix protocol error caused by redis-benchmark,ivanstosic-janea,2022-02-04T16:19:32Z,2022-02-07T20:57:11+00:00,8,76.63,True,3,0,1,256,6,1,7,MERGED
10231,Fix cluster tests failing due to subcommand names,enjoy-binbin,2022-02-04T01:51:00Z,2022-02-04T09:32:30+00:00,1,7.69,True,4,6,1,20,1,0,1,MERGED
10229,Add 'Available since' to module API function docs,zuiderkwast,2022-02-02T18:33:07Z,2022-02-03T08:25:37+00:00,3,13.88,True,22,2,1,818,5,0,5,MERGED
10227,X[AUTO]CLAIM should skip deleted entries,guybe7,2022-02-02T12:53:37Z,2022-02-08T08:20:09+00:00,5,139.44,True,189,48,4,2362,3,2,5,MERGED
10224,Fix src/modules build issue on OS X 11,sundb,2022-02-01T15:39:22Z,2022-02-01T19:39:10+00:00,1,4.0,True,8,1,2,133,0,0,0,MERGED
10223,create-cluster clean now will clean appendonlydir,enjoy-binbin,2022-02-01T13:04:29Z,2022-02-07T05:58:15+00:00,3,136.9,True,10,5,1,378,5,0,5,MERGED
10220,acl check api for functions and eval,yoav-steinberg,2022-01-31T15:43:01Z,2022-02-07T06:04:01+00:00,15,158.35,True,125,95,3,2860,5,6,11,MERGED
10219,Bump vmactions/freebsd-vm from 0.1.5 to 0.1.6,dependabot,2022-01-31T15:15:32Z,2022-02-02T08:39:34+00:00,1,41.4,True,2,1,1,1667,0,0,0,MERGED
10218,Consistent erros returned from EVAL scripts,yoav-steinberg,2022-01-31T10:50:20Z,2022-02-08T09:44:40+00:00,4,190.91,True,88,10,2,5551,3,2,5,MERGED
10207,fix cluster rebalance test race,oranagra,2022-01-29T23:40:10Z,2022-01-30T09:30:19+00:00,1,9.84,True,53,17,5,1263,0,0,0,MERGED
10206,Resize notused1 in clusterMsg so that clusterMsg is backward compatible with previous Redis releases,PingXie,2022-01-29T22:01:22Z,2022-01-30T17:43:37+00:00,8,19.7,True,36,2,3,12,3,1,4,MERGED
10204,Skip external server and codeql cron tests on forks,tezc,2022-01-29T13:45:09Z,2022-01-29T17:02:35+00:00,1,3.29,True,4,0,2,84,4,0,4,MERGED
10202,Use object size then pointer size when malloc (#10201),liwg06,2022-01-29T01:39:30Z,2022-01-29T12:43:17+00:00,1,11.06,True,1,1,1,127,0,0,0,MERGED
10200,Added missing documentation about the ACL GETUSER changes in acl-v2,madolson,2022-01-28T16:28:54Z,2022-01-28T20:13:46+00:00,2,3.75,True,4,0,1,249,0,0,0,MERGED
10199,doc improvement about acl first-arg,oranagra,2022-01-28T13:38:54Z,2022-01-29T16:34:59+00:00,6,26.93,True,5,4,1,151,0,1,1,MERGED
10197,Add entropy to srand (and fix Sentinel failures),moticless,2022-01-27T19:41:11Z,2022-01-30T14:39:23+00:00,2,66.97,True,5,2,1,469,2,0,2,MERGED
10196,Update generate-command-help.rb and help.h.,yossigo,2022-01-27T16:20:32Z,2022-01-27T19:48:06+00:00,2,3.46,True,496,83,2,119,0,0,0,MERGED
10193,Add key-specs notes,guybe7,2022-01-26T15:48:40Z,2022-01-30T10:00:03+00:00,5,90.19,True,241,212,16,629,2,7,9,MERGED
10192,solve race in expiration test,oranagra,2022-01-26T12:41:57Z,2022-01-26T17:45:31+00:00,6,5.06,True,2,2,1,264,1,1,2,MERGED
10191,remove the duplicated register of Log and Version in Lua engine,soloestoy,2022-01-26T12:19:38Z,2022-01-27T02:37:33+00:00,1,14.3,False,0,3,1,118,0,1,1,CLOSED
10190,Solve race in a BGSAVE test,oranagra,2022-01-26T11:05:53Z,2022-01-26T17:46:02+00:00,2,6.67,True,7,5,1,486,0,1,1,MERGED
10188,"Reply for command args should be an array, not a set",guybe7,2022-01-26T09:29:57Z,2022-01-26T10:49:24+00:00,1,1.32,True,1,1,1,0,1,0,1,MERGED
10187,forbid module to unload when it holds ongoing timer,warriorguo,2022-01-26T08:19:06Z,2022-02-01T12:54:11+00:00,24,148.58,True,66,1,3,214,10,9,19,MERGED
10183,Add tests for ACL command error cases,hwware,2022-01-25T20:37:24Z,2022-02-06T05:58:29+00:00,8,273.35,True,22,0,1,0,1,1,2,MERGED
10181,Set default channel permission to resetchannels for 7.0,hpatro,2022-01-25T14:30:43Z,2022-01-30T10:02:55+00:00,3,115.54,True,63,36,5,1401,10,0,10,MERGED
10179,Added engine stats to FUNCTION STATS command.,MeirShpilraien,2022-01-25T10:19:16Z,2022-01-25T13:50:14+00:00,12,3.52,True,97,6,2,560,0,4,4,MERGED
10178,aof rewrite and rdb save counters in info,yoav-steinberg,2022-01-25T09:56:12Z,2022-02-17T12:32:49+00:00,16,554.61,True,10,1,4,1928,14,10,24,MERGED
10173,Change expression to look for at least one limit exceeded for links test,madolson,2022-01-25T07:59:01Z,2022-01-26T07:59:53+00:00,1,24.01,True,1,1,1,638,1,0,1,MERGED
10172,Fix commands.c build issue on merge,yoav-steinberg,2022-01-25T07:04:57Z,2022-01-25T10:24:06+00:00,1,3.32,True,6,0,1,421,3,0,3,MERGED
10170,redis-cli: Aligned RESP3 maps with multiline value in TTY,zuiderkwast,2022-01-24T22:58:54Z,2022-01-25T15:15:58+00:00,1,16.28,True,23,0,1,1465,0,0,0,MERGED
10167,Improve testing and update flags around commands without ACL keyspec flags,madolson,2022-01-24T18:41:20Z,2022-01-25T07:55:30+00:00,1,13.24,True,84,11,7,1287,0,1,1,MERGED
10166,Fix outdated save key word in redis.conf,enjoy-binbin,2022-01-24T16:48:59Z,2022-01-24T20:02:42+00:00,2,3.23,True,3,3,1,258,0,1,1,MERGED
10164,Fix AOFRW limit test occasional failures on slower machines,chenyang8094,2022-01-24T09:35:07Z,2022-01-24T12:55:24+00:00,7,3.34,True,22,22,1,27,0,1,1,MERGED
10163,Retain a down primary's slot info after automatic fail over,PingXie,2022-01-23T03:00:52Z,2022-02-24T05:55:36+00:00,1,770.91,False,116,33,5,573,3,1,4,CLOSED
10160,Add check min-slave-* feature when evaluating Lua scripts and Functions,noradomi,2022-01-21T14:30:48Z,2022-02-03T09:57:51+00:00,14,307.45,True,58,9,2,836,13,5,18,MERGED
10159,fix missing transform from key-spec to acl permission,soloestoy,2022-01-21T06:41:01Z,2022-01-25T15:14:06+00:00,1,104.55,False,20,5,2,365,8,1,9,CLOSED
10158,Enhancement SENTINEL MASTERS | MASTER | REPLICAS | SENTINELS command,hwware,2022-01-20T22:40:28Z,2024-03-23T22:30:34+00:00,11,19031.83,False,331,149,8,531,4,11,15,CLOSED
10157,Fix flaky cluster tests in 24-links.tcl,ny0312,2022-01-20T21:38:24Z,2022-01-24T01:28:32+00:00,7,75.84,True,38,23,1,2104,1,4,5,MERGED
10151,Sentinel: return an error if configuration save fails,hwware,2022-01-19T19:49:44Z,2022-02-03T11:20:35+00:00,5,351.51,True,30,18,2,224,4,2,6,MERGED
10148,Allow SET without GET arg on write-only ACL. Allow BITFIELD GET on read-only ACL,enjoy-binbin,2022-01-19T16:06:15Z,2022-01-26T19:03:22+00:00,19,170.95,True,173,22,7,975,23,12,35,MERGED
10147,Improved handling of subcommands (don't allow ACL on first-arg of a sub-command),guybe7,2022-01-19T15:07:54Z,2022-01-22T12:09:40+00:00,6,69.03,True,58,22,4,1005,1,4,5,MERGED
10146,Fixed Sentinel support for hostnames and dynamic IP addresses,moticless,2022-01-19T14:41:58Z,2022-01-29T19:00:29+00:00,5,244.31,True,43,11,1,473,7,3,10,MERGED
10141,Added AOF rewrite support for functions.,MeirShpilraien,2022-01-19T09:13:04Z,2022-01-19T19:21:43+00:00,3,10.14,True,45,0,2,309,0,1,1,MERGED
10138,remove doc in redis.conf merged by mistake to 5.0,oranagra,2022-01-19T05:40:31Z,2022-01-20T06:17:42+00:00,1,24.62,True,0,25,1,73,0,0,0,MERGED
10137,Fix double key declaration for renamenx,madolson,2022-01-19T04:20:23Z,2022-01-20T03:30:33+00:00,1,23.17,True,5,5,2,325,0,0,0,MERGED
10135,Disable keyspec module API in 7.0 RC1,zuiderkwast,2022-01-18T19:11:17Z,2022-01-24T13:02:08+00:00,7,137.85,True,27,3,6,193,0,1,1,MERGED
10131,Fix `FUNCTION LOAD` ignores unknown parameter.,MeirShpilraien,2022-01-18T07:26:38Z,2022-01-18T08:29:52+00:00,1,1.05,True,9,0,2,423,4,0,4,MERGED
10128,Add test case to improve code coverage for Addslotsrange and Delslotsrange command,hwware,2022-01-17T22:06:02Z,2022-02-03T02:22:47+00:00,3,388.28,True,50,1,1,0,1,1,2,MERGED
10127,sub-command support for ACL CAT and COMMAND LIST. redisCommand always stores fullname,enjoy-binbin,2022-01-17T17:23:44Z,2022-01-23T08:05:07+00:00,57,134.69,True,562,260,55,877,7,44,51,MERGED
10126,Support function flags in script EVAL via shebang header,yoav-steinberg,2022-01-17T14:16:36Z,2022-01-24T14:50:03+00:00,35,168.56,True,369,117,15,2377,6,20,26,MERGED
10123,Use am instead of using server.aof_manifest directly to call getBaseA…,chenyang8094,2022-01-17T02:09:44Z,2022-01-17T07:02:10+00:00,1,4.87,True,1,1,1,147,0,0,0,MERGED
10122,"New detailed key-spec flags (RO, RW, OW, RM, ACCESS, UPDATE, INSERT, DELETE)",oranagra,2022-01-16T21:06:59Z,2022-01-18T14:00:01+00:00,2,40.88,True,758,459,201,2747,5,1,6,MERGED
10121,Fix timing issue in PSETEX/PEXPIRE sub-second expire tests,enjoy-binbin,2022-01-16T15:58:43Z,2022-01-17T08:42:13+00:00,2,16.73,True,3,6,1,845,2,0,2,MERGED
10117,Fix typo in doc for PUBSUB command,alisaifee,2022-01-15T13:12:38Z,2022-01-15T17:57:24+00:00,2,4.75,True,2,2,2,110,0,0,0,MERGED
10116,fix zmalloc_get_rss on NetBSD,devnexen,2022-01-15T10:26:11Z,2022-01-16T08:03:10+00:00,1,21.62,True,2,2,1,209,8,0,8,MERGED
10115,Fix function no-cluster flag test,enjoy-binbin,2022-01-15T03:52:04Z,2022-01-15T07:13:53+00:00,1,3.36,True,3,1,1,171,1,0,1,MERGED
10114,Add sentinel config set test case,hwware,2022-01-14T19:02:40Z,2022-01-19T09:57:51+00:00,14,110.92,True,60,6,2,0,2,11,13,MERGED
10113,Fix typo in deps/README.md,PeteHaitch,2022-01-14T02:17:48Z,2022-01-14T11:54:22+00:00,1,9.61,True,1,1,1,0,0,0,0,MERGED
10112,Fix small issues in aof.c,hwware,2022-01-13T20:34:55Z,2022-01-14T19:48:22+00:00,4,23.22,False,4,3,1,69,0,4,4,CLOSED
10110,Fix additional AOF filename issues.,yossigo,2022-01-13T20:01:16Z,2022-01-18T10:52:27+00:00,8,110.85,True,38,32,7,261,2,3,5,MERGED
10109,checkTcpBacklogSettings check for solaris based systems.,devnexen,2022-01-13T14:23:32Z,2022-01-15T18:39:06+00:00,2,52.26,True,4,0,1,0,2,0,2,MERGED
10108,Command info module API,zuiderkwast,2022-01-13T10:57:39Z,2022-02-04T19:09:37+00:00,112,536.2,True,1281,367,12,1259,10,40,50,MERGED
10105,Show subcommand full name in error log / ACL LOG,enjoy-binbin,2022-01-12T16:01:54Z,2022-01-12T18:05:14+00:00,1,2.06,True,46,38,3,438,1,0,1,MERGED
10104,Add command tips to COMMAND DOCS,guybe7,2022-01-12T15:16:09Z,2022-01-20T09:32:11+00:00,12,186.27,True,1830,1310,107,1461,19,7,26,MERGED
10103,show sub-commands INFO latencystats and LATENCY HISTOGRAM,soloestoy,2022-01-12T07:54:13Z,2022-01-17T10:32:32+00:00,12,122.64,True,100,39,4,288,3,4,7,MERGED
10102,Always create base AOF file when redis start from empty.,chenyang8094,2022-01-11T14:11:34Z,2022-01-13T06:49:26+00:00,31,40.63,True,83,9,7,1148,4,18,22,MERGED
10101,Added RM_MonotonicMicroseconds() API to provide monotonic time function,tezc,2022-01-11T12:06:36Z,2022-01-13T09:36:04+00:00,4,45.49,True,23,0,4,95,2,0,2,MERGED
10098,Fix EVAL timeout test failed on freebsd,chenyang8094,2022-01-11T09:40:28Z,2022-01-24T20:31:35+00:00,30,322.85,True,16,12,2,351,0,8,8,MERGED
10097,"changing min,max in ZRANGE -> start stop",slorello89,2022-01-10T17:31:42Z,2022-06-25T16:02:20+00:00,5,3982.51,True,4,4,2,956,6,1,7,MERGED
10096,Add script tests to cover keys with expiration time set,enjoy-binbin,2022-01-10T17:27:59Z,2022-01-11T20:43:18+00:00,2,27.26,True,68,33,5,483,1,0,1,MERGED
10095,LPOP/RPOP with count against non existing list return null array,enjoy-binbin,2022-01-10T16:51:11Z,2022-01-11T12:26:13+00:00,4,19.58,True,38,8,2,420,5,1,6,MERGED
10092,"Set repl-diskless-sync to yes by default, add repl-diskless-sync-max-replicas",oranagra,2022-01-10T13:50:11Z,2022-01-17T12:11:12+00:00,12,166.35,True,102,56,16,1908,8,7,15,MERGED
10086,Fix timing issue with cluster hostname test,madolson,2022-01-10T00:45:20Z,2022-01-11T00:21:05+00:00,1,23.6,True,10,0,1,774,0,0,0,MERGED
10082,Fix crash when error [sub]command name contains |,enjoy-binbin,2022-01-09T09:40:00Z,2022-01-09T11:06:52+00:00,4,1.45,True,22,4,3,939,0,2,2,MERGED
10081,Make sure replicas don't write their own replies to the replication link,enjoy-binbin,2022-01-09T07:35:09Z,2022-01-10T06:21:17+00:00,4,22.77,True,34,3,2,928,3,1,4,MERGED
10080,fix redis crached by using eval with access to volatile keys,zeekling,2022-01-09T07:08:59Z,2022-01-11T05:56:31+00:00,2,46.79,True,1,1,1,103,9,0,9,MERGED
10075,Changed latency histogram output to omit trailing 0s and periods,madolson,2022-01-08T00:54:10Z,2022-01-10T01:04:19+00:00,2,48.17,True,38,17,7,387,0,0,0,MERGED
10072,Fixes typo in redis.conf,YeonCheolGit,2022-01-07T15:22:56Z,2022-01-09T06:08:55+00:00,1,38.77,True,1,1,1,116,3,0,3,MERGED
10068,"lpGetInteger returns int64_t, avoid overflow",guybe7,2022-01-07T08:50:56Z,2022-01-07T13:31:06+00:00,1,4.67,True,16,7,2,275,2,0,2,MERGED
10066,"Function Flags support (no-writes, no-cluster, allow-state, allow-oom)",MeirShpilraien,2022-01-06T16:07:45Z,2022-01-14T12:02:02+00:00,42,187.9,True,648,80,16,5718,10,20,30,MERGED
10065,Allow jemalloc configure flags in Makefile,TerryHowe,2022-01-06T15:05:06Z,2022-01-06T16:09:36+00:00,1,1.07,False,1,1,1,90,1,0,1,CLOSED
10064,Use const char pointer in redismodule.h as far as possible,ShooterIT,2022-01-06T12:32:17Z,2022-01-18T13:55:21+00:00,11,289.38,True,30,31,8,512,6,1,7,MERGED
10062,Adds isolated netstats for replication.,DarrenJiang13,2022-01-06T09:33:31Z,2022-05-31T05:07:33+00:00,15,3475.57,True,75,18,7,2087,25,8,33,MERGED
10061,Adapt redis-check-aof tool for Multi Part Aof,chenyang8094,2022-01-06T04:53:13Z,2022-02-17T06:13:28+00:00,39,1009.34,True,573,170,4,1274,19,33,52,MERGED
10059,Set errno to EEXIST in redisFork() if child process exists,tezc,2022-01-05T21:46:01Z,2022-01-06T07:54:22+00:00,2,10.14,True,10,1,2,279,1,1,2,MERGED
10056,Move doc metadata from COMMAND to COMMAND DOCS,oranagra,2022-01-05T08:14:13Z,2022-01-11T15:16:16+00:00,37,151.03,True,395,249,10,1779,8,16,24,MERGED
10050,Print error messages in monitor/pubsub when errors occurs,enjoy-binbin,2022-01-04T06:15:49Z,2022-01-04T12:45:10+00:00,1,6.49,True,10,3,1,917,0,0,0,MERGED
10049,"Support whitespace characters in appendfilename, and ban them in appenddirname",chenyang8094,2022-01-04T01:14:53Z,2022-01-10T07:09:40+00:00,3,149.91,True,66,13,5,139,11,2,13,MERGED
10046,Stringify JSON key of --json option result,yu74n,2022-01-03T12:43:29Z,2022-01-04T15:24:29+00:00,7,26.68,True,12,2,1,1276,1,3,4,MERGED
10044,`redis-cli --replica` reads dummy empty rdb instead of full snapshot,yoav-steinberg,2022-01-03T12:28:40Z,2022-01-04T15:09:23+00:00,3,26.68,True,23,15,5,257,0,1,1,MERGED
10043,redis-cli generates command help tables from the results of COMMAND ,jhelbaum,2022-01-03T10:51:25Z,2022-02-05T14:54:17+00:00,40,796.05,True,353,44,3,601,30,17,47,MERGED
10041,Add DUMP RESTORE tests for redis-cli -x and -X options,enjoy-binbin,2022-01-02T08:20:27Z,2022-01-02T11:58:22+00:00,7,3.63,True,28,0,1,193,1,1,2,MERGED
10039,Build commands.c in Makefile,zuiderkwast,2022-01-01T23:37:18Z,2022-01-06T15:59:37+00:00,2,112.37,True,12,0,1,257,7,1,8,MERGED
10036,Fix timing issue in sentinel CKQUORUM test,enjoy-binbin,2022-01-01T10:25:25Z,2022-01-23T11:54:50+00:00,8,529.49,True,10,3,1,679,3,3,6,MERGED
10035,Add tests for blocking XREAD[GROUP] when the stream ran dry,enjoy-binbin,2021-12-31T13:48:15Z,2022-01-04T19:48:50+00:00,8,102.01,True,106,1,2,253,2,2,4,MERGED
10034,Fixes 'since' for `GEORADIUS[BYMEMBER]_RO`,itamarhaber,2021-12-31T10:25:51Z,2022-01-09T09:13:32+00:00,1,214.79,True,4,4,3,34,1,0,1,MERGED
10033,Fix C11_ATOMIC detection on GNU Make 4.3,wh-gd,2021-12-31T07:39:25Z,2022-01-04T12:05:00+00:00,1,100.43,True,4,2,1,279,5,0,5,MERGED
10032,"Fix when the master connection is disconnected, replication retry read indefinitely",sundb,2021-12-31T01:08:57Z,2021-12-31T12:08:04+00:00,1,10.99,True,3,1,1,594,4,0,4,MERGED
10030,optmize(PowerOfTwo): use Bit operation will be faster than while,Ccheers,2021-12-30T12:52:43Z,2021-12-30T15:52:29+00:00,1,3.0,False,10,7,1,43,3,1,4,CLOSED
10026,Module API doc formatting from #9656,zuiderkwast,2021-12-29T13:25:26Z,2021-12-30T09:34:41+00:00,2,20.15,True,2,0,1,131,0,0,0,MERGED
10023,Remove unnecessary open after aof rewrite,bugwz,2021-12-29T07:16:27Z,2022-06-06T05:09:21+00:00,1,3813.88,False,18,31,1,176,5,1,6,CLOSED
10022,Constrain node ID logging when exceeding send buffer limit,madolson,2021-12-29T04:23:01Z,2021-12-31T17:32:33+00:00,1,61.16,True,1,1,1,98,0,0,0,MERGED
10020,Make sure replicas don't write their own replies to the replication link,yoav-steinberg,2021-12-28T10:25:55Z,2022-01-02T09:18:43+00:00,8,118.88,True,11,0,1,1016,3,1,4,MERGED
10019,use startEvictionTimeProc() in config set maxmemory,soloestoy,2021-12-28T09:11:23Z,2022-01-04T11:08:10+00:00,6,169.95,True,13,9,4,271,3,1,4,MERGED
10018,Fix geo search bounding box check causing missing results,qetu3790,2021-12-28T08:02:01Z,2022-02-21T06:06:58+00:00,6,1318.08,True,35,10,2,308,13,2,15,MERGED
10017,Report slot to keys map size in MEMORY STATS in cluster mode,yzhaon,2021-12-28T06:44:21Z,2022-01-02T08:40:00+00:00,15,121.93,True,14,1,3,2104,3,3,6,MERGED
10016,Add missing metadata to the commands SSOT files.,itamarhaber,2021-12-27T22:07:28Z,2021-12-29T19:57:40+00:00,4,45.84,True,451,211,64,718,5,1,6,MERGED
10015,Ban snapshot-creating commands and other admin commands from transactions,guybe7,2021-12-27T12:29:36Z,2022-01-04T11:37:48+00:00,7,191.14,True,114,11,11,732,14,1,15,MERGED
10013,Remove incomplete fix of a broader problem,guybe7,2021-12-27T10:27:54Z,2021-12-28T08:19:58+00:00,2,21.87,True,2,3,2,241,1,0,1,MERGED
10010,Tests: don't rely on the response of MEMORY USAGE when mem_allocator is not jemalloc,chenyang8094,2021-12-27T08:50:32Z,2021-12-27T19:37:21+00:00,6,10.78,True,20,21,3,514,0,1,1,MERGED
10006,Fix failing test due to recent change in transaction propagation,chenyang8094,2021-12-27T03:18:47Z,2021-12-27T13:18:17+00:00,20,9.99,True,12,12,1,2147,14,6,20,MERGED
10004,Redis Function Libraries,MeirShpilraien,2021-12-26T14:44:43Z,2022-01-06T11:39:39+00:00,37,260.92,True,1348,490,22,6954,16,36,52,MERGED
10003,Safe and organized exit when receiving sigterm while loading,perryitay,2021-12-26T10:01:56Z,2021-12-28T11:25:56+00:00,7,49.4,True,9,2,1,327,9,2,11,MERGED
10001,Add event loop support to the module API,tezc,2021-12-26T02:23:26Z,2022-01-18T11:10:07+00:00,26,560.78,True,591,35,10,1627,15,18,33,MERGED
9987,Module events: Fail RM_SubscribeToServerEvent if event is too new,guybe7,2021-12-22T18:06:30Z,2022-01-11T12:33:39+00:00,4,474.45,True,56,4,2,173,1,4,5,MERGED
9984,Changed fuction name to be case insensitive.,MeirShpilraien,2021-12-22T15:23:26Z,2021-12-26T06:37:24+00:00,6,87.23,True,44,2,2,397,6,2,8,MERGED
9983,Modules: Mark APIs non-experimental,zuiderkwast,2021-12-22T15:13:23Z,2021-12-30T10:17:22+00:00,3,187.07,True,0,21,15,506,14,0,14,MERGED
9980,redis-cli: Add -X option and extend --cluster call take arg from stdin,enjoy-binbin,2021-12-22T10:11:42Z,2021-12-30T10:10:04+00:00,22,191.97,True,123,23,2,2848,3,7,10,MERGED
9975,Shorten timeouts of CLIENT PAUSE to avoid hanging when tests fail.,zhugezy,2021-12-21T07:55:24Z,2021-12-22T10:06:30+00:00,6,26.18,True,10,10,1,337,5,1,6,MERGED
9974,ACL V2 - Selectors and key based permissions,madolson,2021-12-21T06:42:13Z,2022-01-20T21:05:27+00:00,96,734.39,True,1809,614,21,5480,20,82,102,MERGED
9972,"check somaxconn system settings on macOS, FreeBSD and OpenBSD.",devnexen,2021-12-20T21:49:12Z,2021-12-28T07:20:10+00:00,1,177.52,True,37,1,2,0,1,0,1,MERGED
9971,Add --version support for redis-check-rdb,yancz2000,2021-12-20T16:33:52Z,2021-12-21T12:11:18+00:00,1,19.62,True,19,0,1,102,0,0,0,MERGED
9968,Generate RDB with Functions only via redis-cli --functions-rdb,yoav-steinberg,2021-12-20T14:08:51Z,2022-01-02T07:39:01+00:00,40,305.5,True,288,133,12,1193,1,22,23,MERGED
9966,Fix recent daily CI test failures,enjoy-binbin,2021-12-20T08:37:20Z,2021-12-20T10:31:13+00:00,4,1.9,True,14,4,4,1147,1,3,4,MERGED
9964,Add external test that runs without debug command,oranagra,2021-12-19T10:52:59Z,2021-12-19T15:41:51+00:00,1,4.81,True,129,80,18,507,0,0,0,MERGED
9963,Adding module api for processing commands during busy jobs and allow flagging the commands that should be handled at this status,perryitay,2021-12-19T09:51:57Z,2022-01-20T07:05:53+00:00,48,765.23,True,493,96,31,904,14,38,52,MERGED
9962,Fix some nonsense came from LGTM,enjoy-binbin,2021-12-19T07:17:43Z,2021-12-19T15:52:23+00:00,2,8.58,True,11,9,5,1057,1,1,2,MERGED
9959,COMMAND: Use underscores instead of hyphens in attributes,guybe7,2021-12-17T16:31:49Z,2021-12-18T07:00:43+00:00,1,14.48,True,20,20,3,0,2,0,2,MERGED
9958,Adds utils/gen-commands-json.py,itamarhaber,2021-12-17T14:03:10Z,2021-12-27T17:31:13+00:00,39,243.47,True,121,7,4,385,0,30,30,MERGED
9954,redis-cli: Add OUTPUT_JSON format type,yu74n,2021-12-16T19:00:05Z,2021-12-23T08:21:18+00:00,17,157.35,True,89,7,1,911,18,8,26,MERGED
9953,"Change FUNCTION CREATE, DELETE and FLUSH to be WRITE commands instead of MAY_REPLICATE.",MeirShpilraien,2021-12-16T15:37:41Z,2021-12-21T14:13:30+00:00,16,118.6,True,135,70,19,2371,6,6,12,MERGED
9940,Reuse temporary client objects for blocked clients by module,tezc,2021-12-14T08:28:28Z,2022-01-11T17:00:57+00:00,65,680.54,True,187,117,4,1430,14,28,42,MERGED
9938,Add FUNCTION DUMP and RESTORE.,MeirShpilraien,2021-12-13T15:28:21Z,2021-12-26T07:03:37+00:00,82,303.59,True,511,33,11,1525,2,37,39,MERGED
9936,Add FUNCTION FLUSH command to flush all functions,MeirShpilraien,2021-12-13T08:50:04Z,2021-12-16T15:58:25+00:00,23,79.14,True,165,1,9,490,1,12,13,MERGED
9935,Redact acl setuser arugments if user has spaces,madolson,2021-12-13T06:21:58Z,2021-12-13T16:39:05+00:00,1,10.29,True,10,8,2,246,1,0,1,MERGED
9934,Reduce system calls of write for client->reply by introducing writev,panjf2000,2021-12-12T10:46:07Z,2022-02-22T12:00:37+00:00,105,1729.24,True,156,28,4,1043,69,36,105,MERGED
9930,Make BITFIELD_RO reject OVERFLOW subcommand ,huangzhw,2021-12-11T13:08:08Z,2021-12-21T06:59:45+00:00,4,233.86,False,22,0,2,66,6,0,6,CLOSED
9927,Fix timing issue in strem blocking tests,enjoy-binbin,2021-12-10T16:21:06Z,2021-12-10T18:35:51+00:00,1,2.25,True,5,0,1,567,1,0,1,MERGED
9924,Error message improvement for CONFIG SET command,hwware,2021-12-09T20:46:23Z,2021-12-15T07:46:32+00:00,10,131.0,True,14,6,2,1552,1,2,3,MERGED
9923,Add FLUSHEVERYTHING command that also flushes the Redis Functions.,MeirShpilraien,2021-12-09T11:22:47Z,2021-12-13T07:36:50+00:00,2,92.23,False,44,6,4,722,10,1,11,CLOSED
9921,make the func name clear,ohye3166,2021-12-09T04:40:07Z,2021-12-12T07:44:33+00:00,1,75.07,False,4,3,2,76,3,0,3,CLOSED
9920,Protected configs and sensitive commands,YaacovHazan,2021-12-08T19:49:02Z,2021-12-19T08:46:16+00:00,29,252.95,True,148,31,15,1417,2,31,33,MERGED
9919,Fix the server log when client use Multiparam Config Set,hwware,2021-12-08T18:19:41Z,2021-12-09T14:37:06+00:00,7,20.29,True,7,2,1,1167,1,3,4,MERGED
9916,Fix possible int overflow when hashing an sds.,yoav-steinberg,2021-12-08T14:20:11Z,2021-12-13T19:16:26+00:00,8,124.94,True,125,107,7,1184,8,3,11,MERGED
9914,Multiparam config get. See #9871.,yoav-steinberg,2021-12-08T11:43:04Z,2021-12-16T07:01:13+00:00,7,187.3,True,56,43,4,276,1,2,3,MERGED
9911,Add hash-seed config parameter.,yossigo,2021-12-07T10:17:14Z,2021-12-08T12:07:16+00:00,8,25.83,False,119,21,8,573,2,4,6,CLOSED
9910,Fix timing issue in logging.tcl with FreeBSD,enjoy-binbin,2021-12-07T08:30:01Z,2021-12-07T10:02:59+00:00,1,1.55,True,6,16,1,739,0,0,0,MERGED
9909,Fix SENTINEL subcommands's arity,enjoy-binbin,2021-12-07T08:28:36Z,2021-12-08T06:59:02+00:00,2,22.51,True,4,5,2,330,1,0,1,MERGED
9908,change _dictReset function annotate,ohye3166,2021-12-07T08:14:51Z,2021-12-07T19:14:18+00:00,1,10.99,True,1,2,1,36,2,0,2,MERGED
9904,Don't write oom score adj to proc unless we're managing it.,yoav-steinberg,2021-12-06T14:16:53Z,2021-12-07T14:05:52+00:00,6,23.82,True,85,19,4,438,4,3,7,MERGED
9901,Fix spelling of sanitization includes redis.conf,madolson,2021-12-06T05:57:22Z,2021-12-06T08:14:13+00:00,1,2.28,True,5,5,1,80,0,0,0,MERGED
9896,Fix outdated protected-mode documentation in sentinel.conf,enjoy-binbin,2021-12-05T07:31:33Z,2021-12-08T09:25:57+00:00,1,73.91,True,4,15,1,260,2,0,2,MERGED
9895,"in dict struct , rehashidx's type is long, i think we should keep the…",ohye3166,2021-12-05T07:08:47Z,2021-12-08T01:56:35+00:00,1,66.8,False,3,1,1,126,0,0,0,CLOSED
9890,Sort out mess around propagation and MULTI/EXEC,guybe7,2021-12-03T12:52:26Z,2021-12-22T22:03:48+00:00,66,465.19,True,1004,393,23,3070,22,39,61,MERGED
9889,Santize dump payload: fix invalid listpack entry start with EOF,sundb,2021-12-03T12:10:15Z,2021-12-04T14:43:08+00:00,2,26.55,True,13,0,2,340,1,0,1,MERGED
9888,Hide hidden configs from `config get` patterns.,yoav-steinberg,2021-12-03T10:29:53Z,2021-12-08T10:44:11+00:00,11,120.24,True,31,5,2,353,2,5,7,MERGED
9887,optimze rdbsavalen,ohye3166,2021-12-03T04:42:10Z,2021-12-08T01:54:16+00:00,1,117.2,False,2,2,1,71,0,1,1,CLOSED
9882,Add the READONLY command as a prefix to redis-benchmark,shawn-higgins1,2021-12-02T21:28:44Z,2024-03-24T23:24:09+00:00,14,20233.92,False,235,74,4,626,6,15,21,CLOSED
9881,Fix CONFIG SET test failures in MacOS/FreeBSD,enjoy-binbin,2021-12-02T07:41:28Z,2021-12-02T16:18:18+00:00,4,8.61,True,11,8,1,2310,0,1,1,MERGED
