number,title,author,createdAt,closedOrMergedAt,reviewsCount,hoursOpen,merged,additions,deletions,changedFiles,bodyLength,issueCommentsCount,reviewThreadsCount,interactionsCount,finalReviewState
38761,fix: failing type errors in build,charislam,2025-09-16T18:43:13Z,2025-09-17T05:55:38+00:00,3,11.21,True,141,117,16,512,2,1,3,MERGED
38760,fix(docs): typo,charislam,2025-09-16T17:38:08Z,2025-09-16T19:42:37+00:00,1,2.07,True,1,1,1,0,2,0,2,MERGED
38759,fix: remove PostHog wildcard domain from CSP,seanoliver,2025-09-16T17:23:42Z,2025-09-16T22:48:56+00:00,1,5.42,True,0,4,1,858,2,0,2,MERGED
38758,Added new security blog post,CoolAssPuppy,2025-09-16T17:00:40Z,2025-09-17T21:06:26+00:00,6,28.1,True,699,8,6,89,2,7,9,MERGED
38756,fix: search and sync scripts,charislam,2025-09-16T16:48:59Z,2025-09-17T15:20:44+00:00,1,22.53,True,17,19,2,0,2,0,2,MERGED
38753,Add self-remediation for orphan prefixes and refactor delete objects to be a singular request,joshenlim,2025-09-16T15:46:00Z,2025-09-17T06:07:51+00:00,1,14.36,True,59,32,2,2152,3,0,3,MERGED
38747,chore: limit regions for nimbus,alaister,2025-09-16T12:34:29Z,2025-09-25T08:09:15+00:00,1,211.58,True,12,11,4,0,3,0,3,MERGED
38746,chore: edge function examples filter stripe example (enabled features),alaister,2025-09-16T12:10:28Z,2025-09-25T08:11:09+00:00,1,212.01,True,43,5,4,0,3,0,3,MERGED
38745,chore: add custom content provider label,alaister,2025-09-16T12:02:55Z,2025-09-16T14:06:57+00:00,1,2.07,True,24,39,6,0,3,0,3,MERGED
38744,feat(studio): add columns and update labels for query performance,kemaldotearth,2025-09-16T11:30:15Z,2025-09-16T12:43:43+00:00,1,1.22,True,166,15,3,522,3,2,5,MERGED
38740,docs: update google auth docs,hf,2025-09-16T10:21:29Z,2025-09-16T13:43:16+00:00,2,3.36,True,135,146,2,67,2,1,3,MERGED
38739,Chore/optimize auth users UI query,joshenlim,2025-09-16T10:11:11Z,2025-09-16T14:58:41+00:00,1,4.79,True,46,4,1,1355,2,0,2,MERGED
38738,fix query performance links,jordienr,2025-09-16T09:42:00Z,2025-09-16T11:58:55+00:00,1,2.28,True,5,5,5,39,2,0,2,MERGED
38736,Contextual error for foreign tables in table editor,joshenlim,2025-09-16T08:36:41Z,2025-09-17T11:59:27+00:00,1,27.38,True,49,12,1,386,2,1,3,MERGED
38735,chore: replace branch id with branch ref,sweatybridge,2025-09-16T08:26:51Z,2025-09-17T02:31:01+00:00,1,18.07,True,159,238,19,167,2,1,3,MERGED
38733,Chore/state of startups,MildTomato,2025-09-16T04:42:04Z,2025-09-16T18:54:44+00:00,5,14.21,True,214,82,4,14,2,2,4,MERGED
38732,New case study and blog,dnywh,2025-09-16T04:33:50Z,2025-09-16T05:36:00+00:00,1,1.04,True,537,0,10,239,2,0,2,MERGED
38730,chore: transfer docs requirements,kevcodez,2025-09-16T03:41:31Z,2025-09-16T07:29:14+00:00,1,3.8,True,4,1,1,0,2,0,2,MERGED
38729,fix: functions on the Supabase Preview do not deploy properly,nyannyacha,2025-09-16T02:57:08Z,2025-09-16T14:10:11+00:00,2,11.22,True,3,0,1,588,2,0,2,MERGED
38728,introduce ui rules,SaxonF,2025-09-16T00:17:10Z,2025-09-16T04:57:42+00:00,1,4.68,True,253,0,1,97,2,0,2,MERGED
38727,fix: handle undefined count when fetching table rows,charislam,2025-09-15T23:25:52Z,2025-09-16T03:04:46+00:00,1,3.65,True,9,8,2,161,2,0,2,MERGED
38726,chore: add auth settings redirect,charislam,2025-09-15T23:06:15Z,2025-09-19T18:30:37+00:00,7,91.41,True,5,0,1,0,6,2,8,MERGED
38725,fix(docs/auth): update auth settings links,cstockton,2025-09-15T20:19:41Z,2025-09-16T14:10:41+00:00,2,17.85,True,35,27,13,97,2,0,2,MERGED
38723,fix(ui/auth-sessions): always show refresh token reuse interval,cstockton,2025-09-15T19:29:06Z,2025-09-16T16:20:33+00:00,3,20.86,True,25,30,1,435,3,0,3,MERGED
38718,chore: prevent extraneous tsconfig errors in tests,charislam,2025-09-15T18:39:33Z,2025-09-16T17:22:00+00:00,1,22.71,True,10,1,1,193,2,0,2,MERGED
38717,fix: add PostHog external URL to CSP for feature flags support,seanoliver,2025-09-15T18:28:54Z,2025-09-15T21:02:47+00:00,1,2.56,True,4,0,1,635,2,0,2,MERGED
38715,chore: turn on typechecking on prod build,charislam,2025-09-15T17:06:14Z,2025-09-16T17:12:13+00:00,3,24.1,True,12,9,3,299,3,0,3,MERGED
38714,propagate sentry issue id to form,jordienr,2025-09-15T16:32:22Z,2025-09-17T10:59:08+00:00,1,42.45,True,16,6,4,232,3,1,4,MERGED
38709,fix: enabled/disabled indicator for web3,hf,2025-09-15T13:26:53Z,2025-10-01T08:44:25+00:00,1,379.29,True,4,1,1,26,2,0,2,MERGED
38708,chore: stricter action config for labeler,staaldraad,2025-09-15T12:53:29Z,2025-09-15T14:26:05+00:00,2,1.54,True,5,2,1,156,2,0,2,MERGED
38706,add status code to tags instead of context,jordienr,2025-09-15T12:39:06Z,2025-09-17T09:30:58+00:00,1,44.86,True,8,1,1,0,3,2,5,MERGED
38705,Fix project card provider undefined,joshenlim,2025-09-15T10:49:25Z,2025-09-16T03:24:53+00:00,1,16.59,True,2,3,2,431,3,0,3,MERGED
38704,chore: Add labeler action and documentation config,ChrisChinchilla,2025-09-15T10:38:52Z,2025-09-15T12:02:05+00:00,1,1.39,True,18,0,2,177,2,1,3,MERGED
38702,Add attachment to sentry permission error,jordienr,2025-09-15T08:33:49Z,2025-09-15T12:19:10+00:00,1,3.76,True,3,1,1,0,2,0,2,MERGED
38699,Support opening table rows for foreign tables in side panel (read only),joshenlim,2025-09-15T07:53:51Z,2025-09-16T03:54:03+00:00,1,20.0,True,8,3,2,173,2,0,2,MERGED
38697,fix: disable plan selection on billing enabled flag,alaister,2025-09-15T04:31:18Z,2025-09-15T09:00:28+00:00,2,4.49,True,50,45,1,0,2,1,3,MERGED
38696,chore: add compute price to enabled features,alaister,2025-09-15T04:17:47Z,2025-09-16T03:13:34+00:00,1,22.93,True,26,15,3,0,2,0,2,MERGED
38695,chore: move connect modal custom content to enabled features,alaister,2025-09-15T04:10:57Z,2025-09-15T08:59:38+00:00,1,4.81,True,63,67,6,82,3,0,3,MERGED
38694,chore: add sso settings to enabled features,alaister,2025-09-15T03:53:31Z,2025-09-15T08:58:54+00:00,1,5.09,True,36,10,5,0,2,0,2,MERGED
38693,Fix default value placeholder for fields with foreign keys,joshenlim,2025-09-15T02:42:16Z,2025-09-15T10:17:44+00:00,1,7.59,True,5,6,1,357,2,0,2,MERGED
38691,feat: update mgmt api docs,github-actions,2025-09-15T00:09:16Z,2025-09-15T21:45:21+00:00,1,21.6,True,38,10,2,44,2,0,2,MERGED
38678,chore(deps): bump axios from 1.10.0 to 1.12.0,dependabot,2025-09-13T16:00:19Z,2025-09-16T19:31:26+00:00,1,75.52,True,622,198,2,4967,1,0,1,MERGED
38675,docs: update import-data guide to reflect dashboard UI change,prateekbisht23,2025-09-13T14:54:12Z,2025-09-24T06:59:07+00:00,4,256.08,True,1,1,1,385,5,1,6,MERGED
38672,Fix(docs): prevent SecurityError from rapid history.replaceState call…,Devanshusharma2005,2025-09-13T13:15:19Z,2025-09-18T21:00:10+00:00,4,127.75,True,21,4,5,2256,6,5,11,MERGED
38671,fix vertical scroll in mobile schema selector,fsansalvadore,2025-09-13T13:11:14Z,2025-09-15T03:01:19+00:00,3,37.83,True,1,0,1,250,2,1,3,MERGED
38670,docs: web3  and some other js reference improvements,hf,2025-09-13T09:18:49Z,2025-09-15T12:56:35+00:00,3,51.63,True,4241,3990,11,170,3,4,7,MERGED
38669,fix: marketing company stats,tomaspozo,2025-09-13T05:06:57Z,2025-09-13T12:59:09+00:00,2,7.87,True,216,284,15,991,2,0,2,MERGED
38666,docs: add default environment variables available in hosted enviroment,laktek,2025-09-12T21:56:47Z,2025-09-16T15:51:58+00:00,5,89.92,True,6,0,1,73,2,2,4,MERGED
38665,chore(deps): bump hono from 4.6.16 to 4.9.7 in /examples/auth/hono,dependabot,2025-09-12T21:27:34Z,2025-09-16T19:32:27+00:00,1,94.08,True,5,5,2,4296,1,0,1,MERGED
38662,feat: alternate search index for nimbus,charislam,2025-09-12T15:33:55Z,2025-09-16T16:37:53+00:00,2,97.07,True,1244,217,17,1564,5,1,6,MERGED
38658,fix(replication): Use correct url for tables,iambriccardo,2025-09-12T10:24:04Z,2025-09-12T11:35:08+00:00,2,1.18,True,1,1,1,70,4,1,5,MERGED
38654,Support for projects pagination (Part 2),joshenlim,2025-09-12T08:29:04Z,2025-09-17T08:51:14+00:00,4,120.37,True,363,225,4,2315,2,3,5,MERGED
38653,chore: update docs on minting custom jwt,sweatybridge,2025-09-12T08:29:03Z,2025-09-16T12:57:59+00:00,10,100.48,True,69,0,2,193,2,9,11,MERGED
38649,fix: let api handle signing key validation error,sweatybridge,2025-09-12T04:33:20Z,2025-09-12T09:50:27+00:00,3,5.29,True,3,12,4,342,4,0,4,MERGED
38648,feat: improvements to SupaSquad page,tomaspozo,2025-09-12T01:44:46Z,2025-09-12T11:19:59+00:00,2,9.59,True,144,91,8,435,2,0,2,MERGED
38645,Added a new case study and blog post.,CoolAssPuppy,2025-09-11T22:52:33Z,2025-09-15T14:26:45+00:00,2,87.57,True,537,0,10,282,2,1,3,MERGED
38644,Correction to the patent blog post,akorotkov,2025-09-11T20:01:08Z,2025-09-16T07:53:39+00:00,2,107.88,True,1,1,1,76,3,0,3,MERGED
38640,fix: prevent crash on _ page when user has no organizations,charislam,2025-09-11T17:45:57Z,2025-09-12T05:50:02+00:00,3,12.07,True,123,148,4,0,2,1,3,MERGED
38638,fix: estimate number of users when count is large,charislam,2025-09-11T16:45:00Z,2025-09-12T05:07:31+00:00,3,12.38,True,167,17,5,817,3,2,5,MERGED
38637,feat: studio connect framework state,Hallidayo,2025-09-11T16:17:33Z,2025-09-15T13:31:28+00:00,3,93.23,True,84,9,1,475,5,1,6,MERGED
38635,Use overflow auto instead of scroll,joshenlim,2025-09-11T16:07:53Z,2025-09-12T02:29:51+00:00,1,10.37,True,2,2,1,349,3,0,3,MERGED
38634,feat(studio): query performance metric cards ,kemaldotearth,2025-09-11T15:32:49Z,2025-09-15T11:45:23+00:00,2,92.21,True,111,18,8,585,3,1,4,MERGED
38633,chore: use custom content for client libraries,alaister,2025-09-11T14:39:50Z,2025-09-11T15:41:07+00:00,1,1.02,True,92,89,9,196,3,0,3,MERGED
38625,fix(docs): change management API generation script to ES module,mandarini,2025-09-11T11:10:14Z,2025-09-11T12:58:11+00:00,1,1.8,True,2,2,1,422,3,0,3,MERGED
38624,Make project infinite query keys fully unique,joshenlim,2025-09-11T10:27:46Z,2025-09-12T02:50:55+00:00,1,16.39,True,11,9,4,1141,3,0,3,MERGED
38623,feat: web3 (ethereum) ui,hf,2025-09-11T10:22:39Z,2025-09-15T09:57:03+00:00,2,95.57,True,8,1,1,28,3,0,3,MERGED
38619,Chore/swap use check permissions with use async check project permissions part 8 (Season Finale),joshenlim,2025-09-11T07:40:33Z,2025-09-16T09:05:57+00:00,2,121.42,True,603,682,202,832,3,0,3,MERGED
38616,fix(apps/docs): update outdated langchain usage.,zhyd1997,2025-09-11T04:30:47Z,2025-09-16T14:31:25+00:00,2,130.01,True,6,6,1,273,3,0,3,MERGED
38613,Fix filtering issue,SaxonF,2025-09-11T01:24:17Z,2025-09-11T06:32:27+00:00,1,5.14,True,3,1,1,374,3,0,3,MERGED
38612,Re-add get_logs tool,SaxonF,2025-09-11T00:17:46Z,2025-09-11T06:32:04+00:00,1,6.24,True,11,1,2,34,3,0,3,MERGED
38609,fix: client side exception in cron jobs details,charislam,2025-09-10T22:29:16Z,2025-09-11T03:40:02+00:00,1,5.18,True,47,38,2,645,2,0,2,MERGED
38606,feat(studio): remove query performance tabs,kemaldotearth,2025-09-10T18:51:42Z,2025-09-11T14:20:52+00:00,1,19.49,True,84,190,8,614,3,1,4,MERGED
38595,docs: update js client libs docs,mandarini,2025-09-10T12:14:02Z,2025-09-11T11:14:28+00:00,1,23.01,True,112260,57005,26,293,2,0,2,MERGED
38593,feat: bump auth-js to v2.72.0-rc.11,mandarini,2025-09-10T11:52:29Z,2025-09-11T08:07:43+00:00,1,20.25,True,10,10,2,370,3,0,3,MERGED
38588,ref(replication): Add alpha banner and remove batch size,iambriccardo,2025-09-10T10:10:09Z,2025-09-11T07:25:39+00:00,2,21.26,True,122,135,7,175,3,0,3,MERGED
38586,Chore/refactor dashboard history logic,joshenlim,2025-09-10T09:18:08Z,2025-09-10T14:19:09+00:00,1,5.02,True,110,99,9,3934,3,2,5,MERGED
38581,Chore/swap use check permissions with use async check project permissions part 7,joshenlim,2025-09-10T06:54:10Z,2025-09-10T10:09:18+00:00,3,3.25,True,789,811,45,2965,3,1,4,MERGED
38576,Refine prompt,SaxonF,2025-09-10T03:46:09Z,2025-09-10T07:14:34+00:00,1,3.47,True,19,26,1,224,3,0,3,MERGED
38575,feat: missing billing info banner,kevcodez,2025-09-10T03:40:12Z,2025-09-10T05:26:27+00:00,4,1.77,True,21,1,3,159,3,2,5,MERGED
38574,Home New: Getting Started,SaxonF,2025-09-10T03:14:56Z,2025-09-11T00:05:03+00:00,5,20.84,True,728,1,4,165,3,5,8,MERGED
38573,use ref for selected org to ensure not outdated,SaxonF,2025-09-10T01:41:02Z,2025-09-10T05:38:32+00:00,1,3.96,True,15,3,1,157,2,0,2,MERGED
38566,chore(deps): bump vite from 7.0.5 to 7.1.5 in /examples/user-management/sveltekit-user-management,dependabot,2025-09-09T21:26:41Z,2025-09-16T19:59:11+00:00,2,166.54,True,1,1,1,4507,1,0,1,MERGED
38562,realtime: improve getting started guide,filipecabaco,2025-09-09T20:08:53Z,2025-09-17T13:31:58+00:00,15,185.38,True,746,97,7,192,2,15,17,MERGED
38561,feat: mcp registry domain verification,gregnr,2025-09-09T17:47:31Z,2025-09-09T21:42:24+00:00,1,3.91,True,1,0,1,488,2,0,2,MERGED
38560,add myself to humans.txt,stylessh,2025-09-09T15:43:06Z,2025-09-09T17:48:43+00:00,1,2.09,True,1,0,1,0,2,0,2,MERGED
38559,Swap useCheckPermissions with useAsyncCheckProjectPermissions Part 6,joshenlim,2025-09-09T15:33:32Z,2025-09-10T03:26:26+00:00,1,11.88,True,111,67,16,2155,2,0,2,MERGED
38557,OrioleDB patent,kiwicopple,2025-09-09T14:21:12Z,2025-09-10T10:28:25+00:00,1,20.12,True,65,0,5,20,2,0,2,MERGED
38555,feat(web): remove webinar banner (DO NOT MERGE until wed 10 sept),stylessh,2025-09-09T13:39:05Z,2025-09-10T18:56:11+00:00,1,29.29,True,1,8,1,135,2,1,3,MERGED
38554,docs: Clearup keys and connection instructions in web getting started guides,ChrisChinchilla,2025-09-09T13:13:59Z,2025-09-12T11:35:34+00:00,1,70.36,True,79,58,24,171,2,0,2,MERGED
38552,Swap useCheckPermissions with useAsyncCheckProjectPermissions Part 5,joshenlim,2025-09-09T12:40:35Z,2025-09-09T14:07:55+00:00,1,1.46,True,420,408,20,1415,3,0,3,MERGED
38550,Auth Report tests and improvements,jordienr,2025-09-09T11:04:06Z,2025-09-17T15:41:10+00:00,7,196.62,True,742,852,15,365,3,12,15,MERGED
38548,fix(types): update branching types for api route changes,avallete,2025-09-09T10:12:36Z,2025-09-09T11:47:46+00:00,1,1.59,True,803,344,10,140,3,0,3,MERGED
38546,fix(studio): usage project selector truncation,kemaldotearth,2025-09-09T08:05:49Z,2025-09-09T11:05:35+00:00,2,3.0,True,2,1,1,175,3,0,3,MERGED
38542,feat: support additional tax ids,kevcodez,2025-09-09T04:57:11Z,2025-09-09T07:40:14+00:00,3,2.72,True,138,67,1,0,2,0,2,MERGED
38541,(Clean up) Remove secrets:pull command,joshenlim,2025-09-09T03:32:49Z,2025-09-09T07:52:45+00:00,2,4.33,True,0,1,1,185,3,0,3,MERGED
38539,fix: table editor mobile view,charislam,2025-09-09T01:59:43Z,2025-09-09T13:06:31+00:00,1,11.11,True,4,6,1,2181,4,0,4,MERGED
38538,chore: update cli reference doc,kiwicopple,2025-09-09T01:28:01Z,2025-09-10T07:44:12+00:00,2,30.27,True,6,25,1,0,2,0,2,MERGED
38537,chore: replace all supabase urls with relative urls,charislam,2025-09-09T00:51:10Z,2025-09-09T12:54:33+00:00,1,12.06,True,952,912,311,788,2,0,2,MERGED
38535,Update humans.txt Yuliya Marinova,yuliyambg,2025-09-08T23:13:25Z,2025-09-16T17:23:18+00:00,1,186.16,True,1,0,1,78,3,0,3,MERGED
38534,Update humans.txt - Yuliya Marinova,yuliyamarinova,2025-09-08T20:42:47Z,2025-09-08T23:07:19+00:00,1,2.41,False,1,0,1,86,4,0,4,CLOSED
38533,fix: hide hidden pages from llms.txt,charislam,2025-09-08T20:33:31Z,2025-09-09T14:47:27+00:00,1,18.23,True,41,20,3,148,2,0,2,MERGED
38532,feat(web): hero banner to promote upcoming webinar.,stylessh,2025-09-08T20:23:17Z,2025-09-09T13:25:14+00:00,2,17.03,True,11,5,2,330,2,0,2,MERGED
38530,fix(docs): typespec support for tags in v0.23+,charislam,2025-09-08T17:49:15Z,2025-09-09T10:19:56+00:00,1,16.51,True,7,0,1,190,2,0,2,MERGED
38528,fix: sitemap generation with SDKs disabled,charislam,2025-09-08T17:26:10Z,2025-09-09T12:47:32+00:00,1,19.36,True,1,0,1,186,2,0,2,MERGED
38527,chore(docs): feature flag compliance content,charislam,2025-09-08T17:19:03Z,2025-09-09T14:52:48+00:00,1,21.56,True,9,0,3,0,2,0,2,MERGED
38524,fix: usage page select project ref,alaister,2025-09-08T16:34:06Z,2025-09-09T05:26:31+00:00,2,12.87,True,23,21,2,0,2,0,2,MERGED
38523,feat(studio): update query performance table ui,kemaldotearth,2025-09-08T15:45:53Z,2025-09-10T16:40:25+00:00,19,48.91,True,186,131,9,620,4,7,11,MERGED
38522,Add myself to humans.txt,tomaspozo,2025-09-08T15:35:17Z,2025-09-12T01:53:11+00:00,1,82.3,True,1,0,1,37,2,0,2,MERGED
38520,docs: Overhaul MCP page,ChrisChinchilla,2025-09-08T13:47:58Z,2025-09-09T11:30:23+00:00,1,21.71,True,75,70,2,248,2,0,2,MERGED
38518,chore(docs): remove excess newline,jasonprojects23,2025-09-08T12:26:13Z,2025-09-09T13:50:15+00:00,1,25.4,True,1,2,1,201,4,0,4,MERGED
38516,chore: customizable dashboard auth,alaister,2025-09-08T11:08:36Z,2025-09-09T07:04:27+00:00,1,19.93,True,193,44,11,135,2,0,2,MERGED
38515,"fix: remove warehouse_logs, adjust function edge logs descriptoin",Ziinc,2025-09-08T10:50:59Z,2025-09-25T06:55:24+00:00,1,404.07,True,2,8,2,84,2,0,2,MERGED
38512,chore: update and remove deprecated cli command sections,sweatybridge,2025-09-08T09:27:52Z,2025-09-08T17:18:27+00:00,1,7.84,True,12,30,1,184,2,0,2,MERGED
38511,fix: estimate data branch cost before creation,sweatybridge,2025-09-08T09:10:25Z,2025-09-09T09:00:12+00:00,4,23.83,True,286,114,3,210,5,2,7,MERGED
38500,fix: remove duplicate tweet,dnywh,2025-09-08T02:00:55Z,2025-09-08T07:04:50+00:00,1,5.07,True,0,6,1,308,2,0,2,MERGED
38499,Fix adding bucket policy to schema,SaxonF,2025-09-07T22:50:41Z,2025-09-08T04:25:46+00:00,1,5.58,True,4,6,1,87,2,0,2,MERGED
38488,Docs: expand Connecting to Postgres guide with new FAQ entries,monicakh,2025-09-06T20:23:05Z,2025-09-10T13:26:25+00:00,3,89.06,True,212,12,4,338,6,11,17,MERGED
38479,fix: do not auto submit on toggling data branch,sweatybridge,2025-09-05T18:47:01Z,2025-09-08T08:58:55+00:00,1,62.2,True,25,21,1,229,4,0,4,MERGED
38477,fix: don't render hidden pages,charislam,2025-09-05T18:18:55Z,2025-09-08T17:05:38+00:00,1,70.78,True,212,12,8,199,2,0,2,MERGED
38473,feat(replication): Add UI for updating pipeline versions,iambriccardo,2025-09-05T14:29:40Z,2025-09-10T09:26:37+00:00,4,114.95,True,545,192,8,380,3,3,6,MERGED
38472,docs: create Vercel project deletion troubleshooting guide,jenniekibiri,2025-09-05T14:15:58Z,2025-09-08T10:59:36+00:00,1,68.73,True,171,0,10,411,2,0,2,MERGED
38471,chore(docs): put feedback form behind feature flag,charislam,2025-09-05T13:00:23Z,2025-09-05T21:02:42+00:00,1,8.04,True,16,3,3,0,2,0,2,MERGED
38470,feat(studio): simplify query performance filters,kemaldotearth,2025-09-05T12:58:26Z,2025-09-09T11:18:32+00:00,17,94.33,True,51,78,3,288,3,5,8,MERGED
38465,feat: ensure customer puts down address on upgrade,kevcodez,2025-09-05T10:01:59Z,2025-09-08T06:26:04+00:00,2,68.4,True,16,41,2,194,3,0,3,MERGED
38464,chore: custom ssl cert url,alaister,2025-09-05T09:53:04Z,2025-09-09T05:12:17+00:00,2,91.32,True,25,9,5,55,3,0,3,MERGED
38463,Shift refresh button to header in table editor and make realtime + API docs button smaller,joshenlim,2025-09-05T09:46:21Z,2025-09-08T06:15:39+00:00,1,68.49,True,73,68,12,490,3,0,3,MERGED
38462,docs: Update database settings to connection popup,ChrisChinchilla,2025-09-05T09:45:55Z,2025-09-08T10:40:25+00:00,4,72.91,True,13,13,11,204,3,3,6,MERGED
38460, feat: add AP2 support for datadog for log drains,Ziinc,2025-09-05T08:34:50Z,2025-09-10T04:50:16+00:00,1,116.26,True,4,0,1,102,3,0,3,MERGED
38459,feat(design-system): add contentlayer watch task to package.json,kemaldotearth,2025-09-05T08:34:16Z,2025-09-05T10:19:49+00:00,1,1.76,True,11,0,2,304,2,0,2,MERGED
38458,Swap useCheckPermissions with useAsyncCheckPermissions part 4: Storage,joshenlim,2025-09-05T08:33:18Z,2025-09-08T05:39:13+00:00,1,69.1,True,226,214,16,1276,3,0,3,MERGED
38457,fix(studio): hide internal schemas in create ext modal,soedirgo,2025-09-05T07:52:12Z,2025-09-05T12:27:19+00:00,1,4.59,True,21,12,1,0,3,0,3,MERGED
38452,feat: add support for nimbus prod urls,darora,2025-09-05T00:08:29Z,2025-09-05T02:35:13+00:00,2,2.45,True,6,0,1,0,3,0,3,MERGED
38446,edge function report: cleanup and url filters,jordienr,2025-09-04T20:00:39Z,2025-09-05T09:49:08+00:00,3,13.81,True,164,180,9,161,2,3,5,MERGED
38445,docs: sessions link incorrect,Hallidayo,2025-09-04T19:45:35Z,2025-09-11T16:10:56+00:00,1,164.42,True,1,1,1,247,3,0,3,MERGED
38444,fix: disabled items in nav,charislam,2025-09-04T19:38:44Z,2025-09-04T21:02:19+00:00,1,1.39,True,12,10,1,53,2,0,2,MERGED
38441,New supasquad page,tomaspozo,2025-09-04T18:53:10Z,2025-09-05T19:27:28+00:00,2,24.57,True,2422,113,18,692,2,0,2,MERGED
38440,【CSV file import】Ensure onChange fires when the same file is uploaded twice,taishikato,2025-09-04T16:25:38Z,2025-09-05T15:35:01+00:00,1,23.16,True,1,2,1,699,3,0,3,MERGED
38436,feat: revamp functions.mdx,mansueli,2025-09-04T14:41:03Z,2025-09-08T20:56:11+00:00,3,102.25,True,143,1,4,395,2,13,15,MERGED
38431,feat: show warning on oauth app connect,cemalkilic,2025-09-04T09:51:00Z,2025-09-11T14:36:08+00:00,2,172.75,True,14,0,2,88,4,0,4,MERGED
38430,Fix missing loading prop in ConfirmationModal for disabling extension,joshenlim,2025-09-04T09:50:24Z,2025-09-04T13:34:33+00:00,1,3.74,True,1,0,1,187,3,0,3,MERGED
38426,fix: estimate time needed to create data branch,sweatybridge,2025-09-04T06:53:26Z,2025-09-04T08:59:47+00:00,1,2.11,True,51,4,1,58,3,0,3,MERGED
38422,Show an error message with a row number when a user uploads CSV file with an issue,taishikato,2025-09-04T02:18:29Z,2025-09-09T22:30:24+00:00,4,140.2,True,134,92,5,3311,14,2,16,MERGED
38418,fix: Populate state field in billing address form,kanishkdudeja,2025-09-03T19:58:59Z,2025-09-04T02:22:07+00:00,3,6.39,True,1,0,1,1104,3,0,3,MERGED
38417,Add Sam Meech-Ward to humans.txt,meech-ward,2025-09-03T17:15:11Z,2025-09-04T08:33:10+00:00,1,15.3,True,1,0,1,0,3,0,3,MERGED
38413,Changed Mendable to Firecrawl,CoolAssPuppy,2025-09-03T15:16:14Z,2025-09-15T13:59:04+00:00,1,286.71,True,128,110,21,147,3,0,3,MERGED
38409,unblock cms draft mode,fsansalvadore,2025-09-03T13:31:27Z,2025-09-16T11:03:13+00:00,1,309.53,True,125,95,17,34,2,0,2,MERGED
38408,feat(studio): usage area brush up,kemaldotearth,2025-09-03T12:42:39Z,2025-09-08T10:11:51+00:00,13,117.49,True,226,160,11,267,4,4,8,MERGED
38407,feat(replication): Add ability to copy pipeline id and filter logs by pipeline id,iambriccardo,2025-09-03T11:53:09Z,2025-09-04T13:47:01+00:00,6,25.9,True,209,94,8,568,3,4,7,MERGED
38404,Fix table editor incorrectly showing type change notice for foreign key,joshenlim,2025-09-03T11:18:16Z,2025-09-04T08:35:36+00:00,1,21.29,True,8,13,1,599,2,0,2,MERGED
38395,chore(self-hosted): bump up edge-runtime image version to v1.69.6,nyannyacha,2025-09-03T05:23:13Z,2025-09-03T06:56:59+00:00,2,1.56,True,1,1,1,140,2,0,2,MERGED
38394,Gracefully handle feature flag set up,joshenlim,2025-09-03T05:06:20Z,2025-09-10T04:00:16+00:00,2,166.9,True,47,25,6,2220,4,1,5,MERGED
38392,docs: storage limits,dnywh,2025-09-03T03:20:20Z,2025-09-03T05:33:25+00:00,5,2.22,True,30,36,4,392,3,2,5,MERGED
38391,Add Hardik to humans.txt,hardikm10,2025-09-03T02:46:49Z,2025-09-03T10:19:39+00:00,1,7.55,True,1,0,1,338,2,0,2,MERGED
38390,chore: api keys ux improvements,dnywh,2025-09-03T01:59:20Z,2025-09-03T04:39:00+00:00,1,2.66,True,98,84,4,641,4,0,4,MERGED
38389,Improves the filter bar,SaxonF,2025-09-02T23:55:21Z,2025-09-09T18:06:25+00:00,1,162.18,True,2649,1000,21,69,3,0,3,MERGED
38386,Add SQL syntax highlighting to Query Performance page,taishikato,2025-09-02T18:51:08Z,2025-09-05T00:20:05+00:00,5,53.48,True,183,24,5,288,11,1,12,MERGED
38383,fix(studio): empty state of access tokens width,kemaldotearth,2025-09-02T15:36:39Z,2025-09-02T16:47:19+00:00,1,1.18,True,2,2,1,195,3,0,3,MERGED
38381,Update humans.txt,issuedat,2025-09-02T13:43:25Z,2025-09-16T14:20:36+00:00,1,336.62,True,1,0,1,41,2,0,2,MERGED
38374,chore: Remove unused code from `ui-library`,ivasilov,2025-09-02T09:29:18Z,2025-09-02T13:36:41+00:00,2,4.12,True,49,2208,41,60,2,1,3,MERGED
38372,docs: Fix Key changes for functions,ChrisChinchilla,2025-09-02T09:24:07Z,2025-09-09T06:27:44+00:00,4,165.06,True,2,2,1,139,2,1,3,MERGED
38369,Add Edge Function Report Filters,jordienr,2025-09-02T08:34:00Z,2025-09-04T07:03:40+00:00,7,46.49,True,846,187,11,418,4,4,8,MERGED
38365,Add Tim to humans.txt,thewheat,2025-09-02T05:29:54Z,2025-09-02T07:36:57+00:00,1,2.12,True,1,0,1,111,3,0,3,MERGED
38360,Switched to Zoom and changed registration link,CoolAssPuppy,2025-09-01T19:33:21Z,2025-09-01T20:46:34+00:00,1,1.22,True,1,1,1,107,2,0,2,MERGED
38352,chore: Bump vulnerable dependencies,ivasilov,2025-09-01T13:00:24Z,2025-09-10T12:36:48+00:00,1,215.61,True,248,228,3,385,2,0,2,MERGED
38350,Fix TableEditor keyboard copy action copies who cell value even when only a subset is highlighted while editing cell,joshenlim,2025-09-01T11:45:00Z,2025-09-01T15:50:49+00:00,1,4.1,True,7,5,2,891,2,0,2,MERGED
38344,feat: v1 migrations endpoint for self hosted,sweatybridge,2025-09-01T08:19:39Z,2025-09-04T10:29:48+00:00,1,74.17,True,100,0,1,176,3,0,3,MERGED
38343,design system: text color contrast,dnywh,2025-09-01T05:40:42Z,2025-09-09T01:45:08+00:00,3,188.07,True,148,237,45,1205,4,0,4,MERGED
38341,Home New: Report,SaxonF,2025-09-01T04:28:58Z,2025-09-16T03:00:25+00:00,2,358.52,True,558,85,5,152,5,1,6,MERGED
38339,Home New: Project Usage,SaxonF,2025-09-01T03:14:49Z,2025-09-11T23:34:28+00:00,1,260.33,True,621,11,6,292,3,0,3,MERGED
38337,Home New: Advisors,SaxonF,2025-09-01T02:15:24Z,2025-09-10T02:49:34+00:00,1,216.57,True,493,157,10,338,3,9,12,MERGED
38336,Home New: Top,SaxonF,2025-09-01T01:15:48Z,2025-09-04T00:58:30+00:00,6,71.71,True,1135,400,11,250,5,4,9,MERGED
38334,typo,William-LP,2025-08-31T17:37:13Z,2025-09-01T16:03:19+00:00,1,22.43,True,3,3,1,252,3,0,3,MERGED
38330,Changed Mobbin logo,CoolAssPuppy,2025-08-31T05:58:51Z,2025-08-31T09:22:08+00:00,1,3.39,True,0,0,2,129,2,0,2,MERGED
38318,Update Docs: Adding missing 'to' in NO ACTION and RESTRICT options,jeffjenk,2025-08-30T10:57:50Z,2025-09-11T16:14:34+00:00,2,293.28,True,1,1,1,184,3,0,3,MERGED
38312,feat: add aws nimbus cloud provider,alaister,2025-08-29T20:39:46Z,2025-09-01T08:06:43+00:00,1,59.45,True,72,31,10,0,3,0,3,MERGED
38311,Webinar setup,CoolAssPuppy,2025-08-29T20:07:30Z,2025-08-29T21:59:39+00:00,1,1.87,True,61,0,2,338,2,0,2,MERGED
38308,Fix SQL Editor search not showing snippets in folders,joshenlim,2025-08-29T15:57:23Z,2025-09-01T07:51:03+00:00,1,63.89,True,6,1,1,738,3,0,3,MERGED
