number,title,author,createdAt,closedOrMergedAt,reviewsCount,hoursOpen,merged,additions,deletions,changedFiles,bodyLength,issueCommentsCount,reviewThreadsCount,interactionsCount,finalReviewState
38307,fix(design-system): missing path and deps,kemaldotearth,2025-08-29T15:52:21Z,2025-09-02T08:54:06+00:00,16,89.03,True,926,184,18,387,4,6,10,MERGED
38306,New SupaSquad page,tomaspozo,2025-08-29T13:53:00Z,2025-09-04T19:01:17+00:00,4,149.14,False,2414,112,17,692,4,2,6,CLOSED
38303,Docs: clarify CLI v2 config change behavior,monicakh,2025-08-29T12:29:34Z,2025-09-01T11:44:02+00:00,1,71.24,True,26,1,1,338,2,0,2,MERGED
38299,chore: minor clarity improvements on new project creation,dnywh,2025-08-29T06:56:28Z,2025-08-31T23:07:59+00:00,1,64.19,True,19,13,7,698,4,0,4,MERGED
38298,Support for projects pagination part 1,joshenlim,2025-08-29T06:01:46Z,2025-09-11T06:02:58+00:00,9,312.02,True,589,276,18,3290,8,5,13,MERGED
38297,Fix policy alignment,SaxonF,2025-08-29T05:25:56Z,2025-08-29T09:36:29+00:00,1,4.18,True,1,1,1,56,3,0,3,MERGED
38296,fix(edge-functions): parse eszip made from edge-runtime v1.69.x correctly,nyannyacha,2025-08-29T04:34:14Z,2025-09-02T01:23:22+00:00,1,92.82,True,96,52,8,406,3,0,3,MERGED
38294,Homepage,SaxonF,2025-08-29T03:46:54Z,2025-10-06T01:27:46+00:00,1,909.68,False,3583,528,28,43,3,5,8,CLOSED
38292,fix: small typo in identites -> identities,cstockton,2025-08-28T21:56:43Z,2025-09-03T22:28:47+00:00,1,144.53,True,4,4,4,347,2,0,2,MERGED
38290,fix: improve wording about transaction pooler,v0idpwn,2025-08-28T19:43:48Z,2025-08-28T20:43:57+00:00,2,1.0,True,1,1,1,132,2,0,2,MERGED
38287,Fix 404 link in Docs,cwdott,2025-08-28T19:28:41Z,2025-09-11T16:22:16+00:00,2,332.89,True,1,1,1,293,3,0,3,MERGED
38283,Eric Finally Updates humans.txt,ekhar,2025-08-28T15:48:42Z,2025-09-01T09:23:38+00:00,1,89.58,True,1,0,1,28,2,0,2,MERGED
38282,docs: feature toggle tests,ChrisChinchilla,2025-08-28T15:24:39Z,2025-09-04T14:46:08+00:00,1,167.36,True,1842,523,82,143,2,0,2,MERGED
38280,chore: add lint warning for pg version,staaldraad,2025-08-28T14:36:51Z,2025-09-08T17:40:05+00:00,1,267.05,True,10,0,2,60,2,0,2,MERGED
38279,Docs/UI library vue nuxt clients,Baroshem,2025-08-28T14:28:26Z,2025-09-26T12:48:47+00:00,6,694.34,True,4777,280,33,674,5,2,7,MERGED
38272,feat: clearer upload limits,dnywh,2025-08-28T07:31:38Z,2025-09-03T02:05:34+00:00,17,138.57,True,863,648,18,1796,7,8,15,MERGED
38270,Small fix to prevent layout shift in SQL editor when running query,joshenlim,2025-08-28T06:28:26Z,2025-09-01T09:08:01+00:00,1,98.66,True,5,5,3,583,3,0,3,MERGED
38267,Choose provider and model,SaxonF,2025-08-28T01:29:46Z,2025-09-09T10:05:40+00:00,3,296.6,True,477,852,13,66,3,3,6,MERGED
38265,docs(auth): add Flutter signInWithIdToken example for Facebook auth,grdsdev,2025-08-27T22:15:29Z,2025-08-28T11:16:20+00:00,3,13.01,True,82,2,3,551,2,1,3,MERGED
38256,Fix restart DB TS error,joshenlim,2025-08-27T14:25:47Z,2025-08-28T04:09:37+00:00,2,13.73,True,10,7,1,472,3,1,4,MERGED
38255,ref(docs): Respect x-internal openapi spec attribute,kamilogorek,2025-08-27T13:58:26Z,2025-09-03T22:46:49+00:00,1,176.81,True,6,54,2,75,2,0,2,MERGED
38253,docs: clarify the use of secret api key for accessing customer metrics,hf,2025-08-27T13:13:13Z,2025-09-15T09:57:16+00:00,1,452.73,True,6,1,1,18,2,0,2,MERGED
38252,docs: clarify user_metadata,hf,2025-08-27T13:10:45Z,2025-09-10T07:58:20+00:00,1,330.79,True,17,17,1,18,2,0,2,MERGED
38251,[www] compress public/images,fsansalvadore,2025-08-27T13:10:29Z,2025-08-28T08:45:49+00:00,1,19.59,True,479,66453,3011,285,2,0,2,MERGED
38250,docs: clarify empty jwks.json,hf,2025-08-27T13:07:38Z,2025-09-10T07:58:08+00:00,1,330.84,True,1,1,1,18,2,0,2,MERGED
38241,[www] clean up lib/constants file,fsansalvadore,2025-08-27T08:59:33Z,2025-08-28T08:44:32+00:00,1,23.75,True,6,30,6,30,2,0,2,MERGED
38240,[www] remove lodash,fsansalvadore,2025-08-27T08:59:12Z,2025-08-28T08:44:49+00:00,1,23.76,True,178,54,19,31,3,0,3,MERGED
38239,[www] use dynamic imports,fsansalvadore,2025-08-27T08:58:27Z,2025-08-28T08:44:14+00:00,1,23.76,True,91,75,3,39,2,0,2,MERGED
38237,feat(replication): Significantly improve the replication UI behavior,iambriccardo,2025-08-27T08:17:56Z,2025-08-29T10:20:51+00:00,5,50.05,True,1195,806,20,1175,3,4,7,MERGED
38236,Chore/finalize setup configcat www,joshenlim,2025-08-27T07:30:29Z,2025-09-01T09:17:45+00:00,3,121.79,True,25,10,4,714,2,1,3,MERGED
38233,Fix policy header actions,joshenlim,2025-08-27T07:08:12Z,2025-08-28T03:51:15+00:00,1,20.72,True,1,1,1,172,3,0,3,MERGED
38229,update realtime and storage policies,SaxonF,2025-08-27T05:21:02Z,2025-08-27T09:07:27+00:00,4,3.77,True,104,119,9,74,3,3,6,MERGED
38228,Assistant UI refine,SaxonF,2025-08-27T04:39:37Z,2025-08-28T05:39:26+00:00,2,25.0,True,488,428,10,121,3,1,4,MERGED
38225,Refine roles,SaxonF,2025-08-26T23:23:26Z,2025-08-27T05:41:06+00:00,1,6.29,True,17,14,1,92,3,0,3,MERGED
38222,add sentry log to permission query error,jordienr,2025-08-26T18:57:21Z,2025-08-27T05:34:06+00:00,1,10.61,True,8,1,1,0,3,0,3,MERGED
38220,realtime: add ai rules,filipecabaco,2025-08-26T16:11:32Z,2025-08-28T12:39:50+00:00,1,44.47,True,866,6,11,108,2,0,2,MERGED
38210,Adds Kanishk to humans.txt,kanishkdudeja,2025-08-26T06:33:00Z,2025-08-26T12:23:03+00:00,1,5.83,True,1,0,1,111,2,0,2,MERGED
38204,Refine the policies page,SaxonF,2025-08-26T03:57:46Z,2025-08-26T15:09:17+00:00,3,11.19,True,287,301,9,117,2,2,4,MERGED
38203,"Shift useFlag hook and configcat library to common package, remove from Studio",joshenlim,2025-08-26T03:27:50Z,2025-08-27T06:42:20+00:00,3,27.24,True,189,1273,45,1104,2,0,2,MERGED
38202,chore: update cli reference doc,kiwicopple,2025-08-26T02:11:00Z,2025-08-26T04:50:24+00:00,1,2.66,True,5,1,1,0,2,0,2,MERGED
38199,Add David Weitzman to humans.txt,dweitzman,2025-08-25T21:48:05Z,2025-08-26T12:45:49+00:00,1,14.96,True,1,0,1,0,3,0,3,MERGED
38198,fix: replace typo in Multigres diagram,w3b6x9,2025-08-25T21:32:32Z,2025-08-26T15:55:39+00:00,1,18.39,True,0,0,1,0,2,0,2,MERGED
38192,Swap to use paginated projects endpoint,joshenlim,2025-08-25T15:51:05Z,2025-08-27T07:09:58+00:00,2,39.31,True,125,99,32,1036,3,0,3,MERGED
38191,Chore/use default badge for paused state in project row,joshenlim,2025-08-25T15:19:11Z,2025-08-27T04:12:26+00:00,1,36.89,True,8,16,3,527,3,0,3,MERGED
38187,realtime: remove broadcast from footer,filipecabaco,2025-08-25T14:15:16Z,2025-08-25T22:18:08+00:00,3,8.05,True,1,9,1,248,2,0,2,MERGED
38178,docs(react-native): Expo cross-platform social sign-in with complete example ,massimodeluisa,2025-08-25T10:24:15Z,2025-09-19T14:53:36+00:00,15,604.49,True,16857,0,59,1545,5,9,14,MERGED
38177,www nav CTAs to only render after user is loaded,joshenlim,2025-08-25T10:08:59Z,2025-08-26T02:49:57+00:00,1,16.68,True,49,44,1,335,2,0,2,MERGED
38174,fix: Correct learn more link on developer.apple.com,codenamenam,2025-08-25T08:58:05Z,2025-09-18T17:11:09+00:00,4,584.22,True,1,1,1,281,3,0,3,MERGED
38173,Update clone-project.mdx to show whats transferred clearer,aaronByrne1,2025-08-25T08:56:39Z,2025-08-29T16:27:14+00:00,1,103.51,True,23,3,2,340,5,0,5,MERGED
38171,EditBucketModal not selecting the correct unit,joshenlim,2025-08-25T07:56:17Z,2025-08-27T05:04:04+00:00,1,45.13,True,220,213,9,624,2,0,2,MERGED
38141,docs(auth-hooks): clarify webhook status codes and document email_change quirk,cstockton,2025-08-23T00:32:11Z,2025-08-26T15:41:13+00:00,9,87.15,True,70,14,2,628,2,6,8,MERGED
38134,docs: Fix delete objects limit,Hallidayo,2025-08-22T18:22:03Z,2025-09-16T14:20:28+00:00,2,595.97,True,6,0,1,346,3,0,3,MERGED
38133,fix: studio storage settings link,Hallidayo,2025-08-22T18:13:22Z,2025-09-16T20:50:04+00:00,1,602.61,True,8,5,1,331,4,0,4,MERGED
38129,Reports consolidation 1: Edge Functions,jordienr,2025-08-22T14:32:37Z,2025-09-01T09:10:30+00:00,14,234.63,True,1446,733,31,954,3,11,14,MERGED
38128,"feat: more charts, use functions.combined-stats",Ziinc,2025-08-22T14:16:18Z,2025-09-05T10:43:58+00:00,1,332.46,True,649,130,6,141,3,0,3,MERGED
38127,Auto select smart region as default in new project page,joshenlim,2025-08-22T12:30:35Z,2025-08-25T15:53:40+00:00,1,75.38,True,1,1,1,343,3,0,3,MERGED
38122,fix wrapper name row ui,jordienr,2025-08-22T09:48:14Z,2025-08-25T09:11:49+00:00,2,71.39,True,24,3,1,151,3,0,3,MERGED
38117,generic opt in copy,SaxonF,2025-08-22T05:52:39Z,2025-09-09T07:00:59+00:00,3,433.14,True,21,24,2,54,3,2,5,MERGED
38113,Refine the integrations page,SaxonF,2025-08-22T00:06:36Z,2025-08-27T14:18:30+00:00,8,134.2,True,1166,846,31,122,3,6,9,MERGED
38101,docs: update migration admonition,tk1ng,2025-08-21T17:10:59Z,2025-08-27T13:54:56+00:00,4,140.73,True,1,3,1,423,4,1,5,MERGED
38099,style: use GitHub's right product name,raulb,2025-08-21T16:42:21Z,2025-08-22T11:43:48+00:00,6,19.02,True,83,83,57,529,3,1,4,MERGED
38096,fix(studio): column sizes for access tokens,kemaldotearth,2025-08-21T13:04:32Z,2025-08-21T15:02:46+00:00,2,1.97,True,9,6,1,214,3,0,3,MERGED
38094,feat(ui): add shadow to tables on inner scroll,kemaldotearth,2025-08-21T12:37:15Z,2025-08-26T17:05:53+00:00,5,124.48,True,221,81,9,430,3,2,5,MERGED
38091,Chore/disable more sections 05,joshenlim,2025-08-21T08:24:49Z,2025-08-22T08:50:24+00:00,1,24.43,True,44,31,4,459,2,0,2,MERGED
38090,Chore/custom content connect UI frameworks,joshenlim,2025-08-21T07:52:15Z,2025-08-22T09:57:40+00:00,2,26.09,True,212,42,12,1883,3,1,4,MERGED
38087,Chore/custom content logs default query,joshenlim,2025-08-21T06:26:01Z,2025-08-22T09:23:25+00:00,2,26.96,True,24,5,5,378,3,0,3,MERGED
38086,Chore/custom content example projects,joshenlim,2025-08-21T06:17:31Z,2025-08-22T09:14:24+00:00,2,26.95,True,113,58,8,357,3,0,3,MERGED
38074,"Nudge feedback widget, move request to bedrock",saltcod,2025-08-20T18:31:01Z,2025-08-21T11:26:54+00:00,1,16.93,True,83,96,4,227,3,0,3,MERGED
38073,Chore/custom content hook,joshenlim,2025-08-20T16:38:58Z,2025-08-22T08:52:28+00:00,3,40.23,True,197,0,8,1798,3,1,4,MERGED
38070,Clarify extension docs that custom extensions are not supported,encima,2025-08-20T15:52:21Z,2025-08-23T11:57:51+00:00,2,68.09,True,5,1,1,424,2,2,4,MERGED
38064,Chore/disable more sections 04,joshenlim,2025-08-20T13:00:44Z,2025-08-22T08:17:43+00:00,1,43.28,True,548,390,19,1295,3,0,3,MERGED
38060,chore/disable-more-sections-03,joshenlim,2025-08-20T09:47:06Z,2025-08-20T13:50:53+00:00,1,4.06,True,133,180,14,522,2,0,2,MERGED
38058,Chore/disable more sections 02,joshenlim,2025-08-20T09:16:43Z,2025-08-20T12:17:35+00:00,1,3.01,True,290,345,13,763,2,0,2,MERGED
38057,Chore/disable more sections 01,joshenlim,2025-08-20T07:26:10Z,2025-08-20T11:59:43+00:00,1,4.56,True,510,205,21,312,2,0,2,MERGED
38050,docs(realtime): add more examples,edgurgel,2025-08-20T01:01:01Z,2025-08-21T06:57:05+00:00,2,29.93,True,24,8,1,301,4,0,4,MERGED
38049,docs(realtime): JWT claims can be accessed when authorising channels,edgurgel,2025-08-20T00:31:43Z,2025-08-20T23:05:51+00:00,1,22.57,True,18,5,2,339,2,0,2,MERGED
38045,cms www blog,fsansalvadore,2025-08-19T20:36:46Z,2025-09-03T12:49:28+00:00,1,352.21,True,34967,2126,106,1835,3,0,3,MERGED
38043,feat: remove server-side page tracking calls,seanoliver,2025-08-19T18:13:47Z,2025-08-25T20:30:14+00:00,1,146.27,True,2,39,1,1037,2,0,2,MERGED
38042,feat(profile): add self-serve editing of username and primary email,cstockton,2025-08-19T17:23:05Z,2025-08-25T14:30:57+00:00,3,141.13,True,209,75,7,828,4,1,5,MERGED
38040,blog: Lw15 hackathon winner,dshukertjr,2025-08-19T15:46:56Z,2025-08-20T13:07:25+00:00,1,21.34,True,123,0,13,152,2,0,2,MERGED
38039,realtime: Improve documentation about message storage,filipecabaco,2025-08-19T15:14:06Z,2025-08-20T09:29:09+00:00,2,18.25,True,6,0,1,182,2,1,3,MERGED
38034,feat(studio): update other account sections to match access tokens,kemaldotearth,2025-08-19T13:04:09Z,2025-08-19T14:24:01+00:00,1,1.33,True,84,61,3,283,3,0,3,MERGED
38032,doc: add Raúl Barroso,raulb,2025-08-19T11:53:03Z,2025-08-20T07:27:58+00:00,1,19.58,True,1,0,1,109,2,0,2,MERGED
38029,Chore/disable authentication segments,joshenlim,2025-08-19T09:49:31Z,2025-08-20T11:34:42+00:00,1,25.75,True,407,169,14,538,2,0,2,MERGED
38021,Project list updates,SaxonF,2025-08-19T03:43:57Z,2025-08-25T14:57:12+00:00,1,155.22,True,563,286,13,248,3,0,3,MERGED
38020,feat: disable users features,alaister,2025-08-18T23:32:50Z,2025-08-19T06:22:13+00:00,2,6.82,True,152,107,5,159,3,1,4,MERGED
38019,feat: disable database features,alaister,2025-08-18T23:17:41Z,2025-08-19T04:52:00+00:00,3,5.57,True,139,75,8,139,2,2,4,MERGED
38018,docs: fix jwt signing key cli ref,TylerHillery,2025-08-18T22:58:29Z,2025-08-19T09:48:48+00:00,2,10.84,True,6,0,1,359,2,0,2,MERGED
38013,fix padding in project homepage,jordienr,2025-08-18T15:01:16Z,2025-08-18T16:09:17+00:00,1,1.13,True,1,1,1,58,4,0,4,MERGED
38011,docs: Change key name for dynamic loading docs,ChrisChinchilla,2025-08-18T14:21:33Z,2025-09-09T07:28:49+00:00,2,521.12,True,23,23,18,192,2,1,3,MERGED
38010,fix unified logs gate,jordienr,2025-08-18T13:52:50Z,2025-08-18T16:39:10+00:00,1,2.77,True,4,5,2,0,3,0,3,MERGED
38008,docs: Tweaks to React quickstart,ChrisChinchilla,2025-08-18T12:47:38Z,2025-09-05T12:23:19+00:00,1,431.59,True,2,2,1,159,3,0,3,MERGED
38006,feat(studio): account area ui updates,kemaldotearth,2025-08-18T12:08:19Z,2025-08-21T12:40:03+00:00,2,72.53,True,211,235,8,280,3,0,3,MERGED
38004,Add Cameron Blackwood to humans.txt,Reikon95,2025-08-18T09:54:38Z,2025-08-18T15:35:29+00:00,1,5.68,True,1,0,1,217,3,0,3,MERGED
38002,unified logs: rm org plan check,jordienr,2025-08-18T09:29:58Z,2025-08-18T12:12:40+00:00,1,2.71,True,2,7,1,0,3,0,3,MERGED
37996,Update `/project/_/settings/api` page for consistency with other Project Settings pages,Saeris,2025-08-18T05:51:30Z,2025-08-18T15:42:41+00:00,3,9.85,True,342,355,3,307,5,1,6,MERGED
37995,Fix CSV import for postgres array types,joshenlim,2025-08-18T04:30:03Z,2025-08-19T04:39:08+00:00,1,24.15,True,143,33,3,1168,3,0,3,MERGED
37991,feat: disable org features,alaister,2025-08-17T22:58:49Z,2025-08-19T04:03:29+00:00,3,29.08,True,140,41,8,88,4,0,4,MERGED
37990,feat: disable project homepage features,alaister,2025-08-17T22:34:57Z,2025-08-18T07:59:24+00:00,4,9.41,True,198,98,10,213,3,2,5,MERGED
37989,feat: disable logs features,alaister,2025-08-17T22:00:59Z,2025-08-18T06:21:04+00:00,2,8.33,True,104,46,5,83,3,1,4,MERGED
37987,Added new solutions pages and a new case study,CoolAssPuppy,2025-08-17T19:44:43Z,2025-09-12T06:33:09+00:00,1,610.81,True,4572,197,66,151,3,0,3,MERGED
37976,fix: update prod branch name together with git branch,sweatybridge,2025-08-17T05:10:26Z,2025-08-19T09:32:30+00:00,1,52.37,True,1,0,1,216,3,0,3,MERGED
37972,chore: add additional playwright tests for table editor,Michaelomh,2025-08-16T15:36:51Z,2025-08-22T08:15:07+00:00,1,136.64,True,627,369,10,2677,4,0,4,MERGED
37968,add missing onRouterTransitionStart,jordienr,2025-08-16T10:06:53Z,2025-08-25T09:12:24+00:00,3,215.09,True,4,0,2,20,3,2,5,MERGED
37965,Replace deprecated components on `/authorize` page,Saeris,2025-08-16T06:25:10Z,2025-08-26T06:47:32+00:00,2,240.37,True,189,148,2,675,4,1,5,MERGED
37962,Replace deprecated `Alert` in `/claim-project` page,Saeris,2025-08-16T00:39:41Z,2025-08-26T04:15:53+00:00,3,243.6,True,29,27,2,344,4,1,5,MERGED
37956,Fix studio dynamic route mock setup,Saeris,2025-08-15T15:51:54Z,2025-08-15T19:48:08+00:00,1,3.94,False,8,6,3,522,3,1,4,CLOSED
37954,fix(www): alignment of edge functions page highlights,kemaldotearth,2025-08-15T13:54:45Z,2025-08-15T15:51:43+00:00,1,1.95,True,1,0,1,148,2,0,2,MERGED
37950,use customrender in bucketmodal tests,jordienr,2025-08-15T11:31:45Z,2025-08-15T17:40:29+00:00,1,6.15,False,0,559,5,26,2,0,2,CLOSED
37949,feat(studio): update access token area ui,kemaldotearth,2025-08-15T11:00:46Z,2025-08-19T10:10:56+00:00,15,95.17,True,812,370,14,604,4,7,11,MERGED
37946,FE-1813: Audit Logs Improvements,jordienr,2025-08-15T09:00:57Z,2025-08-15T17:41:29+00:00,2,8.68,True,152,129,3,442,2,1,3,MERGED
37945,Refactor search list in sql editor to have context menu,joshenlim,2025-08-15T08:36:49Z,2025-08-18T03:26:33+00:00,7,66.83,True,515,268,10,1569,3,3,6,MERGED
37942,Update the docs for domains on google oAuth screens,ivasilov,2025-08-15T06:25:46Z,2025-08-15T08:44:18+00:00,2,2.31,True,2,1,1,0,2,2,4,MERGED
37938,fix: write queries in ai assistant,charislam,2025-08-14T22:40:30Z,2025-08-15T04:15:34+00:00,1,5.58,True,6,5,1,247,3,0,3,MERGED
37937,Fix so can change prod branch,SaxonF,2025-08-14T21:17:06Z,2025-08-15T05:26:57+00:00,1,8.16,True,17,13,1,161,3,0,3,MERGED
37935,style: update `ExpandingTextArea` focus styles,taishikato,2025-08-14T16:44:51Z,2025-08-20T15:52:08+00:00,4,143.12,True,2,2,2,723,5,0,5,MERGED
37930,add etl logs,jordienr,2025-08-14T12:04:53Z,2025-08-15T11:22:40+00:00,1,23.3,True,82,12,7,0,2,0,2,MERGED
37929,docs: Improve the steps for NextJS quickstart,ChrisChinchilla,2025-08-14T11:16:39Z,2025-08-14T13:43:06+00:00,3,2.44,True,34,15,1,222,3,1,4,MERGED
37928,docs: add missing Swift client functions to specification,grdsdev,2025-08-14T10:16:47Z,2025-08-25T14:00:09+00:00,1,267.72,True,497,0,1,338,2,0,2,MERGED
37927,feat(studio): update chart highlight colour,kemaldotearth,2025-08-14T09:55:04Z,2025-08-18T12:38:42+00:00,5,98.73,True,3,3,1,819,3,1,4,MERGED
37924,Table consistency,SaxonF,2025-08-14T06:21:51Z,2025-08-15T03:16:55+00:00,5,20.92,True,1156,994,22,166,3,3,6,MERGED
37923,fix: defaults to diffing all schemas,sweatybridge,2025-08-14T04:52:34Z,2025-08-19T09:26:02+00:00,2,124.56,True,1,1,1,176,2,0,2,MERGED
37921,feat: enable/disable dashboard features,alaister,2025-08-14T02:13:30Z,2025-08-15T17:45:44+00:00,1,39.54,True,103,35,8,1217,3,0,3,MERGED
37920,fix: add apostrophe for sql export,Hallidayo,2025-08-13T20:34:04Z,2025-09-03T20:59:18+00:00,1,504.42,True,15,4,2,436,6,0,6,MERGED
37919,chore: add BillingManagedBy constant,ignaciodob,2025-08-13T20:33:50Z,2025-08-14T16:32:10+00:00,5,19.97,True,35,6,4,652,2,2,4,MERGED
37918,Fix: Use the `state.editable` instead of the semi-global `editable` variable in Table state,ivasilov,2025-08-13T20:06:19Z,2025-08-14T04:01:11+00:00,1,7.91,True,2,2,1,0,2,0,2,MERGED
37913,[Replace `yup`] Refactor Sign In/Up forms to use shadcn and replace `yup` with `zod`,Saeris,2025-08-13T17:55:35Z,2025-08-15T06:12:34+00:00,10,36.28,True,1518,406,15,462,4,6,10,MERGED
37912,fix: search sync + sentry errors issues,charislam,2025-08-13T17:25:49Z,2025-08-13T20:50:31+00:00,1,3.41,True,8,3,3,655,2,0,2,MERGED
37908,feat(studio): Add expiration date and last used to personal access tokens,kamilogorek,2025-08-13T15:50:18Z,2025-08-20T05:53:51+00:00,2,158.06,True,757,102,12,322,4,0,4,MERGED
37907,reduce stale time for permissions query,jordienr,2025-08-13T15:38:10Z,2025-08-14T12:04:40+00:00,1,20.44,True,1,1,1,5,2,0,2,MERGED
37901,Chore/refactor database publications page,joshenlim,2025-08-13T10:54:30Z,2025-08-14T06:24:06+00:00,5,19.49,True,284,215,8,1101,4,3,7,MERGED
37899,Swap useCheckPermissions with useAsyncCheckProjectPermissions part 3,joshenlim,2025-08-13T10:08:24Z,2025-08-13T12:07:35+00:00,1,1.99,True,503,417,50,2334,3,0,3,MERGED
37898,remove effect for logs redirection,jordienr,2025-08-13T09:47:30Z,2025-08-13T13:37:17+00:00,1,3.83,True,34,69,5,141,3,0,3,MERGED
37896,Bump temp API key expiry to an hour just for realtime inspector,joshenlim,2025-08-13T08:42:05Z,2025-08-14T08:24:30+00:00,1,23.71,True,30,6,4,494,7,0,7,MERGED
37895,Remove captureException in SessionTimeoutModal,joshenlim,2025-08-13T08:31:02Z,2025-08-14T07:42:23+00:00,1,23.19,True,0,9,1,148,3,0,3,MERGED
37894,Chore/setup sentry for www,joshenlim,2025-08-13T05:02:36Z,2025-08-14T08:12:58+00:00,7,27.17,True,148,9,13,922,3,7,10,MERGED
37890,Update LinterPageFooter.tsx,chrisb2244,2025-08-13T02:17:29Z,2025-08-13T15:54:07+00:00,1,13.61,True,1,1,1,376,4,0,4,MERGED
37889,update fair use policy,pamelachia,2025-08-13T00:00:42Z,2025-08-13T09:28:33+00:00,1,9.46,True,1,1,1,130,2,0,2,MERGED
37888,feat: drop file to import data in Table Editor,charislam,2025-08-12T23:30:20Z,2025-08-13T15:32:07+00:00,11,16.03,True,232,67,8,272,2,4,6,MERGED
37879,chore: add confirmation modal when enabling SMS MFA,ignaciodob,2025-08-12T17:42:17Z,2025-08-13T12:06:07+00:00,3,18.4,True,37,15,1,468,3,3,6,MERGED
37877,docs(postgres changes): add sql method for adding tables,charislam,2025-08-12T16:13:23Z,2025-08-13T15:37:24+00:00,1,23.4,True,11,0,1,0,2,0,2,MERGED
37875,fix tabs crash,jordienr,2025-08-12T15:52:59Z,2025-08-12T18:24:44+00:00,1,2.53,True,1,1,1,151,2,0,2,MERGED
37874,use dynamic max values in database reports,jordienr,2025-08-12T15:39:27Z,2025-08-13T11:40:28+00:00,1,20.02,True,47,82,2,183,2,0,2,MERGED
37866,"Adds Report Settings, Chart Header and Tooltip Sync features",jordienr,2025-08-12T12:07:08Z,2025-08-26T09:49:28+00:00,1,333.71,True,625,359,12,411,3,0,3,MERGED
37865,fix: connect Remix guide,Hallidayo,2025-08-12T11:40:15Z,2025-08-12T16:29:46+00:00,1,4.83,True,40,32,1,140,4,0,4,MERGED
37863,Chore/support copy row in table editor,joshenlim,2025-08-12T09:47:32Z,2025-08-13T02:51:04+00:00,1,17.06,True,112,26,3,544,3,0,3,MERGED
37861,docs: add admonition for retrieving branch project id,avallete,2025-08-12T09:27:29Z,2025-08-13T21:14:15+00:00,1,35.78,True,39,0,1,142,2,0,2,MERGED
37860,Part 2 of swapping useCheckPermissions with useAsyncCheckProjectPermissions,joshenlim,2025-08-12T08:52:48Z,2025-08-12T10:34:53+00:00,7,1.7,True,352,305,55,1687,3,4,7,MERGED
37859,chore: update cli reference doc,kiwicopple,2025-08-12T08:52:22Z,2025-08-12T17:42:49+00:00,1,8.84,True,32,50,1,0,2,0,2,MERGED
37855,Fix LinkedIn Developer URL,rendyfebry,2025-08-12T05:42:03Z,2025-08-12T09:03:30+00:00,1,3.36,True,1,1,1,376,3,0,3,MERGED
37854,Chore/align bucket and object naming validation with storage api,joshenlim,2025-08-12T05:12:57Z,2025-08-12T07:01:35+00:00,1,1.81,True,113,50,4,679,4,0,4,MERGED
37853,fix: resolve 50% session tracking discrepancy on root route,seanoliver,2025-08-12T00:52:38Z,2025-08-13T19:54:53+00:00,6,43.04,True,115,17,3,1463,2,3,5,MERGED
37846,Update upgrading.mdx | added pgjwt to deprecation list,TheOtherBrian1,2025-08-11T20:31:35Z,2025-08-12T18:03:08+00:00,1,21.53,True,1,0,1,265,2,0,2,MERGED
37839,docs: Add Xcode isntructions to Swift ref docs,ChrisChinchilla,2025-08-11T15:56:16Z,2025-08-12T06:38:31+00:00,1,14.7,True,4,0,1,146,2,0,2,MERGED
37838,docs: Make Swift client initialization variable consistent,ChrisChinchilla,2025-08-11T15:36:32Z,2025-08-12T06:37:49+00:00,1,15.02,True,5,5,2,306,2,0,2,MERGED
37837,fix: Handle a race condition with permissions API and the cell editors in the Table Editor,ivasilov,2025-08-11T15:26:41Z,2025-08-12T05:19:00+00:00,1,13.87,True,20,23,5,755,3,0,3,MERGED
37830,upgrade sentry,jordienr,2025-08-11T11:32:18Z,2025-08-11T13:47:28+00:00,1,2.25,True,459,1340,4,419,2,0,2,MERGED
37828,docs: add flutter phone factor reference doc and example,grdsdev,2025-08-11T10:46:22Z,2025-08-14T18:03:01+00:00,4,79.28,True,30,3,2,324,2,4,6,MERGED
37827,feat: cached egress rollout,kevcodez,2025-08-11T10:14:31Z,2025-08-13T09:36:48+00:00,9,47.37,True,495,438,31,402,3,3,6,MERGED
37825,fix(design-system): @import rules order should be correct,dengfuping,2025-08-11T02:43:54Z,2025-08-15T12:18:29+00:00,1,105.58,True,4,4,1,342,3,0,3,MERGED
37823,ui consistency issues,SaxonF,2025-08-11T01:23:05Z,2025-08-13T00:55:10+00:00,6,47.53,True,597,582,18,135,4,3,7,MERGED
37808,Update sveltekit.mdx to remove VITE_ prefix from env vars.,biztos,2025-08-09T12:27:17Z,2025-08-12T18:40:34+00:00,1,78.22,True,6,6,1,755,3,0,3,MERGED
37800,Fix security definer RLS example,GaryAustin1,2025-08-08T22:28:49Z,2025-08-12T18:29:40+00:00,1,92.01,True,1,1,1,469,2,0,2,MERGED
37790,feat(replication): Delete destination and pipeline atomically,iambriccardo,2025-08-08T11:45:30Z,2025-08-11T06:23:15+00:00,1,66.63,True,117,69,4,114,3,0,3,MERGED
37788,AWS Marketplace Onboarding Page,ecktoteckto,2025-08-08T11:30:51Z,2025-08-13T09:31:14+00:00,9,118.01,True,1135,49,14,1795,3,3,6,MERGED
37787,Attempt to fix completion,SaxonF,2025-08-08T11:20:42Z,2025-08-12T10:18:24+00:00,1,94.96,True,123,76,3,116,3,0,3,MERGED
37786,Set unusualLineTerminators for grid monaco editor to auto,joshenlim,2025-08-08T11:19:07Z,2025-08-08T15:20:59+00:00,1,4.03,True,1,0,1,185,3,0,3,MERGED
37785,chore: disallow larger instance size launch,kevcodez,2025-08-08T10:15:27Z,2025-08-11T04:35:57+00:00,1,66.34,True,11,13,1,225,2,0,2,MERGED
37784,Button to add preventDefault onClick if disabled,joshenlim,2025-08-08T09:11:08Z,2025-08-12T06:42:55+00:00,3,93.53,True,5,1,1,324,3,1,4,MERGED
37782,feat: state of startups 2025 results page,dnywh,2025-08-08T07:27:55Z,2025-09-04T01:04:30+00:00,1,641.61,True,2965,489,36,955,4,0,4,MERGED
37779,chore: add missing env vars to workflow,sweatybridge,2025-08-08T04:26:40Z,2025-08-08T15:13:18+00:00,1,10.78,True,3,0,1,112,2,0,2,MERGED
37778,fix: specify that 3rd party JWTs must have kid header parameter,edgurgel,2025-08-08T00:35:14Z,2025-08-09T01:45:46+00:00,1,25.18,True,1,1,1,144,2,0,2,MERGED
37777,"Revert ""chore: minor fix to reduce flakiness of database playwright tests""",kimsoo527,2025-08-07T23:52:43Z,2025-08-11T07:42:33+00:00,1,79.83,False,67,132,3,14,3,0,3,CLOSED
37774,refactor: reading markdown docs files,charislam,2025-08-07T18:53:28Z,2025-08-13T15:37:14+00:00,1,140.73,True,455,179,22,455,5,0,5,MERGED
37773,fix: queue user identification calls until PostHog is initialized,seanoliver,2025-08-07T18:37:20Z,2025-08-07T21:02:51+00:00,1,2.43,True,22,1,1,1618,2,0,2,MERGED
37772,docs: remove supabase-js release notes,charislam,2025-08-07T18:33:54Z,2025-08-08T14:21:41+00:00,1,19.8,True,1,309,2,89,2,0,2,MERGED
37767,docs: add direct links to the dashboard for some settings,avallete,2025-08-07T16:22:56Z,2025-08-08T10:44:02+00:00,1,18.35,True,2,2,1,102,2,0,2,MERGED
37758,fix crash in query performance,jordienr,2025-08-07T12:26:48Z,2025-08-08T07:55:01+00:00,1,19.47,True,40,18,4,283,5,0,5,MERGED
37754,fix: diff all schemas on branch merge,sweatybridge,2025-08-07T11:03:06Z,2025-08-12T13:18:24+00:00,3,122.25,True,1,9,4,189,3,0,3,MERGED
