number,title,author,createdAt,closedOrMergedAt,reviewsCount,hoursOpen,merged,additions,deletions,changedFiles,bodyLength,issueCommentsCount,reviewThreadsCount,interactionsCount,finalReviewState
37207,chore: generate pages on demand for staging,charislam,2025-07-16T13:54:18Z,2025-08-05T22:35:36+00:00,1,488.69,True,63,56,19,117,2,0,2,MERGED
37205,feat: Create new schema when creating a FDW with the schema option,ivasilov,2025-07-16T13:11:47Z,2025-07-25T08:54:17+00:00,8,211.71,True,537,294,18,178,8,4,12,MERGED
37202,Advisor rules update for LW15,joshenlim,2025-07-16T10:28:14Z,2025-07-16T14:20:08+00:00,2,3.87,True,272,8,14,279,3,0,3,MERGED
37201,d3,fsansalvadore,2025-07-16T09:59:02Z,2025-07-16T13:58:55+00:00,1,4.0,True,158,11,12,0,2,0,2,MERGED
37200,Chore/async filters for unified logs,joshenlim,2025-07-16T09:43:07Z,2025-07-17T09:33:17+00:00,1,23.84,True,339,103,12,776,3,0,3,MERGED
37198,standardize db report,fsansalvadore,2025-07-16T08:48:51Z,2025-07-16T10:29:01+00:00,1,1.67,True,273,71,5,0,3,0,3,MERGED
37196,Refine review branch prompt,SaxonF,2025-07-16T07:12:12Z,2025-07-16T09:55:50+00:00,2,2.73,True,3,14,1,51,3,1,4,MERGED
37192,Branch refinements,SaxonF,2025-07-16T04:43:26Z,2025-07-16T06:06:55+00:00,1,1.39,True,100,63,10,278,3,0,3,MERGED
37191,chore: deep link feature preview modal,alaister,2025-07-16T04:35:09Z,2025-07-16T06:38:33+00:00,2,2.06,True,119,65,7,173,3,1,4,MERGED
37188,add merge request button to header,SaxonF,2025-07-16T01:40:43Z,2025-07-16T06:00:50+00:00,1,4.34,True,86,4,4,153,3,0,3,MERGED
37187,feat: middle click closes tab,gregnr,2025-07-16T01:35:03Z,2025-07-16T06:20:39+00:00,1,4.76,True,7,0,1,180,3,0,3,MERGED
37186,chore: updated guide to privatelink,doublethink,2025-07-16T00:40:40Z,2025-07-16T20:15:37+00:00,1,19.58,True,109,29,2,59,3,2,5,MERGED
37183,Upgrades pro users and above,SaxonF,2025-07-15T23:23:51Z,2025-07-16T04:58:33+00:00,1,5.58,True,37,20,3,172,2,0,2,MERGED
37182,realtime: Add settings documentation,filipecabaco,2025-07-15T22:22:51Z,2025-07-16T11:55:07+00:00,2,13.54,True,50,0,4,128,2,1,3,MERGED
37178,Add postgREST Report + Filters,jordienr,2025-07-15T19:07:28Z,2025-07-16T15:45:57+00:00,2,20.64,True,541,248,9,266,4,0,4,MERGED
37176,docs: fix small error in cron.mdx,0xflotus,2025-07-15T18:17:17Z,2025-07-28T15:29:03+00:00,1,309.2,True,1,1,1,178,3,0,3,MERGED
37171,feat: use code instead of reset password link,hf,2025-07-15T15:12:46Z,2025-07-16T13:01:38+00:00,1,21.81,True,398,159,6,80,2,0,2,MERGED
37165,d2b2,fsansalvadore,2025-07-15T14:37:32Z,2025-07-15T17:01:19+00:00,1,2.4,True,145,4,7,0,2,0,2,MERGED
37160,fix filltimeseries for reports,jordienr,2025-07-15T13:55:26Z,2025-07-15T18:38:03+00:00,1,4.71,True,89,38,5,112,2,0,2,MERGED
37150,chore/unified-logs-fixes-04b,joshenlim,2025-07-15T10:37:13Z,2025-07-15T16:07:19+00:00,3,5.5,True,167,131,12,1262,3,2,5,MERGED
37149,Add Chris Ward to humans.txt,ChrisChinchilla,2025-07-15T10:35:10Z,2025-07-23T15:24:55+00:00,1,196.83,True,1,0,1,107,2,0,2,MERGED
37148,d2,fsansalvadore,2025-07-15T09:41:12Z,2025-07-15T14:07:37+00:00,1,4.44,True,238,44,16,0,2,0,2,MERGED
37142,chore: update cli reference doc,kiwicopple,2025-07-15T03:41:47Z,2025-07-15T09:49:04+00:00,3,6.12,True,1,1,1,0,2,1,3,MERGED
37141,chore: update self-hosted image versions,kiwicopple,2025-07-15T03:41:16Z,2025-07-15T09:52:09+00:00,2,6.18,True,4,4,1,0,2,3,5,MERGED
37140,feat: bedrock prompt caching,gregnr,2025-07-15T03:25:33Z,2025-07-16T01:08:31+00:00,1,21.72,True,36,18,3,1923,3,0,3,MERGED
37136,docs: update Node.js version in DEVELOPERS.md to match .nvmrc,dnywh,2025-07-15T02:23:07Z,2025-07-15T23:04:42+00:00,1,20.69,True,1,1,1,649,2,0,2,MERGED
37135,Chore/branch feature preview,SaxonF,2025-07-15T01:48:26Z,2025-07-15T10:24:47+00:00,2,8.61,True,112,56,12,42,3,5,8,MERGED
37134,add default main branch if none exists,SaxonF,2025-07-15T00:24:32Z,2025-07-15T02:39:19+00:00,1,2.25,True,28,24,3,96,2,0,2,MERGED
37128,Remove stop database admonition when performing db diff,ebauman,2025-07-14T19:55:36Z,2025-07-15T14:26:47+00:00,1,18.52,True,0,6,1,361,4,0,4,MERGED
37126,Feat/add mfa and wrapper tracking,pamelachia,2025-07-14T19:12:57Z,2025-07-15T07:27:18+00:00,2,12.24,True,83,2,4,269,3,0,3,MERGED
37125,docs(storage/500gb): Update hostname for S3 and TUS,itslenny,2025-07-14T19:03:37Z,2025-07-25T17:10:28+00:00,1,262.11,True,24,6,2,79,2,0,2,MERGED
37122,docs: add auth getClaims method,charislam,2025-07-14T17:19:39Z,2025-07-14T21:13:23+00:00,1,3.9,True,18242,11393,11,0,2,0,2,MERGED
37120,feat: allow 500 GB uploads,kevcodez,2025-07-14T16:53:12Z,2025-07-23T16:43:54+00:00,7,215.84,True,51,22,6,45,5,3,8,MERGED
37110,docs: Fix type typo in Kotlin docs,pank-su,2025-07-14T13:53:34Z,2025-07-14T15:04:45+00:00,1,1.19,True,1,1,1,152,3,0,3,MERGED
37105,feat(replication): Implement new error UI when the pipeline fails,iambriccardo,2025-07-14T12:13:59Z,2025-07-15T10:10:38+00:00,8,21.94,True,424,68,5,226,2,3,5,MERGED
37102,database report: rename label,jordienr,2025-07-14T11:04:20Z,2025-07-14T13:35:24+00:00,1,2.52,True,1,1,1,0,2,0,2,MERGED
37101,fix find by id in vault,jordienr,2025-07-14T10:47:55Z,2025-07-14T14:00:53+00:00,1,3.22,True,4,2,1,41,2,0,2,MERGED
37100,d1,fsansalvadore,2025-07-14T08:34:30Z,2025-07-14T13:55:55+00:00,1,5.36,True,1791,530,50,0,4,0,4,MERGED
37097,chore: jwt keys page table layout,MildTomato,2025-07-14T06:53:32Z,2025-07-14T11:40:18+00:00,2,4.78,True,71,64,9,274,2,1,3,MERGED
37096,Fix success handler for migrate JWT secret,joshenlim,2025-07-14T06:00:36Z,2025-07-14T08:04:53+00:00,3,2.07,False,76,134,4,299,3,1,4,CLOSED
37095,Dynamic model setting,SaxonF,2025-07-14T05:58:12Z,2025-07-15T07:57:38+00:00,6,25.99,True,9,4,2,128,2,1,3,MERGED
37094,chore: hint for compute costs in upgrade screen,kevcodez,2025-07-14T05:54:04Z,2025-07-14T08:31:35+00:00,2,2.63,True,27,19,1,190,2,0,2,MERGED
37093,remove duplicate download,SaxonF,2025-07-14T05:15:26Z,2025-07-14T07:33:39+00:00,1,2.3,True,0,8,1,33,2,0,2,MERGED
37092,download as migration,SaxonF,2025-07-14T05:13:01Z,2025-07-14T08:22:16+00:00,1,3.15,True,35,3,1,51,2,0,2,MERGED
37080,Branches page,SaxonF,2025-07-14T02:04:45Z,2025-07-14T07:41:06+00:00,3,5.61,True,1406,1262,18,227,6,2,8,MERGED
37069,"fix: additional fixes for api keys, jwt signing keys",hf,2025-07-13T13:59:04Z,2025-07-14T08:04:24+00:00,1,18.09,True,130,138,7,0,2,0,2,MERGED
37068,Add platform kit to library,SaxonF,2025-07-13T12:22:47Z,2025-07-14T12:04:57+00:00,2,23.7,True,14269,54,58,133,3,3,6,MERGED
37062,Update auth-email-passwordless.mdx,Vinaimu,2025-07-13T06:14:18Z,2025-07-18T20:45:36+00:00,1,134.52,False,1,1,1,338,11,0,11,CLOSED
37049,feat: distribute bedrock requests per regional limits,delgado3d,2025-07-11T19:49:38Z,2025-07-17T08:11:06+00:00,1,132.36,True,201,128,6,209,3,0,3,MERGED
37048,fix(api): set x-pg-application-name for dashboard,avallete,2025-07-11T19:26:51Z,2025-07-21T08:39:46+00:00,1,229.22,True,132,12,14,161,3,0,3,MERGED
37046,luma events,fsansalvadore,2025-07-11T14:12:50Z,2025-07-11T15:44:07+00:00,1,1.52,True,233,70,5,0,2,0,2,MERGED
37042,fix(docs): move prerequisite on top,avallete,2025-07-11T10:14:53Z,2025-07-28T09:37:58+00:00,1,407.38,True,11,11,1,119,2,0,2,MERGED
37037,chore: toast auth initialization errors,alaister,2025-07-11T05:54:21Z,2025-07-15T09:57:32+00:00,1,100.05,True,65,21,6,153,2,0,2,MERGED
37033,docs(mcp): production data clarification,gregnr,2025-07-11T03:20:31Z,2025-07-11T13:56:13+00:00,1,10.6,True,2,2,1,240,2,0,2,MERGED
37032,Context reduction,SaxonF,2025-07-11T02:30:26Z,2025-07-11T06:03:37+00:00,3,3.55,True,42,247,5,59,2,1,3,MERGED
37027,docs: jwt signing keys,hf,2025-07-10T18:37:22Z,2025-07-14T08:33:42+00:00,4,85.94,True,393,119,7,38,3,14,17,MERGED
37026,feat: add Realtime private only feature flag,w3b6x9,2025-07-10T17:13:20Z,2025-07-11T10:47:05+00:00,3,17.56,True,99,16,13,1523,2,2,4,MERGED
37025,fix: update Realtime private only docs link,w3b6x9,2025-07-10T16:17:08Z,2025-07-15T07:58:44+00:00,2,111.69,True,3,1,1,0,3,0,3,MERGED
37024,feat(replication): Improve status display of the pipeline,iambriccardo,2025-07-10T16:12:52Z,2025-07-11T14:51:52+00:00,2,22.65,True,95,38,2,378,2,0,2,MERGED
37019,fix: remove redundant feature preview click,pamelachia,2025-07-10T12:30:05Z,2025-07-11T09:59:57+00:00,2,21.5,True,1,27,2,105,2,0,2,MERGED
37013,ref: Allow for Vercel-managed projects removal,kamilogorek,2025-07-10T10:01:56Z,2025-07-10T13:33:13+00:00,1,3.52,True,18,23,1,83,3,0,3,MERGED
37012,"Fix Issue #26280 ""User Management App"" Docs - safeGetSession typescript error",Abhinanda-Shetty,2025-07-10T07:45:55Z,2025-07-14T15:11:05+00:00,1,103.42,True,2,2,1,981,8,0,8,MERGED
37006,Limit tools based on extensions,SaxonF,2025-07-10T02:21:56Z,2025-07-10T05:54:19+00:00,4,3.54,True,200,7,5,162,3,2,5,MERGED
37005,"chore: enable prettier cache, speeds up subsequent runs ~6.5x",thebengeu,2025-07-10T01:08:50Z,2025-07-10T12:32:12+00:00,2,11.39,True,12,12,10,74,3,0,3,MERGED
37003,feat: Analytic storage bucket,ivasilov,2025-07-09T22:14:28Z,2025-07-15T12:18:38+00:00,10,134.07,True,1885,224,32,0,4,9,13,MERGED
37001,Add portal to PopoverContent in TimezoneSelection.tsx,joshenlim,2025-07-09T21:53:00Z,2025-07-15T10:05:13+00:00,1,132.2,True,1,1,1,82,2,0,2,MERGED
36999,Update mcp_supabase_config.mdx,AnikG,2025-07-09T21:29:32Z,2025-07-31T11:55:24+00:00,1,518.43,False,23,0,1,372,7,0,7,CLOSED
36997,Add missing permissions text for AI opt in modal,joshenlim,2025-07-09T21:21:37Z,2025-07-10T05:14:00+00:00,1,7.87,True,24,13,1,345,2,0,2,MERGED
36996,Shared Responsibility Remove OpenAI Section,ekhar,2025-07-09T20:08:16Z,2025-07-10T12:12:48+00:00,2,16.08,True,0,2,1,435,5,0,5,MERGED
36992,reports pricing,jordienr,2025-07-09T16:07:02Z,2025-07-14T14:45:30+00:00,4,118.64,True,404,167,19,193,2,1,3,MERGED
36989,Chore/uniform reports daterange picker,fsansalvadore,2025-07-09T15:20:08Z,2025-07-10T10:35:21+00:00,1,19.25,True,677,514,15,115,2,0,2,MERGED
36978,feat: bump auth-js to v2.71.0-rc.7,hf,2025-07-09T11:15:46Z,2025-07-14T07:05:05+00:00,1,115.82,True,19,18,3,36,3,0,3,MERGED
36977,lw: detect gh metadata info update,fsansalvadore,2025-07-09T10:26:42Z,2025-07-10T09:07:25+00:00,1,22.68,True,6,2,2,0,2,0,2,MERGED
36976,format edgefn report exec time chart,jordienr,2025-07-09T10:10:34Z,2025-07-10T12:55:17+00:00,1,26.75,True,52,36,1,135,3,0,3,MERGED
36974,fix(docker): use postgres instead of supabase_admin as current user,singh-inder,2025-07-09T09:30:44Z,2025-07-15T19:22:15+00:00,1,153.86,False,1,1,1,554,3,0,3,CLOSED
36972,Refactor `NewAccessTokenButton` to use shadcn components,Saeris,2025-07-09T06:12:24Z,2025-07-23T08:54:31+00:00,15,338.7,True,377,126,6,705,7,9,16,MERGED
36965,docs: add Iceberg and DuckDB FDW docs,burmecia,2025-07-09T01:08:58Z,2025-07-09T15:00:55+00:00,1,13.87,True,29,1,3,231,2,0,2,MERGED
36964,add Sean Oliver to humans.txt as part of onboarding,seanoliver,2025-07-08T18:53:09Z,2025-07-08T21:23:15+00:00,1,2.5,True,1,0,1,282,2,0,2,MERGED
36962,fix pre auth terms,pamelachia,2025-07-08T17:40:44Z,2025-07-09T02:32:01+00:00,1,8.85,True,5,1,1,56,2,0,2,MERGED
36960,add shared api metrics to auth and realtime reports,jordienr,2025-07-08T16:08:12Z,2025-07-15T09:57:15+00:00,5,161.82,True,386,39,5,280,3,3,6,MERGED
36954,chore: clean up removed field handling,soedirgo,2025-07-08T10:46:19Z,2025-07-21T05:58:44+00:00,3,307.21,True,1,62,2,30,3,0,3,MERGED
36949,fix: show run logs for gitless branches,sweatybridge,2025-07-08T05:44:25Z,2025-07-09T11:07:33+00:00,2,29.39,True,132,946,10,287,3,1,4,MERGED
36948,Updates Assistant snippet handling,SaxonF,2025-07-08T02:40:57Z,2025-07-09T08:00:41+00:00,4,29.33,True,267,118,5,92,3,2,5,MERGED
36944,Update `@deprecated` suggestions for `ui` package  components,Saeris,2025-07-07T22:35:30Z,2025-08-05T09:31:32+00:00,2,682.93,True,17,17,17,695,4,0,4,MERGED
36933,"feat: update docs, ui-library to use `supabase.auth.getClaims()`",hf,2025-07-07T17:37:14Z,2025-07-08T17:11:57+00:00,1,23.58,True,28,28,16,109,2,0,2,MERGED
36919,fix(branches): update branch name with git_branch changes,avallete,2025-07-07T09:32:24Z,2025-07-08T08:46:41+00:00,1,23.24,False,10,10,2,338,3,0,3,CLOSED
36918,fix: Updates to the create Iceberg FDW sheet,ivasilov,2025-07-07T09:02:38Z,2025-07-10T13:03:14+00:00,1,76.01,True,385,23,8,0,3,1,4,MERGED
36917,chore: add final e2e tests for table-editor and sql-editor,Michaelomh,2025-07-07T08:07:51Z,2025-07-19T10:58:25+00:00,2,290.84,True,356,52,4,387,3,1,4,MERGED
36916,lw15 ticketing,fsansalvadore,2025-07-07T07:46:06Z,2025-07-08T15:43:04+00:00,2,31.95,True,2682,477,49,0,3,2,5,MERGED
36915,Review branch diff with AI,SaxonF,2025-07-07T07:23:53Z,2025-07-09T23:11:34+00:00,1,63.79,True,377,71,13,271,3,0,3,MERGED
36913,Feat/unified logs live filter enums,MildTomato,2025-07-07T07:06:05Z,2025-07-09T03:35:20+00:00,3,44.49,True,535,90,7,459,2,2,4,MERGED
36912,Feat/terms update,pamelachia,2025-07-07T07:05:57Z,2025-07-07T17:25:09+00:00,2,10.32,True,189,113,5,158,2,0,2,MERGED
36907,Assistant error state,SaxonF,2025-07-07T03:48:28Z,2025-07-08T08:02:49+00:00,1,28.24,True,13,0,1,101,3,0,3,MERGED
36905,chore: external svg scripts,doublethink,2025-07-07T02:20:11Z,2025-07-09T02:21:15+00:00,2,48.02,True,3,3,3,166,3,0,3,MERGED
36895,Feat/unified logs inspection panel,MildTomato,2025-07-05T08:03:32Z,2025-07-08T12:00:23+00:00,45,75.95,True,3213,347,39,879,3,37,40,MERGED
36893,New GuideTemplate with composable components,tomaspozo,2025-07-04T21:38:50Z,2025-07-09T16:42:55+00:00,3,115.07,True,293,2,10,1353,4,12,16,MERGED
36890,feat(docs): new branching docs,charislam,2025-07-04T18:31:58Z,2025-07-16T13:45:19+00:00,2,283.22,True,727,761,8,56,2,2,4,MERGED
36889,feat: final ui/ux updates for jwt signing keys,hf,2025-07-04T18:27:58Z,2025-07-08T09:42:03+00:00,5,87.23,True,713,533,14,131,5,1,6,MERGED
36888,feat(docs): add scaffolding for iceberg docs,charislam,2025-07-04T16:14:12Z,2025-07-15T14:16:23+00:00,3,262.04,True,296,0,8,0,2,4,6,MERGED
36886,Rename api to api gateway,saltcod,2025-07-04T14:11:04Z,2025-07-05T09:20:22+00:00,2,19.16,True,2,2,2,35,3,0,3,MERGED
36885,opt in tags,saltcod,2025-07-04T14:04:59Z,2025-07-04T16:47:42+00:00,1,2.71,True,53,13,4,0,3,0,3,MERGED
36881,fix: remove apac bedrock region and add us region,delgado3d,2025-07-04T08:50:25Z,2025-07-07T04:23:08+00:00,2,67.55,True,6,6,3,0,3,0,3,MERGED
36877,Add review requested at,SaxonF,2025-07-04T06:52:22Z,2025-07-09T10:45:28+00:00,1,123.89,True,371,49,10,185,3,0,3,MERGED
36876,feat: use enablePgReplicate feature flag,imor,2025-07-04T06:09:46Z,2025-07-04T10:23:56+00:00,2,4.24,True,35,18,3,218,3,0,3,MERGED
36872,[bot] fix lint errors,github-actions,2025-07-04T00:17:44Z,2025-07-04T15:18:16+00:00,1,15.01,True,3,2,1,47,2,1,3,MERGED
36871,docs(python): add params to the update_user method,silentworks,2025-07-03T22:04:44Z,2025-07-10T15:06:35+00:00,1,161.03,True,32,1,1,388,5,0,5,MERGED
36868,feat: add billing information to the leave org modal,ignaciodob,2025-07-03T18:43:28Z,2025-07-04T12:15:54+00:00,2,17.54,True,22,1,1,1066,3,1,4,MERGED
36867,feat: MCP URL builder,charislam,2025-07-03T18:38:55Z,2025-10-01T14:45:34+00:00,6,2156.11,True,1276,499,40,496,16,4,20,MERGED
36866,feat(replication): Update the API calls for replication endpoints,iambriccardo,2025-07-03T18:03:02Z,2025-07-08T14:34:03+00:00,7,116.52,True,420,158,7,72,3,4,7,MERGED
36865,docs: update auth email template variables,ssudaraka,2025-07-03T17:30:36Z,2025-07-04T01:46:28+00:00,2,8.26,True,2,0,1,343,2,0,2,MERGED
36864,fix(docs): studio feature stages update,charislam,2025-07-03T15:49:06Z,2025-07-03T16:52:36+00:00,1,1.06,True,2,0,1,0,2,0,2,MERGED
36862,fix: update docs link for auth hooks configuration page,cstockton,2025-07-03T15:01:41Z,2025-07-28T15:24:56+00:00,1,600.39,True,1,1,1,54,2,0,2,MERGED
36860,realtime: Limit access to settings based on project,filipecabaco,2025-07-03T13:39:20Z,2025-07-07T09:22:55+00:00,1,91.73,True,15,2,1,155,2,0,2,MERGED
36859,docs: add admonition of pnpm < v10 install,avallete,2025-07-03T12:53:43Z,2025-07-17T06:31:54+00:00,4,329.64,True,7,0,2,0,2,1,3,MERGED
36858,chore: enable tag manager for sign up,alaister,2025-07-03T10:57:11Z,2025-07-15T07:54:52+00:00,1,284.96,False,13,8,4,0,3,1,4,CLOSED
36857,backup-restore.mdx: Better fix,tvogel,2025-07-03T10:46:00Z,2025-07-28T15:31:37+00:00,1,604.76,True,4,2,1,390,3,0,3,MERGED
36856,Changed -an List- to -a List-,Chemsdine223,2025-07-03T09:25:54Z,2025-07-04T15:19:29+00:00,2,29.89,True,1,1,1,381,5,1,6,MERGED
36855,chore: new security page without flag,staaldraad,2025-07-03T08:51:09Z,2025-07-16T14:24:12+00:00,1,317.55,True,77,14,6,106,3,0,3,MERGED
36852,"Add search docs, advisors, and custom logging tools",SaxonF,2025-07-03T05:07:06Z,2025-07-09T23:43:38+00:00,4,162.61,True,820,385,9,605,4,8,12,MERGED
36849,block branch free plan,SaxonF,2025-07-02T23:34:03Z,2025-07-03T07:14:04+00:00,1,7.67,True,61,12,3,72,3,0,3,MERGED
36837,Distributes bedrock requests evenly across regions,gregnr,2025-07-02T16:21:29Z,2025-07-02T17:35:37+00:00,1,1.24,True,204,67,10,137,3,0,3,MERGED
36836,format data to ms in execution time - edge fn report,jordienr,2025-07-02T15:57:37Z,2025-07-10T12:53:07+00:00,1,188.93,True,18,2,4,105,4,0,4,MERGED
36835,fix(docs): feedback form note,charislam,2025-07-02T14:50:18Z,2025-07-04T15:43:11+00:00,1,48.88,True,16,0,1,154,2,0,2,MERGED
36833,Update with-ionic-react.mdx to run in current verison,ConnorMolz,2025-07-02T13:51:25Z,2025-07-02T16:32:55+00:00,1,2.69,True,33,17,1,417,4,0,4,MERGED
36828,feat: Add Iceberg FDW,ivasilov,2025-07-02T09:13:48Z,2025-07-04T11:00:50+00:00,1,49.78,True,120,6,6,17,3,0,3,MERGED
36827,feat: Add support for `import foreign schema` for wrappers,ivasilov,2025-07-02T08:34:05Z,2025-07-04T08:06:18+00:00,3,47.54,True,328,124,11,0,2,1,3,MERGED
36824,fix: switch default staging / local provider,kangmingtay,2025-07-02T07:06:29Z,2025-07-02T16:26:50+00:00,2,9.34,True,5,1,1,0,2,1,3,MERGED
36820,docs(#36820): correct title and grammar in RedwoodJS quickstart guide,abdelkabirouadoukou,2025-07-02T03:42:03Z,2025-07-09T03:56:34+00:00,1,168.24,False,233,233,1,1262,5,0,5,CLOSED
36819,AI UI refine and renaming,SaxonF,2025-07-02T03:01:44Z,2025-07-08T02:09:12+00:00,1,143.12,True,531,570,20,170,3,0,3,MERGED
36812,Update installation links for VS Code and VS Code Insiders in MCP guide,burkeholland,2025-07-01T22:00:43Z,2025-07-02T23:11:23+00:00,1,25.18,True,2,2,1,300,3,0,3,MERGED
36805,docs: fix documentation for seed file,Magnuti,2025-07-01T13:29:19Z,2025-07-02T23:28:19+00:00,1,33.98,True,1,1,1,90,4,0,4,MERGED
36803,fix db charts,fsansalvadore,2025-07-01T13:22:44Z,2025-07-08T08:22:46+00:00,2,163.0,True,111,114,3,0,3,1,4,MERGED
36802,fix table editor permissions state,saltcod,2025-07-01T13:06:40Z,2025-07-02T21:00:28+00:00,1,31.9,True,9,0,1,573,3,0,3,MERGED
36798,Update Edge Functions docs,lydiahallie,2025-07-01T09:54:54Z,2025-07-10T14:18:01+00:00,4,220.39,True,2737,1806,41,309,6,16,22,MERGED
36797,chore: realtime reports,fsansalvadore,2025-07-01T09:30:41Z,2025-07-03T16:14:19+00:00,1,54.73,True,556,60,4,0,3,0,3,MERGED
36795,Review and merge branch,SaxonF,2025-07-01T06:11:55Z,2025-07-04T04:57:59+00:00,1,70.77,True,2050,50,24,863,3,0,3,MERGED
36794,fix(branching): allow gitless branches to be set as peristent,avallete,2025-07-01T06:08:27Z,2025-07-03T09:56:02+00:00,1,51.79,True,26,30,1,0,2,0,2,MERGED
36793,feat: Add duplicate key check with confirmation dialog for Edge Function secrets,laktek,2025-07-01T06:04:50Z,2025-07-01T09:15:39+00:00,1,3.18,True,75,0,2,422,2,0,2,MERGED
36790,chore: update cli reference doc,kiwicopple,2025-07-01T04:46:46Z,2025-07-02T23:18:40+00:00,1,42.53,True,33,345,1,0,2,0,2,MERGED
36788,fix: disk attributes on compute down size,kevcodez,2025-07-01T04:24:43Z,2025-07-01T09:25:11+00:00,1,5.01,True,27,24,3,608,3,0,3,MERGED
36785,Change path to pathname in storage unified logs query,joshenlim,2025-07-01T00:41:00Z,2025-07-04T19:56:58+00:00,1,91.27,True,2,2,1,565,2,0,2,MERGED
36781,feat: improved jwt signing key rotation dialog,hf,2025-06-30T19:10:02Z,2025-07-03T08:23:51+00:00,1,61.23,True,325,162,3,67,2,0,2,MERGED
36780,Update auth-google.mdx,HarmonyV,2025-06-30T17:54:04Z,2025-09-16T09:33:47+00:00,2,1863.66,True,21,10,1,637,3,0,3,MERGED
36774,Chore/fix index delete,saltcod,2025-06-30T14:10:27Z,2025-06-30T15:36:18+00:00,1,1.43,True,4,1,2,210,2,0,2,MERGED
36772,Chore/clean up assistant mcp feature flags,joshenlim,2025-06-30T13:48:17Z,2025-07-22T08:05:17+00:00,1,522.28,True,137,1052,25,1221,3,0,3,MERGED
36768,Auth + Database Report Fix,jordienr,2025-06-30T13:00:39Z,2025-06-30T14:04:34+00:00,2,1.07,True,446,77,5,125,2,0,2,MERGED
36763,Edge Function Report,jordienr,2025-06-30T09:49:40Z,2025-07-02T13:54:39+00:00,1,52.08,True,820,1010,10,92,3,0,3,MERGED
36762,chore/unified-logs-fixes-04,joshenlim,2025-06-30T07:37:00Z,2025-07-15T10:37:43+00:00,14,363.01,False,132,119,7,1086,5,10,15,CLOSED
36760,docs: privatelink feature,doublethink,2025-06-30T05:24:59Z,2025-07-01T23:11:10+00:00,2,41.77,True,97,0,4,176,2,1,3,MERGED
36759,Webhooks automatically append authorization header if edge function with verify JWT enabled is selected,joshenlim,2025-06-30T04:04:59Z,2025-07-21T04:16:06+00:00,2,504.19,True,296,248,5,1048,3,1,4,MERGED
36732,feat: enable Self-Service Single Sign-On (SSO) for orgs,saltcod,2025-06-27T19:45:57Z,2025-08-06T00:03:30+00:00,1,940.29,True,1269,14,14,218,4,0,4,MERGED
36730,feat: jwt signing key dialog supports bring your own key,hf,2025-06-27T17:34:44Z,2025-07-03T10:41:12+00:00,2,137.11,True,426,12,3,77,3,0,3,MERGED
36725,chore/unified-logs-fixes-03,joshenlim,2025-06-27T12:15:28Z,2025-07-10T09:13:11+00:00,4,308.96,True,292,22,12,957,3,3,6,MERGED
36723,Fix database selector not selectable in connect modal,joshenlim,2025-06-27T10:23:39Z,2025-06-27T12:15:43+00:00,1,1.87,True,6,4,3,127,3,0,3,MERGED
36722,Chore/update churn survey,pamelachia,2025-06-27T08:47:31Z,2025-06-29T09:58:39+00:00,5,49.19,True,296,270,8,437,5,3,8,MERGED
36718,docs: update Kotlin docs,jan-tennert,2025-06-26T19:09:50Z,2025-07-15T13:31:28+00:00,1,450.36,True,28,10,2,201,4,0,4,MERGED
36716,docs: update documentation for issue #36705,AmanDevelops,2025-06-26T18:24:00Z,2025-06-27T18:50:51+00:00,1,24.45,True,4,4,1,395,3,0,3,MERGED
36715,chore(docs linter): bump version,charislam,2025-06-26T17:48:54Z,2025-07-03T14:46:29+00:00,1,164.96,True,149,95,33,219,2,0,2,MERGED
36712,chore(docs): make clearer link between template and actual email,avallete,2025-06-26T14:55:53Z,2025-06-27T18:42:18+00:00,1,27.77,True,42,6,1,83,2,0,2,MERGED
36710,Chore/unified logs fixes 02,joshenlim,2025-06-26T14:25:43Z,2025-06-27T10:58:50+00:00,1,20.55,True,65,43,7,1396,2,0,2,MERGED
36709,chore(docs): add link to dotenvx management detail,avallete,2025-06-26T13:47:12Z,2025-06-27T18:42:38+00:00,1,28.92,True,10,0,1,142,2,0,2,MERGED
36708,realtime: Add Allow Public Access toggle back to Realtime Configuration,filipecabaco,2025-06-26T13:39:47Z,2025-06-26T16:08:20+00:00,1,2.48,True,10,15,1,147,2,0,2,MERGED
36707,realtime: Add footer channel to www application,filipecabaco,2025-06-26T13:30:26Z,2025-07-01T11:47:54+00:00,2,118.29,True,23,2,1,123,2,0,2,MERGED
36703,chore: add docs for new db reports charts,fsansalvadore,2025-06-26T12:04:54Z,2025-07-17T12:40:13+00:00,1,504.59,True,346,2,16,0,4,0,4,MERGED
36701,docs(auth) - typo correction,skelbon,2025-06-26T11:51:25Z,2025-06-26T16:26:56+00:00,1,4.59,True,1,1,1,401,3,0,3,MERGED
36699,add cursor rule,jordienr,2025-06-26T11:42:13Z,2025-07-11T12:47:33+00:00,7,361.09,False,133,0,1,66,3,6,9,CLOSED
36698,docs: simplify declarative schema usage example,sweatybridge,2025-06-26T11:09:14Z,2025-06-26T16:44:18+00:00,1,5.58,True,4,26,1,173,2,0,2,MERGED
36697,Fix opt in disabled logic,joshenlim,2025-06-26T10:56:54Z,2025-06-27T08:12:31+00:00,1,21.26,False,10,2,2,49,3,0,3,CLOSED
36690,Update Edge Functions docs,lydiahallie,2025-06-26T08:40:59Z,2025-07-01T09:55:40+00:00,2,121.24,False,948,491,16,713,4,5,9,CLOSED
36689,Feature flag MCP changes,joshenlim,2025-06-26T08:28:56Z,2025-06-26T10:41:32+00:00,1,2.21,True,1758,855,25,2509,2,0,2,MERGED
36687,"Revert ""Revert ""Feature/assistant mcp""""",joshenlim,2025-06-26T05:07:04Z,2025-06-26T07:02:49+00:00,1,1.93,True,3788,2000,57,46,2,0,2,MERGED
36676,docs: add instructions for using management api as alternative to dashboard ui,charislam,2025-06-25T21:07:29Z,2025-06-26T13:10:11+00:00,1,16.05,True,502,0,24,0,2,0,2,MERGED
36674,docs: update required Node.js version to v22 LTS ,GAURAV-DEEP01,2025-06-25T19:04:26Z,2025-07-28T15:15:47+00:00,1,788.19,False,1,1,1,627,4,0,4,CLOSED
36671,docs(feature stages): update feature matrix with current feature stages,charislam,2025-06-25T17:37:15Z,2025-06-26T13:48:55+00:00,1,20.19,True,59,56,2,0,2,0,2,MERGED
36663,Update Admonition for AI Assistant for when opt in is re-enabled,joshenlim,2025-06-25T14:41:01Z,2025-06-26T02:50:10+00:00,1,12.15,True,35,18,3,327,1,0,1,MERGED
36662,docs: add workos tpa docs,hf,2025-06-25T14:08:57Z,2025-06-25T15:15:51+00:00,1,1.11,True,59,0,3,39,2,0,2,MERGED
36654,feat: show upgrade warning if user objects exist in internal schemas,soedirgo,2025-06-25T10:04:00Z,2025-06-27T08:26:03+00:00,2,46.37,True,526,227,9,334,2,1,3,MERGED
36650,Chore/fix unified logs,joshenlim,2025-06-25T08:14:15Z,2025-06-26T08:45:46+00:00,11,24.53,True,261,335,20,1696,2,6,8,MERGED
36647,Add Amp to MCP getting started page,jdorfman,2025-06-25T06:04:19Z,2025-06-25T16:26:48+00:00,2,10.37,True,63,1,1,483,13,0,13,MERGED
36646,fix: warning message on upgrade guards,soedirgo,2025-06-25T04:53:51Z,2025-06-25T08:06:47+00:00,1,3.22,True,98,6,3,608,2,0,2,MERGED
36643,Update humans.txt,o-santi,2025-06-24T19:52:16Z,2025-07-22T13:25:43+00:00,2,665.56,True,1,0,1,235,3,0,3,MERGED
36639,Update Edge Functions Quickstart docs,lydiahallie,2025-06-24T15:49:53Z,2025-07-01T09:56:10+00:00,1,162.1,False,641,333,20,322,10,7,17,CLOSED
36638,feat: add publishable key in connect dialog,hf,2025-06-24T15:39:52Z,2025-06-26T07:11:08+00:00,2,39.52,True,125,73,20,263,3,0,3,MERGED
36630,chore: Dashboard guards to limit what can and cannot be done by an AWS_K8S project,dragarcia,2025-06-24T08:35:40Z,2025-06-26T04:14:27+00:00,5,43.65,True,138,103,10,192,1,6,7,MERGED
