number,title,author,createdAt,closedOrMergedAt,reviewsCount,hoursOpen
7972,gui: Tweak the Restore Versions modal for better usability,tomasz1986,2021-09-26T13:10:59Z,2022-01-25T22:08:28+00:00,1,2912.96
7976,gui: Allow text wrapping in remove folder/device modals,tomasz1986,2021-09-27T14:20:04Z,2021-11-22T08:41:44+00:00,7,1338.36
7977,gui: Fix jumping nav tabs in black and dark themes,tomasz1986,2021-09-27T14:53:20Z,2021-09-27T19:28:14+00:00,1,4.58
7978,"Revert ""gui: Allow to resize command in External Versioning (#7410)""",tomasz1986,2021-09-28T02:18:28Z,2021-09-28T06:05:18+00:00,1,3.78
7980,gui: Use case insensitive sort with folders on top in Restore Versions,tomasz1986,2021-09-29T03:51:48Z,2021-09-29T06:05:01+00:00,1,2.22
7982,lib/model: Limit the number of default hashers on Android (ref #2220),tomasz1986,2021-09-30T10:25:41Z,2021-10-29T08:06:52+00:00,1,693.69
7984,"gui: Add copy to clipboard, share by email, and share by SMS buttons to device IDs (fixes #2771, ref #3868)",tomasz1986,2021-10-01T19:56:50Z,2022-11-07T19:11:12+00:00,92,9647.24
7992,lib/model: Write trailer when shortcutting on recv-enc (fixes #7991),imsodin,2021-10-04T20:00:05Z,2021-10-05T09:23:27+00:00,1,13.39
7993,gui: Add direct link to Ignore Patterns from folder panel (fixes #4293),tomasz1986,2021-10-05T16:34:00Z,2021-10-20T21:06:03+00:00,13,364.53
7995,lib/protocol: Preserve sequence decrypting fileinfos (fixes #7994),imsodin,2021-10-05T18:16:15Z,2021-10-06T08:26:54+00:00,1,14.18
7996,lib/connections/registry: Fix and optimize,greatroar,2021-10-05T18:28:19Z,2021-10-06T08:52:51+00:00,1,14.41
8006,gui: Translate theme names in settings,acolomb,2021-10-17T19:15:23Z,2021-10-20T17:44:38+00:00,5,70.49
8015,lib/relay: Send SNI when the address is a host name (fixes #8014),calmh,2021-10-21T06:57:11Z,2021-11-22T07:31:03+00:00,2,768.56
8017,lib/protocol: Two micro-optimizations,greatroar,2021-10-22T11:02:34Z,2021-10-22T16:40:40+00:00,1,5.63
8019,lib/model: Set mod. time after writing trailer in shortcut (ref #7992),imsodin,2021-10-23T11:07:20Z,2021-10-24T14:50:31+00:00,1,27.72
8022,gui: Display identicons for discovered device IDs.,acolomb,2021-10-29T14:39:05Z,2021-10-29T18:23:42+00:00,1,3.74
8023,lib/model: Optimize jobQueue performance and memory use,greatroar,2021-10-29T16:03:12Z,2021-10-29T18:20:47+00:00,1,2.29
8024,cmd/syncthing/cli: indexDumpSize doesn't need a heap,greatroar,2021-10-29T16:06:02Z,2021-10-29T18:21:51+00:00,1,2.26
8025,lib/syncthing: Clean up / refactor LoadOrGenerateCertificate() utility function.,acolomb,2021-10-29T19:52:40Z,2021-11-07T22:59:48+00:00,8,219.12
8027,"lib/api, lib/config: Remove config.ReadJSON (fixes #7957)",imsodin,2021-10-31T14:47:46Z,2023-03-10T11:50:31+00:00,1,11877.05
8028,lib/config: Move the bcrypt password hashing to GUIConfiguration,acolomb,2021-10-31T22:09:24Z,2021-11-08T12:32:05+00:00,8,182.38
8037,Normalize CLI options to always use two dashes.,acolomb,2021-11-03T20:51:13Z,2021-11-04T07:42:56+00:00,2,10.86
8039,lib/api: http.Request.BasicAuth instead of custom code,greatroar,2021-11-06T09:53:00Z,2021-11-06T11:38:08+00:00,1,1.75
8042,lib/nat: Fix race condition in Mapping,greatroar,2021-11-07T19:18:49Z,2021-11-22T07:29:44+00:00,7,348.18
8043,cmd/syncthing: Implement generate as a subcommand with optional API credential setting (fixes #8021),acolomb,2021-11-08T12:57:01Z,2021-11-18T21:58:00+00:00,22,249.02
8052,"lib/config, lib/ignore: Write Windows line endings (fixes #7115)",calmh,2021-11-22T06:54:23Z,2021-11-22T08:38:24+00:00,2,1.73
8054,gui: Warning in folders with ignoreDelete enabled (fixes #8050),villekalliomaki,2021-11-22T19:39:48Z,2021-11-25T13:04:59+00:00,3,65.42
8057,lib/fs: Path handling optimizations,greatroar,2021-11-23T19:03:36Z,2021-11-23T20:25:29+00:00,2,1.36
8062,lib/model: Return index from deviceActivity.leastBusy,greatroar,2021-11-26T09:49:36Z,2021-11-26T11:07:43+00:00,1,1.3
8063,Minor cleanup,greatroar,2021-11-27T11:10:24Z,2021-11-27T14:35:07+00:00,1,3.41
8069,cmd/syncthing/cli: Add command to show pending devices/folders (fixes #8068),ignacy123,2021-12-04T14:28:29Z,2021-12-09T20:18:47+00:00,1,125.84
8074,CLI await-insync - block until the current dir finishes syncing,TobiaszCudnik,2021-12-10T09:34:32Z,2023-03-10T12:00:58+00:00,4,10922.44
8079,lib: Fix panic due to closed event subscriptions on shutdown,gsaraf,2021-12-20T15:58:02Z,2021-12-22T19:16:21+00:00,8,51.31
8086,build: Bump quic-go to 0.24.0,imsodin,2021-12-28T11:06:40Z,2021-12-30T12:07:01+00:00,1,49.01
8091,"gui: Make device ID read-only and hide ""nearby devices"" when adding a new pending device (fixes #8083)",tomasz1986,2021-12-31T14:38:17Z,2022-01-28T08:15:57+00:00,52,665.63
8092,cmd/stdiscosrv: Support deploying behind Caddyserver,lkebin,2022-01-01T14:57:33Z,2022-01-05T14:17:14+00:00,8,95.33
8098,cmd/syncthing: Always update config.xml with generate subcommand (ref #8090),acolomb,2022-01-06T23:07:09Z,2022-01-07T10:02:13+00:00,1,10.92
8099,cmd/syncthing: Add --skip-port-probing (fixes #8090),acolomb,2022-01-06T23:19:08Z,2022-01-07T10:19:17+00:00,1,11.0
8101,gui: Sort language names vertically and don't truncate on small screens,tomasz1986,2022-01-07T22:40:45Z,2022-01-08T15:51:30+00:00,3,17.18
8104,lib/model: Remove bogus fields from connections API endpoint (fixes #8103),acolomb,2022-01-09T18:15:12Z,2022-01-10T09:26:45+00:00,1,15.19
8108,gui: Generate version-specific documentation link URLs,acolomb,2022-01-11T22:09:49Z,2022-01-24T18:36:12+00:00,6,308.44
8117,gui: Fix bug saving settings (fixes #8116),imsodin,2022-01-16T11:15:16Z,2022-01-16T18:06:50+00:00,1,6.86
8122,lib/protocol: Switch to a newer lz4 package,calmh,2022-01-17T16:03:15Z,2022-01-17T17:52:44+00:00,2,1.82
8123,build(deps): bump github.com/shirou/gopsutil/v3 from 3.21.8 to 3.21.12,dependabot,2022-01-17T16:07:49Z,2022-01-22T07:46:03+00:00,1,111.64
8126,build(deps): bump github.com/alecthomas/kong from 0.2.17 to 0.3.0,dependabot,2022-01-17T16:08:09Z,2022-01-22T07:32:03+00:00,1,111.4
8131,cmd/syncthing/cli: Add showing pending folders for given device (fixes #8130),DanielBarczyk,2022-01-20T19:50:00Z,2022-01-30T07:09:37+00:00,5,227.33
8133,lib/protocol: Require at least 3.125% savings from compression,greatroar,2022-01-20T21:49:52Z,2022-01-24T18:36:59+00:00,3,92.79
8134,build: Bump quic to v0.25.0 for Go1.18 support,imsodin,2022-01-20T22:20:05Z,2022-01-21T13:54:42+00:00,1,15.58
8135,gui: Fix loading default ignores (ref #7530),imsodin,2022-01-20T22:25:54Z,2022-01-21T16:24:11+00:00,1,17.97
8138,gui: Fix ignoreDelete warning formatting (ref #8054),tomasz1986,2022-01-23T23:42:52Z,2022-01-30T12:03:46+00:00,1,156.35
8144,cmd/stdiscosrv: Don't start replication listener without peers (fixes #8143),calmh,2022-01-27T06:39:38Z,2022-01-27T08:36:54+00:00,1,1.95
8146,gui: Let folder ID be editable when adding folder (fixes #8145),calmh,2022-01-28T07:10:46Z,2022-01-30T07:55:07+00:00,1,48.74
8147,gui: Fix and align folder editing states (fixes #8145),imsodin,2022-01-29T13:22:16Z,2022-01-30T16:43:40+00:00,5,27.36
8148,lib/fs: Improve error messages checking file paths (fixes #7942),imsodin,2022-01-29T13:59:10Z,2022-01-29T17:47:56+00:00,1,3.81
8149,gui: Translate fancytree messages in Versions modal,tomasz1986,2022-01-29T18:57:32Z,2022-01-30T06:56:36+00:00,4,11.98
8151,"lib/db, lib/model: Remove filesystem state from FileSet (fixes #7850)",imsodin,2022-01-30T16:30:17Z,2022-01-31T09:12:52+00:00,2,16.71
8161,"lib, gui: Removed unused cleanInterval from Staggered Versioning (ref #541)",tomasz1986,2022-02-03T14:49:40Z,2022-02-08T06:06:15+00:00,2,111.28
8162,gui: Allow to translate and fix incorrect Versions date filter ranges,tomasz1986,2022-02-03T19:56:47Z,2022-02-07T20:41:06+00:00,1,96.74
8163,lib/api: Fix comments for endpoint parameters,acolomb,2022-02-06T21:50:15Z,2022-02-07T07:51:10+00:00,1,10.02
8166,Manual-of-Style,OCRenkist,2022-02-07T07:58:28Z,2022-02-22T20:04:29+00:00,1,372.1
8170,build(deps): bump github.com/pierrec/lz4/v4 from 4.1.12 to 4.1.13,dependabot,2022-02-07T16:06:39Z,2022-02-08T06:15:51+00:00,1,14.15
8172,gui: Don't use italic text for CJK languages,tomasz1986,2022-02-07T19:22:13Z,2022-02-08T06:07:22+00:00,1,10.75
8175,CSS code formatting in Dark theme,OCRenkist,2022-02-07T22:57:29Z,2022-02-08T06:16:46+00:00,1,7.32
8177,gui: Remove superfluous Trash Can info text from Simple Versioning,tomasz1986,2022-02-08T15:34:22Z,2022-02-08T19:10:03+00:00,1,3.59
8190,build(deps): bump github.com/thejerf/suture/v4 from 4.0.1 to 4.0.2,dependabot,2022-02-21T16:06:17Z,2022-02-23T20:07:15+00:00,1,52.02
8191,lib/config: Improve clarity of free space errors (fixes #8180),calmh,2022-02-22T14:48:04Z,2022-02-24T16:07:51+00:00,1,49.33
8197,Add port for local discovery broadcasts to Docker documentation,Ajedi32,2022-02-27T23:03:20Z,2022-03-08T07:06:46+00:00,1,200.06
8200,Rename environment variable STCPUPROFILE for consistency,acolomb,2022-03-03T12:30:53Z,2022-03-03T14:27:17+00:00,1,1.94
8201,"gui, lib/model: Mark folders unaccepted by remote device (fixes #8202)",acolomb,2022-03-04T23:41:22Z,2022-04-10T20:47:57+00:00,16,885.11
8204,gui: Use versioned link to documentation in bottom bar,calmh,2022-03-07T07:32:54Z,2022-03-08T06:56:43+00:00,1,23.4
8212,gui: Allow to translate Twitter footer link,tomasz1986,2022-03-12T20:11:54Z,2022-03-12T21:44:11+00:00,1,1.54
8213,gui: Allow to translate calendar buttons in Restore Versions modal,tomasz1986,2022-03-12T20:32:12Z,2022-03-12T21:44:56+00:00,1,1.21
8215,lib/db: Make err(Closed|NotFound) values,greatroar,2022-03-13T16:24:53Z,2022-03-13T19:53:35+00:00,1,3.48
8217,"lib/db, lib/discover: Minor cleanup",greatroar,2022-03-14T20:26:02Z,2022-03-14T21:48:10+00:00,1,1.37
8218,all: Comments and cosmetics,acolomb,2022-03-14T23:39:46Z,2022-04-02T18:36:19+00:00,9,450.94
8220,lib/model: Skip paused folders in aggregated completion loop (fixes #8219),acolomb,2022-03-16T20:04:31Z,2022-08-10T06:50:19+00:00,4,3514.76
8223,lib/fs: Do not follow symlinks in watcher on solaris (fixes #8020),gco,2022-03-19T03:00:47Z,2022-03-24T07:36:44+00:00,2,124.6
8224,build: Pin actions to a full length commit SHA,naveensrinivasan,2022-03-20T18:38:17Z,2022-03-24T15:46:06+00:00,1,93.13
8231,build: Bump quic-go to 0.27.0 for go1.18 update,imsodin,2022-03-24T15:45:29Z,2022-04-12T12:27:29+00:00,2,452.7
8234,Correct comment typo in build.go,gco,2022-03-25T02:44:56Z,2022-04-10T20:24:58+00:00,1,401.67
8235,"lib/model: Chmod to mode|0700, not 755",greatroar,2022-03-25T11:59:05Z,2022-03-26T10:07:07+00:00,1,22.13
8236,all: Replace errors.Cause with errors.Is,greatroar,2022-03-25T13:02:15Z,2022-03-26T10:05:58+00:00,1,21.06
8238,lib/model: Clear folder error after loading ignores (fixes #8232),imsodin,2022-03-25T19:29:18Z,2022-03-27T19:29:40+00:00,1,48.01
8249,"lib/fs, lib/model: Add warning about kqueue resource usage (fixes #7855)",imsodin,2022-04-03T09:41:24Z,2022-04-05T19:32:06+00:00,7,57.84
8253,"lib/connections, lib/model: Improve new conn handling",imsodin,2022-04-05T19:52:01Z,2022-04-07T15:35:33+00:00,1,43.73
8254,lib: Removal global connection registry,imsodin,2022-04-06T20:43:00Z,2022-04-09T14:04:56+00:00,1,65.37
8257,lib: Get rid of buggy filesystem wrapping,imsodin,2022-04-07T14:53:21Z,2022-04-10T18:55:05+00:00,4,76.03
8259,"lib/db: Constant/unused args and return values, double it.Release",greatroar,2022-04-08T09:48:51Z,2022-04-27T18:32:44+00:00,1,464.73
8260,build: Update go directive to 1.17 (fixes #8258),jefferyto,2022-04-08T09:54:43Z,2022-04-09T14:01:25+00:00,4,28.11
8263,lib/connections: Make request tests sequential,imsodin,2022-04-10T12:07:19Z,2022-04-10T18:54:16+00:00,1,6.78
8265,gui: Add default ignores to the advanced configuration editor modal (fixes #8264),acolomb,2022-04-10T22:04:54Z,2022-05-08T19:34:03+00:00,7,669.49
8273,"cmd/syncthing, lib/logger: Add date to default log format (fixes #8272)",calmh,2022-04-12T07:54:26Z,2022-04-15T03:46:14+00:00,2,67.86
8275,lib/model: Switch the remoteFolderState default value to valid (ref #8202),acolomb,2022-04-13T05:37:07Z,2022-04-13T16:15:58+00:00,1,10.65
8280,test: use `T.TempDir` to create temporary test directory,Juneezee,2022-04-13T13:15:17Z,2022-04-15T03:44:07+00:00,1,38.48
8281,gui: Use neutral color for zero out of zero listeners,calmh,2022-04-14T13:57:05Z,2022-04-20T12:43:12+00:00,2,142.77
8283,lib/model: Improve remoteFolderState reporting (fixes #8266),acolomb,2022-04-15T20:00:17Z,2022-04-22T06:42:20+00:00,24,154.7
8286,gui: Mark folders paused on remote devices (fixes #8310),acolomb,2022-04-16T20:43:40Z,2022-05-03T19:51:10+00:00,1,407.12
8288,gui: Remove unused strings from translations,tomasz1986,2022-04-17T11:31:06Z,2022-08-10T06:44:46+00:00,3,2755.23
8290,gui: Improve Latest Change translation string for better multilanguage support,tomasz1986,2022-04-17T15:03:05Z,2022-04-18T04:41:27+00:00,1,13.64
8301,gui: Always show vertical scroll bar.,red-led,2022-04-22T18:03:46Z,2022-04-22T19:39:30+00:00,1,1.6
8302,lib/discover: Filter locally announced addresses (fixes #7289),calmh,2022-04-23T12:30:30Z,2022-05-04T16:43:00+00:00,7,268.21
8305,gui: Bandaid for null http errors (fixes #8261),imsodin,2022-04-24T21:22:08Z,2022-04-25T17:15:15+00:00,1,19.89
8309,all: Clean up fmt.Errorf usage,greatroar,2022-04-27T11:44:51Z,2022-04-27T18:30:14+00:00,1,6.76
8312,lib/events: Remove unused method noopLogger.Stop,greatroar,2022-04-30T14:06:55Z,2022-05-02T06:00:55+00:00,1,39.9
8315,"cmd/strelaysrv, cmd/strelaypoolsrv: Sanitize query strings (fixes #8314)",calmh,2022-05-02T04:54:06Z,2022-05-02T08:38:49+00:00,1,3.75
8324,gui: Show internal config and state paths (fixes #8323),acolomb,2022-05-04T20:31:01Z,2022-08-10T06:25:14+00:00,13,2337.9
8329,lib/api: Fix and optimize csrfManager,greatroar,2022-05-07T07:56:55Z,2022-05-07T10:30:13+00:00,1,2.56
8345,build(deps): bump github.com/prometheus/client_golang from 1.11.0 to 1.12.2,dependabot,2022-05-16T16:06:27Z,2022-06-20T17:26:22+00:00,1,841.33
8348,gui: Add detailed file versioning information to folder info (ref #963),tomasz1986,2022-05-17T21:04:13Z,2022-05-28T11:46:15+00:00,6,254.7
8349,gui: Update Fork Awesome from v1.1.2 to v1.2.0,tomasz1986,2022-05-18T07:35:23Z,2022-05-18T12:08:45+00:00,2,4.56
8351,"lib/assets: MIME types, time formats",greatroar,2022-05-21T08:38:29Z,2022-05-22T20:10:18+00:00,5,35.53
8356,"lib/model: Don't fail on temporary chmod (fixes #8355, ref #8235)",imsodin,2022-05-22T10:07:04Z,2022-05-22T11:52:40+00:00,1,1.76
8362,gui: remove blank meta tags,lsmithx2,2022-05-25T09:25:03Z,2022-07-26T08:19:12+00:00,1,1486.9
8373,remove invalid code,Luoxin,2022-06-02T08:43:07Z,2022-06-02T13:15:42+00:00,1,4.54
8377,Update settingsModalView.html,Renegade605,2022-06-07T02:06:36Z,2022-06-07T04:59:11+00:00,1,2.88
8378,cmd/syncthing/cli: Add show discovery command (fixes #8007),sec65,2022-06-07T07:09:09Z,2022-07-13T21:11:17+00:00,3,878.04
8382,gui: Use discovered IDs from cache when adding a new remote device,acolomb,2022-06-11T14:00:18Z,2022-07-22T09:09:27+00:00,1,979.15
8387,build: Update to patched github.com/gobwas/glob (fixes #8386),calmh,2022-06-15T08:17:30Z,2022-06-15T19:49:15+00:00,2,11.53
8388,gui: Fix missing folder names in Edit Device > Sharing tab (fixes #8369),acolomb,2022-06-15T08:41:35Z,2022-06-15T17:31:55+00:00,1,8.84
8395,"lib/config, lib/model: Warn about two-way introducer (fixes #8393)",imsodin,2022-06-18T11:11:44Z,2022-06-20T17:36:45+00:00,2,54.42
8396,"Link to documentation page for ""folder marker missing""",bill-mcgonigle,2022-06-18T18:39:14Z,2023-03-10T12:01:07+00:00,2,6353.36
8398,build(deps): bump github.com/alecthomas/kong from 0.3.0 to 0.6.1,dependabot,2022-06-20T16:07:01Z,2022-06-20T17:25:14+00:00,1,1.3
8401,gui: Add device sync status (fixes #7981),Evan-sp,2022-06-23T20:09:06Z,2022-07-26T08:15:19+00:00,5,780.1
8406,Fix restarting after system suspend (#8341),omgold,2022-07-01T07:01:14Z,2022-07-26T14:53:32+00:00,1,607.87
8412,cmd/syncthing: Apply file permissions and modtimes when decrypting,calmh,2022-07-04T05:21:21Z,2022-07-04T08:57:46+00:00,1,3.61
8415,all: Support syncing ownership (fixes #xxx),calmh,2022-07-05T08:30:50Z,2022-07-21T11:57:45+00:00,1,387.45
8417,Add WebAuthn support to GUI (fixes #8409),emlun,2022-07-05T13:45:49Z,2023-04-23T18:45:34+00:00,29,7013.0
8419,gui: Fix missing span end tag and missing nbsp semicolon in HTML,tomasz1986,2022-07-05T17:14:25Z,2022-07-05T21:04:30+00:00,1,3.83
8422,lib/osutil: Only announce address of interfaces which are up (fixes #7458),Zahrun,2022-07-07T12:34:11Z,2022-07-07T17:19:30+00:00,6,4.76
8427,"lib/model, lib/config: Apply sensible defaults for auto-accepted encrypted folder (fixes #8296)",acolomb,2022-07-11T19:33:41Z,2022-07-22T09:27:59+00:00,1,253.91
8432,gui: Move filesystem watcher explanation from tooltip to help block,tomasz1986,2022-07-13T13:14:19Z,2022-07-22T09:25:15+00:00,3,212.18
8433,gui: Fix detailed staggered versioning information in folder info (ref #8348),tomasz1986,2022-07-13T13:49:20Z,2022-07-26T08:12:16+00:00,1,306.38
8434,all: Support syncing ownership (fixes #1329),calmh,2022-07-14T06:29:09Z,2022-07-26T06:24:58+00:00,3,287.93
8440,build: Update goleveldb,calmh,2022-07-21T11:56:14Z,2022-07-21T16:39:14+00:00,1,4.72
8441,lib/events: added FolderNew and FolderRemove,coderonline,2022-07-21T12:06:32Z,2022-08-10T06:15:56+00:00,1,474.16
8442,all: Add build constants for runtime.GOOS comparisons,calmh,2022-07-22T14:06:13Z,2022-07-28T17:36:39+00:00,7,147.51
8449,"cmd/syncthing, lib/config: Remove restartOnWakeup option & functionality (fixes #8448)",calmh,2022-07-26T08:28:05Z,2022-07-26T14:53:11+00:00,4,6.42
8472,docs: clarify docker network mode limitations,bt90,2022-07-31T14:10:27Z,2022-07-31T18:46:57+00:00,2,4.61
8475,build(deps): bump github.com/go-ldap/ldap/v3 from 3.4.1 to 3.4.4,dependabot,2022-08-01T16:08:16Z,2022-08-10T06:15:35+00:00,1,206.12
8483,build: Update quic-go for Go 1.19,calmh,2022-08-03T08:48:31Z,2022-08-03T13:43:26+00:00,1,4.92
8485,Refactor CLI code to allow passing CLI arguments via function parameter,Martchus,2022-08-04T16:47:58Z,2022-08-07T16:15:27+00:00,1,71.46
8490,Update dependabot.yml,jauderho,2022-08-08T18:58:05Z,2022-08-09T10:30:39+00:00,1,15.54
8491,all: Modernize error wrapping,calmh,2022-08-09T10:03:35Z,2022-08-16T08:01:49+00:00,6,165.97
8493,cmd/syncthing: Fix two typos,cuishuang,2022-08-10T11:19:22Z,2022-09-10T22:43:10+00:00,1,755.4
8496,lib/fs: Cache user lookups,calmh,2022-08-11T12:31:44Z,2022-08-12T05:48:00+00:00,2,17.27
8497,all: Make scanning ownership opt-in,calmh,2022-08-11T13:16:43Z,2022-08-12T05:47:20+00:00,3,16.51
8500,cmd/syncthing: Work around binary in current dir restriction (fixes #8499),imsodin,2022-08-13T15:42:02Z,2022-08-14T19:25:45+00:00,2,27.73
8502,"cmd/syncthing: Use os.executable in monitor, only fallback to PATH",imsodin,2022-08-14T19:41:29Z,2022-08-17T06:57:33+00:00,4,59.27
8513,all: Support syncing extended attributes (fixes #2698),calmh,2022-08-25T07:15:16Z,2022-09-14T07:50:56+00:00,25,480.59
8518,build(deps): bump actions/setup-go from 3.2.1 to 3.3.0,dependabot,2022-08-29T16:39:41Z,2022-09-20T09:46:19+00:00,1,521.11
8526,lib/tlsutil: Use crypto.Signer interface,greatroar,2022-09-09T09:58:54Z,2022-09-09T12:22:38+00:00,1,2.4
8530,gui: Mark devices that haven't connected for a long time (fixes #7703),tomasz1986,2022-09-11T17:05:59Z,2022-11-03T11:09:28+00:00,17,1266.06
8531,gui: Add tooltip to folder error message (fixes #7603),tomasz1986,2022-09-11T18:11:36Z,2022-09-11T20:13:05+00:00,1,2.02
8532,gui: Fix error in Restore Versions when path exists as both directory and file (fixes #7068),tomasz1986,2022-09-11T20:37:45Z,2022-09-12T06:19:30+00:00,1,9.7
8533,gui: Fix text wrapping on tablet-sized screens (fixes #8529),tomasz1986,2022-09-11T21:36:42Z,2022-09-13T17:18:58+00:00,1,43.7
8536,etc/linux-systemd: Mention AmbientCapabilities for syncOwnership.,acolomb,2022-09-12T21:43:06Z,2022-09-13T08:00:47+00:00,1,10.29
8537,lib/versioner: Fix cleaning behaviour (fixes #7988),er-pa,2022-09-13T08:10:02Z,2022-09-13T17:20:05+00:00,3,9.17
8538,lib: Factor out getting IP address from net.Addr,greatroar,2022-09-13T19:24:47Z,2022-09-14T06:44:47+00:00,6,11.33
8539,gui: Disable Restore Versions filters when no versioned files exist (fixes #5408),tomasz1986,2022-09-13T21:36:25Z,2023-03-10T12:41:16+00:00,8,4263.08
8542,script: Support single quotes in $translate.instant() parsing,acolomb,2022-09-14T21:11:14Z,2022-09-16T20:52:33+00:00,3,47.69
8544,gui: Replace JS select-on-click with CSS user-select (fixes #3868),tomasz1986,2022-09-16T13:21:46Z,2022-09-20T09:37:35+00:00,1,92.26
8545,gui: Add size and improve alt text of device QR code image,tomasz1986,2022-09-16T20:45:28Z,2022-09-20T09:46:35+00:00,2,85.02
8546,gui: Make QR code image downloadable on click,tomasz1986,2022-09-17T11:47:43Z,2022-09-17T16:57:17+00:00,1,5.16
8547,gui: Fix missing word in sendOwnership explanation in GUI,tomasz1986,2022-09-17T14:57:33Z,2022-09-19T19:34:11+00:00,2,52.61
8548,gui: Allow to translate action and type in Recent Changes modal,tomasz1986,2022-09-17T17:48:05Z,2023-01-05T13:33:04+00:00,19,2635.75
8549,lib/versioner: Fix error in Trashcan restore (fixes: #7965),er-pa,2022-09-19T16:05:22Z,2022-09-20T09:34:15+00:00,1,17.48
8552,docker: Add env var to control capabilities,calmh,2022-09-23T09:38:05Z,2022-09-26T11:39:42+00:00,1,74.03
8553,gui: Added conn status icons to Remote Devices (fixes #8244),er-pa,2022-09-23T12:49:11Z,2022-09-30T16:15:19+00:00,8,171.44
8561,cmd/strelaysrv: Add optional auth token (fixes #3987),entity0xfe,2022-09-28T21:55:28Z,2022-10-01T19:41:02+00:00,12,69.76
8563,lib: Don't add enc. trailer to info size (fixes #8556),imsodin,2022-09-30T16:14:28Z,2023-03-10T13:14:14+00:00,7,3861.0
8565,lib/fs: Skip xattrs test on EOPNOTSUPP (fixes #8564),imsodin,2022-09-30T22:03:28Z,2022-10-01T06:48:00+00:00,1,8.74
8566,cmd/stcrashreceiver: Update to more modern panicparse,calmh,2022-10-01T11:03:01Z,2022-10-01T20:03:15+00:00,1,9.0
8568,docker: Fix handling of PCAP variable (fixes #8567),calmh,2022-10-01T20:38:03Z,2022-10-02T06:50:27+00:00,1,10.21
8571,gui: Fix rescan interval when add encrypted folder with watch for changes enabled (fixes #8570),Ratio2,2022-10-02T14:39:22Z,2022-11-03T11:07:36+00:00,2,764.47
8573,lib/model: Don't lower rescan interval from default on auto accepted enc folder (fixes #8572),Ratio2,2022-10-02T17:14:43Z,2022-12-21T18:52:23+00:00,2,1921.63
8576,cmd/syncthing: Decrypt versions folder (#8575),Ratio2,2022-10-03T00:18:46Z,2023-03-10T12:01:09+00:00,3,3803.71
8585,lib/api: Add /rest/noauth/health health-check (fixes #8430) ,er-pa,2022-10-06T09:56:14Z,2022-10-06T19:28:49+00:00,3,9.54
8586,"api, gui: Prevent connection issues due to unsupported-upgrade (fixes #8569) ",er-pa,2022-10-06T18:19:50Z,2022-10-06T19:27:09+00:00,2,1.12
8587,Fix whitespace and indentation errors from recent PRs.,acolomb,2022-10-06T20:16:23Z,2022-10-07T06:10:17+00:00,1,9.9
8591,lib/protocol: Show inode change time in FileInfo debug string,calmh,2022-10-07T19:55:31Z,2022-10-08T17:28:10+00:00,1,21.54
8596,lib/scanner: More sensible debug output,calmh,2022-10-08T21:02:54Z,2022-10-13T17:32:59+00:00,1,116.5
8597,gui: Allow automatic device ID selection on WebKit browsers (ref #8544),tomasz1986,2022-10-10T15:22:04Z,2022-10-10T21:01:37+00:00,1,5.66
8600,lib/protocol: Implemented caching of scrypt hashes (fixes #8599),Ratio2,2022-10-11T17:10:30Z,2023-03-10T12:01:13+00:00,3,3594.85
8603,"lib/model, lib/protocol: Fix file comparisons (fixes #8594)",calmh,2022-10-13T17:40:33Z,2022-10-16T15:04:28+00:00,2,69.4
8627,build: Add GitHub actions build for Windows,calmh,2022-10-28T11:59:48Z,2022-11-05T14:40:53+00:00,11,194.68
8631,lib/connections: Use adaptive write size for rate limited connections (fixes #8630),calmh,2022-10-31T14:23:00Z,2022-11-03T14:44:47+00:00,1,72.36
8632,gui: Always show Out of Sync Items for remote devices,tomasz1986,2022-10-31T15:16:02Z,2022-11-03T11:06:32+00:00,1,67.84
8640,docker: Use healthcheck endpoint,bt90,2022-11-03T16:52:27Z,2022-11-03T19:43:33+00:00,1,2.85
8643,gui: Show folder/device status on small screens,tomasz1986,2022-11-04T15:47:56Z,2023-12-10T14:14:11+00:00,36,9622.44
8644,gui: Fix connection type icon width (fixes #8592),tomasz1986,2022-11-04T16:34:01Z,2022-11-04T20:12:18+00:00,2,3.64
8645,gui: Adjust connection type icon size scaling and alignment,tomasz1986,2022-11-04T17:08:31Z,2022-11-04T18:41:27+00:00,1,1.55
8647,lib/model: Fixed adding empty items to device list (fixes #8646),Ratio2,2022-11-05T13:53:36Z,2022-12-06T20:22:35+00:00,2,750.48
8650,lib/fs: Try to remove read only Windows files (fixes #3744),calmh,2022-11-07T06:58:02Z,2022-11-07T20:33:18+00:00,4,13.59
8655,lib/protocol: Ignore inode time when xattr&ownership is ignored (fixes #8654),imsodin,2022-11-07T21:11:15Z,2022-11-08T07:36:41+00:00,1,10.42
8656,lib: Don't bump version when inode time only changes (fixes #8654),imsodin,2022-11-07T21:22:24Z,2022-11-08T07:37:03+00:00,2,10.24
8658,lib/model: Correctly handle xattrs on directories (fixes #8657),calmh,2022-11-08T15:44:26Z,2022-11-09T05:54:05+00:00,2,14.16
8662,docs: Separate synced file folder and config files folder mount point,ResRipper,2022-11-10T02:55:45Z,2023-03-10T12:01:17+00:00,1,2889.09
8670,lib/model: Correctly set xattrs on temp files (fixes #8667),calmh,2022-11-11T06:32:03Z,2022-11-11T10:49:15+00:00,1,4.29
8680,build: Update all dependencies (fixes #8679),calmh,2022-11-17T12:30:08Z,2022-11-17T20:26:10+00:00,1,7.93
8685,cmd/syncthing: Use main logger in generate subcommand (fixes #8682),calmh,2022-11-19T08:16:51Z,2022-11-20T12:48:08+00:00,1,28.52
8687,lib/fs: Optimize WindowsInvalidFilename,greatroar,2022-11-20T22:29:31Z,2022-11-21T11:58:01+00:00,1,13.47
8694,gui: Let the backend decide whether connection is local (fixes #8686),acolomb,2022-11-27T19:57:23Z,2022-11-28T08:28:33+00:00,2,12.52
8706,docker: Update healthcheck cmd for buildx (ref #8640),calmh,2022-12-06T14:53:37Z,2022-12-06T20:23:49+00:00,1,5.5
8708,build: Handle co-authors (ref #3744),calmh,2022-12-07T07:02:46Z,2022-12-21T21:02:45+00:00,1,350.0
