number,title,author,createdAt,closedOrMergedAt,reviewsCount,hoursOpen
6764,lib/fs: Add support for Windows duplicate extents,AudriusButkevicius,2020-06-18T19:35:29Z,2020-06-18T21:32:27+00:00,1,1.95
6768,build: Disable Cgo on windows,imsodin,2020-06-20T12:27:34Z,2020-06-21T15:32:56+00:00,10,27.09
6769,lib/model: Use right db snap when scanning recvonly folder,imsodin,2020-06-20T15:13:23Z,2020-06-21T07:28:29+00:00,1,16.25
6770,lib/ur: Normalise contract between syncthing and ursrv,AudriusButkevicius,2020-06-20T16:53:11Z,2020-06-23T08:47:16+00:00,12,63.9
6774,"lib/api, lib/model: Fixes around event request tracking",imsodin,2020-06-21T12:58:24Z,2020-06-25T19:48:49+00:00,5,102.84
6775,lib/protocol: Use sha256.Sum256 in NewDeviceID,greatroar,2020-06-21T17:25:11Z,2020-06-21T18:38:07+00:00,1,1.22
6777, lib/nat: Make service termination faster,AudriusButkevicius,2020-06-21T21:27:58Z,2020-06-22T08:01:57+00:00,6,10.57
6778,lib/model: More connection closing,AudriusButkevicius,2020-06-21T22:07:52Z,2020-06-22T20:26:27+00:00,4,22.31
6780,lib/model: Remove double error handling in performFinish,imsodin,2020-06-22T07:55:40Z,2020-06-23T05:30:17+00:00,1,21.58
6782,build(deps): bump golang.org/x/text from 0.3.2 to 0.3.3,dependabot-preview,2020-06-22T09:36:39Z,2020-06-23T05:34:23+00:00,1,19.96
6783,build(deps): bump github.com/go-ldap/ldap/v3 from 3.1.10 to 3.2.0,dependabot-preview,2020-06-22T09:37:19Z,2020-06-23T05:34:52+00:00,1,19.96
6785,lib/db: Correct need accounting on reset (fixes #6784),imsodin,2020-06-22T09:53:32Z,2020-06-23T05:29:28+00:00,1,19.6
6787,all: Add untrusted config for devices,imsodin,2020-06-22T18:26:27Z,2020-07-02T18:48:23+00:00,14,240.37
6790,lib/ur: Zero our the value before unmarshal,AudriusButkevicius,2020-06-23T19:01:40Z,2020-06-23T20:23:33+00:00,1,1.36
6796,lib/protocol: Don't warn when dropping deleted invalid item (fixes #6795),imsodin,2020-06-25T14:13:39Z,2020-06-25T18:24:32+00:00,1,4.18
6797,lib/model: Consider weak hash on recheckFile,imsodin,2020-06-25T15:00:53Z,2020-06-26T14:47:04+00:00,1,23.77
6799,lib/protocol: Include WeakHash in BlocksHash,imsodin,2020-06-25T19:44:50Z,2020-06-29T07:33:08+00:00,7,83.81
6802,lib/protocol: Add BlocksHash to FileInfo string,imsodin,2020-06-26T21:33:06Z,2020-06-27T05:44:34+00:00,3,8.19
6803,lib/ur: Track new folder feature usage,AudriusButkevicius,2020-06-28T14:45:02Z,2020-06-28T18:35:23+00:00,1,3.84
6808,"lib/api, lib/model: Improve folder completion API (fixes #6075)",calmh,2020-07-02T12:07:19Z,2020-07-03T06:48:38+00:00,7,18.69
6809,lib/fs: Set O_NOATIME flag on Linux,greatroar,2020-07-02T12:26:50Z,2020-07-22T07:23:47+00:00,1,474.95
6811,gui: Hide file pull order when folder is send only,jccroft1,2020-07-05T17:11:12Z,2020-07-08T20:49:12+00:00,1,75.63
6813,build(deps): bump github.com/lucas-clemente/quic-go from 0.17.1 to 0.17.2,dependabot-preview,2020-07-06T09:01:57Z,2020-07-06T11:18:11+00:00,1,2.27
6814,lib: Use encoding.TextUnmarshaler for utils.SetDefaults,imsodin,2020-07-06T09:24:13Z,2020-07-06T10:47:25+00:00,1,1.39
6821,gui: Disable file pull order when for send-only (fixes #6807),jccroft1,2020-07-08T19:40:17Z,2020-07-09T09:57:05+00:00,4,14.28
6822,gui: Improve advanced tab in folder edit modal,imsodin,2020-07-08T20:34:43Z,2020-07-09T13:28:46+00:00,2,16.9
6824,lib/nat: Make sure nat keeps being disabled (fixes #6823),imsodin,2020-07-09T09:55:41Z,2020-07-14T06:16:08+00:00,4,116.34
6826,lib/db: Use SipHash to deal with hash collisions in GC,greatroar,2020-07-10T14:14:07Z,2020-07-11T07:36:10+00:00,1,17.37
6828,lib/scanner: Less strict validation (fixes #6827),calmh,2020-07-11T06:53:30Z,2020-07-11T12:48:46+00:00,1,5.92
6829,build(deps): bump github.com/lucas-clemente/quic-go from 0.17.2 to 0.17.3,dependabot-preview,2020-07-13T09:14:35Z,2020-07-14T06:29:21+00:00,1,21.25
6830,build(deps): bump github.com/greatroar/blobloom from 0.2.1 to 0.3.0,dependabot-preview,2020-07-13T09:15:33Z,2020-07-14T06:40:47+00:00,1,21.42
6834,gui: Add GUI control for versioning cleanup interval (ref #6693),calmh,2020-07-14T09:20:53Z,2020-07-14T15:35:10+00:00,1,6.24
6837,gui: sharpen device icons (fixes #5579),aelindeman,2020-07-16T16:32:59Z,2020-07-16T17:49:49+00:00,1,1.28
6838,lib/db: Rework flush hooks,AudriusButkevicius,2020-07-17T20:03:41Z,2020-07-19T06:55:27+00:00,1,34.86
6841,dev: add github action file #5436,qinghon,2020-07-19T12:37:37Z,2020-09-15T17:44:31+00:00,8,1397.12
6846,lib/fs: Pass inf. rec. err on instead of warning,imsodin,2020-07-22T15:47:32Z,2020-07-22T20:10:25+00:00,1,4.38
6847,lib/model: Check folder error before sync-waiting (fixes #6793),imsodin,2020-07-22T23:01:13Z,2020-07-31T17:26:10+00:00,1,210.42
6848,change default marker folder name,saimonn,2020-07-23T13:00:10Z,2020-11-14T07:02:50+00:00,1,2730.04
6849,lib: Wrap suture to add service errors/termination (ref #5907),imsodin,2020-07-23T20:33:17Z,2020-08-21T11:27:09+00:00,1,686.9
6861,lib/db: Include blocks in db check (ref #6855),imsodin,2020-07-28T12:53:59Z,2020-07-28T14:25:08+00:00,1,1.52
6863,lib/db: Don't count invalid items to global state (ref #6850),imsodin,2020-07-28T15:30:23Z,2020-07-30T11:49:14+00:00,1,44.31
6865,lib/model: Detect deleted RO items scanning on non-RO (fixes #6864),imsodin,2020-07-29T10:13:00Z,2020-07-30T11:41:46+00:00,1,25.48
6866,build: Actually set build tags,calmh,2020-07-30T07:38:06Z,2020-07-30T08:58:44+00:00,1,1.34
6868,"lib/connections, lib/tlsutil: Handle certName in Go 1.15 (fixes #6867)",calmh,2020-07-30T08:34:55Z,2020-07-30T11:36:12+00:00,4,3.02
6871,gui: Don't show pull order on SO folders (ref #6807),imsodin,2020-07-31T17:09:10Z,2020-08-01T09:19:55+00:00,1,16.18
6872,lib/db: Log context on panic,imsodin,2020-08-01T10:47:48Z,2020-08-01T15:32:36+00:00,1,4.75
6876,lib/model: Don't close file early (fixes #6875),AudriusButkevicius,2020-08-03T18:35:47Z,2020-08-03T19:54:43+00:00,1,1.32
6877,"lib/fs: Unwrap mtimeFile, get fd the ""correct"" way (ref #6875)",AudriusButkevicius,2020-08-03T22:16:46Z,2020-08-07T05:47:49+00:00,1,79.52
6883,all: Remove need to restart syncthing,AudriusButkevicius,2020-08-08T14:07:50Z,2020-08-18T07:26:34+00:00,10,233.31
6884,Created cleanup functionality for syncthing,rjpruitt16,2020-08-08T16:46:46Z,2020-08-24T11:14:31+00:00,18,378.46
6885,lib/osutil: Preserve perms in AtomicWriter (fixes #6886),imsodin,2020-08-09T15:41:58Z,2020-08-10T16:48:38+00:00,2,25.11
6887,lib/osutil: Check returned error instead of info (ref #6885),imsodin,2020-08-10T19:24:06Z,2020-08-12T09:33:57+00:00,3,38.16
6888,"lib/db: Don't put truncated files (ref #6855, ref #6501)",imsodin,2020-08-11T20:10:31Z,2020-08-18T07:20:13+00:00,9,155.16
6893,lib/dialer: Try dialing without reuse in parallel (fixes #6892),AudriusButkevicius,2020-08-13T21:49:42Z,2020-08-18T11:11:12+00:00,9,109.36
6895,build: Bump goleveldb to latest commit,imsodin,2020-08-15T08:41:46Z,2020-08-21T10:35:05+00:00,2,145.89
6896,lib/connections: Announce LAN addresses by default,AudriusButkevicius,2020-08-15T21:46:51Z,2020-08-25T09:48:14+00:00,3,228.02
6900,all: Use protobuf to generate config structs (fixes #6734),AudriusButkevicius,2020-08-18T16:58:52Z,2020-08-25T06:11:16+00:00,16,157.21
6901,lib/fs: Disable ioctl on ppc (fixes #6898),AudriusButkevicius,2020-08-18T18:03:13Z,2020-08-19T05:56:36+00:00,1,11.89
6907,"lib/config, lib/fs: Make junction behaviour configurable (ref #6606)",imsodin,2020-08-19T11:48:07Z,2020-08-19T17:58:52+00:00,4,6.18
6911,lib/model: Don't mark globally deleted items as recv-only (fixes #6910),imsodin,2020-08-19T14:16:54Z,2020-08-21T10:34:23+00:00,2,44.29
6913,lib/model: Do db heavy ops without holding fmut,imsodin,2020-08-19T14:39:41Z,2020-08-27T14:01:46+00:00,1,191.37
6914,lib/model: Handle del. dir with locally changed items on pull (fixes #6873),imsodin,2020-08-19T18:42:05Z,2020-08-20T08:56:30+00:00,1,14.24
6919,lib/model: Prevent localflag flipflopping on del. item (ref #6865),imsodin,2020-08-20T18:07:17Z,2020-08-21T08:09:49+00:00,1,14.04
6925,all: Add failure reporting (fixes #7028),imsodin,2020-08-24T09:38:41Z,2020-10-07T08:05:13+00:00,10,1054.44
6926,lib/syncthing: Also cleanup on startup error,imsodin,2020-08-24T18:09:51Z,2020-08-27T13:52:52+00:00,1,67.72
6931,gui: Fix add folder bug (fixes #6930),rjpruitt16,2020-08-26T03:08:39Z,2020-08-27T06:59:38+00:00,1,27.85
6941,lib/model: Adjust fileinfo size when adding the trailer,imsodin,2020-08-29T08:40:12Z,2020-09-04T12:05:32+00:00,1,147.42
6942,gui: Use indexOf instead of startsWith for IE11 compatibility (fixes #6940),tomasz1986,2020-08-29T09:03:17Z,2020-08-29T10:26:32+00:00,1,1.39
6944,build: Improve translation script (fixes #6943),imsodin,2020-08-29T20:35:41Z,2020-08-30T06:01:47+00:00,1,9.44
6945,lib/model: Add missing lock on download-state (fixes #6880),imsodin,2020-08-29T22:13:00Z,2020-08-30T06:03:11+00:00,1,7.84
6947,all: Implement suture v4-api,imsodin,2020-09-01T08:08:12Z,2020-11-17T12:19:05+00:00,6,1852.18
6948,BUILDHOST name changed for Arch,svetlemodry,2020-09-01T16:39:48Z,2020-09-02T06:20:25+00:00,2,13.68
6950,lib/db: Add local need check&repair,imsodin,2020-09-02T22:31:58Z,2020-09-04T12:01:47+00:00,2,37.5
6951,lib/model: Don't acquire io token for send-only pull,imsodin,2020-09-03T10:48:16Z,2020-09-03T11:59:46+00:00,1,1.19
6952,"lib/db: Copy returned, old FileVersion",imsodin,2020-09-03T21:58:57Z,2020-09-04T12:13:39+00:00,1,14.24
6954,"cmd/stindex, lib/db: Use same condition to check for needed files",imsodin,2020-09-04T07:43:41Z,2020-09-04T11:59:05+00:00,1,4.26
6956,"test, lib/model: Various integration test updates & improvements",imsodin,2020-09-05T14:43:53Z,2020-09-07T07:35:37+00:00,1,40.86
6962,"lib/db, lib/protocol: Never need empty-version entries (fixes #6961)",calmh,2020-09-07T14:35:06Z,2020-09-07T18:18:25+00:00,2,3.72
6971,"lib/db, lib/syncthing: Don't repair DB on upgrade, but on error (fixes #6917)",imsodin,2020-09-08T20:41:55Z,2020-09-10T08:54:42+00:00,3,36.21
6974,lib/fs: More efficient casefs cache,calmh,2020-09-09T07:02:09Z,2020-09-09T12:38:40+00:00,3,5.61
6975,lib/model: Don't fail over case-conflict on tempfile (fixes #6973),imsodin,2020-09-09T07:05:16Z,2020-09-09T09:47:15+00:00,1,2.7
6976,lib/model: Handle symlink deletion on windows (fixes #6972),imsodin,2020-09-09T10:11:13Z,2020-09-10T06:25:45+00:00,4,20.24
6977,lib/model: Consider existing file when handling symlink on windows,imsodin,2020-09-09T14:46:50Z,2020-09-10T08:52:39+00:00,4,18.1
6978,lib/model: Fix case-only renames on pull,imsodin,2020-09-09T16:31:44Z,2020-09-10T06:23:55+00:00,1,13.87
6979,lib/fs: Optimize UnicodeLowercase,greatroar,2020-09-10T10:49:14Z,2020-09-11T07:16:11+00:00,5,20.45
6983,"lib/config, lib/syncthing: Only drop delta index on upgrade if so ordered (fixes #6982)",calmh,2020-09-11T07:38:58Z,2020-09-30T18:16:31+00:00,1,466.63
6986,lib/model: Consider case conflicts when checking to be deleted items,imsodin,2020-09-11T22:20:14Z,2020-09-12T05:45:51+00:00,1,7.43
6995,lib/model: Use winning version instead of merge on conflict,imsodin,2020-09-21T06:27:15Z,2020-10-19T06:53:20+00:00,1,672.43
6997,"lib/model, lib/scanner: Prevent races aborting scans (fixes #6994)",imsodin,2020-09-21T09:11:55Z,2020-09-25T09:27:45+00:00,5,96.26
7000,lib/fs: use file clone ioctl wrappers and types from golang.org/x/sys/unix,tklauser,2020-09-23T08:27:54Z,2020-09-24T08:29:33+00:00,6,24.03
7001,lib/api: Add /rest/config endpoint (fixes #6540),imsodin,2020-09-23T09:08:31Z,2020-10-22T17:54:36+00:00,18,704.77
7009,all: Move remaining protos to use the vanity plugin,AudriusButkevicius,2020-09-26T22:40:45Z,2020-10-02T06:07:06+00:00,7,127.44
7013,lib/fs: Add COM0 and LPT0 to invalid Windows file names,tomasz1986,2020-09-28T13:55:33Z,2020-09-28T18:35:54+00:00,1,4.67
7014,lib/model: Auto-resolve identical case-conflicts (fixes #6989),imsodin,2020-09-29T09:28:09Z,2020-09-30T09:31:36+00:00,2,24.06
7015,"lib: Remove HelloResult type, same as Hello",imsodin,2020-09-29T10:02:43Z,2020-09-29T11:17:39+00:00,1,1.25
7017,gui: add advance config port mapping to gui,rjpruitt16,2020-09-30T04:35:50Z,2020-11-10T08:24:12+00:00,77,987.81
7018,"lib/model, lib/protocol: Send ClusterConfig on config change (fixes #7020)",imsodin,2020-09-30T13:37:23Z,2020-10-02T09:49:52+00:00,3,44.21
7019,lib: Use uint64 for disk stats (ref #3930),imsodin,2020-10-01T09:31:53Z,2020-10-02T13:22:28+00:00,4,27.84
7025,gui: Fix NaN percentage for zero byte files (fixes #7002),fblampe,2020-10-06T11:39:44Z,2020-10-06T15:17:34+00:00,1,3.63
7029,"cmd/stcrashreceiver, lib/db: Improve panic message handling",imsodin,2020-10-08T09:25:31Z,2020-10-08T15:37:46+00:00,4,6.2
7038,lib/model: Handle index sender lifetime (fixes #7034),imsodin,2020-10-17T18:49:59Z,2020-10-21T09:51:54+00:00,7,87.03
7040,lib/db: Undo adding user info to panic msgs (ref #7029),imsodin,2020-10-17T20:27:52Z,2020-10-19T06:40:37+00:00,3,34.21
7041,lib/db: Ignore not found on delete in recalcGlobal (ref #7026),imsodin,2020-10-18T17:05:20Z,2020-10-19T06:28:54+00:00,1,13.39
7044,lib/db: Remove need for the right dev removing globals (fixes #7036),imsodin,2020-10-19T20:33:27Z,2020-10-21T06:26:10+00:00,1,33.88
7045,lib/connections: Fix LAN addresses begin advertised even when disabled (fixes #7035),AudriusButkevicius,2020-10-20T16:45:54Z,2020-10-21T07:16:45+00:00,2,14.51
7047,lib/db: Add mechanism to repair db without schema update (ref #7044),imsodin,2020-10-21T10:51:01Z,2020-10-21T12:21:11+00:00,2,1.5
7049,gui: Refactor to make encryption diff smaller,imsodin,2020-10-21T21:44:28Z,2020-10-23T06:27:03+00:00,1,32.71
7055,all: Add untrusted folders behind feature flag (ref #62),imsodin,2020-10-23T13:24:13Z,2020-11-09T14:33:33+00:00,3,409.16
7056,gui: Fix undefined variables fallout from #7049.,acolomb,2020-10-24T00:02:39Z,2020-10-26T08:09:33+00:00,3,56.12
7061,gui: Readd check if device exists (ref #7059),imsodin,2020-10-27T09:15:28Z,2020-10-27T15:40:17+00:00,1,6.41
7069,lib/config: Sanity checks on MaxConcurrentWrites (ref #7064),imsodin,2020-10-30T09:08:44Z,2020-11-03T18:09:33+00:00,2,105.01
7072,"lib/config: Check for ""msdos"" when detecting FAT FS in Android",tomasz1986,2020-10-30T12:03:10Z,2020-10-30T14:13:57+00:00,1,2.18
7078,gui: Fix another undefined variable access (fixes #7077).,acolomb,2020-11-01T09:37:30Z,2020-11-01T12:15:21+00:00,1,2.63
7079,lib/api: Allow OPTIONS method in CORS preflight request handling.,acolomb,2020-11-01T11:32:39Z,2020-11-01T13:29:56+00:00,3,1.95
7080,build: Update notify (fixes #7063),imsodin,2020-11-01T12:10:14Z,2020-11-01T20:37:31+00:00,1,8.45
7081,lib/api: Fix /rest/config path and add methods to cors (ref #7001),imsodin,2020-11-01T15:12:15Z,2020-11-01T20:36:55+00:00,1,5.41
7088,build: Update dependencies,calmh,2020-11-02T14:33:16Z,2020-11-03T08:11:01+00:00,1,17.63
7089,lib: Remove USE_BADGER experiment,calmh,2020-11-02T14:48:27Z,2020-11-03T08:10:36+00:00,1,17.37
7092,lib/api: Fix debug endpoints (ref #7001),imsodin,2020-11-06T10:48:12Z,2020-11-06T13:21:38+00:00,1,2.56
7093,lib/folder: Clear pull errors when nothing is needed anymore,imsodin,2020-11-06T11:57:03Z,2020-11-06T13:22:21+00:00,1,1.42
7094,lib/model: Add done chan to track folder-lifetime (fixes #6664),imsodin,2020-11-06T13:41:55Z,2020-11-09T08:05:48+00:00,1,66.4
7095,"lib/api, lib/db: Add file debug endpoint",imsodin,2020-11-06T16:25:48Z,2020-11-10T08:24:46+00:00,1,87.98
7100,lib/model: Send indexes for newly shared folder (fixes #7098),imsodin,2020-11-09T00:05:55Z,2020-11-09T07:58:47+00:00,1,7.88
7102,gui: Add warning when JavaScript is disabled in Web browser (fixes #7099),tomasz1986,2020-11-09T03:57:03Z,2020-11-09T08:15:23+00:00,7,4.31
7106,build: Update notify (fixes #5360),imsodin,2020-11-09T09:25:27Z,2020-11-09T13:25:20+00:00,1,4.0
7107,lib/model: Fix locking when resending cluster-configs,imsodin,2020-11-09T10:22:46Z,2020-11-09T13:05:22+00:00,1,2.71
7109,lib/tlsutil: Add O and OU to generated certificates (fixes #7108),calmh,2020-11-09T13:31:05Z,2020-11-09T16:02:57+00:00,1,2.53
7110,lib/model: Prevent test deadlock,imsodin,2020-11-10T09:46:10Z,2020-11-10T11:32:08+00:00,1,1.77
7114,gui: Initialise sharing when accepting new device (fixes #7113),imsodin,2020-11-11T15:47:03Z,2020-11-11T17:18:35+00:00,1,1.53
7119,minor doc comment fix,phanirithvij,2020-11-15T23:48:47Z,2020-11-16T08:54:32+00:00,1,9.1
7127,all: Refactor preparing configuration,imsodin,2020-11-18T17:40:32Z,2020-11-20T13:21:54+00:00,1,43.69
7131,"all: Add configurable defaults (fixes #4224, fixes #6086)",imsodin,2020-11-19T18:03:10Z,2021-02-04T20:10:41+00:00,3,1850.13
7133,lib/model: Retain index info for new folders/devs (ref #7100),imsodin,2020-11-20T12:43:12Z,2020-11-20T14:53:14+00:00,1,2.17
7136,gui: Remove probing for remote GUI address (ref #7017),calmh,2020-11-20T14:18:18Z,2020-11-24T21:07:23+00:00,7,102.82
7140,lib/db: Store versions for last successful db migration,imsodin,2020-11-23T11:59:41Z,2020-11-23T17:31:33+00:00,1,5.53
7141,lib/protocol: Send Close message on read error,imsodin,2020-11-23T15:57:31Z,2020-11-27T10:31:21+00:00,2,90.56
7145,Ignore gui,christianprescott,2020-11-24T04:16:32Z,2021-08-11T07:03:32+00:00,22,6242.78
7147,lib/model: Don't send locally changed on recv-enc (fixes #7137),imsodin,2020-11-24T11:53:21Z,2020-11-24T20:49:46+00:00,1,8.94
7148,gui: Fix & improve sharing with untrusted device,imsodin,2020-11-24T14:54:38Z,2020-11-24T21:02:16+00:00,1,6.13
7149,build: Ignore noscript in translation-script,imsodin,2020-11-24T15:14:05Z,2020-11-24T21:17:52+00:00,3,6.06
7150,all: Handle errors opening db/creating file-set (ref #5907),imsodin,2020-11-24T16:56:02Z,2020-12-21T11:59:23+00:00,7,643.06
7154,"lib: Skip deleted, locally changed on recv-enc folders (fixes #7153)",imsodin,2020-11-25T14:30:57Z,2020-11-27T10:26:37+00:00,1,43.93
7155,lib/model: Fix enc file size when pulling (fixes #7152),imsodin,2020-11-25T15:41:24Z,2020-11-25T21:57:26+00:00,1,6.27
7156,lib/db: Do not reset index-id when dropping device (ref #7135),imsodin,2020-11-25T16:06:46Z,2020-11-25T21:54:05+00:00,1,5.79
7157,lib/api: Shut the api down gracefully (fixes #7138),imsodin,2020-11-25T20:12:48Z,2020-11-26T14:49:39+00:00,1,18.61
7158,"lib/fs, lib/model: Cover more windowsyness sanitizing paths (fixes #7075)",imsodin,2020-11-25T20:22:23Z,2020-11-25T21:52:47+00:00,1,1.51
7159,lib/stun: Don't notify about address changes if it's not useful (fixes #7144),AudriusButkevicius,2020-11-26T18:01:23Z,2020-11-27T06:34:31+00:00,1,12.55
7160,gui: Fix invalid HTML syntax.,acolomb,2020-11-26T23:51:53Z,2021-02-27T07:02:18+00:00,11,2215.17
7161,gui: Restore Select / Deselect All buttons in device sharing tab.,acolomb,2020-11-27T00:45:35Z,2020-11-27T10:48:49+00:00,1,10.05
7162,gui: Split folders into two categories on the sharing tab for devices.,acolomb,2020-11-27T01:36:12Z,2020-12-09T13:54:52+00:00,4,300.31
7164,lib/ur: Send unreported failures on shutdown,imsodin,2020-11-27T11:56:30Z,2020-12-22T19:17:15+00:00,4,607.35
7169,lib/ur: Reset timer when there's nothing to report,imsodin,2020-11-28T17:01:39Z,2020-11-28T19:09:23+00:00,1,2.13
7177,lib/connections: Refactor connection loop,calmh,2020-12-02T22:03:30Z,2020-12-21T15:40:14+00:00,5,449.61
7185,gui: Fix blank device name under recent changes.,elesiuta,2020-12-07T20:00:22Z,2020-12-07T21:19:29+00:00,1,1.32
7186,lib/connections: Handle QUIC not being available,calmh,2020-12-08T14:06:02Z,2020-12-09T18:23:51+00:00,4,28.3
7187,lib/protocol: Handle slashified paths in IsEncryptedParent (fixes #7184),imsodin,2020-12-09T14:26:51Z,2020-12-09T17:16:15+00:00,1,2.82
7188,lib: Apply config changes sequentially (ref #5298),imsodin,2020-12-10T09:58:11Z,2021-01-15T14:43:35+00:00,14,868.76
7189,build: Update notify (fixes #7076),imsodin,2020-12-10T10:09:15Z,2020-12-10T14:43:06+00:00,1,4.56
7192,gui: Sort folders and devices in advanced config modal (fixes #6985),acolomb,2020-12-11T17:11:03Z,2020-12-14T15:45:39+00:00,1,70.58
7200,lib/db: Remove index ids when dropping folder,imsodin,2020-12-16T09:13:56Z,2020-12-21T10:11:00+00:00,1,120.95
7201,gui: Reflect change in untrusted in sharing tab,imsodin,2020-12-16T09:58:43Z,2020-12-21T10:11:45+00:00,1,120.22
7202,lib: Consistently set suture logging,imsodin,2020-12-16T11:21:22Z,2020-12-18T18:44:00+00:00,3,55.38
7204,lib/config: Remove deprecated pending entries from config (ref #6443),imsodin,2020-12-17T20:06:37Z,2020-12-17T21:49:30+00:00,1,1.71
7205,lib/model: Forget pending folders no longer announced in ClusterConfig (fixes #5187),acolomb,2020-12-17T21:04:38Z,2021-01-25T10:58:11+00:00,45,925.89
7208,lib/model: Unflake TestIgnoreDeleteUnignore,imsodin,2020-12-18T10:30:44Z,2020-12-18T17:42:10+00:00,1,7.19
7209,lib/fs: Correct wrapping order for meaningful log-caller,imsodin,2020-12-18T11:21:42Z,2020-12-21T12:01:34+00:00,4,72.66
7211,lib/db: Prevent IndexID creation race,imsodin,2020-12-18T18:37:00Z,2020-12-21T10:33:00+00:00,1,63.93
7212,lib: Close underlying conn in protocol (fixes #7165),imsodin,2020-12-18T18:46:01Z,2020-12-21T10:40:52+00:00,1,63.91
7214,lib/model: Fix flaky test and add some scanning debug,imsodin,2020-12-19T10:18:33Z,2020-12-20T17:13:36+00:00,1,30.92
7216,gui: Allow device removal even if possibly reintroduced (fixes #5426),hiqua,2020-12-20T17:36:49Z,2021-01-15T19:46:05+00:00,9,626.15
7217,Allow validation of relay join requests by certificate,nadiamoe,2020-12-21T00:08:17Z,2020-12-21T10:55:17+00:00,4,10.78
7223,"lib/config, lib/connections: Add optional connection limits (fixes #7176)",calmh,2020-12-21T16:41:58Z,2021-01-11T14:14:45+00:00,8,501.55
7224,gui: Fix nonfunctional ignore button on pending folder notification.,acolomb,2020-12-21T23:20:09Z,2020-12-22T06:28:10+00:00,1,7.13
7226,cmd/stevents: Add command line argument for event type filtering.,acolomb,2020-12-22T19:35:16Z,2020-12-22T21:10:27+00:00,1,1.59
7227,gui: Fix missing sharing device when adding pending folder.,acolomb,2020-12-22T19:54:19Z,2020-12-22T21:37:30+00:00,1,1.72
7232,lib/model: Handle index sender terminating due to error (fixes #7231),imsodin,2020-12-25T09:50:00Z,2020-12-30T08:59:12+00:00,1,119.15
7234,gui: Do not replace zero versioning cleanup interval,imsodin,2020-12-27T07:24:05Z,2020-12-27T09:08:16+00:00,1,1.74
7236,lib/model: Fix child-check when deleting dirs in pull,imsodin,2020-12-27T19:37:31Z,2021-01-02T20:40:38+00:00,2,145.05
7237,lib/model: Cleanup redundant filesystem variables in folders,imsodin,2020-12-27T19:42:43Z,2020-12-27T21:26:25+00:00,1,1.73
7241,lib/fs: Fix TestChmodDir depending on umask (fixes #6551),acolomb,2020-12-29T21:05:47Z,2020-12-30T08:56:11+00:00,1,11.84
7242,"lib/connections, lib/model: Track last connection duration (ref #7223)",calmh,2020-12-30T09:44:47Z,2021-01-05T16:45:08+00:00,4,151.01
7266,lib/ur: Plug file descriptor leak in Linux memorySize,greatroar,2021-01-11T12:55:05Z,2021-01-11T14:15:22+00:00,1,1.34
7269,"lib/fs, lib/model: Reduce lock contention on NewCaseFilesystem (fixes #7268)",calmh,2021-01-12T11:57:04Z,2021-01-12T15:22:22+00:00,1,3.42
7271,"lib/api, lib/model: Avoid contention on filesystem for DB status call (ref #7270)",calmh,2021-01-12T12:17:24Z,2021-01-12T15:25:21+00:00,1,3.13
7272,gui: Fix log-tailing behavior when scrolled to top (fixes #7267),Choongkyu,2021-01-13T08:02:11Z,2021-01-13T19:08:39+00:00,5,11.11
7276,lib/fs: Double lock and don't store leafs in realCaser (ref #7270),imsodin,2021-01-13T16:51:46Z,2021-01-31T17:29:36+00:00,1,432.63
7278,gui: disable rescan all when at least one folder is not paused (fixes #7257),Choongkyu,2021-01-14T03:58:55Z,2021-01-14T08:15:48+00:00,3,4.28
7281,lib/model: Pull when folder leaves error state (fixes #7280),imsodin,2021-01-14T10:06:38Z,2021-01-14T12:29:02+00:00,1,2.37
7285,cmd/syncthing: Provide early startup for config service (ref #7188),calmh,2021-01-16T07:38:45Z,2021-01-16T11:58:02+00:00,1,4.32
7286,lib/fs: Cache all real-case results (fixes #7270),imsodin,2021-01-16T14:37:30Z,2021-01-27T18:25:35+00:00,6,267.8
7290,gui: Make label and input IDs in Advanced Configuration unique (fixes #7287),tomasz1986,2021-01-17T08:15:22Z,2021-01-25T18:54:43+00:00,4,202.66
7296,gui: Reduce checkboxes size in Advanced Configuration (fixes #6949),tomasz1986,2021-01-19T13:22:00Z,2021-01-27T11:23:59+00:00,1,190.03
7299,lib/util: Remove duplicate error handling code,greatroar,2021-01-24T11:30:31Z,2021-01-24T19:19:11+00:00,1,7.81
7302,gui/untrusted: Mirror changes from #7205 and #7192,acolomb,2021-01-25T12:01:50Z,2021-01-25T19:19:56+00:00,1,7.3
7303,lib/svcutil: Simplify doneService,greatroar,2021-01-25T12:43:19Z,2021-01-25T15:27:17+00:00,1,2.73
7306,lib/model: Make /browse endpoint return sane objects,AudriusButkevicius,2021-01-26T19:23:51Z,2021-02-01T08:27:35+00:00,11,133.06
7308,"lib/stun: Inline util.OnDone, comment on its purpose",greatroar,2021-01-27T13:26:09Z,2021-01-27T18:27:01+00:00,2,5.01
7309,"lib/util, lib/svcutil: Remove unused code",greatroar,2021-01-27T13:30:28Z,2021-01-27T15:33:01+00:00,1,2.04
7310,lib/scanner: Allocate structure for final partial block,greatroar,2021-01-28T11:56:58Z,2021-01-28T13:23:24+00:00,1,1.44
7315,lib/model: Optimize rename detection in scanner,imsodin,2021-01-31T15:58:48Z,2021-01-31T20:02:43+00:00,10,4.07
7316,lib/model: Correct pull progress for small files (fixes #7263),imsodin,2021-01-31T21:22:28Z,2021-01-31T22:40:16+00:00,1,1.3
7319,lib/protocol: Hide repeated data blocks in a given file,calmh,2021-02-01T12:14:07Z,2021-02-02T19:15:15+00:00,2,31.02
7321,lib/model: Refactor folder.scanSubdirs into smaller parts,imsodin,2021-02-01T17:41:04Z,2021-02-08T07:40:57+00:00,1,158.0
7323,"lib/scanner: Remove unused field, move WaitGroup.Add out of loop",greatroar,2021-02-03T12:06:29Z,2021-02-03T13:25:24+00:00,1,1.32
7325,gui: do not touch .stignore when not needed (fixes #7284),hiqua,2021-02-03T14:41:28Z,2021-02-03T19:58:25+00:00,4,5.28
7326,lib/ignore: Store cache timestamps as Unix ns counts,greatroar,2021-02-03T16:38:49Z,2021-02-04T17:39:07+00:00,5,25.0
7327,all: Automatic/disabled folder-config when receive-encrypted,imsodin,2021-02-03T21:52:35Z,2021-02-12T21:51:29+00:00,21,215.98
7330,cmd/syncthing: Refactor command line parsing,calmh,2021-02-04T19:52:11Z,2021-02-10T19:35:38+00:00,3,143.72
