number,title,author,createdAt,closedOrMergedAt,reviewsCount,hoursOpen
12078,project panel: Update file icon when editing filename,d1y,2024-05-21T02:31:58Z,2024-05-21T15:34:02+00:00,2,13.03
12084,Tidy up user menu,iamnbutler,2024-05-21T11:29:52Z,2024-05-21T14:34:35+00:00,4,3.08
12087,Fix `npm install` error with some languages,JunkuiZhang,2024-05-21T13:59:09Z,2024-05-22T04:14:44+00:00,17,14.26
12090,Add support for font fallback,JunkuiZhang,2024-05-21T15:18:30Z,2024-07-26T21:56:47+00:00,2,1590.64
12094,Separate tab behavior from inline completion,raphaelluethy,2024-05-21T16:20:04Z,2024-05-22T10:51:21+00:00,2,18.52
12097,Use checked `str` slices in `Rgba::TryFrom<str>`,bbb651,2024-05-21T18:10:26Z,2024-05-24T09:32:46+00:00,2,63.37
12118,JavaScript: Add runnable tests,RemcoSmitsDev,2024-05-22T12:00:21Z,2024-06-01T12:28:53+00:00,1,240.48
12153,Include more filetypes,versecafe,2024-05-22T20:20:07Z,2024-06-07T12:56:19+00:00,2,376.6
12156,Add **/node_modules to file_scan_exclusions,tekacs,2024-05-22T20:49:39Z,2024-05-22T23:27:52+00:00,1,2.64
12157,Allow information popovers while showing autocomplete suggestions,effdotsh,2024-05-22T21:44:40Z,2024-05-24T09:32:17+00:00,3,35.79
12196,Create parent if needed when renaming file to e.g. `path/to/file.txt`,jakobhellermann,2024-05-23T12:03:07Z,2024-06-14T06:12:47+00:00,7,522.16
12200,tasks: Provide environment variable autocomplete for tasks modal,osiewicz,2024-05-23T14:02:03Z,2024-06-19T12:18:38+00:00,3,646.28
12224,Highlight files ending in `mdwn` as Markdown,pdurbin,2024-05-24T01:30:41Z,2024-05-24T07:01:56+00:00,1,5.52
12229,docs: Update font features,JunkuiZhang,2024-05-24T07:25:59Z,2024-05-31T15:34:16+00:00,1,176.14
12233,"docs: Fix path to ""configuring-zed"" page in Python lang doc",vitallium,2024-05-24T09:52:01Z,2024-05-24T14:31:32+00:00,1,4.66
12239,Update winapi-util crate,ognevny,2024-05-24T12:20:20Z,2024-05-26T23:49:19+00:00,1,59.48
12263,Add icon and hover description for symlinks,CFKeef,2024-05-25T00:16:29Z,2024-05-28T06:50:58+00:00,7,78.57
12267,"docs: Add tweaks to the ""Remote development"" page",danilo-leal,2024-05-25T01:10:06Z,2024-05-25T12:33:11+00:00,3,11.38
12279,Fix documentation for setting up ruby-lsp,luizkowalski,2024-05-25T12:29:46Z,2024-05-25T14:50:04+00:00,1,2.34
12285,json: Add runnable for `package.json` and `composer.json` scripts,RemcoSmitsDev,2024-05-25T15:47:13Z,2024-05-26T11:47:49+00:00,3,20.01
12294,Fix ctrl click to open file on windows,jakobhellermann,2024-05-25T20:52:58Z,2024-05-26T23:57:35+00:00,1,27.08
12310,Fix some warnings/issues uncovered by the new cfg checking,jakobhellermann,2024-05-26T09:26:11Z,2024-05-26T10:50:20+00:00,1,1.4
12349,Update Elixir docs,Vagab,2024-05-27T11:42:03Z,2024-05-28T22:52:22+00:00,1,35.17
12357,windows: Improve file_finder to support match with unix style path,huacnlee,2024-05-27T16:20:03Z,2024-06-20T18:33:50+00:00,1,578.23
12370,windows: Fix project prepare_ssh_shell to support setting PATH on Windows,huacnlee,2024-05-28T07:09:32Z,2024-06-03T09:57:50+00:00,2,146.81
12398,Add config option for terminal cursor style,T1mVo,2024-05-28T21:17:37Z,2024-06-14T06:14:04+00:00,1,392.94
12405,wayland: Refactor clipboard implementation,apricotbucket28,2024-05-29T00:56:33Z,2024-06-18T17:04:19+00:00,1,496.13
12418,Use rust-analyzer from path if possible,WeetHet,2024-05-29T08:36:39Z,2024-06-07T04:56:39+00:00,6,212.33
12443,[WIP] Add file icons to editor tabs,unknown,2024-05-29T18:08:16Z,2024-06-24T17:50:41+00:00,16,623.71
12451,python: Add runnable unittest tasks,rayduck,2024-05-29T21:37:52Z,2024-06-01T16:46:36+00:00,8,67.15
12481,Avoid hang when starting work with rust-analyzer,CharlesChen0823,2024-05-30T14:19:37Z,2024-06-07T12:54:49+00:00,1,190.59
12495,linux: Fix IME panel position while enumerating input methods,XDeme1,2024-05-30T17:45:26Z,2024-08-29T02:58:40+00:00,20,2169.22
12505,typescript: Fix shorthand property highlight,Moshyfawn,2024-05-30T20:35:50Z,2024-05-30T22:27:03+00:00,1,1.85
12507,Fix recent project index order,VladasZ,2024-05-30T21:23:14Z,2024-05-31T02:50:03+00:00,1,5.45
12525,Add setting to always open new workspace in current window,VladasZ,2024-05-31T11:05:59Z,2024-07-10T19:30:03+00:00,8,968.4
12526,elixir: Add runnable tasks,jotaviobiondo,2024-05-31T12:19:17Z,2024-05-31T18:49:35+00:00,4,6.5
12530,Improve discoverability of minimizing git hunks,Morgandri1,2024-05-31T13:58:04Z,2024-06-13T07:56:20+00:00,1,305.97
12533,ruby: Add a new injection for regular expressions,vitallium,2024-05-31T14:28:37Z,2024-05-31T16:02:59+00:00,1,1.57
12552,Add !vimwaiting to togglecomment ,xzbdmw,2024-06-01T07:09:08Z,2024-06-03T15:23:29+00:00,1,56.24
12554,"Implement ""join pane into next""",tcard,2024-06-01T11:45:17Z,2024-07-05T18:58:28+00:00,2,823.22
12558,Fix terminal key bindings,apricotbucket28,2024-06-01T14:47:44Z,2024-06-03T18:25:27+00:00,4,51.63
12569,Add suffixes for templates,dustessavdh,2024-06-02T00:34:49Z,2024-06-07T12:52:48+00:00,2,132.3
12582,Maintain cursor to upper line in visual mode indent/outdent,p-A-uLo,2024-06-02T13:44:10Z,2024-06-06T15:45:25+00:00,16,98.02
12591,Change on remote setup and one more SSH command as example,frivas,2024-06-02T22:34:21Z,2024-06-03T08:34:09+00:00,1,10.0
12603,Fix XI2 Scrolling Issue,someone13574,2024-06-03T12:41:28Z,2024-06-03T15:10:14+00:00,5,2.48
12622,Update linux binary expectations,ConradIrwin,2024-06-04T02:19:48Z,2024-06-04T22:31:01+00:00,9,20.19
12623,Fix autocomplete completions being cut in half,effdotsh,2024-06-04T02:23:58Z,2024-08-06T11:39:13+00:00,1,1521.25
12642,ruby: Remove outline for running tests,vitallium,2024-06-04T15:37:53Z,2024-06-10T16:04:44+00:00,3,144.45
12676,task: Do not substitute Zed variables in command and env,osiewicz,2024-06-05T09:29:13Z,2024-06-11T14:15:13+00:00,3,148.77
12699,Don't show backtraces in prompts,ConradIrwin,2024-06-05T19:44:21Z,2024-06-05T21:00:24+00:00,2,1.27
12700,Use cwd to run package.json script,znycheporuk,2024-06-05T20:39:36Z,2024-06-06T12:17:45+00:00,1,15.64
12702,Adjust IME action buffering to only apply to insert actions,mikayla-maki,2024-06-05T21:45:56Z,2024-06-05T23:13:04+00:00,1,1.45
12710,chore: added inl to cpp config,dhairyanadapara,2024-06-06T02:02:45Z,2024-06-06T07:23:36+00:00,1,5.35
12716,"Fixed default LSP default settings for `JavaScript`, `TypeScript` & `TSX`",chungweileong94,2024-06-06T04:16:52Z,2024-06-06T06:40:20+00:00,1,2.39
12729,Prevent folder expansion when all items are closed,panghu-huang,2024-06-06T11:55:26Z,2024-06-06T15:32:58+00:00,3,3.63
12751,cpp: Highlight sized type specifiers as keywords,zeux,2024-06-06T19:23:14Z,2024-06-08T10:26:11+00:00,1,39.05
12779,docs: Document building with `RUST_FONTCONFIG_DLOPEN=on env` on Linux,curiousercreative,2024-06-07T16:45:40Z,2024-06-11T04:15:05+00:00,1,83.49
12788,svelte: Improve syntax highlighting,soerenmeier,2024-06-07T18:38:49Z,2024-07-10T19:42:50+00:00,3,793.07
12789,vim: add guu gUU g~~ g/,ConradIrwin,2024-06-07T18:54:46Z,2024-06-07T22:45:38+00:00,2,3.85
12792,Add auto-completion support for `package.json` files,panghu-huang,2024-06-07T22:59:03Z,2024-06-08T10:33:29+00:00,1,11.57
12813,Adjust treatment of extension download counts,bajrangCoder,2024-06-08T19:56:59Z,2024-06-18T09:54:18+00:00,1,229.96
12814,windows: Fix Zed/GPUI misinterpreting keycodes + Refactor,agamcsama,2024-06-09T01:03:28Z,2024-06-20T18:39:21+00:00,2,281.6
12844,Respect workspace order in recent projects,eth0net,2024-06-10T13:54:00Z,2024-06-20T10:16:23+00:00,2,236.37
12858,Update EULA,JosephTLyons,2024-06-10T18:20:54Z,2024-06-10T20:09:19+00:00,3,1.81
12859,Update windows doc to mention rust-lld linker error,IceSentry,2024-06-10T18:21:53Z,2024-06-10T21:51:30+00:00,6,3.49
12868,Improve Python syntax highlighting,nigelmj,2024-06-10T22:32:56Z,2024-06-18T16:21:18+00:00,1,185.81
12894,Quiet excess output in tests ,notpeter,2024-06-11T15:47:40Z,2024-06-14T20:02:27+00:00,1,76.25
12899,Make install.sh sh-compatible,ConradIrwin,2024-06-11T17:49:59Z,2024-06-12T01:12:14+00:00,2,7.37
12906,Use square buttons for code action and run indicators in the gutter,versecafe,2024-06-11T20:33:53Z,2024-06-14T18:21:16+00:00,1,69.79
12909,lsp: Implement `textDocument/signatureHelp` for `ProjectClientState::Local` environment,tomoikey,2024-06-11T21:19:04Z,2024-07-11T10:38:34+00:00,30,709.33
12918,Selectable information popover text,effdotsh,2024-06-12T01:40:41Z,2024-07-11T03:14:34+00:00,1,697.56
12922,Added TSX test runnables,chungweileong94,2024-06-12T07:24:47Z,2024-06-12T09:02:24+00:00,2,1.63
12964,"Add mold package for opensuse, arch, void and gentoo",subodhu,2024-06-13T06:38:05Z,2024-06-13T07:47:37+00:00,1,1.16
12967,Fix install.sh error: `./install.sh: 50: [[: not found`,gitduk,2024-06-13T07:34:20Z,2024-06-13T14:00:02+00:00,1,6.43
12972,Add missing Linux build dependencies,DocKDE,2024-06-13T09:44:09Z,2024-06-13T17:45:39+00:00,2,8.03
12985,ui: Fix doctest,qianyan,2024-06-13T15:14:28Z,2024-06-14T00:32:41+00:00,4,9.3
12992,docs: wrap_guides,notpeter,2024-06-13T16:43:35Z,2024-06-14T13:48:25+00:00,1,21.08
13074,Dynamicer builds,ConradIrwin,2024-06-14T21:14:38Z,2024-06-21T23:32:32+00:00,5,170.3
13087,Add runnable for rust main function,panghu-huang,2024-06-15T06:24:49Z,2024-06-18T14:25:20+00:00,11,80.01
13098,linux: Implement tray icons,XDeme1,2024-06-15T19:21:41Z,2024-08-22T21:46:09+00:00,1,1634.41
13102,Remove textDocument/diagnostic capability,4teapo,2024-06-15T23:48:53Z,2024-06-16T07:39:05+00:00,1,7.84
13108,Improve code folding to exclude folding line breaks in whitespace-sensitive languages,nigelmj,2024-06-16T12:45:44Z,2024-06-21T07:03:06+00:00,7,114.29
13113,Fix Hide Copilot context menu item,dontwanttothink,2024-06-16T16:21:19Z,2024-06-17T15:23:03+00:00,1,23.03
13114,blade: Bump rev to fix GLES,lukaslihotzki,2024-06-16T16:53:07Z,2024-06-20T17:40:03+00:00,1,96.78
13126,Add limit to minimum window size,Aaron-212,2024-06-17T08:05:35Z,2024-06-25T03:26:13+00:00,1,187.34
13175,Allow for non-official builds to report telemetry,JosephTLyons,2024-06-17T21:42:23Z,2024-06-18T00:24:18+00:00,1,2.7
13210,Add active_line_width setting to increase the thickness of the active indent guide,WeetHet,2024-06-18T15:30:55Z,2024-06-21T08:53:46+00:00,2,65.38
13217,Add support for auto surround,amtoaer,2024-06-18T16:58:14Z,2024-06-20T09:48:46+00:00,1,40.84
13247,Add mouse context action to copy permalink,5tefan,2024-06-19T06:36:26Z,2024-06-20T07:46:50+00:00,1,25.17
13251,docs: Update installation instructions for MSYS2,fenix-hub,2024-06-19T09:46:17Z,2024-06-20T17:57:00+00:00,2,32.18
13254,vim: Allow toggling command palette on empty diagnostics view,mrnugget,2024-06-19T10:30:23Z,2024-07-03T15:03:14+00:00,2,340.55
13276,Add the ability to customize available models for OpenAI-compatible services,amtoaer,2024-06-19T17:04:29Z,2024-06-25T20:37:02+00:00,5,147.54
13287,"vim: Allow count and repeat for ""r"" and ""shift-r"" action",Benjamin-Davies,2024-06-20T02:24:59Z,2024-06-24T15:41:33+00:00,1,109.28
13290,Disable inline assist button when assistant is disabled,chungweileong94,2024-06-20T03:40:45Z,2024-06-20T09:56:09+00:00,1,6.26
13313,Add Markdown Preview shortcut to Atom keymap,adamsoutar,2024-06-20T13:22:50Z,2024-06-21T07:28:31+00:00,1,18.09
13326,Adjust keybindings for deletion in the project panel,mikayla-maki,2024-06-20T17:37:58Z,2024-06-25T18:21:44+00:00,5,120.73
13343,Use livekit's Rust SDK instead of their swift SDK,maxbrunsfeld,2024-06-21T00:55:18Z,2024-11-15T21:18:50+00:00,2,3548.39
13367,csharp: Solve problem of omnisharp server failing to download,windoflake,2024-06-21T14:48:48Z,2024-07-05T15:38:56+00:00,2,336.84
13372,docs: Correct path to global tasks file,dgrijalva,2024-06-21T16:39:26Z,2024-06-22T08:53:59+00:00,2,16.24
13385,macOS: Fix IME action when deleting last char,JunkuiZhang,2024-06-22T09:47:33Z,2024-06-25T02:54:36+00:00,1,65.12
13397,Bump image crate,MatinAniss,2024-06-22T15:32:40Z,2024-06-25T13:12:46+00:00,1,69.67
13402,Fix an issue where provider settings were lost when switching between Ollama models,amtoaer,2024-06-22T17:50:07Z,2024-06-25T15:58:14+00:00,1,70.14
13407,Add Nix/NixOS dev-shell,xtrm-en,2024-06-22T23:20:05Z,2024-07-09T07:21:43+00:00,6,392.03
13413,windows: Fix `rust` tasks,JunkuiZhang,2024-06-23T08:53:09Z,2024-07-11T08:47:25+00:00,4,431.9
13420,windows: Fix and simplify title bar padding,MatinAniss,2024-06-23T15:06:54Z,2024-07-09T19:15:15+00:00,7,388.14
13425,windows: Fix title bar font for Windows 10,MatinAniss,2024-06-23T17:01:52Z,2024-06-25T14:51:00+00:00,5,45.82
13431,Multi-cursor removal possibility,kriskw1999,2024-06-23T21:23:11Z,2024-06-24T08:32:37+00:00,4,11.16
13432,Reveal in files instead of Finder,francesco-gaglione,2024-06-23T21:51:26Z,2024-07-09T18:54:15+00:00,16,381.05
13433,Debugger implementation,RemcoSmitsDev,2024-06-23T22:12:44Z,2025-03-18T16:55:26+00:00,13,6426.71
13452,Preserve selected entry in file_finder,kshokhin,2024-06-24T06:51:48Z,2024-08-27T13:24:06+00:00,27,1542.54
13453,docs: Fix Decrease buffer font size key binding,pointlessone,2024-06-24T07:06:51Z,2024-06-26T07:48:01+00:00,1,48.69
13481,JSON: Show package.json dependency tooltips on hover,osiewicz,2024-06-24T20:52:47Z,2024-06-25T12:59:29+00:00,2,16.11
13482,Use string interpolation,hamirmahal,2024-06-24T22:51:35Z,2024-06-25T14:57:51+00:00,2,16.1
13508,Add keyboard shortcuts for scrolling in terminal,hron,2024-06-25T13:05:15Z,2024-06-28T07:26:14+00:00,1,66.35
13509,docs: Fix some typos,Peiffap,2024-06-25T13:57:00Z,2024-06-25T14:58:11+00:00,1,1.02
13510,Improve PageUp/PageDown keybinds for Linux/Mac,notpeter,2024-06-25T14:13:27Z,2024-06-27T13:26:53+00:00,2,47.22
13528,wayland: Set window urgency hint when `activate` is called,apricotbucket28,2024-06-25T21:49:15Z,2024-07-08T22:09:19+00:00,3,312.33
13530,Update Docker Compose configuration,toshimaru,2024-06-26T00:42:47Z,2024-06-26T12:05:23+00:00,1,11.38
13542,Fix font feature tag validation,JunkuiZhang,2024-06-26T12:23:19Z,2024-06-26T15:01:48+00:00,5,2.64
13546,Restore unsaved buffers on restart,mrnugget,2024-06-26T15:27:42Z,2024-07-17T16:10:20+00:00,3,504.71
13548,Simplify font feature tag validation,Peiffap,2024-06-26T15:51:35Z,2024-06-26T21:11:57+00:00,3,5.34
13561,Use iterators instead of loops in `clock.rs`,Peiffap,2024-06-26T21:52:57Z,2024-06-27T06:30:21+00:00,1,8.62
13565,Code maintenance in the `editor` crate,Peiffap,2024-06-27T00:09:04Z,2024-06-27T06:40:48+00:00,1,6.53
13593,Fix PageUp for context menu,hron,2024-06-27T15:16:04Z,2024-06-28T09:03:30+00:00,2,17.79
13597,Extract `title_bar` crate,iamnbutler,2024-06-27T16:38:03Z,2024-06-27T23:14:13+00:00,1,6.6
13601,Store starts open state of outline panel,yongkangchen,2024-06-27T19:06:48Z,2024-06-27T20:51:42+00:00,1,1.75
13611,Linux window decorations,mikayla-maki,2024-06-27T22:05:48Z,2024-07-03T18:28:09+00:00,11,140.37
13625,Runtimes UI Starter,rgbkrk,2024-06-28T03:36:59Z,2024-07-05T15:15:50+00:00,4,179.65
13627,Update linux.md,milanpal15,2024-06-28T05:49:12Z,2024-06-28T12:12:05+00:00,1,6.38
13640,Add duplicate line shortcut to sublime_text.json,johtso,2024-06-28T12:23:59Z,2024-06-28T16:03:28+00:00,1,3.66
13644,Add support for projects managed with Yarn,osiewicz,2024-06-28T12:54:56Z,2024-07-11T12:56:07+00:00,2,312.02
13653,"Use user-defined font weight, where appropriate",Peiffap,2024-06-28T16:06:54Z,2024-07-01T13:45:01+00:00,1,69.64
13655,Remove 'a' from Atom ProjectPanel default keymap,notpeter,2024-06-28T17:08:06Z,2024-06-28T19:29:45+00:00,3,2.36
13668,Fix panel state,yongkangchen,2024-06-29T09:16:01Z,2024-07-04T00:38:20+00:00,1,111.37
13670,Add a test for PageUp/PageDown in completion list,hron,2024-06-29T12:34:58Z,2024-06-30T13:03:55+00:00,1,24.48
13675,Fix focusing terminal when running tasks,hron,2024-06-29T18:31:38Z,2024-07-02T07:57:54+00:00,1,61.44
13686,dart: Add Flutter runnables and tasks,agent3bood,2024-06-30T15:30:57Z,2024-07-11T08:46:53+00:00,5,257.27
13691,Don't override environment's locale,someone13574,2024-06-30T22:27:56Z,2024-07-25T17:50:22+00:00,1,595.37
13707,ruby: Replace default tasks with a stub message,vitallium,2024-07-01T17:35:41Z,2024-08-13T10:25:57+00:00,4,1024.84
13726,cpp: Add injection for raw string literals,XDeme1,2024-07-02T02:19:37Z,2024-08-22T21:48:46+00:00,1,1243.49
13735,Fix typo in show_whitespaces docs in default setting,andreinonea,2024-07-02T11:00:16Z,2024-07-02T12:37:32+00:00,2,1.62
13740,"Document that the binaries and arguments of Rust, Go, and Clang can be overridden",danieroux,2024-07-02T14:46:40Z,2024-07-19T15:26:22+00:00,1,408.66
13750,Use regex to properly select Go test runnable,cjfinnell,2024-07-02T18:52:19Z,2024-07-03T15:53:19+00:00,1,21.02
13765,docs: Document setting up Claude in the Assistant,maxmckenzie,2024-07-03T07:11:44Z,2024-07-03T16:22:32+00:00,1,9.18
13792,Separate out macOS and Linux keymaps,mikayla-maki,2024-07-03T20:41:17Z,2024-07-08T19:05:29+00:00,2,118.4
13805,Add VSCode keymap for Windows,Huliiiiii,2024-07-04T01:04:18Z,2024-07-25T17:48:29+00:00,4,520.74
13807,"linux: Remove `StartupWMClass` from .desktop file, add `NewWorkspace` action",jansol,2024-07-04T01:50:38Z,2024-07-08T06:31:08+00:00,6,100.67
13821,windows: Fix `package-version-server`,JunkuiZhang,2024-07-04T09:44:14Z,2024-07-04T10:49:17+00:00,3,1.08
13830,linux scripts: Respect `$CARGO_TARGET_DIR`,p00f,2024-07-04T15:56:54Z,2024-07-05T11:19:05+00:00,1,19.37
13834,ocaml: Pass environment to language server,WeetHet,2024-07-04T17:13:29Z,2024-07-05T13:59:17+00:00,3,20.76
13839,docs: Update the example to set up black formatter in Python,zhangfand,2024-07-04T20:16:46Z,2024-07-05T13:32:48+00:00,1,17.27
13871,lua: Add Windows support,sakloui,2024-07-05T16:09:49Z,2024-07-05T18:11:11+00:00,5,2.02
13872,Finely scope repl events for runs and output clearing,rgbkrk,2024-07-05T16:15:04Z,2024-07-05T20:38:44+00:00,1,4.39
13889,Ignore whitespace commits,notpeter,2024-07-06T04:04:30Z,2024-07-11T06:45:41+00:00,1,122.69
13893,windows: Replace symlinks with files for TSX Tree-sitter queries,Giuliano1993,2024-07-06T14:07:10Z,2024-07-08T14:32:21+00:00,1,48.42
13898,Pass `hold: true` to Alacritty for tasks,hron,2024-07-06T15:30:35Z,2024-07-11T14:50:00+00:00,2,119.32
13900,Add missing clipboard shortcut to default-linux.json,vjdw,2024-07-06T17:03:44Z,2024-07-07T11:40:23+00:00,1,18.61
13902,Fix nushell local env detection by using direnv export,WeetHet,2024-07-06T18:37:42Z,2024-07-12T08:29:33+00:00,18,133.86
13914,clojure: Recognize ClojureDart files,zachcp,2024-07-07T14:44:13Z,2024-07-08T14:14:50+00:00,4,23.51
13915,Add keyboard shortcuts for the prompts on Linux,hron,2024-07-07T14:51:53Z,2024-07-09T08:50:14+00:00,2,41.97
13922,cpp: Improve syntax highlighting,XDeme1,2024-07-08T00:42:33Z,2024-07-24T21:55:21+00:00,1,405.21
13926,Use user-defined font weight in terminal,hron,2024-07-08T09:51:50Z,2024-07-08T11:43:23+00:00,1,1.86
13939,On X11 don't allow runnables to get too far behind,ConradIrwin,2024-07-08T16:53:46Z,2024-07-09T02:04:45+00:00,2,9.18
13945,Linux docs,ConradIrwin,2024-07-08T19:52:57Z,2024-07-08T22:29:28+00:00,3,2.61
13976,"Add ""copy (absolute) path"" menu items for tabs",mattfbacon,2024-07-09T09:13:03Z,2024-07-26T10:00:26+00:00,5,408.79
13987,chore: Clippy fixes for 1.80,osiewicz,2024-07-09T13:21:07Z,2024-07-10T15:53:18+00:00,4,26.54
14002,Prevent dumping of temporary files in config_dir,notpeter,2024-07-09T15:51:13Z,2024-07-09T16:59:17+00:00,1,1.13
14009,Introduce `autosave_before_task` setting,hron,2024-07-09T17:48:44Z,2024-07-10T06:51:57+00:00,1,13.05
14014,Python: Fix auto close for single quotes,notpeter,2024-07-09T18:16:58Z,2024-07-09T19:27:57+00:00,1,1.18
14016,Update .dockerignore,fitzy1321,2024-07-09T18:33:28Z,2024-07-09T20:27:55+00:00,1,1.91
14034,WIP: Disable binary downloads,mikayla-maki,2024-07-09T22:41:28Z,2024-07-23T03:32:39+00:00,7,316.85
14038,outline_panel: Fix outline panel should autoscroll when selection has changed,CharlesChen0823,2024-07-10T02:28:23Z,2024-07-10T07:12:09+00:00,1,4.73
14046,remove error of derive debug macro,sgj123456,2024-07-10T07:52:48Z,2024-07-10T09:18:52+00:00,1,1.43
14104,"Open URIs from the CLI, support for the `zed://` URI scheme on Linux",korewaChino,2024-07-10T21:08:26Z,2024-07-16T20:49:15+00:00,2,143.68
14111,Introduce support for customizable directory structures for journal entries,fmeyer,2024-07-10T22:11:02Z,2024-09-19T16:00:57+00:00,4,1697.83
14136,Keymap changes for `editor::JoinLines`,notpeter,2024-07-11T03:40:42Z,2024-07-11T15:14:26+00:00,2,11.56
14143,Allow Zed to run under multiple user accounts simultaneously,samsonjs,2024-07-11T04:41:27Z,2024-09-01T00:46:14+00:00,5,1244.08
14151,terminal: Prevent extra character on handled meta keystrokes,denisw,2024-07-11T06:52:37Z,2024-07-11T08:20:54+00:00,1,1.47
14168,docs: Document `buffer_line_height`,oliverpool,2024-07-11T08:36:20Z,2024-07-11T17:42:27+00:00,1,9.1
14213,terminal: Set `TERM_PROGRAM` and `TERM_PROGRAM_VERSION` environment variables in integrated terminal,ldm0,2024-07-11T14:59:58Z,2024-07-11T17:48:46+00:00,4,2.81
14250,Adjust list item & pickers spacing,danilo-leal,2024-07-11T19:55:41Z,2024-07-15T13:23:18+00:00,1,89.46
14281,Apply `terminal.foreground` and `terminal.background` from theme,zakj,2024-07-12T01:20:48Z,2024-07-13T11:41:44+00:00,2,34.35
14320,Fix renaming sometimes not working in vim mode,Congyuwang,2024-07-12T11:08:44Z,2024-07-16T20:46:04+00:00,3,105.62
14331,PlainText language: Default to SoftWrap::EditorWidth,notpeter,2024-07-12T13:58:42Z,2024-07-12T15:10:59+00:00,1,1.2
14347,windows: Refactor clipboard implementation,JunkuiZhang,2024-07-12T16:00:55Z,2024-07-15T02:40:42+00:00,3,58.66
14350,Add mouse handling to gpui input example,ConradIrwin,2024-07-12T16:17:42Z,2024-07-15T18:10:25+00:00,2,73.88
14401,linux: Show warning if file picker portal is missing,apricotbucket28,2024-07-13T14:08:36Z,2024-07-15T16:36:39+00:00,5,50.47
14404,Add icon to the tabbar title ,fazibear,2024-07-13T14:54:35Z,2024-07-15T22:26:45+00:00,1,55.54
14410,deno: wire up LSP settings,sigmaSd,2024-07-13T16:58:25Z,2024-07-13T18:10:37+00:00,2,1.2
14442,Make unnecessary code fade configurable,MatthewScholefield,2024-07-14T12:00:51Z,2024-08-20T17:13:28+00:00,1,893.21
14464,Implement signature help overload UI and parameter description UI,tomoikey,2024-07-14T22:12:44Z,2024-08-21T16:39:24+00:00,2,906.44
14493,Add REPL dropdown menu to toolbar,iamnbutler,2024-07-15T13:54:17Z,2024-07-15T18:55:49+00:00,1,5.03
14518,Selectable diagnostic popover text,effdotsh,2024-07-15T21:12:59Z,2024-07-29T05:13:13+00:00,4,320.0
14535,project_panel: Fixed open in split not working in project panel,CharlesChen0823,2024-07-16T04:27:49Z,2024-07-16T06:17:58+00:00,2,1.84
14614,svelte: Fix typo in LSP config for inlayHints,matubu,2024-07-17T00:48:32Z,2024-07-17T13:59:21+00:00,1,13.18
14626,Fix right clicks changing vim mode,Congyuwang,2024-07-17T05:35:32Z,2024-07-17T20:19:35+00:00,1,14.73
14646,clangd: Implement switch source/header extension,thorbenk,2024-07-17T13:27:10Z,2024-08-21T19:15:08+00:00,6,845.8
14659,windows: Remove unnecessary `Send` and `Sync` implementations,JunkuiZhang,2024-07-17T15:36:55Z,2024-07-25T17:42:37+00:00,1,194.09
14661,"ruby: Add support for ""rubocop"" language server",vitallium,2024-07-17T15:51:07Z,2024-07-17T21:29:42+00:00,2,5.64
14676,Fix worktree order serialization,eth0net,2024-07-17T18:25:14Z,2024-07-18T07:41:29+00:00,1,13.27
14687,node_runtime: Bump downloaded Node.js version to Current (Jod),0xk1f0,2024-07-17T21:53:23Z,2024-07-19T22:18:56+00:00,2,48.43
14696,typescript: Highlight `infer` keyword,rimuy,2024-07-17T23:39:40Z,2024-07-18T07:42:17+00:00,1,8.04
14705,project_panel: Select the newly created file when copy/pasting a file,CharlesChen0823,2024-07-18T03:22:00Z,2024-07-18T14:26:33+00:00,4,11.08
14707,ruby: Bump to v0.0.8,vitallium,2024-07-18T05:16:11Z,2024-07-18T12:13:36+00:00,2,6.96
14749,Handle supermaven account status messages,kevmo314,2024-07-18T15:37:50Z,2024-07-18T18:22:30+00:00,1,2.74
14770,Add gpt-4o-mini as an available model,versecafe,2024-07-18T20:51:36Z,2024-07-19T04:32:56+00:00,6,7.69
14781,Adjust tabs design (spacing and size),danilo-leal,2024-07-19T01:40:38Z,2024-07-26T15:48:16+00:00,1,182.13
14783,vim: Fix 'Y' to yank to end of line,vbhavsar,2024-07-19T02:22:41Z,2024-07-19T04:34:40+00:00,1,2.2
14784,Improve `cx.theme` development experience to support auto import,huacnlee,2024-07-19T03:30:58Z,2024-07-19T12:12:45+00:00,1,8.7
14791,gpui: Update Menu name to use `SharedString` type to support more types,huacnlee,2024-07-19T06:53:01Z,2024-07-19T12:51:31+00:00,3,5.97
14793,Add command to copy current file:line for working with external tools,slembcke,2024-07-19T07:21:41Z,2024-08-26T18:31:20+00:00,1,923.16
14812,http: Dynamically update proxy from system settings (macOS) or zed settings,Congyuwang,2024-07-19T13:52:10Z,2024-08-06T13:32:10+00:00,21,431.67
14823,Extract completion provider crate,rtfeldman,2024-07-19T16:29:02Z,2024-07-19T17:35:34+00:00,3,1.11
14828,Expand terminal menu actions,versecafe,2024-07-19T17:36:41Z,2024-07-20T09:20:53+00:00,4,15.74
14834,Add Sign Out link for Supermaven,kevmo314,2024-07-19T18:41:13Z,2024-07-20T00:53:25+00:00,1,6.2
14837,Extract Python into an extension,PushUpek,2024-07-19T19:33:34Z,2024-07-19T22:19:16+00:00,4,2.76
14842,Add GitHub Copilot Chat Support,Hawkbawk,2024-07-19T21:45:51Z,2024-07-30T07:32:58+00:00,11,249.79
14849,astro: Ensure Typescript is present,0xk1f0,2024-07-20T02:21:13Z,2024-07-23T14:39:25+00:00,1,84.3
14850,gpui: Add `truncate` and `text_ellipsis` to TextStyle,huacnlee,2024-07-20T03:28:30Z,2024-08-23T18:02:51+00:00,4,830.57
14864,Fix description of -l flag in bundle-mac,claytonrcarter,2024-07-20T12:21:18Z,2024-07-20T16:16:54+00:00,1,3.93
14865,linux: Fix wrong names reported by `all_font_names`,JunkuiZhang,2024-07-20T12:37:46Z,2024-07-25T18:53:22+00:00,3,126.26
14872,windows: Stop beeping,JunkuiZhang,2024-07-20T17:49:29Z,2024-07-25T17:26:36+00:00,2,119.62
14879,erlang: Add Erlang Language Platform support,fabjan,2024-07-20T19:54:45Z,2024-07-21T15:38:24+00:00,1,19.73
14883,Add button to copy SHA from Git blame,Hawkbawk,2024-07-20T22:48:20Z,2024-07-21T16:02:16+00:00,1,17.23
