number,title,author,createdAt,closedOrMergedAt,reviewsCount,hoursOpen
20464,editor: Fix toggle_comment in readonly mode,antaz,2024-11-09T20:06:07Z,2024-11-10T07:47:30+00:00,1,11.69
20467,Discover available python environments with Jupyter kernel support,rgbkrk,2024-11-10T02:47:58Z,2024-11-11T18:19:05+00:00,15,39.52
20480,Add initial FreeBSD support,CalebHeydon,2024-11-10T17:56:27Z,2024-11-11T17:39:05+00:00,2,23.71
20487,python: Improve function syntax highlighting,clwainwright,2024-11-11T06:04:18Z,2024-11-18T23:05:39+00:00,2,185.02
20489,Bump rustls and async-tungstenite to remove child dep ring 0.16.20,ifsheldon,2024-11-11T07:17:47Z,2024-11-12T04:29:55+00:00,2,21.2
20499,gpui: Add paint_path example,huacnlee,2024-11-11T14:06:19Z,2024-11-16T11:36:13+00:00,1,117.5
20507,Add a way to use splits when opening in file finder,SomeoneToIgnore,2024-11-11T16:18:09Z,2024-11-13T10:58:42+00:00,1,42.68
20537,"gpui: Fix SVG color render, when color have alpha",huacnlee,2024-11-12T11:23:23Z,2024-11-16T14:53:57+00:00,5,99.51
20539,Document use of `allow_concurrent_runs` with long-running tasks,markuswustenberg,2024-11-12T13:52:05Z,2024-11-13T08:43:17+00:00,3,18.85
20551,anthropic: Allow specifying additional beta headers for custom models,rowillia,2024-11-12T18:59:23Z,2025-01-04T00:02:05+00:00,2,1253.05
20573,"Highlight `?` and `:` in ternary expressions as operator in JavaScript, TypeScript, and TSX",Huliiiiii,2024-11-13T09:05:16Z,2024-11-16T11:42:11+00:00,1,74.62
20577,Maintain selection on file/dir deletion in project panel,smitbarmase,2024-11-13T10:20:05Z,2024-11-22T10:59:04+00:00,12,216.65
20587,windows: Implement `ssh` using `UnixSocket`,JunkuiZhang,2024-11-13T12:33:14Z,2025-03-27T23:44:00+00:00,5,3227.18
20595,anthropic: Remove stable headers,dsp-ant,2024-11-13T14:00:57Z,2024-11-13T20:04:37+00:00,1,6.06
20597,settings: Add allow_user_npmrc option,yuekcc,2024-11-13T14:59:00Z,2024-11-19T07:50:14+00:00,1,136.85
20614,Update Rust crate wasmtime to v24.0.2 [SECURITY],renovate,2024-11-13T17:57:44Z,2024-11-14T16:35:31+00:00,1,22.63
20615,context_servers: Upgrade protocol to version 2024-11-05,dsp-ant,2024-11-13T18:14:18Z,2024-11-14T18:03:30+00:00,1,23.82
20618,Don't try and run on armv5/6/7,ConradIrwin,2024-11-13T19:42:44Z,2024-11-13T23:18:53+00:00,1,3.6
20619,Update Rust crate anyhow to v1.0.93,renovate,2024-11-13T20:07:09Z,2024-11-14T09:11:52+00:00,1,13.08
20620,Update Rust crate clap to v4.5.21,renovate,2024-11-13T20:07:21Z,2024-11-14T09:12:14+00:00,1,13.08
20625,Update Rust crate libc to v0.2.162,renovate,2024-11-13T21:36:21Z,2024-11-14T10:07:38+00:00,1,12.52
20626,Update Rust crate linkme to v0.3.31,renovate,2024-11-13T21:36:33Z,2024-11-14T10:07:27+00:00,1,12.52
20629,Update Rust crate mdbook to v0.4.42,renovate,2024-11-13T22:10:58Z,2024-11-14T10:07:17+00:00,1,11.94
20630,Update Rust crate pulldown-cmark to v0.12.2,renovate,2024-11-13T22:11:07Z,2024-11-14T10:07:04+00:00,1,11.93
20636,assistant: Add tiny design tweaks to the patch block,danilo-leal,2024-11-13T23:12:06Z,2024-11-14T13:53:00+00:00,2,14.68
20638,Update Rust crate serde_json to v1.0.132,renovate,2024-11-13T23:14:49Z,2024-11-14T16:35:13+00:00,1,17.34
20639,Update Rust crate sys-locale to v0.3.2,renovate,2024-11-13T23:15:01Z,2024-11-14T16:35:05+00:00,1,17.33
20643,Update Rust crate thiserror to v1.0.69,renovate,2024-11-14T00:31:09Z,2024-11-14T16:34:58+00:00,1,16.06
20665,Fix scrollbar not always being on top,TOULR,2024-11-14T11:46:52Z,2024-11-15T15:47:17+00:00,6,28.01
20681,assistant: Remove `low_speed_timeout`,mrnugget,2024-11-14T16:37:15Z,2024-11-15T06:37:31+00:00,3,14.0
20700,ocaml: Improve highlighting and bracketing,lord,2024-11-14T22:30:23Z,2024-11-15T15:17:46+00:00,1,16.79
20705,Leave goal_x unchanged when moving by rows past the start or end of the document,lord,2024-11-15T01:45:46Z,2024-11-18T23:32:44+00:00,1,93.78
20708,docs: Update Zig Tree-sitter grammar link,chottolabs,2024-11-15T04:33:39Z,2024-11-15T05:45:37+00:00,1,1.2
20721,toolchains: Expose raw JSON representation of a toolchain,osiewicz,2024-11-15T10:46:27Z,2024-11-21T12:27:25+00:00,1,145.68
20752,html: Use `@attribute` highlight capture for HTML attributes,uncenter,2024-11-15T22:43:55Z,2025-01-06T23:35:48+00:00,1,1248.86
20758,Add more common Prettier plugin base paths,sweetppro,2024-11-16T06:07:36Z,2024-11-16T11:20:52+00:00,1,5.22
20760,Improve project_panel diagnostic icon knockout colors,nilskch,2024-11-16T08:39:37Z,2024-11-21T18:03:40+00:00,5,129.4
20763, python: Highlight attribute docstrings,JaagupAverin,2024-11-16T14:34:48Z,2024-11-19T17:53:36+00:00,3,75.31
20764,Improve prettier parser selection to prioritize file's language setting,ShinyChang,2024-11-16T15:08:56Z,2024-12-06T17:31:57+00:00,10,482.38
20769,Improve editor tabs,unknown,2024-11-16T16:35:48Z,2024-12-02T17:49:47+00:00,7,385.23
20780,"Use `HashMap<ProjectEntryId, Entry>` instead of `HashSet<Entry>` in outline_panel",mgsloan,2024-11-17T05:07:51Z,2024-11-18T12:38:31+00:00,1,31.51
20797,Fix status bar diagnostics flashing,gartnera,2024-11-17T23:41:48Z,2024-12-03T15:28:00+00:00,1,375.77
20804,docs: Update Svelte extension link,Moshyfawn,2024-11-18T04:55:37Z,2024-11-18T07:51:47+00:00,1,2.94
20811,extension: Bump WASI to p2,osiewicz,2024-11-18T11:58:59Z,2025-01-28T08:20:02+00:00,1,1700.35
20812,gpui: Add linear gradient support to fill background,huacnlee,2024-11-18T12:01:23Z,2024-12-11T19:52:53+00:00,8,559.86
20830,Add `fs::MTime` newtype to encourage `!=` instead of `>`,mgsloan,2024-11-18T18:41:10Z,2024-11-22T02:21:18+00:00,5,79.67
20847,Filter LSP code actions based on the requested kinds,Techatrix,2024-11-19T00:01:07Z,2024-11-22T12:01:01+00:00,3,84.0
20851,"gpui: Fix default colors blue, red, green to match in CSS default colors",huacnlee,2024-11-19T06:20:28Z,2024-11-28T08:08:07+00:00,1,217.79
20856,clangd: Use Url::to_file_path() to get actual file path for header/source,Poldraunic,2024-11-19T09:07:00Z,2024-11-19T13:49:22+00:00,13,4.71
20859,Fix file missing or duplicated when copying multiple items in project panel + Fix marked files not being deselected after selecting a directory,smitbarmase,2024-11-19T10:16:53Z,2024-11-26T23:23:01+00:00,1,181.1
20897,docs: Correct default values,jaxvanyang,2024-11-20T11:35:49Z,2024-12-06T17:47:06+00:00,3,390.19
20911,rope: Minor optimization for tab indices,AdamWRichardson,2024-11-20T16:32:57Z,2024-11-21T07:48:13+00:00,2,15.25
20920,Add the option to hide both the task and command lines in the task output,omennia,2024-11-20T18:28:13Z,2024-11-22T18:45:42+00:00,5,48.29
20922,Add go version to gopls cache key,nilskch,2024-11-20T19:06:00Z,2024-12-09T11:56:01+00:00,2,448.83
20924,Add textobjects queries,ConradIrwin,2024-11-20T20:03:27Z,2024-12-03T17:37:02+00:00,2,309.56
20927,Update astral-sh/setup-uv digest to caf0cab,renovate,2024-11-20T20:51:07Z,2024-11-28T08:55:46+00:00,1,180.08
20938,Update Rust crate tree-sitter-c to v0.23.2,renovate,2024-11-20T22:38:07Z,2024-11-28T08:55:57+00:00,1,178.3
20939,Update Rust crate ashpd to 0.10.0,renovate,2024-11-20T22:38:21Z,2024-11-28T08:56:21+00:00,1,178.3
20941,Add Project Panel navigation actions in netrw mode,Anthony-Eid,2024-11-20T23:11:52Z,2024-12-05T13:07:14+00:00,1,349.92
20947,Update Rust crate bytemuck to v1.20.0,renovate,2024-11-21T00:09:30Z,2024-11-28T08:56:37+00:00,1,176.79
20949,Fix hovered links underline not showing when using cmd_or_ctrl for multi_cursor_modifier,remixz,2024-11-21T00:46:13Z,2024-11-28T09:00:46+00:00,1,176.24
20951,Update Rust crate ipc-channel to 0.19,renovate,2024-11-21T01:03:46Z,2024-11-28T08:58:10+00:00,1,175.91
20955,Update Rust crate rodio to 0.20.0,renovate,2024-11-21T02:24:01Z,2024-11-28T08:58:36+00:00,1,174.58
20967,Update Rust crate proc-macro2 to v1.0.92,renovate,2024-11-21T04:27:57Z,2024-11-28T08:58:54+00:00,1,172.52
20974,Store inlay hint enabledness in user settings,Poldraunic,2024-11-21T08:13:52Z,2024-12-02T09:38:47+00:00,13,265.42
21000,Fixes and improvements to `pane` context menu,Poldraunic,2024-11-21T17:22:51Z,2025-01-03T22:48:34+00:00,2,1037.43
21036,Use `!=` for mtime comparison instead of `>`,mgsloan,2024-11-22T00:44:36Z,2024-12-10T19:05:19+00:00,2,450.35
21075,Improve Nix package and shell,WeetHet,2024-11-22T20:12:45Z,2024-11-27T18:22:17+00:00,1,118.16
21092,assistant: Add Bedrock support,5herlocked,2024-11-23T03:43:30Z,2025-02-24T23:10:12+00:00,25,2251.45
21097,Add LSP Binary Search Options to Extension API,jcdickinson,2024-11-23T06:19:51Z,2024-11-26T19:35:18+00:00,2,85.26
21115,Clean up app event transformations,JosephTLyons,2024-11-23T17:55:30Z,2024-11-24T04:11:45+00:00,1,10.27
21119,git: Append (You) to git blame author,HarshNarayanJha,2024-11-23T19:34:15Z,2024-12-13T02:32:02+00:00,1,462.96
21137,linux: Fix file not opening from file explorer,smitbarmase,2024-11-24T13:31:29Z,2024-11-29T21:01:29+00:00,1,127.5
21142,Enable clangd's dot-to-arrow feature,feeiyu,2024-11-24T15:50:14Z,2024-11-28T08:43:25+00:00,7,88.89
21153,Fix opening repos when `.git` is a soft link,can2049,2024-11-25T03:56:56Z,2024-12-13T02:29:37+00:00,3,430.54
21177,"linux: Fix Zed not visible in ""Open With"" list in file manager for Flatpak",smitbarmase,2024-11-25T18:05:55Z,2024-11-29T20:59:04+00:00,1,98.89
21196,docs: Fix default value for `relative_line_numbers` in vim,5brian,2024-11-26T06:07:21Z,2024-11-26T16:10:28+00:00,1,10.05
21213,Add an uninstall script,WeetHet,2024-11-26T14:35:23Z,2024-11-28T08:31:12+00:00,14,41.93
21257,Update nix cargo hash,jaredramirez,2024-11-27T23:04:56Z,2024-11-28T06:04:11+00:00,1,6.99
21263,Add word count for markdown and plain text files,saahityaedams,2024-11-28T04:03:29Z,2025-01-03T00:54:56+00:00,8,860.86
21288,Update to embed-resource 3.0 (fixes build below windows \?\ path),nabijaczleweli,2024-11-28T15:20:54Z,2024-11-29T12:43:40+00:00,1,21.38
21300,Remove project panel trash action for remote projects,Moshyfawn,2024-11-28T19:14:36Z,2024-11-29T20:37:24+00:00,3,25.38
21313,Allow `workspace::ActivatePaneInDirection` to navigate out of the terminal panel,haruleekim,2024-11-29T06:54:56Z,2024-11-29T11:04:58+00:00,1,4.17
21337,workspace: Implement Extended Terminal Layout,th0jensen,2024-11-29T15:14:41Z,2025-03-06T10:42:23+00:00,1,2323.46
21383,Show error and warning indicators in tabs,nilskch,2024-12-01T13:37:14Z,2024-12-05T14:43:04+00:00,3,97.1
21388,Enable toolchain venv in new terminals,sn1c,2024-12-01T18:05:04Z,2024-12-03T15:24:30+00:00,10,45.32
21389,python: Refine highlighting,JaagupAverin,2024-12-01T21:42:37Z,2024-12-13T11:40:16+00:00,7,277.96
21395,"Add ""Copy Extension ID"" action to extension card dropdown",uncenter,2024-12-02T03:04:19Z,2024-12-02T16:19:42+00:00,1,13.26
21402,Treat `.pcss` files as CSS,MrSubidubi,2024-12-02T13:31:22Z,2024-12-02T15:56:47+00:00,2,2.42
21405,linux: Make prompt detail selectable,smitbarmase,2024-12-02T15:00:21Z,2024-12-06T17:26:47+00:00,1,98.44
21409,Force code actions to be single line,WeetHet,2024-12-02T16:35:47Z,2024-12-04T17:39:27+00:00,2,49.06
21424,Check for vulnerable dependencies in CI,cole-miller,2024-12-02T21:23:36Z,2024-12-02T23:48:03+00:00,1,2.41
21428,Publish theme json schema v0.2.0,notpeter,2024-12-02T22:49:57Z,2024-12-03T17:57:39+00:00,1,19.13
21435,vim: Extra textobjects + minor changes and tests,hrou0003,2024-12-03T02:18:47Z,2024-12-03T16:19:28+00:00,1,14.01
21438,Fix AI Context menu text wrapping causing overlap,huacnlee,2024-12-03T02:54:12Z,2024-12-03T04:45:16+00:00,1,1.85
21444,ui: Ensure `Label` with `single_line` set does not wrap,huacnlee,2024-12-03T05:34:46Z,2024-12-03T18:03:53+00:00,1,12.49
21454,"python: Add capture groups for builtin types, builtin attribute decorators, class inheritance, function arguments and definition keywords",elisiariocouto,2024-12-03T13:16:10Z,2025-01-20T18:14:19+00:00,5,1156.97
21479,Configure Highlight settings on yank vim,RustyDev24,2024-12-03T17:53:30Z,2024-12-04T16:23:32+00:00,2,22.5
21498,context_server: Add missing types for MCP spec to protocol 2024-11-05,dsp-ant,2024-12-04T00:34:26Z,2024-12-04T15:45:25+00:00,1,15.18
21508,Detect wider variety of usernames for SSH-based remotes,nickbreaton,2024-12-04T04:54:53Z,2024-12-05T23:23:37+00:00,3,42.48
21533,windows: Ignore WM_SIZE event when minimizing window,feeiyu,2024-12-04T14:38:55Z,2024-12-06T22:15:04+00:00,1,55.6
21544,vim: Add delete action to HelixNormal mode,leroycep,2024-12-04T18:41:34Z,2024-12-06T21:05:42+00:00,5,50.4
21550,Use LiveKit's Rust SDK on Linux while continue using Swift SDK on Mac,mgsloan,2024-12-04T20:36:26Z,2024-12-05T23:06:18+00:00,2,26.5
21551,Update cloudflare/wrangler-action digest to 6d58852,renovate,2024-12-04T20:55:53Z,2024-12-06T18:16:53+00:00,1,45.35
21552,Update Rust crate anyhow to v1.0.94,renovate,2024-12-04T20:57:05Z,2024-12-04T23:04:24+00:00,1,2.12
21561,Update Rust crate ctor to v0.2.9,renovate,2024-12-04T23:03:59Z,2024-12-06T17:22:35+00:00,1,42.31
21568,Update Rust crate pathdiff to v0.2.3,renovate,2024-12-05T00:22:44Z,2024-12-06T17:33:33+00:00,1,41.18
21570,Update Rust crate rsa to v0.9.7,renovate,2024-12-05T01:31:09Z,2024-12-06T17:32:45+00:00,1,40.03
21572,Exclude pinned tabs when closing active item with shortcut,uncenter,2024-12-05T02:21:26Z,2024-12-19T13:29:57+00:00,2,347.14
21615,Implement screen capture on linux,mikayla-maki,2024-12-05T23:13:46Z,2025-01-30T19:36:24+00:00,1,1340.38
21616,markdown preview: Fix panic when parsing empty image tag,bennetbo,2024-12-05T23:19:45Z,2024-12-06T09:01:57+00:00,2,9.7
21617,Catch panic from oo7 when reading credentials,cole-miller,2024-12-06T00:17:40Z,2024-12-06T13:45:03+00:00,2,13.46
21665,Update NorwegianExtended equivalents,ConradIrwin,2024-12-06T22:10:12Z,2024-12-06T23:42:58+00:00,1,1.55
21672,assistant: Remove outdated settings update path,DrewRidley,2024-12-07T01:17:20Z,2025-01-03T23:08:08+00:00,1,669.85
21675,Add image dimension and file size information,kaf-lamed-beyt,2024-12-07T02:53:37Z,2025-02-07T00:56:35+00:00,22,1486.05
21702,editor: Add debounce setting for triggering DocumentHighlight,xzbdmw,2024-12-08T13:16:39Z,2024-12-12T23:37:58+00:00,1,106.36
21703,windows: Fix the app frozen after window minimize and maximize,feeiyu,2024-12-08T13:29:08Z,2024-12-10T19:00:41+00:00,1,53.53
21705,Resolve documentation for visible completions,mgsloan,2024-12-08T16:34:33Z,2024-12-10T19:25:31+00:00,1,50.85
21706,Prefer project (worktree) tasks to language/global tasks in task::Spawn,IViktorov,2024-12-08T17:30:43Z,2024-12-14T07:30:49+00:00,1,134.0
21712,vim: Add use_highlight_find setting,jaivinwylde,2024-12-08T19:27:46Z,2024-12-10T15:45:33+00:00,1,44.3
21713,Add support for folding block/multiline comments,tomlin7,2024-12-08T20:00:33Z,2024-12-12T23:32:30+00:00,2,99.53
21716,Make space for documentation aside during followup completion select,mgsloan,2024-12-08T21:01:05Z,2024-12-09T17:47:14+00:00,3,20.77
21719,Added JavaScript runnable detection for `context` and `suite` methods,RemcoSmitsDev,2024-12-08T21:59:23Z,2024-12-09T11:17:51+00:00,1,13.31
21722,Add per-language settings `show_completions_on_input` and `show_completion_documentation`,mgsloan,2024-12-08T23:14:04Z,2024-12-09T18:53:51+00:00,1,19.66
21736,Notify users via toast instead of silently logging generic LSP response errors,dangdennis,2024-12-09T08:48:58Z,2025-01-20T21:54:38+00:00,6,1021.09
21756,"On windows, recreate renderer swap chain on restore from minimized",mgsloan,2024-12-09T18:16:59Z,2024-12-10T18:59:44+00:00,4,24.71
21760,Workspace move editor actions,Igonato,2024-12-09T19:42:03Z,2024-12-17T11:39:36+00:00,13,183.96
21808,windows: Make git update work,CharlesChen0823,2024-12-10T14:23:29Z,2025-01-18T10:41:52+00:00,2,932.31
21825,Improve editor open URL command to open the selected portion of URL,smitbarmase,2024-12-10T19:50:15Z,2024-12-13T06:15:21+00:00,2,58.42
21861,worktree: Fix privacy check for singleton files,cole-miller,2024-12-11T15:40:18Z,2024-12-12T06:53:01+00:00,3,15.21
21871,toolbar: Add gap between the Kernel and REPL button,raphaelkieling,2024-12-11T19:27:42Z,2024-12-12T12:49:17+00:00,1,17.36
21873,linux: Implement Menus,smitbarmase,2024-12-11T20:08:37Z,2024-12-18T22:27:25+00:00,3,170.31
21880,Update Rust crate cargo_toml to 0.21,renovate,2024-12-11T21:07:30Z,2024-12-18T20:24:30+00:00,1,167.28
21892,Update Rust crate heed to 0.21.0,renovate,2024-12-11T22:18:47Z,2024-12-18T20:24:48+00:00,1,166.1
21900,Update Rust crate tiktoken-rs to 0.6.0,renovate,2024-12-12T01:13:57Z,2024-12-18T20:24:56+00:00,1,163.18
21942,Expand diagnostic excerpts using heuristics on syntactic information from TreeSitter ,mgsloan,2024-12-12T22:36:11Z,2024-12-20T22:43:43+00:00,1,192.13
21955,Add process ID to terminal tab tooltips,Angelk90,2024-12-13T10:07:51Z,2025-01-09T18:06:10+00:00,1,655.97
21981,Fix running Python commands that include paths with spaces,silvanocerza,2024-12-13T17:25:13Z,2024-12-13T21:31:08+00:00,6,4.1
22003,Fix permalink-to-line when Git repo root and worktree dir don't coincide,cole-miller,2024-12-14T02:31:06Z,2024-12-19T19:42:36+00:00,3,137.19
22018,Update collab local development instructions,Qkessler,2024-12-14T17:27:59Z,2024-12-18T03:43:48+00:00,2,82.26
22036,Enable `yaml-language-server` lookup in PATH,henryhchchc,2024-12-15T09:18:33Z,2025-01-09T21:23:12+00:00,1,612.08
22045,linux: Fix saving file with root ownership,smitbarmase,2024-12-15T18:55:02Z,2024-12-19T22:17:26+00:00,9,99.37
22048,vim: Add a setting to change the Vim mode indicator position on the status bar from right to left,helgemahrt,2024-12-15T20:38:43Z,2024-12-19T23:19:28+00:00,4,98.68
22053,extensions_ui: Add Cython as a suggested extension,lgeiger,2024-12-16T00:34:05Z,2024-12-16T22:54:55+00:00,1,22.35
22063,workspace: Fix doc comments,helgemahrt,2024-12-16T09:09:02Z,2024-12-16T13:27:15+00:00,1,4.3
22073,Project panel: Deselect entries on remaining blank space click + Remove hover color for selected entries,smitbarmase,2024-12-16T09:50:05Z,2024-12-16T13:05:55+00:00,1,3.26
22079,docs: Fix context_servers key for example extension manifest,uncenter,2024-12-16T13:09:47Z,2024-12-16T16:00:27+00:00,4,2.84
22091,Fix nix shell,wuliuqii,2024-12-16T16:18:15Z,2025-01-07T04:15:40+00:00,3,515.96
22102, Improve code context menu layout position esp visual stability,mgsloan,2024-12-16T19:43:14Z,2024-12-17T06:17:36+00:00,2,10.57
22109,ui: Add background color property to label,helgemahrt,2024-12-16T21:48:33Z,2024-12-16T23:27:25+00:00,1,1.65
22150,Allow the use of both Assistants when in the `assistant2` feature flag,maxdeviant,2024-12-17T18:23:26Z,2024-12-17T19:23:58+00:00,1,1.01
22170,Remove main push from `bump-zed-minor-versions` script,mgsloan,2024-12-17T23:15:36Z,2024-12-18T16:32:59+00:00,1,17.29
22174,Add command to copy current file name,ankddev,2024-12-18T03:54:52Z,2025-02-11T15:42:23+00:00,4,1331.79
22175,Fix the illegal JSON in the documentation,cocolato,2024-12-18T03:59:43Z,2024-12-18T09:10:13+00:00,1,5.17
22178,Migrate more events to telemetry::event,JosephTLyons,2024-12-18T07:33:46Z,2025-01-14T21:13:49+00:00,1,661.67
22195,docs: Use higher-quality image in the header,plyght,2024-12-18T16:42:37Z,2024-12-23T13:40:57+00:00,1,116.97
22200,Hide chat panel button when not in a call,cole-miller,2024-12-18T18:50:24Z,2024-12-19T19:55:31+00:00,2,25.09
22207,Update Rust crate hyper to v0.14.32,renovate,2024-12-18T21:02:04Z,2024-12-20T01:16:57+00:00,1,28.25
22211,Update Rust crate semver to v1.0.24 - autoclosed,renovate,2024-12-18T22:30:02Z,2024-12-20T01:16:41+00:00,1,26.78
22212,Update Rust crate tree-sitter-c to v0.23.4 - autoclosed,renovate,2024-12-18T22:30:13Z,2024-12-20T01:15:12+00:00,1,26.75
22215,Update aws-sdk-rust monorepo,renovate,2024-12-18T23:02:28Z,2024-12-20T01:19:18+00:00,1,26.28
22226,Update Rust crate tree-sitter-json to 0.24,renovate,2024-12-19T02:36:33Z,2024-12-20T01:14:56+00:00,1,22.64
22248,Update macOS system requirements in docs,ringods,2024-12-19T13:39:35Z,2024-12-19T18:13:59+00:00,1,4.57
22258,Fix knockout icon background to match hovered entry background in project panel,smitbarmase,2024-12-19T17:33:40Z,2024-12-20T21:26:47+00:00,1,27.89
22263,vim: Add AnyQuotes support for unified quote handling similar to mini.ai nvim,oca159,2024-12-19T19:46:05Z,2025-01-08T03:22:50+00:00,2,463.61
22268,Use standard injection.language and injection.content captures,uncenter,2024-12-19T22:10:31Z,2025-01-07T19:00:52+00:00,3,452.84
22323,Add support for Claude 3.5 Haiku model,saahityaedams,2024-12-21T07:18:39Z,2025-01-03T19:05:25+00:00,1,323.78
22325,Add decorated function to pytest runnables,ThomAub,2024-12-21T09:11:02Z,2024-12-21T11:33:02+00:00,2,2.37
22335,"linux: Fix ""Failed to start language server"" errors when starting Zed from .desktop file",smitbarmase,2024-12-21T20:12:55Z,2024-12-22T10:07:21+00:00,8,13.91
22351,Update Luau docs,4teapo,2024-12-22T12:39:20Z,2024-12-22T13:56:19+00:00,1,1.28
22352,Add support for block comments in Markdown configuration,Rusydy,2024-12-22T13:10:52Z,2025-01-01T15:48:01+00:00,1,242.62
22396,Fix pulling metadata out of broken symlinks,Qkessler,2024-12-24T15:56:34Z,2025-01-21T17:09:16+00:00,3,673.21
22414,windows: Fix crashing when minimizing a window on Windows 11,JunkuiZhang,2024-12-25T08:42:17Z,2024-12-25T09:53:45+00:00,1,1.19
22418,Add dirty indicator to Breadcrumbs,Qkessler,2024-12-25T14:38:29Z,2025-02-26T18:46:27+00:00,3,1516.13
22422,Pin actions/checkout action to 11bd719,renovate,2024-12-25T22:51:12Z,2024-12-26T13:33:41+00:00,1,14.71
22423,Update Rust crate anyhow to v1.0.95,renovate,2024-12-25T22:52:31Z,2024-12-26T13:30:52+00:00,1,14.64
22424,Update Rust crate async-broadcast to v0.7.2,renovate,2024-12-26T00:14:16Z,2024-12-27T00:13:07+00:00,1,23.98
22425,Update Rust crate env_logger to v0.11.6,renovate,2024-12-26T00:14:29Z,2024-12-26T23:56:57+00:00,1,23.71
22427,Update Rust crate libc to v0.2.169,renovate,2024-12-26T04:16:06Z,2024-12-26T23:56:57+00:00,1,19.68
22430,"docs: Add ""bounded"" mode to soft_wrap documentation",sofaspawn,2024-12-26T11:59:48Z,2024-12-26T19:42:32+00:00,1,7.71
22441,Add a case for shadows when blur_radius = 0,iamnbutler,2024-12-27T03:38:15Z,2025-01-06T17:47:01+00:00,3,254.15
22443,Prevent duplicate resolution when applying additional edits,lleyton,2024-12-27T09:20:01Z,2024-12-27T16:44:29+00:00,1,7.41
22479,Syntax highlight the JavaScript keyword `using`,jaydenseric,2024-12-29T01:18:31Z,2024-12-29T08:19:52+00:00,1,7.02
22483,Fix lost focus when navigating back in project search result,feeiyu,2024-12-29T14:54:31Z,2025-03-04T13:06:44+00:00,1,1558.2
22494,Rename the `OpenFile` action to `OpenSelectedFilename` to better reflect its function,cole-miller,2024-12-30T02:22:07Z,2025-01-07T04:37:27+00:00,3,194.26
22526,assistant2: Suggest current file as context,agu-z,2024-12-31T22:17:37Z,2025-01-02T13:35:29+00:00,2,39.3
22552,Update swatinem/rust-cache digest to f0deed1,renovate,2025-01-01T22:45:58Z,2025-01-02T17:44:30+00:00,1,18.98
22553,Update Rust crate quote to v1.0.38,renovate,2025-01-01T22:47:13Z,2025-01-02T23:00:44+00:00,1,24.23
22554,Update Rust crate sea-orm to v1.1.3,renovate,2025-01-02T01:53:29Z,2025-01-03T16:41:43+00:00,1,38.8
22555,Update Rust crate serde_json to v1.0.134,renovate,2025-01-02T01:53:49Z,2025-01-02T23:25:27+00:00,1,21.53
22558,Update Rust crate unicase to v2.8.1,renovate,2025-01-02T03:05:58Z,2025-01-02T14:57:26+00:00,1,11.86
22580,windows: Fix cursor style not changing when hovering over items in the title bar,smitbarmase,2025-01-02T18:20:04Z,2025-01-04T00:18:02+00:00,1,29.97
22587,python: Adjust binary path based on OS,TorratDev,2025-01-02T21:04:38Z,2025-01-03T23:12:46+00:00,2,26.14
22599,csharp: Add bracket indents,MrSubidubi,2025-01-03T02:47:56Z,2025-01-03T14:13:17+00:00,1,11.42
22600,windows: Fix leading slash on windows,someone120,2025-01-03T03:08:14Z,2025-01-03T09:18:18+00:00,1,6.17
22609,"Add syntax highlighting for character literals in Haskell, PureScript, and Zig",nilskch,2025-01-03T10:55:39Z,2025-01-03T21:24:56+00:00,2,10.49
22616,windows: Fix tests on Windows,JunkuiZhang,2025-01-03T15:28:34Z,2025-02-05T14:30:09+00:00,3,791.03
22625,Add a dedicated action to open files,cole-miller,2025-01-03T20:08:37Z,2025-01-08T14:44:55+00:00,2,114.61
22629,More Emacs keybinding improvements,rosstimson,2025-01-03T21:31:37Z,2025-01-06T22:19:06+00:00,4,72.79
22660,windows: Fix fs watch when file doesn't exist or is a symlink,smitbarmase,2025-01-04T15:41:23Z,2025-01-07T19:00:52+00:00,3,75.32
22663,Document `git.gutter_debounce` setting,spotikhanov,2025-01-04T17:14:39Z,2025-01-06T18:46:16+00:00,1,49.53
22665,google_ai: Add Gemini 2.0 Flash support,respberryx,2025-01-04T19:22:02Z,2025-01-06T21:45:37+00:00,3,50.39
22668,editor: Add inline diagnostics feature,davisp,2025-01-04T21:14:10Z,2025-02-20T23:39:49+00:00,50,1130.43
22681,windows: Don't load login shell environment,vilgotf,2025-01-05T14:30:03Z,2025-01-07T20:08:22+00:00,1,53.64
22688,Fix ghost files appearing in the project panel when clicking relative paths in the terminal,smitbarmase,2025-01-05T17:38:33Z,2025-01-05T22:06:16+00:00,2,4.46
22727, go: Adjust `gopls` path based on OS,TorratDev,2025-01-06T19:21:09Z,2025-01-06T22:19:06+00:00,4,2.97
22730,Reduce amount of workspace serialization happening,SomeoneToIgnore,2025-01-06T20:22:21Z,2025-01-07T11:18:17+00:00,4,14.93
22762,lsp: Use `Path` instead of `String` for path handling,JunkuiZhang,2025-01-07T11:03:39Z,2025-01-19T19:07:39+00:00,17,296.07
22783,"assistant2: Add keybinding for ""Remove All Context"" action",danilo-leal,2025-01-07T17:09:59Z,2025-01-07T21:11:44+00:00,1,4.03
22796,Fix conversation selector popover menu offset,rtfeldman,2025-01-07T21:38:43Z,2025-01-08T13:50:13+00:00,1,16.19
22808,gpui: Add `PathBuilder` based on lyon to build `Path`,huacnlee,2025-01-08T05:15:12Z,2025-01-29T20:14:33+00:00,1,518.99
22812,gpui: Enable MSAA to Path render for Anti-Aliasing,huacnlee,2025-01-08T08:56:12Z,2025-01-29T20:14:40+00:00,16,515.31
22836,Use distinct carets for line number hovers,SomeoneToIgnore,2025-01-08T15:46:35Z,2025-01-09T00:08:25+00:00,1,8.36
22850,pane: Add ability to use custom tooltip content,danilo-leal,2025-01-08T18:17:04Z,2025-01-09T00:31:46+00:00,1,6.25
