number,title,author,createdAt,closedOrMergedAt,reviewsCount,hoursOpen
28709,python: Auto-close f-strings,probably-neb,2025-04-14T18:36:35Z,2025-04-14T21:22:27+00:00,2,2.76
28733,markdown: Add ability to customize individual heading level,danilo-leal,2025-04-15T00:09:30Z,2025-04-15T12:35:24+00:00,1,12.43
28737,"agent: Add more Rust code examples, update TODO check",tmickleydoyle,2025-04-15T03:54:35Z,2025-04-15T16:52:09+00:00,1,12.96
28790,feedback: Update issue template URL,MrSubidubi,2025-04-15T16:56:41Z,2025-04-16T01:36:31+00:00,1,8.66
28808,agent: Add assistant panel width persistence,imumesh18,2025-04-15T19:57:05Z,2025-05-02T20:05:03+00:00,2,408.13
28811,Add support for judge repetitions in eval,mgsloan,2025-04-15T20:30:00Z,2025-04-15T23:18:03+00:00,1,2.8
28816,agent: Add telemetry for eval runs,tmickleydoyle,2025-04-15T21:28:56Z,2025-04-16T02:54:26+00:00,6,5.42
28881,Add support for OpenAI o3 and o4-mini models,imumesh18,2025-04-16T17:24:24Z,2025-04-17T14:58:41+00:00,8,21.57
28896,Pin actions/checkout action to 11bd719,renovate,2025-04-16T19:02:03Z,2025-04-16T21:03:49+00:00,1,2.03
28897,Update actions/setup-node digest to 49933ea,renovate,2025-04-16T19:02:09Z,2025-04-18T17:31:03+00:00,1,46.48
28904,Update Rust crate anyhow to v1.0.98,renovate,2025-04-16T20:03:50Z,2025-04-16T21:04:23+00:00,1,1.01
28905,Update Rust crate clap to v4.5.36,renovate,2025-04-16T20:04:00Z,2025-04-18T18:11:30+00:00,1,46.12
28911,Update Rust crate libc to v0.2.172,renovate,2025-04-16T21:01:18Z,2025-04-18T17:30:41+00:00,1,44.49
28912,Update Rust crate mimalloc to v0.1.46,renovate,2025-04-16T21:01:30Z,2025-04-18T17:30:07+00:00,1,44.48
28917,Update Rust crate proc-macro2 to v1.0.95,renovate,2025-04-16T22:20:29Z,2025-04-18T17:30:22+00:00,1,43.16
28918,Update Rust crate sea-orm to v1.1.10,renovate,2025-04-16T22:20:41Z,2025-04-18T19:15:02+00:00,1,44.91
28952,Add `zed` to Flatpak config and data directories,mkungla,2025-04-17T09:34:29Z,2025-04-19T17:41:03+00:00,2,56.11
29005,git_ui: Improve error handling in commit message generation,imumesh18,2025-04-17T20:27:03Z,2025-06-09T14:20:20+00:00,1,1265.89
29016,Don't display MacOS key symbols in Linux,marcospb19,2025-04-17T23:44:59Z,2025-04-18T00:48:00+00:00,1,1.05
29019,"Make Copy and Trim ignore empty lines, and fix vim line selections",redforks,2025-04-18T01:50:59Z,2025-04-18T03:35:06+00:00,1,1.74
29027,language_models: Dynamically detect Copilot Chat models,lj3954,2025-04-18T06:30:20Z,2025-05-12T11:28:42+00:00,5,580.97
29115,Include partial output in terminal tool error on interrupt,captaindpt,2025-04-20T03:00:01Z,2025-04-28T15:25:11+00:00,1,204.42
29127,Hide editor context menu when modal is opened,redforks,2025-04-20T13:55:11Z,2025-04-21T14:43:26+00:00,2,24.8
29131,Add right click in terminal create new selection if none present,kylelau519,2025-04-20T21:38:20Z,2025-04-21T15:39:17+00:00,7,18.02
29144,windows: A new implementation of keystrokes,JunkuiZhang,2025-04-21T07:12:54Z,2025-08-06T19:36:41+00:00,6,2580.4
29145,windows: Add support for SSH,JunkuiZhang,2025-04-21T07:22:00Z,2025-07-08T14:34:58+00:00,24,1879.22
29182,editor: Use quantize score for code completions sort + Add code completions tests,smitbarmase,2025-04-21T23:31:27Z,2025-04-23T01:53:34+00:00,3,26.37
29212,"docs: Update ""checkOnSave"" to ""check""",Doods0,2025-04-22T13:34:27Z,2025-04-22T16:27:47+00:00,1,2.89
29291,rust-analyzer: Fix for deserialization error of CargoRunnableArgs,notpeter,2025-04-23T17:05:02Z,2025-04-23T20:11:02+00:00,1,3.1
29299,"agent: Add ""copy to clipboard"" button to error message popups",osyvokon,2025-04-23T18:32:36Z,2025-04-23T22:12:27+00:00,1,3.66
29309,context servers: Show configuration modal when extension is installed,bennetbo,2025-04-23T21:50:50Z,2025-05-01T18:02:14+00:00,3,188.19
29316,editor: Do not insert scrollbar hitboxes when scrollbars are never to be shown,MrSubidubi,2025-04-23T23:39:48Z,2025-05-06T07:25:01+00:00,1,295.75
29359,Query multiple LSPs for more types of requests,XiNiHa,2025-04-24T17:31:12Z,2025-07-02T17:51:20+00:00,14,1656.34
29369,"copilot: Add support for tool_calls for gpt-4.1, gpt-4o, o4-mini",imumesh18,2025-04-24T19:36:11Z,2025-05-05T11:59:12+00:00,1,256.38
29400,assistant_tool: Remove additionalProperties from tool schema,imumesh18,2025-04-25T09:59:28Z,2025-04-25T13:14:43+00:00,1,3.25
29452,Use image cache to stop leaking images,mikayla-maki,2025-04-25T23:33:30Z,2025-04-29T19:30:16+00:00,1,91.95
29456,editor: Improve code completions by prioritizing prefix matching,smitbarmase,2025-04-26T01:55:52Z,2025-04-26T11:45:48+00:00,2,9.83
29473,workspace: Fix inactive pane dimming,ronharel02,2025-04-26T11:56:37Z,2025-05-07T06:02:34+00:00,4,258.1
29482,editor: Trim indent guides at last non-empty line,ronharel02,2025-04-26T14:36:26Z,2025-05-12T15:04:47+00:00,1,384.47
29490,vim: Fix end of paragraph deletion when there's no blank lines,dinocosta,2025-04-26T22:24:18Z,2025-04-29T19:34:51+00:00,3,69.18
29494,title_bar: Add icon for project branch trigger button,shank03,2025-04-27T07:43:33Z,2025-05-06T08:38:24+00:00,7,216.91
29496,Add support for OpenRouter as a language model provider,imumesh18,2025-04-27T09:52:57Z,2025-06-03T15:59:46+00:00,23,894.11
29502,ollama: Fix build with default features,tidely,2025-04-27T15:26:33Z,2025-04-28T13:58:10+00:00,1,22.53
29536,agent: Include grep-related instructions in the prompt only if the tool is available,osyvokon,2025-04-28T14:17:25Z,2025-04-28T19:47:41+00:00,5,5.5
29547,Add default tab_size for Elm,ivanbanov,2025-04-28T16:12:08Z,2025-05-06T07:14:02+00:00,1,183.03
29563,ollama: Add tool call support,tidely,2025-04-28T20:48:38Z,2025-05-05T17:52:23+00:00,7,165.06
29588,Stop routing session events via the DAP store,ConradIrwin,2025-04-29T05:42:02Z,2025-04-29T19:51:05+00:00,4,14.15
29591,client: Implement Socks identification and authorization,tidely,2025-04-29T06:45:52Z,2025-05-06T08:03:57+00:00,12,169.3
29601,agent: Enrich `grep` tool output with syntax information,agu-z,2025-04-29T14:30:32Z,2025-04-29T17:03:02+00:00,1,2.54
29602,bedrock: Preserve thinking blocks for Bedrock,5herlocked,2025-04-29T14:36:38Z,2025-04-29T16:18:32+00:00,1,1.7
29649,chore: Use `target_os` for conditional dependencies,huacnlee,2025-04-30T06:22:28Z,2025-04-30T08:24:05+00:00,3,2.03
29664,Add kernel detection for language support of runnable markdown cells,JonGretar,2025-04-30T11:17:25Z,2025-05-22T03:23:06+00:00,1,520.09
29685,Fix tab and shift+tab scroll behavior in picker,smltr,2025-04-30T16:36:27Z,2025-05-21T07:43:23+00:00,1,495.12
29709,Add setting to hide onboarding banners,nt8r,2025-04-30T22:03:39Z,2025-05-06T18:54:10+00:00,3,140.84
29714,VSCode shortcuts importer,JunkuiZhang,2025-05-01T00:09:41Z,2025-09-09T16:13:02+00:00,1,3160.06
29716,language: Select language based on longest matching path extension,claytonrcarter,2025-05-01T00:30:43Z,2025-05-26T18:00:05+00:00,11,617.49
29717,editor: Fix context menu capitalization,AaronFeickert,2025-05-01T01:06:50Z,2025-05-01T06:58:08+00:00,1,5.86
29718,gpui: Improve path rendering & global multisample anti-aliasing,sunli829,2025-05-01T03:44:02Z,2025-07-02T16:41:42+00:00,19,1500.96
29719,bedrock: Support Writer Palmyra models,5herlocked,2025-05-01T04:20:19Z,2025-05-12T07:54:10+00:00,1,267.56
29720,bedrock: Support Amazon Nova Premier,5herlocked,2025-05-01T04:35:57Z,2025-05-12T08:15:18+00:00,1,267.66
29737,Respect cursor_pointer when a ButtonLike is disabled,rtfeldman,2025-05-01T15:00:25Z,2025-05-01T19:34:40+00:00,1,4.57
29761,Use project environment in LSP runnables context,WeetHet,2025-05-01T19:38:31Z,2025-05-02T11:01:40+00:00,9,15.39
29829,editor: Remove extra quotes from outline search term,AaronFeickert,2025-05-02T23:21:30Z,2025-05-06T07:50:33+00:00,1,80.48
29840,docs: Add instructions for uninstalling Zed,AnjaliPhukan,2025-05-03T12:58:06Z,2025-05-04T17:41:37+00:00,2,28.73
29874,git: Add ability to pass `--signoff`,ericcornelissen,2025-05-04T13:21:19Z,2025-07-17T03:39:55+00:00,1,1766.31
29886,project_search: Ensure filter row aligns with other search rows,MrSubidubi,2025-05-04T20:07:52Z,2025-05-05T06:35:49+00:00,1,10.47
29921,pane: Add functional clone on drop with `control` modifier,CharlesChen0823,2025-05-05T13:07:38Z,2025-05-26T13:40:20+00:00,3,504.55
29924,Terminal tool improvements,cole-miller,2025-05-05T14:24:27Z,2025-05-05T19:57:04+00:00,3,5.54
29938,Add Zed Pro Trial Upsell,iamnbutler,2025-05-05T17:27:29Z,2025-05-05T22:46:54+00:00,2,5.32
29943,Update `assistant` to `agent` in settings and keymaps,cole-miller,2025-05-05T18:34:36Z,2025-05-06T01:02:56+00:00,2,6.47
29994,language_models: Add tool use support for Mistral models,imumesh18,2025-05-06T11:18:19Z,2025-05-19T16:36:59+00:00,4,317.31
29998,agent: Fix inline assistant focusing behavior for cursor placement,imumesh18,2025-05-06T12:09:51Z,2025-05-12T09:29:14+00:00,1,141.32
30033,agent: Allow customizing temperature by provider/model,agu-z,2025-05-06T18:17:50Z,2025-05-06T20:36:26+00:00,4,2.31
30039,"Rename assistant settings to agent settings, to match new settings UI",mikayla-maki,2025-05-06T19:13:41Z,2025-05-08T01:11:29+00:00,1,29.96
30044,Add TypeScript support to ESLint flat config,ai,2025-05-06T20:41:19Z,2025-05-07T12:49:00+00:00,1,16.13
30049,git_ui: Only register conflict addon for full mode editors,MrSubidubi,2025-05-06T22:52:57Z,2025-05-07T20:10:08+00:00,1,21.29
30053,Restore tool cards on thread deserialization,mikayla-maki,2025-05-07T00:16:19Z,2025-05-07T01:16:34+00:00,1,1.0
30090,Load Profile state from Thread and tie visibility to the thread's model,benbrandt,2025-05-07T09:19:28Z,2025-05-08T02:36:08+00:00,2,17.28
30138,editor: Use default gutter margin instead of `horizontal_padding` for horizontal content padding,MrSubidubi,2025-05-07T15:47:38Z,2025-05-07T18:23:55+00:00,1,2.6
30153,title_bar: Add link indicator to current plan entry in user menu,MrSubidubi,2025-05-07T17:01:18Z,2025-05-07T18:25:39+00:00,1,1.41
30155,language_models: Add vision support for Copilot Chat models,imumesh18,2025-05-07T17:10:04Z,2025-05-12T13:11:38+00:00,2,116.03
30160,ruby: Update documentation about new LS activation sequence,vitallium,2025-05-07T17:52:57Z,2025-05-07T20:35:48+00:00,1,2.71
30162,search: Do not consider filters if they are toggled off,MrSubidubi,2025-05-07T18:22:05Z,2025-05-08T06:42:40+00:00,1,12.34
30171,mistral: Add new Mistral medium model,versecafe,2025-05-07T19:01:19Z,2025-05-08T01:57:16+00:00,1,6.93
30189,editor: Ensure scrollbar thumb is not layouted when content size is smaller than viewport,MrSubidubi,2025-05-07T21:26:09Z,2025-05-08T07:06:10+00:00,3,9.67
30212,snippets: Add icons and file names to snippet scope selector,loczek,2025-05-08T07:55:53Z,2025-05-26T13:44:10+00:00,1,437.8
30223,Add tool support for DeepSeek,thlstsul,2025-05-08T09:46:43Z,2025-06-03T08:59:36+00:00,1,623.21
30227,vim: Add `g M` motion to go to the middle of a line,x4132,2025-05-08T10:05:09Z,2025-05-16T21:21:30+00:00,1,203.27
30239,Make `copilot::SignIn` open sign-in modal when needed,mgsloan,2025-05-08T11:12:54Z,2025-05-08T14:52:07+00:00,2,3.65
30249,copilot: Use latest Copilot API spec ,imumesh18,2025-05-08T12:43:17Z,2025-06-06T06:46:06+00:00,1,690.05
30251,Improve compatibility with Wayland clipboard,aldofunes,2025-05-08T12:47:59Z,2025-05-30T17:21:00+00:00,1,532.55
30289,Add a test for remote tool use by the agent,cole-miller,2025-05-08T17:36:54Z,2025-05-08T20:53:04+00:00,1,3.27
30326,editor: Ensure minimap is shown when `show_minimap` is toggled to `true`,MrSubidubi,2025-05-09T01:04:45Z,2025-05-09T05:32:32+00:00,1,4.46
30332,deps: Update aws-lc-rs to 1.13.1,ognevny,2025-05-09T04:27:46Z,2025-05-09T06:13:00+00:00,1,1.75
30344,windows: Remove extra empty line when loading default settings,JunkuiZhang,2025-05-09T07:29:37Z,2025-05-09T11:00:16+00:00,1,3.51
30416,Wait to locate system-installed Node until the shell environment is loaded,maxbrunsfeld,2025-05-09T17:53:39Z,2025-05-09T19:24:28+00:00,1,1.51
30437,agent: Allow to collapse provider sections in the settings view,amateurhuman,2025-05-09T21:38:58Z,2025-05-12T08:07:30+00:00,1,58.48
30444,Implement global settings file,trishume,2025-05-09T22:52:21Z,2025-05-13T06:29:33+00:00,1,79.62
30450,Add setting to disable the sign in button,trishume,2025-05-10T01:12:29Z,2025-05-14T13:39:04+00:00,1,108.44
30454,debugger: Fix unzipping of codelldb on Windows,zcg,2025-05-10T09:04:40Z,2025-05-21T18:17:15+00:00,3,273.21
30456,Fix deprecation warning text being covered by right dock,kmpeeduwee,2025-05-10T10:09:50Z,2025-05-11T21:54:21+00:00,2,35.74
30467,open_ai: Fix parallel tools issue,adrianfuro,2025-05-10T15:13:39Z,2025-05-26T11:46:35+00:00,1,380.55
30470,Add Caps Lock support,mzaks,2025-05-10T16:18:11Z,2025-06-18T00:43:33+00:00,7,920.42
30474,docs: Suggest checking `zed_extension_api` compatibility,sectore,2025-05-10T19:31:49Z,2025-05-10T21:07:01+00:00,1,1.59
30477,editor: Prevent vertical scrollbar from overlapping with buffer headers,MrSubidubi,2025-05-10T20:29:40Z,2025-05-11T15:54:57+00:00,1,19.42
30479,Allow toggling border visibility in centered layout mode,kmpeeduwee,2025-05-10T21:42:08Z,2025-06-09T06:44:13+00:00,1,705.03
30490,paths: XDG_CONFIG_HOME compliance on non-linux platforms,chawyehsu,2025-05-11T02:21:23Z,2025-06-06T17:19:45+00:00,3,638.97
30519,Fix apply buffer font features to completion tooltip (#30362),kmpeeduwee,2025-05-11T17:53:45Z,2025-05-11T19:45:42+00:00,1,1.87
30546,Fix out-of-bounds panic in fuzzy matcher with Unicode/multibyte characters,imumesh18,2025-05-12T09:29:40Z,2025-05-12T14:43:14+00:00,2,5.23
30568,Add `ZED_BLADE_VALIDATE` flag for enabling blade validation on Linux,probably-neb,2025-05-12T13:25:07Z,2025-06-06T13:02:08+00:00,1,599.62
30589,language_models: Add support for tool use to LM Studio provider,gyzerok,2025-05-12T17:13:10Z,2025-05-26T11:54:17+00:00,1,330.69
30599,editor: Do not offset text in single line editors by default,MrSubidubi,2025-05-12T20:07:09Z,2025-05-26T11:47:10+00:00,2,327.67
30600,agent: Namespace MCP server tools,bennetbo,2025-05-12T21:17:53Z,2025-05-27T17:47:45+00:00,1,356.5
30614,Add move line to JetBrains keymap,Celsiusss,2025-05-13T08:34:45Z,2025-05-21T20:12:44+00:00,3,203.63
30639,Add image input support for OpenAI models,agu-z,2025-05-13T13:58:06Z,2025-05-13T15:32:42+00:00,2,1.58
30659,bedrock: Fix cross-region inference,5herlocked,2025-05-13T21:26:43Z,2025-06-03T15:46:35+00:00,1,498.33
30663,docs: Fix up some invalid JSON in OpenAI configuration example,bakert,2025-05-13T23:16:44Z,2025-05-14T11:19:01+00:00,1,12.04
30671,editor: Add support for `drag_and_drop_selection`,CharlesChen0823,2025-05-14T07:38:00Z,2025-06-09T04:51:18+00:00,3,621.22
30673,Support global system settings: `/etc/zed/settings.json`,notpeter,2025-05-14T08:23:02Z,2025-08-06T19:38:44+00:00,3,2027.26
30693,Reduce allocations,tidely,2025-05-14T13:11:32Z,2025-05-14T16:29:28+00:00,1,3.3
30697,Add a separator before Quit in the application menu,skurfer,2025-05-14T14:04:41Z,2025-05-14T16:19:09+00:00,1,2.24
30699,Add excluded_files to pane::DeploySearch,theherk,2025-05-14T14:31:01Z,2025-05-21T10:03:39+00:00,1,163.54
30703,context_server: Fix casing of `mimeType` in tool responses,xJonathanLEI,2025-05-14T15:29:30Z,2025-05-26T08:29:45+00:00,1,281.0
30716,"client: Remove extra clone, pass big struct by reference",tidely,2025-05-14T18:37:07Z,2025-05-14T22:16:25+00:00,1,3.65
30724,docs: Add minimap configuration section,MrSubidubi,2025-05-14T23:36:52Z,2025-05-15T06:07:32+00:00,1,6.51
30742,language_tools: Increase available space for language server logs,MrSubidubi,2025-05-15T08:53:50Z,2025-05-26T21:57:45+00:00,2,277.07
30748,"Add missing ""no"" in .rules",halvko,2025-05-15T09:54:32Z,2025-05-17T06:31:57+00:00,1,44.62
30769,python: Support setting pytest args,cache-missing,2025-05-15T16:03:01Z,2025-07-01T09:34:29+00:00,6,1121.52
30782,editor: Do not start scroll when hovering the scroll thumb during dragging events,MrSubidubi,2025-05-15T20:22:13Z,2025-05-24T20:39:02+00:00,1,216.28
30783,recent_projects: Fix `Open recent` and `Open remote` menu items when no windows exist,cgorski,2025-05-15T20:50:02Z,2025-05-30T06:01:06+00:00,11,345.18
30785,theme: Add colors for minimap thumb and border,MrSubidubi,2025-05-15T21:17:15Z,2025-05-26T18:23:42+00:00,5,261.11
30790,gpui: Activate the window example along with the Quit action,stormasm,2025-05-16T02:23:55Z,2025-05-26T07:10:35+00:00,1,244.78
30803,vim: Document ctrl-s override,5brian,2025-05-16T08:25:04Z,2025-05-26T07:30:00+00:00,1,239.08
30810,"Revert ""Revert ""python: Enable subroot detection for pylsp and pyright (#27364)"" (#29658)""",probably-neb,2025-05-16T09:59:49Z,2025-05-16T11:05:33+00:00,1,1.1
30818,Display the correct git push flag when force-pushing,TymekDev,2025-05-16T12:36:04Z,2025-05-26T07:26:46+00:00,1,234.84
30828,gpui: Implement dynamic window control elements,MatinAniss,2025-05-16T13:58:56Z,2025-06-06T17:11:24+00:00,7,507.21
30832,Fix prevent zero value for buffer line height,kmpeeduwee,2025-05-16T14:15:53Z,2025-05-19T00:55:35+00:00,1,58.66
30833,debugger: Use DAP schema to configure daps,Anthony-Eid,2025-05-16T14:41:21Z,2025-05-22T09:48:26+00:00,6,139.12
30840,Reuse display_map snapshot where possible to reduce snapshot creation,RemcoSmitsDev,2025-05-16T18:01:55Z,2025-09-09T16:12:23+00:00,1,2782.17
30842,Fix performance issues in project search related to detecting JSX tag auto-closing,RemcoSmitsDev,2025-05-16T19:13:08Z,2025-05-20T23:37:09+00:00,2,100.4
30844,ci: Check for broken links,thomas-zahner,2025-05-16T19:43:32Z,2025-06-06T09:39:35+00:00,1,493.93
30860,theme: Add support for per-theme overrides,hron,2025-05-17T08:22:26Z,2025-08-08T21:17:19+00:00,1,2004.91
30869,terminal: Consume event during processing,tidely,2025-05-17T10:27:29Z,2025-05-23T11:28:53+00:00,1,145.02
30890,Fix `Replace Next Match` command,hron,2025-05-17T19:00:04Z,2025-05-21T10:05:44+00:00,1,87.09
30893,Add icons to the built-in picker for Open,hron,2025-05-17T19:53:47Z,2025-05-21T10:07:22+00:00,1,86.23
30904,gpui: Add more shapes for `PathBuilder`,madcodelife,2025-05-18T05:26:09Z,2025-05-26T09:49:42+00:00,1,196.39
30911,Make sure GoPlsAdapter produces output that can be rendered as Markdown,mikalsande,2025-05-18T10:58:56Z,2025-05-26T08:04:13+00:00,1,189.09
30922,Add separate confirmation setting for file deletions,CLoaKY233,2025-05-18T17:36:59Z,2025-06-05T21:40:11+00:00,1,436.05
30937,markdown: Fix parse inline `code` display,CharlesChen0823,2025-05-19T06:13:17Z,2025-05-26T11:28:44+00:00,2,173.26
30942,extension_host: Turn on parallel compilation,benbrandt,2025-05-19T09:04:03Z,2025-05-19T16:06:33+00:00,1,7.04
30948,extension_host: Use wasmtime incremental compilation,benbrandt,2025-05-19T10:48:39Z,2025-05-21T08:12:16+00:00,1,45.39
30952,gpui: Fix race condition when upgrading a weak reference,laizy,2025-05-19T12:01:20Z,2025-05-30T15:18:26+00:00,3,267.29
30964,Ensure horizontal scrollbars show as needed,MrSubidubi,2025-05-19T17:13:42Z,2025-05-26T11:06:19+00:00,1,161.88
30980,title_bar: Fix config merging to respect priority,zertosh,2025-05-19T23:02:07Z,2025-05-20T07:56:24+00:00,1,8.9
30984,Meter edit predictions by acceptance in free plan,maxbrunsfeld,2025-05-20T01:14:10Z,2025-05-21T17:11:42+00:00,1,39.96
30990,gpui: Correct the image id in the example image_loading,stormasm,2025-05-20T04:52:15Z,2025-05-20T07:36:41+00:00,1,2.74
31000,vim: Enable window shortcuts in Agent panel,pavles6,2025-05-20T09:08:10Z,2025-06-06T17:20:04+00:00,1,416.2
31002,client: Try to re-introduce HTTP/HTTPS proxy,JunkuiZhang,2025-05-20T09:42:57Z,2025-05-21T01:08:32+00:00,5,15.43
31043,docs: Bedrock Configuration docs,5herlocked,2025-05-20T17:34:47Z,2025-05-26T15:09:50+00:00,4,141.58
31056,Add holding opt/alt for fast scrolling,alii,2025-05-20T23:46:13Z,2025-05-26T19:42:20+00:00,2,139.94
31062,gpui: Fix scroll area to support two-layer scrolling in different directions,huacnlee,2025-05-21T03:00:32Z,2025-06-06T17:06:09+00:00,2,398.09
31087,Handle `~` in debugger launch modal,P1n3appl3,2025-05-21T11:49:04Z,2025-05-22T11:20:01+00:00,5,23.52
31107,docs: Include slimmer C++ build tools only installation for Windows,NewtonChutney,2025-05-21T17:57:11Z,2025-05-26T08:32:13+00:00,1,110.58
31110,"Update terminal file icon associations in ""FILE_SUFFIX_BY_ICON_KEY""",lukejans,2025-05-21T19:03:42Z,2025-05-26T08:22:44+00:00,1,109.32
31133,project search: Reduce clones and allocations,RemcoSmitsDev,2025-05-21T22:46:29Z,2025-05-22T02:11:00+00:00,1,3.41
31150,python: Respect picked toolchain (when it's not at the root) when running tests,sudoish,2025-05-22T03:53:01Z,2025-06-02T13:29:34+00:00,5,273.61
31174,linux: Fix keystroke handling on non-English keyboard layout,JunkuiZhang,2025-05-22T10:24:07Z,2025-07-11T18:25:27+00:00,3,1208.02
31214,bedrock: Support Claude 4 models,5herlocked,2025-05-22T19:58:01Z,2025-05-22T21:59:24+00:00,3,2.02
31223,Reduce allocations,tidely,2025-05-22T21:14:17Z,2025-05-23T11:25:17+00:00,1,14.18
31224,project: Use VecDeque in SearchHistory,tidely,2025-05-22T21:26:05Z,2025-05-23T11:25:40+00:00,1,13.99
31229,Change default diagnostics_max_severity to 'hint',blopker,2025-05-22T23:54:17Z,2025-05-23T07:30:38+00:00,1,7.61
31235,Expand tilde paths in edit prediction settings,clauses3,2025-05-23T05:00:33Z,2025-06-03T08:32:24+00:00,1,267.53
31239,"send system prompt once, in the beginning of chat",arrrrny,2025-05-23T06:28:40Z,2025-05-23T11:12:33+00:00,1,4.73
31251,Add thinking budget for Gemini custom models,90aca,2025-05-23T09:12:16Z,2025-06-03T11:40:20+00:00,2,266.47
31258,agent: Unfollow agent on completion cancellation,benbrandt,2025-05-23T10:20:18Z,2025-05-23T12:55:08+00:00,1,2.58
31260,language: Improve auto-indentation when using round brackets in Python,MrSubidubi,2025-05-23T10:49:36Z,2025-05-24T20:55:16+00:00,1,34.09
31266,ui: Fix content shift when selecting last tab,MrSubidubi,2025-05-23T11:32:12Z,2025-05-24T20:36:51+00:00,1,33.08
31290,Add overdue invoices check,benbrandt,2025-05-23T15:10:05Z,2025-05-23T20:02:02+00:00,1,4.87
31314,gpui: Remove unnecessary String,tidely,2025-05-23T21:50:45Z,2025-05-26T08:17:04+00:00,1,58.44
31315,Add initial element inspector for Zed development,mgsloan,2025-05-23T22:04:48Z,2025-05-23T23:08:59+00:00,2,1.07
31339,debugger: Fix install detection for debugpy,raphaelluethy,2025-05-24T15:05:51Z,2025-05-27T09:45:55+00:00,15,66.67
31345,"debugger: Improve Go debugging support, with inline hints and stdout/stderr redirect",sysradium,2025-05-24T17:23:59Z,2025-05-27T21:48:39+00:00,7,76.41
31353,agent: Add a setting choose the default view,AlvaroParker,2025-05-24T19:02:08Z,2025-05-26T14:33:18+00:00,3,43.52
31361,agent: Add max mode on text threads,AlvaroParker,2025-05-24T23:30:05Z,2025-05-28T13:12:38+00:00,2,85.71
31366,Add ability to manage dock size via command/shortcut,aurexav,2025-05-25T03:51:30Z,2025-07-02T10:27:52+00:00,24,918.61
31384,Fix diff indicators not restored when reopening remote project,feeiyu,2025-05-25T14:23:33Z,2025-06-17T14:07:52+00:00,2,551.74
31385,Default to fast model first for commit messages,abdelq,2025-05-25T15:47:38Z,2025-05-26T08:37:44+00:00,1,16.84
31390,Add setting for minimap on active editor only,AlvaroParker,2025-05-25T18:16:38Z,2025-06-17T13:39:49+00:00,9,547.39
31392,Add GitHub token environment variable support for Copilot,clauses3,2025-05-25T18:44:40Z,2025-06-09T10:39:44+00:00,1,351.92
31397,gpui: Fix typo in doc comment,WaffleLapkin,2025-05-25T22:28:39Z,2025-05-26T04:59:51+00:00,1,6.52
31415,Update default models to newer versions,benbrandt,2025-05-26T09:12:01Z,2025-05-27T08:54:42+00:00,1,23.71
31421,Add UnwrapSyntaxNode action,Gregoor,2025-05-26T10:28:48Z,2025-08-07T04:52:23+00:00,1,1746.39
31428,gpui: Apply cfg at compile time,tidely,2025-05-26T12:30:09Z,2025-05-26T13:34:04+00:00,1,1.07
31499,Allow to run dynamic TypeScript and JavaScript tests,lsndr,2025-05-27T11:25:43Z,2025-06-09T10:13:26+00:00,2,310.8
31500,docs: Add more troubleshooting steps for Windows,shenjackyuanjie,2025-05-27T11:26:40Z,2025-06-06T10:57:40+00:00,3,239.52
31508,Add warning message when editing a message in a thread,rtfeldman,2025-05-27T13:44:28Z,2025-05-27T20:26:47+00:00,1,6.71
31510,agent: Keep horizontal scrollbar in edit file tool cards,benbrandt,2025-05-27T14:05:33Z,2025-05-27T15:24:22+00:00,1,1.31
31512,Remove redundant words in comments,tongjicoder,2025-05-27T14:29:44Z,2025-05-27T23:01:31+00:00,1,8.53
31556,linux: Fix crash when switching repository via git panel,smitbarmase,2025-05-27T21:00:04Z,2025-05-27T23:56:00+00:00,1,2.93
31559,debugger: Improve Go support,sysradium,2025-05-27T21:43:16Z,2025-05-28T10:59:06+00:00,3,13.26
31586,assistant_tools: Remove description.md files of removed tools,imumesh18,2025-05-28T12:41:03Z,2025-05-28T13:55:39+00:00,1,1.24
31596,terminal: Fix hovering a URL highlighting the closing bracket,parkji30,2025-05-28T15:09:19Z,2025-06-04T18:06:14+00:00,6,170.95
31609,Add a bunch of manually tested prompt changes that make Gemini 2.5 Pro work better for me,nathansobo,2025-05-28T17:06:31Z,2025-07-01T10:03:02+00:00,1,808.94
31620,language_models: Sort Ollama models by name,little-dude,2025-05-28T18:36:45Z,2025-06-03T15:37:08+00:00,1,141.01
31621,editor: Fix horizontal scrollbar alignment if indent guides are disabled,MrSubidubi,2025-05-28T18:53:06Z,2025-05-28T19:59:51+00:00,1,1.11
31657,task: Add ZED_RELATIVE_DIR task variable,d5ng4i,2025-05-29T04:44:57Z,2025-05-29T09:50:37+00:00,2,5.09
31665,language_models: Add thinking support for ollama,imumesh18,2025-05-29T07:10:13Z,2025-06-02T15:12:41+00:00,8,104.04
31668,Rename Max Mode to Burn Mode throughout code and docs,imumesh18,2025-05-29T07:38:20Z,2025-05-29T13:12:42+00:00,1,5.57
31671,editor: Smooth scroll,hocman2,2025-05-29T08:05:07Z,2025-06-03T15:21:48+00:00,2,127.28
31703,markdown_preview: Fix release notes title being overridden,simonpham,2025-05-29T18:09:00Z,2025-05-30T08:29:53+00:00,4,14.35
31704,Add View Release Notes to Help menu,simonpham,2025-05-29T18:12:33Z,2025-05-29T19:39:54+00:00,1,1.46
31708,multi_buffer: Merge adjacent matches into a single excerpt when separated by only one line,Rogue-striker,2025-05-29T18:52:02Z,2025-06-03T10:08:00+00:00,5,111.27
